Título,Enlace,Precio,Dirección,Características,Municipio de Origen
"Hermoso departamento en renta – pueblo quieto. A solo 5 minutos del Estadio Azteca. -110 m² - 3 habitaciones. - 1 baño completo + ½ baño. - 2 lugares de estacionamiento. Precio de renta: $18, 000 mensuales. Requisitos: • 1 mes de renta. • 1 mes de depósito. No pedimos aval ni fiador. Espacios amplios, excelente ubicación y requisitos accesibles.",https://www.inmuebles24.com/propiedades/clasificado/alclapin-amplio-departamento-en-renta-a-5-mins-del-estadio-147618431.html,"MN 18,000","Circuito Estadio Azteca
Tlalpan, Ciudad de México","110 m² lote, 3 rec., 2 baños, 2 estac.",Tlalpan
"Penthouse de lujo en renta. Exclusivo penthouse de dos niveles: Primer nivel. Cocina integral equipada con amplia alacena. Sala / comedor con excelente iluminación. Balcón con vista agradable. Dos habitaciones con clóset, conectadas por baño completo. Dos baños y medio. Segundo nivel. Habitación principal de gran tamaño con clóset. Un baño y medio. Roof garden privado con acceso independiente al departamento: ¡ideal para reuniones y momentos únicos! Características adicionales. Dos cajones de estacionamiento (uno techado) Bodega. Privada con doble seguridad 24/7. Ubicado en segundo nivel. Renta: $32, 000 (mantenimiento incluido) Zona: Calle Celestun 432, colonia Héroes de Padierna, Tlalpan, cp: Ver datos, cdmx.",https://www.inmuebles24.com/propiedades/clasificado/alclapin-departamento-en-renta-en-tlalpan-147531236.html,"MN 32,000","Celestun
Héroes de Padierna, Tlalpan","167 m² lote, 3 rec., 3 baños, 2 estac.",Tlalpan
"Ubicado a 1 minuto de la Carretera Libre a Cuernavaca, a 3 minutos de la Escuela Lancaster, 2 minutos de San Andres Totoltepec y 3 minutos de San Pedro Martircaracterísticas destacadas: Departamento tipo estudio amuebladoEstancia y recámara con ventilación natural y vista exterior1 Recámara abierta con cama y buróCocina con barra desayunador1 Baño con ventilación naturalcaracteristicas generales: 1er pisoEdificio de 2 departamentosLlama para agendar una cita! requisitos: 1 mes de depósito, póliza jurídica, fiador con bien raíz en la cdmx, comprobar ingresos 3 a 1, reporte de Buró de Crédito. El costo de la póliza jurídica, gastos de investigación y mes de depósito no están incluidos en el monto de la renta. Para Aviso de Privacidad, quejas, sugerencias o aclaraciones comunícate a los teléfonos de la inmobiliaria o visítanos en Av. Revolución 1564 colonia San Ángel.",https://www.inmuebles24.com/propiedades/clasificado/alclapin-departamento-tipo-loft-en-renta-en-san-andres-147607261.html,"MN 8,000","Calle 2a Diligencias 8
San Andrés Totoltepec, Tlalpan","1 rec., 1 baño",Tlalpan
"Ubicado en el Tercer Piso, lo cual da total privacidad y cero ruido de vecinos superiores. Cuenta con 2 Recamaras, 2 Baños Completos, 2 Estacionamientos, Amenidades Amplias, sin amueblar y mantenimiento incluido. 2 recámaras. 2 baños completos. 2 estacionamientos. Terraza privada. Último piso. Mantenimiento incluido. No se aceptan mascotas o se acepta con poliza ampliada. Amenidades del conjunto: Alberca (Pueden tomar clases los niños) Gimnasio (Amplio y bien distribuido con equipos Life Fitness) Juegos infantiles (Uno cerrado y 2 Abiertos) Salones de fiestas (3 uno Grande para arriba de 100 personas) Cafetería (1 Llevan la comida al departamento) Paqueteria y Tintorería. Excelente ubicación en zona tranquila y con fácil acceso.",https://www.inmuebles24.com/propiedades/clasificado/alclapin-renta-departamento-be-grand-coapa-2-recamaras-147440485.html,"MN 25,000","Calzada del Hueso , granjas Coapa, be grand
Granjas Coapa, Tlalpan","92 m² lote, 2 rec., 2 baños, 2 estac.",Tlalpan
"Magnífico departamento lleno de luz naturalpermite mascotas93mts2, 2 recámaras cada una con closet, 2 baños completo uno integrado en la principal, sala comedor, cocina con barra desayunador, área de lavado integrada. Cuarto de servicio en la azotea, 2 elevadores, vigilancia de 24 horas, jardín común y 1 cajón de estacionamiento. Y lo mejor, mantenimiento incluido!! ____________________________________________________________________________________________________________________Todas las imágenes mostradas en este anuncio son para fines ilustrativos, el departamento no se renta amueblado. Es importante hacer una visita al inmueble para conocer características y/o acabados. requisitos* 1 Mes de depósito con mascotas 1 mes y medio* 1 Mes de renta* Fiador con bien raíz libre de gravamen en cdmx* Firma de Póliza Jurídica de Arrendamiento e Investigación* (Probables requisitos extras) dependiendo del perfil del cliente, condiciones del propietario, propuesta de renta, tiempo y tipo de arrendamiento con o sin muebles*Rentas inmuebles comerciales precio de renta mas iva* Contrato mínimo por 1 año.",https://www.inmuebles24.com/propiedades/clasificado/alclapin-juntate-con-los-expertos-excelente-departamento-en-147525245.html,"MN 20,900","Fuente DE LA Infancia 47, Fuentes DEL Pedregal, Tlalpan, C.p. 14140
Fuentes del Pedregal, Tlalpan","93 m² lote, 2 rec., 2 baños, 1 estac.",Tlalpan
"Ubicado a 1 minuto de la Carretera Libre a Cuernavaca, a 3 minutos de la Escuela Lancaster, 2 minutos de San Andres Totoltepec y 3 minutos de San Pedro Martircaracterísticas destacadas: Departamento tipo estudio amuebladoEstancia y recámara con ventilación natural y vista exterior1 Recámara abierta con cama y buróCocina con barra desayunador1 Baño con ventilación naturalcaracteristicas generales: 1er pisoEdificio de 2 departamentosLlama para agendar una cita! requisitos: 1 mes de depósito, póliza jurídica, fiador con bien raíz en la cdmx, comprobar ingresos 3 a 1, reporte de Buró de Crédito. El costo de la póliza jurídica, gastos de investigación y mes de depósito no están incluidos en el monto de la renta. Para Aviso de Privacidad, quejas, sugerencias o aclaraciones comunícate a los teléfonos de la inmobiliaria o visítanos en Av. Revolución 1564 colonia San Ángel.",https://www.inmuebles24.com/propiedades/clasificado/alclapin-departamento-tipo-loft-en-renta-en-san-andres-147607264.html,"MN 8,000","Calle 2a Diligencias 8
San Andrés Totoltepec, Tlalpan","1 rec., 1 baño",Tlalpan
"Dos extraordinario departamentos llenos de luz, vista exterior uno con balcón el otro con terraza para disfrutar! contactar por wattsappdepatamento No. 1cobalto No, Ver datosmts2 habitables, 20mts2 de terraza balcón, recámara principal con vestidor Y baño, recamaras secundaria con baño integrado Y vestidor, sala comedor, diseño de bar, cocina abierta con excelente capacidad de almacenaje, medio baño de visitas, área de lavado y cuarto de servicio con baño integrados al departamento, 3 cajones de estacionamiento, bodega, 2 elevadores. renta: $52, 000. 00 mantenimiento incluidobalcón terrazadepatamento No. 2cobalto No. 70190mts2 habitables, 5mts2 de terraza, recámara principal con vestidor Y baño, 2 recamaras secundarias con con closet, baño completo que compaten recámaras secundarias, sala comedor, cocina abierta con excelente capacidad de almacenaje, medio baño de visitas, área de lavado y cuarto de servicio con baño integrados al departamento, 2 cajones de estacionamiento, 2 elevadores. renta: $54, 000. 00 mas mantenimientoterrazaacabados de lujo, pisos madera ingeniería en Tzalam, mármol, techos con 2. 70 de altura, grandes ventanales. El edificio cuenta: Lobby, control de acceso, salón de fiestas, gym, área de asador. Fraccionamiento con extrema vigilancia, calles de concreto, gas natural, cables ocultos, magnífico parque de 6000mts2 aproximados divididos en 3 terrazas, juegos infantiles, espejo de agua con lirios y peces. El departamento se encuentra dentro del mejor fraccionamiento al sur de la ciudad &quot;único en su tipo&quot; A 5 Minutos del hospital Ángeles del Pedregal, 6 minutos del Plaza artz. Rodeado de todos los servicios y los mejores colegios de la zona. &quot;estilo de vida, seguridad, tranquilidad, ubicación&quot;____________________________________________________________________________________________________________________Todas las imágenes mostradas en este anuncio son para fines ilustrativos, el departamento no se renta amueblado. Es importante hacer una visita al inmueble para conocer características y/o acabados. requisitos* 1 Mes de depósito* 1 Mes de renta* Fiador con bien raíz libre de gravamen en cdmx* Firma de Póliza Jurídica de Arrendamiento e Investigación* (Probables requisitos extras) dependiendo del perfil del cliente, condiciones del propietario, propuesta de renta, tiempo y tipo de arrendamiento con o sin muebles*Rentas inmuebles comerciales precio de renta mas iva* Contrato mínimo por 1 año.",https://www.inmuebles24.com/propiedades/clasificado/alclapin-juntate-con-los-expertos-renta-departamento-lomas-del-147155958.html,"MN 52,000","Lomas del Pedregal, Tlalpan, Ciudad de México
Lomas del Pedregal, Tlalpan","175 m² lote, 2 rec., 3 baños, 3 estac.",Tlalpan
"Si lo que buscas en vivir en un lugar privilegiado dentro de la ciudad, rodeado de árboles con seguridad y un ambiente de tranquilidad como si estuvieras en un lugar de descanso, este departamento es tu opción. El departamento cuenta con 179 mt de superficie, consta de 2 amplias recámaras, ambas con closet y baño integrado, sala comedor, cocina integral, desayunador, baño de visitas, espacio para poder realizar home office o lo que tú decidas, área de lavado, 2 lugares de estacionamiento, uno de ellos techado, cuarto de servicio con baño, zotehuela en donde se encuentran los lavaderos y boilers y una preciosa terraza a todo lo largo del departamento con vista al campo de Golf. Tanto la sala comedor como las recámaras tienen salida a la terraza. Dentro de las amenidades cuenta con precioso jardín con asador, amplia terraza común y un salón para reuniones familiares o con los amigos con barra de bar, tarja, una parrilla y baño completo. Sólo 3 departamentos en el inmueble. Este departamento tiene salida directa al jardín. Vigilancia 24/7. Cuota de mantenimiento: $3, 300 (no inlcuída en la renta) No cuenta con elevador",https://www.inmuebles24.com/propiedades/clasificado/alclapin-renta-departamento-club-de-golf-mexico-tlalpan-146384197.html,"MN 27,000","Av. San Buenaventura 616
Club de Golf México, Tlalpan","179 m² lote, 2 rec., 2 baños, 2 estac.",Tlalpan
"Vive en un desarrollo exclusivo al sur de la Ciudad de México. Este departamento en Be Grand Coapa combina confort, seguridad y amenidades de lujo, ideal para quienes buscan un estilo de vida práctico y familiar. Con espacios luminosos y modernos, este hogar te permitirá disfrutar de cada momento sin necesidad de salir de casa. Además, su ubicación estratégica lo coloca cerca de Pabellón Polanco, escuelas, hospitales y vías principales. * Se desocupa el 14 de Octubre. *Amenidades premium: Alberca. Gimnasio equipado. Cafetería. Juegos infantiles. Salón de eventos. Extensas áreas verdes. Seguridad 24/7. Balcón privado. Distribución funcional y moderna. * La renta ya incluye mantenimiento. No pierdas la oportunidad de estrenar y darle a tu familia el hogar que merece.",https://www.inmuebles24.com/propiedades/clasificado/alclapin-departamento-en-renta-be-grand-coapa-59694941.html,"MN 25,000","Calz. del Hueso 859
Granjas Coapa, Tlalpan","92 m² lote, 3 rec., 2 baños, 2 estac.",Tlalpan
"Se renta departamento de 40 m2. 1 Recamaras. 1 Baño completo. 1 estacionamiento. Seguridad. Buena ubicación. Precio $ 7, 800, 00 mensual. Entrega inmediata. Información. Al Ver datosVer datosVer datos.",https://www.inmuebles24.com/propiedades/clasificado/alclapin-departamento-en-renta-147637827.html,"MN 7,800","Sudzal 8
Pedregal de San Nicolás, Tlalpan","45 m² lote, 1 rec., 1 baño, 1 estac.",Tlalpan
"Se rentan lindas y funcionales oficinas dentro de Plaza Imágen, en Jardines en la Montaña. Son 150mt2 y cuenta con 7 privados, sala de juntas, cocineta, 2 baños, 3 lugares de estacionamiento. Por encontrarse dentro de la plaza comercial, tienes lugares de estacionamiento para visitas, cafeterías y diversos comercios. Vigilancia y cctv. Cerca de bancos, Hotel Royal del Pedregal, vías de acceso como Periférico Sur, Insurgentes Sur. Renta: 41, 500 m. n. Mas iva (factura) mantenimiento: 4, 000 m. n. Mas iva. Gracias a nuestra experiencia y nuestro servicio personalizado te garantizamos: - Nos ocupamos de todo el proceso de principio a fin, desde la negociación hasta la entrega de la propiedad. Al ""Contactar"" para consultar esta propiedad, estás aceptando los ""Términos y Condiciones"" y ""Aviso de privacidad"". Los precios publicados y la disponibilidad pueden cambiar sin previo aviso por lo que se debe de verificar con la inmobiliaria y los propietarios de los inmuebles. Todas las medidas enunciadas son meramente orientativas, las medidas exactas serán las que se expresen en el respectivo título de propiedad de cada inmueble. La publicación de la presente información no representa una oferta pública por lo que toda transacción debe hacerse de forma personal de acuerdo con las prácticas comerciales de la inmobiliaria y para poder ser valida requiere de la autorización expresa de los propietarios de los inmuebles. No esperes más y déjanos ayudarte. ¡contáctanos!",https://www.inmuebles24.com/propiedades/clasificado/alclapin-renta-oficina-en-jardines-en-la-montana-tlalpan-147205833.html,"MN 41,500","Jardines en la Montaña
Tlalpan, Ciudad de México","150 m² lote, 1 rec., 2 baños, 3 estac.",Tlalpan
"Amplio departamento recién remodelado, mto incluido con acabados de lujo y 3 estacionamientos, alberca techada, salón de eventos y seguridad 24/7 horas.",https://www.inmuebles24.com/propiedades/clasificado/alclappa-amplio-deprtamento-en-fuentes-del-pedregal.-147415086.html,"MN 39,500","Circuito Fuentes del Pedregal 478
Fuentes del Pedregal, Tlalpan","222 m² lote, 3 rec., 3 baños, 3 estac.",Tlalpan
"Se renta ph en conjunto sta teresa #890 col sta teresa. (A unos metros del Hospital Ángeles del Pedregal). $21, 800. 00 ya con mantenimiento incluido de $1, 400. 00. 120 m2. primer nivel. -Sala. -Comedor. -Cocina integral. -3 habitaciones. -2 baños completos. -Área de lavado. segundo piso. -1 habitación multiusos. -Terraza amplia con vista panorámica. -1 lugar de estacionamiento techado y no estorba. -Área de juegos infantiles. -Fuente. Vigilancia 24x7. -Áreas verdes",https://www.inmuebles24.com/propiedades/clasificado/alclapin-se-renta-ph-en-conjunto-sta-teresa-colonia-santa-147551477.html,"MN 21,800","Camino Santa Teresa 890
Condominios del Bosque, Tlalpan","120 m² lote, 4 rec., 2 baños, 1 estac.",Tlalpan
"Para estrenar, listo para habitarse90 m²Estancia, comedor, cocina totalmente equipada, área de lavado, ½ baño de visitas, 1 recámara amplia con walking closet, baño completo con cancel de vidrio templado, terraza de 15 m² a lo largo de la estancia y recámara, 2 lugares de estacionamiento fijos, techados, ubicados en Sótano 4. Cuenta con bodega, elevadorEn Origina vivirá experiencias extraordinarias diseñadas principalmente para complacer su estilo de vida con más de 30 zonas de experiencias, servicios y más 13, 000 m²de áreas verdesExperiencias: Market Place, Huerto, Spa, Nido Espejo de Agua, Pet Resort, Padel, Gimnasio, Yoga Deck, Carril de Nado, Pickleball, Teens Place, Gamer’s´Zone, Kid’s Club, Golf Practice, Asadores, Fire Pit, Pet Zone, Sky Garden, Salones privados para eventos, Co-working, Concierge, etc. Acceso controlado con biométricos, seguridad 24 hrs. Valet parkingUbicación estratégica con acceso inmediato a Periférico e Insurgentes, 2 de las principales arterias viales de la cdmx. A unos minutos de centros comerciales de primer nivel como Artz, Perisur, colegios, hospitales, etc. Renta $ 35, 000 ( mantenimiento incluido) Requisitos: -Depósito, Renta y Póliza de arrendamiento con costo aprox. De $ 7, 800. 00",https://www.inmuebles24.com/propiedades/clasificado/alclapin-departamento-en-ampliacion-fuentes-del-pedregal-147647044.html,"MN 35,000","Blvd. Adolfo Ruiz Cortines al 4270
Ampliación Fuentes del Pedregal, Tlalpan","90 m² lote, 1 rec., 1 baño, 2 estac.",Tlalpan
"Ubicado en planta baja dentro de un edificio tranquilo, este departamento de 80 m² se encuentra en una zona estratégica al sur de la ciudad, a minutos de Plaza Cuicuilco Inbursa, Periférico e Insurgentes Sur, con excelente conectividad y todos los servicios a la mano. Características: -2 recámaras con clóset. -2 baños completos. -Estancia comedor iluminada. -Cocina equipada. -Área de servicio. -Opción de rentar con o sin muebles. -80 m² de superficie. -Ubicación: Priv. Zaragoza, Col. La Lonja, Tlalpan. -Renta: $13, 500 mensuales (incluye mantenimiento) La zona ofrece un entorno ideal para familias, profesionistas o estudiantes, con cercanía a universidades (unam, uvm, La Salle), colegios, comercios, restaurantes y centros comerciales como Plaza Cuicuilco y Gran Sur. Además, cuenta con transporte público accesible gracias a las estaciones de Metrobús Corregidora y Ayuntamiento a solo unos pasos.",https://www.inmuebles24.com/propiedades/clasificado/alclapin-departamento-en-renta-plaza-cuicuilco-inbursa-147470694.html,"MN 12,500","La Lonja
Tlalpan, Ciudad de México","80 m² lote, 2 rec., 2 baños, 1 estac.",Tlalpan
"Vivienda en Col. Popular Santa Teresa. Ideal para 1-2 personas. 2 cuartos con buena iluminación, zotehuela y baño independientes. Zona tranquila y segura ubicada a 10 minutos del Periférico Sur. Cercano: transporte público, mercado, escuelas y Walmart. Restricciones: no niños, no mascotas. Renta de 4, 500. 00 mensuales mas 400 de agua y luz. Agenda tu cita para visita por WhatsApp al 55 Ver datos con Mayra.",https://www.inmuebles24.com/propiedades/clasificado/alclapin-solo-mujeres-vivienda-en-renta-de-2-cuartos-en-col.-144843340.html,"MN 4,500","Becal, Col. Popular Santa Teresa, C.P. 14160, cdmx
Popular Santa Teresa, Tlalpan","30 m² lote, 2 rec., 1 baño",Tlalpan
"- Departamento en venta o renta en Bosques de Tepepan, Tlalpan. - 195 m2. - 3 habitaciones. - 2. 5 baños. - 2 estacionamientos. - Roof Garden privado. - Piso 7. - Elevador. - Mantenimiento incluido. - Se aceptan mascotas. amenidades: - 2 hectáreas de áreas verdes y deportivas. - Pista de tartán. - Canchas de fút y de front tennis. - Alberca techada y climatizada de dos carriles. - Alberca exterior con terraza común. - Gimnasio súper equipado. - Seguridad 24/7. - Juegos infantiles. - Área para perritos. - Ludoteca. - Salón de eventos con terraza para 250 personas. requisitos para renta: - Póliza de arrendamiento a cargo del inquilino. - Investigación de solvencia económica del inquilino y el obligado solidario con costo de 1, 199 ya incluido en el costo de la póliza. - Un mes de depósito en garantía a la firma del contrato. - Un mes de renta a la firma del contrato",https://www.inmuebles24.com/propiedades/clasificado/veclapin-departamento-en-venta-o-renta-195-m-sup2--3-147351833.html,"MN 28,500","Mirador 18
Fuentes de Tepepan, Tlalpan","195 m² lote, 3 rec., 2 baños, 2 estac.",Tlalpan
"Departamento en renta ubicado en Villa Olímpica. Cuenta con 3 recámaras, estudio y 3 baños, ideal para familias o personas que buscan espacio adicional. Este departamento de 110 m2 ofrece una distribución funcional con sala, comedor y cocina integral. Disfruta de la comodidad de tener clósets y un estudio para trabajar o estudiar desde casa. Cuenta con 1 lugar de estacionamiento. El edificio ofrece amenidades como caseta de guardia, seguridad privada y un salón de juegos infantiles para los más pequeños, capilla y otras amenidades. Villa Olímpica es una zona predominantemente residencial, con un ambiente tranquilo y familiar. Encontrarás opciones de transporte público cercanas, como paradas de autobús urbano. Hay escuelas de diversos niveles en los alrededores. Para tus compras, hay supermercados y tiendas de conveniencia a poca distancia. La zona también cuenta con parques y áreas verdes para actividades recreativas. La seguridad es un aspecto valorado en este barrio, con vigilancia y un ambiente generalmente seguro. Es una zona ideal para familias y personas que buscan un lugar tranquilo para vivir. No mascotas.",https://www.inmuebles24.com/propiedades/clasificado/alclapin-departamento-remodelado-de-3-recamaras-con-estudio-en-147320822.html,"MN 19,000","Villa Olímpica
Villa Olímpica, Tlalpan","110 m² lote, 3 rec., 3 baños, 1 estac.",Tlalpan
"¡Renta Departamento Exclusivo en Bosques de Tepepan, cdmx Sur! Ubicado en una zona tranquila y rodeada de naturaleza, este exclusivo departamento de 108 m² te ofrece comodidad, seguridad y una excelente calidad de vida. El departamento se encuentra en una de las zonas más buscadas del sur de la Ciudad de México, en Bosques de Tepepan, una área tranquila y arbolada que te garantiza un entorno relajante y de fácil acceso a principales avenidas. **Características del Departamento: ** * Superficie: 108 m² * 3 habitaciones amplias y luminosas. * 2. 5 baños con acabados modernos. * 2 lugares de estacionamiento. * Piso: 6º piso. **Amenidades del Conjunto Habitacional: ** * Alberca climatizada. * Gimnasio totalmente equipado. * Canchas deportivas. * Juegos infantiles. *Ludoteca. ¡No dejes pasar esta oportunidad de vivir en una de las zonas más exclusivas y tranquilas del sur de la Ciudad de México! Para más información o agendar una cita, contáctanos. **no se comparte comisión** **se renta sin muebles**",https://www.inmuebles24.com/propiedades/clasificado/alclapin-renta-departamento-exclusivo-bosques-de-tepepan-147595063.html,"MN 24,000","Mirador
Fuentes de Tepepan, Tlalpan","108 m² lote, 3 rec., 2 baños, 2 estac.",Tlalpan
"Departamento en Renta en Residencial Parque Sur – Coapa Guadalupe. Renta mensual: $21, 000. Mantenimiento: $3, 500. ¡Vive con comodidad, estilo y seguridad en una de las zonas más exclusivas del sur de la ciudad! Características del departamento (100 m²): • 3 recámaras con excelente iluminación natural. • 2 baños completos. • Sala y comedor amplios. • Cocina integral equipada. • Área de lavado. • Baño de servicio. • 2 lugares de estacionamiento. • 1 bodegas. • Elevador. Amenidades del conjunto: • Alberca. • Gimnasio. • Ludoteca. • Área para mascotas. • Extensas áreas verdes. • Sala de negocios. • Seguridad y vigilancia 24 horas. Este departamento combina confort, modernidad y una ubicación privilegiada, ideal para familias o profesionistas que buscan calidad de vida. Contáctanos para agendar tu cita y conocer tu próximo hogar.",https://www.inmuebles24.com/propiedades/clasificado/alclapin-departamento-en-renta-en-residencial-parque-sur-coapa-147635325.html,"MN 21,000","Anillo Periférico 4860
Coapa, Tlalpan","100 m² lote, 3 rec., 2 baños, 2 estac.",Tlalpan
"Bonito departamento ubicado A una calle del tec, de monterrey, en la calle de 5 de mayo # 14 entre prolongación de canal de miramontes Y periferico sur A 2 calles del costco coapa Y soriana, cerca de centros comerciales, universidades, bancos, Y en la zona de las mejores escuelas. El departamento cuenta con 2 recamaras un baño amplia sala Y comedor. la cocina esta equipada, Y la zotehuela es amplia- tiene un lugar fijo de estacionamiento, el edificio sólo tiene 3 departamentos Y que se renta está en primer piso. Requisitos de renta ; poliza jurídica Y obligado solidario. citas sólo por whatapp. Ver datos. 69",https://www.inmuebles24.com/propiedades/clasificado/alclapin-junto-a-el-tec.-de-monterrey-campus-coapa-departamento-147473822.html,"MN 11,500","5 de Mayo 14
A.M.S.A, Tlalpan","70 m² lote, 2 rec., 1 baño, 1 estac.",Tlalpan
"Lujoso departamento en Origina Pedregal. Departamento inteligente con automatización de voz. Vive la experiencia de un hogar moderno y conectado. El departamento cuenta con sistema inteligente integrado a Alexa lo que te permite: Encender y apagar las luces de distintos cuartos con solo usar la voz. Abrir y cerrar persianas automáticamente. Crear ambientes personalizados sin necesidad de controles manuales. Todo se puede controlar desde celular y ipad. Son 177m2. Cuenta con sala-comedor, amplia cocina con refrigerador y lavavajillas. Microondas, con barra de granito, y generosos espacios para guardar. Terraza y balcón a lo largo del departamento. Área de bar. Recamara principal con amplio vestidor y baño completo cuenta con aire acondicionado y calefacción. 2 recamaras mas, con 1 baño completo afuera. (Una de las recamaras también cuenta con aire acondicionado y calefacción) Medio baño de visitas. Área de lavado con centro de lavado. 3 lugares de estacionamiento y bodega. Se renta totalmente amueblado! El desarrollo cuenta con un gimnasio muy completo con barra fit con productos para los residentes. Espectacular sapa. Alberca, área de clases, yoga. Business center con barra de café, te, galletas, agua. Área de juegos para niños, huerto, área de mascotas. Amplios jardines. Zona de asadores con sala y mesa y un carrito de aditamentos para tu carne asada. Salas launge. Gran Salón de eventos. Servicio de valet parking para tus visitas. Vigilancia 24/7. Atendemos 24 hrs",https://www.inmuebles24.com/propiedades/clasificado/alclapin-lujoso-deparatamento-en-origina-pedregal-147646015.html,"MN 95,000","Blvd. Adolfo Ruiz Cortines 4271
Fuentes del Pedregal, Tlalpan","177 m² lote, 3 rec., 2 baños, 3 estac.",Tlalpan
