Título,Enlace,Precio,Dirección,Características,Municipio de Origen
"Excelente departamento en 1er. Piso, sin elevador, con buena iluminación cuenta con cocina integral con área de lavado anexa, dos recámaras la principal con baño completo y área de clóset abierta, la segunda recámara con área de clóset abierta. Aparte otro baño completo en área social. 1 estacionamiento en batería (hay que ponerse de acuerdo con otro vecino) Cuota de mantenimiento de 1, 200 (incluida en la renta) Se entrega sin persianas. No se aceptan mascotas. Características generales. Pisos de loseta cerámica, ventanas con marco de aluminio, muros y techos terminados en aplanado. Cisterna. Gas Natural. Cuenta con vigilancia y cctv. Estacionamiento para visitas. Amenidades. Salón de usos múltiples. Entorno urbano. Escuelas cercanas, Tec de Monterrey y plazas comerciales. Transporte público accesible",https://www.inmuebles24.com/propiedades/clasificado/alclapin-departamento-en-renta-en-primer-piso-col.-valle-147206912.html,"MN 16,000","Arenal 581
Valle Escondido, Tlalpan","70 m² lote, 2 rec., 2 baños, 1 estac.",Tlalpan
"¡Aprovecha oportunidad! Departamento ubicado cerca del Club Alemán y Tecnológico de Monterrey, con excelentes vías de comunicación, a unos pasos de Avenida Periférico. Cuenta con sala, comedor, cocina abierta, área de servicio, dos recámaras, la principal con baño integrado, segundo baño completo. Totalmente amueblado. En excelente estado de conservación, con gran iluminación y ventilación natural. Un lugar de estacionamiento techado. El residencial cuenta con vigilancia las 24 horas con cctv. Atención inmediata al 55 Ver datos.",https://www.inmuebles24.com/propiedades/clasificado/alclapin-departamento-en-renta-totalmente-amueblado-colonia-147570496.html,"MN 15,000","Arenal 581
Arenal Tepepan, Tlalpan","70 m² lote, 2 rec., 2 baños, 1 estac.",Tlalpan
"Disfruta de un hogar lleno de luz y comodidad en este departamento recién remodelado, ubicado en el segundo piso de la colonia Movimiento Organizado, Tlalpan. Consta de 2 habitaciones con clósets, un baño completo + ½ baño en la estancia sala- comedor muy iluminada, tiene cocina integral, cuarto de lavado con área de tendido, un lugar de estacionamiento. La excelente distribución y sus espacios renovados lo convierten en un lugar ideal para tu día a día. Conócelo! Las fotografías de los inmuebles son meramente ilustrativas. En el precio de venta y/o renta de los inmuebles anunciados no se incluyen, de manera enunciativa más no limitativa: El mobiliario, decoración, cuadros, accesorios, cortinas, artículos personales, etc. Por favor consultar sus dudas con uno de nuestros asesores. Agenda tu cita al Ver datos o al Ver datos",https://www.inmuebles24.com/propiedades/clasificado/alclapin-se-renta-departamento-en-la-col.-movimiento-organizado-63124756.html,"MN 14,000","Jacarandas numero
Movimiento Organizado de Tlalpan, Tlalpan","85 m² lote, 2 rec., 1 baño, 1 estac.",Tlalpan
"Cómodo departamento de 3 habitaciones, todas con closets, cocineta integral, área de lavado con buena iluminación, un baño completo, amplia estancia comedor, pisos laminados y mármol, en 2° piso, un lugar de estacionamiento compartido, vigilancia 24 horas, servicio de recolección de basura, buen ambiente, muy cerca de Miramontes, Calzada de las brujas, y División del Norte. Centros comerciales cercanos y escuelas. Mantenimiento incluido en el precio",https://www.inmuebles24.com/propiedades/clasificado/alclapin-departamento-en-renta-en-coapa-147605007.html,"MN 14,500","Liorna 66
Nueva Oriental Coapa, Tlalpan","80 m² lote, 3 rec., 1 baño, 1 estac.",Tlalpan
"Vive en un penthouse que combina amplitud, lujo clásico y panorámicas espectaculares. Este ph de 500 m² ofrece sala y comedor, bar con medio baño, terraza con vistas hacia Reforma y volcanes, cocina con antecomedor y múltiples espacios para convivir. En el nivel inferior, cuatro recámaras exquisitamente diseñadas: dos comparten baño, una con baño propio y la principal con sala privada, walk-in clóset y baño completo. Con acabados de madera y cristal finos, pisos de parquet y baños elegantes, cada rincón refleja calidad y sofisticación. Disfruta de cuatro estacionamientos y amenidades exclusivas: alberca, gimnasio, salón de usos múltiples, asador y jardín.",https://www.inmuebles24.com/propiedades/clasificado/alclapin-elegancia-y-vistas-de-ensueno-en-jardines-en-la-147282001.html,"MN 130,000","Pico de Peñalara
Jardines en la Montaña, Tlalpan","500 m² lote, 4 rec., 3 baños, 4 estac.",Tlalpan
"Departamento en renta de 64 m2 aprox, ubicado en un conjunto habitacional en 4to piso, cuenta con 2 recamaras con closet, una área de estancia, 1 baño completo, sala comedor, cocina integral, área de lavado, 1 cajón de estacionamiento fijo e independiente, seguridad 24hrs y áreas verdes comunes.",https://www.inmuebles24.com/propiedades/clasificado/alclapin-departamento-renta-147636845.html,"MN 11,500","CERRADA TECHICHICASTITLA
Santa Úrsula Xitla, Tlalpan","64 m² lote, 2 rec., 1 baño, 1 estac.",Tlalpan
"Este funcional apartamento ofrece un espacio bien distribuido, ideal para una vida cómoda. Con una antigüedad de 5 años, presenta un diseño práctico y acogedor. La propiedad cuenta con área de lavado y cocina integral, facilitando las tareas diarias. El interior se compone de una acogedora estancia; la cocina está equipada con todo lo necesario, permite preparar alimentos de manera eficiente. Las 2 recámaras están equipadas con prácticos clósets. Cuenta con 1 baño completo equipado. Además, el conjunto ofrece un roof garden para eventos y reuniones. Los servicios básicos como agua y luz están garantizados. La ubicación es inmejorable, con escuelas cercanas que facilitan el acceso a la educación. Ubicado en Ejidos de San Pedro Mártir, este apartamento se encuentra en una zona residencial tranquila y bien comunicada. El área ofrece fácil acceso a transporte público y vialidades principales a 5 minutos del periférico y la caseta a la salida para Cuernavaca, conectando con el resto de la ciudad. Encontrarás comercios locales, supermercados y servicios a pocos minutos, haciendo tu día a día más práctico.",https://www.inmuebles24.com/propiedades/clasificado/alclapin-hermoso-y-acogedor-departamento-al-sur-de-la-ciudad-de-147630598.html,"MN 9,000","2a Cerrada de Magnolia N° 54 Alcaldía Tlalpan Ejidos de San Pedro Mártir CDMX
Ejidos de San Pedro Mártir, Tlalpan","58 m² lote, 2 rec., 1 baño, 1 estac.",Tlalpan
"En renta departamento remodelado zona de hospitales. $22, 000. Vive con comodidad, estilo y la mejor ubicación. A tan solo 5 minutos de Médica Sur y de la zona de hospitales, se encuentra este departamento totalmente nuevo, diseñado para ofrecerte el equilibrio perfecto entre funcionalidad, modernidad y confort. Características: • Planta baja. • 3 amplias recámaras con excelente iluminación natural. • 2 baños completos con acabados modernos. • Sala, estancia y comedor con espacios abiertos para convivir y disfrutar. • Cocina integral totalmente equipada, lista para estrenar. Su cercanía con importantes hospitales, centros comerciales, parques y vías principales lo convierten en una opción ideal tanto para profesionales de la salud como para familias que buscan practicidad y calidad de vida. Ubicación privilegiada – a minutos de Médica Sur y la zona de hospitales. Osk09-DrCarDu100% Calle Cuitláhuac 177 56, Ampliación Isidro Fabela, Tlalpan, Distrito Federal. Superficie total. 120 m² Recámaras. 3. Baños. 2. Estacionamientos. 1",https://www.inmuebles24.com/propiedades/clasificado/alclapin-departamento-en-renta-tlalpan-zona-hospitales-147622439.html,"MN 22,000","Cuitláhuac 177
Ampliación Isidro Fabela, Tlalpan","120 m² lote, 3 rec., 2 baños, 1 estac.",Tlalpan
"Si lo que buscas en vivir en un lugar privilegiado dentro de la ciudad, rodeado de árboles con seguridad y un ambiente de tranquilidad como si estuvieras en un lugar de descanso, este departamento es tu opción. El departamento cuenta con 230 mt de superficie, consta de 3 amplias recámaras con closet y baño integrado, sala de tv o estudio o cuarta recámara, sala comedor, cocina integral, desayunador, baño de visitas, closet de blancos, área de lavado, 2 lugares de estacionamiento, uno de ellos techado, cuarto de servicio con baño, zotehuela en donde se encuentran los lavaderos y boilers y una preciosa terraza a todo lo largo del departamento con vista al campo de Golf. Tanto la sala comedor como las recámaras tienen salida a la terraza. Dentro de las amenidades cuenta con precioso jardín con asador, amplia terraza común y un salón para reuniones familiares o con los amigos con barra de bar, tarja, una parrilla y baño completo. Sólo 3 departamentos en el inmueble. Vigilancia 24/7. Cuota de mantenimiento: $3, 300 (no incluida en la renta) No cuenta con elevador",https://www.inmuebles24.com/propiedades/clasificado/alclapin-renta-departamento-club-de-golf-mexico-tlalpan-147631496.html,"MN 35,500","Av. San Buenaventura 616-2
Club de Golf México, Tlalpan","720 m² lote, 4 rec., 4 baños, 2 estac.",Tlalpan
"Excelente departamento en condominio amplio Y con mucha iluminación, cuenta con estancia-comedor con pisos de porcelanato, espacio para estudio O area de tv con balcón, moderna cocina integral con barra Y cubierta de granito, 2 recámaras con closets la principal con baño completo Y cancel, otro baño completo con cancel en pasillo, area de lavado integrado al departamento, con bodega, se entrega con persianas, 2 estacionamientos con autoelevador, portero eléctrico para acceso al estacionamiento, salón de usos multiples con cocineta Y baños, estricta vigilancia en caseta de ingreso. Magnifica ubicación principales vialidades A 2 minutos de carretera picacho-ajusco, periferico sur, boulevard de la luz, muy cerca de san jerónimo, luis cabrera, six flags, hospital angeles del pedregal, centros comerciales artz, perisur Y plaza san jerónimo, gasolineria, bancos, iglesia, supermercados, perfecto estado de conservación Y de funcionalidad. Se requiere el pago de 1 mes de renta de depósito, 1 mes de ocupación Y mantenimiento, contrato anual, aval, pago de 4, 400 póliza jurídica E investigación, renta $17, 200. 00 mas $1, 300. 00 de mantenimiento, interesados concertar citas",https://www.inmuebles24.com/propiedades/clasificado/alclapin-excelente-departamento-en-lomas-de-padierna-62195977.html,"MN 17,200","Akil 218
Lomas de Padierna, Tlalpan","2000 m² lote, 2 rec., 2 baños, 2 estac.",Tlalpan
"286 m2 en 2 niveles, 3 recámaras cada una con baño, vestidor en la principal, 2 terrazas, sala y comedor, sala de tv, desayunador con espacio para family room, cocina, cuarto de servicio y cuarto de lavandería, 4 autos, closets de guardado en garage, Edificio de 5 niveles, 20 departamentos, doble seguridad, fraccionamiento con parques privados, renta más mantenimiento Gentry Real Estate es una Agencia Inmobiliaria conformada por Personal altamente profesional; quienes se capacitan constantemente con el objetivo de estar dispuestos a enfrentar los cambios que el sector inmobiliario lanza día con día, con ello, procuran y salvaguardan que los clientes tomen la mejor decisión en todas sus operaciones.",https://www.inmuebles24.com/propiedades/clasificado/alclapin-departamento-en-renta-jardines-en-la-montana-ph-147649049.html,"MN 75,000","Jardines en la Montaña, PH en Renta o Venta
Jardines en la Montaña, Tlalpan","286 m² lote, 3 rec., 3 baños, 4 estac.",Tlalpan
"286 m2 en 2 niveles, 3 recámaras cada una con baño, vestidor en la principal, 2 terrazas, sala y comedor, sala de tv, desayunador con espacio para family room, cocina, cuarto de servicio y cuarto de lavandería, 4 autos, closets de guardado en garage, Edificio de 5 niveles, 20 departamentos, doble seguridad, fraccionamiento con parques privados, renta más mantenimiento Gentry Real Estate es una Agencia Inmobiliaria conformada por Personal altamente profesional; quienes se capacitan constantemente con el objetivo de estar dispuestos a enfrentar los cambios que el sector inmobiliario lanza día con día, con ello, procuran y salvaguardan que los clientes tomen la mejor decisión en todas sus operaciones.",https://www.inmuebles24.com/propiedades/clasificado/alclapin-departamento-en-renta-jardines-en-la-montana-ph-143822739.html,"MN 75,000","Jardines en la Montaña, PH en Renta o Venta
Jardines en la Montaña, Tlalpan","286 m² lote, 3 rec., 3 baños, 4 estac.",Tlalpan
"Fraccionamiento cerrado Jardines en la Montaña – Estricta Seguridad 24 hrs. – Impecable - Acabados de Lujo - Renta $50, 000. Más $6, 500. De Cuota de Mantenimiento - Departamento Moderno Semi-amueblado de 300 m² - no mascotas - Hermosa vista al Bosque de Tlalpan – 2 niveles - doble altura - 3 recámaras cada una con baño-vestidor (la principal con enorme vestidor y jacuzzi), sala comedor, cocina integral equipada con espacio para antecomedor, alacena, sala de T. V. , área de lavado, cuarto de servicio, estacionamiento para 3 automóviles fijos, bodega, Jardín de área común. Amplios espacios, iluminación natural, grandes ventanales, Interfón. Extraordinaria ubicación, cerca de Centros Comerciales, Servicios (tiendas Departamentales, Farmacias, Bancos, Restaurantes, etc. ), fácil acceso a principales vías de comunicación. Citas Ver datos",https://www.inmuebles24.com/propiedades/clasificado/alclapin-jardines-montana-moderno-300-m-sup2--$50-000.-mas-147200854.html,"MN 50,000","CAMINO SANTA TERESA
Jardines en la Montaña, Tlalpan","300 m² lote, 3 rec., 4 baños, 3 estac.",Tlalpan
"Buscas una ubicación privilegiada en colonia tranquila?. Cerca de zona de Hospitales a unos minutos de perisur, vive la experiencia de vivir en casa sola con dos departamentos. El departamento recién remodelado con pisos de cerámica en colores neutros que hacen un acogedor hogar, techos altos, excelente iluminación y ventilación! Con 81 metros dividido en dos plantas, en planta baja encontrarás cocina integral con barra de preparación de alimentos y amplia alacena en madera, medio baño para visitas y área de sala comedor, en segunda planta goza de grandes espacios. Recámara con clóset en madera y baño completo, salón de tv que bien puede ser tu estudio o porque no?. Una segunda recámara. La casa cuenta con 1 lugar de estacionamiento independiente para cada departamento y cisterna. Ideal para solteros que trabajen home office, pareja o familia pequeña que busquen espacios amplios y tranquilidad. Que esperas para conocerlo?. Visítanos! Requisitos. Depósito de renta. Renta corriente. Póliza jurídica. Info Wats app",https://www.inmuebles24.com/propiedades/clasificado/alclapin-departamento-remodelado-a-5-minutos-de-perisur!-146764060.html,"MN 14,400","saturno esq neptuno
Comuneros de Santa Úrsula, Tlalpan","80 m² lote, 1 rec., 1 baño, 1 estac.",Tlalpan
"Vive en un ambiente seguro y bien ubicado en Santa Úrsula Coapa, dentro de una privada con acceso controlado, rodeado de parques, plazas comerciales y escuelas. Características del departamento: 2 recámaras – La principal con su propio baño. Cuarto de televisión – Espacio ideal para entretenimiento o estudio. 2 baños completos – Funcionalidad y comodidad para la familia. nsala y comedor amplios – Perfectos para disfrutar y recibir visitas. Cocina cómoda – Diseño práctico para facilitar tu día a día. Área de lavado – Espacio independiente para mayor comodidad. 1 cajón de estacionamiento independiente – Seguridad y acceso exclusivo. Amenidades en la privada: Juegos infantiles para los más pequeños, Cancha de fútbol para ejercitarse y divertirse. Vigilancia 24/7 – Seguridad y tranquilidad garantizadas. Este departamento es ideal para quienes buscan confort, seguridad y una excelente ubicación",https://www.inmuebles24.com/propiedades/clasificado/alclapin-como-departamento-en-santa-ursula-coapa-146126145.html,"MN 18,000","LAS FLORES
Santa Úrsula Xitla, Tlalpan","90 m² lote, 2 rec., 2 baños, 1 estac.",Tlalpan
"Descripción. Centro de Tlalpan – exclusivo, céntrico, lleno de vida. El departamento donde la luz, el espacio y la privacidad se encuentran. Hay lugares que simplemente se sienten como el hogar soñado. Este departamento no sólo está en el corazón del Centro de Tlalpan —uno de los barrios con más historia y encanto de la ciudad—, sino que también está diseñado para quienes buscan vivir con elegancia, amplitud y total privacidad. Desde que cruzas la puerta, la luz natural te da la bienvenida en cada rincón. Los ventanales amplios, los acabados de lujo, y la distribución inteligente te invitan a imaginar cenas largas, tardes tranquilas y momentos compartidos que se vuelven recuerdos. ¿Lo mejor? Un enorme roof garden privado que se convierte en tu refugio urbano: ideal para ejercitarte al aire libre, hacer reuniones bajo las estrellas o simplemente desconectarte del ruido del mundo. Características que te enamoran: • 3 recámaras (la principal con vestidor y baño privado) • 2. 5 baños + baño adicional en el roof garden. • Estancia amplia + espacio para family room o sala de T. V. • Cocina moderna con barra de granito. • Área de lavado independiente y cuarto de servicio con baño. • 3 estacionamientos techados. • Bodega + salón de usos múltiples. • Vigilancia 24/7. • Solo 3 niveles en el conjunto: tu privacidad está garantizada. Un departamento como pocos. Un estilo de vida como ninguno. Agenda tu cita y descubre por qué este espacio podría ser tu próxima historia de hogar. Citas:: 55 Ver datos y 55 Ver datos. requisitos: Un depósito, una renta, fiador con inmueble libre de gravamen y póliza jurídica que paga 50% propietario y 50% inquilino. . . Al ""Contactar"" para consultar esta propiedad, estás aceptando los ""Términos y Condiciones"" y ""Aviso de privacidad"". Aviso de Privacidad, Quejas, Sugerencias y más en nuestro sitio oficial. * El costo del mantenimiento, póliza jurídica, gastos de investigación, mobiliario, electrodomésticos y arte que se muestran en las fotografías no está incluido en el precio de renta. Todas las medidas enunciadas son meramente orientativas, las medidas exactas serán las que se expresen en el respectivo título de propiedad de cada inmueble.",https://www.inmuebles24.com/propiedades/clasificado/alclapin-departamento-en-renta-en-el-centro-de-tlalpan-146705581.html,"MN 34,500","Tlalpan Centro
Tlalpan Centro, Tlalpan","180 m² lote, 3 rec., 2 baños, 3 estac.",Tlalpan
"Departamento en Renta en Ex Hacienda SanJuan. Departamento en Renta en Rayo Vende Inmobiliaria. A dos cuadras del Periférico, Hospital de Rehabilitación, tec de Monterrey, Paseo Acoxpa, se encuentra este departamento muy iluminado. Consta de: • Sala. • Comedor. • 2 recámaras, la principal con baño, la otra lo tiene afuera. • Closet de blancos. • Área de lavado. • Estacionamiento fijo para 1 auto sin estorbar. • Áreas verdes. • Seguridad. ¡Listo para disfrutar departamento con Rayo Vende Inmobiliaria! ¡Hazlo tuyo, invierte y disfruta! , tenemos más de 40 años de experiencia, te asesoramos en todo el proceso de compra con Seguridad, Honestidad y Transparencia. ¡Contáctanos hoy mismo!",https://www.inmuebles24.com/propiedades/clasificado/alclapin-departamento-en-renta-en-ex-hacienda-san-juan-146648318.html,"MN 17,200","Calzada Mexico Xochimilco
Ex Hacienda San Juan de Dios, Tlalpan","87 m² lote, 2 rec., 2 baños, 1 estac.",Tlalpan
"Dmz. Vive dentro de unos de los conjuntos más cómodos y con amplias áreas verdes. Departamento de 80m2 recién remodelado, ubicado en segundo piso, Cuenta con tres recámaras con clóset, un baño completo, área de sala comedor, cocina integral y amplia área de lavado. Un cajón de estacionamiento. **La renta es más mantenimiento de $750** Conjunto con amplias áreas verdes, áreas de asadores, vigilancia 24 horas, cámaras de seguridad, cancha de basquetbol y salón de usos múltiples. Se permite una mascota chica. Excelente ubicación a cinco minutos del Periférico, Calzada Acoxpa, a espaldas de la Plaza Coapa, metrobus cañaverales.",https://www.inmuebles24.com/propiedades/clasificado/alclapin-dmz.-renta-de-departamento-remodelado-en-coapa-147591544.html,"MN 14,750","calzada de los tenorios 230
Lotería Nacional, Tlalpan","80 m² lote, 3 rec., 1 baño, 1 estac.",Tlalpan
"Departamento en Renta en jardínes en la montaña. Departamento en Renta en Rayo Vende. ¡El estilo que te gusta y mereces! Departamento en Fraccionamiento cerrado en Tlalpan. Construcción: 339 m2. Piso: 4. • Sala- comedor. • Cocina abierta tipo loft. • 2 recámaras con vestidor y baño. • 2. 5 baños. • Estudio. • Family Room. • 4 lugares de estacionamiento. • Bodega. Mantenimiento $10, 800. ¡Listo para estrenar departamento con Rayo Vende Inmobiliaria! ¡Hazlo tuyo, invierte y estrena!, tenemos más de 40 años de experiencia, te asesoramos en todo el proceso de Renta con Seguridad, Honestidad y Transparencia. ¡Contáctanos hoy mismo! (55) Ver datos. Ver datos. • 2 recámaras (opción a 3) • 2. 5 baños. • 4 estacionamientos. • 339 metros de construcción. • Piso 4. • Family. • Estudio. • Antigüedad 2010. Amplio departamento en fraccionamiento cerrado. Doble vigilancia. Elevador al piso. Iluminada sala - comedor con vista al bosque. Espaciosa cocina y antecomedor. 2 recámaras con vestidor y baño, opción a tercera recámara. Estudio, family room. Cuenta también con lavandería y cuarto de servicio. 4 estacionamientos y bodega.",https://www.inmuebles24.com/propiedades/clasificado/alclapin-departamento-en-renta-en-jardines-en-la-montana-146095331.html,"MN 70,000","PICO DE VERAPAZ
Jardines en la Montaña, Tlalpan","339 m² lote, 2 rec., 2 baños, 4 estac.",Tlalpan
"Departamento loft en Renta en Tlalpan. Departamento loft en Rayo Vende Inmobiliaria. Hermoso loft recién remodelado, combina comodidad y estilo en un ambiente moderno y funcional. Se encuentra en P. B. , completamente amueblado, listo para habitarse. Cuenta con: • Sala y comedor. • Cocina equipada. • Un baño completo. • Área de lavado independiente. • Un lugar de estacionamiento. Tiene acceso a un lindo jardín común, ideal para relajarse al aire libre, perfecto para una persona sola o una pareja, te encantará la tranquilidad, solo 7 departamentos. ¡Listo para rentar departamento loft con Rayo Vende Inmobiliaria! Tenemos más de 40 años de experiencia, te asesoramos en todo el proceso de renta con Seguridad, Honestidad y Transparencia. ¡Contáctanos hoy mismo!",https://www.inmuebles24.com/propiedades/clasificado/alclapin-departamento-loft-en-renta-en-tlalpan-147096536.html,"MN 10,000","FERNANDO BELTRAN Y PUGA
Miguel Hidalgo, Tlalpan","70 m² lote, 1 rec., 1 baño, 1 estac.",Tlalpan
"Ubicado a dos cuadras de la Carr. Picacho-Ajusco, se encuentra el Condominio Antigua Ajusco iii. El departamento está ubicado en cuarto piso y cuenta con: - 2 recámaras (la principal con walk in closet) - 2 baños completos. - Estancia con balcón y una agradable vista. - Cocina integral. - Área de lavado. - 2 lugares de estacionamiento techados. El condominio consta de 8 torres y cuenta con una palapa con asador para realizar eventos. Asimismo, se cuenta con servicio de vigilancia las 24 horas.",https://www.inmuebles24.com/propiedades/clasificado/alclapin-departamento-en-renta-en-condominio-antigua-ajusco-147518729.html,"MN 15,500","Piñanona 44
Miguel Hidalgo 4A Sección, Tlalpan","83 m² lote, 2 rec., 2 baños, 2 estac.",Tlalpan
"Si quieres vivir en un hermoso departamento rodeado de áreas verdes, no puedes dejar pasar esta oportunidad. En el hermoso condominio de Pedregal Dos, en el Edificio Verona se encuentra este departamento de 3 recamaras, una de ellas habilitada completamente como vestidor, dos baños, cocina, alacena, sala, comedor, área de tv. , área de lavado, todo remodelado y en perfectas condiciones. El precio de renta es de $35, 000. 00 mensuales, incluye mantenimiento. Agenda tu cita: Ver datos, y. Ver datos. requisitos: Un depósito, una renta, fiador con inmueble libre de gravamen y póliza jurídica que paga el inquilino. Al “Contactar” para consultar esta propiedad, estás aceptando los “Términos y condiciones” y “Aviso de Privacidad”. Aviso de Privacidad, Quejas, Sugerencias y más en el sitio Oficial. El Costo del mantenimiento, mobiliario, electrodomésticos y arte que se muestran en las fotografías no está incluido en el precio de renta. Todas las medidas enunciadas son meramente orientativas, las medidas exactas serán las que se expresen en el respectivo título de propiedad de cada inmueble.",https://www.inmuebles24.com/propiedades/clasificado/alclapin-departamento-en-renta-en-pedregal-dos-146061601.html,"MN 31,000","PEDREGAL DOS
Fuentes del Pedregal, Tlalpan","131 m² lote, 2 rec., 2 baños, 2 estac.",Tlalpan
