Título,Enlace,Precio,Dirección,Características,Municipio de Origen
"Departamento en Renta en Rayo Vende Inmobiliaria. ¡Descubre todas las ventajas de vivir en la mejor zona de la Ciudad de México! En calle cerrada cerca de Tec de Monterrey, a 5 minutos de Periférico Sur y a 10 minutos de Tlalpan. • 2 recámaras. • 1 baño. • 1 estacionamiento. • Área de lavado y tendido. • Piso: 3. Ideal para parejas o estudiantes y con una vistosa bóveda catalana. La renta incluye mantenimiento e internet. ¡Listo para rentar departamento con Rayo Vende Inmobiliaria! ¡Hazlo tuyo, renta y habita! , tenemos más de 40 años de experiencia, te asesoramos en todo el proceso de arrendamiento con Seguridad, Honestidad y Transparencia. ¡Contáctanos hoy mismo!",https://www.inmuebles24.com/propiedades/clasificado/alclapin-departamento-en-renta-en-arboledas-del-sur-147647679.html,"MN 10,000","RICARDO FLORES MAGON
Arboledas del Sur, Tlalpan","58 m² lote, 2 rec., 1 baño, 1 estac.",Tlalpan
"Departamento en Renta en lomas del pedregal. Departamento Renta en Rayo Vende Inmobiliaria. Seguridad, tranquilidad, ubicación, plusvalía… ¡Si se puede! • Construcción 288 m2. • 3 Recámaras. •Comedor. • Sala. •Cocina abierta. •Estacionamiento para 2 autos. • Cuarto de servicio. •Juegos infantiles. Amenidades: • Gimnasio equipado. • Salón de usos múltiples. • Terraza con asador. Renta más Mantenimiento. A una cuadra de Periférico Sur y a dos cuadras del Hospital Ángeles del Pedregal en un exclusivo fraccionamiento, te ofrecemos este departamento exterior, en segundo piso. La sala y comedor con balcón con vista a impecable área verde común y un gran ventanal que permite la entrada de luz natural a todo el departamento; cocina abierta con barras de granito, iluminada y de muy buen tamaño. Baño de visitas, clóset de blancos. Hall distribuidor, tres recámaras, dos de ellas comparten baño y una de ellas puede ser family o estudio. La recámara principal tiene vestidor y baño completo. Las tres recámaras con vista al jardín interior. Tiene cuarto de servicio con baño, lavandería, estacionamiento para 2 autos, vigilancia estricta 24/7. Las amenidades que puedes disfrutar son gimnasio, salón de usos múltiples para 100 personas y terraza, además de su impecable jardín común. Aceptan mascota pequeña. ¡Listo para rentar departamento con Rayo Vende Inmobiliaria! ¡Hazlo tuyo, renta y vívelo!, tenemos más de 40 años de experiencia, te asesoramos en todo el proceso de renta con Seguridad, Honestidad y Transparencia. ¡Contáctanos hoy mismo! (55) Ver datos. Ver datos",https://www.inmuebles24.com/propiedades/clasificado/alclapin-departamento-en-renta-en-lomas-del-pedregal-146912293.html,"MN 54,000","Cobalto 70 edif A
Lomas del Pedregal, Tlalpan","190 m² lote, 3 rec., 2 baños, 2 estac.",Tlalpan
"Departamento en Renta en santa ursula xitla. Departamento en Renta en Rayo Vende. Descubre este espacioso y luminoso departamento de 128 m², con ubicación privilegiada sobre Av. Insurgentes Sur, a pocos pasos de puntos de interés como el restaurante “Arroyo”, el centro comercial Patio Tlalpan, la Universidad Intercontinental y el Hospital de Neurología. Su excelente conectividad te permite estar entre las estaciones del Metrobús “Fuentes Brotantes” y “Santa Úrsula”. El departamento destaca por sus techos altos y sus amplios espacios, cuenta con 2 recámaras, 2 baños completos, área de televisión y un estudio que fácilmente podría convertirse en una tercera recámara. La cocina integral tiene acceso directo al cuarto de lavado y al baño de servicio. Además, el condominio te ofrece tranquilidad y seguridad gracias a la vigilancia 24 horas con dos casetas de seguridad. Incluye también 2 lugares de estacionamiento techados e independientes. En la azotea dispondrás de jaula de tendido. Este departamento es ideal si buscas espacio, seguridad y una ubicación inmejorable. Ten en cuenta que no se aceptan mascotas. ¡Listo para rentar departamento con Rayo Vende Inmobiliaria! ¡Hazlo tuyo! Tenemos más de 40 años de experiencia, te asesoramos en todo el proceso de renta con Seguridad, Honestidad y Transparencia. No dudes más en agendar una cita y enamórate de tu nuevo hogar.",https://www.inmuebles24.com/propiedades/clasificado/alclapin-departamento-en-renta-en-santa-ursula-xitla-147623982.html,"MN 16,350","INSURGENTES SUR
Santa Úrsula Xitla, Tlalpan","128 m² lote, 2 rec., 2 baños, 2 estac.",Tlalpan
"Vive en este cómodo departamento, la calle empedrada te dará una acogedora bienvenida, estarás a 5 minutos de Insurgentes Sur y Viaducto Tlalpan, tendrás cerca mercados, plazas, entre otros. Cuenta con sala y comedor, 2 recámaras con opción a 3a, 1 baño completo, Cocina de excelente tamaño, cómodo área de lavado y un lugar de estacionamiento. La luz en este departamento es increíble. El condominio es muy familiar, cuenta con seguridad 24/7, área de niños, cancha de básquet y área con aparatos para ejercitarse. El departamento se encuentra en 5o piso, no tiene elevador. Cuenta con cisterna general. Citas: 55 Ver datos y 55 Ver datos. Al ""Contactar"" para consultar esta propiedad, estás aceptando los ""Términos y Condiciones"" y ""Aviso de privacidad"". Aviso de Privacidad, Quejas, Sugerencias y más en nuestro sitio oficial. * Los gastos e impuestos de escrituración no están incluidos en el precio de venta, así como el mobiliario, electrodomésticos y arte que se muestran en las fotografías. Las medidas son ilustrativas y deben de corroborarse con los títulos de propiedad respectivos y/o las boletas predial. Los precios publicados y la disponibilidad pueden cambiar sin previo aviso por lo que se debe de verificar con la inmobiliaria y los propietarios de los inmuebles.",https://www.inmuebles24.com/propiedades/clasificado/veclapin-departamento-en-renta-venta-en-tlalpan-144499023.html,"MN 10,500","Diligencias S/N
San Pedro Mártir, Tlalpan","75 m² lote, 2 rec., 1 baño, 1 estac.",Tlalpan
"Retan de Habitación para estudiante o ejecutivo solo Residencial Villacoapa, Tlalpan, cdmx. Si lo que buscas es una habitación cómoda con excelente ubicación cercana a todos los servicios y dentro de una área escolar esta es tú mejor opción. Ubicada en un edificio con un ambiente familiar. La recámara cuenta con la siguientes características. Recámara con iluminación y ventilación natural. Closet. Baño completo. Cocineta con tarja, parrilla de 2 quemadores y alacena. Área común afuera de la habitación que se puede usar como sala. Área de lavado compartida. Área de tendido compartida. no acepta mascotas. Requisitos: 1 año de contrato forzoso. Renta anticipada. 1 mes de depósito. Obligado Solidario comprobando ingresos estables con estados de cuenta o recibo de nomina. Firma de 12 pagares. Ocupación a partir del 1 de octubre del 2025. Ideal para estudiantes de universidades cercanas como Tec de Monterrey campus cdmx, uvm, La Salle, unam, uam Xochimilco. Cerca de todos los servicios de primera necesidad como tiendas de conveniencia, mercado, bancos, supermercado, escuelas, transporte y vías de acceso como Av. Acoxpa, Miramontes, Tenorios, Eje 3. A 1 km Walmart Acoxpa. A 1 km Gran Terraza Coapa. A 2. 7 km Tec Monterrey Campus cdmx. A 4 km uvm Coyoacán. A 2 km Hospital Ángeles Acoxpa. A 1 km Metrobús Cañaverales.",https://www.inmuebles24.com/propiedades/clasificado/alclapin-renta-habitacion-para-estudiante-residencial-147577376.html,"MN 7,000","Sendero sn
Residencial Villa Coapa, Tlalpan","20 m² lote, 1 rec., 1 baño",Tlalpan
"[arr] id houm: Ver datos. Entérate de todos los beneficios al rentar con Houm: • No te pedimos aval. • Asistencia e intermediación con el propietario. • Firma tu contrato online. • Renta sin burocracia, papeleos y mucho más rápido. • Difiere tu depósito en hasta 6 meses sin interés. Departamento en renta, ubicado en la colonia Héroes de Padierna, con una superficie construida de 60. 00 m² y superficie total de 60. 00 m². Sus principales características son: • Amueblado. • 1 recámara. • 1 baño. • No Admite mascotas. • Año de construcción: 2020. Si rentas con nosotros, te brindamos asesoría personalizada durante todo el proceso. Importante: • Se deben demostrar ingresos de 3 veces el valor de la renta. • En caso de que tus ingresos no lleguen a 3 veces el valor de la renta, estos pueden ser la suma de las personas que vivirán en la propiedad. • Te invitamos a agendar una visita a esta propiedad: esta puede ser presencial o vía streaming, desde la comodidad de tu hogar. • Y lo mejor. Sin aval. Más que una corredora, somos Houm. *Aplican T&C",https://www.inmuebles24.com/propiedades/clasificado/alclapin-departamento-en-heroes-de-padierna-con-1-recamara-144999584.html,"MN 9,500","Yucalpeten
Héroes de Padierna, Tlalpan","60 m² lote, 1 rec., 1 baño",Tlalpan
"Departamento en Renta en La Magdalena Petlacalco, ubicado en pb, en una casa con 2 niveles, en una calle cerrada y tranquila, se encuentra a unos pasos de la avenida principal, donde pasa el transporte público que va a diferentes puntos como al Metrobús la Joya, Calzada de Tlalpan y Huipulco. Vías de acceso Carretera Federal a Cuernavaca. En una calle con Diversos Negocios, donde hay Gimnasios, Tiendas, Escuelas, Gasolinera y Oxxo. El Departamento cuenta con 90mts. Distribuidos en: Estancia-comedor, cocina integral (sin estufa), 3 recamaras cada una con closet y la principal con baño, baño en pasillo completo ambos con cancel, vestidor, área de lavado con adaptación para lavadora, 1 lugar de estacionamiento independiente, interfon y jardín con área de bar. Cuenta con cámaras de seguridad, portones eléctricos. Los servicios se pagan aparte como agua (solo por pipa), luz, y gas lp. Requisitos: Un mes de renta, un mes de depósito, fiador con bien raíz u obligado solidario, póliza jurídica. Disponibilidad inmediata. *Acepta una mascota*",https://www.inmuebles24.com/propiedades/clasificado/alclapin-departamento-en-renta-en-la-magdalena-petlacalco-147579639.html,"MN 11,500","Morelos
La Magdalena Petlacalco, Tlalpan","92 m² lote, 3 rec., 2 baños, 1 estac.",Tlalpan
"Disfruta la magnifica ubicacion de este cómodo departamento. Sala comedor con pisos laminados, cocina integral, area de lavado, 3 recámaras con closet, jaula de tendido y 1 lugar de estacionamiento. Muy cercano a la estación de metrobús La Joya y El Caminero con vigilancia 24 horas, a 10 minutos del Centro de Tlalpan y zona de hospitales. La renta incluye la cuota de mantenimiento de $850. 00",https://www.inmuebles24.com/propiedades/clasificado/alclapin-en-renta-bonito-departamento-tlalpan-147483512.html,"MN 13,000","congreso
La Joya, Tlalpan","70 m² lote, 3 rec., 1 baño, 1 estac.",Tlalpan
"Vive en un espacio moderno, cómodo y privado, con una gran terraza y la tranquilidad de un condominio exclusivo en el sur de la cdmx. Ubicado en Santa Úrsula Xitla, Tlalpan, a espaldas del Restaurante Arroyo y a solo una calle de Patio Tlalpan, tendrás al alcance centros comerciales, servicios, transporte y vialidades principales. Características del departamento. Planta baja con 75 m² habitables + 35 m² de terraza privada, perfecta para disfrutar al aire libre. 2 recámaras con amplios clósets. 2 baños completos, uno dentro de la recámara principal. Amplia estancia con excelente distribución. Cocina funcional y área de lavado independiente. 2 lugares de estacionamiento en sótano con eleva-auto. El condominio ofrece. Elevador y vigilancia 24/7, con control de acceso. Solo 24 departamentos, lo que garantiza privacidad y tranquilidad. Excelente mantenimiento, ya incluido en la renta. Requisitos. Un mes de depósito. Póliza jurídica. Renta corriente. Restricción de mascotas. Disponible para visitarse a partir del 15 de septiembre 2025. Conócelo y agenda tu visita hoy mismo, estamos para atenderte en nuestros números de contacto, redes sociales y sitio web.",https://www.inmuebles24.com/propiedades/clasificado/alclapin-santa-ursula-xilta-departamento-en-renta-62345842.html,"MN 19,000","Cuautla 20
Santa Úrsula Xitla, Tlalpan","110 m² lote, 2 rec., 2 baños, 2 estac.",Tlalpan
"Muy bonito Loft en parte baja de San Nicolás Totolapan, muy cerca de Fuentes del Pedregal, se ubica dentro de una propiedad con entrada independiente, cuenta con: -salita. Espacio abierto para recámara. 1 baño completo. Cocina con antecomedor. Patio privado. Espacio para 1 cajón de estacionamiento con portón eléctrico. Área de lavado. El precio de renta incluye servicios de agua y gas, puedes traer un frigobar o refrigerador. Se entrega sin cama. Se renta para pareja o persona sola, no se aceptan mascotas. Requisitos: mes de renta, 2 meses de deposito,, comprobantes de ingresos. Disponible a partir del 15 de septiembre. Se puede visitar antes",https://www.inmuebles24.com/propiedades/clasificado/alclapin-renta-loft-san-nicolas-totolapan-cerca-fuentes-del-62433306.html,"MN 9,500","Soledad
San Nicolás 2, Tlalpan","50 m² lote, 1 rec., 1 baño, 1 estac.",Tlalpan
"No asesores. Cerca de Viaducto Tlalpan, Periférico, Calzada México-Xochimilco, Calzada Acoxpa, Tecnológico de Monterrey, Costco, Colegios, Centros Comerciales, Hospitales. Requisitos: Un depósito, una renta, un aval, el pago de una póliza jurídica, referencias y comprobación de ingresos 3/1.",https://www.inmuebles24.com/propiedades/clasificado/alclapin-departamento-en-renta-en-hacienda-san-juan-146118259.html,"MN 22,000","Hacienda San Juan
Hacienda de San Juan de Tlalpan, Tlalpan","102 m² lote, 3 rec., 2 baños, 2 estac.",Tlalpan
"Excelente Depto. Que consta de Una habitación, un baño completo, cocina integral sala y comedor.",https://www.inmuebles24.com/propiedades/clasificado/alclapin-departamento-renta-147506697.html,"MN 9,000","GUADALUPE VICTORIA
Héroes de Padierna, Tlalpan","45 m² lote, 1 rec., 1 baño",Tlalpan
"Pent House de 230 metros, 3 recamaras, 3 baños completos, sala, comedor, cocina integral, área de lavado, área de tendido, 12 baño, 1 estacionamiento",https://www.inmuebles24.com/propiedades/clasificado/alclapin-pent-house-renta-147522671.html,"MN 19,500","JALISCO
Miguel Hidalgo 1A Seccion, Tlalpan","230 m² lote, 3 rec., 3 baños, 1 estac.",Tlalpan
"Departamento en renta ubicado en Colonia Nueva Oriental, Coapa. Se encuentra en primer piso y cuenta con dos recámaras con clóset, un baño completo, sala-comedor, cocina integral, área de lavado y balcón. El edificio dispone de portón eléctrico, cisterna y tinacos. En los alrededores hay plazas comerciales, centros de autoservicio, escuelas, restaurantes",https://www.inmuebles24.com/propiedades/clasificado/alclapin-departamento-en-renta-en-coapa-147494673.html,"MN 16,000","Rancho Piomo 16
Nueva Oriental Coapa, Tlalpan","80 m² lote, 2 rec., 1 baño, 1 estac.",Tlalpan
"Ref: 2 5 0 2 1 0. Disfruta de la comodidad y tranquilidad que ofrece este hermoso departamento en renta ubicado en Héroes de Padierna, Tlalpan, Ciudad de México. Con una construcción de 68 m2, habitables y una terraza de 40 m2. Esta propiedad cuenta con 2 recamaras, 1 baño completo, cocina equipada, piso de cerámica y piso laminado. Además, podrás disfrutar en la terraza de una excelente vista para relajarte al aire libre y disfrutar con tu familia de unas exquisitas parrilladas. La ubicación de este departamento es ideal para aquellos que buscan un ambiente residencial tranquilo y seguro. En la zona, encontrarás una variedad de servicios y comercios cercanos que harán tu vida cotidiana mucho más cómoda. Entre las zonas de interés cercanas se encuentran el centro comercial Perisur, el Parque Nacional Fuentes Brotantes y el Hospital Ángeles del Pedregal. Adicional alrededor de la zona, cuenta con Escuelas, Hospitales, Mercados y pequeñas plazas comerciales y Bancos. Para tu comodidad, las principales vías de acceso a esta propiedad incluyen la Avenida Periférico Sur y la Carretera Picacho-Ajusco. Asimismo, podrás acceder fácilmente a estaciones de metro como la estación Perisur y a diversas rutas de transporte público que te conectarán con diferentes puntos de la ciudad. No pierdas la oportunidad de vivir en este encantador departamento en una de las zonas más exclusivas de la Ciudad de México.",https://www.inmuebles24.com/propiedades/clasificado/alclapin-departamento-en-renta-heroes-de-padierna-alcaldia-146538485.html,"MN 15,000","Contoy 345 , Héroes de Padierna , 14200 Tlalpan, Ciudad de México, México
Héroes de Padierna, Tlalpan","108 m² lote, 2 rec., 1 baño",Tlalpan
"Inmobipro le ofrece en Renta un departamento cerca de la Picacho Ajusco, a unos minutos del Six Flags, en un edificio de tan sólo seis departamento, en una colonia residencial, Héroes de Padierna. El departamento consta de tres niveles. En el primer nivel se encuentra una amplia sala-comedor con cocina integral; en el segundo nivel están las tres recamaras, la principal con baño completo, otro baño completo y un medio baño. En el tercer nivel está el roof garden, privado, con área de asador. El departamento cuenta con amplia bodega y dos lugares de estacionamiento. Wig: p1bsete",https://www.inmuebles24.com/propiedades/clasificado/alclapin-departamento-en-renta-en-heroes-de-padierna-145834288.html,"MN 28,000","Telchac
Héroes de Padierna, Tlalpan","175 m² lote, 3 rec., 2 baños, 2 estac.",Tlalpan
"Situado en la tranquila y bien conectada colonia San Lorenzo Huipulco, dentro de la alcaldía Tlalpan. Este espacio ofrece dos recámaras perfectamente distribuidas, recamara principal con pantalla lg de 42"" lo que permite una estancia confortable tanto para familias pequeñas como para quienes desean contar con una habitación adicional para oficina, estudio o visitas, además cuenta con dos balcones. El área de cocina ha sido equipada con una estufa y campana integradas, además de refrigerador y lavadora ofreciendo un espacio óptimo para realizar actividades culinarias de forma práctica. Este departamento cuenta con dos lugares de estacionamiento, portón eléctrico que abre con control remoto lo que facilita la movilidad y proporciona seguridad adicional para vehículos particulares. Cabe destacar que no se admiten mascotas, lo cual favorece un ambiente más controlado dentro del desarrollo habitacional. Además, el precio de renta ya incluye tanto el servicio de internet como la cuota de mantenimiento, eliminando preocupaciones adicionales en la administración mensual del hogar. El condominio en el que se encuentra este departamento pone a disposición de sus residentes un roof garden privado con acceso desde el interior del departamento que ofrece un espacio abierto y versátil ideal para relajarse o convivir. También cuenta con cámaras de seguridad, lo que garantiza un entorno protegido y armónico para todos los habitantes. Importante: No cuenta con elevador. Con opción de rentar sin algunos muebles. La ubicación es otro de los grandes atributos de este inmueble. Su cercanía con la Zona de Hospitales lo convierte en una alternativa estratégica para profesionales de la salud o personas que requieren acceso constante a servicios médicos de primer nivel. A pocos minutos del Estadio Azteca y del Tren Ligero Huipulco, cerca de varias universidades públicas y privadas, tales como la unam, Tec de Monterrey, uvm y otras. El departamento se sitúa también a una distancia conveniente de centros comerciales como Paseo Acoxpa. Las principales vías de comunicación, entre las que destacan Periférico, Viaducto Tlalpan y Calzada de Tlalpan, aseguran una conexión fluida con diferentes zonas de la ciudad, facilitando desplazamientos rápidos tanto en vehículo como en transporte público. ¡Con Homie renta sin aval! Proceso 100% digital y diferentes formas de pago de tu renta, tú eliges. ¡Conoce ya este depa! Estás a pocos pasos de encontrar el hogar de tus sueños. Departamento de 65. 0 metros cuadrados cuenta con: - 2 habitaciones. - 2. 0 baños. - 2 lugares de estacionamiento. Características: - Balcón. - Amueblado. - Cuarto de lavado. - Cocina integral. Servicios: - Internet/Teléfono. Amenidades: - Seguridad. Antigüedad: 7 años. . Número de habitantes recomendado: 4. Disponibilidad para mostrar: 08/septiembre/2025. Disponibilidad para habitar: 08/septiembre/2025. ¡Enamórate de tu vida en este departamento! # Homie Id: 9_4_8_3_8. Estos son los beneficios que tienes como inquilino al rentar tu nuevo hogar con nosotros: * No necesitas aval (sujeto a Términos y Condiciones). * Realiza el pago de tu renta mediante transferencia digital en nuestra plataforma o en efectivo en miles de locales disponibles. * Asistencia y conciliación con tu propietario. * Proceso sin burocracia, renta en cuestión de horas y sin trámites complicados. * Firma tu contrato de forma digital.",https://www.inmuebles24.com/propiedades/clasificado/alclapin-departamento-semiamueblado-en-renta-cerca-del-estadio-146947748.html,"MN 16,300","Privada Sauces
San Lorenzo Huipulco, Tlalpan","65 m² lote, 2 rec., 2 baños, 2 estac.",Tlalpan
"Departamento semi amueblado en renta; ubicado en Avenida Fortin, exterior, en tercer piso. Buscamos un estudiante ó una pareja, ya que únicamente se renta una recamara. Consta de: Sala, comedor, cocina integral, zotehuela, jaula de tendido. Recámara con closet, un baño completo. Estacionamiento en area común de la unidad habitacional. Mobiliario que incluye: Comedor para 4 personas. Vitrina chica. Refrigerador, alacena, pequeña mesa en la cocina, horno de microondas. Está contratado servicio de Internet con Izzi, pago adicional $300. Requisitos para renta: Un mes de renta, un mes de depósito y póliza de arrendamiento anual $4, 800 con fiador u obligado solidario.",https://www.inmuebles24.com/propiedades/clasificado/alclapin-departamento-en-renta-en-colonia-narciso-mendoza-146533591.html,"MN 10,500","EL FORTIN
Narciso Mendoza, Tlalpan","55 m² lote, 1 rec., 1 baño, 1 estac.",Tlalpan
"[arr] id houm: Ver datos. Entérate de todos los beneficios al rentar con Houm: • No te pedimos aval. • Asistencia e intermediación con el propietario. • Firma tu contrato online. • Renta sin burocracia, papeleos y mucho más rápido. • Difiere tu depósito en hasta 6 meses sin interés. Departamento en renta, ubicado en la colonia Residencial Villa Coapa, con una superficie construida de 110. 00 m² y superficie total de 160. 00 m². Sus principales características son: • Sin amueblar. • 2 recámaras. • 2 baños. • No Admite mascotas. • 2 estacionamientos. • Cocina equipada. • Piso 2. • Año de construcción: 2017. • Bodega. Si rentas con nosotros, te brindamos asesoría personalizada durante todo el proceso. Importante: • Se deben demostrar ingresos de 3 veces el valor de la renta. • En caso de que tus ingresos no lleguen a 3 veces el valor de la renta, estos pueden ser la suma de las personas que vivirán en la propiedad. • Te invitamos a agendar una visita a esta propiedad: esta puede ser presencial o vía streaming, desde la comodidad de tu hogar. • Y lo mejor. Sin aval. Más que una corredora, somos Houm. *Aplican T&C",https://www.inmuebles24.com/propiedades/clasificado/alclapin-departamento-en-residencial-villa-coapa-con-2-147651221.html,"MN 23,500","El Lindero
Residencial Villa Coapa, Tlalpan","160 m² lote, 2 rec., 2 baños, 2 estac.",Tlalpan
"Extraordinario Pent House en una de las calles principales de Jardines en la Montaña. Fue renovado hace 4 años, está impecable. , caseta de vigilancia además de la vigilancia del fraccionamiento. Las vistas son increíbles así como la luz y los generosos espacios. El departamento, de dos niveles, cuenta con una estancia muy amplia en dónde cabe inclusive la sala de tv con salida a una linda y amplia terraza. La cocina es cerrada de gran tamaño, con espacio desayunador que da a la terrraza, también con gran vista, enorme alacena y área de lavado y cuarto de servicio con baño integrado. Cuenta con tres amplias recámaras, dos con vestidor y una con clóset, todas con baño privado y una con terraza tan amplia como la de la estancia. Excelentes vistas a la ciudad. Linda luz y vistas en las tres recámaras. Cuenta con 4 lugares de estacionamiento y clósets de almacenamiento muy buenos en esa área. El departamento está en venta Y renta (con mantenimiento incluído). Informes 55 Ver datos. El edificio cuenta con vestíbulo y vigilancia privada. Es una magnífica oportunidad de departamento en este increíble fraccionamiento. En este inmueble no asesores externos. Disculpen. Agenda tu cita o contáctanos a través de esta publicación. La compraventa de esta propiedad se puede realizar mediante recursos propios o crédito. Para aviso de privacidad, quejas, sugerencias o aclaraciones. Ver datos. Los gastos e impuestos de escrituración (con la Notaría de tu elección) y cargos relacionados por algún tipo de crédito no están incluidos en el precio de venta, así como el mobiliario, electrodomésticos y arte que se muestran en las fotografías. Nota importante: Toda la información y medidas provistas son aproximadas y deberán ratificarse con la documentación pertinente y no compromete contractualmente a nuestra empresa.",https://www.inmuebles24.com/propiedades/clasificado/veclapin-venta-y-renta-departamento-pent-house-en-jardines-en-90738316.html,"MN 85,000","PICO DE VERAPAZ 519
Jardines en la Montaña, Tlalpan","286 m² lote, 3 rec., 3 baños, 4 estac.",Tlalpan
