Título,Enlace,Precio,Dirección,Características,Municipio de Origen
"Este funcional departamento ofrece un diseño que maximiza el confort. Ubicado en una zona privilegiada, cuenta con 20 años de antigüedad y se distingue por sus acabados de calidad. La distribución interior incluye una amplia sala y comedor integrados, ideales para recibir visitas. La cocina está equipada con espacios de almacenamiento. Dispone de 3 baños completos y 1 medio baño, además de 3 recámaras bien iluminadas. Entre las comodidades adicionales, se incluyen 2 lugares de estacionamiento, seguridad privada las 24 horas y acceso para personas con discapacidad. El edificio ofrece un salón de usos múltiples para eventos y reuniones. La ubicación en Jardines en la Montaña ofrece cercanía a escuelas de diversos niveles, facilitando el acceso a servicios educativos. La zona es principalmente residencial, con un ambiente tranquilo y familiar. Cuenta con buenas opciones de transporte público y fácil acceso a vialidades importantes. Encontrarás supermercados, tiendas de conveniencia y farmacias a pocos minutos de distancia, haciendo la vida diaria más cómoda.",https://www.inmuebles24.com/propiedades/clasificado/alclapin-departamento-de-240-m-sup2--con-3-recamaras-en-renta-147562814.html,"MN 37,000","Pico de Turquino 13
Jardines en la Montaña, Tlalpan","240 m² lote, 3 rec., 3 baños, 2 estac.",Tlalpan
"[arr] id houm: Ver datos. Entérate de todos los beneficios al rentar con Houm: • No te pedimos aval. • Asistencia e intermediación con el propietario. • Firma tu contrato online. • Renta sin burocracia, papeleos y mucho más rápido. • Difiere tu depósito en hasta 6 meses sin interés. Departamento en renta, ubicado en la colonia Viveros Coatectlan, con una superficie construida de 90. 00 m² y superficie total de 180. 00 m². Sus principales características son: • Amueblado. • 2 recámaras. • 2 baños. • Admite mascotas. • 1 estacionamiento. • Cocina equipada. • Piso 1. • Año de construcción: 2014. Además, el inmueble cuenta con las siguientes amenidades: • Estacionamiento de visitas. Si rentas con nosotros, te brindamos asesoría personalizada durante todo el proceso. Importante: • Se deben demostrar ingresos de 3 veces el valor de la renta. • En caso de que tus ingresos no lleguen a 3 veces el valor de la renta, estos pueden ser la suma de las personas que vivirán en la propiedad. • Te invitamos a agendar una visita a esta propiedad: esta puede ser presencial o vía streaming, desde la comodidad de tu hogar. • Y lo mejor. Sin aval. Más que una corredora, somos Houm. *Aplican T&C",https://www.inmuebles24.com/propiedades/clasificado/alclapin-departamento-en-viveros-coatectlan-con-2-recamaras-146860939.html,"MN 9,000","Cerrada Chabacano
Viveros CoatectlAn, Tlalpan","180 m² lote, 2 rec., 2 baños, 1 estac.",Tlalpan
"Departamento ubicado en pb, en el conjunto residencial Real de la Montaña. Sus 125 m2 incluyen una amplia sala comedor con vista al área verde el conjunto. La cocina es amplia, con espacio para el desayunador y medio baño de visitas. La cocina comparte el espacio con el área de lavado. Dos recámaras, la principal con baño. La secundaria con baño completo en el pasillo. El departamento recibe luz todo el día, por ambos lados. Tiene 2 lugares de estacionamiento techado y bodega (11 m2). El condominio tiene área de juegos infantiles, patio para mascotas y 2 grandes jardines. Salón de eventos y vigilancia 24/7. - En cumplimiento con las disposiciones legales, le informamos que Casaliving Real Estate Agency tiene autorización para la promoción e intermediación en la operación de renta de este inmueble. - El mobiliario y demás objetos personales y/o decorativos mostrados en las fotografías, no están incluidos en el precio de renta. - El precio publicado de renta no incluye los gastos de contratación de póliza, fianza o cualquier otro instrumento legal de garantía. - Antes de dar cualquier apartado o información personal, asegúrese de que la propiedad esté vigente, haberla visitado y estar siendo atendido por un asesor calificado. - Consulta nuestro Aviso de Privacidad en. Cualquier comentario, queja o sugerencia sobre este anuncio, por favor reportarlo al correo electrónico: Ver datos o a través del teléfono: Ver datos, en horario de lunes a viernes de 8: 00 am a 7: 00 pm. - Imágenes para uso exclusivo de casaliving Real Estate Agency. Te invitamos a ser parte de nuestra comunidad en Facebook e Instagram: Casaliving. mx. -",https://www.inmuebles24.com/propiedades/clasificado/alclapin-departamento-en-pb-real-de-la-montana-147647244.html,"MN 29,500","Carretera Picacho-Ajusco 52
Jardines en la Montaña, Tlalpan","125 m² lote, 2 rec., 2 baños, 2 estac.",Tlalpan
"Pent House de 230 metros, 3 recamaras, 3 baños completos, sala, comedor, cocina integral, área de lavado, área de tendido, 12 baño, 1 estacionamiento",https://www.inmuebles24.com/propiedades/clasificado/alclapin-pent-house-renta-147522671.html,"MN 19,500","JALISCO
Miguel Hidalgo 1A Seccion, Tlalpan","230 m² lote, 3 rec., 3 baños, 1 estac.",Tlalpan
"[arr] id houm: Ver datos. Entérate de todos los beneficios al rentar con Houm: • No te pedimos aval. • Asistencia e intermediación con el propietario. • Firma tu contrato online. • Renta sin burocracia, papeleos y mucho más rápido. • Difiere tu depósito en hasta 6 meses sin interés. Departamento en renta, ubicado en la colonia Pedregal de San Nicolás 4ta Sección, con una superficie construida de 35. 00 m² y superficie total de 35. 00 m². Sus principales características son: • Amueblado. • 1 recámara. • 1 baño. • No Admite mascotas. • 1 estacionamiento. • Cocina equipada. • Piso 2. • Año de construcción: 2020. Además, el inmueble cuenta con las siguientes amenidades: • Estacionamiento de visitas. Si rentas con nosotros, te brindamos asesoría personalizada durante todo el proceso. Importante: • Se deben demostrar ingresos de 3 veces el valor de la renta. • En caso de que tus ingresos no lleguen a 3 veces el valor de la renta, estos pueden ser la suma de las personas que vivirán en la propiedad. • Te invitamos a agendar una visita a esta propiedad: esta puede ser presencial o vía streaming, desde la comodidad de tu hogar. • Y lo mejor. Sin aval. Más que una corredora, somos Houm. *Aplican T&C",https://www.inmuebles24.com/propiedades/clasificado/alclapin-departamento-en-pedregal-de-san-nicolas-4ta-seccion-147151476.html,"MN 10,700","Avenida Tetiz
Tlalpan, Ciudad de México","35 m² lote, 1 rec., 1 baño, 1 estac.",Tlalpan
"En renta departamento nuevo de 95 m2. 3 amplias habitaciones con closet. 2 baños completos. Amplia e iluminada Estancia sala y comedor. Cocina integral con barra. 1 lugar de estacionamiento. zotehuela. Roof garden Privado. Bodega Privada. Características: Cisterna, y tinaco, gas estacionario, interfon, boiler de paso. Precio de renta $23, 000. 00 más manteniminto $1, 500. requisitos: Contrato por 1 año. Comprobante de intresos ( 3 meses en recibos de nómina y 6 meses en estados de cuenta) Aval u obligado solidario. Póliza jurídica (al 50%) $2, 750. 00",https://www.inmuebles24.com/propiedades/clasificado/alclapin-depa-nuevo-en-renta-a-1-cuadra-de-periferico-147527801.html,"MN 23,000","DEPARTAMENTO EN RENTA EN COL. ISIDRO FABELA A 1 MIN DE PERIFÉRICO
Isidro Fabela, Tlalpan","95 m² lote, 3 rec., 2 baños, 1 estac.",Tlalpan
"En renta departamento nuevo de 95 m2. 2 amplias habitaciones con closet. 2 baños completos. Amplia e iluminada Estancia sala y comedor. Cocina integral con barra. 1 lugar de estacionamiento. zotehuela. Roof garden Privado. Bodega Privada. Características: Cisterna, y tinaco, gas estacionario, interfon, boiler de paso. Precio de renta $21, 000. 00 más manteniminto $1, 500. requisitos: Contrato por 1 año. Comprobante de intresos ( 3 meses en recibos de nómina y 6 meses en estados de cuenta) Aval u obligado solidario. Póliza jurídica (al 50%) $2, 750. 00",https://www.inmuebles24.com/propiedades/clasificado/alclapin-departamento-en-renta-col.-isidro-fabela-tlalpan-147493577.html,"MN 21,000","Calle 8 Oriente
Isidro Fabela, Tlalpan","95 m² lote, 2 rec., 2 baños, 1 estac.",Tlalpan
"[arr] id houm: Ver datos. Entérate de todos los beneficios al rentar con Houm: • No te pedimos aval. • Asistencia e intermediación con el propietario. • Firma tu contrato online. • Renta sin burocracia, papeleos y mucho más rápido. • Difiere tu depósito en hasta 6 meses sin interés. Departamento en renta, ubicado en la colonia Residencial Villa Coapa, con una superficie construida de 110. 00 m² y superficie total de 160. 00 m². Sus principales características son: • Sin amueblar. • 2 recámaras. • 2 baños. • No Admite mascotas. • 2 estacionamientos. • Cocina equipada. • Piso 2. • Año de construcción: 2017. • Bodega. Si rentas con nosotros, te brindamos asesoría personalizada durante todo el proceso. Importante: • Se deben demostrar ingresos de 3 veces el valor de la renta. • En caso de que tus ingresos no lleguen a 3 veces el valor de la renta, estos pueden ser la suma de las personas que vivirán en la propiedad. • Te invitamos a agendar una visita a esta propiedad: esta puede ser presencial o vía streaming, desde la comodidad de tu hogar. • Y lo mejor. Sin aval. Más que una corredora, somos Houm. *Aplican T&C",https://www.inmuebles24.com/propiedades/clasificado/alclapin-departamento-en-residencial-villa-coapa-con-2-147651221.html,"MN 23,500","El Lindero
Residencial Villa Coapa, Tlalpan","160 m² lote, 2 rec., 2 baños, 2 estac.",Tlalpan
"A 15 minutos en coche de Six Flags subiendo sobre la Carr. Libre Picacho Ajusco. Amplia casa en condominio de 4 casas,, cuenta con 5 habitaciones, 4 baños completos y uno medio, además de lugar de estacionamiento para 2 autos. Nota importante: toda la información y medidas provistas son aproximadas y deberán ratificarse con la documentación pertinente y no compromete contractualmente a nuestra empresa. Los gastos expresados refieren a la última información recabada y deberán confirmarse. Fotografías no vinculantes ni contractuales. Contacto. -Alejandra Ozuna. -55 Ver datos",https://www.inmuebles24.com/propiedades/clasificado/alclapin-casa-en-condominio-en-picacho-ajusco.-144256208.html,"MN 26,500","Carretera picacho Ajusco
Miguel Hidalgo 3A Sección, Tlalpan","250 m² lote, 5 rec., 4 baños, 2 estac.",Tlalpan
"Departamento de lujo con pisos laminados. Cuenta con estancia comedor, cocina equipada y cuarto de servicio con baño. 2 recámaras. Estudio. 2 baños completos. 2 lugares de estacionamiento. 1 bodega. Edificio con lobby, elevador y vigilancia 24 hrs. Salón de usos múltiples. 8, 000 m de jardines y áreas comunes. Requisitos para rentar: 1 mes de deposito. 1 mes de renta adelantada. Fiador con bien raíz en cdmx. Comprobantes de ingresos de los últimos 3 meses a través de nomina o estados de cuenta bancarios. Póliza Jurídica.",https://www.inmuebles24.com/propiedades/clasificado/alclapin-renta-o-venta-departamento-jardines-en-la-montana-real-66933946.html,"MN 25,000","Real de la Montaña, Picacho Ajusco
Jardines en la Montaña, Tlalpan","150 m² lote, 2 rec., 2 baños, 2 estac.",Tlalpan
"Departamento en segundo piso en el Exclusivo Fraccionamiento Jardines de la Montaña con alta seguridad, con vigilancia 24/7 y accesos controlados, un fraccionamiento con alta calidad de vida con 3 parques propios, El departamento cuenta con 203 m2, en donde se tienen 3 recámaras, 3 baños, 3 estacionamientos, cuarto de servicio con baño, Excelente ubicación, a 2 minutos de Periférico, a 8 min de Insurgentes, a 10 min de Artz, a 5 min de Perisur.",https://www.inmuebles24.com/propiedades/clasificado/alclapin-jardines-en-la-montana:-departamento-en-renta-en-147547882.html,"MN 40,000","Avenida Paseo del Pedregal 1300
Jardines en la Montaña, Tlalpan","203 m² lote, 3 rec., 3 baños, 3 estac.",Tlalpan
"Entrando al departamento está el closet y baño de visitas. En el área común esta la sala comedor y un espacio para la cantina. Esta área tiene acceso al balcón que tiene vista a la áreas verdes del fraccionamiento. Después de la sala hay una división para delimitar el área del Family. Cuenta con recámara principal con baño completo, vestidor y jacuzzi. Tiene 2 recámaras secundarias cada una con baño completo. En el área de la cocina hay espacio para colocar un desayunador, tiene la alacena y ahi mismo esta el acceso al patio de servicio y al cuarto de servicio que cuenta con baño completo. Acepta mascotas. El departamento cuenta con 3 estacionamientos independientes y techados. Entre las amenidades del desarrollo se encuentran alberca, ludoteca, áreas verdes con espejos de agua, pet friendly, salón de eventos o usos múltiples. Para aviso de privacidad, quejas, sugerencias o aclaraciones visita, o escríbenos a Ver datos. Oficina Sur Ver datos y 6292. Los gastos de investigación y póliza jurídica no están incluidos en el costo de renta, así como el mobiliario, electrodomésticos y arte que se muestran en las fotografías.",https://www.inmuebles24.com/propiedades/clasificado/alclapin-departamento-en-renta-en-lomas-del-pedregal-147565996.html,"MN 64,500","Avenida Cobalto
Lomas del Pedregal, Tlalpan","278 m² lote, 3 rec., 3 baños, 3 estac.",Tlalpan
"No asesores. Cerca de Viaducto Tlalpan, Periférico, Calzada México-Xochimilco, Calzada Acoxpa, Tecnológico de Monterrey, Costco, Colegios, Centros Comerciales, Hospitales. Requisitos: Un depósito, una renta, un aval, el pago de una póliza jurídica, referencias y comprobación de ingresos 3/1.",https://www.inmuebles24.com/propiedades/clasificado/alclapin-departamento-en-renta-en-hacienda-san-juan-146118259.html,"MN 22,000","Hacienda San Juan
Hacienda de San Juan de Tlalpan, Tlalpan","102 m² lote, 3 rec., 2 baños, 2 estac.",Tlalpan
"Departamento en tercer nivel no hay elevador. No mascotas. No niños. 100 m2. Tres recámaras - *Dos recámaras cuentan con balcón*- Dos baños completos. Sala. Comedor. Calentador solar. 1 cajón de estacionamiento. Portón automático. Sin mascotas. $14, 000. Incluye mantenimiento. (Aproximadamente de servicios son $500. Mensuales) Departamento en tercer nivel. 100 m2. Tres recámaras - *Dos recámaras cuentan con balcón*- Dos baños completos. Sala. Comedor. Calentador solar. 1 cajón de estacionamiento. Portón automático. Sin mascotas. $14, 000. Incluye mantenimiento. (Aproximadamente de servicios son $500. Mensuales) nota: no mascotas. No niños.",https://www.inmuebles24.com/propiedades/clasificado/alclapin-renta-departamento-3-recamaras-100-m-ubicacion-cerca-146799002.html,"MN 14,000","Tarahumaras
Pedregal de las Aguilas, Tlalpan","100 m² lote, 3 rec., 2 baños, 1 estac.",Tlalpan
"¡Departamento remodelado en renta a unos pasos de Picacho Ajusco! Disfruta de este amplio y cómodo departamento de una recámara, con sala y comedor espaciosos, cocina abierta y un lugar de estacionamiento techado, ubicado a cinco pasos de Picacho Ajusco y tan solo a una cuadra del parque. Características: 1 recámara con baño completo y closet abierto. 1 baño completo. Cocina abierta. Balcón. Área de lavado. Calentador solar. Vista espectacular de la ciudad. 1 lugar lugar de estacionamiento techado. La propiedad no cuenta con estufa, pero tiene el espacio para que coloques la de tu preferencia. El departamento se encuentra en un primer piso y no cuenta con elevador. Ubicación: Mur cerca del Zorro Abarrotero, Mini Bodega Aurrerá, carnicería, pollería, servicios, escuelas y transporte público e tan sólo unos pasos, para que tengas todo lo que necesitas al alcance. ¡Pet friendly! Tu mascota es bienvenida. No dejes pasar esta oportunidad y agenda tu cita hoy mismo. requisitos: Pago de Póliza Jurídica con valor de $3, 074. Mes de renta corriente. Un mes de depósito. Comprobar ingresos 3 a 1, en caso de que tus ingresos no lleguen a 3 veces el valor de la renta, estos pueden ser la suma de las personas que vivirán en la propiedaden. Se deben demostrar recibos de nómina o estados bancarios de los últimos 3 meses. *En cumplimiento con las disposiciones legales, le informamos que Sparrowe by kw y kw Pedregal tiene autorización para la promoción e intermediación en la operación de venta de este inmueble. *El mobiliario y demás objetos personales y/o decorativos mostrados en las fotografías, No están incluidos en el precio de venta. *Antes de dar cualquier apartado o información personal, asegúrese de que la propiedad esté vigente, haberla visitado y estar siendo atendido por un asesor calificado. *Consulta nuestro Aviso de Privacidad en Cualquier comentario, queja o sugerencia sobre este anuncio, por favor reportarlo al correo electrónico: @kwmexico. mx. *Imágenes para uso exclusivo de Sparrowe by kw y kw Pedregal. Te invitamos a ser parte de nuestra comunidad en Facebook, Instagram y YouTube",https://www.inmuebles24.com/propiedades/clasificado/alclapin-renta-departamento-con-balcon-tlalpan-miguel-hgo.-3a-147506463.html,"MN 10,000","Carretera Picacho-Ajusco 982
Miguel Hidalgo 3A Sección, Tlalpan","76 m² lote, 1 rec., 1 baño, 1 estac.",Tlalpan
"Te presentamos un exclusivo departamento en renta, ideal para médicos que buscan comodidad y accesibilidad. Ubicado en el tranquilo Barrio del Niño Jesús, Tlalpan, este espacioso departamento de 64 metros cuadrados ofrece la combinación perfecta de privacidad y cercanía a las principales vías y servicios de la ciudad. Listo para rentar, es una oportunidad que no puedes dejar pasar. El departamento cuenta con 1 recámara que incluye vestidor y closet, 1 baño completo en la habitación, y un cuarto de lavado. La cocina está equipada con horno de gas, perfecta para los amantes de la cocina. Los pisos de madera añaden un toque elegante y cálido a cada espacio del hogar. Disfruta de la comodidad de tener un balcón para relajarte y estacionamiento para tu vehículo. La ubicación es inmejorable: accesible al tráfico, con transporte público cercano, e inmediata a tiendas, colegios, hospitales y centros médicos. Este departamento ha sido diseñado para ofrecer confort y funcionalidad. Equipado con servicios de electricidad, gas natural y agua corriente, podrás disfrutar de una vida cómoda y libre de preocupaciones. No pierdas la oportunidad de vivir en una de las zonas más tranquilas y bien conectadas de Tlalpan. ¡Contáctanos para más información y agenda una visita! Requisitos: Fiador con Bien Raíz libre de gravamen en la cdmx u obligado solidario, comprobar ingresos 3 a 1, Póliza Jurídica, un mes de depósito y la renta que corre. *Todas las imágenes mostradas en este anuncio son para fines ilustrativos, el resultado final puede variar. **Consulte el aviso de privacidad en nuestra página web",https://www.inmuebles24.com/propiedades/clasificado/alclapin-departamento-en-renta-en-el-centro-de-tlalpan-146457029.html,"MN 12,800","Cerrada de Hidalgo 21
Barrio del Niño Jesús, Tlalpan","64 m² lote, 1 rec., 1 baño, 1 estac.",Tlalpan
"Departamento en excelente ubicación. Pequeño balcónSe acepta una mascota pequeña. Renovado, iluminado con amplia estancia para sala y comedor, Disponible para 15 ó 20 de Septiembre. Cocina integral, con espacio para lavadora en cocina 3 recámaras 2 baños 1 estacionamiento en hilera de coordina con 2 vecinos Área de tendido en azoteaMantenimiento IncluídoRequisitos: 1 mes de renta, 1 mes de depósito en garantía, póliza jurídica de $4, 300 se paga la mitad",https://www.inmuebles24.com/propiedades/clasificado/alclapin-departamento-prado-coapa-1a-seccion-147528659.html,"MN 18,500","Hacienda de la Escalera 74
Prado Coapa, Tlalpan","100 m² lote, 4 rec., 2 baños, 1 estac.",Tlalpan
"Departamento en un tercer piso, con hermosa vista y muy amplio, tiene 2 recamaras con baño completo, la principal con vestidor y con bastante espacio. La estancia con mucha iluminación, cocina integral abierta, cuarto de servicio y con espacio para estacionar 5 autos. En un edificio de 3 pisos, sin elevador, con servicio de gas natural y dentro de un fraccionamiento con vigilancia, la entrada se ubica sobre la carretera Picacho Ajusco. Se puede rentar con o sin muebles, precio negociable",https://www.inmuebles24.com/propiedades/clasificado/alclapin-departamento-en-renta-en-el-ajusco-146109675.html,"MN 25,000","Picacho Ajusco 886
Héroes de Padierna, Tlalpan","200 m² lote, 2 rec., 2 baños, 5 estac.",Tlalpan
"Asesora miriam martinez mm417. En Isidro Fabela, se renta este funcional departamento de 150 m². Cuenta con 3 recámaras y 2 baños completos. La cocina integral está equipada para facilitar la preparación de alimentos. El departamento ofrece 2 lugares de estacionamiento. Además, cuenta con asador y acceso a internet/wifi. Ubicado en una zona con acceso a diversas vialidades, este departamento facilita la movilidad hacia diferentes puntos de la ciudad. En los alrededores, encontrarás supermercados, farmacias y otros servicios que simplificarán tu día a día. Isidro Fabela es una zona mixta que combina áreas residenciales con comercios locales, ofreciendo un ambiente dinámico y conveniente.",https://www.inmuebles24.com/propiedades/clasificado/alclapin-departamento-amueblado-3-recamaras-frente-a-gran-sur-147400026.html,"MN 21,900","Aguatón
Isidro Fabela, Tlalpan","150 m² lote, 3 rec., 2 baños, 2 estac.",Tlalpan
"Departamento en Fuentes del Pedregal. ¡Imagina vivir en un espacio amplio y luminoso en uno de los mejores lugares de la ciudad! Este departamento de 168 m2 cuenta con una distribución perfecta para disfrutar de la vida en familia o con amigos. Características destacadas: estancia amplia, un espacio abierto y luminoso perfecto para relajarte, leer un libro o disfrutar de una conversación con seres queridos; 3 recámaras, espacios privados y cómodos para descansar y relajarte; 2 baños completos, todo lo que necesitas para tu rutina diaria; 2 cajones de estacionamiento, espacio suficiente para tus vehículos; sala y comedor, áreas separadas para disfrutar de momentos en familia o con amigos; cocina, un espacio funcional y práctico para preparar tus comidas favoritas; iluminación natural, grandes ventanales que permiten que la luz natural inunde el departamento, creando un ambiente acogedor y alegre. Fuentes del Pedregal es un barrio exclusivo y tranquilo, con fácil acceso a servicios y amenities. Disfruta de la tranquilidad y seguridad de esta zona residencial. No te pierdas esta oportunidad de vivir en un departamento en uno de los mejores lugares de la ciudad. ¿Quieres saber más sobre este departamento o programar una visita?",https://www.inmuebles24.com/propiedades/clasificado/alclapin-excelente-departamento-fuentes-del-amor-147516039.html,"MN 26,000","Fuentes del Amor
Fuentes del Pedregal, Tlalpan","168 m² lote, 3 rec., 2 estac.",Tlalpan
"Departamento en Fuentes del Pedregal. ¡Imagina vivir en un espacio amplio y luminoso en uno de los mejores lugares de la ciudad! Este departamento de 168 m2 cuenta con una distribución perfecta para disfrutar de la vida en familia o con amigos. Características destacadas: estancia amplia, un espacio abierto y luminoso perfecto para relajarte, leer un libro o disfrutar de una conversación con seres queridos; 3 recámaras, espacios privados y cómodos para descansar y relajarte; 2 baños completos, todo lo que necesitas para tu rutina diaria; 2 cajones de estacionamiento, espacio suficiente para tus vehículos; sala y comedor, áreas separadas para disfrutar de momentos en familia o con amigos; cocina, un espacio funcional y práctico para preparar tus comidas favoritas; iluminación natural, grandes ventanales que permiten que la luz natural inunde el departamento, creando un ambiente acogedor y alegre. Fuentes del Pedregal es un barrio exclusivo y tranquilo, con fácil acceso a servicios y amenities. Disfruta de la tranquilidad y seguridad de esta zona residencial. No te pierdas esta oportunidad de vivir en un departamento en uno de los mejores lugares de la ciudad. ¿Quieres saber más sobre este departamento o programar una visita?",https://www.inmuebles24.com/propiedades/clasificado/alclapin-excelente-departamento-fuentes-del-amor-147629022.html,"MN 28,000","Fuentes del Amor
Fuentes del Pedregal, Tlalpan","168 m² lote, 3 rec., 2 estac.",Tlalpan
"Bonito departamento en renta en Avenida Fuentes Brotantes, frente al Parque Nacional Fuentes Brotantes, al sur de la Ciudad de México. Es amplio, luminoso, está a 10 minutos de la Avenida Insurgentes Sur. Cuenta con: * 1 cajón privado y cercado de estacionamiento. * Jardin en las áreas comunes del edificio. * Cuarto de lavado pequeño. * Closet cerrado en las 2 recámaras. * Puerta de la cocina tipo granero. Ideal para familias pequeñas o parejas. Se aceptan mascotas pequeñas y medianas.",https://www.inmuebles24.com/propiedades/clasificado/alclappa-departamento-en-renta-147443459.html,"MN 10,500","Avenida Fuentes Brotantes
Miguel Hidalgo, Tlalpan","74 m² lote, 2 rec., 1 baño, 1 estac.",Tlalpan
"1 recámara con cama y clóset. 1 sala acogedora con muebles modernos. Comedor para 2-4 personas. Cocina integral equipada (estufa, refrigerador, microondas) 1 baño completo. 1 espacio de estacionamiento. Pequeño patio privado. Servicios básicos disponibles. Se aceptan mascotas (De piso a Lomo 40cm). Disponible de inmediato. Renta mensual: $14, 000 sin amueblar y 15, 000 amueblado. Contáctanos para más información o agendar una cita: Teléfono / WhatsApp: Ver datos. Correo electrínico: Ver datos",https://www.inmuebles24.com/propiedades/clasificado/alclappa-loft-amueblado-147607659.html,"MN 14,000","Guadalupe Victoria 7
Tlalpan, Tlalpan","50 m² lote, 1 rec., 1 baño",Tlalpan
