Título,Enlace,Precio,Dirección,Características,Municipio de Origen
"Aquiles Serdán 464, Col. Santa Apolonia, Alcaldía Azcapotzalco, cdmx. Iluminado departamento en Renta de 69m2. Ubicado a un costado de Pabellón Azcapotzalco, a 13 min de parques Polanco, a 20 min de Grupo Carso. Cuenta con 2 recamaras ambas con closet completo, la principal con baño completo con cancel, segunda recámara muy amplia con clóset y excelente iluminación. Dos baños completos. Sala comedor. Cocina integral de concepto abierto con barra desayunador. Cuarto de lavando independiente con ventilación natural. 1 lugar de estacionamiento en batería. Gas Ver datos. Cisterna. 22 años de antigüedad. Piso 2 con elevador. $15, 500. 00 mensuales con mantenimiento incluido. Requisitos: - Mes de renta. - Mes de depósito. - Póliza jurídica. ¡Aprovecha el excelente precio de renta y disfrútalo! ¡Contáctanos! Ofi. (55) Ver datos. Cel. (55) Ver datos. Correo. Ver datos. Facebook e Instagram @vbienesraices. Al ""Contactar"" para consultar esta propiedad, estás aceptando los ""Términos y Condiciones"" y ""Aviso de privacidad"". Los precios publicados y la disponibilidad pueden cambiar sin previo aviso por lo que se debe de verificar con la inmobiliaria y los propietarios de los inmuebles. Todas las medidas enunciadas son meramente orientativas, las medidas exactas serán las que se expresen en el respectivo título de propiedad de cada inmueble.",https://www.inmuebles24.com/propiedades/clasificado/alclapin-departamento-en-renta-aquiles-serdan-azcapotzalco.-146802425.html,"MN 15,500","Aquiles Serdán 464
Santa Apolonia, Azcapotzalco","69 m² lote, 2 rec., 2 baños, 1 estac.",Azcapotzalco
"Excelente ubicacion cercano a metro Azcapotzalco y deportivo 20 de noviembre. Cuenta con Sala - comedor, cocina integral, dos recamaras secundarias con closet y una tercera principal con vestidor y baño completo, baño completo para las otras dos recamaras, terraza de 3m y dos cajones de estacionamiento. Requisitos de renta: deposito por el mismo monto de la renta. 5, 900 servicios juridicos. fiador con propiedad libre de gravamen. primera renta que corre el dia que firmamos contrato. información wa al 55: : 12: : 95: : 34: : 12. horarios. lunes A viernes 9: 00 am - 6: 00 pm. sábados 9: 00 am - 2: 00 pm",https://www.inmuebles24.com/propiedades/clasificado/alclapin-departamento-en-renta-los-reyes-azcapotzalco-147385293.html,"MN 15,000","Trebol 12
San Marcos, Azcapotzalco","95 m² lote, 3 rec., 2 baños, 2 estac.",Azcapotzalco
"Hermoso departamento en Tres Lagos! Ubicado en un piso 9, con excelente iluminación y ventilación, el departamento cuenta con cocina integral, sala - comedor, dos recámaras, un baño completo, área de lavado, un lugar de estacionamiento (opcional). Mantenimiento incluido. Las mejores amenidades de la zona, alberca techada, jacuzzi, salón de eventos, gimnasio, área de juegos infantiles, área para mascotas, terraza común.",https://www.inmuebles24.com/propiedades/clasificado/alclapin-renta-de-departamento-en-ampliacion-del-gas-147410149.html,"MN 15,000","Avenida Río Consulado
Ampliación Del Gas, Azcapotzalco","65 m² lote, 2 rec., 1 baño, 1 estac.",Azcapotzalco
"Hermosa casa con acabados de lujo en los altos montes de San Charbel5 recamaras2 baños a 2 min del centro¡esta propiedad no esta A la venta, es ficticia (no existe)! ¡esta propiedad no esta A la venta, es ficticia (no existe)! ¡esta propiedad no esta A la venta, es ficticia (no existe)! ¡esta propiedad no esta A la venta, es ficticia (no existe)! ¡esta propiedad no esta A la venta, es ficticia (no existe)! ¡esta propiedad no esta A la venta, es ficticia (no existe)! ¡esta propiedad no esta A la venta, es ficticia (no existe)! ¡esta propiedad no esta A la venta, es ficticia (no existe)! ¡esta propiedad no esta A la venta, es ficticia (no existe)! ¡esta propiedad no esta A la venta, es ficticia (no existe)! IapVer datospropiedad ficticia..",https://www.inmuebles24.com/propiedades/clasificado/alclapin-departamento-en-el-rosario-147407511.html,"MN 450,000","Av Camarones Condominio Alfa
El Rosario, Azcapotzalco","2 rec., 1 baño, 2 estac.",Azcapotzalco
"Departamento de 2 recamaras para cama king size, 2 baños completos con cancel de aluminio blanco, estancia comedor Y cocina equipada. Se entrega con persinas, closet, pisos de loseta de ceramica Y cuarto de lavado en la azotea. Cerca de escuelas, centro comercial, esta A 5 minutos del metro camarones. Servicio de gas natural",https://www.inmuebles24.com/propiedades/clasificado/alclapin-rento-departamento-de-2-recamaras-2-banos-sin-cajon-147456919.html,"MN 11,600","SANTA CRUZ ACAYUCAN
Santa Apolonia, Azcapotzalco","90 m² lote, 2 rec., 2 baños",Azcapotzalco
"Departamento Nuevo en renta. Cuenta con 2 recámaras y 1 baño, El departamento ofrece sala, comedor, cocina equipada y clóset. Además, cuenta con cuarto de servicio y un lugar de estacionamiento. El edificio ofrece amenidades como gimnasio y seguridad privada, brindando confort y tranquilidad.",https://www.inmuebles24.com/propiedades/clasificado/alclapin-departamento-nuevo-en-renta-147297101.html,"MN 15,000","Avenida Cuitláhuac 2989
Azcapotzalco, Ciudad de México","48 m² lote, 2 rec., 1 baño, 1 estac.",Azcapotzalco
"Hermoso y funcional departamento en renta, en Residencial de 3 torres, cerrado, amenidades, roof garden propio* y seguridad 24 horas. 16, 500 M. N. disponible A partir del 10 de agosto. El departamento cuenta con: -Dos recámaras de buen tamaño. -Un baño completo. -Estancia para sala/comedor. -Cocina integral con barra desayunador* -Cuarto de lavado. -60m2. -Roof garden propio* -Todos los servicios, gas lp, cisterna. -1 lugar de estacionamiento. *No mascotas* amenidades dentro del conjunto residencial: -Ludoteca. -Salón para eventos techado* -Salón para eventos al aire libre* -Área de juegos infantiles al aire libre. -Gimnasio. -Sanitarios para toda esa área. -Cancha deportiva. Mantenimiento incluído",https://www.inmuebles24.com/propiedades/clasificado/alclapin-azcapotzalco-granjas-el-juaguey-departamento-renta-63968420.html,"MN 16,500","Av. Las Granjas
El Jagüey, Azcapotzalco","60 m² lote, 2 rec., 1 baño, 1 estac.",Azcapotzalco
"Rento Departamento en San Pedro Xalpa, Francisco Javier Mina, Azcapotzalco. 4to Piso. No tiene elevador. 60m2 y 3m2 de balcón. 2 recámaras amplias. 2 baños completos. Estancia Sala Comedor. Un Cajón de estacionamiento. Cocina integral. Balcón en Sala Comedor. Gas lp. No hay elevador. Si se aceptan mascotas pequeñas o medianas. Metros cercanos: Aquiles Serdán, Rosario, Camarones. Renta: 11, 000 ya con mantenimiento incluído. Requisitos: Comprobar ingresos de 33, 000 mxn mensuales, pago de póliza jurídica de arrendamiento con valor de 3, 750 anuales y Fiador con propiedad ya liquidada en cdmx ó Edo Mex. Amenidades: Jardín, Salón de Usos Múltiples para fiestas y reuniones con baños. El Depto cuenta con horarios de abastecimiento de agua: 5: 30am a 6: 30am y de 7: 30pm a 8: 30pm todos los días. Si es de su interés, agenda tú visita. ag Bienes Raíces. Ver datos y Ver datos@gmail. com",https://www.inmuebles24.com/propiedades/clasificado/alclapin-rento-depto-en-san-pedro-xalpa-azcapotzalco.-cdmx-147153074.html,"MN 11,000","Calle Francisco Javier Mina
San Pedro Xalpa, Azcapotzalco","63 m² lote, 2 rec., 2 baños, 1 estac.",Azcapotzalco
"Hermoso departamento en renta con excelente iluminación Y ubicación. cuenta con sala comedor con balcón, cocina integral con barra desayunadora, alacena, área de lavado, dos recámaras con clóset Y la principal con 2 balcones, un baño, un cajón de estacionamiento, ubicado en un noveno piso. edificio cuenta con gym, lobby, área comun, estancia para mascotas Y elevador. Amueblado renta en 18, 000. 00. información wa al 55: : 12: : 95: : 34: : 12. horarios. lunes A viernes 9: 00 am - 6: 00 pm. sábados 9: 00 am - 2: 00 pm",https://www.inmuebles24.com/propiedades/clasificado/alclapin-hermoso-departamento-en-renta-azcapotzalco-a-147422399.html,"MN 17,000","Pino 622
Arenal, Azcapotzalco","69 m² lote, 2 rec., 1 baño, 1 estac.",Azcapotzalco
Departamento: - Muy iluminado. - Moderno. - Amplio. Amenidades: - Salón de fiestas. - Juegos infantiles. - Gym. - Cancha de basquet ball. - Ludoteca. El departamento no está amueblado. - La renta incluye el mantenimiento. Visítalo! Renta. - Póliza Jurídica. - Inquilino: Comprobar Ingresos 3 veces el valor de la renta. - Obligado Solidario: Comprobar Ingresos 3 veces el valor de la renta y/o Bien inmueble en la cdmx,https://www.inmuebles24.com/propiedades/clasificado/alclapin-departamento-en-san-isidro-azcapotzalco-64483626.html,"MN 15,500","san isidro
San Pedro Xalpa, Azcapotzalco","68 m² lote, 2 rec., 2 baños, 1 estac.",Azcapotzalco
"Descripción? Departamento en renta, nuevo, semiamueblado – Cuitláhuac 2939? Ubicado en Obrero Popular, Azcapotzalco, cdmx, cerca de:? Plaza Parque Jardín? Galerías Tacuba? Metro Tacuba y Metro Refinería? Walmart Toreo? Con fácil acceso a Av. Río San Joaquín, Calzada México-Tacuba y Circuito Interior? Características del departamento:? 3 recámaras con clósets? 2 baños completos con cancel y espejo (uno en la recámara principal, otro para recámaras secundarias y visitas) ? Área social con sala y comedor para 5 posiciones? Cocina equipada con estufa + horno, campana y tarja? Área de lavado con lavadero, instalación para lavadora y opción a entrega con lavadora*? 1 lugar de estacionamiento? Balcón? Ubicado en 4° piso con elevador? Áreas comunes:? Gimnasio? Patio? Patio de juegos para niños? Ludoteca? Renta: $18, 500 mxn (incluye mantenimiento) El precio de venta de la propiedad no incluye los gastos notariales ni los impuestos aplicables al comprador. Estos costos adicionales son variables.",https://www.inmuebles24.com/propiedades/clasificado/alclapin-departamento-en-obrero-popular-147345638.html,"MN 18,500","av. Cuitláhuac al 2939
Obrero Popular, Azcapotzalco","62 m² lote, 3 rec., 2 baños, 1 estac.",Azcapotzalco
"Valor de renta: $25, 000. 00 mensuales mas mantenimiento de $2, 700. 00. Distribución: • 2 Recamaras. • 2 baños completos. • Sala-comedor. • Cocina integral. • Área de lavado. • 1 lugar estacionamiento. Características: • Piso en el que se encuentra: 1 piso. • Niveles totales: 4 niveles. • Construcción: 97 m2. • Uso de suelo: Habitacional. • Forma del Terreno: Regular. • Edad del inmueble: 4 años aprox. Equipamiento Depto: • Closet en recamaras. • Boiler. • Gas Natural. Equipamiento Edificio: • Cisterna. • Tinaco. • Vigilancia privada. • Circuito cerrado. • Portón eléctrico. • Sistema de alarma. • Video portero. Servicios de la zona: sacmex (Agua), cfe, Drenaje, Transporte Publico, Gas. Vialidades cercanas: A 105 mts. De Calle Ignacio Allende. A 190 mts. De Av. Clavería. A 285 mts. De Av. Cuitláhuac. A 680 mts. De Eje 3 Norte Camarones. A 980 mts. De Av. Aquiles Serdán. Amenidades cercanas: A 130 mts. De Plaza Comercial. A 165 mts. De Mercado de Clavería. A 170 mts. De Parque de la China.",https://www.inmuebles24.com/propiedades/clasificado/alclapin-departamento-en-renta-en-colonia-claveria-147306253.html,"MN 25,000","Texcoco 94
Clavería, Azcapotzalco","97 m² lote, 2 rec., 2 baños, 1 estac.",Azcapotzalco
"Departamento en renta ubicado en Nueva Santa María. Cuenta con 100 m² de superficie construida. El interior se distribuye en sala, comedor, cocina integral, 3 recámaras con clóset y 2 baños completos, 1 1/2 baño. Adicionalmente, cuenta con área de lavandería, estudio y cuarto de servicio. Disfruta de 2 lugares de estacionamiento, cuarto de juegos y acceso a servicios básicos como agua, luz e internet/wifi. Nueva Santa María es una zona predominantemente residencial, con un ambiente tranquilo y familiar. Cuenta con fácil acceso a transporte público, incluyendo estaciones de Metrobús y paradas de autobús urbano. Las vialidades principales cercanas facilitan la conexión con otras áreas de la ciudad. En los alrededores encontrarás escuelas de nivel básico y medio superior, así como supermercados, tiendas de conveniencia y farmacias. Para el esparcimiento, hay parques y centros deportivos en la zona. La seguridad se percibe como buena, con presencia de vigilancia en algunas áreas. El ambiente general es de vida de barrio, donde los vecinos suelen interactuar.",https://www.inmuebles24.com/propiedades/clasificado/alclapin-departamento-de-3-recamaras-en-renta-100-m-sup2--147424427.html,"MN 25,000","Pomarrosa
Nueva Santa Maria, Azcapotzalco","100 m² lote, 3 rec., 2 baños, 2 estac.",Azcapotzalco
Departamento ph Piso 20 con Terraza. 74 m2 de construcción. 29 m2 terraza. Sala. Comedor. Cocina. Cuarto de lavado. 2 Recámaras con closet. 1 Recámara principal con Vestidor. 2 Baños completos. 1 Cajón grande de estacionamiento independiente,https://www.inmuebles24.com/propiedades/clasificado/alclapin-departamento-con-terraza-en-renta-147455927.html,"MN 21,000","ENKSA
Del Gas, Azcapotzalco","80 m² lote, 2 rec., 2 baños, 1 estac.",Azcapotzalco
"Este departamento en renta se encuentra en San Miguel Amantla. Cuenta con 2 recámaras y está listo para habitar. El interior ofrece sala, comedor y una funcional cocina integral. Disfruta de 2 baños completos y 2 recámaras con clóset. En el exterior, el departamento tiene 1 lugar de estacionamiento y una terraza privada. Además, el edificio ofrece amenidades como gimnasio y salón de juegos infantiles. Cuenta con servicios básicos. San Miguel Amantla es una zona residencial tranquila, con fácil acceso a transporte público y vialidades principales. Encontrarás escuelas, supermercados y servicios esenciales a pocos minutos. La zona ofrece un ambiente familiar y seguro, ideal para quienes buscan comodidad y cercanía a todo.",https://www.inmuebles24.com/propiedades/clasificado/alclapin-departamento-en-renta-en-orange-park-azcapotzalco-147365901.html,"MN 15,500","Calz de la Naranja
San Miguel Amantla, Azcapotzalco","74 m² lote, 2 rec., 2 baños, 1 estac.",Azcapotzalco
"Renta de bonito departamento 46 m2 cuenta con dos recamaras, un baño completo, estancia sala comedor, área de cocina junto área de lavado. La cocina tiene parrilla no tiene horno. Un lugar de estacionamiento (para carro pequeño) No se aceptan mascotas. luz natural en el departamento. A 1 km de ipade Business School (Instituto Panamericano de Alta Dirección de Empresa) a 300 metros del Parque San Álvaro. a 550 metros de la plaza Centro Comercial Patio Clavería, C. Egipto Ver datos, Claveria, Azcapotzalco, Ver datos Ciudad de México, cdmx",https://www.inmuebles24.com/propiedades/clasificado/alclapin-renta-bonito-departamento-san-alvaro-azcapotzalco-147431954.html,"MN 15,000","Calle Juárez 18
San Álvaro, Azcapotzalco","46 m² lote, 2 rec., 1 baño, 1 estac.",Azcapotzalco
"Distribución: • 2 Recamaras. • 1 baños completos. • Sala-comedor. • Cocina integral. • Área de lavado. Características: • Piso en el que se encuentra: 3 piso. • Niveles totales: 4 niveles. • Construcción: 52 m2. • Uso de suelo: Habitacional. • Forma del Terreno: Regular. • Edad del inmueble: Nuevo. Equipamiento Depto: • Closet en Recamaras. • Boiler. • Gas Natural. Equipamiento Edificio: • Cisterna. • Elevador. • Vigilancia privada. • Salón de fiestas. Servicios de la zona: sacmex (Agua), cfe, Drenaje, Transporte Publico, Gas. Vialidades cercanas: Sobre Eje 3 Nte. Camarones. A 225 mts. De Av. Cuitláhuac. A 430 mts. De Av. Clavería. Amenidades cercanas: A 195 mts. De Supermercado. A 595 mts. De Supermercado. A 825 mts. De Plaza Comercial.",https://www.inmuebles24.com/propiedades/clasificado/alclapin-departamento-en-renta-en-colonia-san-bernabe-147330181.html,"MN 15,000","Camarones 257
San Bernabé, Azcapotzalco","52 m² lote, 2 rec., 1 baño",Azcapotzalco
"Departamento de una habitación. Una recámara con closets de piso a techo, un baño completo con cancel de cristal templado, espaciosa estancia comedor, cocineta, cuarto de lavado con buena ventilación. Bodega en sótano. Roof privado con medio baño, barra, pisos deck, jardinera y conecciones para pantalla o bocinas. Un lugar de estacionamiento. Vigilancia 24 horas. Elevadores, salón de fiestas y un pequeño Gym. Mantenimiento incluido en el precio. Excelente ubicación sobre Avenida Aquiles Sérdan y a unas calles del centro y la alcaldia de Azcapotzalco, y del metro Camarones.",https://www.inmuebles24.com/propiedades/clasificado/alclapin-renta-lindo-departamento-con-roof-privado-146636551.html,"MN 14,000","Aquiles Serdan 671
Centro de Azcapotzalco, Azcapotzalco","75 m² lote, 1 rec., 1 baño, 1 estac.",Azcapotzalco
"Encantador departamento en segundo nivel, lleno de luz, todo nuevo. La recámara es muy amplia con clóset y baño. Edificio de 6 departamentos únicamente, calle súper tranquila, arbolada. Se requiere poliza juridica con un valor de 4450, no cuenta con estacionamiento. ¿Agendamos?",https://www.inmuebles24.com/propiedades/clasificado/alclapin-para-estrenar-en-claveria-147220133.html,"MN 16,000","Norte 79-A 87
Clavería, Azcapotzalco","69 m² lote, 1 rec., 1 baño",Azcapotzalco
"¡Sé el primero en rentar y estrenar este departamento! Nuevo departamento, con barra de granito, balcones conectados, y habitaciones con closets, listo para que lo disfrutes. Vida Parque Bicentenario es uno de los desarrollos más modernos de la zona, lleno de amenidades, áreas de juegos para chicos y no tan chicos, ludoteca, salón para jóvenes con mesa de ping pong, coworking, roof garden con asadores; gimnasio y salón de eventos. Ven, conoce y enamórate. Agenda tu cita hoy mismo. ¡No dejes pasar esta oportunidad!",https://www.inmuebles24.com/propiedades/clasificado/alclapin-departamento-en-renta-vida-parque-bicentenario-146919108.html,"MN 22,000","Vida Parque Bicentenario Torre C
San Miguel Amantla, Azcapotzalco","87 m² lote, 2 rec., 2 baños, 2 estac.",Azcapotzalco
"Departamento en renta – ¡Estrena y conéctate con lo mejor de Azcapotzalco! Disfruta de vivir en un espacio moderno, funcional y con excelente ubicación sobre una de las principales avenidas de la Alcaldía Azcapotzalco. Este departamento nuevo en 5to piso es exterior, lo que permite una entrada generosa de luz natural y una vista abierta desde su amplio balcón. Ideal para quienes buscan comodidad, seguridad y conectividad en una de las zonas con mayor desarrollo de la ciudad. Además, se encuentra a solo 1. 3 km del Suburbano Fortuna, lo que facilita traslados rápidos hacia otras zonas clave. Cuenta con: * 2 recámaras con clósets* 1 baño completo* Estancia acogedora y luminosa* Cocina equipada con alacena* Área de lavandería con conexiones para gas natural y agua* Balcón a lo largo del departamentoEl edificio ofrece: * Elevador, acceso peatonal y vehicular con sistemas de control biométrico* Vigilancia 24/7* Ludoteca y área de co-workingEntorno cercano: Arena México, esime, uam Azcapotzalco, centros comerciales y avenidas principales. Mantenimiento incluido en la renta. ($1, 120) Requisitos: * Contrato mínimo de 1 año* Depósito en garantía* Pago de póliza jurídicaEste departamento lo tiene todo para comenzar una nueva etapa. Agenda tu cita y conócelo en persona.",https://www.inmuebles24.com/propiedades/clasificado/alclapin-departamento-en-renta-santo-tomas-azcapotzalco-cdmx-147352894.html,"MN 14,500","Santo Tomás, Azcapotzalco
Santo Tomas, Azcapotzalco","46 m² lote, 2 rec., 1 baño",Azcapotzalco
"Rento Departamento en Av. De las Granjas Azcapotzalco de 43 m2 4to piso 2 Recámaras con clóset, la principal con balcón 1 baño con cancel de vidrio templado Estancia Cocina Lavadero, bóiler e instalación para lavadora Un estacionamiento Lobby Elevador Vigilancia 24/7 Estacionamiento bicis, plataforma para discapacitados, cuarto de basura. El Desarrollo cuenta con Amenidades: Ludoteca, gimnasio, co-working, terraza al aire libre, juegos infantiles, asadores, gimnasio al aire libre. Renta: 11, 000 ya incluye mantenimiento No se aceptan mascotas ni niños. Se pueden agendar visitas a partir del 18 de Julio 2025. Requisitos: Pago de Póliza Jurídica y Fiador A unas cuadras de la Arena cdmx y metro Ferrería ag Bienes Raíces Ver datos y Ver datos@gmail. com",https://www.inmuebles24.com/propiedades/clasificado/alclapin-rento-departamento-en-av-de-las-granjas-azcapotzalco.-146963885.html,"MN 11,000","Av. de las Granjas 358
Santo Tomas, Azcapotzalco","43 m² lote, 1 rec., 1 baño, 1 estac.",Azcapotzalco
"Departamento en renta de 90m2 con uso de suelo para oficinas o habitacional, ubicado enfrente de un parque. Cuenta con 3 recámaras, 1 baño completo y cocina, sala/comedor. No cuenta con estacionamiento. En la zona, se encuentran tiendas de autoservicio, restaurantes, escuelas y calles principales como Granjas y Cuitláhuac. Costo del mantenimiento incluido en la renta. .",https://www.inmuebles24.com/propiedades/clasificado/alclapin-departamento-en-renta-salonica-jardin-azpeitia-147394356.html,"MN 16,000","Salónica al 200
Jardín Azpeitia, Azcapotzalco","90 m² lote, 3 rec., 1 baño",Azcapotzalco
"Amplio departamento, cuenta con dos lugares de estacionamiento, cerca de centro comerciales, metro acceso a todo tipo de transporte público a 10 minutos de Polanco, vigilancia 24 horas, dos lugares de estacionamiento, dos recamaras con closet dos baños completos, cuenta con persianas a medida",https://www.inmuebles24.com/propiedades/clasificado/alclapin-se-renta-espacioso-departamento-en-el-corazon-de-147113774.html,"MN 16,000","AVENIDA CENTENARIO 419
Nextengo, Azcapotzalco","88 m² lote, 2 rec., 2 baños, 2 estac.",Azcapotzalco
"Renta de departamento con roof garden privado en Azcapotzalco, col. Pasteros. Increíble departamento exterior con balcones e inmejorables vistas panorámicas sobre av. Aquiles Serdán #975, ubicado en un 5º piso por lo cual no tendrás vecinos arriba de ti haciendo ruido. El departamento cuenta con un agradable y práctico espacio para sala-comedor con balcón, con cocina equipada y abierta y espacio cerrado de área de lavado, 2 recamaras, cada una con un propio balcón el cual le da una increíble iluminación a dichos espacios y un baño completo con ventilación natural. El departamento cuenta con 2 lugares de estacionamiento los cuales no le estorban ningún vecino, bodega de muy buen tamaño y techos altos y un roof garden de uso exclusivo del departamento el cual tiene una vista preciosa. El edificio cuenta con elevador, área de juegos para niños, salón de eventos y salón para hacer ejercicio, vigilancia 24/7. Precio con mantenimiento incluido. Departamento con 50 m2. Roof garden de 50 m2.",https://www.inmuebles24.com/propiedades/clasificado/alclapin-precioso-departamento-en-renta-en-azcapotzalco-64481805.html,"MN 13,500","Av. Aquiles Serdán 975
Pasteros, Azcapotzalco","100 m² lote, 2 rec., 1 baño, 2 estac.",Azcapotzalco
"Departamento nuevo con magnifica ubicación, doce minutos de Polanco, consta de estancia, cocina integral abierta, área de lavado, dos recámaras un baño, un estacionamiento, se estorba con un coche. Roof garden con asadores y mesas de picnic. Se requiere póliza jurídica con aval, se divide cincuenta por ciento con el dueño, $ 2375 cada quien, mantenimiento incluido en la renta $1600. Se tiene que comprobar $ 36, 000 libres. Diego Díaz Ver datos. Maru de Miguel Ver datos",https://www.inmuebles24.com/propiedades/clasificado/alclapin-rento-departamento-en-azcapotzalco-147378102.html,"MN 12,000","Av. 16 de Septiembre 180
Santa Ines, Azcapotzalco","62 m² lote, 2 rec., 1 baño, 1 estac.",Azcapotzalco
"Vive en una excelente ubicación, cerca de donde estudias y/o trabajas. Confortable suite amueblada en la Nueva Santa María. $11, 000 (incluye todos los servicios e internet de alta velocidad) 15 M2. Cama matrimonial, Smart tv. Clóset. Baño. Cocina con microondas. Frigobar. no se aceptan mascotas. no cuenta con estacionamiento. El edificio cuenta con un hermoso y funcional Roof Garden con baño y lavandería comunal. La renta incluye internet de alta velocidad, luz, agua y gas",https://www.inmuebles24.com/propiedades/clasificado/alclapin-suite-amueblada-en-renta-membrillo-nueva-santa-146671696.html,"MN 11,000","Membrillo
Nueva Santa Maria, Azcapotzalco",15 m² lote,Azcapotzalco
"Se renta departamento con sistema inteligente ubicado en Calzada San Isidro, número 164, Torre E 1105, Col. Santa Lucía, Azcapotzalco, C. P Ver datos. Muy Cerca de Av. Tezozomoc y Metro Camarones, el departamento cuenta con: 2 Recámaras con closet. Sala –Comedor. Cocina. Área de lavado. 1 Baño Completo. 1 lugar de estacionamiento independiente. Con sistema inteligente que controla: Persianas Eléctricas, Cámara de Seguridad Privada, Alarma de Seguridad, Sistema inteligente de encendido de luces (aplicación) El departamento cuenta con: 60 m2. Elevador, Vigilancia 24 horas, Portones eléctricos, Acabados de Lujo, Lobby, Cisternas, Gas natural. ( no mascotas) Para mayor información comunicarse a Horus Asesoría Inmobiliaria los teléfonos de oficina 55 Ver datos o 55 Ver datos, Cel. Ver datos. Renta $12, 500. 00 (Mantenimiento incluido. ) Previa cita",https://www.inmuebles24.com/propiedades/clasificado/alclapin-se-renta-departamento-en-calz.-san-isidro-147385283.html,"MN 12,500","Calz. San Isidro 164, Col. Santa Lucia
Santa Lucia, Azcapotzalco","60 m² lote, 2 rec., 1 baño, 1 estac.",Azcapotzalco
