Título,Enlace,Precio,Dirección,Características,Municipio de Origen
"Vive en un espacio moderno, funcional y lleno de luz en el corazón de Ampliación del Gas. Este depa de 2 recámaras, ubicado en el 4o piso de un edificio recién construido, te ofrece todo lo necesario para comenzar una nueva etapa con comodidad y estilo. Disfruta de un balcón privado, cocina integral equipada y área de lavado, en un ambiente pet friendly y con acceso universal. Las amenidades son uno de sus grandes atractivos: gimnasio, sala de coworking interior y exterior, roof garden comunitario, salón de yoga, ludoteca, espacio para jóvenes y salón para eventos. Ideal para quienes buscan equilibrio entre vida personal y profesional. Cuenta con 1 lugar de estacionamiento techado. A un paso de vías principales y zonas comerciales, este depa está disponible de inmediato. Agenda tu visita hoy mismo y descubre por qué este lugar puede ser tu nuevo hogar. Con Homie renta sin aval. Proceso 100% digital. Tú eliges cómo pagar la renta a través de diferentes formas de pago. ¡Conoce ya este depa e independízate de las tareas de rentar! Departamento de 53. 0 metros cuadrados cuenta con: - 2 habitaciones. - 1. 0 baño. - Se aceptan mascotas. - 1 lugar de estacionamiento. Características: - Cuarto de lavado. - Cocina integral. - Acceso universal. Amenidades: - Gimnasio. - Seguridad. - Elevador. - Salón de fiestas. Antigüedad: Por estrenar. Número de habitantes recomendado: 4. Disponibilidad para mostrar: 30/agosto/2025. Disponibilidad para habitar: 30/agosto/2025. ¡Enamórate de tu vida en este departamento! # Homie Id: 9_5_3_1_7. Estos son los beneficios que tienes como inquilino al rentar tu nuevo hogar con nosotros: * No necesitas aval (sujeto a Términos y Condiciones). * Realiza el pago de tu renta mediante transferencia digital en nuestra plataforma o en efectivo en miles de locales disponibles. * Asistencia y conciliación con tu propietario. * Proceso sin burocracia, renta en cuestión de horas y sin trámites complicados. * Descuentos exclusivos en mudanzas, muebles y más. * Firma tu contrato de forma digital.",https://www.inmuebles24.com/propiedades/clasificado/alclapin-departamento-en-renta-en-colonia-del-gas-95317-147454649.html,"MN 16,000","Calle Sabino
Del Gas, Azcapotzalco","53 m² lote, 2 rec., 1 baño, 1 estac.",Azcapotzalco
"Departamento en Renta de 66 m2 en planta baja (solo para una persona hombre). Cuenta con 1 recamara con closet, baño completos, sala, comedor, cocina y zotehuela sin estacionamiento. Cerca de escuelas, plazas comerciales y transporte publico.",https://www.inmuebles24.com/propiedades/clasificado/alclapin-departamento-en-renta-en-calz-renacimiento-colonia-147418229.html,"MN 8,500","Calz Renacimiento
Petrolera, Azcapotzalco","66 m² lote, 1 rec., 1 baño",Azcapotzalco
"Ubicado en Av. Cuitláhuac, este depa de 70 m² combina funcionalidad, diseño moderno y una excelente ubicación en el corazón de Azcapotzalco. Se encuentra en el 3er piso de un edificio nuevo con elevador, lobby, gimnasio, ludoteca, terraza y jardín, perfecto para quienes buscan comodidad en un entorno bien conectado. Cuenta con 3 recámaras, 2 baños completos, cocina integral con persianas, cuarto de lavado, balcón privado y 1 lugar de estacionamiento (compartido en batería con una sola persona). Ideal para familias o profesionistas, con capacidad máxima para 4 personas. No se aceptan mascotas. El edificio incluye acceso universal para mayor accesibilidad. A solo 15 minutos caminando del Metro Cuitláhuac, con acceso rápido a Av. México-Tacuba y Eje 3 Norte. La renta mensual es de $22, 500 con mantenimiento incluido. ¡Agenda una visita y conoce tu nuevo hogar! Con Homie renta sin aval. Proceso 100% digital. Tú eliges cómo pagar la renta a través de diferentes formas de pago. ¡Conoce ya este depa e independízate de las tareas de rentar! Departamento de 70. 0 metros cuadrados cuenta con: - 3 habitaciones. - 2. 0 baños. - 1 lugar de estacionamiento. Características: - Balcón. - Jardín. - Terraza. - Cocina integral. - Cuarto de servicio. Amenidades: - Lobby. - Gimnasio. - Seguridad. - Elevador. Antigüedad: Por estrenar. Número de habitantes recomendado: 4. Disponibilidad para mostrar: 24/junio/2025. Disponibilidad para habitar: 24/junio/2025. ¡Enamórate de tu vida en este departamento! # Homie Id: 9_4_7_2_2. Estos son los beneficios que tienes como inquilino al rentar tu nuevo hogar con nosotros: * No necesitas aval (sujeto a Términos y Condiciones). * Realiza el pago de tu renta mediante transferencia digital en nuestra plataforma o en efectivo en miles de locales disponibles. * Asistencia y conciliación con tu propietario. * Proceso sin burocracia, renta en cuestión de horas y sin trámites complicados. * Descuentos exclusivos en mudanzas, muebles y más. * Firma tu contrato de forma digital.",https://www.inmuebles24.com/propiedades/clasificado/alclapin-departamento-con-balcon-en-la-obrera-popular-94722-146772939.html,"MN 16,650","Avenida Cuitláhuac
Obrero Popular, Azcapotzalco","70 m² lote, 3 rec., 2 baños, 1 estac.",Azcapotzalco
"Ref: 2 5 0 1 0 1. Se renta amplio departamento en San Pedro Xalpa, Azcapotzalco, Ciudad de México. Este inmueble cuenta con 3 recamaras, 2 baños y 85 m2 de construcción, ideal para familias que buscan un espacio cómodo y funcional. El departamento se encuentra en una zona de uso de suelo Residencial, lo que garantiza tranquilidad y seguridad para sus residentes. Además, el edificio ofrece amenidades como Gimnasio, Salón de Fiestas, Elevadores y Área de juegos infantiles, brindando comodidad y entretenimiento a sus habitantes. La ubicación estratégica de este departamento brinda acceso a diversas zonas de interés cercanas, como el Centro Comercial Parque Tezontle, el Parque Tezozómoc y la Macroplaza. Con respecto a las vías de acceso, el departamento se encuentra cerca de importantes avenidas como Av. Tezozomoc, Av. Aquiles Serdán y Av. Cuitláhuac, así como de la estación de metro Aquiles Serdán. Esto facilita la movilidad de los residentes hacia diferentes puntos de la ciudad. No pierdas la oportunidad de vivir en este cómodo y completo departamento en una de las zonas con mayor crecimiento y desarrollo de la Ciudad de México. *El departamento se renta sin muebles.",https://www.inmuebles24.com/propiedades/clasificado/alclapin-departamento-en-renta-en-residencial-corintio-calzada-146523629.html,"MN 18,500","Calzada San Isidro 768
San Pedro Xalpa, Azcapotzalco","85 m² lote, 3 rec., 2 baños, 1 estac.",Azcapotzalco
"Se renta departamento semi amueblado o sin amueblar, de 90 m2, tiene 3 recámaras con clóset, dos baños completos, sala, comedor, cocina integral, área de lavado integrada al departamento con lavasecadora de 20 kilos, un lugar de estacionamiento. El departamento se encuentra en tercer piso, el edificio cuenta con seguridad las 24 horas, se encuentra a 10 minutos caminando del metro camarones, cerca de plazas, mercado, bancos y avenidas principales como Camarones y Aquiles Serdán, y a 20 minutos en coche de Polanco. Inmobiliarias No se comparte comisión",https://www.inmuebles24.com/propiedades/clasificado/alclapin-departamento-muy-bien-ubicado-en-azcapotzalco-144035668.html,"MN 19,000","Miguel Hidalgo 21
Centro de Azcapotzalco, Azcapotzalco","89 m² lote, 3 rec., 2 baños, 1 estac.",Azcapotzalco
"¡ Hermoso departamento en renta en Azcapotzalco! 62 M2. 2 recámaras. 2 baños. 1 cajón de estacionamiento. Con balcón. Elevador. 1 año de antigüedad. A una cuadra de metro Aquiles Serdán y Tezozomoc. 13, 500. 00 incluye mantenimiento y agua. InformacióVer datosf",https://www.inmuebles24.com/propiedades/clasificado/alclapin--hermoso-departamento-en-renta-en-azcapotzalco!-147112907.html,"MN 13,500","Av. 16 de Septiembre 197
Santa Inés, Azcapotzalco","62 m² lote, 2 rec., 2 baños, 1 estac.",Azcapotzalco
"Ref: 2 5 4 0 2 4. Este moderno departamento en renta se encuentra en la zona de Industrial Vallejo, Azcapotzalco, Ciudad de México. Con una superficie de 65 m2, cuenta con 3 recámaras, 1 baño y uso de suelo residencial, ideal para familias que buscan comodidad y seguridad. Además, en el complejo residencial se pueden disfrutar de áreas de juegos infantiles y seguridad privada las 24 horas. Entre las zonas de interés cercanas se encuentra el Parque Tezozómoc, ideal para disfrutar de actividades al aire libre en familia. Asimismo, a pocos minutos se encuentra el Centro Comercial Town Center El Rosario, donde se pueden encontrar diversas tiendas, restaurantes y entretenimiento. Por otro lado, la Universidad Autónoma Metropolitana (uam) unidad Azcapotzalco se encuentra a corta distancia, lo que la convierte en una ubicación conveniente para estudiantes. En cuanto a las principales vías de acceso, se destaca la Avenida Cuitláhuac y la Avenida Vallejo, que permiten una rápida conexión con diferentes puntos de la ciudad. Además, la estación del metro Tezozómoc se encuentra a poca distancia, facilitando el transporte público para los residentes. Con una ubicación estratégica y amenidades que ofrecen comodidad y seguridad, este departamento en renta es una excelente opción para quienes buscan un hogar en una zona con todo lo necesario al alcance.",https://www.inmuebles24.com/propiedades/clasificado/alclapin-departamento-en-renta-azcapotzalco-147121073.html,"MN 15,000","avenida ceylan 959
Industrial Vallejo, Azcapotzalco","65 m² lote, 3 rec., 1 baño, 1 estac.",Azcapotzalco
"Rar-4881 Departamento en Renta en Col. Amp. Del Gas, Azcapotzalco, cdmx. Distribución: • Sala. • Comedor. • 3 Recámaras. • 2 Baños completos. • 1 Baño completo. • 1 medio baño. • Cocina integral. • 2 lugares de estacionamiento. Características: • Superficie: 65 m2. • Forma de Terreno: Regular. • Edad: 6 años aprox. • Piso en el que se encuentra: 7 piso. • Niveles Totales: 20 niveles. • Uso de suelo: Habitacional. • Mantenimiento Incluido en la Renta. Equipamiento del Inmueble: • Gas Natural. • Boiler. • Lavadero. • Closet en recamaras. • Estufa. • Contrato cfe. Equipamiento Edificio: • Cisterna. • Bomba. • Hidroneumático. • Vigilancia privada. • Alarma. • Escaleras. • Elevador. • Recepción. • Gimnasio. • Ludoteca. • Salón Usos múltiples. • Áreas verdes. Estatus del inmueble: • Inmueble Desocupado. • Inmueble Usado. Servicios de la Zona: • Agua, • cfe, • Drenaje, • Servicios municipales, • Gas, • Transporte Publico. • Vialidades: Avenida Jardín, Circuito Interior. • A 3 km a la redonda: Plazas comerciales, Escuelas, Gasolineras, Gimnasios, Bancos, Parques. Entorno: • Habitacional.",https://www.inmuebles24.com/propiedades/clasificado/alclapin-departamento-en-renta-en-col.-amp.-del-gas-147399026.html,"MN 15,600","Av. Jardín 330, Edificio Bambú, Depto. 704
Ampliación Del Gas, Azcapotzalco","65 m² lote, 3 rec., 1 baño, 2 estac.",Azcapotzalco
"¡Descubre tu nuevo hogar en Azcapotzalco! Este encantador departamento en renta combina comodidad, practicidad y una excelente ubicación que te permitirá disfrutar de la ciudad con total facilidad. El espacio cuenta con dos acogedoras habitaciones equipadas con clósets amplios, lo que asegura orden y funcionalidad en tu día a día. La recámara principal tiene acceso a un balcón interior, un rincón perfecto para relajarte y disfrutar de momentos de tranquilidad. El departamento dispone de un baño completo, además de una cocina integral recién remodelada que se convierte en el corazón del hogar, ideal para preparar tus platillos favoritos. Para tu comodidad, también encontrarás un boiler eléctrico, un área de lavado con bodega que brinda espacio extra de almacenamiento y un lugar de estacionamiento asignado que garantiza seguridad y conveniencia. El edificio ofrece un roof garden común, un espacio al aire libre donde podrás convivir, relajarte o simplemente disfrutar de una vista despejada de la ciudad. La ubicación es inmejorable: a tan solo dos cuadras del metro Aquiles Serdán, lo que facilita la movilidad hacia cualquier punto de la ciudad. Además, estarás a 10 minutos del centro de Azcapotzalco y a solo 15 minutos de zonas tan importantes como Polanco y Lomas Verdes, donde encontrarás centros de trabajo, entretenimiento, comercios y restaurantes. Este departamento es la opción ideal si buscas un espacio cómodo, bien ubicado y con todas las comodidades para disfrutar plenamente tu estilo de vida. Con Homie renta sin aval. Proceso 100% digital y diferentes formas de pago de tu renta, tú eliges. ¡Conoce ya este depa! Estás a pocos pasos de encontrar el hogar de tus sueños. Departamento de 60. 0 metros cuadrados cuenta con: - 2 habitaciones. - 1. 0 baño. - 1 lugar de estacionamiento. Características: - Balcón. - Cuarto de lavado. - Cocina integral. Amenidades: - Salón de fiestas. Antigüedad: 3 años. . Número de habitantes recomendado: 3. Disponibilidad para mostrar: 12/septiembre/2025. Disponibilidad para habitar: 12/septiembre/2025. ¡Enamórate de tu vida en este departamento! # Homie Id: 9_1_6_5_6. Estos son los beneficios que tienes como inquilino al rentar tu nuevo hogar con nosotros: * No necesitas aval (sujeto a Términos y Condiciones). * Realiza el pago de tu renta mediante transferencia digital en nuestra plataforma o en efectivo en miles de locales disponibles. * Asistencia y conciliación con tu propietario. * Proceso sin burocracia, renta en cuestión de horas y sin trámites complicados. * Descuentos exclusivos en mudanzas, muebles y más. * Firma tu contrato de forma digital.",https://www.inmuebles24.com/propiedades/clasificado/alclapin-departamento-en-renta-en-la-preciosa-ciudad-de-144267296.html,"MN 11,700","Huitzilihuitl
La Preciosa, Azcapotzalco","60 m² lote, 2 rec., 1 baño, 1 estac.",Azcapotzalco
"Renta de habitación independiente en Nueva Santa María, Azcapotzalco Espacio privado con baño completo y acceso independiente. Cocina, comedor y área de lavado son compartidos. Se entrega con servicios incluidos: luz, agua, gas (solo cocina) e internet. Entrada con chapa digital. Nota: El baño tiene calentador de paso y usa cilindro de 10kg el único gasto. Medida del baño 2. 90 x 1. 15m2Ubicado sobre Av. Plan de San Luis, cerca de Av. Camarones, Av. Circuito Interior y Metro Normal, a 5 minutos del Casco de Santo Tomás (ipn) . Zona tranquila y bien conectada. Requisitos: Póliza jurídica ($5, 000) u obligado solidario con inmueble en cdmx ($1, 500) Restricción: Solo para dama y no se aceptan mascotas.",https://www.inmuebles24.com/propiedades/clasificado/alclapin-recamara-en-renta-nueva-santa-maria-azcapotzalco-147144085.html,"MN 6,500","Av. Plan de San Luis al 400
Nueva Santa Maria, Azcapotzalco","2 m² lote, 1 rec., 1 baño",Azcapotzalco
"Bonito departamento Remodelado en renta en Los Reyes, Azcapotzalco, cdmx, está en 4o piso sin elevador, muy iluminado, estacionamiento para un auto compartido. Vigilancia 24 hrs. Y cámaras de seguridad. Sala comedor corridos, área de cocina con tarja, alacena y estufa, área de lavado integrado, 2 recámaras con closet, un baño completo con cancel de cristal, bodega, pisos cerámicos en todo el departamento. Tiene gas natural, tinaco independiente, áreas verdes comunales. se acepta mascota pequeña. requisitos: Un mes de depósito, un mes por adelantado, Contrato por un año mínimo, inquilino y obligado solidario presentar ine y comprobante de ingresos, pago de protección jurídica anual de 3, 650",https://www.inmuebles24.com/propiedades/clasificado/alclapin-renta-depto-centro-azcapotzalco-cdmx-147381360.html,"MN 13,000","Trebol
Centro de Azcapotzalco, Azcapotzalco","70 m² lote, 2 rec., 1 baño, 1 estac.",Azcapotzalco
"Rento habitaciones en excelente ubicación, a 3 cuadras de Aquiles Serdán y a 5 minutos caminando del metro Aquiles Serdán y Tezozómoc. Cerca de plazas comerciales (Pabellón Azcapotzalco, Destino Plaza) y a poca distancia del Hospital Pemex y uam Azcapotzalco. Incluye agua, luz e internet. Solo mujeres. No se aceptan mascotas. Hay acceso a comedor, área de lavado y cocina equipada con estufa, refrigerador y microondas; espacio para guardar comida. Renta: 6, 000. Habitación chica: 4, 500.",https://www.inmuebles24.com/propiedades/clasificado/alclapin-magnifica-recamara-en-2-piso-cerca-metro-tezozomoc-147415502.html,"MN 6,500","Calle Rafael Alducin
San Juan Tlihuaca, Azcapotzalco","65 m² lote, 3 rec., 2 baños, 1 estac.",Azcapotzalco
"*departamento en renta. ¡no te lo pierdas! Departamento en renta en excelente ubicación A 15 minutos de polanco Y 5 min del circuito Y del ipn. cuenta con 2 recámaras amplias con clóset, baño, cocina integral, cuarto de servicio Y un estudio para hacer home office si asi lo requieres, Y un lugar de estacionamiento. En cuanto A la seguridad te encóntras tranquilo ya que esteconjunto habitacional cuenta con seguridad 24/7, cctv, control de acceso vehicular Y peatonal. rodeado de plazas comerciales como diagonal cuitláhuac O patio claveria, restaurantes, mercados, gym, todo A tu alcance por lo que podras dirigirte A tu lugar favorito caminando. agenda tu cita ¡ que no te lo ganen! (4)",https://www.inmuebles24.com/propiedades/clasificado/alclapin-poniente-54-4-147114005.html,"MN 14,000","PONIENTE 54
Obrero Popular, Azcapotzalco","54 m² lote, 2 rec., 1 baño, 1 estac.",Azcapotzalco
"Departamento ph con excelente ubicacion. Ubicado en la colonia Del Gas, Azcapotzalco colonia con extraordinaria ubicación en la cdmx. Características: ph exterior semi amueblado cálido e iluminado con luz natural en todas sus áreas de 101. 49 m2. Ubicado en el piso 21, en bonito conjunto de 8 edificios con elevador cada uno, sus espacios son armoniosos, se encuentra en excelentes condiciones y listo para habitarse. Consta de una muy iluminada estancia con una bonita vista panorámica, 1 recamara con baño completo y 1 estudio con closet de piso a techo. 1 baño completo de visitas, cocina abierta, área de lavado con ventilación natural. Cuenta con vigilancia de 24/7 y circuito cerrado con cctv. El edificio es de 21 niveles cada uno con 4 departamentos. Tiene gimnasio, alberca, jacuzzi y salón de usos múltiples. Estacionamiento de fácil acceso ingresas con tarjeta y huella digital para mayor seguridad. Cuenta con un lugar de estacionamiento techado. Su ubicación tiene acceso rápido a vialidades importantes. Acepta mascota pequeña",https://www.inmuebles24.com/propiedades/clasificado/alclapin-renta-de-departamento-ph-en-tres-lagos-azcapotzalco-147376157.html,"MN 18,000","Rio Consulado 800
Del Gas, Azcapotzalco","101 m² lote, 2 rec., 2 baños, 1 estac.",Azcapotzalco
"Se rentan habitaciones totalmente amuebladas exclusivamente para médicos, con excelente ubicación, a una cuadra del Hospital La Raza. Cuenta con baño común, regaderas, cocina. Incluye servicios: internet, luz, agua, gas y limpieza de áreas comunes. Requisitos: 2 Depósitos en garantía. Renta. Obligado solidario. Póliza jurídica compartida el pago. Hoja de asignación de área donde laborará en el hospital. Agende una cita para conocerlos.",https://www.inmuebles24.com/propiedades/clasificado/alclapin-renta-de-habitaciones-exclusivo-para-medicos-147422297.html,"MN 5,000","Tlaxcaltecas 50
La Raza, Azcapotzalco","12 m² lote, 1 rec., 1 baño",Azcapotzalco
"Se renta departamento en casa duplex. Para habitar en planta baja con muy buena ubicación a escasos 5 minutos del centro de Azcapotzalco, a unas cuadras del Parque Bicentenario y cerca de los Metros Refinería, Camarones y Tacuba. Bien iluminado, techos altos y áreas generosas para poder vivir muy bien. Se conforma de sala-comedor, cocina integral, estudio, sala de tv, tres recámaras la principal con baño, un baño completo mas para servicio de las otras áreas, área de lavado y patio. No dejes pasar la oportunidad de vivir en esta tradicional colonia dotada de todos los servicios, solicita tu cita con Cony Rojas 55 Ver datos.",https://www.inmuebles24.com/propiedades/clasificado/alclapin-se-renta-departamento-en-casa-duplex-63501474.html,"MN 22,000","Oasis 21-1
Clavería, Azcapotzalco","150 m² lote, 3 rec., 2 baños",Azcapotzalco
"[arr] id houm: Ver datos. Entérate de todos los beneficios al rentar con Houm: • No te pedimos aval. • Asistencia e intermediación con el propietario. • Firma tu contrato online. • Renta sin burocracia, papeleos y mucho más rápido. • Difiere tu depósito en hasta 6 meses sin interés. Departamento en renta, ubicado en la colonia Santa Apolonia, con una superficie construida de 50. 00 m² y superficie total de 50. 00 m². Sus principales características son: • Sin amueblar. • 2 recámaras. • 1 baño. • Admite mascotas. • 1 estacionamiento. • Cocina equipada. • Año de construcción: 2000. Si rentas con nosotros, te brindamos asesoría personalizada durante todo el proceso. Importante: • Se deben demostrar ingresos de 3 veces el valor de la renta. • En caso de que tus ingresos no lleguen a 3 veces el valor de la renta, estos pueden ser la suma de las personas que vivirán en la propiedad. • Te invitamos a agendar una visita a esta propiedad: esta puede ser presencial o vía streaming, desde la comodidad de tu hogar. • Y lo mejor. Sin aval. Más que una corredora, somos Houm. *Aplican T&C",https://www.inmuebles24.com/propiedades/clasificado/alclapin-departamento-en-santa-apolonia-con-2-recamaras-id:.-145329111.html,"MN 10,500","Santa Cruz Acayucan
Santa Apolonia, Azcapotzalco","50 m² lote, 2 rec., 1 baño, 1 estac.",Azcapotzalco
"Hermoso departamento de 50 m2 en San Miguel Amantla, Azcapotzalco en 1er nivel cuanta con: 2 lugares de estacionamiento, uno techado y otro semi techado. 2 recámaras. 1 baño completo. Estancia amplia con techo doble altura. Cocina equipada con alacena, lavadero y espacio para lavadora. Mantenimiento incluido",https://www.inmuebles24.com/propiedades/clasificado/alclapin-hermoso-departamento-en-primer-piso-147357725.html,"MN 12,500","fresnos san miguel amantla azcapotzalco
San Miguel Amantla, Azcapotzalco","50 m² lote, 2 rec., 1 baño, 2 estac.",Azcapotzalco
"Se renta departamento en Residencial Tres Lagos muy bien ubicado en el Circuito Interior. Ubicado en el piso 20 con una bonita vista a la Ciudad de México, muy iluminado, el departamento cuenta con cocina integral, estancia para sala y comedor, dos recámaras, un baño completo, área de lavado, un lugar de estacionamiento cubierto. Sus amenidades: alberca techada, salón de eventos, gimnasio, área de juegos infantiles, área para mascotas. No pierda oportunidad de conocerlo y rentarlo. Cuota de mantenimiento, incluida en la renta.",https://www.inmuebles24.com/propiedades/clasificado/alclapin-renta-departamento-en-residencial-tres-lagos-147271684.html,"MN 15,500","Prolongación Naranjo 443
Ampliación Del Gas, Azcapotzalco","65 m² lote, 2 rec., 1 baño, 1 estac.",Azcapotzalco
"Departamento interior en renta en 3er. Piso de 50. 92 m2, con buena conectividad, cerca del Metro Ferrería y Suburbano Fortuna. Características: • 2 recámaras. • 1 baño. • Clóset de blancos. • Área de lavado. • 1 cajón de estacionamiento independiente. • Bodega. Áreas comunes del edificio: • Vigilancia 24/7. • Salón de usos múltiples. • Ludoteca. • Espacio para ejercicio. • Recepción. Nota: El edificio no cuenta con elevador. Ubicado a una cuadra del Tren Suburbano Fortuna y a minutos de la Arena Ciudad de México. Cercano a supermercados, mercado local y universidades. Se acepta una mascota pequeña. Renta $13, 000. Más mantenimiento $900. Requisitos: 1 mes de renta. 1 depósito. Póliza Jurídica. Propiedad en garantía en la cdmx o área conurbada libre de gravamen u obligado económico. No se comparte comisión. Contamos con más inmuebles consulta nuestra página. Teléfono: 55 Ver datos",https://www.inmuebles24.com/propiedades/clasificado/alclapin-departamento-en-renta-en-el-jaguey-azcapotzalco-146982796.html,"MN 13,000","Privada de la Soledad, El Jagüey, Azcapotzalco
El Jagüey, Azcapotzalco","51 m² lote, 2 rec., 1 baño, 1 estac.",Azcapotzalco
"Departamento amueblado en renta – Calzada Azcapotzalco La Villa, Col. San Marcos. Renta: 14, 500 (incluye mantenimiento, no incluye servicios agua, luz, gas son aparte) Ubicación: 4º piso. Superficie: 58 m² Distribución y características: Espacio de sala-comedor. Cocina integral. 2 recámaras. 2 baños completos. 1 cajón de estacionamiento. Edificio: Construido en 2016. Solo 12 departamentos. Vigilancia 24/7. Elevador. Cisterna. Gas natural. Extras: Se acepta mascota pequeña (perro o gato) Cerca de Pasaje Ferrería. A unos minutos del Metro Camarones y Metro Ferrería. Requisitos: Comprobante de ingresos 3 veces lo de la renta (estados de cuenta bancarios de los últimos 3 meses, recibo de nómina, declaraciones parciales, etc) 1 mes de deposito. 1 mes de renta por adelantado. Póliza jurídica. Fiador con propiedad en la cdmx libre de gravamen o un obligado solidario en cdmx con ingresos 3 veces lo de la renta",https://www.inmuebles24.com/propiedades/clasificado/alclapin-departamento-amueblado-en-renta-calzada-azcapotzalco-147384348.html,"MN 14,500","Elite Living Altos Azcapotzalco
San Marcos, Azcapotzalco","58 m² lote, 2 rec., 2 baños, 1 estac.",Azcapotzalco
