Título,Enlace,Precio,Dirección,Características,Municipio de Origen
"Precioso Departamento en Renta en Poniente 54 # 3396, colonia Obrero Popular, cerca del Centro de Azcapotzalco, del Casco de Sto. Tomás y de Avenidas principales como Camarones, Cuitláhuac, Circuito Interior, unitec Cuitláhuac, Tiendas de Autoservicio. características: el departamentoel departamento cuenta con Interfono, Cocina integral con alacena, horno y estufa de encendido electrónico, calentador de agua (boiler) de paso de encendido electrónico, servicio de gas natural, camas, tv, sofá, sillón, mesa de comedor, bufetera, electrodomésticos como cafetera, microondas, refrigerador, lavadora y un muy buen estado de conservación. distribución del departamento. El Departamento consta de 2 dos recamaras, 1 un baño, sala-comedor, cocina integral, zotehuela con área de lavado interior y 1 un lugar de estacionamiento techado individual con acceso independiente. ubicación dentro del desarrollo. Este bonito departamento, se ubica en el cuarto piso y es interior, lo que le permite tener la tranquilidad y comodidad de estar lejos de ruidos de la calle y como es el último piso y el departamento del fondo, le permite tener la privacidad de no tener vecinos pasando en frente o departamentos que le tapen la luz natural, no cuenta con elevador. características del desarrollo. ubicación del desarrolloel desarrollo está super céntrico, se ubica en Poniente 54 número 3396, colonia Obrero Popular, de la delegación o Alcaldía Azcapotzalco en la Ciudad de México y está a unas cuadras de la Avenida Camaronez, Azcapotzalco, Cuitlahuac, Glorienta de Camarones, cerca de la Torre de Pemex, el unitec de Marina Nacional, el Instituto Politécnico Nacional ipn en el casco de Santo Tomas, Anzures, Polanco. Muy cerca de colonia San Rafael, Cuauhtémoc, Juárez, Roma, Condesaserviciosel desarrollo cuenta con los servicios de una empresa de administración profesional con vigilancia y personal de mantenimiento de planta, así como personal de limpieza con una plantilla de varias personas que da servicio los siete días de la semana y todo con mucha tranquilidad y Excelente ambiente familiar, el desarrollo no cuenta con elevador. seguridadeste excelente departamento se encuentra en un Desarrollo Cuenta con Vigilancia las 24 horas del día, Circuito Cerrado de Televisión cctv, acceso controlado por sistemas electrónicos de forma peatonal, o bien por tag adicional al corbatín, tarjetón o marbete en el acceso vehicular. También se cuenta con Alarma Sísmica, Alarma Vecinal. vialidades cercanas. Circuito Interior, Reforma, Cuitlahuac, Mariano Escobedo, Marina Nacional, Av. México Tacuba, Avenida de los Insurgentes Centro, Ejército Nacional, Rio San Joaquín, Aquiles Serdán, Cuitláhuac, Eje 1 Norte Álzate, Eje 2 Norte Eulalia Guzmán, Camarones, Avenida de las Granjas, Vallejo, Avenida jardín entre muchas otras. Tendrás servicios, ubicación y equipamiento a un precio muy accesible. centros comerciales cercanosplaza Horizonte Cuitlahuac, Plaza Parque Jardín, Plaza Azcapotzalco, Plaza Legaria 238, Plaza Galerías, Parques Plaza Nuevo Polanco, Plaza Parque Jardín, Plaza Parque Vía Vallejo, Parques Polanco, Reforma 222, Plaza Antara, Plaza Carso, Fórum Buenavista, Pabellón Azcapotzalco, Marina Park y muchas mas. transportes cercanossitio de Taxis, Estaciones del Metro como Colegio Militar, Normal, Popotla, Cuitlahuac, Camarones, Rutas de Microbús a diferentes destinos como Toreo de 4 cuatro caminos, Pantitlán, Polanco, Defensa Nacional, metro Normal, Rosario, Tlalnepantla y muchas otras mas. servicios cercanos: Hospitales, Escuelas Públicas y Particulares de todos los niveles desde guarderías hasta universidades, Parques, Deportivos, Tiendas de Conveniencia, Farmacias, Panaderías, Tintorerías, Tortillerías, Tlapalerías, Papelerías, etc. hospitales cercanos: Hospital Españo, Hospital de la Mujer, Hospital Ruben Leñero, Hospital General de issste Tacuba, Unidad de Medicina Familiar No. 5 de imss Marina Nacional, Hospital de Especialidades San Judas Tadeo, Hospital Central Petroleos Mexicanos pemex, Hospital de la Luz, entre muchos otros. escuelas cercanas. cics - Centro Interdisciplinario de Ciencias de la Salud Unidad Santo Tomás ipn, ese - Escuela Superior de Economía - ipn, encb - Escuela Nacional de Ciencias Biológicas Unidad Santo Tomás ipn, esca - Escuela Superior de Comercio y Administración Unidad Santo Tomás ipn, esm - Escuela Superior de Medicina - ipn, eseo - Escuela Superior de Enfermería y Obstetricia ipn, unitec Cuitláhuac - Universidad Tecnológica de México, Colegio Frances Nueva Santa Maria Ac, Colegio de Educación Montessori, Colegio Trilingüe Pedro María Anaya, Instituto Social y Escolar, Colegio Salesiano, Colegio Civilización A. C. , Instituto Cobre de México, Escuela Estado de Nuevo León, Escuela Primaria Estado de Hidalgo, Escuela Primaria &quot;Francisco Sarabia&quot;, Escuela Primaria 20 de Noviembre, Escuela Primaria &quot;&quot;Rafael Angel de la Peña&quot;, Escuela Bilingüe Cambridge, Kinder Fray Francisco Aparicio, Colegio Inglés Michael Faraday, Jardín de Niños Maria Luisa de la Torre, Ex itam, Centro De Capacitación Artistica A. N. D. A. , requisitos: * Comprobar ingresos por 3. 5 veces el monto de la renta. * Fiador con inmueble libre de gravamen (indispensable) , de preferencia en Ciudad de México pero puede ser de otras ciudades* Aprobar la investigación (con costo) * Contrato mínimo a 12 meses. * Pago del depósito y un mes de renta por adelantado. * La Póliza Jurídica es opcional y no sustituye al fiador. ¡agenda tu cita! Te encantará. Empresa de intermediacion inmobiliaria. Compraventa, renta, remodelacion, construcción y administración de inmuebles. La información aquí proporcionada puede ser sujeta a cambio sin previo aviso y muestran únicamente una propuesta y de ninguna forma puede ser considerada vinculante, contractual o de forma alguna obligación de cumplir con cierto ofrecimiento. Las imágenes y contenido pueden estar sujetas a derechos de autor, por lo que no se autoriza de ninguna forma su uso fuera de este sitio ni para fines distintos a los que fue publicado. Para mayor información se recomienda contactar con un asesor que le brinde atención personalizada.",https://www.inmuebles24.com/propiedades/clasificado/alclapin-departamento-amueblado-en-renta-cerca-del-ipn-casco-de-146881596.html,"MN 15,000","Poniente 54 #3396
Obrero Popular, Azcapotzalco","66 m² lote, 2 rec., 1 baño, 1 estac.",Azcapotzalco
Para una persona sola. Citas y muestra del departamento solo los domingos al Ver datos. Solicito aval con casa propia. Porfavor si no cumple los requisitos no insista.,https://www.inmuebles24.com/propiedades/clasificado/alclappa-cerca-del-metro-y-metrobus-el-rosario-147220546.html,"MN 5,500","San José 164
San Martín Xochinahuac, Azcapotzalco","50 m² lote, 1 rec., 1 baño",Azcapotzalco
"Depa con excelente ventilación e iluminación natural, doble cerradura de seguridad en la puerta principal, timbre e interfón, 2 recamaras con clóset, cocina integral como estufa con camapana de extracción, sala/comedor, baño completo con boiler, cancel y luz en espejo, area de lavado, 1 lugar de estacionamiento, roof garden privado con azador, barra y tarja. Entre sus amenidades tenemos: lobby, areas de co working, gym equipado, ludoteca, area de juegos para ninos, 2 elevadores, areas comunes al aire libre, contenedores de basura, servicios ocultos (agua, gas, luz e internet), acceso controlado con camaras de seguridad en todo el edificio tanto afuera como adentro, guardias de seguridad 24/7. Mantenimiento del edificio ya esta incluido en la renta.",https://www.inmuebles24.com/propiedades/clasificado/alclappa-departamento-en-renta-con-roof-garden-privado-en-146706576.html,"MN 20,000","Avenida Cuitláhuac 2939
Clavería, Azcapotzalco","85 m² lote, 2 rec., 1 baño, 1 estac.",Azcapotzalco
"Departamento en Renta de 70 m2 nuevo, ubicado en el nivel 10 con vista exterior, incluye: -Sala - Comedor. -Balcón grande. -Cocina integral c/barra desayunador. -Área de lavado. -2 Baños completos. -2 Recámaras c/closets de madera. -1 Cajón estacionamiento. -Pisos de loseta ceramica. -Puertas de madera. Cuenta con: -Seguridad las 24 hrs. -2 Elevadores. -Ludoteca. -Salón de usos múltiples. El departamento se ubica cerca de tiendas de autoservicio Sam´s Club La Raza, Home Depot Tlatilco, Plaza Parque Jardín. Se tienen cerca escuelas en sus diferentes niveles como el Justo Sierra y el ipn. Se localiza a 10 min del Hospital la Raza. Vías de comunicación importantes como Circuito Interior, Av. Insurgentes, Ave Jardín, Av Cuitlahuac.",https://www.inmuebles24.com/propiedades/clasificado/alclappa-hermoso-departamento-en-renta-en-azcapotzalco-66370764.html,"MN 15,000","Calle Sabino 538
Ampliación Del Gas, Azcapotzalco","70 m² lote, 2 rec., 2 baños, 1 estac.",Azcapotzalco
"Departamento en renta (sin muebles) ubicado en segundo piso, sin elevador. Cuenta con 2 habitaciones con closet, 1 baño, sala comedor, cocina integral, closet de blancos y balcón. En la azotea se encuentra el área de lavado y tendido (exclusiva para cada departamento) . El conjunto cuenta con un Roof Garden de uso común. El departamento no cuenta con estacionamiento, hay una pensión a pocos metros. En el edificio no se permiten las mascotas, por reglamento. A 10 min a pie de la Glorieta de CamaronesA 1. 8 km de Metro Refinería (línea 7) A 2. 2 km de Metro Cuitláhuac (línea 2) Solo arrendamientos de larga estancia (contrato por un año) La comprobación de ingresos es requisito indispensable Solesti Inteligencia Inmobiliaria. Seriedad y confianza.",https://www.inmuebles24.com/propiedades/clasificado/alclapin-departamento-en-renta-2-habitaciones-1-bano-147206016.html,"MN 14,000","Norte 79B Azcapotzalco
Un Hogar Para Cada Trabajador, Azcapotzalco","74 m² lote, 2 rec., 1 baño",Azcapotzalco
"Departamento en Renta en Colonia Arenal, Azcapotzalco. Ubicado en edificio Residencial, en una zona de excelente conectividad, tranquila y bien comunicada. Ideal para quienes buscan una ubicación estratégica, cerca de avenidas principales, centros comerciales, escuelas, parques, restaurantes, mercados y tiendas. Muy cerca de Sams Club la raza, a solo unos pasos de Av. Circuito Interior (Paseo de las Jacarandas), Calzada Vallejo, de Av. Cuitláhuac. Características: • Superficie: 65 m²• Renta: $16, 500• Recámaras: 2• Baños: 1• Balcones: 3• Cuarto de lavado• Bodega en la cocina• Estacionamiento: 1• Elevador• Mantenimiento incluido• Seguridad 24 horasAmenidades: • Gimnasio• Salón de usos múltiples • Ludoteca• Jardín",https://www.inmuebles24.com/propiedades/clasificado/alclapin-departamento-en-renta-en-azcapotzalco-147406248.html,"MN 16,500","Azcapotzalco
Arenal, Azcapotzalco","65 m² lote, 2 rec., 1 baño, 1 estac.",Azcapotzalco
"Departamento nuevo a estrenar, cuenta con 2 recamaras, 2 baños completos, cocina equipada, area de lavado, estacionamiento para un auto. Amenidades, alberca, Gimnasio, asadores, salon de usos multiples. Super bien comunicado, cerca del metro Aquiles Serdan y 10 minutos del Rosario. Se aceptan mascotas pequeñas. Incluye Mantenimiento",https://www.inmuebles24.com/propiedades/clasificado/alclappa-estrena-bonito-departamento-super-bien-ubicado!-147324786.html,"MN 14,000","Av. 16 de Septiembre 197
Santa Inés, Azcapotzalco","63 m² lote, 2 rec., 2 baños, 1 estac.",Azcapotzalco
"Se renta departamento cdmx, cuenta con 3 recamaras con closet con base para colchon, 1 baño completo, área de lavado Y tendido dentro del departamento, sillon 2 plazas, mesa de madera con 4 sillas, cerca de metro popotla, metro ciutlahuac Y metro refineria.",https://www.inmuebles24.com/propiedades/clasificado/alclappa-renta-departamento-3-recamaras-cdmx-u.-h.-cuitlahuac-147389785.html,"MN 12,000","Calle Norte 71
Cosmopolita, Azcapotzalco","75 m² lote, 3 rec., 1 baño",Azcapotzalco
"Precioso Departamento en Renta en Poniente 54 # 3396, colonia Obrero Popular, cerca del Centro de Azcapotzalco, del Casco de Sto. Tomás y de Avenidas principales como Camarones, Cuitláhuac, Circuito Interior, unitec Cuitláhuac, Tiendas de Autoservicio. características: el departamentoel departamento cuenta con Interfono, Cocina integral con alacena, horno y estufa de encendido electrónico, calentador de agua (boiler) de paso de encendido electrónico, servicio de gas natural, camas, tv, sofá, sillón, mesa de comedor, bufetera, electrodomésticos como cafetera, microondas, refrigerador, lavadora y un muy buen estado de conservación. distribución del departamento. El Departamento consta de 2 dos recamaras, 1 un baño, sala-comedor, cocina integral, zotehuela con área de lavado interior y 1 un lugar de estacionamiento techado individual con acceso independiente. ubicación dentro del desarrollo. Este bonito departamento, se ubica en el cuarto piso y es interior, lo que le permite tener la tranquilidad y comodidad de estar lejos de ruidos de la calle y como es el último piso y el departamento del fondo, le permite tener la privacidad de no tener vecinos pasando en frente o departamentos que le tapen la luz natural, no cuenta con elevador. características del desarrollo. ubicación del desarrolloel desarrollo está super céntrico, se ubica en Poniente 54 número 3396, colonia Obrero Popular, de la delegación o Alcaldía Azcapotzalco en la Ciudad de México y está a unas cuadras de la Avenida Camaronez, Azcapotzalco, Cuitlahuac, Glorienta de Camarones, cerca de la Torre de Pemex, el unitec de Marina Nacional, el Instituto Politécnico Nacional ipn en el casco de Santo Tomas, Anzures, Polanco. Muy cerca de colonia San Rafael, Cuauhtémoc, Juárez, Roma, Condesaserviciosel desarrollo cuenta con los servicios de una empresa de administración profesional con vigilancia y personal de mantenimiento de planta, así como personal de limpieza con una plantilla de varias personas que da servicio los siete días de la semana y todo con mucha tranquilidad y Excelente ambiente familiar, el desarrollo no cuenta con elevador. seguridadeste excelente departamento se encuentra en un Desarrollo Cuenta con Vigilancia las 24 horas del día, Circuito Cerrado de Televisión cctv, acceso controlado por sistemas electrónicos de forma peatonal, o bien por tag adicional al corbatín, tarjetón o marbete en el acceso vehicular. También se cuenta con Alarma Sísmica, Alarma Vecinal. vialidades cercanas. Circuito Interior, Reforma, Cuitlahuac, Mariano Escobedo, Marina Nacional, Av. México Tacuba, Avenida de los Insurgentes Centro, Ejército Nacional, Rio San Joaquín, Aquiles Serdán, Cuitláhuac, Eje 1 Norte Álzate, Eje 2 Norte Eulalia Guzmán, Camarones, Avenida de las Granjas, Vallejo, Avenida jardín entre muchas otras. Tendrás servicios, ubicación y equipamiento a un precio muy accesible. centros comerciales cercanosplaza Horizonte Cuitlahuac, Plaza Parque Jardín, Plaza Azcapotzalco, Plaza Legaria 238, Plaza Galerías, Parques Plaza Nuevo Polanco, Plaza Parque Jardín, Plaza Parque Vía Vallejo, Parques Polanco, Reforma 222, Plaza Antara, Plaza Carso, Fórum Buenavista, Pabellón Azcapotzalco, Marina Park y muchas mas. transportes cercanossitio de Taxis, Estaciones del Metro como Colegio Militar, Normal, Popotla, Cuitlahuac, Camarones, Rutas de Microbús a diferentes destinos como Toreo de 4 cuatro caminos, Pantitlán, Polanco, Defensa Nacional, metro Normal, Rosario, Tlalnepantla y muchas otras mas. servicios cercanos: Hospitales, Escuelas Públicas y Particulares de todos los niveles desde guarderías hasta universidades, Parques, Deportivos, Tiendas de Conveniencia, Farmacias, Panaderías, Tintorerías, Tortillerías, Tlapalerías, Papelerías, etc. hospitales cercanos: Hospital Españo, Hospital de la Mujer, Hospital Ruben Leñero, Hospital General de issste Tacuba, Unidad de Medicina Familiar No. 5 de imss Marina Nacional, Hospital de Especialidades San Judas Tadeo, Hospital Central Petroleos Mexicanos pemex, Hospital de la Luz, entre muchos otros. escuelas cercanas. cics - Centro Interdisciplinario de Ciencias de la Salud Unidad Santo Tomás ipn, ese - Escuela Superior de Economía - ipn, encb - Escuela Nacional de Ciencias Biológicas Unidad Santo Tomás ipn, esca - Escuela Superior de Comercio y Administración Unidad Santo Tomás ipn, esm - Escuela Superior de Medicina - ipn, eseo - Escuela Superior de Enfermería y Obstetricia ipn, unitec Cuitláhuac - Universidad Tecnológica de México, Colegio Frances Nueva Santa Maria Ac, Colegio de Educación Montessori, Colegio Trilingüe Pedro María Anaya, Instituto Social y Escolar, Colegio Salesiano, Colegio Civilización A. C. , Instituto Cobre de México, Escuela Estado de Nuevo León, Escuela Primaria Estado de Hidalgo, Escuela Primaria &quot;Francisco Sarabia&quot;, Escuela Primaria 20 de Noviembre, Escuela Primaria &quot;&quot;Rafael Angel de la Peña&quot;, Escuela Bilingüe Cambridge, Kinder Fray Francisco Aparicio, Colegio Inglés Michael Faraday, Jardín de Niños Maria Luisa de la Torre, Ex itam, Centro De Capacitación Artistica A. N. D. A. , requisitos: * Comprobar ingresos por 3. 5 veces el monto de la renta. * Fiador con inmueble libre de gravamen (indispensable) , de preferencia en Ciudad de México pero puede ser de otras ciudades* Aprobar la investigación (con costo) * Contrato mínimo a 12 meses. * Pago del depósito y un mes de renta por adelantado. * La Póliza Jurídica es opcional y no sustituye al fiador. ¡agenda tu cita! Te encantará. Empresa de intermediacion inmobiliaria. Compraventa, renta, remodelacion, construcción y administración de inmuebles. La información aquí proporcionada puede ser sujeta a cambio sin previo aviso y muestran únicamente una propuesta y de ninguna forma puede ser considerada vinculante, contractual o de forma alguna obligación de cumplir con cierto ofrecimiento. Las imágenes y contenido pueden estar sujetas a derechos de autor, por lo que no se autoriza de ninguna forma su uso fuera de este sitio ni para fines distintos a los que fue publicado. Para mayor información se recomienda contactar con un asesor que le brinde atención personalizada.",https://www.inmuebles24.com/propiedades/clasificado/alclapin-departamento-amueblado-en-renta-cerca-del-ipn-casco-de-146881684.html,"MN 16,000","Poniente 54 #3396
Clavería, Azcapotzalco","66 m² lote, 2 rec., 1 baño, 1 estac.",Azcapotzalco
"Departamento en Colonia Clavería, Azcapotzalco, cdmx. Favor de leer y analizar la descripción Completa. Si no puede contactarnos por celular por mala señal, porfavor deje sus datos por mensaje de Texto sms o Whatsapp, (nosotros lo contactamos, pero favor de desbloquear el recibir números desconocidos), mandar mensaje solo si cumple con todos los requisitos, porfavor. Contactar porfavor en Horario de oficina. A media cuadra del parque de la china y a 3 cuadras de la glorieta de camarones. 1 Recámara con clóset, Estancia, Cocina y Baño. Calentador de agua. No tiene Estacionamiento, hay pensión Cerca. No se reciben mascotas. Se requiere: Comprobar Ingresos (3 a 1), Aval con Bien Inmueble en cdmx (Indispensable) y un Depósito. Gas de cilindro. Área de Tendido y Lavadero en azotea. El pago de los servicios es por separado (Agua, Cfe. ) Primer Piso.",https://www.inmuebles24.com/propiedades/clasificado/alclappa-remodelado-lea-porfavor-la-descripcion-y-requisitos-146578997.html,"MN 7,100","Norte 79-A
Clavería, Azcapotzalco","50 m² lote, 1 rec., 1 baño",Azcapotzalco
"Excelente Departamento en Renta, con Amenidades y servicios en condominio residencial real de san martín. el departamentoel departamento cuenta con Interfono, Cocina integral con alacena, horno, estufa, piso cerámico y un muy buen estado de conservación ya que está como nuevo. Ya está listo para habitarse inmediatamente. distribución del departamento. El Departamento consta de un área abierta para poner su estancia sala-comedor, 2 dos recamaras, y 1 un baño completo, cocina integral, área de lavado interior con lavadero, instalación para lavadora y área de tendido, así como un lugar de estacionamiento techado y arriba del departamento inmediatamente en el piso superior se encuentra el Roof Garden Privado o terraza, lo que le permitirá tener sus plantas, mascotas y hasta hacer reuniones o fiestas con su familia y todos sus amigos. ubicación dentro del desarrollo. Este bonito departamento, se ubica en el quinto piso 5 (no cuenta con elevador) , y es interior lo que le permite tener una tranquilidad lejos de los ruidos de la calle, ni los flujos de plantas bajas, además de todas las instalaciones de este precioso desarrollo. características del desarrollo. seguridadeste excelente departamento se encuentra en un Desarrollo Cuenta con Vigilancia las 24 horas del día, Circuito Cerrado de Televisión cctv, acceso controlado por biométricos vía huella digital y control de acceso vehicular y un sistema único de control de accesos, reservaciones y muchas cosas más. serviciosel desarrollo cuenta con los servicios de una empresa de administración profesional dentro del condominio y personal de mantenimiento de planta, así como personal de limpieza con una plantilla de varias personas que da servicio los siete días de la semana y todo con mucha tranquilidad y Excelente ambiente familiar. amenidadeseste fabuloso desarrollo cuenta con muchas amenidades, entre las que se encuentran ludoteca o área de juegos infantiles, gimnasio, Salón de fiestas y bonitas amenidades que le permitirán pasar momentos muy agradables con su familia y amigos en la comodidad de su hogar. ubicación del desarrolloel desarrollo está super céntrico, se le conoce como &quot;Real de San Martín&quot; y se ubica en una de las zonas de Mayor Plusvalía de la Ciudad de México, a un lado la Alameda Reynosa Azcapotzalco en Avenida Real de San Martín 103, en la colonia Santa Barbara de la delegación o alcaldía de Azcapotzalco en la Ciudad de México y está cerca de la Arena Ciudad de México, Tecnoparque, Alameda Norte, Centro Deportivo Ferrocarrilero, Escuela Superior de Ingeniería Eléctrica Unidad Azcapotzalco (esime Azcapotzalco) , zona industrial de vallejo, estaciones del metro Ferreria y Norte 45, suburbano Fortuna entre muchos lugares importantes mas. Aprovecha esta increíble oportunidad y compra éste estupendo departamento con Roof Garden privado a un precio increíble. Requisitos: * Fiador con bien raíz libre de gravamen* comprobacion de Ingresos por 2. 5 veces el monto de la renta o mayores* Aprobar la investigación (con costo) * Contrato mínimo a 12 meses. * Depósito y un mes de renta por adelantado. Llama ahora para una cita antes que te lo ganen. ¡ ¡ ¡ L L A M A Y A! !! Empresa de intermediacion inmobiliaria. Compraventa, renta, remodelacion, construcción y administración de inmuebles. La información aquí proporcionada puede ser sujeta a cambio sin previo aviso y muestran únicamente una propuesta y de ninguna forma puede ser considerada vinculante, contractual o de forma alguna obligación de cumplir con cierto ofrecimiento. Las imágenes y contenido pueden estar sujetas a derechos de autor, por lo que no se autoriza de ninguna forma su uso fuera de este sitio ni para fines distintos a los que fue publicado. Para mayor información se recomienda contactar con un asesor que le brinde atención personalizada.",https://www.inmuebles24.com/propiedades/clasificado/alclapin-departamento-en-renta-con-roof-garden-privado-o-146418185.html,"MN 13,000","Real de San Martín 103 -departamento en Renta con Roof Garden Privado o Terraza en Real de San Martín 103 Colonia Santa Barbara, Alcaldía Azcapotzalco, Cdmx
Santa Bárbara, Azcapotzalco","100 m² lote, 2 rec., 1 baño, 1 estac.",Azcapotzalco
