Título,Enlace,Precio,Dirección,Características,Municipio de Origen
"Precioso departamento en buena, zona a unos pasos del Bosque de Tlalpan, Periférico, y Avenida Insurgentes. Si te gusta vivir en un edificio de 5 departamentos aquí esta, para llegar a él es directo con el elevador, se encuentra en un 4 piso, y al entrar a él veras el hall distribuidor y sala y comedor grande con una vista preciosa a los volcanes y a la villa olímpica, la sala y comedor está dividida con una chimenea que funciona, la cocina tiene una iluminación natural es grande con cubierta de granito, tiene 2 parrillas una de gas y una eléctrica, horno. , cajón térmico, y área para lava vajillas, una despensa grande, desayunador, 1/2 baño de visitas, sala de tv despacho con libreros, 3 recamaras, principal grande con vista a los volcanes y tiene sus ventanas con doble vidrio, el vestidor es grande con el baño tiene 2 lavabos y regadera con canceles templados, las otras dos recamaras tienen su baño, una con tina y con su vestidor, tenemos el closet de blancos, área de lavado, y cuarto de servicio el departamento los pisos son de encino en sala comedor, y en recamaras pisos de ingeniería, todos los muebles empotrados son de caoba. El departamento tiene calefacción y área acondicionado. Contamos con 4 lugares de estacionamientos. El edificio tiene un salón de usos múltiples con cocineta y baños. Y terraza. Como son solo 5 departamentos solo hay 2 personas que se encargan de la limpieza, y vigilancia en el fraccionamiento. Quien no conoce Parques del Pedregal hay un precioso jardín que rodea las casas, y podrás salir a caminar o correr. El mantenimiento está incluido en la renta que es el pago del fraccionamiento y del edificio que son $8, 500. 00",https://www.inmuebles24.com/propiedades/clasificado/alclapin-departamento-en-venta-parques-del-pedregal-alborada-146881295.html,"MN 69,000","Alborada
Parque del Pedregal, Tlalpan","340 m² lote, 3 rec., 3 baños, 4 estac.",Tlalpan
"Departamento de lujo con pisos laminados. Cuenta con estancia comedor, cocina equipada y cuarto de servicio con baño. 2 recámaras. Estudio. 2 baños completos. 2 lugares de estacionamiento. 1 bodega. Edificio con lobby, elevador y vigilancia 24 hrs. Salón de usos múltiples. 8, 000 m de jardines y áreas comunes. Requisitos para rentar: 1 mes de deposito. 1 mes de renta adelantada. Fiador con bien raíz en cdmx. Comprobantes de ingresos de los últimos 3 meses a través de nomina o estados de cuenta bancarios. Póliza Jurídica.",https://www.inmuebles24.com/propiedades/clasificado/alclapin-renta-o-venta-departamento-jardines-en-la-montana-real-66933946.html,"MN 25,000","Real de la Montaña, Picacho Ajusco
Jardines en la Montaña, Tlalpan","150 m² lote, 2 rec., 2 baños, 2 estac.",Tlalpan
"[arr] id houm: Ver datos. Entérate de todos los beneficios al rentar con Houm: • No te pedimos aval. • Asistencia e intermediación con el propietario. • Firma tu contrato online. • Renta sin burocracia, papeleos y mucho más rápido. • Difiere tu depósito en hasta 6 meses sin interés. Departamento en renta, ubicado en la colonia Pedregal de San Nicolás 4ta Sección, con una superficie construida de 67. 00 m² y superficie total de 67. 00 m². Sus principales características son: • Sin amueblar. • 2 recámaras. • 1 baño. • Admite mascotas. • 1 estacionamiento. • Piso 3. • Año de construcción: 2010. Además, el inmueble cuenta con las siguientes amenidades: • Vigilancia 24 hrs. Si rentas con nosotros, te brindamos asesoría personalizada durante todo el proceso. Importante: • Se deben demostrar ingresos de 3 veces el valor de la renta. • En caso de que tus ingresos no lleguen a 3 veces el valor de la renta, estos pueden ser la suma de las personas que vivirán en la propiedad. • Te invitamos a agendar una visita a esta propiedad: esta puede ser presencial o vía streaming, desde la comodidad de tu hogar. • Y lo mejor. Sin aval. Más que una corredora, somos Houm. *Aplican T&C",https://www.inmuebles24.com/propiedades/clasificado/alclapin-departamento-en-pedregal-de-san-nicolas-4ta-seccion-147309356.html,"MN 9,000","Panabá
Tlalpan, Ciudad de México","67 m² lote, 2 rec., 1 baño, 1 estac.",Tlalpan
"Precioso departamento amueblado moderno en la mejor torre Jardines en la Montaña. 4 recámaras, dos con baño y vestidor las otras dos comparten baño y vestidor, sala, comedor con vista y muy iluminada, family room, cocina integral con desayunador, elevador al piso, el edificio cuenta con excelente seguridad, alberca, gym, área de juegos. Impecable. Gentry Real Estate es una Agencia Inmobiliaria conformada por Personal altamente profesional; quienes se capacitan constantemente con el objetivo de estar dispuestos a enfrentar los cambios que el sector inmobiliario lanza día con día, con ello, procuran y salvaguardan que los clientes tomen la mejor decisión en todas sus operaciones.",https://www.inmuebles24.com/propiedades/clasificado/alclapin-jardines-en-la-montana-torre-olimpo-146596263.html,"MN 110,000","Jardines en la Montaña, Torre Olimpo
Jardines en la Montaña, Tlalpan","367 m² lote, 3 rec., 3 baños, 4 estac.",Tlalpan
"Renta departamento amueblado, de lujo, en exclusivo fraccionamiento, Cobalto 94. - Excelentes vías de acceso, a periférico, segundo piso, supervia, etc. - Sala, comedor. - Medio baño para visitas. - Cocina integral, Desayunador, Antecomedor. - Cuarto de Servicio. - Cuenta con 2 habitaciones, ambas con vestidor y baño completo. - Cuarto de T. V. - 2 Lugares de estacionamiento. - Vigilancia 24 hrs. - Mantenimiento incluido en el precio de renta. Adicional en las áreas comunes, cuenta con Lobby, Recepción, Gimnasio, Juegos infantiles, Jardines, Salón de fiestas, Parque con lagos. Clave interna: D811am. * Consulta el Aviso de Privacidad en nuestra página oficial *",https://www.inmuebles24.com/propiedades/clasificado/alclapin-departamento-en-renta-amueblado-y-de-lujo-lomas-del-142764780.html,"MN 69,000","Av. Cobalto 94
Lomas del Pedregal Framboyanes, Tlalpan","220 m² lote, 2 rec., 2 baños, 2 estac.",Tlalpan
"Situado en la tranquila y bien conectada colonia San Lorenzo Huipulco, dentro de la alcaldía Tlalpan. Este espacio ofrece dos recámaras perfectamente distribuidas, recamara principal con pantalla lg de 42"" lo que permite una estancia confortable tanto para familias pequeñas como para quienes desean contar con una habitación adicional para oficina, estudio o visitas, además cuenta con dos balcones. El área de cocina ha sido equipada con una estufa y campana integradas, además de refrigerador y lavadora ofreciendo un espacio óptimo para realizar actividades culinarias de forma práctica. Este departamento cuenta con dos lugares de estacionamiento, portón eléctrico que abre con control remoto lo que facilita la movilidad y proporciona seguridad adicional para vehículos particulares. Cabe destacar que no se admiten mascotas, lo cual favorece un ambiente más controlado dentro del desarrollo habitacional. Además, el precio de renta ya incluye tanto el servicio de internet como la cuota de mantenimiento, eliminando preocupaciones adicionales en la administración mensual del hogar. El condominio en el que se encuentra este departamento pone a disposición de sus residentes un roof garden privado con acceso desde el interior del departamento que ofrece un espacio abierto y versátil ideal para relajarse o convivir. También cuenta con cámaras de seguridad, lo que garantiza un entorno protegido y armónico para todos los habitantes. Importante: No cuenta con elevador. Con opción de rentar sin algunos muebles. La ubicación es otro de los grandes atributos de este inmueble. Su cercanía con la Zona de Hospitales lo convierte en una alternativa estratégica para profesionales de la salud o personas que requieren acceso constante a servicios médicos de primer nivel. A pocos minutos del Estadio Azteca y del Tren Ligero Huipulco, cerca de varias universidades públicas y privadas, tales como la unam, Tec de Monterrey, uvm y otras. El departamento se sitúa también a una distancia conveniente de centros comerciales como Paseo Acoxpa. Las principales vías de comunicación, entre las que destacan Periférico, Viaducto Tlalpan y Calzada de Tlalpan, aseguran una conexión fluida con diferentes zonas de la ciudad, facilitando desplazamientos rápidos tanto en vehículo como en transporte público. ¡Con Homie renta sin aval! Proceso 100% digital y diferentes formas de pago de tu renta, tú eliges. ¡Conoce ya este depa! Estás a pocos pasos de encontrar el hogar de tus sueños. Departamento de 65. 0 metros cuadrados cuenta con: - 2 habitaciones. - 2. 0 baños. - 2 lugares de estacionamiento. Características: - Balcón. - Amueblado. - Cuarto de lavado. - Cocina integral. Servicios: - Internet/Teléfono. Amenidades: - Seguridad. Antigüedad: 7 años. . Número de habitantes recomendado: 4. Disponibilidad para mostrar: 14/julio/2025. Disponibilidad para habitar: 01/agosto/2025. ¡Enamórate de tu vida en este departamento! # Homie Id: 9_4_8_3_8. Estos son los beneficios que tienes como inquilino al rentar tu nuevo hogar con nosotros: * No necesitas aval (sujeto a Términos y Condiciones). * Realiza el pago de tu renta mediante transferencia digital en nuestra plataforma o en efectivo en miles de locales disponibles. * Asistencia y conciliación con tu propietario. * Proceso sin burocracia, renta en cuestión de horas y sin trámites complicados. * Descuentos exclusivos en mudanzas, muebles y más. * Firma tu contrato de forma digital.",https://www.inmuebles24.com/propiedades/clasificado/alclapin-departamento-semiamueblado-en-renta-cerca-del-estadio-146947748.html,"MN 17,300","Privada Sauces
San Lorenzo Huipulco, Tlalpan","65 m² lote, 2 rec., 2 baños, 2 estac.",Tlalpan
"Departamento completamente amueblado. Cuenta con 190m2. Cuenta con sala comedor. Cocina integral abierta con isla. Cuarto de servicio con baño. área de lavado. 3 recámaras. 2 baños completos. 2 lugares de estacionamiento techados. Amenidades como: salón de eventos Y jardin con gran vista panoramica. El precio de renta es más mantenimiento. Requisitos para rentar: 1 mes de deposito. 1 mes de renta adelantada. Fiador con bien raíz en cdmx O área metropolitana. Comprobantes de ingreso (por 3 veces la renta), A traves de nomina O estados de cuenta bancarios. Poliza juridica.",https://www.inmuebles24.com/propiedades/clasificado/alclapin-renta-departamento-jardines-en-la-montana.-amueblado-66463904.html,"MN 33,000","PICO DE VERAPAZ
Jardines en la Montaña, Tlalpan","190 m² lote, 3 rec., 2 baños, 2 estac.",Tlalpan
"Amplio departamento en renta, a unos metros del hospital de Alta Especialidad Pemex Picacho. Se ubica en un 2do piso sin elevador. Son dos recamaras, estudio, sala, comedor, cocina con ante comedor, amplia área de lavado, con mucha iluminación, el edificio esta muy cerca del acceso principal a la Unidad habitacional. Cuenta con persianas aunque habrá que darle mantenimiento. Los pisos en las áreas sociales son de loseta ceramica y en las recamaras piso laminado. Llamanos para una cita Ver datos",https://www.inmuebles24.com/propiedades/clasificado/alclapin-departamento-en-renta-142898942.html,"MN 17,000","Periferico Sur No. , edificio E-
PEMEX, Tlalpan","107 m² lote, 2 rec., 2 baños, 1 estac.",Tlalpan
"Vive en un depa con excelente distribución, iluminación natural y una gran vista hacia la Ciudad de México. Ubicado en el 4º piso de un edificio de solo cuatro niveles, este espacio de 83 m² más 3 m² de balcón cuenta con 2 recámaras, 2 baños completos, cocina integral, cuarto de lavado y 2 lugares de estacionamiento en batería en sótano. Situado en la Col. Miguel Hidalgo 4ta Sección, Tlalpan, te ofrece un entorno tranquilo con acceso rápido a vialidades principales. El edificio cuenta con seguridad y una palapa ideal para reuniones al aire libre. Además, se aceptan mascotas respetando el reglamento. Aprovecha la amplitud, las vistas y la comodidad de vivir en un espacio moderno y funcional. Agenda una visita y enamórate de tu próximo hogar. Con Homie renta sin aval. Proceso 100% digital. Tú eliges cómo pagar la renta a través de diferentes formas de pago. ¡Conoce ya este depa e independízate de las tareas de rentar! Departamento de 83. 0 metros cuadrados cuenta con: - 2 habitaciones. - 2. 0 baños. - Se aceptan mascotas. - 2 lugares de estacionamiento. Características: - Balcón. - Cuarto de lavado. - Cocina integral. Amenidades: - Seguridad. - Espacio para visitas. - Asador. Antigüedad: 11 años. . Número de habitantes recomendado: 4. Disponibilidad para mostrar: 24/julio/2025. Disponibilidad para habitar: 24/julio/2025. ¡Enamórate de tu vida en este departamento! # Homie Id: 9_4_6_5_1. Estos son los beneficios que tienes como inquilino al rentar tu nuevo hogar con nosotros: * No necesitas aval (sujeto a Términos y Condiciones). * Realiza el pago de tu renta mediante transferencia digital en nuestra plataforma o en efectivo en miles de locales disponibles. * Asistencia y conciliación con tu propietario. * Proceso sin burocracia, renta en cuestión de horas y sin trámites complicados. * Descuentos exclusivos en mudanzas, muebles y más. * Firma tu contrato de forma digital.",https://www.inmuebles24.com/propiedades/clasificado/alclapin-departamento-con-gran-vista-en-tlalpan-94651-147074626.html,"MN 15,500","Piñanona
Miguel Hidalgo 2A Sección, Tlalpan","83 m² lote, 2 rec., 2 baños, 2 estac.",Tlalpan
"Ref: 2 5 0 2 1 0. Disfruta de la comodidad y tranquilidad que ofrece este hermoso departamento en renta ubicado en Héroes de Padierna, Tlalpan, Ciudad de México. Con una construcción de 68 m2, habitables y una terraza de 40 m2. Esta propiedad cuenta con 2 recamaras, 1 baño completo, cocina equipada, piso de cerámica y piso laminado. Además, podrás disfrutar en la terraza de una excelente vista para relajarte al aire libre y disfrutar con tu familia de unas exquisitas parrilladas. La ubicación de este departamento es ideal para aquellos que buscan un ambiente residencial tranquilo y seguro. En la zona, encontrarás una variedad de servicios y comercios cercanos que harán tu vida cotidiana mucho más cómoda. Entre las zonas de interés cercanas se encuentran el centro comercial Perisur, el Parque Nacional Fuentes Brotantes y el Hospital Ángeles del Pedregal. Adicional alrededor de la zona, cuenta con Escuelas, Hospitales, Mercados y pequeñas plazas comerciales y Bancos. Para tu comodidad, las principales vías de acceso a esta propiedad incluyen la Avenida Periférico Sur y la Carretera Picacho-Ajusco. Asimismo, podrás acceder fácilmente a estaciones de metro como la estación Perisur y a diversas rutas de transporte público que te conectarán con diferentes puntos de la ciudad. No pierdas la oportunidad de vivir en este encantador departamento en una de las zonas más exclusivas de la Ciudad de México.",https://www.inmuebles24.com/propiedades/clasificado/alclapin-departamento-en-renta-heroes-de-padierna-alcaldia-146538485.html,"MN 15,000","Contoy 345 , Héroes de Padierna , 14200 Tlalpan, Ciudad de México, México
Héroes de Padierna, Tlalpan","108 m² lote, 2 rec., 1 baño",Tlalpan
"¿Buscas un lugar tranquilo y seguro para vivir? Te ofrezco este increíble departamento de 3 recámaras en Hacienda de la Escalera, Coapa. Es un espacio ideal para ti y tu familia. Amplio balcón con vista panorámica. 3 recámaras iluminadas. 2 baños completos. Cocina integral. Acepto mascotas. El edificio es muy seguro, con servicio de portería y vigilancia 24/7. También tiene elevador y un cajón de estacionamiento. Todo por solo $23, 000 al mes (mantenimiento incluido). Contáctame por mensaje directo para más detalles y agendar una cita. Amenidades. Balcón. Estacionamiento techado. Cocina integral. Conmutador. Elevador. Portero. Mascotas permitidas",https://www.inmuebles24.com/propiedades/clasificado/alclapin--renta-de-departamento-con-balcon-en-coapa!-147450262.html,"MN 23,000","hacienda de la escalera
Ex Hacienda Coapa, Tlalpan","120 m² lote, 3 rec., 2 baños, 1 estac.",Tlalpan
"Departamento en renta, remodelado, consta de dos recamaras con closet, un baño completo, área de tendido y lavado, espacio para sala y comedor. Un lugar de estacionamiento privado.",https://www.inmuebles24.com/propiedades/clasificado/alclapin-departamento-renta-146443809.html,"MN 20,000","LA ROSA
Ex Hacienda San Juan de Dios, Tlalpan","120 m² lote, 2 rec., 1 baño, 1 estac.",Tlalpan
"¡Con roof garden privado, estancia de doble altura ybalcones! Consta de 2 recamaras, (principal con baño) , 2 baños completos, sala comedor, area de lavado, ventanales de piso a techo con persianas automatizadas, 2 lugares de estacionamiento y seguridad 24 horas. Se encuenta en 4 nivel de 4, cuenta con elevador y es interior! Acepta mascotas. Requisitos: mes de renta, mes de deposito, fiador libre de gravamen u obligado solidario con poliza juridica (30% del total de la renta) . Renta mas $2, 000 de mantenimiento. (4)",https://www.inmuebles24.com/propiedades/clasificado/alclapin-renta-departamento-ph-en-colonia-heroes-de-padierna-146569559.html,"MN 20,000","Pomuch
Héroes de Padierna, Tlalpan","164 m² lote, 2 rec., 2 baños, 2 estac.",Tlalpan
"Departamento tipo loft en renta, 35 m2 aprox, espacio de 1 habitación, clóset, área cocina, semi amueblado, baño completo, área de lavado y tendido, sin estacionamiento",https://www.inmuebles24.com/propiedades/clasificado/alclapin-departamento-renta-147151362.html,"MN 5,200","PASEO DE LAS FLORES
La Primavera, Tlalpan","35 m² lote, 1 rec., 1 baño",Tlalpan
"Exclusivo Depa en venta o renta 272 m2, 3 Hab, 2. 5 Bn, 2 Estac, Sur cdmx. - 272 m2 incluyendo el increíble Roof Garden de 90 m2 con pérgola con aislamiento térmico, Terraza de 14 m2. - Baño principal con Jacuzzi. - Área de lavado. - Amplia bodega y elevadores. - Vigilancia 24/7, condominio seguro y tranquilo. - Mantenimiento incluido en el precio. - renta con muebles en 55, 000 mxn. Venta con muebles en 10, 550, 000 mxn. - Se acepta un perro pequeño o un gato. Amenidades exclusivas: - 2 hectáreas de áreas verdes y deportivas. - Pista de tartán. - Canchas de fút y de front tennis. - Alberca techada y climatizada de dos pistas. - Alberca exterior con terraza común. - Gimnasio súper equipado. - Área de juegos infantiles. - Área para perritos. - Ludoteca. - Salón de eventos con terraza para 250 personas. Requisitos para la renta: - Póliza de arrendamiento a cargo del inquilino. - Investigación de solvencia económica del inquilino y el obligado solidario con costo de aproximadamente 1, 199 ya incluido en el costo de la póliza. - Un mes de depósito en garantía a la firma del contrato. - Un mes de renta a la firma del contrato",https://www.inmuebles24.com/propiedades/clasificado/veclapin-exclusivo-depa-en-venta-o-renta-272-m-sup2--3-hab-147213783.html,"MN 48,000","Mirador 18
Fuentes de Tepepan, Tlalpan","272 m² lote, 3 rec., 2 baños, 2 estac.",Tlalpan
"Extraordinario Pent House en una de las calles principales de Jardines en la Montaña. Fue renovado hace 4 años, está impecable. , caseta de vigilancia además de la vigilancia del fraccionamiento. Las vistas son increíbles así como la luz y los generosos espacios. El departamento, de dos niveles, cuenta con una estancia muy amplia en dónde cabe inclusive la sala de tv con salida a una linda y amplia terraza. La cocina es cerrada de gran tamaño, con espacio desayunador que da a la terrraza, también con gran vista, enorme alacena y área de lavado y cuarto de servicio con baño integrado. Cuenta con tres amplias recámaras, dos con vestidor y una con clóset, todas con baño privado y una con terraza tan amplia como la de la estancia. Excelentes vistas a la ciudad. Linda luz y vistas en las tres recámaras. Cuenta con 4 lugares de estacionamiento y clósets de almacenamiento muy buenos en esa área. El departamento está en venta Y renta (con mantenimiento incluído). Informes 55 Ver datos. El edificio cuenta con vestíbulo y vigilancia privada. Es una magnífica oportunidad de departamento en este increíble fraccionamiento. En este inmueble no asesores externos. Disculpen. Agenda tu cita o contáctanos a través de esta publicación. La compraventa de esta propiedad se puede realizar mediante recursos propios o crédito. Para aviso de privacidad, quejas, sugerencias o aclaraciones. Ver datos. Los gastos e impuestos de escrituración (con la Notaría de tu elección) y cargos relacionados por algún tipo de crédito no están incluidos en el precio de venta, así como el mobiliario, electrodomésticos y arte que se muestran en las fotografías. Nota importante: Toda la información y medidas provistas son aproximadas y deberán ratificarse con la documentación pertinente y no compromete contractualmente a nuestra empresa.",https://www.inmuebles24.com/propiedades/clasificado/veclapin-venta-y-renta-departamento-pent-house-en-jardines-en-90738316.html,"MN 85,000","PICO DE VERAPAZ 519
Jardines en la Montaña, Tlalpan","286 m² lote, 3 rec., 3 baños, 4 estac.",Tlalpan
"! La renta es de 20, 000 más 3, 890 de mantenimiento! Hermoso y cómodo departamento al sur de la ciudad en un gran condominio con espectaculares áreas comunes para disfrutar de un espacio rodeado de naturaleza. Ubicado muy cerca del Tec de Monterrey, paseo Acoxpa, gran terraza Coapa.",https://www.inmuebles24.com/propiedades/clasificado/alclapin-renta-depto-en-bosques-de-tepepan-147121840.html,"MN 20,000","Mirador 18
Fuentes de Tepepan, Tlalpan","92 m² lote, 2 rec., 2 baños, 2 estac.",Tlalpan
"Departamento en un tercer piso, con hermosa vista y muy amplio, tiene 2 recamaras con baño completo, la principal con vestidor y con bastante espacio. La estancia con mucha iluminación, cocina integral abierta, cuarto de servicio y con espacio para estacionar 5 autos. En un edificio de 3 pisos, sin elevador, con servicio de gas natural y dentro de un fraccionamiento con vigilancia, la entrada se ubica sobre la carretera Picacho Ajusco. Se puede rentar con o sin muebles, precio negociable",https://www.inmuebles24.com/propiedades/clasificado/alclapin-departamento-en-renta-en-el-ajusco-146109675.html,"MN 25,000","Picacho Ajusco 886
Héroes de Padierna, Tlalpan","200 m² lote, 2 rec., 2 baños, 5 estac.",Tlalpan
"[arr] id houm: Ver datos. Entérate de todos los beneficios al rentar con Houm: • No te pedimos aval. • Asistencia e intermediación con el propietario. • Firma tu contrato online. • Renta sin burocracia, papeleos y mucho más rápido. • Difiere tu depósito en hasta 6 meses sin interés. Departamento en renta, ubicado en la colonia Fuentes de Tepepan, con una superficie construida de 73. 00 m² y superficie total de 73. 00 m². Sus principales características son: • Sin amueblar. • 2 recámaras. • 2 baños. • No Admite mascotas. • 1 estacionamiento. • Cocina equipada. • Piso 2. • Año de construcción: 2022. Además, el inmueble cuenta con las siguientes amenidades: • Vigilancia 24 hrs. • Lavandería. Si rentas con nosotros, te brindamos asesoría personalizada durante todo el proceso. Importante: • Se deben demostrar ingresos de 3 veces el valor de la renta. • En caso de que tus ingresos no lleguen a 3 veces el valor de la renta, estos pueden ser la suma de las personas que vivirán en la propiedad. • Te invitamos a agendar una visita a esta propiedad: esta puede ser presencial o vía streaming, desde la comodidad de tu hogar. • Y lo mejor. Sin aval. Más que una corredora, somos Houm. *Aplican T&C",https://www.inmuebles24.com/propiedades/clasificado/alclapin-departamento-en-fuentes-de-tepepan-con-2-recamaras-147361335.html,"MN 11,500","Camino Real Al Ajusco
Fuentes de Tepepan, Tlalpan","73 m² lote, 2 rec., 2 baños, 1 estac.",Tlalpan
"Descripción del Inmueble: -Este departamento, ubicado en el 3er piso del edificio, se encuentra disponible para renta en la dirección Corregidora 430, en la colonia El Capulín, Tlalpan, Ciudad de México. Con una renta. mensual de 14, 000 mxn, es una excelente opción para quienes. buscan comodidad y una ubicación estratégica. Características y Comodidades: -Dimensiones: La propiedad tiene una construcción de 65. 0 m². -Espacios: Cuenta con 2 recámaras y 2 baños completos con regaderas. -Cocina: Dispone de una cocina integral y un desayunador, ideales para tus actividades diarias. -Áreas comunes: El departamento incluye sala, comedor y área de lavado. -Estacionamiento: Ofrece 2 lugares de estacionamiento, un gran beneficio en la zona. -Antigüedad y Estado: El inmueble tiene 7 años de antigüedad y se encuentra en buen estado de conservación. -Amenidades del Edificio: Para tu comodidad, el edificio cuenta con un elevador. Servicios: La propiedad tiene servicios como agua, luz, drenaje y cisterna. También está equipado con closets, tanque de gas estacionario, línea telefónica, tv por cable y fibra óptica. Ubicación y Entorno: La propiedad se localiza en una zona con importantes puntos de referencia como el Centro Acuático ceforma. y el Parque Nacional Fuentes Brotantes, lo que garantiza acceso a áreas verdes y de recreación. Su ubicación facilita el acceso a diversas vías principales, mejorando la conectividad dentro de la Ciudad de México. ¡No pierdas la oportunidad de vivir en un departamento funcional en una zona tranquila! Contáctanos para agendar una visita y conocer más sobre esta propiedad.",https://www.inmuebles24.com/propiedades/clasificado/alclapin-departamento-moderno-en-renta-con-2-recamaras-y-2-147259403.html,"MN 14,000","Corregidora 430
Barrio El Capulín, Tlalpan","65 m² lote, 2 rec., 2 baños, 1 estac.",Tlalpan
