Título,Enlace,Precio,Dirección,Características,Municipio de Origen
"Este departamento en renta se ubica en la tranquila zona de Arenal Tepepan. El interior cuenta con sala, comedor, balcon, cocina integral area de servicio para conexion de lavadora, 3 recámaras con clósets y 2 baños completos. Además, dispone de cuarto de servicio. En el exterior, 2 lugares de estacionamiento asi como de visitas. El edificio ofrece caseta de guardia y seguridad privada. Arenal Tepepan es una zona residencial tranquila, ideal para familias. Cuenta con escuelas cercanas y fácil acceso a servicios básicos como agua y luz. El área ofrece una mezcla de tranquilidad y conveniencia, con acceso a transporte público y vialidades importantes. Encontrarás supermercados, tiendas de conveniencia y farmacias a poca distancia. La zona se percibe como segura, con servicios de vigilancia que contribuyen a un ambiente familiar y apacible.",https://www.inmuebles24.com/propiedades/clasificado/alclapin-departamento-de-3-recamaras-en-renta-arenal-tepepan-147293689.html,"MN 18,000","Arenal 694
Arenal Tepepan, Tlalpan","110 m² lote, 3 rec., 2 baños, 2 estac.",Tlalpan
Elevador portón eléctrico a control remoto 2 recamaras la principal de buen tamaño con su vestidor y baño completo integrados y la segunda con su amplio clóset el segundo baño completo también con su amplia estancia sala comedor con cocina integral totalmente equipada muy tranquilo y mucha luz natural con jaula de tendido en la zona zotea con arena cuenta con cuarto de servicio exclusivo muy amplio con instalación para su lavadora cuanta con elevador y con portón eléctrico a control remoto con cctv y con roof garden para eventos o reuniones excelente zona del sur,https://www.inmuebles24.com/propiedades/clasificado/alclapin-rento-departamento-amplio-con-excelente-ubicacion-147402523.html,"MN 15,000","Avenida Cafetales
Granjas Coapa, Tlalpan","98 m² lote, 2 rec., 2 baños, 1 estac.",Tlalpan
"Descubre este elegante y moderno departamento de 245 m² ubicado en el quinto piso de un edificio reciente Ver datos en la colonia Parque del Pedregal, a tan solo unos minutos de Perisur. Con una distribución ideal para quienes valoran el espacio y la luz, la propiedad cuenta con ventanales amplios que enmarcan una vista arbolada hacia el parque, lo que brinda una sensación de calma y conexión con la naturaleza. Tiene 3 recámaras, todas con vestidor y baño propio, family room, sala y comedor con acceso a dos balcones privados, una cocina integral equipada con servicios integrados, medio baño de visitas, cuarto de servicio, y 4 lugares de estacionamiento techado. El edificio ofrece elevador, vigilancia 24 horas, y un salón de usos múltiples con baños para tus reuniones o eventos.",https://www.inmuebles24.com/propiedades/clasificado/alclapin-exclusivo-departamento-con-vista-al-parque-en-parque-147230598.html,"MN 55,000","Alborada
Parque del Pedregal, Tlalpan","245 m² lote, 3 rec., 3 baños, 4 estac.",Tlalpan
"Excelente departamento en 1er. Piso, sin elevador, con buena iluminación cuenta con cocina integral con área de lavado anexa, dos recámaras la principal con baño completo y área de clóset abierta, la segunda recámara con área de clóset abierta. Aparte otro baño completo en área social. 1 estacionamiento en batería (hay que ponerse de acuerdo con otro vecino) Cuota de mantenimiento de 1, 200 (incluida en la renta) Se entrega sin persianas. No se aceptan mascotas. Características generales. Pisos de loseta cerámica, ventanas con marco de aluminio, muros y techos terminados en aplanado. Cisterna. Gas Natural. Cuenta con vigilancia y cctv. Estacionamiento para visitas. Amenidades. Salón de usos múltiples. Entorno urbano. Escuelas cercanas, Tec de Monterrey y plazas comerciales. Transporte público accesible",https://www.inmuebles24.com/propiedades/clasificado/alclapin-departamento-en-renta-en-primer-piso-col.-valle-147206912.html,"MN 16,000","Arenal 581
Valle Escondido, Tlalpan","70 m² lote, 2 rec., 2 baños, 1 estac.",Tlalpan
"Lindo departamento en renta en primer piso, exterior, portón eléctrico, Roof garden en azotea con asador. El departamento cuenta con 2 habitaciones con clósets, la principal con baño integrado, cocina integral concepto abierto, área de lavado con instalaciones para centro de lavado, un lugar de estacionamiento fijo. Nota: No se aceptan mascotas",https://www.inmuebles24.com/propiedades/clasificado/alclapin-departamento-en-renta-en-primer-piso-147368390.html,"MN 11,000","Chapab 49
Cuchilla de Padierna, Tlalpan","85 m² lote, 2 rec., 2 baños, 1 estac.",Tlalpan
"Departamento en renta en el desarrollo bosque de tepepan con excelente luz Y magnifica vista, ubicado en 6 piso, tienen cocina abierta sala comedor con terraza, medio baño, 3 recámaras todas con closet Y la principal con baño, las otras dos comparten baño, terraza con estupenda vista, 2 lugares de estacionamiento totalmente independientes, bodega. El departamento tiene canceles de cristal templado en los baños Y persianas en todas las ventanas mas black-out en las habitaciones. El condominio cuenta con 2 albercas una techada Y otra abierta, salón de fiestas para 300 personas, gimnasio, ludoteca, cancha de tenis Y frontón, pista de joggin, áreas verdes Y de juegos infantiles. Seguridad Y cctv. no se permiten mascotas",https://www.inmuebles24.com/propiedades/clasificado/alclapin-departamento-en-renta-fuentes-de-tepepan-147132298.html,"MN 22,000","Mirador 18
Fuentes de Tepepan, Tlalpan","100 m² lote, 3 rec., 2 baños, 2 estac.",Tlalpan
"- Departamento en venta o renta en Bosques de Tepepan, Tlalpan. - 195 m2. - 3 habitaciones. - 2. 5 baños. - 2 estacionamientos. - Roof Garden privado. - Piso 7. - Elevador. - Mantenimiento incluido. - Se aceptan mascotas. amenidades: - 2 hectáreas de áreas verdes y deportivas. - Pista de tartán. - Canchas de fút y de front tennis. - Alberca techada y climatizada de dos carriles. - Alberca exterior con terraza común. - Gimnasio súper equipado. - Seguridad 24/7. - Juegos infantiles. - Área para perritos. - Ludoteca. - Salón de eventos con terraza para 250 personas. requisitos para renta: - Póliza de arrendamiento a cargo del inquilino. - Investigación de solvencia económica del inquilino y el obligado solidario con costo de 1, 199 ya incluido en el costo de la póliza. - Un mes de depósito en garantía a la firma del contrato. - Un mes de renta a la firma del contrato",https://www.inmuebles24.com/propiedades/clasificado/veclapin-departamento-en-venta-o-renta-195-m-sup2--3-147351833.html,"MN 32,000","Mirador 18
Fuentes de Tepepan, Tlalpan","195 m² lote, 3 rec., 2 baños, 2 estac.",Tlalpan
"Descripción. Centro de Tlalpan – exclusivo, céntrico, lleno de vida. El departamento donde la luz, el espacio y la privacidad se encuentran. Hay lugares que simplemente se sienten como el hogar soñado. Este departamento no sólo está en el corazón del Centro de Tlalpan —uno de los barrios con más historia y encanto de la ciudad—, sino que también está diseñado para quienes buscan vivir con elegancia, amplitud y total privacidad. Desde que cruzas la puerta, la luz natural te da la bienvenida en cada rincón. Los ventanales amplios, los acabados de lujo, y la distribución inteligente te invitan a imaginar cenas largas, tardes tranquilas y momentos compartidos que se vuelven recuerdos. ¿Lo mejor? Un enorme roof garden privado que se convierte en tu refugio urbano: ideal para ejercitarte al aire libre, hacer reuniones bajo las estrellas o simplemente desconectarte del ruido del mundo. Características que te enamoran: • 3 recámaras (la principal con vestidor y baño privado) • 2. 5 baños + baño adicional en el roof garden. • Estancia amplia + espacio para family room o sala de T. V. • Cocina moderna con barra de granito. • Área de lavado independiente y cuarto de servicio con baño. • 3 estacionamientos techados. • Bodega + salón de usos múltiples. • Vigilancia 24/7. • Solo 3 niveles en el conjunto: tu privacidad está garantizada. Un departamento como pocos. Un estilo de vida como ninguno. Agenda tu cita y descubre por qué este espacio podría ser tu próxima historia de hogar. Citas:: 55 Ver datos y 55 Ver datos. requisitos: Un depósito, una renta, fiador con inmueble libre de gravamen y póliza jurídica que paga 50% propietario y 50% inquilino. . . Al ""Contactar"" para consultar esta propiedad, estás aceptando los ""Términos y Condiciones"" y ""Aviso de privacidad"". Aviso de Privacidad, Quejas, Sugerencias y más en nuestro sitio oficial. * El costo del mantenimiento, póliza jurídica, gastos de investigación, mobiliario, electrodomésticos y arte que se muestran en las fotografías no está incluido en el precio de renta. Todas las medidas enunciadas son meramente orientativas, las medidas exactas serán las que se expresen en el respectivo título de propiedad de cada inmueble.",https://www.inmuebles24.com/propiedades/clasificado/alclapin-departamento-en-renta-en-el-centro-de-tlalpan-146705581.html,"MN 34,500","Tlalpan Centro
Tlalpan Centro, Tlalpan","180 m² lote, 3 rec., 2 baños, 3 estac.",Tlalpan
"Si quieres vivir en un hermoso departamento rodeado de áreas verdes, no puedes dejar pasar esta oportunidad. En el hermoso condominio de Pedregal Dos, en el Edificio Verona se encuentra este departamento de 3 recamaras, una de ellas habilitada completamente como vestidor, dos baños, cocina, alacena, sala, comedor, área de tv. , área de lavado, todo remodelado y en perfectas condiciones. El precio de renta es de $35, 000. 00 mensuales, incluye mantenimiento. Agenda tu cita: Ver datos, y. Ver datos. requisitos: Un depósito, una renta, fiador con inmueble libre de gravamen y póliza jurídica que paga el inquilino. Al “Contactar” para consultar esta propiedad, estás aceptando los “Términos y condiciones” y “Aviso de Privacidad”. Aviso de Privacidad, Quejas, Sugerencias y más en el sitio Oficial. El Costo del mantenimiento, mobiliario, electrodomésticos y arte que se muestran en las fotografías no está incluido en el precio de renta. Todas las medidas enunciadas son meramente orientativas, las medidas exactas serán las que se expresen en el respectivo título de propiedad de cada inmueble.",https://www.inmuebles24.com/propiedades/clasificado/alclapin-departamento-en-renta-en-pedregal-dos-146061601.html,"MN 31,000","PEDREGAL DOS
Fuentes del Pedregal, Tlalpan","131 m² lote, 2 rec., 2 baños, 2 estac.",Tlalpan
"Vive en un ambiente seguro y bien ubicado en Santa Úrsula Coapa, dentro de una privada con acceso controlado, rodeado de parques, plazas comerciales y escuelas. Características del departamento: 2 recámaras – La principal con su propio baño. Cuarto de televisión – Espacio ideal para entretenimiento o estudio. 2 baños completos – Funcionalidad y comodidad para la familia. nsala y comedor amplios – Perfectos para disfrutar y recibir visitas. Cocina cómoda – Diseño práctico para facilitar tu día a día. Área de lavado – Espacio independiente para mayor comodidad. 1 cajón de estacionamiento independiente – Seguridad y acceso exclusivo. Amenidades en la privada: Juegos infantiles para los más pequeños, Cancha de fútbol para ejercitarse y divertirse. Vigilancia 24/7 – Seguridad y tranquilidad garantizadas. Este departamento es ideal para quienes buscan confort, seguridad y una excelente ubicación",https://www.inmuebles24.com/propiedades/clasificado/alclapin-como-departamento-en-santa-ursula-coapa-146126145.html,"MN 18,000","LAS FLORES
Santa Úrsula Xitla, Tlalpan","90 m² lote, 2 rec., 2 baños, 1 estac.",Tlalpan
"Amplio departamento en Fuentes de la infancia, 6º piso en Fuentes del PedregalCuenta con 93m2Muy iluminadoEstancia sala - comedorCocina IntegralÁrea de lavado2 recamaras la principal con baño completoBaño completo para la 2da. Habitaciòn y para visitas1 lugar de estacionamientoCuarto de servicio2 elevadoresVigilancia 24/7Mantenimiento incluido",https://www.inmuebles24.com/propiedades/clasificado/alclapin-departamento-en-fuentes-del-pedredal-146690023.html,"MN 20,900","Fuente de la Infancia 47, Col. Fuentes del Pedregal, Alcaldia Tlalpan, CP 14140, Cdmx 47
Fuentes del Pedregal, Tlalpan","93 m² lote, 2 rec., 2 baños, 1 estac.",Tlalpan
"Departamento en Renta en jardínes en la montaña. Departamento en Renta en Rayo Vende. ¡El estilo que te gusta y mereces! Departamento en Fraccionamiento cerrado en Tlalpan. Construcción: 339 m2. Piso: 4. • Sala- comedor. • Cocina abierta tipo loft. • 2 recámaras con vestidor y baño. • 2. 5 baños. • Estudio. • Family Room. • 4 lugares de estacionamiento. • Bodega. Mantenimiento $10, 800. ¡Listo para estrenar departamento con Rayo Vende Inmobiliaria! ¡Hazlo tuyo, invierte y estrena!, tenemos más de 40 años de experiencia, te asesoramos en todo el proceso de Renta con Seguridad, Honestidad y Transparencia. ¡Contáctanos hoy mismo! (55) Ver datos. Ver datos. • 2 recámaras (opción a 3) • 2. 5 baños. • 4 estacionamientos. • 339 metros de construcción. • Piso 4. • Family. • Estudio. • Antigüedad 2010. Amplio departamento en fraccionamiento cerrado. Doble vigilancia. Elevador al piso. Iluminada sala - comedor con vista al bosque. Espaciosa cocina y antecomedor. 2 recámaras con vestidor y baño, opción a tercera recámara. Estudio, family room. Cuenta también con lavandería y cuarto de servicio. 4 estacionamientos y bodega.",https://www.inmuebles24.com/propiedades/clasificado/alclapin-departamento-en-renta-en-jardines-en-la-montana-146095331.html,"MN 70,000","PICO DE VERAPAZ
Jardines en la Montaña, Tlalpan","339 m² lote, 2 rec., 2 baños, 4 estac.",Tlalpan
"Vive en este cómodo departamento, la calle empedrada te dará una acogedora bienvenida, estarás a 5 minutos de Insurgentes Sur y Viaducto Tlalpan, tendrás cerca mercados, plazas, entre otros. Cuenta con sala y comedor, 2 recámaras con opción a 3a, 1 baño completo, Cocina de excelente tamaño, cómodo área de lavado y un lugar de estacionamiento. La luz en este departamento es increíble. El condominio es muy familiar, cuenta con seguridad 24/7, área de niños, cancha de básquet y área con aparatos para ejercitarse. El departamento se encuentra en 5o piso, no tiene elevador. Cuenta con cisterna general. Citas: 55 Ver datos y 55 Ver datos. Al ""Contactar"" para consultar esta propiedad, estás aceptando los ""Términos y Condiciones"" y ""Aviso de privacidad"". Aviso de Privacidad, Quejas, Sugerencias y más en nuestro sitio oficial. * Los gastos e impuestos de escrituración no están incluidos en el precio de venta, así como el mobiliario, electrodomésticos y arte que se muestran en las fotografías. Las medidas son ilustrativas y deben de corroborarse con los títulos de propiedad respectivos y/o las boletas predial. Los precios publicados y la disponibilidad pueden cambiar sin previo aviso por lo que se debe de verificar con la inmobiliaria y los propietarios de los inmuebles.",https://www.inmuebles24.com/propiedades/clasificado/veclapin-departamento-en-renta-venta-en-tlalpan-144499023.html,"MN 12,000","Diligencias S/N
San Pedro Mártir, Tlalpan","75 m² lote, 2 rec., 1 baño, 1 estac.",Tlalpan
"Ive en una de las zonas más tranquilas del sur de la cdmx. A una cuadra de periférico, muy cerca del Tec de Monterrey campus Ciudad de México y del Colegio Alemán. Con rápido acceso a la zona de hospitales del Tlalpan, centros comerciales y escuelas. Este cómodo departamento en planta baja es ideal para quienes buscan funcionalidad, ubicación y seguridad. El departamento tiene dos recamaras, la principal con baño, y otro baño completo para dar servicio a la segunda recamara y a las visitas, sala, comedor, cocina integral, área de lavado que incluye centro de lavado y un cajón de estacionamiento. Agende su cita: 55 Ver datos y 55 Ver datos. requisitos: Un depósito, una renta, fiador con inmueble libre de gravamen y póliza jurídica que paga 50% propietario y 50% inquilino. . . Al ""Contactar"" para consultar esta propiedad, estás aceptando los ""Términos y Condiciones"" y ""Aviso de privacidad"". Aviso de Privacidad, Quejas, Sugerencias y más en nuestro sitio oficial. * El costo del mantenimiento, póliza jurídica, gastos de investigación, mobiliario, electrodomésticos y arte que se muestran en las fotografías no está incluido en el precio de renta. Todas las medidas enunciadas son meramente orientativas, las medidas exactas serán las que se expresen en el respectivo título de propiedad de cada inmueble.",https://www.inmuebles24.com/propiedades/clasificado/alclapin-departamento-en-renta-en-tlalpan-arenal-tepepan-147240017.html,"MN 14,000","Arenal Tepepan
Tlalpan, Ciudad de México","63 m² lote, 2 rec., 2 baños",Tlalpan
"Departamento loft en Renta en Tlalpan. Departamento loft en Rayo Vende Inmobiliaria. Hermoso loft recién remodelado, combina comodidad y estilo en un ambiente moderno y funcional. Se encuentra en P. B. , completamente amueblado, listo para habitarse. Cuenta con: • Sala y comedor. • Cocina equipada. • Un baño completo. • Área de lavado independiente. • Un lugar de estacionamiento. Tiene acceso a un lindo jardín común, ideal para relajarse al aire libre, perfecto para una persona sola o una pareja, te encantará la tranquilidad, solo 7 departamentos. ¡Listo para rentar departamento loft con Rayo Vende Inmobiliaria! Tenemos más de 40 años de experiencia, te asesoramos en todo el proceso de renta con Seguridad, Honestidad y Transparencia. ¡Contáctanos hoy mismo!",https://www.inmuebles24.com/propiedades/clasificado/alclapin-departamento-loft-en-renta-en-tlalpan-147096536.html,"MN 10,000","FERNANDO BELTRAN Y PUGA
Miguel Hidalgo, Tlalpan","70 m² lote, 1 rec., 1 baño, 1 estac.",Tlalpan
"Departamento en Renta en lomas del pedregal. Departamento Renta en Rayo Vende Inmobiliaria. Seguridad, tranquilidad, ubicación, plusvalía… ¡Si se puede! • Construcción 288 m2. • 3 Recámaras. •Comedor. • Sala. •Cocina abierta. •Estacionamiento para 2 autos. • Cuarto de servicio. •Juegos infantiles. Amenidades: • Gimnasio equipado. • Salón de usos múltiples. • Terraza con asador. Renta más Mantenimiento. A una cuadra de Periférico Sur y a dos cuadras del Hospital Ángeles del Pedregal en un exclusivo fraccionamiento, te ofrecemos este departamento exterior, en segundo piso. La sala y comedor con balcón con vista a impecable área verde común y un gran ventanal que permite la entrada de luz natural a todo el departamento; cocina abierta con barras de granito, iluminada y de muy buen tamaño. Baño de visitas, clóset de blancos. Hall distribuidor, tres recámaras, dos de ellas comparten baño y una de ellas puede ser family o estudio. La recámara principal tiene vestidor y baño completo. Las tres recámaras con vista al jardín interior. Tiene cuarto de servicio con baño, lavandería, estacionamiento para 2 autos, vigilancia estricta 24/7. Las amenidades que puedes disfrutar son gimnasio, salón de usos múltiples para 100 personas y terraza, además de su impecable jardín común. Aceptan mascota pequeña. ¡Listo para rentar departamento con Rayo Vende Inmobiliaria! ¡Hazlo tuyo, renta y vívelo!, tenemos más de 40 años de experiencia, te asesoramos en todo el proceso de renta con Seguridad, Honestidad y Transparencia. ¡Contáctanos hoy mismo! (55) Ver datos. Ver datos",https://www.inmuebles24.com/propiedades/clasificado/alclapin-departamento-en-renta-en-lomas-del-pedregal-146912293.html,"MN 54,000","Cobalto 70 edif A
Lomas del Pedregal, Tlalpan","190 m² lote, 3 rec., 2 baños, 2 estac.",Tlalpan
"Departamento en Renta en Ex Hacienda SanJuan. Departamento en Renta en Rayo Vende Inmobiliaria. A dos cuadras del Periférico, Hospital de Rehabilitación, tec de Monterrey, Paseo Acoxpa, se encuentra este departamento muy iluminado. Consta de: • Sala. • Comedor. • 2 recámaras, la principal con baño, la otra lo tiene afuera. • Closet de blancos. • Área de lavado. • Estacionamiento fijo para 1 auto sin estorbar. • Áreas verdes. • Seguridad. ¡Listo para disfrutar departamento con Rayo Vende Inmobiliaria! ¡Hazlo tuyo, invierte y disfruta! , tenemos más de 40 años de experiencia, te asesoramos en todo el proceso de compra con Seguridad, Honestidad y Transparencia. ¡Contáctanos hoy mismo!",https://www.inmuebles24.com/propiedades/clasificado/alclapin-departamento-en-renta-en-ex-hacienda-san-juan-146648318.html,"MN 17,200","Calzada Mexico Xochimilco
Ex Hacienda San Juan de Dios, Tlalpan","87 m² lote, 2 rec., 2 baños, 1 estac.",Tlalpan
"A 15 minutos en coche de Six Flags subiendo sobre la Carr. Libre Picacho Ajusco. Amplia casa en condominio de 4 casas,, cuenta con 5 habitaciones, 4 baños completos y uno medio, además de lugar de estacionamiento para 2 autos. Nota importante: toda la información y medidas provistas son aproximadas y deberán ratificarse con la documentación pertinente y no compromete contractualmente a nuestra empresa. Los gastos expresados refieren a la última información recabada y deberán confirmarse. Fotografías no vinculantes ni contractuales. Contacto. -Alejandra Ozuna. -55 Ver datos",https://www.inmuebles24.com/propiedades/clasificado/alclapin-casa-en-condominio-en-picacho-ajusco.-144256208.html,"MN 26,500","Carretera picacho Ajusco
Miguel Hidalgo 3A Sección, Tlalpan","250 m² lote, 5 rec., 4 baños, 2 estac.",Tlalpan
"Departamento en renta de 55 m2. Ubicado en segundo piso, cuenta con 1 recámara, 1 baño completo, sala, comedor, cocina, área de lavado al exterior, zona de tendido en la azotea, sin estacionamiento, no acepta mascotas.",https://www.inmuebles24.com/propiedades/clasificado/alclapin-departamento-renta-147240901.html,"MN 7,500","MAYAS
Tlalcoligia, Tlalpan","55 m² lote, 1 rec., 1 baño",Tlalpan
"Departamento en tercer nivel no hay elevador. No mascotas. No niños. 100 m2. Tres recámaras - *Dos recámaras cuentan con balcón*- Dos baños completos. Sala. Comedor. Calentador solar. 1 cajón de estacionamiento. Portón automático. Sin mascotas. $14, 000. Incluye mantenimiento. (Aproximadamente de servicios son $500. Mensuales) Departamento en tercer nivel. 100 m2. Tres recámaras - *Dos recámaras cuentan con balcón*- Dos baños completos. Sala. Comedor. Calentador solar. 1 cajón de estacionamiento. Portón automático. Sin mascotas. $14, 000. Incluye mantenimiento. (Aproximadamente de servicios son $500. Mensuales) nota: no mascotas. No niños.",https://www.inmuebles24.com/propiedades/clasificado/alclapin-rento-departamento-3-recamaras-100-m-ubicacion-cerca-146799002.html,"MN 14,000","Tarahumaras
Pedregal de las Aguilas, Tlalpan","100 m² lote, 3 rec., 2 baños, 1 estac.",Tlalpan
"286 m2 en 2 niveles, 3 recámaras cada una con baño, vestidor en la principal, 2 terrazas, sala y comedor, sala de tv, desayunador con espacio para family room, cocina, cuarto de servicio y cuarto de lavandería, 4 autos, closets de guardado en garage, Edificio de 5 niveles, 20 departamentos, doble seguridad, fraccionamiento con parques privados, renta más mantenimiento Gentry Real Estate es una Agencia Inmobiliaria conformada por Personal altamente profesional; quienes se capacitan constantemente con el objetivo de estar dispuestos a enfrentar los cambios que el sector inmobiliario lanza día con día, con ello, procuran y salvaguardan que los clientes tomen la mejor decisión en todas sus operaciones.",https://www.inmuebles24.com/propiedades/clasificado/alclapin-departamento-en-renta-jardines-en-la-montana-ph-143822752.html,"MN 75,000","Jardines en la Montaña, PH en Renta o Venta
Jardines en la Montaña, Tlalpan","286 m² lote, 3 rec., 3 baños, 4 estac.",Tlalpan
"Departamento en renta en zona sur, Cuenta con estancia, 2 recámaras con clósets amplios, 2 baños completos, cocina integral independiente, área de lavado dentro del departamento, salón de usos múltiples para algún evento y áreas verdes, estacionamiento para 2 autos uno detrás del otro. Vigilancia privada las 24 horas con circuito cerrado. Adriana sánchez Ver datos. 87",https://www.inmuebles24.com/propiedades/clasificado/alclapin-departamento-en-renta-147413577.html,"MN 16,500","Calzada del hueso 554
Granjas Coapa, Tlalpan","83 m² lote, 2 rec., 2 baños, 2 estac.",Tlalpan
"El departamento cuenta con 58 metros cuadrados, distribuidos en 2 habitaciones, 2 baños completos, área para sala, comedor; asimismo cuenta con cocina integral, zotehuela, roof garden (área común de la Torre), 1 lugar de estacionamiento, elevador, vigilancia las 24/7, circuito cerrado, estacionamiento para visitas y portón eléctrico. ¡Ven a conocerlo, no te arrepentirás! Muy cerca de bancos, escuelas, farmacias y tiene fácil acceso a una de las principales vías de circulación. La renta ya incluye el mantenimiento ($1, 500 pesos mensuales).",https://www.inmuebles24.com/propiedades/clasificado/alclapin--en-renta-hermoso-departamento-ubicado-muy-cerca-de-la-146481482.html,"MN 16,500","Arenal
Arenal Tepepan, Tlalpan","58 m² lote, 2 rec., 2 baños, 1 estac.",Tlalpan
"No asesores. Cerca de Viaducto Tlalpan, Periférico, Calzada México-Xochimilco, Calzada Acoxpa, Tecnológico de Monterrey, Costco, Colegios, Centros Comerciales, Hospitales. Requisitos: Un depósito, una renta, un aval, el pago de una póliza jurídica, referencias y comprobación de ingresos 3/1.",https://www.inmuebles24.com/propiedades/clasificado/alclapin-departamento-en-renta-en-hacienda-san-juan-146118259.html,"MN 22,000","Hacienda San Juan
Hacienda de San Juan de Tlalpan, Tlalpan","102 m² lote, 3 rec., 2 baños, 2 estac.",Tlalpan
