Título,Enlace,Precio,Dirección,Características,Municipio de Origen
"Departamento en renta. 93m2. *3 habitaciones con closet y la principal con baño completo. *Sala-comedor. *Balcón de 9m2; *Cocina integral. *Área de lavado independiente. *Baño completo de visitas. *1 lugar de estacionamiento/compartido/descubierto. Áreas comúnes: *Salón multiusos. *Jardín con juegos para niños. *Área de asadores. *Gimnasio. *Contenedores para basura. *Vigilancia. Se aceptan mascotas con previo aviso y con clausula específica en el contrato de arrendamiento que pagan los daños causados. Incluye: Mantenimiento y agua. Ubicación totalmente al Sur de la cdmx a 5 min del Colegio Militar, a 10 min de la caseta de cobro de Cuernavaca. Requisitos: 1 mes de renta corriente, 1 mes de depósito en garantía, Póliza juridica con obligado solidario (50-50) (4)",https://www.inmuebles24.com/propiedades/clasificado/alclapin-departamento-en-renta-a-5-min-del-colegio-militar-147381578.html,"MN 14,500","PALMA
La Palma, Tlalpan","93 m² lote, 3 rec., 2 baños, 1 estac.",Tlalpan
"Lindo departamento con buena ubicación, muy cerca de Viaducto Tlalpan, salida a Cuernavaca y a unos 10 minutos de la zona de Hospitales y centros comerciales. Cuenta con una estancia, sala-comedor, cocina integral con área de lavado integrada, 2 recámaras, estudio que pudiera ser la tercera recámara, 1 baño completo. Unidad rodeada de áreas verdes, vigilancia las 24 horas. 1 auto fijo. , lugar tranquilo y confortable.",https://www.inmuebles24.com/propiedades/clasificado/alclapin-departamento-en-renta-en-san-pedro-martir-147351912.html,"MN 9,000","Camino Viejo a San Pedro Martir
San Pedro Mártir, Tlalpan","65 m² lote, 3 rec., 1 baño, 1 estac.",Tlalpan
"[arr] id houm: Ver datos. Entérate de todos los beneficios al rentar con Houm: • No te pedimos aval. • Asistencia e intermediación con el propietario. • Firma tu contrato online. • Renta sin burocracia, papeleos y mucho más rápido. • Difiere tu depósito en hasta 6 meses sin interés. Departamento en renta, ubicado en la colonia Héroes de Padierna, con una superficie construida de 60. 00 m² y superficie total de 60. 00 m². Sus principales características son: • Amueblado. • 1 recámara. • 1 baño. • No Admite mascotas. • Año de construcción: 2020. Si rentas con nosotros, te brindamos asesoría personalizada durante todo el proceso. Importante: • Se deben demostrar ingresos de 3 veces el valor de la renta. • En caso de que tus ingresos no lleguen a 3 veces el valor de la renta, estos pueden ser la suma de las personas que vivirán en la propiedad. • Te invitamos a agendar una visita a esta propiedad: esta puede ser presencial o vía streaming, desde la comodidad de tu hogar. • Y lo mejor. Sin aval. Más que una corredora, somos Houm. *Aplican T&C",https://www.inmuebles24.com/propiedades/clasificado/alclapin-departamento-en-heroes-de-padierna-con-1-recamara-144999584.html,"MN 9,500","Yucalpeten
Héroes de Padierna, Tlalpan","60 m² lote, 1 rec., 1 baño",Tlalpan
"[arr] id houm: Ver datos. Entérate de todos los beneficios al rentar con Houm: • No te pedimos aval. • Asistencia e intermediación con el propietario. • Firma tu contrato online. • Renta sin burocracia, papeleos y mucho más rápido. • Difiere tu depósito en hasta 6 meses sin interés. Departamento en renta, ubicado en la colonia Lomas de Padierna, con una superficie construida de 60. 00 m² y superficie total de 60. 00 m². Sus principales características son: • Amueblado. • 1 recámara. • 1 baño. • No Admite mascotas. • 1 estacionamiento. • Año de construcción: 2020. Si rentas con nosotros, te brindamos asesoría personalizada durante todo el proceso. Importante: • Se deben demostrar ingresos de 3 veces el valor de la renta. • En caso de que tus ingresos no lleguen a 3 veces el valor de la renta, estos pueden ser la suma de las personas que vivirán en la propiedad. • Te invitamos a agendar una visita a esta propiedad: esta puede ser presencial o vía streaming, desde la comodidad de tu hogar. • Y lo mejor. Sin aval. Más que una corredora, somos Houm. *Aplican T&C",https://www.inmuebles24.com/propiedades/clasificado/alclapin-departamento-en-lomas-de-padierna-con-1-recamara-id:.-146695053.html,"MN 11,900","Yucalpeten
Lomas de Padierna, Tlalpan","60 m² lote, 1 rec., 1 baño",Tlalpan
"*¡Exclusivo Penthouse en Fuentes del Pedregal! * Vive la experiencia de residir en una de las zonas más prestigiosas y exclusivas de la Ciudad de México. Este espectacular *penthouse en renta* ofrece *321 m² distribuidos en 2 niveles*, diseñados para brindar máximo confort y elegancia. *Ubicación privilegiada*: Situado en *Circuito Fuentes del Pedregal*, una de las áreas más codiciadas por su tranquilidad, seguridad y cercanía a las mejores amenidades: centros comerciales, restaurantes gourmet, colegios de prestigio y acceso rápido a Periférico y Avenida San Jerónimo. *Características del inmueble*: - Amplia *sala y comedor* ideales para entretenimiento. - *Cocina integral con desayunador*, equipada con alta gama. - *Estudio privado* perfecto para home office. - *3 recámaras* (incluida una suite principal). - *3. 5 baños* con acabados de lujo. - *Sauna privado* para relajación sin salir de casa. - *2 estacionamientos techados* y servicio de seguridad 24/7. - *Elevador directo al penthouse*, garantizando privacidad y comodidad. *Renta: 52, 000 mxn* (Incluye mantenimiento de 6, 300 mxn). ¡Una oportunidad única para disfrutar de *vida de lujo en Fuentes del Pedregal*! Contacta ahora para agendar una visita. *Tu próximo hogar exclusivo te espera.",https://www.inmuebles24.com/propiedades/clasificado/alclapin-se-renta-penthouse-en-fuentes-del-pedregal-147084053.html,"MN 52,000","Cto. Fuentes del Pedregal 432
Fuentes del Pedregal, Tlalpan","321 m² lote, 3 rec., 3 baños, 2 estac.",Tlalpan
"Departamento en renta ubicado en vías principales y centros comerciales. Cuenta con dos recámaras, sala, comedor, un baño, cocina integral, área de lavado y un lugar de estacionamiento. La distribución permite un uso funcional de los espacios, con recámaras independientes y un área social que integra sala y comedor. La cocina está equipada con gabinetes y tarja, y el área de lavado se encuentra junto a ella. El estacionamiento es de uso exclusivo para un vehículo.",https://www.inmuebles24.com/propiedades/clasificado/alclapin-departamento-en-renta-zona-sur-147294664.html,"MN 12,500","Avenida Sauzales 83 Edif 11 Entrada F Depto 102
Sauzales Cebadales, Tlalpan","50 m² lote, 2 rec., 1 baño, 1 estac.",Tlalpan
"Vive con estilo y tranquilidad en BeGrand Coapa. Un hogar lleno de luz, comodidad y momentos por vivir. Imagina despertar cada día en un espacio acogedor, moderno y rodeado de áreas verdes. Este encantador departamento se convertirá en tu refugio ideal. Cuenta con: Dos recámaras que invitan al descanso. Dos baños completos con acabados de calidad. Dos lugares de estacionamiento. Cocina abierta, perfecta para cocinar y compartir. Estancia amplia y muy iluminada. Balcón privado, tu rincón al aire libre. Mantenimiento incluido. Ubicado dentro del Residencial BeGrand Coapa, un espacio que inspira bienestar, tranquilidad y convivencia. Disfruta de: Alberca para relajarte o nadar cada día. Gimnasio equipado para mantenerte activo. Área de juegos infantiles para los más pequeños. Jardines y espacios abiertos que invitan a respirar, caminar o simplemente desconectarte. Todo esto en un entorno seguro, familiar y rodeado de naturaleza, sin salir de la ciudad. ¡Tu nuevo comienzo te espera aquí! Haz de este espacio tu nuevo hogar. ¡Agenda tu visita hoy mismo!",https://www.inmuebles24.com/propiedades/clasificado/alclapin-renta-departamento-be-grand-coapa-147306753.html,"MN 24,000","Calzada del Hueso 859
Granjas Coapa, Tlalpan","99 m² lote, 2 rec., 2 baños, 2 estac.",Tlalpan
"En Isidro Fabela, se renta este funcional departamento de 150 m². Cuenta con 3 recámaras y 2 baños completos. La cocina integral está equipada para facilitar la preparación de alimentos. El departamento ofrece 2 lugares de estacionamiento. Además, cuenta con asador y acceso a internet/wifi. Ubicado en una zona con acceso a diversas vialidades, este departamento facilita la movilidad hacia diferentes puntos de la ciudad. En los alrededores, encontrarás supermercados, farmacias y otros servicios que simplificarán tu día a día. Isidro Fabela es una zona mixta que combina áreas residenciales con comercios locales, ofreciendo un ambiente dinámico y conveniente.",https://www.inmuebles24.com/propiedades/clasificado/alclapin-departamento-amueblado-3-recamaras-frente-a-gran-sur-147400026.html,"MN 21,900","Aguatón
Isidro Fabela, Tlalpan","150 m² lote, 3 rec., 2 baños, 2 estac.",Tlalpan
"Muy bonito Loft en parte baja de San Nicolás Totolapan, muy cerca de Fuentes del Pedregal, se ubica dentro de una propiedad con entrada independiente, cuenta con: -salita. Espacio abierto para recámara. 1 baño completo. Cocina con antecomedor. Patio privado. Espacio para 1 cajón de estacionamiento con portón eléctrico. Área de lavado. El precio de renta incluye servicios de agua y gas, puedes traer un frigobar o refrigerador. Se entrega sin cama. Se renta para pareja o persona sola, no se aceptan mascotas. Requisitos: mes de renta, 2 meses de deposito,, comprobantes de ingresos. Disponible a partir del 15 de septiembre. Se puede visitar antes",https://www.inmuebles24.com/propiedades/clasificado/alclapin-renta-loft-san-nicolas-totolapan-cerca-fuentes-del-62433306.html,"MN 10,000","Soledad
San Nicolás 2, Tlalpan","50 m² lote, 1 rec., 1 baño, 1 estac.",Tlalpan
"Exclusivo Pent-house en venta en Fuentes del Pedregal, con 458 m2 distribuidos en dos niveles que ofrecen amplitud, comodidad y elegancia. En planta baja cuenta con vestíbulo, medio baño, estancia, comedor, cocina con desayunador, estudio, cuarto de servicio con baño y patio de servicio. En planta alta se encuentran 4 recámaras, cada una con su propio baño, sala de tv, vestíbulo y una amplia terraza. Este espectacular departamento incluye 4 lugares de estacionamiento, bodega y línea telefónica. Disfruta de amenidades de lujo como salón de eventos y alberca techada con calefacción. Mantenimiento mensual $8, 330. Ubicado en una de las zonas más exclusivas del sur de la Ciudad de México. El precio de venta del inmueble es más gastos de escrituración (derechos, impuestos, honorarios, avalúos) que serán calculados por la notaría al formalizar la operación. En operaciones de crédito el monto de escrituración se determinará en función de los montos de crédito. Se encuentran a disposición del consumidor los documentos necesarios para la venta del inmueble. El inmueble se transmitirá libre de todo gravamen.",https://www.inmuebles24.com/propiedades/clasificado/veclapin-departamento-en-venta-fuentes-del-pedregal-circuito-147010145.html,"MN 45,000","Circuito Fuentes del Pedregal
Fuentes del Pedregal, Tlalpan","458 m² lote, 4 rec., 2 baños, 4 estac.",Tlalpan
"[arr] id houm: Ver datos. Entérate de todos los beneficios al rentar con Houm: • No te pedimos aval. • Asistencia e intermediación con el propietario. • Firma tu contrato online. • Renta sin burocracia, papeleos y mucho más rápido. • Difiere tu depósito en hasta 6 meses sin interés. Departamento en renta, ubicado en la colonia Pedregal de San Nicolás 4ta Sección, con una superficie construida de 35. 00 m² y superficie total de 35. 00 m². Sus principales características son: • Amueblado. • 1 recámara. • 1 baño. • No Admite mascotas. • 1 estacionamiento. • Cocina equipada. • Piso 2. • Año de construcción: 2020. Además, el inmueble cuenta con las siguientes amenidades: • Estacionamiento de visitas. Si rentas con nosotros, te brindamos asesoría personalizada durante todo el proceso. Importante: • Se deben demostrar ingresos de 3 veces el valor de la renta. • En caso de que tus ingresos no lleguen a 3 veces el valor de la renta, estos pueden ser la suma de las personas que vivirán en la propiedad. • Te invitamos a agendar una visita a esta propiedad: esta puede ser presencial o vía streaming, desde la comodidad de tu hogar. • Y lo mejor. Sin aval. Más que una corredora, somos Houm. *Aplican T&C",https://www.inmuebles24.com/propiedades/clasificado/alclapin-departamento-en-pedregal-de-san-nicolas-4ta-seccion-147151476.html,"MN 10,700","Avenida Tetiz
Tlalpan, Ciudad de México","35 m² lote, 1 rec., 1 baño, 1 estac.",Tlalpan
"[arr] id houm: Ver datos. Entérate de todos los beneficios al rentar con Houm: • No te pedimos aval. • Asistencia e intermediación con el propietario. • Firma tu contrato online. • Renta sin burocracia, papeleos y mucho más rápido. • Difiere tu depósito en hasta 6 meses sin interés. Departamento en renta, ubicado en la colonia Viveros Coatectlan, con una superficie construida de 90. 00 m² y superficie total de 180. 00 m². Sus principales características son: • Amueblado. • 2 recámaras. • 2 baños. • Admite mascotas. • 1 estacionamiento. • Cocina equipada. • Piso 1. • Año de construcción: 2014. Además, el inmueble cuenta con las siguientes amenidades: • Estacionamiento de visitas. Si rentas con nosotros, te brindamos asesoría personalizada durante todo el proceso. Importante: • Se deben demostrar ingresos de 3 veces el valor de la renta. • En caso de que tus ingresos no lleguen a 3 veces el valor de la renta, estos pueden ser la suma de las personas que vivirán en la propiedad. • Te invitamos a agendar una visita a esta propiedad: esta puede ser presencial o vía streaming, desde la comodidad de tu hogar. • Y lo mejor. Sin aval. Más que una corredora, somos Houm. *Aplican T&C",https://www.inmuebles24.com/propiedades/clasificado/alclapin-departamento-en-viveros-coatectlan-con-2-recamaras-146860939.html,"MN 10,000","Cerrada Chabacano
Viveros CoatectlAn, Tlalpan","180 m² lote, 2 rec., 2 baños, 1 estac.",Tlalpan
"Espacios diáfanos, amplios y serenos que invitan a disfrutar la vista al jardín, al trabajo en casa y al bienestar. es lo que obtendrás en este departamento dentro del Club de Golf México en Tlalpan sur. tú ya conoces. En un edificio de 3 pisos, este departamento tiene salida directa al jardín, construido en generosos 179 metros cuadrados, ni más ni menos. Diseño de concepto abierto en el área principal: estancia y comedor que dan salida a la maravillosa terraza con extensión a todo lo largo, con el. plus: vista al campo de Golf. Cocina integral con entrepaños tipo alacena y desayunador que bien lo puedes utilizar como extensión de la misma. 2 recámaras de buen tamaño con baño integrado cada una y closets piso a techo y también cuentan con salida a la terraza. Zona multiusos: cuarto tv, oficina tipo home office, espacio zen. lo que requieras. Aseo para visitas, cuarto de servicio con baño, área de lavado. 2 lugares de estacionamiento, uno de ellos techado. Amenidades: -Jardín con asador. -Área de uso múltiple para reuniones con lo necesario para que estés cómodo con quienes te reúnes: barra, tarja, parrilla y baño completo. Estricta vigilancia todos los días del año a todas horas y con caseta de entrada y salida, tanto peatonal como vehicular. Tu mascota por supuesto es bienvenida. Previa cita para que lo conozcas al 55 Ver datos.",https://www.inmuebles24.com/propiedades/clasificado/alclapin-amplio-departamento-en-renta-dentro-del-club-de-golf-147332595.html,"MN 27,000","Av San Buenavantura 616
Club de Golf México, Tlalpan","179 m² lote, 2 rec., 2 baños, 2 estac.",Tlalpan
"Departamento recien remodelado, con tres habitaciones, dos baños, sala, comedor, cocina Y un cajon de estacionamiento",https://www.inmuebles24.com/propiedades/clasificado/alclapin-departamento-renta-146421440.html,"MN 13,300","MELCHOR DAVILA
Héroes de Padierna, Tlalpan","100 m² lote, 3 rec., 2 baños, 1 estac.",Tlalpan
"[arr] id houm: Ver datos. Entérate de todos los beneficios al rentar con Houm: • No te pedimos aval. • Asistencia e intermediación con el propietario. • Firma tu contrato online. • Renta sin burocracia, papeleos y mucho más rápido. • Difiere tu depósito en hasta 6 meses sin interés. Departamento en renta, ubicado en la colonia La Primavera, con una superficie construida de 63. 00 m² y superficie total de 63. 00 m². Sus principales características son: • Sin amueblar. • 2 recámaras. • 1 baño. • No Admite mascotas. Si rentas con nosotros, te brindamos asesoría personalizada durante todo el proceso. Importante: • Se deben demostrar ingresos de 3 veces el valor de la renta. • En caso de que tus ingresos no lleguen a 3 veces el valor de la renta, estos pueden ser la suma de las personas que vivirán en la propiedad. • Te invitamos a agendar una visita a esta propiedad: esta puede ser presencial o vía streaming, desde la comodidad de tu hogar. • Y lo mejor. Sin aval. Más que una corredora, somos Houm. *Aplican T&C",https://www.inmuebles24.com/propiedades/clasificado/alclapin-departamento-en-la-primavera-con-2-recamaras-id:.-147249864.html,"MN 11,500","Paseo Lirio
La Primavera, Tlalpan","63 m² lote, 2 rec., 1 baño, 1 estac.",Tlalpan
"Propiedad en Exclusiva: Estrena exclusivo departamento al sur de la ciudad en Bosques de Tepepan, un desarrollo exclusivo para disfrutar que brinda una experiencia residencial única resaltando por un magnífico roof garden, conectado por una escalera interior y con acceso independiente. Totalmente terminados con acabados de alta calidad, este departamento va más allá de la elegancia; son un refugio sereno con vistas panorámicas, logrando un equilibrio perfecto entre lujo y comodidad. Además, en cocina y baños están completamente equipados para ofrecer una experiencia de vida excepcional. Cuenta con una amplia estancia con balcón, con vista a los volcanes, cocina abierta equipada y su área de lavado, con 3 recámaras con clóset. La recámara principal con baño completo y otro baño para servicio a las otras recámaras y de visitas, dos lugares de estacionamiento techados independientes. Elevador y amenidades (salón para eventos, gimnasio, ludoteca, alberca, carril de nado, jacuzzi, área de juegos infantiles, pista de jogging, canchas). A unos minutos de Periférico Sur y Viaducto Tlalpan, cerca de comercios, escuelas, hospitales. Todo a tu alcance. Ven a conocerlo, apártalo y estrénalo! Te va a encantar. - El precio de renta incluye mantenimiento de $4, 100. - Acepta mascota pequeña. - Requisitos de Arrendamiento: Un depósito, una renta adelantada, fiador con bien raíz libre de gravamen y pago de póliza jurídica por $9, 600",https://www.inmuebles24.com/propiedades/clasificado/alclapin-bosque-de-tepepan:-departamento-en-renta-en-fuentes-de-146485976.html,"MN 29,000","""Bosques de Tepepan"" Calle Mirador 18
Fuentes de Tepepan, Tlalpan","125 m² lote, 3 rec., 2 baños, 2 estac.",Tlalpan
"Te presentamos un exclusivo departamento en renta, ideal para médicos que buscan comodidad y accesibilidad. Ubicado en el tranquilo Barrio del Niño Jesús, Tlalpan, este espacioso departamento de 64 metros cuadrados ofrece la combinación perfecta de privacidad y cercanía a las principales vías y servicios de la ciudad. Listo para rentar, es una oportunidad que no puedes dejar pasar. El departamento cuenta con 1 recámara que incluye vestidor y closet, 1 baño completo en la habitación, y un cuarto de lavado. La cocina está equipada con horno de gas, perfecta para los amantes de la cocina. Los pisos de madera añaden un toque elegante y cálido a cada espacio del hogar. Disfruta de la comodidad de tener un balcón para relajarte y estacionamiento para tu vehículo. La ubicación es inmejorable: accesible al tráfico, con transporte público cercano, e inmediata a tiendas, colegios, hospitales y centros médicos. Este departamento ha sido diseñado para ofrecer confort y funcionalidad. Equipado con servicios de electricidad, gas natural y agua corriente, podrás disfrutar de una vida cómoda y libre de preocupaciones. No pierdas la oportunidad de vivir en una de las zonas más tranquilas y bien conectadas de Tlalpan. ¡Contáctanos para más información y agenda una visita! Requisitos: Fiador con Bien Raíz libre de gravamen en la cdmx u obligado solidario, comprobar ingresos 3 a 1, Póliza Jurídica, un mes de depósito y la renta que corre. *Todas las imágenes mostradas en este anuncio son para fines ilustrativos, el resultado final puede variar. **Consulte el aviso de privacidad en nuestra página web",https://www.inmuebles24.com/propiedades/clasificado/alclapin-departamento-en-renta-en-el-centro-de-tlalpan-146457029.html,"MN 13,950","Cerrada de Hidalgo 21
Barrio del Niño Jesús, Tlalpan","64 m² lote, 1 rec., 1 baño, 1 estac.",Tlalpan
"3 Recamaras, 1 Cuarto de Servicio muy amplio, Tanque de Gas estacionario independiente, Cisterna y Tinacos de Gran capacidad, 1 Estacionamiento para vehículo pequeño o 2 motocicletas. Cctv, Solo 3 Departamentos en el edificio. Zona muy tranquila. Ideal para Home Office.",https://www.inmuebles24.com/propiedades/clasificado/alclappa-departamento-amplio-se-puede-adaptar-como-oficina-147412970.html,"MN 8,500","Naranjos No. 35 Mz. 25 Lt.
Paraje 38, Tlalpan","100 m² lote, 3 rec., 1 baño, 1 estac.",Tlalpan
"Renta precioso departamento tipo loft, una recámara, baño completo, estancia comedor, cocina, estacionamiento, no mascotas no número mayor de dos personas. Imf. WhatsApp",https://www.inmuebles24.com/propiedades/clasificado/alclappa-precioso-departamento-tipo-loft-145056890.html,"MN 9,500","San Andrés Totoltepec
San Andrés Totoltepec, Tlalpan","1000 m² lote, 1 rec., 1 baño, 1 estac.",Tlalpan
"Se renta departamento amueblado en excelente ubicación al sur de la Ciudad de México, específicamente en Carretera Picacho-Ajusco, km 5. 5, a poca distancia del Hospital Ajusco Medio. La propiedad ofrece un diseño moderno y funcional, ideal para profesionales o parejas que buscan comodidad y practicidad. Características: - Dos recámaras con clósets empotrados y óptima ventilación. - Un baño completo con acabados contemporáneos. - Cocina integral equipada con estufa, horno y alacena. - ️Sala-comedor de concepto abierto con abundante luz natural. -️ Espacio adaptable para home office o estudio. - Seguridad 24/7. Especificaciones: - Renta mensual: $8, 000 mxn. - Disponibilidad: Inmediata. - Mascotas: No permitidas. Contacto: Para mayor información o concertar una cita, favor de comunicarse a los teléfonos. 55 Ver datos o 55 Ver datos (WhatsApp). ¡Agenda tu visita hoy mismo y vive en tu nuevo hogar!",https://www.inmuebles24.com/propiedades/clasificado/alclappa-departamento-amueblado-en-renta:-147143455.html,"MN 8,000","paseo de las rosas mz 8 lt 5 col primavera
La Primavera, Tlalpan","30 m² lote, 2 rec., 1 baño, 1 estac.",Tlalpan
"Lindo Loft/minidepartamento equipado listo para habitar. 2 camas individuales (kingzise) baño y cocina independiente, terraza. Incluye internet. Zona segura, transporte y comercio abundante. English Spoken.",https://www.inmuebles24.com/propiedades/clasificado/alclappa-minidepartamento-loft-equipado-seguro-cerca-colmex-147219337.html,"MN 8,300","Akil 252
Héroes de Padierna, Tlalpan","40 m² lote, 1 rec., 1 baño, 4 estac.",Tlalpan
Departamento en 3er nivel. 2 Recamaras (separadas por nivel) 2 Baños. Cocina equipada. Cuarto de lavado. Terraza. A 5 min de Av. Picacho Ajusco. Parques y Escuelas cercanas,https://www.inmuebles24.com/propiedades/clasificado/alclappa-departamento-tipo-loft-147264893.html,"MN 13,000","Jesús Lecuona 265
Miguel Hidalgo 2A Sección, Tlalpan","70 m² lote, 2 rec., 2 baños",Tlalpan
"A 15 min de El Caminero | Cerca de Insurgentes y Viaducto Tlalpan. Ideal para médicos o profesionistas de la zona hospitalaria. ️ 1er piso en edificio de solo 3 deptos (uno por nivel) Acabados como nuevos | Opción semi amueblado (sala, comedor, trinchador, cortinas y persianas) El depto no cuenta con estacionamiento, sin embargo a una cuadra se encuentra una pensión donde puede guardar vehiculo con costo adiconal e independiente a la renta de este inmueble. El departamento no cuenta con área de lavado/tendido. Si cuenta preparación disopnible para centro de lavado. No se aceptan mascotas. Renta mensual: $11, 200 (semi amueblado) $10, 200 (sin muebles) Requisitos: Ingreso 3 a 1. ️1 Mes de renta + 1 mes de depósito. ️ Pago de investigación (no reembolsable) ️ Comprobantes de ingresos. ️ Aval con propiedad en cdmx (libre de gravamen) u Obligado solidario. ¡Contáctanos para agendar tu visita! ¡No dejes pasar esta oportunidad!",https://www.inmuebles24.com/propiedades/clasificado/alclappa-renta-departamento-en-pedregal-de-las-aguilas-tlalpan-146881139.html,"MN 11,200","Tarahumaras
Pedregal de las Aguilas, Tlalpan","110 m² lote, 3 rec., 1 baño",Tlalpan
"Closet para visitas, medio baño, sala, comedor, cocina, desayunador, almacenamiento de despensa, cuarto de servicio con baño, area para estudio, sala de television, 2 recamaras espejo con closet y baño completo cada una, 1 recamara principal con vestidor, baño completo y jacuzzi, terraza, bodega y 3 lugares de estacionamiento con 3 accesos controlados y supervizados continuamente. Cuenta con diversas amenidades, alberca, ludoteca, areas verdes con espejos de agua, petfriendly, salon de eventos o usos multiples.",https://www.inmuebles24.com/propiedades/clasificado/alclappa-departamento-en-renta-en-exclusivo-fraccionamiento-147422562.html,"MN 50,000","Lomas del Pedregal
Lomas del Pedregal, Tlalpan","30468 m² lote, 3 rec., 3 baños, 3 estac.",Tlalpan
