Título,Enlace,Precio,Dirección,Características,Municipio de Origen
"Tu nuevo depa en Nápoles, cdmx – Cerca del wtc y listo para ti️ ¿Buscas comodidad, estilo y ubicación en un solo lugar? Este departamento en renta en la colonia Nápoles tiene todo lo que necesitas: a solo unos pasos del World Trade Center, muy cerca de la Del Valle y rodeado de cafés, restaurantes y todo lo que te gusta. Renta sin complicaciones: ️ Sin aval. ️ Sin fianza. ️ Renta en 24 horas. Lo que incluye tu nuevo hogar: Espacios modernos y funcionales. Opción amueblado. Internet de alta velocidad incluido. Cocina equipada. Seguridad 24/7. Estacionamiento (sujeto a disponibilidad) Amenidades que elevan tu día a día: Coworking y salas de juntas. Cine privado y sala de juegos. Terraza con asadores. Gimnasio y área de yoga. Zona pet friendly. Elige entre estudios o departamentos de 1 y 2 recámaras, todos dentro de un edificio moderno, con diseño vanguardista y ambiente profesional.",https://www.inmuebles24.com/propiedades/desarrollo/ememvein-departamento-en-renta-en-la-napoles-del-valle-144568092.html,"MN 22,700","amalia by urbanista
Nápoles, Benito Juárez","199 un., 1 a 2 rec.",Benito Juárez
"Este exclusivo Loft ejecutivo amueblado de doble altura ofrece una experiencia única de confort y estilo en una ubicación privilegiada, en Nápoles, Benito Juárez, Ciudad de México. Diseñado para quienes buscan un hogar funcional y sofisticado, el espacio combina la comodidad con una estética moderna, ideal para disfrutar del día a día en un ambiente elegante y acogedor. Es interior, sin balcón, en la planta baja, destaca su cocina integral abierta totalmente equipada con electrodomésticos de alta gama, que incluyen refrigerador, horno, estufa, lavavajillas, lavadora y secadora, lo que facilita una experiencia culinaria sin preocupaciones. Además, la amplia sala de estar está equipada con una televisión plana de 42”, perfecta para el entretenimiento, y el sistema de aire acondicionado y calefacción asegura un ambiente agradable durante todo el año. La propiedad cuenta con amplios espacios iluminados, donde los muebles, blancos y la decoración cuidadosamente seleccionada aportan un toque de estilo contemporáneo. Un escritorio con silla complementa el ambiente, brindando un lugar ideal para trabajar o estudiar. En la planta alta se encuentra la recámara, que ofrece una cama queen size para un descanso reparador, acompañada de una pantalla de 31” para momentos de relajación. El baño completo y la terraza privada completan el confort del espacio, todo ello decorado con una exclusiva colección de fotografías de la reconocida fotógrafa Megs Inniss, que aporta una atmósfera única y artística al hogar. El edificio ofrece una serie de comodidades adicionales, como elevador, seguridad privada las 24 horas y un gimnasio, lo que garantiza la tranquilidad, conveniencia y bienestar de sus residentes. Este departamento es la opción perfecta para aquellos que buscan calidad de vida y un estilo de vida moderno en el corazón de la Ciudad de México. Si requiere cajón de estacionamiento tiene un costo adicional de renta de $1, 200 mensual. La renta incluye mantenimiento y servicios excepto cfe. Requisitos en renta: Renta que corre. 1 Depósito en garantía. Pago de póliza jurídica de 60% del valor de renta más iva. no se requiere fiador",https://www.inmuebles24.com/propiedades/clasificado/alclapin-loft-ejecutivo-frente-a-torre-wtc-napoles.-145448161.html,"MN 25,000","Filadelfia 42
Nápoles, Benito Juárez","73 m² lote, 1 rec., 1 baño",Benito Juárez
"Vivir en la colonia Del Valle, sí se puede. Localizado en una de las zonas más céntricas y de mayor crecimiento en la Ciudad de México, Vitant Del Valle cuenta con una ubicación sin igual. Nuestro desarrollo se encuentra dentro del complejo residencial Mitikah; lo que te permitirá disfrutar de restaurantes, cafeterías, cine y mucho más… todo a un lado de tu depa.",https://www.inmuebles24.com/propiedades/desarrollo/ememvein-renta-de-departamentos-vitant-del-valle-90652152.html,"MN 19,200","Av. Río Churubusco No. 601, Col. Xoco, Alcaldía Benito Juárez, Ciudad de México.
Xoco, Benito Juárez","135 un., 45 m² lote",Benito Juárez
"Town House en Renta en Torre Mitiakh. Disfruta el lujo y la comodidad de vivir en un exclusivo town house de 200 m2 dentro de la prestigiosa Torre Mitiakh. Amplios espacios, acabados de primer nivel y acceso a las amenidades más selectas. 3 recamaras. 3 baños y medio. cuarto de servicio con su baño completo. 2 lugares de estacionamiento. Renta: 77, 000 incluyendo mantenimiento. Se aceptan mascotas. Privacidad y seguridad. Estilo de vida único. Ubicación privilegiada. Ideal para quienes buscan exclusividad y confort en su día a día.",https://www.inmuebles24.com/propiedades/clasificado/alclapin-townhouse-en-renta-en-torre-mitikah-147400553.html,"MN 66,000","Mítikah Torre Residencial
Xoco, Benito Juárez","200 m² lote, 3 rec., 3 baños, 2 estac.",Benito Juárez
"Este luminoso departamento de 84 m² cuenta con un diseño moderno, distribución funcional y. excelente ubicación. Sus principales características: • Dos recámaras amplias, cada una con baño completo privado, lo que brinda independencia y. comodidad. • Estancia de gran tamaño, con excelente entrada de luz natural gracias a ventanales que dan hacia. árboles y una zona arbolada, lo que le da privacidad y frescura. • Cocina abierta con barra desayunadora, de estilo contemporáneo, integrada al área social. • Dos lugares de estacionamiento independientes. - Bodega de gran tamaño para almacenamiento. • Pequeña terraza privada, ideal para colocar plantas o disfruta del aire libre. • Vigilancia 24/7 y acceso automático al garaje para tu seguridad y comodidad. Incluye bodega. Mantenimiento. $3, 000 mxn. Ubicado sobre Eje 5 Sur, justo frente a la Plaza de Toros y a unas cuadras del Estadio Azul, con acceso inmediato a parques, comercios, centros culturales y múltiples vías de transporte.",https://www.inmuebles24.com/propiedades/clasificado/alclapin-departamento-en-renta-en-ciudad-de-los-deportes-147802992.html,"MN 23,000","Eje 6 Sur Tintoreto 147
Ciudad de los Deportes, Benito Juárez","84 m² lote, 2 rec., 2 baños, 2 estac.",Benito Juárez
"10 niveles. 801. 80 m2. Cocina abierta. Área de lavado. Sala comedor. Balcón. 2 baños completos. 2 recámaras. Principal con baño completo y walking clóset. 1 Cajon de estacionamiento. Mantenimiento: $4, 800. 00. Areas comunes: Alberca. Jacuzzi. Roof Garden. Gimnasio. Renta Amueblado. Todo es eléctrico. 4 departamentos por nivel. Roof Garden con asador",https://www.inmuebles24.com/propiedades/clasificado/alclapin-oportunidad-departamento-en-renta-en-la-napoles-147514785.html,"MN 28,000","Calle Nueva York 290
Nápoles, Benito Juárez","80 m² lote, 2 rec., 2 baños, 1 estac.",Benito Juárez
"Departamento en renta interior de 90 m2 con increíbles amenidades. Ubicación: Situado en la colonia Nápoles, alcaldía Benito Juárez con vialidades de fácil acceso como Av. Insurgentes Sur y Av. Rio Becerra. A espaldas del World Trade Center de la cdmx, el cual cuenta con múltiples restaurantes y locales comerciales. Cercano a medios de transporte como las estaciones La Piedad y Poliforum de la línea 1 del Metrobús. Diseño del espacio. - 2 Recámaras. - 2 baños completos. - Cocina integral. - Cuarto de lavado. - 2 cajones de estacionamiento. Áreas comunes: Casa Club. *pb. - Alberca. - Jacuzzi. - Sanitarios/Vestidores. - Cuarto de masaje. - Sauna. - Ludoteca. - Arenero. *Piso 1. - Lunge Familiar. - Bussinesnes Center. - Sala de juntas. - Terraza. *az. - Canchas padel/ Uso Multiples. Servicios: - Seguridad 24/7. - Elevador. Area total: 90 m2. *Restricciones* Trámite junto a Morada Uno. Monto no reembolsable por investigación* Obligatorio obligado solidario. La poliza debe cubrirse 100% por inquilino y no es negociable. *Aviso de privacidad en",https://www.inmuebles24.com/propiedades/clasificado/alclapin-renta-de-departamento-1502.-interior.-residencial-wtc-147330395.html,"MN 35,000","Chicago 98
Nápoles, Benito Juárez","95 m² lote, 2 rec., 2 baños, 2 estac.",Benito Juárez
"Ubicado en una de las zonas más codiciadas de la Ciudad de México, este amplio y elegante departamento remodelado ofrece una combinación perfecta entre comodidad, modernidad y una ubicación inmejorable. Con acceso directo a vialidades principales como Avenida Insurgentes Sur, Félix Cuevas y la cercanía a importantes puntos de interés como Galerías Insurgentes, Centro Comercial Manacar, Parque Hundido, colegios, bancos, restaurantes y más, este inmueble garantiza una vida urbana plena, con todas las comodidades a tu alcance. Amplio departamento remodelado en instalaciones hidráulicas y eléctricas, pisos de parquet de caoba, consta de balcón completo en estancia, sala, comedor, y un nicho funcional en sala-comedor ideal para mobiliario auxiliar o bar empotrable, cocina integral, 3 recamaras, 3 ½ baños, cuarto de tv, cuarto de servicio con baño completo, cuarto de lavado, bodega, roof garden común, 6to. Piso con elevador directo al departamento, 2 cajones de estacionamiento y vigilancia privada las 24 horas. Agenda tu cita: Ver datos y Ver datos. . . Al ""Contactar"" para consultar esta propiedad, estás aceptando los ""Términos y Condiciones"" y ""Aviso de privacidad"". Aviso de Privacidad, Quejas, Sugerencias y más en nuestro sitio oficial. * Los gastos e impuestos de escrituración no están incluidos en el precio de venta, así como el mobiliario, electrodomésticos y arte que se muestran en las fotografías. Las medidas son ilustrativas y deben de corroborarse con los títulos de propiedad respectivos y/o las boletas predial. Los precios publicados y la disponibilidad pueden cambiar sin previo aviso por lo que se debe de verificar con la inmobiliaria y los propietarios de los inmuebles.",https://www.inmuebles24.com/propiedades/clasificado/veclapin-departamento-en-venta-en-insurgentes-mixcoac-147167743.html,"MN 47,500","Insurgentes Mixcoac
Benito Juárez, Ciudad de México","232 m² lote, 3 rec., 3 baños, 2 estac.",Benito Juárez
"¡Departamento de Lujo en Venta y Renta– Piso 43, Torre Mitikah! Xoco, Benito Juárez – Ciudad de México. Totalmente remodelado con acados de lujo | Piso 43 | Acabados de lujo. 2 Recámaras. Principal con vestidor. Secundaria con clóset. 2 Baños completos + ½ baño de visitas. Acabados premium. Cocina integral equipada. Electrodomésticos modernos. Aprovechamiento inteligente del espacio. Estancia-Comedor amplia y luminosa. Perfecta para disfrutar en familia. Área de lavado independiente + Cuarto de servicio con baño. Recibidor elegante y acogedor. 2 lugares de estacionamiento + Bodega privada. Amenidades de lujo en Torre Mitikah: Sala de cine. Carril de nado. Sauna y vapor. Gimnasio equipado. Salón de yoga y spinning. Sala Lounge. Centro de negocios. Salón de eventos. Ludoteca, salón de jóvenes y adultos. nota: Se puede rentar amueblado con un precio adicional de $ 15'000. Requisitos: Renta que corre, mantenimiento, depósito en garantia, fiador y pago póliza.",https://www.inmuebles24.com/propiedades/clasificado/veclapin-departamento-en-venta-en-torre-mitikah-147678763.html,"MN 85,000","Av Río Churubusco 601
Xoco, Benito Juárez","205 m² lote, 2 rec., 2 baños, 2 estac.",Benito Juárez
"Venta y Renta de hermoso departamento en Col. Alamos, sin muebles, totalmente remodelado, piso 4, 1 recamara con closets de buen tamaño, 1 baño completo con cancel, cocina con barra desayunadora de quarzo, sala, lavadora secadora empotrada, jaula de tendido. Ideal para comprar un departamento en una zona céntrica, en la alcaldía Benito Juárez para una pareja o persona sola, excelente para inversión. No tiene elevador y no tiene estacionamiento. Para renta incluye refrigerador, lavadora-secadora y las sillas para la barra de cocina. Listo para iniciar contrato de renta a principios de noviembre",https://www.inmuebles24.com/propiedades/clasificado/veclapin-venta-y-renta-de-departamento-de-una-recamara-en-col.-147559535.html,"MN 14,500","La Coruña 145
Álamos, Benito Juárez","40 m² lote, 1 rec., 1 baño",Benito Juárez
"Espectacular departamento con terraza en planta baja mucha luminosidad, amplitud y vestidor, ubicado en Luz Saviñón 1024. Terraza Privada. Vigilancia 24 hrs. Cámaras de seguridad. 1 cajón de estacionamiento (se estorba) Planta baja. Elevador. Con mucha luminosidad. Estancia para sala y comedor amplia. Cocina integral abierta con barra de granito. Cuarto de lavado. 2 baños completos modernos. 2 recámaras para camas King size con vestidor y closets. Roofgarden común con asador, fregadero y baños. 4 años de construcción. Limpieza de áreas comunes. Vigilancia 24 hrs. Cámaras de seguridad. Depósitos y recolección de basura. Mascota pequeña. ¡Ven a conocerlo!",https://www.inmuebles24.com/propiedades/clasificado/alclapin-espectacular-departamento-con-terraza-amplio-con-63646230.html,"MN 26,000","Luz saviñon 1024
Narvarte Poniente, Benito Juárez","120 m² lote, 2 rec., 2 baños, 1 estac.",Benito Juárez
"¡¡Nápoles, gran oportunidad!! Departamento en renta de 84m² en el último piso, totalmente renovado con hermosos acabados, iluminación natural y sin ruido. Dos recámaras, baño, cocina integral con barra, cuarto de servicio, estacionamiento, elevador y ubicación inmejorable: a pasos de Insurgentes y Viaducto. Renta no incluye mantenimiento el cual es por $1, 520. 00",https://www.inmuebles24.com/propiedades/clasificado/alclapin-ohio-12-departamento-en-la-napoles.-145841301.html,"MN 24,480","Ohio, 12
Nápoles, Benito Juárez","84 m² lote, 2 rec., 1 baño, 1 estac.",Benito Juárez
"Te presentamos este hermoso y amplio departamento amueblado ubicado en la colonia Del Valle, a solo unos pasos de Insurgentes y muy cerca del wtc. Ya sea que quieras comprar o rentar, éste puede ser tu opción. Situado en el primer piso de un edificio con pocas unidades, cuenta con una generosa superficie de 164m² y un encantador balcón que recorre la sala y comedor, permitiendo disfrutar de la vista exterior. El departamento ofrece tres amplias recámaras, la principal con baño privado, además de un segundo baño completo para las otras habitaciones. La cocina es abierta, con una moderna isla central y abundante espacio de almacenamiento, lo que la convierte en un espacio ideal para cocinar y convivir. Junto a la cocina se encuentra el cuarto de lavado para mayor comodidad. Los acabados son de alta calidad, con elegantes detalles de duela y cantera, además de barras de granito en la cocina. Los servicios de luz, gas y agua son independientes. El edificio cuenta con elevador y dos lugares de estacionamiento que se asignan conforme van llegando los residentes, gestionados por el personal de seguridad, que se encarga de mover los autos. Además, se acepta la convivencia con mascotas. El depto se renta amueblado, equipado con refrigerador, microondas, cafetera, tetera, centro de lavado con secadora y lavadora integrada, cama king, queen y 2 individuales cada una en cada cuarto, además que con toda la vajilla, sartenes y más equipo. Si gustas se puede platicar que se rente sin muebles, aunque la renta no cambiaría ya que el dueño tendría que gastar en una bodega. La seguridad está garantizada con vigilancia las 24 horas. Los requisitos son un mes de renta, un mes de depósito y una póliza jurídica la cual puede o no solicitar un obligado solidario. No dejes pasar la oportunidad de vivir en una de las mejores zonas de la ciudad, en un espacio amplio, cómodo y con todo lo que necesitas al alcance de la mano. *Sujeto a cambio de precio sinprevio aviso. Inmobiliaria Maco no se haceresponsable por cambios o modificaciones en los precios aquídescritos, ya que en ocasiones dichos ajustes suceden independientemente a su conocimiento*Sujeto a cambio de precio sinprevio aviso. Inmobiliaria Maco no se haceresponsable por cambios o modificaciones en los precios aquídescritos, ya que en ocasiones dichos ajustes suceden independientemente a su conocimiento",https://www.inmuebles24.com/propiedades/clasificado/alclapin-amplio-depto-en-del-valle-con-amplio-balcon-muy-147701847.html,"MN 49,000","Torres Adalid 46
Del Valle Centro, Benito Juárez","164 m² lote, 3 rec., 2 baños, 2 estac.",Benito Juárez
"¡ para ver el video del dpto por favor pulsar en la sección de video. Increíble E inigualable panorámico súper amplio dpto sin amueblar en renta, dentro del lujoso, exclusivo, icónico, Y afamado condominio mitikah residencial. Se encuentra en el piso 59. Mascotas permitidas, listo para habitar, son 209m2. Contrato por un año forzoso, precio más mantenimiento (10, 500 pesos mensuales), garantía: póliza jurídica con obligado solidario O fiador con inmueble en cdmx libre de gravámenes. Situado en el panorámico piso 59, cuenta con: recámara principal con baño completo; dos recámaras secundarias cada una con su baño completo; cocina de granito con barra Y espacio para refrigerador Y lavavajillas; sala-estancia-comedor; baño de visitas; cuarto de lavado; cuarto se servicio con baño completo; tres lugares de estacionamiento; Y dos bodegas. Incluye persianas traslucidas Y blackout. El residencial cuenta con las más completas áreas comunes como: seguridad privada con circuito cerrado, lobby, acceso al centro comercial Y supermercado, salón de eventos para 300 personas, sala de cine, alberca, ludoteca, área de juegos infantiles, family rooms para visitas, game room, cine, spa, sauna Y vapor, skypool, gym, salón de spinning, salón de yoga, lounge Y salón de adultos. Contacto con santiago barroso al Ver datos.",https://www.inmuebles24.com/propiedades/clasificado/alclapin-inigualable-super-departamento-en-renta-sin-amueblar-147141484.html,"MN 65,000","Cto Interior Avenida Río Churubusco 601
Xoco, Benito Juárez","209 m² lote, 3 rec., 3 baños, 3 estac.",Benito Juárez
"Departamento remodelado en quinto piso, con 143 m² interiores y un roof garden privado de 200 m², con acceso directo desde el interior del departamento. Al ingresar, se encuentra la sala-comedor con iluminación natural y conexión fluida hacia la cocina equipada y el área de lavado. Un pasillo distribuye las tres recámaras, todas con walk-in closet. La recámara principal y una de las recámaras secundarias tienen vista exterior y balcón privado. La tercera recámara cuenta con vista al interior del edificio. La recámara principal tiene baño completo; el segundo baño da servicio a las recámaras secundarias y el medio baño al área social. El departamento incluye dos lugares de estacionamiento (en tandem) y cuenta con elevador con acceso directo al piso. El edificio tiene seguridad 24 horas, gimnasio y salón de eventos. Se aceptan mascotas. 143 m² interiores. 200 m² de roof garden privado. 3 recámaras con walking closet. 2. 5 baños. Estacionamiento para 2 autos (en tandem) Antigüedad: 15 años. Remodelado recientemente. Elevador. Seguridad 24/7. Amenidades: gimnasio y salón de eventos. Pet friendly. Ubicación: San José Insurgentes, a una cuadra de Insurgentes Sur y muy cerca de Torre Manacar. Zona con excelente conectividad y servicios. Nota: Los muebles son montaje virtual. El departamento no incluye muebles",https://www.inmuebles24.com/propiedades/clasificado/alclapin-departamento-en-renta-en-san-jose-insurgentes-roof-147065439.html,"MN 55,000","Plateros 16
San José Insurgentes, Benito Juárez","143 m² lote, 3 rec., 2 baños, 2 estac.",Benito Juárez
"Se Renta departamento en torre residencial mitikah con excelentes amenidades, con acceso directo a la plaza, hermosa vista panorámica, acabados de lujo, muy iluminado, 3 recamaras, la principal con baño completo y vestidor, segunda closet y baño, tercera closet y baño, medio baño de visitas, cuarto de lavado, cuarto de servicio con baño, cocina integral, amplia estancia y comedor, bodega, 2 estacionamientos, amenidades: Albera, gym, Salón de eventos, salón de adultos, salón lounge, ludoteca, área juegos infantiles, sala de cine, family Room, game Room, Spa, sauna, spinning, jardín pet frendly, 6 elevadores, elevador de carga. Piso 52",https://www.inmuebles24.com/propiedades/clasificado/alclapin-se-renta-departamento-mitika-145102139.html,"MN 73,500","Avenida Churubusco
Xoco, Benito Juárez","225 m² lote, 3 rec., 4 baños, 2 estac.",Benito Juárez
"En el exclsuvo Hyatt Regency, con vista panorámica, muy iluminado, y ventilado, cocina integral abierta, pisos de madera, con aire acondicionado. Amenidades: Carril de nado, gimansio incluido, mas todos los servicios del hotel con descuento, vive y disfruta el concepto de lujo y modernidad. Vigilancia 24/7",https://www.inmuebles24.com/propiedades/clasificado/alclapin-departamento-en-renta-en-hyatt-regency-147446440.html,"MN 32,000","Avenida Insurgentes Sur 724
Del Valle Centro, Benito Juárez","62 m² lote, 1 rec., 1 baño, 1 estac.",Benito Juárez
"Departamento tipo Loft en renta, piso 20 En Torre Mitikah. Es un desarrollo inmobiliario, el más alto de uso residencial en México, lo que lo convierte en un ícono. Es un conjunto con centro comercial, oficinas, áreas verdes y servicios, pensado como “ciudad dentro de la ciudad” Ubicado en Rio Churubusco, muy cerca de Coyoacán, Av. Universidad, Insurgentes y eje 8; conecta con colonias de gran plusvalía como del Valle, Del Carmen Coyoacán entre otras. El loft, cuenta con 68m2, Cocina integral. Área de lavado, Baño, Walking closet, Área abierta para recamara, sala y comedor. Un estacionamiento. Bodega. Se acepta mascota pequeña. El precio incluye el mantenimiento y el uso de todas las amenidades que ofrece el desarrollo( Common room, Gimnasio, sala de cine, futbolito, kids club, alberca infantil, spa, spinning, salón de poker, carril de nado, jacuzzi, ballroom, salón de yoga, bussines lounge, ludoteca y game room)",https://www.inmuebles24.com/propiedades/clasificado/alclapin-renta-departamento-tipo-loft-1-recamara-68-m-sup2--147719089.html,"MN 32,000","Avenida Río Churubusco 601
Xoco, Benito Juárez","68 m² lote, 1 rec., 1 baño, 1 estac.",Benito Juárez
"Mf. Departamento en Renta Amueblado sobre Eje Central Lázaro Cardenas. Agradable y muy iluminado departamento exterior, ubicado en sexto piso con elevador. Son dos recamaras, la principal con baño y vestidor, la segunda comparte baño con el área social. Estancia de buen tamaño con sofa y comedor, cocina integral, refrigerador, lavadora, El edificio tiene 21 departamentos, hay un roof garden común, biciestacionamiento;el acceso es controlado por huella digital, y tiene circuito cerrado de vigilancia. El departamento tiene un cajón de estacionamiento que se comparte con otro vecino. No se aceptan mascotas. Con ubicación privilegiada, a 200 metros de la estacion del metro Eje Central L12, y con todos los servicios y escuelas en la zona. Requisitos: comprobar ingresos 3 a 1 la renta, mes de renta y mes de deposito, fiador con bien inmueble libre de gravamen en cdmx o área metropolitana, póliza juridica de 6, 500 pesos a cargo del inquilino. Agenda tu visita, con gusto te atendemos. (4)",https://www.inmuebles24.com/propiedades/clasificado/alclapin-departamento-amueblado-en-renta-en-portales-sur.-4-147131849.html,"MN 20,000","Eje Central Lázaro Cárdenas
Portales Sur, Benito Juárez","60 m² lote, 2 rec., 2 baños, 1 estac.",Benito Juárez
"Penthouse en renta, exterior, con excelente distribución y una vista espectacular. Ubicación: Con vialidades de fácil acceso como Av. Cuauhtémoc y División del Norte. Excelente ubicación, se encuentra en Av. Popocatepetl (Eje 8) a unos minutos de los centros comerciales Mitikah y Patio Universidad. Espacios de ocio como la Cineteca Nacional, Viveros de Coyoacán y el Parque de los venados, ideal para salir a caminar, hacer ejercicio y pasear a tu mascota. Descripción del espacio: - 2 Recámaras. - 2 Baños. - Sala/comedor. - Balcón. - Roof garden privado (Acceso por fuera del departamento) - Cocina equipada. - Área de lavado. - 2 cajones de estacionamiento. - Bodega. Áreas comunes: - Roof Garden. Servicios: - 2 Elevadores. - Interphone. - Seguridad 24hrs. Áreas: Habitables: 71. 00 m2. Descubierto: 74. 7m2. Total: 145. 7 m2. *restricciones* Trámite junto a Morada Uno. Monto no reembolsable por investigación* La poliza debe cubrirse 100% por inquilino y no es negociable. *Aviso de privacidad en",https://www.inmuebles24.com/propiedades/clasificado/alclapin-renta-penthouse-exterior-esquina_801.-sta.-cruz-147747888.html,"MN 25,000","Popocatepetl 243
Santa Cruz Atoyac, Benito Juárez","71 m² lote, 2 rec., 2 baños, 2 estac.",Benito Juárez
"Renta de departamento de 2 recamaras 62M2, 1 baño completo, 1 estacionamiento independiente, el edificio no tiene elevador, piso 4. se aceptan mascotas. la renta incluye mantenimiento $17, 000. no asesores",https://www.inmuebles24.com/propiedades/clasificado/alclapin-renta-de-departamento-de-62-m-sup2--de-2-rec-147669939.html,"MN 17,000","Avenida N. H. de Chapultepec 102
Niños Héroes, Benito Juárez","62 m² lote, 2 rec., 1 baño, 1 estac.",Benito Juárez
