Título,Enlace,Precio,Dirección,Características,Municipio de Origen
"Departamento en renta en la Torre Residencial Mitikah de 3 recamaras cada una con su bano. Es un innovador proyecto residencial que cuenta con amenidades únicas y singulares vistas panorámicas al Sur de la Ciudad. Cuenta con area comercial, oficinas, servicios y espacios de recreación para sus residentes. Mitikah torre Residencial ofrece un estilo de vida de primer nivel con grandiosas amenidades y entretenimiento sin límites. Amenidades. Salón de eventos (con capacidad de hasta 260 personas) Sala de cine. Alberca. Ludoteca. Área de juegos infantiles. Family rooms para visitas. Game room. Spa y Sauna. Sky pool con carril de nado. Gimnasio. Salón de spinning. Salón de yoga. Lounge. Salón de adultos. Motor Lobby con cuarto y baño de choferes. Conexión con centro comercial y supermercado. Lobby con buzones de correo. Ballroom con con sala de estar, foyer, guarda ropa y recepción. Área para futbolito scorpion. Alberca infantil, pilates y yoga con vestidores. Juice Bar. Salón de spinning. Salón de poker. Cuenta con un Centro comercial con cine, restaurantes, boutiques triple aaa, Restaurantes, food court, gourmet y de mantel. Vive la experiencia en tu nuevo hogar",https://www.inmuebles24.com/propiedades/clasificado/alclapin-departamento-en-renta-en-benito-juarez-colonia-xoco-146732775.html,"MN 65,000","Avenida Rio Churubusco
Xoco, Benito Juárez","202 m² lote, 3 rec., 3 baños, 2 estac.",Benito Juárez
"Vive la experiencia única de residir dentro del exclusivo Hyatt Regency, ubicado en Insurgentes Sur, en el corazón de la Ciudad de México. Este departamento ofrece un estilo de vida inigualable con acceso completo a todas las amenidades y beneficios del hotel. Disfruta de la comodidad de tener a pocos pasos restaurantes reconocidos como Fogo de Chão y Deigo Ramen, además de relajarte en el prestigioso Spa Desertika. El inmueble cuenta con acceso a un gimnasio equipado, servicio de toallas y regaderas, y una terraza espectacular con alberca, perfecta para disfrutar de las impresionantes vistas panorámicas de la ciudad. Este departamento no solo es un lugar para vivir, es un espacio para experimentar lo mejor de la Ciudad de México en un entorno de lujo y confort. Agenda tu cita y conócelo! Tel. 55 Ver datos",https://www.inmuebles24.com/propiedades/clasificado/alclapin-departamento-renta-insurgentes-sur.-hyatt-regency-145547706.html,"MN 42,000","Insurgentes sur #, Del Valle Centro, Benito Juárez
Del Valle Centro, Benito Juárez","85 m² lote, 2 rec., 2 baños, 2 estac.",Benito Juárez
"No pierdas oportunidad de vivir en un departamento completamente amueblado frente al World Trade Center, con una ubicación inmejorable cerca de importantes puntos de interés de la ciudad de México, este conjunto residencial ofrece en sus departamentos seguridad, aire acondicionado, cocina equipada con lavavajillas, aditamentos de cocina, muebles y decoración de vanguardia. Precios sujetos a cambio sin previo aviso y de acuerdo a disponibilidad. Imagenes referenciales",https://www.inmuebles24.com/propiedades/clasificado/alclapin-departamento-amueblado-en-renta-en-napoles-benito-147812305.html,"MN 35,000","Napoles Benito Juárez
Nápoles, Benito Juárez","93 m² lote, 2 rec., 2 baños",Benito Juárez
"Asesora zuleyka elizalde ze35. Se Renta Espectacular Departamento Pent-House en Nonoalco, Benito Juarez. Vive con estilo en este Pent-house de 155 m² en dos niveles, con terraza privada y asador, ideal para reuniones y momentos al aire libre. Distribución: - Primer nivel- Sala y comedor con excelente iluminación natural. Cocina equipada. 2 baños completos (uno con tina y otro con vestidor/Walk-in closet) Recámara principal con vestidor y baño completo. Recámara secundaria. - Segundo nivel- Recámara/estudio con baño completo. Salón de tv con bar. Terraza con asador elevable. Baño de visitas. Cuarto de lavado. - Amenidades y plusvalía- 2 estacionamientos. Calentador de paso de alto flujo. Seguridad 24/7. Elevador. Requisitos. 1 mes de depósito de garantía. Póliza jurídica (aprox. $6, 000) Aval y/o obligado solidario, pagarés. Ubicación privilegiada. A una calle de Av. Revolución y Patriotismo, cerca del Metro San Antonio, escuelas, hospitales y Mega Soriana.",https://www.inmuebles24.com/propiedades/clasificado/alclapin-departamento-ph-en-renta-nonoalco-benito-juarez-147709684.html,"MN 31,499","Berruguete
Santa María Nonoalco, Benito Juárez","155 m² lote, 2 rec., 3 baños, 2 estac.",Benito Juárez
"Departamento en Miguel Laurent, Colonia Tlacoquemecatl del Valle, Benito Juárez, una de las zonas más demandadas de la Ciudad de México. Se distingue por su excelente conectividad con avenidas principales, cercanía a parques, centros comerciales, restaurantes y servicios, ofreciendo un entorno ideal para vivir con comodidad y plusvalía. 6 min caminando - Metro Zapata. 7 min caminando - Metro División del Norte. 5 min caminando - Metrobús Félix Cuevas. 3 min caminando - Parque Tlacoquemécatl. 6 min en auto - Parque Arboledas. 7 min en auto - Parque Hundido. 8 min en auto - Galerías Insurgentes. 10 min en auto - Walmart Universidad. Amenidades y Características. Cocina con barra desayunador. Baño con tina. Se aceptan mascotas. Mantenimiento incluido. En resumen, esta ubicación combina la tranquilidad de una colonia residencial con la comodidad de tener todo a unos minutos caminando o en auto: parques, escuelas, transporte, restaurantes y centros comerciales.",https://www.inmuebles24.com/propiedades/clasificado/alclapin-departamento-en-colonia-del-valle-147692071.html,"MN 21,000","Miguel Laurent
Tlacoquemecatl, Benito Juárez","70 m² lote, 2 rec., 1 baño, 1 estac.",Benito Juárez
"Vive en el centro de la Colonia del Valle, zona de alta plusvalía. Hermoso departamento exterior, muy iluminado y ventilado, 100 mts. La estancia tiene dos balcones y un espejo de pared a techo, todo su frente es de cristal con protecciones y tiene un pequeño armario para abrigos de visitas. Dos recamaras; la principal tiene vestidor y acceso directo al baño, la otra recamara tiene dos closet, dos baños completos. La cocina tiene barra desayunador, despensero de techo a piso y cocina integral. Estacionamiento fijo y vigilancia 24 horas. Interfón, puerta de entrada principal eléctrica. Elevador. Se entrega totalmente encortinado. Muy bien ubicado entre Av. Amores y Av. Coyoacán. A dos calles esta Soriana, y enfrente Farmacia San Pablo, Pastelería el Globo, Starbucks, y cerca del World Trade Center. Se acepta sólo una pequeña mascota. Mantenimiento: $2, 000 incluido en la renta",https://www.inmuebles24.com/propiedades/clasificado/alclapin-departamento-en-renta-eje-5-eugenia-del-valle-cdmx-147824030.html,"MN 20,000","Eugenia 721
Del Valle Centro, Benito Juárez","100 m² lote, 2 rec., 2 baños, 1 estac.",Benito Juárez
"Lindo depa, ubicado en una de las torres remodelado del Centro de la Ciudad de México. Con una vista increíble hacia el horizonte de la cdmx, ubicado en el piso 13, con amenidades. * 60 m2 de construcción. * Cocina. * 1 baño completo. * 1 estacionamientos independiente. * Persianas traslucidas en estancia. * Persianas black out en recámaras. * Piso 13 de 16. * 2 Elevadores. * Vigilancia las 24 hrs. * Circuito cerrado de tv. Cuota de mantenimiento incluida en la renta. Amenidades: gim, salón de eventos. Citas con anticipación. Requisitos: 1 mes de deposito. 1 mes de renta. Fiador con bien inmueble libre de gravamen. Comprobar ingresos por lo menos 3 a 1",https://www.inmuebles24.com/propiedades/clasificado/alclapin-super-depa-en-calzada-de-tlalpan-147240488.html,"MN 16,000","Calzada de Tlalpan 550
Moderna, Benito Juárez","60 m² lote, 2 rec., 1 baño, 1 estac.",Benito Juárez
"Departamento amplio de 2 recamaras, sala comedor, estacionamiento, en una de las mejores calles de san pedro de los pinos, ambiente tranquilo no mascotas",https://www.inmuebles24.com/propiedades/clasificado/alclapin-departamento-renta-147667380.html,"MN 17,000","AV TRES
San Pedro de los Pinos, Benito Juárez","80 m² lote, 2 rec., 1 baño, 1 estac.",Benito Juárez
"Se renta departamento amueblado y equipado cuenta con 60 m2, con una recamara, amplia estancia, 1 baño completo, se encuentra en el 2do. Piso edificio muy tranquilo y seguro. Se encuentra ubicado muy cerca del metro eje central de la línea 12 del metro entre Av. Rio Churubusco y Av. Division del Norte",https://www.inmuebles24.com/propiedades/clasificado/alclapin-mf-renta-de-departamento-en-eje-central-portales-sur-147773244.html,"MN 13,900","Eje Central 1010
Portales Sur, Benito Juárez","60 m² lote, 1 rec., 1 baño",Benito Juárez
"Vive en las alturas de San Pedro de los Pinos, en este moderno departamento ubicado en el piso 15, ideal para quienes buscan confort, seguridad y una excelente ubicación. Con 75 m2 perfectamente distribuidos, cuenta con 3 habitaciones, 2 baños completos, cocina integral y cuarto de lavado, pensado para adaptarse al ritmo de vida urbano sin sacrificar comodidad. Disfruta de espacios comunes como áreas verdes, juegos infantiles, salón para visitas, elevador y seguridad 24/7. A solo minutos de Costco San Antonio, con acceso directo a vialidades principales como Periférico y Av. Revolución, este depa te conecta con todo lo que necesitas. Incluye un lugar de estacionamiento y mantenimiento mensual ya cubierto. Solicita una visita hoy y visualiza tu vida en este espacio funcional, moderno y bien ubicado. Con Homie renta sin aval. Proceso 100% digital. Tú eliges cómo pagar la renta a través de diferentes formas de pago. ¡Conoce ya este depa e independízate de las tareas de rentar! Departamento de 75. 0 metros cuadrados cuenta con: - 3 habitaciones. - 2. 0 baños. - 1 lugar de estacionamiento. Características: - Cocina integral. - Cuarto de servicio. Amenidades: - Seguridad. - Elevador. - Juegos. - Espacio para visitas. - Áreas verdes. Antigüedad: 7 años. . Número de habitantes recomendado: 4. Disponibilidad para mostrar: 01/septiembre/2025. Disponibilidad para habitar: 01/septiembre/2025. ¡Enamórate de tu vida en este departamento! # Homie Id: 9_5_2_9_8. Estos son los beneficios que tienes como inquilino al rentar tu nuevo hogar con nosotros: * No necesitas aval (sujeto a Términos y Condiciones). * Realiza el pago de tu renta mediante transferencia digital en nuestra plataforma o en efectivo en miles de locales disponibles. * Asistencia y conciliación con tu propietario. * Proceso sin burocracia, renta en cuestión de horas y sin trámites complicados. * Firma tu contrato de forma digital.",https://www.inmuebles24.com/propiedades/clasificado/alclapin-departamento-en-renta-de-3-habitaciones-en-san-pedro-147462079.html,"MN 17,100","Toltecas
San Pedro de los Pinos, Benito Juárez","75 m² lote, 3 rec., 2 baños, 1 estac.",Benito Juárez
"Mls #25-3222. Departamento en renta en Residencial Mitikah de 3 recamaras cada una con su baño. Cuenta con amenidades únicas y singulares vistas panorámicas al Sur de la Ciudad. Cuenta con área comercial, oficinas, servicios y espacios de recreación para sus residentes. Amenidades. Salón de eventos (con capacidad de hasta 260 personas) Sala de cine. Alberca. Ludoteca. Área de juegos infantiles. Family rooms para visitas. Game room. Spa y Sauna. Sky pool con carril de nado. Gimnasio. Lounge. Salón de adultos. Motor Lobby con cuarto y baño de choferes. Conexión con centro comercial y supermercado. Lobby con buzones de correo. Ballroom con con sala de estar, foyer, guarda ropa y recepción. Área para futbolito scorpion. Alberca infantil, pilates y yoga con vestidores. Juice Bar. Salón de spinning. Salón de poker. Cuenta con un Centro comercial con cine, restaurantes, boutiques triple aaa, Restaurantes, food court, gourmet y de mantel. Precio sujeto a cambio y sin previo aviso",https://www.inmuebles24.com/propiedades/clasificado/alclapin-departamento-en-renta-en-mitikah-dg-25-3222-146492605.html,"MN 65,000","Mítikah Torre Residencial
Xoco, Benito Juárez","200 m² lote, 3 rec., 3 baños, 2 estac.",Benito Juárez
"""¡Espacios amplios y comodidad en el corazón de la del Valle! Departamento de 3 recámaras, 3 baños, cuarto de servicio integrado. Elevador. Squash. Vigilancia 24 hrs. Ubicación privilegiada, con fácil acceso a todos los servicios. A unos pasos de Walmart Felix Cuevas y Liverpool Insurgentes. ¡Todo lo que necesitas a tu alcance!",https://www.inmuebles24.com/propiedades/clasificado/alclapin-departamento-col.-del-valle-147774046.html,"MN 37,000","Patricio Sanz
Del Valle Centro, Benito Juárez","140 m² lote, 3 rec., 3 baños, 1 estac.",Benito Juárez
"Se encuentran disponibles 3 departamentos. 1 Departamento de 116m2. 2 Departamentos de 108m2. Mantenimiento incluido. Vive en la Colonia del Valle, una de las zonas más seguras, céntricas y mejor conectadas de la Ciudad de México. Este inmueble se encuentra en Martín Mendalde, con acceso inmediato a vías principales como Av. Universidad, División del Norte y Eje 6 Sur, lo que garantiza movilidad rápida hacia cualquier punto de la ciudad. Puntos de interés cercanos: 5 min Metro División del Norte. 5 min Parque Arboledas. 8 min Parque de los Venados. 10 min️ Centro Comercial Parque Delta. ️8 min Plaza Universidad. 12 min Cineteca Nacional. 9 min Hospital San Ángel Inn Universidad. ️Amplia oferta de restaurantes y cafés en Av. Universidad y División del Norte – a menos de 5 min. La Colonia del Valle es reconocida por su calidad de vida, con calles arboladas, áreas verdes, oferta educativa de prestigio, supermercados, gimnasios y centros de entretenimiento. Una ubicación ideal para quienes buscan comodidad, conectividad y un estilo de vida práctico en la cdmx.",https://www.inmuebles24.com/propiedades/clasificado/alclapin-departamento-en-colonia-del-valle-147446370.html,"MN 38,000","Martin Mendalde
Del Valle Centro, Benito Juárez","116 m² lote, 2 rec., 2 baños, 2 estac.",Benito Juárez
"[arr] id houm: Ver datos. Entérate de todos los beneficios al rentar con Houm: • No te pedimos aval. • Asistencia e intermediación con el propietario. • Firma tu contrato online. • Renta sin burocracia, papeleos y mucho más rápido. • Difiere tu depósito en hasta 6 meses sin interés. Departamento en renta, ubicado en la colonia Narvarte Oriente, con una superficie construida de 55. 00 m² y superficie total de 55. 00 m². Sus principales características son: • Amueblado. • 1 recámara. • 1 baño. • No Admite mascotas. • Cocina equipada. • Piso 3. • Año de construcción: 2019. Además, el inmueble cuenta con las siguientes amenidades: • Elevador. • Gimnasio. • Zona de asadores. Si rentas con nosotros, te brindamos asesoría personalizada durante todo el proceso. Importante: • Se deben demostrar ingresos de 3 veces el valor de la renta. • En caso de que tus ingresos no lleguen a 3 veces el valor de la renta, estos pueden ser la suma de las personas que vivirán en la propiedad. • Te invitamos a agendar una visita a esta propiedad: esta puede ser presencial o vía streaming, desde la comodidad de tu hogar. • Y lo mejor. Sin aval. Más que una corredora, somos Houm. *Aplican T&C",https://www.inmuebles24.com/propiedades/clasificado/alclapin-departamento-en-narvarte-oriente-con-1-recamara-id:.-145079631.html,"MN 17,490","Calle Doctor José María Vértiz
Narvarte Oriente, Benito Juárez","55 m² lote, 1 rec., 1 baño",Benito Juárez
"[arr] id houm: Ver datos. Entérate de todos los beneficios al rentar con Houm: • No te pedimos aval. • Asistencia e intermediación con el propietario. • Firma tu contrato online. • Renta sin burocracia, papeleos y mucho más rápido. • Difiere tu depósito en hasta 6 meses sin interés. Departamento en renta, ubicado en la colonia Carmen, con una superficie construida de 123. 00 m² y superficie total de 123. 00 m². Sus principales características son: • Amueblado. • 2 recámaras. • 2 baños. • Admite mascotas. • 2 estacionamientos. • Cocina equipada. • Piso 5. • Año de construcción: 2018. • Cuarto de lavado. Además, el inmueble cuenta con las siguientes amenidades: • Vigilancia 24 hrs. • Elevador. Si rentas con nosotros, te brindamos asesoría personalizada durante todo el proceso. Importante: • Se deben demostrar ingresos de 3 veces el valor de la renta. • En caso de que tus ingresos no lleguen a 3 veces el valor de la renta, estos pueden ser la suma de las personas que vivirán en la propiedad. • Te invitamos a agendar una visita a esta propiedad: esta puede ser presencial o vía streaming, desde la comodidad de tu hogar. • Y lo mejor. Sin aval. Más que una corredora, somos Houm. *Aplican T&C",https://www.inmuebles24.com/propiedades/clasificado/alclapin-departamento-en-carmen-con-2-recamaras-id:.-144999796.html,"MN 31,500","Andorra
Benito Juárez, Ciudad de México","123 m² lote, 2 rec., 2 baños, 2 estac.",Benito Juárez
"Departamento estilo loft en renta en la Torre Residencial Mitikah tipo loft con bano, sin amueblar Es un innovador proyecto residencial que cuenta con amenidades únicas y singulares vistas panorámicas al Sur de la Ciudad. Cuenta con area comercial, oficinas, servicios y espacios de recreación para sus residentes. cr 25-2004.",https://www.inmuebles24.com/propiedades/clasificado/alclapin-loft-en-renta-en-xoco-benito-juarez-cr-25-2004.-147834740.html,"MN 35,000","Benito Juárez Xoco
Xoco, Benito Juárez","67 m² lote, 1 rec., 1 baño",Benito Juárez
"Asesor saul pichardo spa96. Excelente departamento remodelado en renta, en uno de los desarrollos más exclusivos de la ciudad, city towers ii. caracteristicas: -3 recámaras. -3 baños. -Balcón en todo el departamento. -2 estacionamientos techados. requisitos: Arrendatario: -ine. -Comprobante de ingresos. -Correo y numero. -1 mes de renta. -1 mes de deposito. -Aval con bien raíz en la cdmx. -ine. -Comprobante de domicilio. -Escrituras con libertad de gravamen. -Correo y número. En caso de no tener aval se puede con un obligado solidario, de el se requieren los siguientes documentos: Obligado solidario. -ine. -Comprobantes de ingresos (últimos 3 meses) -Comprobante de domicilio. -Correo y número. amenidades: Albercas. Gimnasio. Busines center. Salón de eventos. Jacuzi. Cine. Área infantil. Área para mascotas. Salón de música. Salón de yoga. Áreas verdes. Salones de juegos. Lounge. Elevadores. Vigilancia 24/7. Incluye mantenimiento",https://www.inmuebles24.com/propiedades/clasificado/alclapin-departamento-en-renta-santa-cruz-atoyac-alcaldia-147798829.html,"MN 45,000","Av. Popocatépetl
Santa Cruz Atoyac, Benito Juárez","115 m² lote, 3 rec., 3 baños, 2 estac.",Benito Juárez
"Descripcion: caracteristicas principales: Superficie: 92M2 aprox. Recámaras: 2. Baños: 2. Estacionamientos: 2 techados. Bodega: 1. Edad: 2 años aprox. Cuota de mantenimiento: incluída en la renta. Características generales: Estacionamiento para visitas: si. Elevador: si. Vigilancia estricta: 24 Horas. Mascotas: 1 pequeña se puede aceptar. distribución: Pasillo distribuidor a cocina abierta, área de lavandería, sala y comedor, pasillo distribuidor, recámara principal con vestidor y baño completo, recámara secundaria con clóset y baño completo en pasillo. Acabados: Finos, mármoles, pisos de ingenieria, accesorios en baño, canceles de vidrio templado. Amenidades: piso 24. amenidades para niños: ludoteca. canchita de futbol. juegos. ping pong. cine. alberca. amenidades para adultos: 4 salas sociales (se reservan mas de 7 personas son 700) lounge tea. piso 48. amenidades para adultos: bar. social room. alberca. jacuzzi. vapor sauna salón spa. salon de spinning. salon de box. salon de pilates. salon de yoga. pocker room. game room. piso 5. ludoteca. jardin con juegos para niños. piso 1. salon de eventos. desde 60 hasta 240 personas. renta desde 4000. limpieza desde 700. seguridad desde 1500. app buildinglink. requisitos de arrendamiento: 1 mes de renta. 1 meses de depósito. 1 póliza jurídica de 16, 500 (pagan mitad arrendador Y arrendatario) investigación. ingresos netos mensuales de por lo menos 120, 000 comprobables. Fiador con bien raiz en cdmx. aviso de privacidad visita www. puntoazulbienesraices. com",https://www.inmuebles24.com/propiedades/clasificado/alclapin-departamento-en-renta-en-torre-mitikah-piso-36-143031475.html,"MN 40,000","MITIKAH
Xoco, Benito Juárez","92 m² lote, 2 rec., 2 baños, 2 estac.",Benito Juárez
"Departamento en Renta en Porfirio Díaz | Del Valle Centro | Parque Hundido | Av Insurgentes sur | Eje 6 | Estadio Ciudad de los Deportes | Insurgentes San Borja. Precio de renta: $45, 000. 00 mxn. Más Mantenimiento: $5, 864. 00 mxn. Características: Departamento ubicado en 3er piso. M² de Terreno: 178 m2. M² de Construcción: 122 m2. Características: • Cocina Integral con barra desayunadora. • Área de lavado. • Sala-comedor. • Recámara principal con vestidor. • Recámara 2 con clóset. • 2 Baños completos y medio baño para visitas. • 2 Lugares de estacionamiento. Descripción: Departamento ubicado en el conjunto habitacional marcado con el número 59 de la calle Porfirio Díaz Colonia Del Valle Centro, consta de cinco departamentos, ubicando dos por nivel; Se encuentra en el tercer nivel, exterior con gran balcón y vista a jardín, dos recámaras, dos baños completos y medio baño para visitas, dos cajones de estacionamiento en piso, elevador y vigilancia, cuenta con Roof Garden propio. Seminuevo. Acabados y Equipamiento: • Cocina con estufa marca mabe de 6 quemadores, con protección de cristal, horno y campana. Mueble de alacena incluido. • Área de lavado con lavadero de granito, boiler marca calorex y conexión para centro de lavado. • Baños con cancelería, lavabo, baño, porta toallas y espejo. • Piso mármol en áreas sociales, segunda recámaras y parte de baños. • Piso de madera rojizo en recámara principal y vestidor. Servicios: - Contrato cfe (medidor independiente) - Agua. - Gas. Servicios de la zona: - Transporte público. - Alumbrado público. - Seguridad pública. Requisitos para la Renta: 1 Mes de Renta, 1 Mes de Depósito, Fiador con Bien Raíz en la cdmx ó Área Metropolitana u Obligado Solidario, comprobantes de ingresos 3 a 1 y Pago de Cobertura Jurídica. Observación: Departamento 301. De preferencia no mascotas. Cobertura con Arrendafacil (Básica) : $9, 550. 00 - 100% por inquilino. Los principales puntos de interés y vialidades de la zona son: • A 150 mts de Tienda de conveniencia. • A 160 mts de Cafetería. • A 200 mts de Av. Insurgentes Sur. • A 200 mts del Metrobus – Linea 1 y conexión con Linea 2 (Parque Hundido) • A 200 mts de Restaurante. • A 250 mts del Parque Hundido. • A 290 mts de Gimnasio. • A 300 mts de Comida Rápida. • A 350 mts de Eje 6. • A 400 mts de Banco. • A 500 mts de farmacia. • A 700 mts de Estadio Ciudad de los Deportes. • A 1 km de Centro comercial. • A 1km de Av. Felix cuevas. - Silvia López. Of. (55) Ver datos",https://www.inmuebles24.com/propiedades/clasificado/alclapin-departamento-en-renta-porfirio-diaz-insurgentes-san-147787048.html,"MN 45,000","Porfirio Díaz 59
Del Valle Centro, Benito Juárez","176 m² lote, 2 rec., 2 baños, 2 estac.",Benito Juárez
"Departamento amueblado con dos estacionamientos, enorme bodega, mantenimiento incluido, dos recámaras una con clóset y la principal con walk in clóset con caja fuerte, dos baños completos. Amenidades: jardín, salones de fistas, alberca, gimnasio, ludoteca",https://www.inmuebles24.com/propiedades/clasificado/alclappa-hermoso-departamento-amueblado-147800368.html,"MN 47,000","Dakota 95
Nápoles, Benito Juárez","90 m² lote, 2 rec., 2 baños, 2 estac.",Benito Juárez
"Bonito departamento en renta: cuarto nivel. exterior. 67M habitables. 6M balcón. 2 recamaras. 2 baños completos. cocina equipada. sala-comedor, area de lavado. 1 estacionamiento. Bodega. renta $30, 000 (ya incluye la cuota mensual de mantenimiento) requisitos para la renta del inmueble: 1. Fiador con bien raíz en cdmx libre de gravamen (no negociable) 2. Depósito. 3. Pago del 50% del costo de la póliza jurídica con un costo de $13, 500 anual ($6, 750 totales a pagar) Mayores informe. 5. 5. 5. 4. 0. 7. 8. 0. 1. 0.",https://www.inmuebles24.com/propiedades/clasificado/alclapin-renta-depto-napoles-67-m-sup2--con-2-recamaras-147736425.html,"MN 30,000","Oklahoma 115
Nápoles, Benito Juárez","67 m² lote, 2 rec., 2 baños, 1 estac.",Benito Juárez
"Departamento en renta, como nuevo, muy buenos acabados y excelente ubicación, calle tranquila, cerca de centros comerciales, teatros, etc. , a una cuadra de de periférico sur y barranca del muerto. Unicamente 9 departamentos, interior, vigilancia 24 horas, estacionamiento para dos autos. Cuenta con estancia muy amplia, con la posibilidad de tener área de tv o estudio, baño completo para la segunda recamara que también puede ser de visitas y cocina abierta y cuarto de lavado integrado. La recamara principal con vestidor y baño la segunda recamara con closet. bodega y estacionamiento para dos autos. La renta incluye mantenimiento de $3000. Citas a partir de julio disponible para ocupar agosto 2025. El monto publicado no incluye comisiones, gastos de investigación, póliza jurídica o gastos de mediación. Los datos proporcionados por clientes o interesados serán tratados conforme a lo establecido en la ley federal de protección de datos personales""",https://www.inmuebles24.com/propiedades/clasificado/alclapin-renta-departamento-merced-gomez-a-una-cuadra-de-146853659.html,"MN 27,000","TIBURCIO SANCHEZ DE LA BARQUERA 76
Merced Gómez, Benito Juárez","110 m² lote, 2 rec., 2 baños, 2 estac.",Benito Juárez
