Título,Enlace,Precio,Dirección,Características,Municipio de Origen
"Departamento en renta en la colonia Del Valle Sur, alcaldía Benito Juárez, cdmx. Muy cerca de la avenida Universidad y sus centros comerciales. Departamento es exterior, iluminado y mide 83 m2, tiene 2 recámaras una con la cama queen, 1 baño completo con lavasecadora, balcón, cocina, sala comedor, 1 estacionamiento independiente. Piso 2 con elevador. Edificio tiene vigilancia con conserje. Mantenimiento incluido en la renta. Antigüedad del edificio 45 años. Póliza jurídica. Informes y citas Ask Yana Bienes Raíces by Keller Williams Ver datos 98.",https://www.inmuebles24.com/propiedades/clasificado/alclapin-bonito-departamento-con-balcon-en-renta-del-valle-147642680.html,"MN 22,000","Martin Mendalde
Del Valle Centro, Benito Juárez","83 m² lote, 2 rec., 1 baño, 1 estac.",Benito Juárez
"Hermoso y moderno penthouse en la mejor zona de la Colonia San José Insurgentes, muy cerca del Parque de la Bola. En dos niveles, cuenta con 3 recámaras, 3½ baños, amplia terraza y balcón, 2 lugares de estacionamiento independientes uno del otro. Estacionamientos para visitas, áreas jardinadas. 1er nivel: sala, comedor con salida a hermosa terraza de 50m2, con persianas eléctricas, ½ baño para visitas, cocina abierta con plancha de granito, área de lavado y cuarto de servicio con baño. 2º nivel: con entrada independiente del elevador, sala de tv, 2 recámaras, cada una con vestidor y baño. Amplia recámara principal con balcón y con estudio que puede ser 3ra. Recámara. Mantenimiento incluido. Vigilancia 24 horas. Con posibilidad de rentar una bodega por $1, 000. Precio más gastos de póliza jurídica e investigación. No incluye el mobiliario que se muestra en las fotografías.",https://www.inmuebles24.com/propiedades/clasificado/alclapin-penthouse-en-renta-san-jose-insurgentes-147760534.html,"MN 57,000","Plateros
San José Insurgentes, Benito Juárez","266 m² lote, 3 rec., 3 baños, 2 estac.",Benito Juárez
"Excelente departamento ubicado en Planta Baja en zona con amplia conectividad. Estancia, cocina, 2 recámaras, baño completo, área de lavado, bodega y 2 cajones de estacionamiento en línea (se comparte uno más con un vecino). Tiene como amenidades dos salones de fiesta y un gimnasio equipado, además de un patio bastante amplio. El Desarrollo cuenta con Vigilancia las 24 hrs. , cámaras de vigilancia y limpieza en áreas comunes; dos accesos peatonales. Se formaliza Contrato de Arrendamiento a través de Póliza Jurídica.",https://www.inmuebles24.com/propiedades/clasificado/alclapin-departamento-en-renta-napoles-147488687.html,"MN 22,000","Indianápolis
Nápoles, Benito Juárez","64 m² lote, 2 rec., 1 baño, 2 estac.",Benito Juárez
"City Towers Black departamento de una habitación, un baño completo, un lugar de estacionamiento. En piso alto, vista panorámica, barra de granito, piso de mármol, persianas eléctricas, sonido Bose en sala / comedor. Lujo total, con albercas, jacuzies, simulador de golf, planetario, área de buceo, rogateros, parque acuático, carriles de nado, business center, salón de eventos, entro otros..",https://www.inmuebles24.com/propiedades/clasificado/alclapin-city-towers-black-departamento-de-una-habitacion-147447956.html,"MN 26,000","Popocatépetl
Santa Cruz Atoyac, Benito Juárez","60 m² lote, 1 rec., 1 baño, 1 estac.",Benito Juárez
"Departamento tipo ""Loft"" amueblado, para estrenar en piso 41 en mítikah Torre Residencial, donde se conjugan matices elegantes y sofisticados con elementos funcionales, seguros y de alta calidad. De estilo contemporáneo, amplios 68m2 con hermosa vista, cocina abierta con estufa de inducción, moderno baño completo y vestidor. Aire acondicionado para tener la temperatura ideal en todo momento. 1 Lugar de estacionamiento amplio e independiente. La torre dispone de las mejores amenidades para adultos: -Spa. -Sauna y vapor. -Sky pool. -Gimnasio. -Salón de spinning. -Salón de yoga. -Lounge. -Salón de adultos. y amenidades familiares: -Salón de eventos para 300 personas. -Sala de cine. -Alberca. -Ludoteca. -Área de juegos infantiles. -Family rooms para visitas. -Game room. Alta seguridad las 24h. Mantenimiento incluido en la renta. Trato directo!!",https://www.inmuebles24.com/propiedades/clasificado/alclapin-renta-exclusivo-departamento-amueblado-para-estrenar-147733618.html,"MN 37,000","Av. Río Churubusco 601
Xoco, Benito Juárez","68 m² lote, 1 rec., 1 baño, 1 estac.",Benito Juárez
"Precioso departamento amueblado que consta de una recámara, sala, comedor, un baño completo, cocina totalmente equipada con todo lo necesario para preparar todo tipo de alimentos, estacionamiento con elevador de automóviles, elevador y está ubicado en el corazón de la colonia Narvarte. Excelente ubicación entre Cumbres de Maltrata y Avenida Universidad.",https://www.inmuebles24.com/propiedades/clasificado/alclapin-departamento-en-renta-en-la-narvarte-147863278.html,"MN 29,000","Calle Concepción Beistegui 1812
Narvarte Oriente, Benito Juárez","70 m² lote, 1 rec., 1 baño, 1 estac.",Benito Juárez
"Moderno departamento exterior con 2 recámaras con opción a una tercera o estudio que actualmente es sala de televisión, 2 baños, cuarto de lavado y 2 estacionamientos con elevautos, se estorban con vecino. Elevador y vigilancia 24/7. Áreas comunes: amplio roof garden con excelente vista, cuenta con baños para hombres y mujeres. A unos pasos del metro Mixcoac, Parque Hundido, centros comerciales, escuelas y hospitales. Mtto incluido. No mascotas.",https://www.inmuebles24.com/propiedades/clasificado/veclapin-departamento-en-venta-y-renta-en-extremadura-147311810.html,"MN 28,000","Empresa 31
Extremadura Insurgentes, Benito Juárez","90 m² lote, 2 rec., 2 baños, 2 estac.",Benito Juárez
"Mls #25-2004Departamento estilo loft en renta en la Torre Residencial Mitikah tipo loft con bano, sin amueblar Es un innovador proyecto residencial que cuenta con amenidades únicas y singulares vistas panorámicas al Sur de la Ciudad. Cuenta con area comercial, oficinas, servicios y espacios de recreación para sus residentes. Mitikah torre Residencial ofrece un estilo de vida de primer nivel con grandiosas amenidades y entretenimiento sin límites. AmenidadesSalón de eventos (con capacidad de hasta 260 personas) Sala de cineAlbercaLudotecaÁrea de juegos infantilesFamily rooms para visitasGame roomSpa y SaunaSky pool con carril de nadoGimnasioSalón de spinningSalón de yogaLoungeSalón de adultosMotor Lobby con cuarto y baño de choferesConexión con centro comercial y supermercadoLobby con buzones de correoBallroom con con sala de estar, foyer, guarda ropa y recepciónÁrea para futbolito scorpionAlberca infantil, pilates y yoga con vestidoresJuice BarSalón de spinningSalón de pokerCuenta con un Centro comercial con cine, restaurantes, boutiques triple aaa, Restaurantes, food court, gourmet y de mantel. Vive la experiencia en tu nuevo hogar",https://www.inmuebles24.com/propiedades/clasificado/alclapin-departamento-en-renta-en-benito-juarez-xoco-am.-25-147822609.html,"MN 35,000","Benito Juárez
Xoco, Benito Juárez","67 m² lote, 1 rec., 1 baño, 1 estac.",Benito Juárez
Departamento en renta en Torre Mitikah Residencial. Costo del mantenimiento $9382. 97. Ubicado en piso 41. 135. 71m2 de construcción. 2 recámaras. La recámara principal cuenta con baño completo y walking clóset. 2 baños completos. Cocina amplia nueva. Cuarto de lavado. 2 lugares de estacionamiento. 1 bodega. Amenidades familiares: Salón de eventos para 300 personas. Sala de cine. Alberca. Ludoteca. Área de juegos infantiles. Family rooms para visitas. Game room. Cine. Amenidades para adultos: Spa. Sauna y vapor. Sky pool. Gimnasio. Salón de spinning. Salón de yoga. Lounge. Salón de adultos,https://www.inmuebles24.com/propiedades/clasificado/alclapin-departamento-en-renta-en-mitikah-147369729.html,"MN 56,000","Dirección no informada
Xoco, Benito Juárez","135 m² lote, 2 rec., 2 baños",Benito Juárez
"Ubicado en una de las avenidas más buscadas de la cdmx, este depa en Avenida Coyoacán combina comodidad, estilo y ubicación. Con 75 m² completamente remodelados en 2020, ofrece 2 recámaras con closets amplios, 2 baños completos y un diseño funcional en el segundo piso de un edificio con solo 4 niveles. Amueblado y con cocina totalmente equipada, está listo para habitarse inmediatamente! Disfruta de un roof top compartido con asadores y baños, ideal para relajarte o socializar. Además, el edificio cuenta con elevador, vigilancia 24/7, limpieza en áreas comunes y portero. Aunque no cuenta con estacionamiento, está perfectamente conectado: cerca del Metrobús Colonia del Valle, Ecobici y tres estaciones de metro. Farmacias, supermercados, gimnasio y parques se encuentran a solo unos pasos. Incluye mantenimiento y filtro de agua con servicio. Solicita tu visita hoy mismo y asegura tu próximo hogar. Con Homie renta sin aval. Proceso 100% digital. Tú eliges cómo pagar la renta a través de diferentes formas de pago. ¡Conoce ya este depa e independízate de las tareas de rentar! Departamento de 75. 0 metros cuadrados cuenta con: - 2 habitaciones. - 2. 0 baños. Características: - Terraza. - Amueblado. - Cuarto de lavado. - Cuarto de servicio. Amenidades: - Seguridad. - Elevador. - Asador. Antigüedad: 47 años. . Número de habitantes recomendado: 4. Disponibilidad para mostrar: 06/agosto/2025. Disponibilidad para habitar: 01/octubre/2025. ¡Enamórate de tu vida en este departamento! # Homie Id: 9_5_0_3_9. Estos son los beneficios que tienes como inquilino al rentar tu nuevo hogar con nosotros: * No necesitas aval (sujeto a Términos y Condiciones). * Realiza el pago de tu renta mediante transferencia digital en nuestra plataforma o en efectivo en miles de locales disponibles. * Asistencia y conciliación con tu propietario. * Proceso sin burocracia, renta en cuestión de horas y sin trámites complicados. * Firma tu contrato de forma digital.",https://www.inmuebles24.com/propiedades/clasificado/alclapin-departamento-en-renta-en-av-coyoacan-colonia-del-147189317.html,"MN 22,000","Avenida Coyoacán
Del Valle Centro, Benito Juárez","75 m² lote, 2 rec., 2 baños",Benito Juárez
Departamento en renta remodelado. cuenta con: * 1 habitacion. *1 baño completo. * sala - comedor. *cocina con tarja. *no acepta mascotas. *no cuenta con estacionamiento. ¡¡para mas informacion contactanos!!,https://www.inmuebles24.com/propiedades/clasificado/alclapin-bonito-departamento-en-renta-en-la-colonia-portales-146866373.html,"MN 8,200","AV. EMPERADORES 40B
Portales Oriente, Benito Juárez","45 m² lote, 1 rec., 1 baño",Benito Juárez
"Ff 25 - 2004. Departamento estilo loft en renta en la Torre Residencial Mitikah tipo loft con bano, sin amueblar Es un innovador proyecto residencial que cuenta con amenidades únicas y singulares vistas panorámicas al Sur de la Ciudad. Cuenta con area comercial, oficinas, servicios y espacios de recreación para sus residentes.",https://www.inmuebles24.com/propiedades/clasificado/alclapin-departamento-en-renta-en-xoco-benito-juarez-146225469.html,"MN 35,000","Xoco
Xoco, Benito Juárez","67 m² lote, 1 rec., 1 baño",Benito Juárez
"Renta de Departamento en City Towers Green – 74m² $30, 500 mensuales. Vive con comodidad y estilo en este moderno departamento de 74m², ubicado dentro de City Towers Green, uno de los desarrollos residenciales más completos y exclusivos de la Ciudad de México. Su diseño contemporáneo y sus amenidades de primer nivel lo convierten en la opción ideal para quienes buscan un hogar con confort, seguridad y calidad de vida. Tiene: ️ 2 recámaras amplias, con clósets y excelente iluminación natural. 1 baño completo moderno, con acabados funcionales y elegantes. ️ Sala y comedor con espacios perfectamente integrados, ideales para disfrutar y compartir. Cocina integral equipada, lista para que prepares tus mejores recetas. 2 lugares de estacionamiento cómodos y seguros. Amenidades exclusivas para disfrutar todos los días: Gimnasio totalmente equipado. ️ Alberca. Cine privado. Ludoteca y áreas para niños. ️ Vigilancia y seguridad 24/7. Se acepta mascotas. Ubicación privilegiada: En Av. Popocatépetl 415, Santa Cruz Atoyac, Benito Juárez, estarás rodeado de todo lo que necesitas: supermercados, centros comerciales, universidades, restaurantes y parques. Además, a tan solo unos minutos encontrarás Parque de los Venados y el Metro Parque de los Venados, lo que te brinda excelente conectividad con toda la ciudad.",https://www.inmuebles24.com/propiedades/clasificado/alclapin-departamento-74-m-sup2--con-2-recamaras-en-renta-en-147513679.html,"MN 30,500","Av. Popocatépetl 415
Santa Cruz Atoyac, Benito Juárez","74 m² lote, 2 rec., 1 baño, 2 estac.",Benito Juárez
"Se Renta acogedor departamento en City Towers Coyoacán ii. Amueblado. Consta de 64 m2 más balcón corrido amplio, con 2 habitaciones, 2 llugares de estacionamiento y un baño completo; sala comedor con excelente iluminación y ventilación natural y acceso al balcón. Cocina integral con Área de lavado integrada. Excelentes amenidades. Alberca infinity. Carril de nado. Gym muy equipado. Jardines. Jacuzzis. Restaurante. Ludoteca. Asadores. Salones de juegos. Salón de fiestas. Sala de cine. Área de mascotas. Súper. Bussines center. Vapor. Sauna. Excelentes filtros de vigilancia. Listo para ocupar el 1 de noviembre.",https://www.inmuebles24.com/propiedades/clasificado/alclapin-renta-departamento-city-towers-coyoacan-ii-147707795.html,"MN 27,000","Av. Popocatépetl 435
Santa Cruz Atoyac, Benito Juárez","64 m² lote, 2 rec., 1 baño, 2 estac.",Benito Juárez
"Habitación en renta, de 18 m2, en departamento compartido con 3 habitaciones mas. Cuenta con una cama, clóset, frigobar y baño compartido. Areas comunes cocina integral con estufa de inducción y estancia sala comedor. Incluido mantenimiento, limpieza, agua y luz.",https://www.inmuebles24.com/propiedades/clasificado/alclapin-departamento-renta-146908002.html,"MN 7,000","EJE CENTRAL
Portales Norte, Benito Juárez","18 m² lote, 1 rec., 1 baño",Benito Juárez
"No pierdas oportunidad de vivir en un departamento completamente amueblado frente al World Trade Center, con una ubicación inmejorable cerca de importantes puntos de interés de la ciudad de México, este conjunto residencial ofrece en sus departamentos seguridad, aire acondicionado, cocina equipada con lavavajillas, aditamentos de cocina, muebles y decoración de vanguardia. Precios sujetos a cambio sin previo aviso y de acuerdo a disponibilidad. Imagenes referenciales",https://www.inmuebles24.com/propiedades/clasificado/alclapin-departamento-amueblado-en-renta-en-napoles-benito-147827008.html,"MN 35,000","Napoles Benito Juárez
Nápoles, Benito Juárez","93 m² lote, 2 rec., 2 baños",Benito Juárez
"Departamento en renta ubicado en Tlalpan 550, Moderna. Se encuentra en el quinto piso con la siguiente Distribución: -Sala. -Comedor. -Cocina. -2 recamaras. -1 baño. Características: -construcción 55 m2. -Agua. -Drenaje. -Luz. -Gas de red. -15 nivelesconstruidos. -1 cajón de estacionamiento",https://www.inmuebles24.com/propiedades/clasificado/alclapin-departamento-en-renta-147857943.html,"MN 15,000","TLALPAN 550 TORRE A DEPARTAMENTO 504 504
Moderna, Benito Juárez","60 m² lote, 2 rec., 1 baño, 1 estac.",Benito Juárez
"[arr] id houm: Ver datos. Entérate de todos los beneficios al rentar con Houm: • No te pedimos aval. • Asistencia e intermediación con el propietario. • Firma tu contrato online. • Renta sin burocracia, papeleos y mucho más rápido. • Difiere tu depósito en hasta 6 meses sin interés. Departamento en renta, ubicado en la colonia Colonia del Valle Centro, con una superficie construida de 75. 00 m² y superficie total de 75. 00 m². Sus principales características son: • Amueblado. • 2 recámaras. • 2 baños. • Admite mascotas. • Cocina equipada. • Piso 2. • Año de construcción: 2020. • Cuarto de lavado. Además, el inmueble cuenta con las siguientes amenidades: • Vigilancia 24 hrs. • Elevador. • Zona de asadores. Si rentas con nosotros, te brindamos asesoría personalizada durante todo el proceso. Importante: • Se deben demostrar ingresos de 3 veces el valor de la renta. • En caso de que tus ingresos no lleguen a 3 veces el valor de la renta, estos pueden ser la suma de las personas que vivirán en la propiedad. • Te invitamos a agendar una visita a esta propiedad: esta puede ser presencial o vía streaming, desde la comodidad de tu hogar. • Y lo mejor. Sin aval. Más que una corredora, somos Houm. *Aplican T&C",https://www.inmuebles24.com/propiedades/clasificado/alclapin-departamento-en-colonia-del-valle-centro-con-2-147753239.html,"MN 23,300","Avenida Coyoacán
Benito Juárez, Ciudad de México","75 m² lote, 2 rec., 2 baños",Benito Juárez
"Excelente departamento con gran ubicación. Muy iluminado y agradable. Consta de 2 recámaras, un baño completo. La recámara principal con vestidor. Amplia sala y comedor con linda vista e iluminación y cocina. Pisos de parquet en excelente estado. La ubicación es inmejorable, un lugar de estacionamiento con opción de renta un adicional. Sin mascotas. Cerca de las principales vías de comunicación con Eje 5, Ángel Urraza, Estadio Cruz Azul y Plaza de Toros, Insurgentes. Rodeado de centros comerciales, restaurantes y todos los servicios cerca. Renta sin muebles. Conózcalo!",https://www.inmuebles24.com/propiedades/clasificado/alclapin-departamento-renta-napoles-147761817.html,"MN 25,000","Baltimore 72
Nápoles, Benito Juárez","90 m² lote, 2 rec., 1 baño, 1 estac.",Benito Juárez
"Tu calidad de vida mejorará con este departamento que combina espacio, seguridad y una ubicación estratégica en uno de los barrios más solicitados de la cdmx. La conexión es el plus: A pie: A solo 2 cuadras de una Universidad y con fácil acceso a todos los servicios. Transporte Rápido: A minutos de Avenida Universidad y la estación Metrobús Centro scop, asegurando traslados rápidos a cualquier punto de la ciudad. Vías Principales: Cerca del Eje Central, ideal para una movilidad fluida. Detalles del departamento (81 m²): Este amplio departamento te ofrece todo lo que necesitas dentro de un edificio con amenidades: 2 Recámaras con clóset. 2 Baños Completos (privacidad y funcionalidad con ventanas). ️ Sala y Comedor iluminados. Cocina Integral moderna y equipada. 1 Cajón de Estacionamiento (techado). Elevador para tu comodidad diaria. Salón de Usos Múltiples (para disfrutar con tus vecinos o realizar eventos). ¡Vive en la Narvarte, vive conectado! No esperes más, este departamento es de fácil acceso y se rentará rápidamente. Precio de renta: [$Ver datos con mantenimiento] requisitos: [Aval con propiedad, Depósito, renta, póliza jurídica con costo de $6500. 00 pesos donde el propietario paga la mitad y usted l otra parte, etc. ] contacto: 55 Ver datos",https://www.inmuebles24.com/propiedades/clasificado/alclapin--oportunidad-unica!-departamento-de-81-m-sup2--en-147736357.html,"MN 20,500","Doctor Barragán 765
Narvarte Oriente, Benito Juárez","81 m² lote, 2 rec., 2 baños, 1 estac.",Benito Juárez
"Asesora avelina hernandez ah42. Departamento ph en renta en la calle de Uxmal, colonia Narvarte. Con. muy buena ubicación. Consta de: -120 m2 muy. -balcón. -sala. -comedor. -cocina integral. -cuarto de lavado. -tres recámaras. -2 baños. -2 lugares de estacionamiento. Tiene una terraza privada de 60 m2. Mantenimiento incluido. Ven a conocer tu próximo hogar! Llámame y agendemos una cita.",https://www.inmuebles24.com/propiedades/clasificado/alclapin-departamento-ph-en-renta-en-la-narvarte-146173690.html,"MN 47,000","Vertiz Narvarte
Vertiz Narvarte, Benito Juárez","119 m² lote, 3 rec., 2 baños, 2 estac.",Benito Juárez
"Venta o renta de oficina interior, recién remodelada, en Av. Coyoacán, Del Valle Centro, de 118 m² Su precio de venta es de venta es de $6, 800, 000. °° y de renta $38, 000. °° Consta de 1 oficina, baño de mujeres y de hombres, bodega y cochera techada con portón eléctrico para 3 autos. Lobby. Con cisterna y acceso a internet. Servicio de luz. Tiene vigilancia 24 horas y portero. En un edificio de sólo 2 pisos, conócela!",https://www.inmuebles24.com/propiedades/clasificado/veclapin-venta-renta-oficina-en-av-coyoacan-del-valle-centro-146443372.html,"MN 38,000","Avenida Coyoacán
Del Valle Centro, Benito Juárez","118 m² lote, 1 rec., 3 estac.",Benito Juárez
Se renta hermoso departamento muy iluminado en un desarrollo con amenidades. El departamento cuenta con: 75 metros. 2 recámaras. 2 baños completos. Estancia sala comedor. Cocina integral. Área de lavado. 2 estacionamientos. 1 bodega. El desarrollo cuenta con amenidades como: Roof Garden común. Sky Bar. Alberca. Jacuzzi. Área de asadores. Pista para correr. Ludoteca para niños. Cafetería. Elevador. Conozcalo! Agende su cita! Requisitos: 1 renta. 1 depósito. Se requiere Aval con bien raíz en la Ciudad de México,https://www.inmuebles24.com/propiedades/clasificado/alclapin-se-renta-departamento-con-amenidades-en-col.-narvarte-147812278.html,"MN 25,000","Narvarte Poniente
Narvarte Poniente, Benito Juárez","75 m² lote, 2 rec., 2 baños, 2 estac.",Benito Juárez
"Departamento exterior en renta cerca del Parque de los Venados. Este departamento se encuentra en planta baja, consta de dos recámaras con clóset, baño completo, clóset de blancos, estancia con cocina integral abierta con barra y área de lavado. Un lugar de estacionamiento independiente. El edificio cuenta con vigilancia 24 hrs y elevador. Mantenimiento incluido en el precio de la renta. Requisitos: -Mes depósito. - Mes corriente. -Póliza jurídica. -Aval. Los gastos de investigación y póliza jurídica no están incluidos en el precio de renta. Aviso de privacidad, así como quejas, sugerencias y más, consulta nuestro sitio oficial o contáctanos para más detalle.",https://www.inmuebles24.com/propiedades/clasificado/alclapin-departamento-en-renta-letran-valle-147823987.html,"MN 20,500","Cuicuilco 72
Letrán Valle, Benito Juárez","70 m² lote, 2 rec., 1 baño",Benito Juárez
"Ref: 2 6 0 2 8 9. Este hermoso departamento en renta se encuentra ubicado en la zona de Niños Héroes, Benito Juárez, en la Ciudad de México. Con una construcción de 107 m2, esta propiedad cuenta con 3 recamaras, 2 baños, 1 lugar de estacionamiento, cocina equipada, sala y comedor, walk in closet, closets en cada habitación, acabados de lujo y piso laminado. Además, el edificio cuenta con caseta de vigilancia, puertas eléctricas y elevadores. En cuanto a la ubicación, este departamento se encuentra en una zona residencial tranquila y segura, ideal para familias. Entre las zonas de interés cercanas se encuentran el Parque de los Venados, el centro comercial Patio Universidad y la Universidad Panamericana. Estos lugares ofrecen opciones de entretenimiento, compras y educativas para toda la familia. Las principales vías de acceso a esta propiedad son la Avenida Universidad, Eje 7 Sur, así como la estación de metro Zapata, lo que facilita el transporte y la movilidad en la zona. Además, se cuenta con ciclovías cercanas para aquellos que prefieren moverse en bicicleta. No pierdas la oportunidad de vivir en este exclusivo departamento en una de las mejores zonas de la Ciudad de México. No se aceptan mascotas. Requisitos: 1 mes de renta. 1 mes de depósito. Póliza Jurídica",https://www.inmuebles24.com/propiedades/clasificado/alclapin-departamento-en-renta-en-cumbres-de-maltrata-benito-147849676.html,"MN 24,000","Cumbres de Maltrata 284
Niños Héroes, Benito Juárez","107 m² lote, 3 rec., 2 baños, 1 estac.",Benito Juárez
"Se renta acogedor departamento en la colonia Josefa Ortiz de Domínguez, Benito Juárez. Perfecto para quienes buscan comodidad, seguridad y una excelente ubicación. El departamento cuenta con las siguientes características: 2 habitaciones amplias con excelente ventilación. 1 baño completo. 1 lugar de estacionamiento privado. Cocina integral equipada. Área de lavado para su conveniencia. Balcón con vista a la ciudad. Se aceptan mascotas (1 pequeña). Amenidades: Acceso universal para personas con movilidad reducida. Elevador para mayor comodidad. Seguridad 24/7. Con Homie renta sin aval. Proceso 100% digital y diferentes formas de pago de tu renta, tú eliges. ¡Conoce ya este depa! Estás a pocos pasos de encontrar el hogar de tus sueños. Departamento de 54. 0 metros cuadrados cuenta con: - 2 habitaciones. - 1. 0 baño. - Se aceptan mascotas. - 1 lugar de estacionamiento. Características: - Balcón. - Cuarto de lavado. - Cocina integral. - Acceso universal. Amenidades: - Seguridad. - Elevador. Antigüedad: 18 años. . Número de habitantes recomendado: 2. Disponibilidad para mostrar: 28/octubre/2025. Disponibilidad para habitar: 28/octubre/2025. ¡Enamórate de tu vida en este departamento! # Homie Id: 9_1_6_6_7. Estos son los beneficios que tienes como inquilino al rentar tu nuevo hogar con nosotros: * No necesitas aval (sujeto a Términos y Condiciones). * Realiza el pago de tu renta mediante transferencia digital en nuestra plataforma o en efectivo en miles de locales disponibles. * Asistencia y conciliación con tu propietario. * Proceso sin burocracia, renta en cuestión de horas y sin trámites complicados. * Firma tu contrato de forma digital.",https://www.inmuebles24.com/propiedades/clasificado/alclapin-departamento-en-renta-en-josefa-ortiz-de-dominguez-144628871.html,"MN 15,000","Guipuzcoa
Josefa Ortiz de Domínguez, Benito Juárez","54 m² lote, 2 rec., 1 baño, 1 estac.",Benito Juárez
