Título,Enlace,Precio,Dirección,Características,Municipio de Origen
"Vive a un paso del corredor Insurgentes, a 3 mins de la Universidad Panamericana y disfruta de la maravilla de irte caminando a todos lados! Este exclusivo, amplio y luminoso departamento seminuevo de 104 m2 habitables, cuenta con un estupendo balcón de casi 5 m2 y magníficas vistas panorámicas de toda la ciudad. Ubicado en un piso 19 de 24, dentro de Enquentro, exclusivo desarrollo único en México que une la elegancia clásica con un estilo moderno. Consta de espaciosa estancia con sala/comedor, 3 cómodas recámaras, la principal con vestidor y baño integrado más 2 recámaras secundarias con clóset que comparten baño entre sí y con el área social. Cuenta con una hermosa cocina integral equipada con barras de granito, cuarto de lavado y 2 estacionamientos techados y designados. Ubicación privilegiada frente a una pintoresca plaza en una zona tradicional de la ciudad, pero a la vez de las principales vías rápidas de la zona. Mantenimiento incluido y con excelentes amenidades como son: amplias áreas verdes, terrazas y roof garden en la casa club; alberca techada y jacuzzi; gimnasio y salón de spinning; baños, vestidores, spa y área de masaje; precioso vestíbulo de acceso; vigilancia 24/7, cctv y sistemas de detección de humos y contra incendios. Aprovecha esta súper oportunidad. Llama hoy mismo y agenda un tour, que no te lo ganen! Expert estate. Live just a stone's throw from the Insurgentes corridor, 3 minutes from Panamerican University, and enjoy the wonder of walking everywhere! This exclusive, spacious, and bright like-new 104 m2 living space apartment, features a wonderful balcony of almost 5 m2 and magnificent panoramic views of the entire city. Located on the 19th of 24 floors, in Enquentro, exclusive development unique in Mexico, that combines classic elegance with a modern style. It consists of a spacious living/dining room, 3 comfortable bedrooms, the master with a walk-in closet and en-suite bathroom, plus 2 secondary bedrooms with closets that share a bathroom with the social area. It features a beautiful fitted kitchen with granite countertops, a laundry room, and 2 designated covered parking spaces. This prime location faces a picturesque plaza in a traditional part of the city, yet is also close to the main expressways. Maintenance is included and the building offers excellent amenities such as: large green areas, terraces, and a roof garden at the clubhouse; an indoor pool and jacuzzi; a gym and spinning room; Bathrooms, changing rooms, a spa and massage area; a beautiful entrance hall; 24/7 security, cctv, and smoke and fire detection systems. Take advantage of this fantastic opportunity. Call today and schedule a tour; don't miss it out! Expert estate",https://www.inmuebles24.com/propiedades/clasificado/alclapin-departamento-renta-extremadura-insurgentes-con-147375696.html,"MN 43,000","GOYA
Extremadura Insurgentes, Benito Juárez","109 m² lote, 3 rec., 2 baños, 2 estac.",Benito Juárez
"El mejor departamento ph del edificio. Mejores vistas hacia a la ciudad, y ubicado en el octavo piso del edificio, a unos pasos de las lujosas áreas comunes, amenidades y el Roof Garden común Sky Bar, donde se encuentran los espacios exteriores como asadores, yacusis, áreas verdes con flores y plantas aromatizantes, y más. Departamento nuevo y lujoso en venta, o renta, en una de las colonias más bonitas de la Ciudad de México, con hermosas vistas verdes hacia al oriente, norte y poniente de la ciudad, vistas desde un balcón a lo largo del departamento con accesos desde la sala y las dos recamaras. Cuenta con equipamiento premium, acabados de lujo y sistema automatizado de iluminación y control de persianas Smart y Alexa. El edificio tiene certificación edge avalándolo como un proyecto premiado y sustentable. La estancia es muy iluminada y con una hermosa vista viendo hacia World Trade Center, los rascacielos de la Avenida Reforma, y al amanecer. La cocina es abierta y equipada de lujo. El departamento tiene dos recámaras y dos baños completos, la recamara principal cuenta con su propio vestidor y baño. Hay dos lugares de estacionamiento amplios, sin estorbar con otros vecinos y sin eleva autos. Estricta vigilancia 24/7. El desarrollo Sky Park San Lorenzo cuenta con amenidades de lujo con accesos automatizados Código qr para las visitas, y sistemas de carga de coches eléctricos e híbridos. Las amenidades exteriores se encuentran el roof del edificio donde se aprecian vistas 360 grados de toda la ciudad. En este espacio hay zona de hamacas, huerto orgánico, área de mascotas, juegos para niños, área de asadores, Sky Lounge, Jacuzzi y Sky Bar. Amenidades interiores incluyen gimnasio, espacios para trabajar y estudiar con área de coworking, business center y aula de usos múltiples, además cuenta con espacios de entretenimiento para todas las edades, como cine, sports bar y ludoteca para niños. Para quienes disfrutan de caminar, el edificio se encuentra cerca de parques, plazas comerciales, restaurantes y servicios que te facilitarán tu día a día. Estamos a unos pasos del Metro Zapata, calle Heriberto Frías, avenida Universidad, Félix Cuevas y Gabriel Mancera, de la bella Colonia Del Valle Centro. Ver los videos incluidos en la publicidad. Negociación directa con el dueño. Gracias. English. The best ph apartment in the building. With the best views of the city, on the eighth floor, just steps from the luxurious common areas, amenities, and the Sky Bar Roof Garden, which features outdoor spaces such as grills, a jacuzzi, green areas with flowers and aromatic plants, and more. This new and luxurious apartment is for sale or rent. It is located in one of Mexico City's most beautiful neighborhoods, with beautiful green views of the city to the east, north, and west, from a balcony that runs the length of the apartment and is accessible from the living room and both bedrooms. The apartment features premium amenities, luxurious finishes, and an automated lighting system Smart, and Alexa for blind controls. The building is edge certified, endorsing it as an award-winning and sustainable project. The living room is very bright and offers a beautiful view of the World Trade Center, the skyscrapers of Reforma Avenue, and the sunrise. The kitchen is open and luxuriously equipped. The apartment has two bedrooms and two full bathrooms. The master bedroom has its own dressing room and bathroom. There are two spacious parking spaces, free from obstructions to other neighbors and without car lifts. Strict 24/7 security. The Sky Park San Lorenzo development features luxury amenities with automated qr code access for visitors and charging systems for electric and hybrid cars. The outdoor amenities include the building's rooftop, which offers 360-degree views of the entire city. This space includes a hammock area, an organic garden, a pet area, a children's playground, a barbecue area, a Sky Lounge, a Jacuzzi, and a Sky Bar. Indoor amenities include the gym, work and study spaces with a coworking area, a business center, and a multipurpose classroom. It also has entertainment spaces for all ages, such as a movie theater, a sports bar, and a children's playroom. For those who enjoy walking, the building is close to parks, shopping malls, restaurants, and services that will make your daily life easier. We're just steps from the Zapata Metro station, Heriberto Frías Street, University Avenue, Félix Cuevas Street, and Gabriel Mancera Street, in the beautiful Colonia Del Valle Centro. Watch the videos included in the advertisement. Negotiation directly with the owner. Thank you.",https://www.inmuebles24.com/propiedades/clasificado/veclapin-departamento-ph-en-venta-o-renta-en-colonia-del-valle-143875950.html,"MN 35,000","San Lorenzo 1009
Del Valle Centro, Benito Juárez","82 m² lote, 2 rec., 2 baños, 2 estac.",Benito Juárez
"Departamento amplio Y remodelado con una super. amueblado. ubicacion en la del valle. muy luminoso. primer piso. 208M. 3 recamaras, la principal con baño Y vestidor. 2. 5 baños. cocina semi abierta de granito. sala comedor amplio. balcon muy amplio. 2 estacionamientos. seguridad 24 hrs. solo 10 deptos Y un ph. **se puede rentar sin muebles no cambia el precio**",https://www.inmuebles24.com/propiedades/clasificado/alclapin-renta-departamento-en-la-del-valle-147735679.html,"MN 48,500","Torres Adalid 208
Del Valle Norte, Benito Juárez","208 m² lote, 3 rec., 2 baños, 2 estac.",Benito Juárez
"Departamento en Renta en Noche Buena, Benito Juárez. Vive en una de las zonas más exclusivas y seguras de la Ciudad de México, con todo lo que necesitas para disfrutar de confort, ubicación privilegiada y estilo de vida. Características destacadas: • terraza cubierta y family room, ideales para disfrutar en familia. • Amplia estancia – comedor – desayunador con excelente iluminación natural. • Cocina funcional y bien distribuida. • Recámara principal con vestidor y baño completo. • 2 recámaras secundarias que comparten baño. • Cuarta recámara con baño privado, perfecta para visitas o home office. • Área de lavado independiente. • 2 cajones de estacionamiento. • Acceso directo desde el elevador. • Salón de usos múltiples para tus reuniones o eventos. Ubicación inmejorable: A pasos de Plaza de Toros México, a solo 2 minutos del wtc y Parque Hundido. Conectividad perfecta con Insurgentes, Periférico y Río Becerra. Rodeado de comercios, restaurantes y servicios de primer nivel. Este departamento reúne espacio, comodidad y una ubicación estratégica que lo convierten en la opción ideal para tu nuevo hogar. El precio incluye el mantenimiento. Acepta una mascota de raza pequeña. Agenda tu cita hoy mismo y conócelo en persona. No dejes pasar esta oportunidad única en la Colonia Nápoles. “el precio publicado no incluyen los gastos notariales, comisiones Y contribuciones que se causen con motivo de la transmisión de la propiedad de que se trata”. Aviso de privacidad: Los muebles que aparecen en la publicación son con fines ilustrativos y no están incluidos en el precio final de venta. •En venta los precios son de contado, en caso de utilizar algún crédito, el precio total se determinará en función de los montos variables de conceptos de crédito y gastos notariales que deben ser consultados con el especialista de cada institución financiera y notaría pública respectivamente. •En renta los gastos de investigación y póliza jurídica no están incluidos en el costo. •Al recibir información de carácter personal por medio de este correo, se entiende que el titular de los datos personales ha otorgado su consentimiento expreso para utilizarlos en casos de identificación, contacto, atención, publicidad, facturación, cobranza, cotizaciones, intermediación inmobiliaria y contrataciones. Para mayor información sobre los términos y condiciones en que serán tratados sus datos personales, así como, los terceros con quienes compartimos su información personal y la forma en que podrá ejercer sus derechos arco y Revocación. Consulta nuestro aviso de privacidad en nuestra página Luxury Hábitat Real Estate México.",https://www.inmuebles24.com/propiedades/clasificado/alclapin-departamento-en-renta-en-noche-buena-benito-juarez-147854943.html,"MN 35,000","San Antonio 158
Ciudad de los Deportes, Benito Juárez","223 m² lote, 4 rec., 3 baños, 2 estac.",Benito Juárez
"Rento departamento en City Towers Park Grand Av México Coyoacán #321, piso 16, 90m, 2 recámaras, 2 baños, 2 baños, balcón, extraordinarias amenidades a 5 cuadras de mitika. $29, 000 mantenimiento incluido",https://www.inmuebles24.com/propiedades/clasificado/alclapin-rento-city-towers-grand-park-145002640.html,"MN 29,000","Av México Coyoacán #321
Xoco, Benito Juárez","90 m² lote, 2 rec., 2 baños, 2 estac.",Benito Juárez
"Lindo Y comodo departamento exterior con balcon, con iluminacion natural. Cerca de torre wtc Y center pepsi. 1 recamara. 1 baño. sala comedor. cocina abierta. area de lavado independiente. se aceptan mascotas. no estacionamiento. con mantenimiento incluido.",https://www.inmuebles24.com/propiedades/clasificado/alclapin-apartamento-70-m-sup2--1-recamara-en-renta-napoles-147837750.html,"MN 22,000","Rochester 10
Nápoles, Benito Juárez","70 m² lote, 1 rec., 1 baño",Benito Juárez
"Estrene cómodo y moderno departamento exterior en planta baja, con excelente iluminación natural y acabados de calidad. * Características: - 2 recámaras con closets, la principal con baño integrado. - 2 baños completos con canceles de cristal templado. - Estancia amplia ideal para sala y comedor. - Cocina integral equipada con barra de granito. - Área de lavado integrada. - 1 lugar de estacionamiento en fila de 2 (posición trasera, para auto mediano) - 1 bodega privada en zona de estacionamiento. - Elevador en el edificio. - Vigilancia privada 24 horas. - Mantenimiento incluido: $2, 500. *Ubicación. - Entre calles: Av. De los Montes y Av. Repúblicas, a una cuadra Av. Emiliano Zapata.",https://www.inmuebles24.com/propiedades/clasificado/alclapin-estrene-departamento-en-planta-baja-en-colonia-147847433.html,"MN 24,000","Av. Plutarco Elías Calles 1835
Portales Oriente, Benito Juárez","80 m² lote, 2 rec., 2 baños, 1 estac.",Benito Juárez
"Rento precioso departamento en la Napoles (Calle Indiana), cerca de varias vías de acceso, moderno, pocos depas, acabados de super lujo, iluminado, 92mts2+terraza. - 2 habitaciones, 3 baños, Balcón de 7mts, Tiene calefacción y aire acondicionado, puerta blindada, luces con dimmer, persianas! 1 estacionamiento. Son sólo 6 departamentos, sin muebles vigilancia 24 horas!",https://www.inmuebles24.com/propiedades/clasificado/alclapin-precioso-depa-con-balcon-en-la-napoles-90743891.html,"MN 32,000","indiana
Nápoles, Benito Juárez","100 m² lote, 2 rec., 1 estac.",Benito Juárez
"Se renta bonito y amplio departamento en Heriberto Frías No. 109, Colonia Narvarte, esquina con Obrero Mundial, Alcaldía Benito Juárez. Consta de dos recámaras, estancia, cocina con estufa, un baño y área de tendido en la azotea. Se encuentra en segundo piso. Departamento No. 6. No hay estacionamiento. Informes: lunes A viernes de 10: 00 A 16: 00 hrs.",https://www.inmuebles24.com/propiedades/clasificado/alclapin-se-renta-bonito-y-amplio-departamento-en-colonia-61715959.html,"MN 18,700","Heriberto Frías no. 109
Narvarte Poniente, Benito Juárez","70 m² lote, 2 rec., 1 baño",Benito Juárez
"Departamento en residencial. Dos recámaras con clóset. Habitación principal con baño completo. Estancia comedor con orientación oriente-poniente, buena ventilación y espacio. Cocina abierta con terminados en granito y barra desayunadora. Muebles diseñados a la medida. Cuarto de lavandería con lavadero y espacio para C. De lavado. Bodega. Gimnasio. Carril de nado. Dos estacionamiento techado. Caseta de vigilancia las 24 hrs. , cctv. Cuota de Mantenimiento incluida. Disponible a inicios de Noviembre.",https://www.inmuebles24.com/propiedades/clasificado/veclapin-departamento-cineteca-plaza-universidad-64585652.html,"MN 26,000","Plaza Universidad, Benito Juárez
General Pedro María Anaya, Benito Juárez","115 m² lote, 2 rec., 2 baños, 2 estac.",Benito Juárez
"Bonito departamento, de 65m2, en excelente estado y muy iluminado. Consta de 2 recamaras con closet, una con balcon, un baño con cancel de cristal templado, cocina equipada con área de lavado, estancia con balcón, un estacionamiento independiente que no se estorba con ningún vecino. Excelente estado. El edificio cuenta con vigilancia las 24hrs, elevador y cisterna. A unos pasos de calzada de Tlalpan, entre el metro Nativitas y el metro Portales. Cerca de Centros comerciales, escuelas y comercios a los alrededores. Disponible a partir de octubre. Renta más Mantenimiento de $1, 200, 00 más prorrateo de luz de áreas comunes (aproximadamente $220. 00 bimestrales). Se requiere de fiador u obligado solidario y el pago de una póliza jurídica con un costo de $6, 200. 00. No se aceptan mascotas. Previa cita.",https://www.inmuebles24.com/propiedades/clasificado/alclapin-excelente-depto-estacionamiento-independiente-142043043.html,"MN 16,000","benito juarez 24
Albert, Benito Juárez","65 m² lote, 2 rec., 1 baño, 1 estac.",Benito Juárez
"Moderno departamento exterior con balcón en la colonia Del Valle Centro. Cuenta con 1 recámara donde cabe bien cama matrimonial o Queen justa. Closet amplio y 2 baños completos, muy bonitos cabados tipo loft. Este departamento ofrece área de lavado y cocina integral con barra grande de madera. Dispone de 2 lugares de estacionamiento en fila. El edificio cuenta con caseta para conserje de lenes a viernes*Solo admite un gato como mascota*. La ubicación es ideal, con escuelas cercanas. Del Valle Centro es una zona residencial con excelente conectividad y acceso a diversos servicios. La zona ofrece una amplia gama de comercios, restaurantes y parques. Es una ubicación estratégica con cercanía a importantes avenidas y transporte público.",https://www.inmuebles24.com/propiedades/clasificado/alclapin-hermoso-departamento-con-balcon-en-del-valle-centro-147494733.html,"MN 19,000","Gabriel Mancera 755
Del Valle Centro, Benito Juárez","65 m² lote, 1 rec., 2 baños, 2 estac.",Benito Juárez
"Vive a un paso del corredor Insurgentes, a 3 mins de la Universidad Panamericana y disfruta de la maravilla de irte caminando a todos lados! Este exclusivo, amplio y luminoso departamento seminuevo de 104 m2 habitables, cuenta con un estupendo balcón de casi 5 m2 y magníficas vistas panorámicas de toda la ciudad. Ubicado en un piso 19 de 24, dentro de Enquentro, exclusivo desarrollo único en México que une la elegancia clásica con un estilo moderno. Consta de espaciosa estancia con sala/comedor, 3 cómodas recámaras, la principal con vestidor y baño integrado más 2 recámaras secundarias con clóset que comparten baño entre sí y con el área social. Cuenta con una hermosa cocina integral equipada con barras de granito, cuarto de lavado y 2 estacionamientos techados y designados. Ubicación privilegiada frente a una pintoresca plaza en una zona tradicional de la ciudad, pero a la vez de las principales vías rápidas de la zona. Mantenimiento incluido y con excelentes amenidades como son: amplias áreas verdes, terrazas y roof garden en la casa club; alberca techada y jacuzzi; gimnasio y salón de spinning; baños, vestidores, spa y área de masaje; precioso vestíbulo de acceso; vigilancia 24/7, cctv y sistemas de detección de humos y contra incendios. Aprovecha esta súper oportunidad. Llama hoy mismo y agenda un tour, que no te lo ganen! Expert estate. Live just a stone's throw from the Insurgentes corridor, 3 minutes from Panamerican University, and enjoy the wonder of walking everywhere! This exclusive, spacious, and bright like-new 104 m2 living space apartment, features a wonderful balcony of almost 5 m2 and magnificent panoramic views of the entire city. Located on the 19th of 24 floors, in Enquentro, exclusive development unique in Mexico, that combines classic elegance with a modern style. It consists of a spacious living/dining room, 3 comfortable bedrooms, the master with a walk-in closet and en-suite bathroom, plus 2 secondary bedrooms with closets that share a bathroom with the social area. It features a beautiful fitted kitchen with granite countertops, a laundry room, and 2 designated covered parking spaces. This prime location faces a picturesque plaza in a traditional part of the city, yet is also close to the main expressways. Maintenance is included and the building offers excellent amenities such as: large green areas, terraces, and a roof garden at the clubhouse; an indoor pool and jacuzzi; a gym and spinning room; Bathrooms, changing rooms, a spa and massage area; a beautiful entrance hall; 24/7 security, cctv, and smoke and fire detection systems. Take advantage of this fantastic opportunity. Call today and schedule a tour; don't miss it out! Expert estate",https://www.inmuebles24.com/propiedades/clasificado/alclapin-departamento-renta-insurgentes-mixcoac-con-balcon-y-147368941.html,"MN 43,000","GOYA
Insurgentes Mixcoac, Benito Juárez","109 m² lote, 3 rec., 2 baños, 2 estac.",Benito Juárez
"Tu nuevo Espacio, Tu Hogar te espera en este departamento de lujo. Imagina despertar en un espacio de 98 m² con acabados de primera calidad, dos recámaras amplias y dos baños completos para tu comodidad. Disfruta de la practicidad de dos estacionamientos. Este departamento no es solo un lugar para vivir, es un estilo de vida: * Seguridad y Comodidad: Circuito cerrado y elevador para tu tranquilidad y acceso sin esfuerzo. * Espacios de Disfrute: Balcones que te invitan a relajarte y disfrutar del exterior. * Cocina de Ensueño: Cocina integral y equipada, lista para tus creaciones culinarias. * Estilo y Funcionalidad: Acabados de lujo que marcan la diferencia. Este departamento combina a la perfección el diseño moderno con la funcionalidad, ofreciendo un ambiente práctico, tranquilo y super bien ubicado en la ciudad. (a unos pasos de Churubusco, a menos de 300 metros de Walmart Express de eje Central y división del Norte, muy cerca de Tlalpan y a minutos de hermoso centro de Coyoacán y sus alrededores). Los detalles en cada rincón están pensados para tu bienestar y la Zona lo convierten en una opción inigualable. Requisitos para renta: no se aceptan mascotas. * Un mes de renta. * Y un mes de deposito. * Comprobante de ingresos últimos 3 meses. * Requerimos Ingresos Mensuales mínimos de 3 veces la renta. * Identificación oficial con foto y firma. * Comprobante de domicilio Particular No mayor a 3 meses. * Se firma un Convenio de Medición de Arrendamiento. *Aval con bien inmueble en la cdmx o Estado de México, O la opción de un Obligado Solidario, Que también compruebe Ingresos Mensuales mínimos de 3 veces la renta. Documentos que necesitamos del Aval; * Identificación oficial. * Copia simple de las escrituras hasta donde está el ingreso al registro público. * Boleta predial actualizado. * Boleta de agua actualizado. Documentos del obligado solidario; * Identificación oficial. * Comprobante de domicilio. * Comprobante de ingresos últimos 3 meses. Tanto el aval con bien inmueble como el obligado solidario firman el contrato arrendamiento junto con la persona interesada rentar el inmueble. Requerimos documentos legibles, por favor. Agenda tu cita para que lo conozcas. Cel 55 Ver datos. con Israel Hernández o mándame un WhatsApp. La información contenida en los anuncios de venta y renta, proviene de fuente confiable, sin embargo, está sujeta a errores, omisiones y puede sufrir cambios de disponibilidad, precio y otras condiciones sin previo aviso. Las partes interesadas, deberán confirmar las condiciones en persona. Wig: pcp7fis",https://www.inmuebles24.com/propiedades/clasificado/alclapin-departamento-en-renta-en-portales-norte-147608510.html,"MN 26,000","Odesa 1214
Portales Norte, Benito Juárez","98 m² lote, 2 rec., 2 baños, 2 estac.",Benito Juárez
"Departamento remodelado super ubicado cerca wtc, hospital infantil",https://www.inmuebles24.com/propiedades/clasificado/alclapin-super-departamento-cerca-wtc-62279345.html,"MN 24,000","Calle Nueva York
Nápoles, Benito Juárez","120 m² lote, 3 rec., 2 baños, 1 estac.",Benito Juárez
"Se renta Amplio y luminoso departamento, exclusivo para 1 sola persona, depto y edificio remodelado, Ambiente Selecto, Estrictamente no se admiten Mascotas. Cuenta con 1 recamara con closet, baño, cocina y sala comedor, aprox 35m2. Caminando de estación de metro Ermita y Eje Central, entre Eje 8 Popocatepetl y Eje 7A Emiliano Zapata. Todos los servicios en la zona.",https://www.inmuebles24.com/propiedades/clasificado/alclappa-se-renta-amplio-y-luminoso-departamento-146513029.html,"MN 10,000","Filipinas 814
Portales Sur, Benito Juárez","35 m² lote, 1 rec., 1 baño",Benito Juárez
"Este funcional apartamento ofrece un diseño que maximiza el espacio y la comodidad. Con acabados de calidad y una distribución inteligente, es ideal para quienes buscan un hogar práctico y bien ubicado. El interior cuenta con una sala-comedor integrada que proporciona un ambiente acogedor, perfecto para recibir visitas o disfrutar de momentos de relajación. La cocina, aunque compacta, está equipada con todo lo necesario para preparar tus platillos favoritos. Las 2 recámaras ofrecen privacidad y confort, con amplios closets para almacenamiento. Además, cuenta con 2 baños completos. En cuanto a los espacios exteriores, el apartamento incluye 2 lugares de estacionamiento. Para el esparcimiento, el edificio ofrece amenidades como asador, gimnasio, alberca, cuarto de juegos, jacuzzi, área de juegos infantiles, ludoteca y espacio de whisky room. La seguridad está garantizada con caseta de guardia. Xoco es una colonia con excelente conectividad, cercana a importantes vías de acceso y transporte público. Encontrarás una gran variedad de servicios, comercios y restaurantes a pocos minutos de distancia. Es una zona que combina la tranquilidad residencial con la conveniencia de la vida urbana.",https://www.inmuebles24.com/propiedades/clasificado/alclapin-vive-a-unos-pasos-de-una-de-las-plazas-comerciales-mas-147782169.html,"MN 40,500","Calle Mayorazgo de Solís
Xoco, Benito Juárez","105 m² lote, 2 rec., 2 baños, 2 estac.",Benito Juárez
