Título,Enlace,Precio,Dirección,Características,Municipio de Origen
"Hermoso departamento en un gran desarrollo Bosque Residencial. Cuenta con 2 recámaras, la principal con vestidor y baño. La 2a con closet y baño, gran estancia con vista al desarrollo, muy iluminado,. Cocina abierta, balcón, bodega y 2 estacionamientos. Amenidades. Alberca, jacuzzi, lobby, cafetería, spinning, salón de yoga. Spa, estética, salón fiestas, Ludoteca, Business center, Co-working. Estricta Vigilancia Sólo 2 años de uso prácticamente nuevo!",https://www.inmuebles24.com/propiedades/clasificado/veclapin-venta-departamento-en-bosque-residencial-147750372.html,"MN 40,000","Carretera México-Toluca 4017
Lomas de Vista Hermosa, Cuajimalpa de Morelos","108 m² lote, 2 rec., 2 baños, 2 estac.",Cuajimalpa de Morelos
"Espectacular departamento amueblado con vista a las montañas, cálido y silencioso. El departamento esta ubicado a 5 minutos de Sanfa fe, cuenta con vigilancia privada, acabados de lujo dentro del departamento y en el Residencial. Son 70 metros, 2 balcones, 1 recámara, 1 baño, área de lavado, 1 estacionamiento y 1 bodega.",https://www.inmuebles24.com/propiedades/clasificado/alclapin-dep-amueblado-1-rec-en-stampa-a-5-minutos-de-santa-fe-147505635.html,"MN 22,000","Stampa Residencial
Santa Fe Centro, Contadero","70 m² lote, 1 rec., 1 baño, 1 estac.",Cuajimalpa de Morelos
"Descubre este moderno loft abierto de 49 m² en High Park Mistral, ubicado en Av. Santa Fe 498, justo junto al City Market. Idealmente diseñado para quienes buscan estilo, comodidad y una ubicación privilegiada, este espacio cuenta con: • Loft abierto con excelente iluminación natural. • Baño completo. • Área de lavado. • 1 cajón de estacionamiento. amenidades. Alberca. Gimnasiof. no mascotas. Además, el desarrollo cuenta con elevadores, seguridad 24/7, estacionamiento techado, bodega y accesibilidad total. Ideal para ejecutivos, parejas o inversionistas que buscan un espacio moderno en el corazón de Santa Fe, con amenidades y estilo de vida incomparables.",https://www.inmuebles24.com/propiedades/clasificado/alclapin-estrena-loft-av-santa-fe-mistral-147812607.html,"MN 20,000","AV SANTA FE 498
Contadero, Cuajimalpa de Morelos","49 m² lote, 1 baño, 1 estac.",Cuajimalpa de Morelos
"Excelente Departamento remodelado en Renta - Vitant Santa Fe, con vista al Parque La Mexicana. Cuenta con dos habitaciones, la principal con vista a la Mexicana y ambas con clóset. Un baño completo, estancia sala-comedor, cocina integral y un estacionamiento. Incluye refrigerador y centro de lavado. Amenidades: Alberca, gimnasio, salón de eventos, ludoteca, jardín, asadores, sport bar y servicio de lavandería. No se acepta mascotas. Precio $29, 000 incluye mantenimiento. ¡Ven a conocerlo!",https://www.inmuebles24.com/propiedades/clasificado/alclapin-departamento-en-renta-frente-al-parque-la-mexicana-147469479.html,"MN 29,000","Av. Santa Fe 578
Contadero, Cuajimalpa de Morelos","75 m² lote, 2 rec., 1 baño, 1 estac.",Cuajimalpa de Morelos
"Se renta departamento en up santa fe. Oportunidad única! El departamento cuenta con 1 recámaras, la principal tiene baño, La cocina integral abierta y barra de granito son perfectas para disfrutar y compartir. Tiene una vista espectacular y una gran iluminación. Además tiene sala, comedor, area de lavado, y 1 lugares de estacionamiento. Disfruta de grandes amenidades como cafetería que cuenta con servicio a los departamentos eso hará tu vida mas cómoda, Business Center, Salón de juegos múltiples, gimnasio, jardín con asador, Elevador. Vigilancia las 24 horas los 7 días de la semana. Tiene área de mascotas. Muy cerca encontrarás farmacias, restaurantes, comercios como el Centro Comercial Santa Fe, Patio Santa Fe, el Parque la Mexicana, también",https://www.inmuebles24.com/propiedades/clasificado/alclapin-extrena-departamento-up-santa-fe-147369237.html,"MN 25,000","Carretera México - Toluca
El Yaqui, Cuajimalpa de Morelos","65 m² lote, 1 rec., 1 baño",Cuajimalpa de Morelos
"Ref: 2 5 2 0 0 2. A 5 minutos de Vista Hermosa, este departamento en renta, mide 360 m2, cuenta con 3 espaciosas recámaras, la principal con vestidor y baño con jacuzzi, las otras dos recámaras también tiene su propio baño y clóset/vestidor, estudio, sala y comedor con espectacular vista arbolada a una cañada, que es area verde natural protegida, una amplia cocina con antecomedor y también hermosas vistas, 2 alacenas. Tiene 4 estacionamientos independientes y lugares para visitas, bodega, área de lavandería, 2 cuartos de servicio, vigilancia 24/7. El elevador de acceso llega directamente al departamento. En áreas comunes tiene un salón de fiestas. Este lujoso departamento se encuentra en una zona privilegiada con gran conectividad y acceso a distintas zonas de interés cercanas: Excelente vía de acceso a la Autopista Méx Toluca en sentido a Toluca con retorno inmediato a cdmx y Santa Fe. Colegio Merici - 2 minutos. Paseo de Tamarindos - 10 minutos. C. C. Santa Fe, Parque La Mexicana, Hospital abc Santa Fe - 15 minutos. Plaza Lilas, Bancos y Supermercado - 10 minutos. Vivir en este departamento es sinónimo de comodidad, lujo y seguridad. Con una amplia oferta de amenidades y servicios a su disposición, esta propiedad es ideal para quienes buscan un estilo de vida exclusivo en una de las zonas más prestigiosas de la Ciudad de México. ¡No pierdas la oportunidad de hacer de este espectacular departamento tu nuevo hogar! Puedes rentarlo con o sin muebles.",https://www.inmuebles24.com/propiedades/clasificado/alclapin-lujo-espacio-seguridad-vistas-hermosas-en-146839754.html,"MN 63,000","Fresno 174
Lomas de Vista Hermosa, Cuajimalpa de Morelos","360 m² lote, 3 rec., 3 baños, 4 estac.",Cuajimalpa de Morelos
"Precioso departamento para renta o venta, en la zona más exclusiva de la ciudad, muy bien ubicado y seguro. Tiene 380m2 y cuenta con 2 recámaras, 2 baños y medio, sala y comedor muy amplios, cocina, área y cuarto de servicio, estudio. Áreas comunes extensas, alberca, gimnasio, canchas de pádel, cafetería, ludoteca, cancha de football, tirolesa, área para perros, etc. Nivel 17. Ubicado en Av. Secretaría de Marina #700. -Renta mensual $65, 000 más mantenimiento 14, 000. -Venta $19, 500, 000. Se muestra solo bajo previa cita Ver datos y Ver datos",https://www.inmuebles24.com/propiedades/clasificado/veclapin-excelente-departamento-en-renta-marina-700-144462737.html,"MN 65,000","Secretaria de Marina 700
Lomas del Chamizal, Cuajimalpa de Morelos","380 m² lote, 2 rec., 2 baños, 2 estac.",Cuajimalpa de Morelos
"Tu próximo hogar te espera en un lugar que lo tiene todo. Descubre este espectacular departamento, un espacio diseñado para quienes buscan exclusividad y confort en una de las zonas más dinámicas de la ciudad. Con dos recámaras y dos baños completos, este hogar ofrece un refugio sereno y funcional para tu vida diaria. Ubicado a solo unos minutos de puntos clave como ""El Pantalón"", Arcos Bosques, Reforma, Palmas y Santa Fe, tendrás un acceso inmejorable a la vida cultural, gastronómica y de negocios de la ciudad. La conveniencia es parte de tu día a día, con un shuttle y transporte cercano que facilitan tus traslados. Pero la vida aquí va más allá de la ubicación. Disfruta de un resort personal con amenidades de primer nivel: refréscate en la alberca, mantente en forma en el gimnasio equipado y en el Yoga Room, socializa en el Social Bar o en los firepits, y diviértete en el Game Room. Las áreas Pet-Friendly, el Lobby y Concierge 24 horas, y el co-working completan una experiencia de vida sin igual. Este departamento es el lugar donde la sofisticación se encuentra con la funcionalidad, y donde cada día es una oportunidad para disfrutar. Contáctanos hoy mismo para agendar una visita y hacer de este departamento tu nuevo hogar.",https://www.inmuebles24.com/propiedades/clasificado/alclapin-departamento-en-renta-a-5-min-del-pantalon-147209794.html,"MN 37,125","Carr. México-Toluca 1535
Granjas Palo Alto, Cuajimalpa de Morelos","93 m² lote, 2 rec., 2 baños, 1 estac.",Cuajimalpa de Morelos
"Departamento en renta en Cuajimalpa de 144 m² Cómodo y funcional departamento con excelente iluminación natural y distribución: • 144 m² de construcción. • 3 recámaras, la principal con vestidor y baño completo. • Las recámaras secundarias comparten un baño completo. • Medio baño de visitas. • Family room, ideal como sala de tv o estudio. • Sala - comedor con muy buena entrada de luz. • Cocina cerrada. • Área de lavado. • 2 lugares de estacionamiento independientes. • Elevador",https://www.inmuebles24.com/propiedades/clasificado/veclapin-departamento-en-renta-en-cuajimalpa-147761439.html,"MN 22,800","Prolongación Hidalgo 255
Manzanastitla, Cuajimalpa de Morelos","144 m² lote, 3 rec., 2 baños, 2 estac.",Cuajimalpa de Morelos
"Suite amueblada de 30 M2 en edificio con estricta vigilancia y amenidades. Cama king size, baño completo y 1 lugar de estacionamiento. Amenidades. gimnasio. jardín. salón de fiestas. salones de juego. área de juegos infantiles. ludoteca. terraza con asador. Cuota de mantenimiento incluida. Clave interna: D1493aa. * Los precios publicados y la disponibilidad pueden cambiar sin previo aviso, se recomienda contactar y verificar con la inmobiliaria. * Consulta el Aviso de Privacidad en nuestra página oficial",https://www.inmuebles24.com/propiedades/clasificado/alclapin-suite-en-renta-bosques-de-las-lomas-cuajimalpa-147839915.html,"MN 10,000","Bosque de Tabachines
Bosques de las Lomas, Cuajimalpa de Morelos","30 m² lote, 1 rec., 1 baño, 1 estac.",Cuajimalpa de Morelos
"Departamento tipo Garden en renta en conjunto residencial de 18 departamentos y casas con amenidades con rápida salida a la Carretera México-Toluca. A solo pocos minutos de Santa Fe, Lomas Reforma, Bosques, Vistahermosa e Interlomas! Superficie de construcción: 90 m2 + jardín. Distribuido en. *Sala y comedor con ventanales de piso a techo vista con salida a jardín privado. *2 recámaras (principal con vestidor y baño privado con salida jardin, recámara secundaria con clóset de piso a techo con ventanal tipo balcón. 2 baños completos / cancelería en vidrio templado y ventilación natural. *Cocina integral. *Aréa de lavado privada. *2 lugares de estacionamiento techados. * Vigilancia 24 /7. La privada cuenta con amenidades: área para mascotas, estacionamiento para visitas, área de eventos con baños, agradable roof top común con área se asador y baño, área lavandería común, gimnasio y vigilancia. **mantenimiento incluido + agua ** **se aceptan mascotas. * Requisitos un mes de renta, un mes de depósito y póliza. *disponibilidad diciembre, progamar visita con 12 hrs de anticipacion**",https://www.inmuebles24.com/propiedades/clasificado/alclapin-departamento-con-jardin-privado-garden-en-renta-en-147581204.html,"MN 25,000","Calle Morelos 65
Cuajimalpa, Cuajimalpa de Morelos","120 m² lote, 2 rec., 2 baños, 2 estac.",Cuajimalpa de Morelos
"A 5 minutos de Santa fe, se vende departamento con acabados de lujo. El departamento cuenta con una recamara amplia, vestidor, baño completo, cuarto de lavado espacioso, alacena, balcones, 2 cajones de estacionamiento y 1 bodega. El edificio cuenta con 2 Albercas, 3 jacuzzis, Vapor, Sauna, Spa, salon de juegos para adultos, salones de eventos, lobby, estacionamientos para visitantes, asadores, jardín, area de juegos infantiles y próximamente tendrá cancha de tennis.",https://www.inmuebles24.com/propiedades/clasificado/veclapin-venta-dep-60-m-5-minutos-de-santa-fe-1-rec-1-bano-2-54325726.html,"MN 20,000","Carretera mexico Toluca 5860
Contadero, Cuajimalpa de Morelos","7 m² lote, 1 rec., 1 baño, 2 estac.",Cuajimalpa de Morelos
"A estrenar precioso departamento de 90 metros a 5 minutos de Santa Fe, con acabados de lujo y amenidades 5 estrellas. El departamento tiene 90 metros, 2 recamaras, 2 baños completos, 2 estacionamientos y 1 bodega, area de lavado y balcones. El edificio cuenta con seguridad privada, cajones de visita, Alberca con 3 carriles de nado, alberca familiar y chapoteadero 3 jacuzzis, Spa, Sauna, Vapor, jardín con asadores, salones de eventos, salon de adultos con billar y futbolito, Gym y en los próximos meses tendrá, ludoteca, cafeteria.",https://www.inmuebles24.com/propiedades/clasificado/veclapin-dep-de-2-recamaras-a-5-minutos-de-santa-fe-esq-56857564.html,"MN 5,000,000","Carreter Mexico Toluca, 5860
Contadero, Cuajimalpa de Morelos","90 m² lote, 2 rec., 2 baños, 2 estac.",Cuajimalpa de Morelos
"Venta Departamento en Lomas de Vista Hermosa (parece casa con enorme jardín) Area habitable: 436m2. Terrazas: 61. 50m2. Jardín: 124. 20m2. Area total: 621. 67m2. 3 recámaras con vestidor y baño. Sala de t. v. Sala. Comedor. Family Room. Biblioteca / Bar. Baño de Visitas. Cto de lavado. Despensa. Cio de Servicio. Patio de Servicio. Terraza. Jardin. Cuarto de maquinas. 4 estacionamientos. Bodega. $44, 000, 000. $7, 000 dlls mas mantenimiento $19, 052",https://www.inmuebles24.com/propiedades/clasificado/veclapin-venta-departamento-en-lomas-de-vista-hermosa-parece-60521426.html,"MN 140,000","lomas de vista hermosa
Lomas de Vista Hermosa, Cuajimalpa de Morelos","621 m² lote, 3 rec., 3 baños, 4 estac.",Cuajimalpa de Morelos
"Hermoso departamento sobre Av. Santa Fe, Torre Península, ubicado en uno de los edificios más modernos y exclusivos en Santa Fe. A pasos del parque La Mexicana!! El departamento cuenta con una excelente iluminación y temperatura. Tiene una magnífica vista al Parque La Mexicana y también cuenta con balcón. No se incluyen muebles. **disponible en enero 2026** descripción. 3 Recámaras, la principal con baño y vestidor. 3. 5 baños. Sala. Comedor. Cocina. 2 estacionamientos. áreas comunes. Gimnasio. Alberca. Salón De Spinning. Salón De Yoga y Pilates. Sala De Negocios. Salón de Fiestas. Ludoteca. Cine. Estricta seguridad las 24 horas. En caso de estar interesados en la propiedad, nos pueden contactar: vía correo electrónico, WhatsApp o teléfono; para agendar una cita. Gracias. Contacto. Ver datos Celular. +Ver datos WhatsApp. Ver datos. tenemos más propiedades en nuestra página web. Gdpt",https://www.inmuebles24.com/propiedades/clasificado/alclapin-departamento-en-renta-en-peninsula-con-balcon-147792221.html,"MN 48,000","Avenida Santa Fe 546
Santa Fe Cuajimalpa, Cuajimalpa de Morelos","170 m² lote, 3 rec., 3 baños, 2 estac.",Cuajimalpa de Morelos
"Estrena Departamento en Bosques. Iluminado, excelentes vistas, Acogedor Espacios muy bien pensados para vivir en confort. Cuenta con 1 recamara de buen tamaño, con baño completo y vestidor. Y comparte baño con el área social. Cocina Abierta y equipada con Refrigerador, Horno de Microondas, Lavavajillas, gabinetes laminados y cubierta de cerámica. Centro de Lavado. Ventilación Natural Pisos Vinílicos en color whiskey, Persianas Traslucidas y Balck out. Chapa Digital. Todos los departamentos en la Renta incluyen; Mantenimiento. Luz. Agua. Gas. Internet. Amenidades como: Alberca templada al aire libre. Gimnasio y Salón de Yoga. Gamer Room. Co Working. Cafetería. Salón Bar. sky lounge. transporte A las universidades de la zona. ibero, tec de monterrey Y al centro comercial santa fe. Departamento sin muebles y Con Muebles. pregunta por precios. no se comparte comsion",https://www.inmuebles24.com/propiedades/clasificado/alclapin-departamento-bosques-de-las-lomas-147642143.html,"MN 27,500","Departamento en Renta en Bosques
Bosques de las Lomas, Cuajimalpa de Morelos","62 m² lote, 1 rec., 1 baño, 1 estac.",Cuajimalpa de Morelos
"Hermoso depto con espectaculares vistas al parque La mexicana se renta en City Santa Fe, torre Milan. 86 metros muy bien distribuidos. Sala comedor con cocina abierta, incluye refrigerador, lavaplatos y microondas, tiene aire acondicionado, baño de visitas, área de lavado, una espaciosa recámara, un vestidor amplísimo y baño grande, dos garages. Condominio con áreas comunes completas, alberca con doble opción ya sea techada o abierta, dos jacuzzis, asoleadero, zona de asadores, centro de negocios con WiFi, salón de adultos, jardín con juegos infantiles, salón juvenil, gym equipadísimo, spa con sauna, vapor y regaderas. Ubicación privilegiada, a unos pasos de City market, Soriana, Oxxo, Starbucks, Moshi moshi, Giornale, Oxxo, tintorerías, estéticas, corporativos como Banorte, Chrysler, Telefónica, del parque La mexicana y del Centro comercial santa fe, todo caminando; y a 5 minutos del Tec de Monterrey, Colegio Eaton, Westhill y de la Universidad Iberoamericana. Véalo! Previa cita.",https://www.inmuebles24.com/propiedades/clasificado/alclapin-esplendido-depto-con-vista-a-la-mexicana-se-renta-en-147845086.html,"MN 28,500","Av. Santa Fe 482
Santa Fe Cuajimalpa, Cuajimalpa de Morelos","85 m² lote, 1 rec., 1 baño, 2 estac.",Cuajimalpa de Morelos
"Depto de 120m. Amplia estancia con sala y comedor mas family room. Con amplia cocina y área de lavado. Cuenta con 2 recamaras amplias mas family room o estudio. Principal con vestidor y baño completo. Las otras dos comparte otro baño completo. Area de lavado. Con 2 lugares techados uno a lado del otro. Cuenta con bodega. Super Casa club. Increíbles amenidades con 2 albercas. Una techada semiolìmpica y la otra de recreación al aire libre con 2 jacuzzis, àrea de mascotas, cuenta con Gym equipado mas 2 canchas de paddle, con cine, salòn de eventos jòvenes adultos, ludoteca. Asadores. Vigilancia 24 hrs y, uy cerca de Sta fe e Interlomas, Vistahermosa. Vigilancia 24 hrs. Y teniendo una plaza con 21 locales de Enttorno parte de afuera donde habrà farmacia un Seven eleven, tintorerìa que no tendràs necesidad de tu Enttorno. Ven a conocerlo. Te encantará. Precio con mantenimiento incluido.",https://www.inmuebles24.com/propiedades/clasificado/alclapin-renta-de120-m-en-enttorno-con-bodega-desarrollo-cerca-62632726.html,"MN 24,000","Avenida Mèxico 359
Manzanastitla, Cuajimalpa de Morelos","120 m² lote, 2 rec., 2 baños, 2 estac.",Cuajimalpa de Morelos
"Hermoso departamento ubicado en Lomas de Vista Hermosa, cerrada con vigilancia, a pocos minutos de Bosques de las Lomas y Santa Fe! Acabados de lujo con pisos de madera en todo el departamento y muy iluminado. Esta propiedad cuenta con 307m2 perfectamente bien distribuidos en edificio con pocos departamentos. Consta de amplia sala comedor con vista arbolada, cocina de muy buen tamaño con cubierta de granito y acceso a cuarto de servicio y lavado. Baño de visitas. Family muy amplio que se comunica con las 3 recámaras. La principal tiene una preciosa terraza, baño y vestidor de gran tamaño. Las recámaras secundarias con baño propio cada una y vestidor muy completo. 3 estacionamientos y bodega. Precio de venta: $11, 900, 000 pesos. Precio de renta: $65, 000 pesos con mantenimiento incluido. Se renta sin muebles. Se aceptan mascotas. Amenidades: Gimnasio, jardín, salón de fiestas. No dejes de ver este excelente departamento! Contáctanos para agendar tu visita!",https://www.inmuebles24.com/propiedades/clasificado/veclapin-departamento-en-venta-o-renta-de-307-m-sup2--en-lomas-147573453.html,"MN 65,000","Loma de la Palma
Lomas de Vista Hermosa, Cuajimalpa de Morelos","307 m² lote, 3 rec., 3 baños, 3 estac.",Cuajimalpa de Morelos
"Exclusivo departamento amueblado en la Torre B de High Park, ubicado en el piso 16, con excelente distribución y acabados modernos. Características. 3 recámaras con excelente iluminación natural. 2 baños completos con acabados de lujo. Estancia amplia con salida a balcón. Cocina equipada de estilo moderno. Área de servicio. 2 cajones de estacionamiento fijos. 1 bodega. Amenidades High Park. Gimnasio equipado. Alberca climatizada. Salón de usos múltiples. Áreas verdes y terrazas. Seguridad 24/7 con acceso controlado. Estacionamiento para visitas. Este departamento es ideal para quienes buscan comodidad, seguridad y un estilo de vida sofisticado en una de las mejores zonas de la ciudad.",https://www.inmuebles24.com/propiedades/clasificado/alclapin-depa-high-park-av-santa-fe-147812556.html,"MN 44,000","AV SANTA FE 462
Contadero, Cuajimalpa de Morelos","119 m² lote, 3 rec., 2 baños, 2 estac.",Cuajimalpa de Morelos
Se renta loft en uno de los mejores desarrollos de Santa Fe perfilado para estudiantes o jóvenes profesionistas. El loft cuenta con 49 m2. Una amplia cocina integral. 1 baño completo. Closet. 1 lugar de Estacionamiento. El conjunto cuenta con: Seguridad Privada 24x7. Jardín. Terraza con Asadores. Cafetería. Una sala de Business. Salón para ver partidos con tv y mesa de billar. Un gimnasio super equipado con las mejores vistas. Mantenimiento incluido. No te quedes sin visitarlo**,https://www.inmuebles24.com/propiedades/clasificado/alclapin-departamento-en-renta-en-santa-fe-146507559.html,"MN 20,400","Blvrd. Reforma 3009
El Yaqui, Cuajimalpa de Morelos","49 m² lote, 1 baño, 1 estac.",Cuajimalpa de Morelos
"Muy buen departamento de dos recamaras con un estudio que podría convertirse en tercera recamara, dos estacionamientos y bodega. Excelentes amenidades, gym, alberca, spa, jacuzzis, asadores, parque de niños, canchas de paddle, tennis y basket, salones de usos múltiples, business center, salones de fiesta, área de mascotas. Se renta sin muebles, incluye lavadora, secadora y refrigerador. Incluye mantenimiento en la renta.",https://www.inmuebles24.com/propiedades/clasificado/alclapin-renta-departamento-a-8-min-de-santa-fe-147818065.html,"MN 26,000","Stampa Residencial
Contadero, Cuajimalpa de Morelos","1 m² lote, 2 rec., 2 baños, 2 estac.",Cuajimalpa de Morelos
"En el residencial hay varios departamentos de diferentes medidas. 33M2 en $16, 485. 00 hasta 84M2 en $32, 042. 00 de 1 Y dos recamaras. vistas panoramicas en este loft up santa fe. 44 M2 area abierta. baño cocina closets amplios. amenidades. jardin, cafeteria, terraza, sala lounge Y business center. gimnacio piso 35 con vistas espectaculares. mantenimiento incluido. se rentan con poliza juridica",https://www.inmuebles24.com/propiedades/clasificado/veclapin-departamento-listo-para-estrenar-en-up-santa-fe-145698772.html,"MN 22,000","BLVD REFORMA
El Yaqui, Cuajimalpa de Morelos","45 m² lote, 1 rec., 1 baño, 1 estac.",Cuajimalpa de Morelos
"En uno de los mejores residenciales de lujo en la cdmx, vidalta, En bosques de las lomas en la ciudad de méxico, Situado en una ubicación privilegiada, en una reserva natural con más de 120 mil metros donde convergen: lujo, inspiradores y modernos espacios arquitectónicos, diversos amenities de esparcimiento y wellness con gastronomía y restaurantes de primer nivel, sumados a un bosque privado, así como a un espectacular jardín central de 20 mil metros, conformando un oasis de tranquilidad y soﬁsticación, Tiene gym, alberca, spa, salon de fiestas, 3 estacionamientos, bodega, valet parking, acabados de lujo, 3 recamaras, 4 baños, bar, salon de belleza, en renta Y venta, mega precio, agenda tu cita",https://www.inmuebles24.com/propiedades/clasificado/veclapin-precioso-depto-en-vidalta-147489760.html,"MN 115,000","secretaria de marina 700
Bosques de las Lomas, Cuajimalpa de Morelos","320 m² lote, 3 rec., 3 baños, 3 estac.",Cuajimalpa de Morelos
"Departamento con acabados de lujo recamaras con vestidor Y baño; cuarto de tv, muchísima luz, amplios Y cómodos espacios, impecable listo para entrar, balcón, área de servicio, bodega, 3 estacionamientos. áreas comunes muy completas Y clases para adultos Y niños de todo incluidas en el mantenimiento como tenis, natación, gimnasio, spinning, atletismo, futbol Y muchas más, lindo restaurante, dos albercas, salones de adulto de fiestas Y jardines con asadores. Atención inmediata Ver datos 98",https://www.inmuebles24.com/propiedades/clasificado/alclapin-departamento-en-renta-en-cumbres-de-santa-fe-3-147303872.html,"MN 128,000","Av. de los Poetas
San Mateo Tlaltenango, Cuajimalpa de Morelos","320 m² lote, 3 rec., 3 baños, 3 estac.",Cuajimalpa de Morelos
"Trato sin intermediarios. disponible A partir del 1° de noviembre, 2025. Residencial Stampa, te ofrece una experiencia de vida única a sólo 5 minutos de Santa Fe, uno de los distritos más vibrantes y modernos de la Ciudad de México. Departamento diseñado con acabados de lujo que reflejan elegancia y modernidad. La cocina, con una encimera de granito, es un espacio funcional y estéticamente agradable para crear tus platillos favoritos. Las vistas panorámicas desde las ventanas te ofrecerán un espectáculo visual constante y la excelente iluminación natural inundará cada rincón, creando un ambiente cálido y acogedor. Disfruta de las amenidades de primer nivel que Residencial Stampa tiene para ofrecer, incluyendo canchas de tenis y pádel, alberca, gimnasio, una ludoteca para los más pequeños y salas de cine para las tardes de entretenimiento. Relájate en el jacuzzi, pasea por los hermosos jardines con juegos infantiles u organiza una deliciosa parrillada en las áreas de asador. Incluso tus mascotas serán bienvenidas con áreas especialmente diseñadas para ellas. Dos estacionamientos techados en fila y bodega en sótano. Vigilancia 24/7, estacionamientos para visitas",https://www.inmuebles24.com/propiedades/clasificado/alclapin-renta-departamento-2-balcones-stampa-contadero-147570177.html,"MN 26,900","Carretera México Toluca 5860
Contadero, Cuajimalpa de Morelos","89 m² lote, 2 rec., 2 baños, 2 estac.",Cuajimalpa de Morelos
