Título,Enlace,Precio,Dirección,Características,Municipio de Origen
"Este departamento en Ciudad de México se encuentra en excelente condición y ofrece una amplia variedad de servicios para tu comodidad. Con una superficie total de 202m2, cuenta con 3 baños y 4 recamaras, ideal para una familia numerosa. Además, dispone de 2 plazas de aparcamiento y una ubicación privilegiada en el barrio de Contadero o ideal para quienes trabajan en Santa Fe. Entre sus servicios destacan el área recreativa, el salón de eventos, el spa y la alberca, perfectos para disfrutar en compañía de amigos y familiares. Con una cocina integral, cuarto de tv, jardín privado, balcón y vestidor, esta propiedad ofrece todo lo necesario para una vida cómoda y relajada. ¡No pierdas la oportunidad de vivir en este increíble hogar! ¡Contáctanos para más información!",https://www.inmuebles24.com/propiedades/clasificado/alclapin-departamento-en-renta-en-san-mateo-tlaltenango-147364493.html,"MN 55,000","Tres Cumbres Santa Fe
San Mateo Tlaltenango, Cuajimalpa de Morelos","202 m² lote, 4 rec., 3 baños, 2 estac.",Cuajimalpa de Morelos
"Exclusivo departamento en residencial trianon, bosques de las lomas. Paseo de los Ahuehuetes Norte. Vive en una de las zonas más exclusivas de la ciudad, rodeado de naturaleza, privacidad y gran plusvalía. Ubicado en el prestigiado Residencial Trianon, un desarrollo único con solo 84 departamentos distribuidos en 6 torres dentro de un terreno de 20, 000 m². Características del departamento: • 460 m² de construcción. • Excelente orientación y luz natural. • Elegantes pisos de madera. • 3 recámaras. o 1 con clóset. o 2 con amplio walk-in closet. • Sala, antecomedor, bar y despacho. • Balcón con vista agradable. • Cocina y baños en estado funcional, con oportunidad para remodelar a tu gusto. • Muchos espacios de guardado y clósets. • Estacionamiento para 6 autos. • Bodega. • Cuota de mantenimiento: $21, 000 mensuales. Exclusividad y privacidad: • Desarrollo con vigilancia 24/7. • Áreas verdes arboladas. • Solo 14 departamentos por torre. • Albercas techada y otra al aire libre. •Gimnasio. •2 canchas de tenis. •Cancha de futbol. •Jardín con juegos y asadores. •Spa. • Salón de eventos",https://www.inmuebles24.com/propiedades/clasificado/alclapin-residencial-trianon-bosques-de-las-lomas-147344149.html,"MN 130,000","Ahuehuetes
Bosques de las Lomas, Cuajimalpa de Morelos","460 m² lote, 3 rec., 3 baños, 6 estac.",Cuajimalpa de Morelos
"Lindisimo depto con espacios generosos y bien distribuidos. Se renta amueblado. Pisos de madera, cocina actualizada. Iluminado y calientito. Elevador al piso. 300 metros, sala y comedor muy espaciosa, cocina con alacena, área de Antecomedor, family room, estudio, 3 recámaras con baño y vestidor, 3 garages. Áreas comunes recién remodeladas, alberca techada con chapoteadero, hermoso jardín con juegos infantiles y zona de asadores con palapas, cancha de tennis, salón de adultos, ludoteca infantil, salón de eventos. Ubicación privilegiada, a tan solo unos minutos de Pabellón Bosques, Colegio Cumbres y Colegio Vista Hermosa, y a 15 minutos de Santa Fe, Interlomas, Cuajimalpa, Reforma y Palmas. Véalo! Previa cita",https://www.inmuebles24.com/propiedades/clasificado/veclapin-esplendido-depto-amueblado-se-renta-vende-en-bosques-146472349.html,"MN 65,000","Bosques de reforma 1507
Bosques de las Lomas, Cuajimalpa de Morelos","300 m² lote, 3 rec., 3 baños, 3 estac.",Cuajimalpa de Morelos
"Ff 26 - 923. Renta de cómodo departamento ubicado en Residencial Park D´Luxe, Cuajimalpa de Morelos, la alcaldía mas segura de Ciudad de México. Agradable clima de montaña. Excelente ubicación en la Avenida México, a pocos kilómetros de Santa Fe e Interlomas. Muy cerca de Chedraui El Yaqui, El departamento está ubicado en la Planta Baja de moderno residencial y tiene una agradable vista hacia la Plaza Central. Precio sujeto a cambio sin previo aviso.",https://www.inmuebles24.com/propiedades/clasificado/alclapin-departamento-en-renta-en-manzanastitla-cuajimalpa-147819665.html,"MN 16,500","Manzanastitla
Manzanastitla, Cuajimalpa de Morelos","60 m² lote, 2 rec., 1 baño, 2 estac.",Cuajimalpa de Morelos
"Departamento Listo Para Estrenar en Up Santa Fe. en el residencial hay varios departamentos de diferentes medidas. 33M2 en $16, 485. 00 hasta 84M2 en $32, 042. 00 de 1 Y dos recamaras. vistas panoramicas en este loft up santa fe. 44 M2 area abierta. baño cocina closets amplios. amenidades. jardin, cafeteria, terraza, sala lounge Y business center. gimnacio piso 35 con vistas espectaculares. mantenimiento incluido. se rentan con poliza juridica",https://www.inmuebles24.com/propiedades/clasificado/veclapin-departamento-listo-para-estrenar-en-up-santa-fe-147772531.html,"MN 16,189","Blvrd Reforma
La Rosita, Cuajimalpa de Morelos","33 m² lote, 1 rec., 1 baño, 1 estac.",Cuajimalpa de Morelos
Departamento con lindos y modernos acabados. Con mucha luz y espacio. Elegante. Ideal para parejas jovenes o familias pequeñas. Sus recamaras cuentan con baño cada una. Vestidor espacioso en recamara principal. Techos altos y ambientes con ventilación. Estancia con salida inmediata a balcon,https://www.inmuebles24.com/propiedades/clasificado/alclapin-departamento-venta-cuajimalpa-santa-fe-146053830.html,"MN 8,550,000","Carr. San Mateo Sta. Rosa 99
Contadero, Cuajimalpa de Morelos","180 m² lote, 3 rec., 2 baños, 2 estac.",Cuajimalpa de Morelos
"Santa Fe, Salvador Agraz, Torre Capital. Bonito departamento amueblado y equipado de 125m2. Sala comedor, cocina abierta, lavandería, dos recámaras, 2 baños, 2 estacionamientos. Bonita Vista, iluminado. Áreas comunes: Gimnasio. Seguridad 24 horas. La renta incluye mantenimiento.",https://www.inmuebles24.com/propiedades/clasificado/alclapin-santa-fe-salvador-agraz.-escape-departamento-en-renta-147835496.html,"MN 32,000","Salvador Agraz
Santa Fe Cuajimalpa, Cuajimalpa de Morelos","125 m² lote, 2 rec.",Cuajimalpa de Morelos
"Departamento de 90 metros, vista al bosque, 2 recamaras, 2 baños completos, 2 estacionamientos y 1 bodega, área de lavado y balcones. El edificio cuenta con seguridad privada, cajones de visita, Alberca con 3 carriles de nado, alberca familiar y chapoteadero 3 jacuzzis, Spa, Sauna, Vapor, jardín con asadores, salones de eventos, salon de adultos con billar y futbolito, Gym, cine ludoteca, cafeteria.",https://www.inmuebles24.com/propiedades/clasificado/alclapin-dep-90-m-mas-balcones-a-5-minutos-de-santa-fe-56463208.html,"MN 24,500","Carretera México Toluca 5860
Contadero, Cuajimalpa de Morelos","90 m² lote, 2 rec., 2 baños, 2 estac.",Cuajimalpa de Morelos
"Solo pago en efectivo. Espectacular departamento en Santa Fe Mediterranea con excelente orientación, distribución y diseño de lujo. Caracteristicas: 240 mts2. 3 recamaras (2 con vestidor y 1 con closet) 3 baños completos. 1 medio baño de visitas. Sala y comedor de gran tamaño. Family room. Cocina con amplia estancia. Alacena. cuarto y baño de servicio. cuarto de lavado. terraza (12 mts2) 3 estacionamientos y 1 bodega. Mantenimiento incluido en la renta. Amenidades: Mediterranea Resort Living es un complejo excelente para familias que cuenta con las mejores amenidades de Santa Fe con amplios jardines, un lago artificial, asadores, cancha de futbol, canchas de tennis, paddle, squash, gimnasio, parque para niños, sala de cine, ludoteca, salon de fiestas, salon de adultos, salon de spinning, salon de yoga, cajones de visitantes y seguridad privada. Además cuenta con profesores privados que dan clases de boxeo, yoga, spinning, natación, entre otras.",https://www.inmuebles24.com/propiedades/clasificado/alclapin-fantastico-departamento-en-santa-fe-mediterranea-64059057.html,"MN 65,000","Vasco de Quiroga , santa fe, Contadero, Cuajimalpa de Morelos, Ciudad de México, CDMX
Santa Fe Cuajimalpa, Cuajimalpa de Morelos","240 m² lote, 3 rec., 3 baños, 3 estac.",Cuajimalpa de Morelos
"Departamento en la mejor ubicación de Bosques de las Lomas. 3 recámaras con baño y vestidor. Cocina integral. Sala y comedor. Medio baño. Con amenidades, alberca. Gimnasio, salón de fiestas. Sala de cine. Ludoteca. Salón de adultos. Alberca. Etc. Nota: El precio es del día de la publicación y está sujeto a cambios.",https://www.inmuebles24.com/propiedades/clasificado/alclapin-departamento-en-renta-armony-en-renta-145233796.html,"MN 75,000","Paseo de los Tamarindos
Granjas Palo Alto, Cuajimalpa de Morelos","300 m² lote, 3 rec., 3 baños, 3 estac.",Cuajimalpa de Morelos
"Precioso departamento en renta con excelentes acabados, cuenta con recámaras cada una con baño, de ellas con vestidor y una con closet (opción a una er recámara), sala, comedor, desayunador, cocina con grandes espacios y excelente material de importación, despensa, estudio, área de lavado, cuarto de servicio, bodega, lugares de estacionamiento y vigilancia. Amenidades: alberca, jardín, ludoteca, salón de fiestas, cancha de futbol, tennis, juegos para niños. Mantenimiento incluido en la renta.",https://www.inmuebles24.com/propiedades/clasificado/alclapin-departamento-en-renta-bosques-de-las-lomas-91375969.html,"MN 170,000","Prolongación Bosques de Reforma 1592
Bosques de las Lomas, Cuajimalpa de Morelos","520 m² lote, 2 rec., 2 baños, 5 estac.",Cuajimalpa de Morelos
"Departamento nuevo para estrenar amueblado Y con acabados de lujo. Consta de 1 recamara, 1baño, 1 cajon. . Ademas de sensores de humo, gas y dioxido de carbono. . Tambien alarma contra incendios. Incluye servicios. Entre sus amenidades se encuentra alberca, chapoteadero, terrace pool, social bar, game room, barbecue grill, gymcoworking, coffe lounge, sala de yoga y pet zone. Precios sujetos a cambio sin previo aviso. Imagenes referenciales.",https://www.inmuebles24.com/propiedades/clasificado/alclapin-departamento-amueblado-en-renta-en-cuajimalpa-de-147826907.html,"MN 29,097","Granjas Palo Alto
Granjas Palo Alto, Cuajimalpa de Morelos","61 m² lote, 1 rec., 1 baño, 1 estac.",Cuajimalpa de Morelos
"Excelente Departamento amueblado Renta en Lantana Santa Fe, cercano al Centro Comercial Santa Fe. Edificio con solo 22 departamentos. Cuenta con 3 recámaras amplias cada una con baño, sala de estar amplia, family room, medio baño de visitas, cocina integral con desayunador, cuarto de servicio, área de lavado, terraza, bodega y 5 estacionamientos. El residencial cuenta con alberca, área para mascotas, lavado de autos, vigilancia, gimnasio, jardín, salón de eventos. No acepta mascotas. ya incluye mantenimiento. ¡Agenda hoy mismo y ven a conocerlo!",https://www.inmuebles24.com/propiedades/clasificado/veclapin-departamento-amueblado-con-family-room-en-lantana-146977257.html,"MN 125,000","Vista Hermosa
Santa Fe Cuajimalpa, Cuajimalpa de Morelos","365 m² lote, 3 rec., 3 baños, 5 estac.",Cuajimalpa de Morelos
"Rento depto de 4 recamaras en ""encinar"" - ""cumbres de santa fe"" Elevador directo al departamento. Piso alto. características. 363 m2. 30. 53 m2 de Terraza. 393. 79 m2 Totales. Recamara principal con vestidor y baño completo. 3 Recamaras con walking closet y baño completo. Family room. Desayunador. Sala. Comedor. Cuarto de servicio. 4 Estacionamientos. amenidades: • Salón de eventos para 100 personas y terraza. • Gimnasio totalmente equipado. • Alberca con 2 carriles semiolímpicos. • Vestidores. Seguridad. Accesos controlados las 24hrs. Accesos vehiculares independientes para residentes y visitantes. Accesos peatonales. Doble control de seguridad en caseta Cumbres y Encinar. Precio de venta: $38, 000, 000 mxn. rento 195, 000",https://www.inmuebles24.com/propiedades/clasificado/veclapin-vendo-o-rento-depto-de-4-rec-en-encinar-cumbres-de-141856941.html,"MN 195,000","AVENIDA CARLOS LAZO 100
San Mateo Tlaltenango, Cuajimalpa de Morelos","363 m² lote, 4 rec., 3 baños, 2 estac.",Cuajimalpa de Morelos
"Venta y/o renta amueblado, En Renta: 15, 000. 00 dólares, Más Mantenimiento, Estilo Moderno Minimalista, Muy bueno, Remodelado, ph, 2 niveles, 4 Recámaras con vestidor y baño, Dos cocina integral con cubierta de granito nuevas, Sala, Comedor, Estudio, Despacho, Área de tv, Cuarto de servicio y área de lavado, Baño de visitas, Terraza grande en segundo nivel con jacuzzi con cristales controlados por sistema inteligente, techos altos y pisos de madera y cantera, Alberca techada, Cancha de tenis, Cancha de Squash, Gimnasio, Salón de fiestas para adultos y para niños, Salón de aerobics, Jardín común, Juegos Infantiles, 8 autos, Seguridad las 24 hrs. Nota, para renta los primeros 4 años la luz es gratuita.",https://www.inmuebles24.com/propiedades/clasificado/alclapin-pent-house-4-recamaras-amueblado-bosques-de-las-52233879.html,"USD 15,000","Prolongación Bosque de la Reforma
Bosques de las Lomas, Cuajimalpa de Morelos","575 m² lote, 4 rec., 4 baños, 8 estac.",Cuajimalpa de Morelos
"Excelente departamento amueblado en renta en uno de los edificios más modernos de la zona de Patio Santa Fe. Vía Santa Fe se caracteriza por consentir a sus residentes con un Shuttle exclusivo que te llevará a todos los lugares favoritos de Santa Fe sin costo adicional, para que no tengas que utilizar tu auto y te olvides del tráfico. Además, cuenta con un gimnasio amplio con aparatos de primera calidad y pesas para que hagas tus rutinas de ejercicio. Si tienes un evento importante, puedes llevarlo a cabo en su amplio salón de fiestas con salida a una agradable terraza cálida que hará sentir a tus invitados muy cómodos, o si prefieres, puedes hacerlo en el área de asadores con juegos infantiles. La ludoteca con la que cuenta es didáctica y de buen tamaño para que los niños jueguen y se diviertan. El departamento cuenta con un diseño moderno y el decorado es para parejas o estudiantes. Renta $25, 000 + $4, 500 de Mantenimiento. Atención inmobiliarias: Para mayor información por favor de comunicarse al cincuentaycinco/dieciocho/treintaydos/doce/ceroocho. no acepta mascotas. ¡Ven a conocerlo!",https://www.inmuebles24.com/propiedades/clasificado/alclapin-departamento-amueblado-en-renta-en-via-santa-fe-145502711.html,"MN 25,000","Prolongación Reforma
Santa Fe Cuajimalpa, Cuajimalpa de Morelos","88 m² lote, 2 rec., 2 baños, 2 estac.",Cuajimalpa de Morelos
"Renta de cómodo departamento ubicado en Residencial Park D´Luxe, Cuajimalpa de Morelos, la alcaldía mas segura de Ciudad de México. Agradable clima de montaña. Excelente ubicación en la Avenida México, a pocos kilómetros de Santa Fe e Interlomas. Muy cerca de Chedraui El Yaqui, El departamento está ubicado en la Planta Baja de moderno residencial y tiene una agradable vista hacia la Plaza Central. El departamento cuenta con 60m2, distribuidos en salón comedor, cocina concepto abierto con encimera de granito, cuarto de lavado, dos recámaras, un baño con regadera y cancel de cristal, dos lugares de estacionamiento techados e individuales (caben cómodamente dos camionetas) Una bodega. Bonita vista a la plaza central del residencial. Amenidades: Salón de usos múltiples con motor lobby. Salón de yoga/Aerobics. Salón de Jóvenes. Business Center. Gimnasio, Ludoteca. Cancha de paddle tennis. Juegos infantiles, Deck con asadores. Pista de jogging. Asoleadero y área de hamacas. Pet friendly. Estacionamiento para las visitas. Sistemas Inteligentes, sensores de iluminación e internet inalámbrico en plaza central. Estricta vigilancia 24/7. Precio y disponibilidad sujetos a cambio. cmb 26-923.",https://www.inmuebles24.com/propiedades/clasificado/alclapin-departamento-en-renta-en-cuajimalpa-resd.-park-d-luxe-147814581.html,"MN 16,501","Avenida Mexico
Manzanastitla, Cuajimalpa de Morelos","60 m² lote, 2 rec., 1 baño, 2 estac.",Cuajimalpa de Morelos
"Descripción. over santa fe, esta ubicado en una zona exclusiva, ofrece lujo estilo y comodidad, este desarrollo residencial compuesto por dos torres de departamentos, esta perfectamente adaptado a la vida cosmopolita de las familias, ofreciendo las mejores vistas. Tenemos departamentos de 2 o 3 recamaras 2 baños, 2 lugares de estacionamientos cocina integral, patio de servicio, terraza. Igualmente, tiene: Gym, Salón de eventos, de juegos, alberca, pet zone roof garden, salón de adultos, ludo teca, terraza y lobby.",https://www.inmuebles24.com/propiedades/clasificado/veclapin-departamento-lujo-santa-fe.-146951744.html,"MN 48,000","CARLOS GRAEF
Santa Fe Cuajimalpa, Cuajimalpa de Morelos","109 m² lote, 2 rec., 2 baños, 2 estac.",Cuajimalpa de Morelos
"Te presentamos una oportunidad única para vivir en uno de los lugares más exclusivos de la Ciudad de México. Este moderno departamento tipo loft combina lujo, diseño contemporáneo y una ubicación privilegiada en Lomas de Chamizal. Vive en este hermoso departamento tipo Loft que cuenta con sala, comedor, cocina integral, balcón, área de lavado, una habitación, un baño, un espacio de estacionamiento para auto compacto. El valor de la renta ya incluye el servicio de agua, gas y luz (hasta $500). Este departamento se renta únicamente para una persona. Se acepta una mascota pequeña. Con excelente ubicación, a 5 min de Santa Fe, Interlomas. Lomas de Chamisal es una de las zonas más prestigiosas de la Ciudad de México, con acceso a restaurantes gourmet, centros comerciales de lujo, parques y una gran oferta cultural. Además, su ubicación estratégica permite un fácil acceso a las principales vías de comunicación de la ciudad. Con Homie renta sin aval. Proceso 100% digital y diferentes formas de pago de tu renta, tú eliges. ¡Conoce ya este depa! Estás a pocos pasos de encontrar el hogar de tus sueños. Departamento de 68. 0 metros cuadrados cuenta con: - 1 habitación. - 1. 0 baño. - Se aceptan mascotas. - 1 lugar de estacionamiento. Servicios: - Luz. - Gas. - Agua. Antigüedad: 9 años. . Número de habitantes recomendado: 2. Disponibilidad para mostrar: 20/octubre/2025. Disponibilidad para habitar: 20/octubre/2025. ¡Enamórate de tu vida en este departamento! # Homie Id: 2_6_5. Estos son los beneficios que tienes como inquilino al rentar tu nuevo hogar con nosotros: * No necesitas aval (sujeto a Términos y Condiciones). * Realiza el pago de tu renta mediante transferencia digital en nuestra plataforma o en efectivo en miles de locales disponibles. * Asistencia y conciliación con tu propietario. * Proceso sin burocracia, renta en cuestión de horas y sin trámites complicados. * Firma tu contrato de forma digital.",https://www.inmuebles24.com/propiedades/clasificado/alclapin-departamento-tipo-loft-en-bosques-de-las-lomas-53890708.html,"MN 12,500","Fábrica de Cartuchos
Bosques de las Lomas, Cuajimalpa de Morelos","68 m² lote, 1 rec., 1 baño, 1 estac.",Cuajimalpa de Morelos
"Amplio departamento, con excelente distribución y generosos espacios. Tiene muy buena luz. Cuenta con 2 terrazas con agradable vista. Tiene Family en el área privada. Son tres recámaras, cada una con vestidor y baño. Area de servicio, de muy buen tamaño, con lavandería, recámara y cuarto de servicio. El edificio está ubicado enfrente del centro comercial Santa Fe. Con accesos por Vasco de Quiroga, la Autopista y la Carretera libre. Son 2 Torres de 14 pisos. De áreas comunes tiene un salón con cocina y baños, alberca con calefacción y gimnasio. Tiene una bodega ubicada en el estacionamiento. El mantenimiento está incluido en el precio de renta. eb-tb4698",https://www.inmuebles24.com/propiedades/clasificado/alclapin-departamento-renta-vasco-de-quiroga-santa-fe-146381678.html,"MN 73,000","VASCO DE QUIROGA 499
Santa Fe Cuajimalpa, Cuajimalpa de Morelos","320 m² lote, 3 rec., 3 baños, 3 estac.",Cuajimalpa de Morelos
"Hermoso departamento muy amplio y muy bien iluminado, finos acabados elevador directo al departamento. Se encuentra en el fraccionamiento Club de Golf Santa Fe. Del prestigiado arquitecto Girault con muy amplias terrazas. Remodelado. 3 recamaras cada un con vestidor y baño, family, amplia estancia con terraza, cocina integral, 2 cuartos de servicio y área de lavado, 4 lugares de estacionamiento y bodega. Con una vista espectacular a la cañada,. Áreas Comunes: Jardin muy amplio, salón para eventos. , alberca techada y cancha de tenis Acceso directo al Club.",https://www.inmuebles24.com/propiedades/clasificado/alclapin-renta-departamento-club-de-golf-santa-fe-54448895.html,"USD 11,000","Club de Golf Santa Fe
Club de Golf Bosques de Santa Fe, Cuajimalpa de Morelos","460 m² lote, 3 rec., 3 baños, 4 estac.",Cuajimalpa de Morelos
"Este amplio departamento de 360 m² se encuentra disponible en venta y renta en la exclusiva zona de Lomas de Vista Hermosa. Cuenta con 3 recámaras con vestidor y 3 baños completos, además de un medio baño adicional de visitas. La propiedad ofrece un diseño espacioso que incluye sala, comedor, sla de tv y una cocina integral equipada con desayunador. Disfrute de la comodidad de tener 2 lugares de estacionamiento, área de lavado y cuarto de servicio integrado. Las terrazas privadas son ideales para relajarse y disfrutar de la vista arbolada. Además, se aceptan mascotas, lo que lo convierte en un hogar perfecto para familias con animales. El exclusivo edificio con solo 4 deptos cuenta con un salón común, espacio para un gimnasio, terraza y jardín. La ubicación es inmejorable, con escuelas cercanas y acceso a servicios básicos como agua y luz. La seguridad privada brinda tranquilidad y protección. Para el entretenimiento, cuenta con cuarto de tv e internet/wifi. Además, la zona ofrece cercanía a parques, supermercados, farmacias y centros comerciales, con fácil acceso a vialidades principales. Lomas de Vista Hermosa es una zona residencial tranquila y segura, ideal para familias y profesionales que buscan un estilo de vida cómodo y exclusivo. Cuota de mantenimiento del edificio incluida en la renta. Cuota de seguridad de la calle $ 4, 500 no incluida. Sujeto a cambios de disponibilidad sin previo aviso. Buzón de quejas y sugerencias al teléfono de contacto.",https://www.inmuebles24.com/propiedades/clasificado/veclapin-departamento-360-m-sup2--con-3-recamaras-en-venta-y-66539413.html,"MN 65,000","loma larga
Lomas de Vista Hermosa, Cuajimalpa de Morelos","360 m² lote, 3 rec., 3 baños, 3 estac.",Cuajimalpa de Morelos
"Departamento en renta de 129m2 más 17m2 de balcon, sobre la Carr. San Mateo Sta. Rosa. Cuenta con 3 recamaras, 3 baños, 2 lugares de estacionamiento en linea de 2, área de lavado integrada, departamento exterior muy iluminado, en excelente estado de conservación, en el piso 18 con elevador, con persianas y canceles instalados, cuota de mantenimiento incluida. El edificio es totalmente nuevo, con vigilancia 24hrs, gimnasio, Roof Garden con asadores, ludoteca, salon de eventos, salon de juegos. Vías de acceso cercano: Av. Tamaulipas. Servicios cercanos: Centro Santa Fe, Costco, Walmart. Requisitos: 1 mes de renta, 1 mes de depósito, fiador con propiedad libre de gravamen y una poliza juridica de $5, 300. Restricciones: No mascotas. Fiador obligatorio: No.",https://www.inmuebles24.com/propiedades/clasificado/alclapin-departamento-renta-en-origina-santa-fe-129-m-sup2-147467814.html,"MN 50,000","Carr. San Mateo Sta. Rosa 99
Contadero, Cuajimalpa de Morelos","129 m² lote, 3 rec., 3 baños, 2 estac.",Cuajimalpa de Morelos
"❖ Departamento con excelentes acabados. ❖ Cocina equipada con granito. ❖ Recámara principal con vestidor. ❖ 2 recámaras con baño completo. ❖ Cuarto de televisión y / o estudio. ❖ Club con excelentes amenidades, gimnasio, restaurante, pista de jogging, área de baseball, soccer. ❖ Starbucks dentro del club. ❖ Mantenimiento de $13, 950. 00 incluido en el precio de renta. ❖ En renta no se aceptan mascotas. .",https://www.inmuebles24.com/propiedades/clasificado/veclapin-departamento-en-venta-y-renta-en-club-resindencial-145492421.html,"MN 65,500","Secretaria de Marina 700
Lomas del Chamizal, Cuajimalpa de Morelos","238 m² lote, 3 rec., 3 baños, 3 estac.",Cuajimalpa de Morelos
"Excelente Departamento en Renta en Blum SantaFe, frente a Patio Santa Fe con vista interior. Disponible en noviembre. Cuenta con una recámara con clóset, un baño completo, estancia amplia, cocina integral, área de lavado y un estacionamiento. Amenidades cómo gimnasio, salón de eventos, área de juegos infantiles, alberca, bussines center, asadores y más! No acepta mascotas. disponible en noviembre. amueblado por costo extra. ¡Agenda hoy mismo y ven a conocerlo!",https://www.inmuebles24.com/propiedades/clasificado/alclapin-departamento-en-renta-en-blum-santa-fe-147756679.html,"MN 20,500","Blum Residencial Santa Fe
Santa Fe Cuajimalpa, Cuajimalpa de Morelos","55 m² lote, 1 rec., 1 baño, 1 estac.",Cuajimalpa de Morelos
