Título,Enlace,Precio,Dirección,Características,Municipio de Origen
"Renta sin Aval en 24 horas. Proceso ágil y flexible. / Lease without guarantor with agile and flexible processes in 24 hours. Opción de departamentos amueblados por Bo-Concept. / Furnished apartments by Bo-Concept available. Todos los departamentos incluyen electrodomésticos. (microondas, lava-secadora, Refrigerador, estufa con horno, lavavajillas) persianas / canceles. All apartments include appliances. (microwave, washer-dryer, refrigerator, stove with oven, dishwasher) blinds / gates. ! estrena depa en la Torre mas emblemática de la cdmx! Brand new apartments just released to the market in the most iconic tower in cdmx. Departamentos tipo: Loft, 1 y 2 recámaras; a un minuto de Bosques de las Lomas y Arcos Bosques (El Pantalón) en medio de escuelas, universidades, hospitales, centros comerciales y toda la oferta de servicios que ofrecen Santa Fe y Bosques. Potencializa tu vida con nuestras amenidades: Alberca. Co-Working. Bar. Cafetería. Salón de Fiestas. Game Room. Chill Spot. Pet Zone. Área de asadores con fogateros. Gimnasio. Yoga Room. Motor Lobby. Sala de recepción. Concierge Vigilancia 24hrs. cctv. Shuttle que te conecta con los principales puntos de la cdmx y Santa Fe. Renta sin aval; Departamentos nuevos, Totalmente equipados con electrodomesticos nuevos, agenda una cita y prepara todo para estrenar! !",https://www.inmuebles24.com/propiedades/desarrollo/ememvein-ri-a-bosques-renta-y-estrena-nuestros-depas.-loft-1-141933064.html,"MN 19,800","carretera mex - tol 1535
Santa Fe Cuajimalpa, Cuajimalpa de Morelos","455 un., 1 a 2 rec., 57 m² lote",Cuajimalpa de Morelos
"Conoce este lujoso y moderno departamento, con amenidades de primer nivel. Vive de en un entorno de naturaleza y seguridad, con acceso cercano a colegios, universidades y vías principales. ¡Contáctanos y visítalo! - Ubicado en uno de los residenciales de lujo de la zona. - Elevador directo al piso, vestíbulo de acceso, elegante lobby y recepción con concierge. - 400 M2 Construcción (375 M2 + terrazas) - 3 Recámaras con vestidor. - 3 Baños completos y 1 medio baño. - 1 Cuarto de servicio. - 1 Bodega. - 3 Cajones de estacionamiento. - Distribución: Family room, sala de tv, Sala y comedor con ventanales panorámicas, cocina integral cerrada y equipada. - Acabados de lujo; placas de mármol, madera natural y cocina de diseño. - Amenidades: Alberca con carriles de nado, cancha de pádel, gimnasio, jardines y salón de fiestas. - Jardines y áreas verdes. - Seguridad 24 horas con acceso controlado. Al ""Contactar"" para consultar esta propiedad, estás aceptando los ""Términos y Condiciones"" y ""Aviso de privacidad"". Los precios publicados y la disponibilidad pueden cambiar sin previo aviso por lo que se debe de verificar con la inmobiliaria y los propietarios de los inmuebles. Los gastos e impuestos de escrituración no están incluidos en el costo de venta, así como el mobiliario, electrodomésticos y arte que se muestran en las fotografías. Este inmueble está sujeto a adquisición por medio de un crédito hipotecario. En caso de que este inmueble se adquiera a través de un crédito, el precio variará de acuerdo con las tasas de interés aplicables a dicho crédito. Todas las medidas enunciadas son meramente orientativas, las medidas exactas serán las que se expresen en el respectivo título de propiedad de cada inmueble. La publicación de la presente información no representa una oferta pública por lo que toda transacción debe de hacerse de forma personal de acuerdo con las prácticas comerciales de la inmobiliaria y para poder ser valida requiere de la autorización expresa de los propietarios de los inmuebles. No esperes más y déjanos ayudarte. ¡contáctanos!",https://www.inmuebles24.com/propiedades/clasificado/alclapin-departamento-en-renta-en-santa-fe-147728920.html,"MN 145,000","CUMBRES DE SANTA FE
Cuajimalpa de Morelos, Ciudad de México","400 m² lote, 3 rec., 3 baños, 3 estac.",Cuajimalpa de Morelos
"Renta sin Aval en 24 horas. Proceso ágil y flexible. / Lease without guarantor with agile and flexible processes in 24 hours. Opción de departamentos amueblados por Bo-Concept. / Furnished apartments by Bo-Concept available. Todos los departamentos incluyen electrodomésticos. (microondas, lava-secadora, Refrigerador, estufa con horno, lavavajillas) persianas / canceles. All apartments include appliances. (microwave, washer-dryer, refrigerator, stove with oven, dishwasher) blinds / gates. ! estrena depa en la Torre mas emblemática de la cdmx! Brand new apartments just released to the market in the most iconic tower in cdmx. Departamentos tipo: Loft, 1 y 2 recámaras; a un minuto de Bosques de las Lomas y Arcos Bosques (El Pantalón) en medio de escuelas, universidades, hospitales, centros comerciales y toda la oferta de servicios que ofrecen Santa Fe y Bosques. Potencializa tu vida con nuestras amenidades: Alberca. Co-Working. Bar. Cafetería. Salón de Fiestas. Game Room. Chill Spot. Pet Zone. Área de asadores con fogateros. Gimnasio. Yoga Room. Motor Lobby. Sala de recepción. Concierge Vigilancia 24hrs. cctv. Shuttle que te conecta con los principales puntos de la cdmx y Santa Fe. Renta sin aval; Departamentos nuevos, Totalmente equipados con electrodomesticos nuevos, agenda una cita y prepara todo para estrenar! !",https://www.inmuebles24.com/propiedades/desarrollo/ememvein-riga-bosques-renta-y-estrena-nuestros-depas.-loft-1-144183867.html,"MN 19,800","Paseo de los Tamarindos 90
Bosques de las Lomas, Cuajimalpa de Morelos","456 un., 1 a 2 rec., 58 a 95 m² lote",Cuajimalpa de Morelos
"Departamento de Lujo en Renta - Sin muebles. Residencial: Origina Santa Fe. Descubre este increíble departamento ubicado en Origina Santa Fe, un residencial exclusivo y vanguardista que redefine el lujo y la funcionalidad en la Ciudad de México. Diseñado por los renombrados Artigas Arquitectos y Mariana Rivera, este desarrollo ofrece una experiencia de vida excepcional con acabados de la más alta calidad y amenidades de primer nivel. +Tipo de operación: Departamento en renta sin muebles. + Ubicación: Origina Santa Fe, Cuajimalpa, cdmx. Características del Departamento: • Superficie Total: 169. 82m² • Balcón: en área social de 5. 28 m² • Recámaras: 3 amplias recámaras e iluminadas. • Baños: 3 baños completos y 1 medio baño para visitas. • Family Room: Espacio ideal para área de televisión o estudio. • Sala y Comedor: Áreas muy amplias y luminosas. • Cocina: Moderna cocina con barra de mármol y acabados de lujo. • Cuarto de servicio con baño completo. • Pisos: De madera de ingeniería. • Área de Lavado: Independiente y funcional. • Estacionamiento: 2 cajones disponibles. Características Principales del Residencial: • Más de 10, 000 m² de áreas verdes funcionales que promueven el bienestar y la comunidad. • Diseñado por expertos con más de 80 años de experiencia en arquitectura y diseño de interiores de primer nivel. • Ubicación privilegiada con acceso rápido al sur, centro y poniente de la ciudad. • Cercanía a universidades prestigiosas, hospitales de alta especialidad, corporativos, restaurantes y centros comerciales. • Ideal para familias, profesionistas y quienes buscan alta plusvalía y comodidad. Amenidades: • Seguridad estricta 24/7 con acceso controlado. • Gimnasio equipado. • Motor lobby y lounge de bienvenida. • Simulador de golf virtual. • Co-working con booths y sala ejecutiva. • Cinema. • Teens zone y TikTok Lounge. • Áreas verdes. • Ludoteca, terraza y salón de fiestas para niños. • Área de mascotas. • Estacionamiento para visitas. • Confort stations con comida y bebidas en todo el desarrollo. • Restaurante y supermercado. • Rooftop con asadores y áreas de relajación. Ubicación Estratégica: Origina Santa Fe está situado cerca del Parque La Mexicana, uno de los pulmones verdes más grandes de la ciudad, y ofrece conectividad directa con avenidas principales, facilitando el acceso a lo mejor que Santa Fe tiene para ofrecer. ¡Descubre una nueva forma de vivir en Origina Santa Fe! Contáctanos para más información o para agendar una visita!",https://www.inmuebles24.com/propiedades/clasificado/alclapin-departamento-en-renta-origina-santa-fe-contadero-147463214.html,"MN 65,000","Carr. San Mateo Sta. Rosa 99
Contadero, Cuajimalpa de Morelos","169 m² lote, 3 rec., 3 baños, 2 estac.",Cuajimalpa de Morelos
"Sir Ver datos. ""Descubre la comodidad en este amplio departamento ubicado en el corazón de Bosques de las Lomas, una de las colonias más exclusivas y codiciadas de la Ciudad de México. Con una ubicación envidiable, a sólo pasos del centro financiero Arcos Bosques y del centro comercial del Edificio del pantalón y a pocos minutos de Santa Fe, de la Universidad Ibero y de la Universidad Anáhuac y a 10 minutos de Las Lomas de Chapultepec, este departamento ofrece la perfecta combinación de estilo de vida y comodidad. El edificio, con sólo 16 unidades, es un ejemplo de exclusividad, con un jardín común de 3, 000 metros cuadrados que es un verdadero refugio para relajarse y disfrutar del aire libre. El departamento en sí es un espacio amplio y luminoso, con 410 metros cuadrados de áreas generosas que incluyen: - Una estancia con espectacular vista al jardín, perfecta para relajarse y disfrutar del entorno. - 4 recámaras, 3 con vestidor y 1 con clóset, ideales para una familia o para aquellos que buscan un espacio para trabajar o estudiar. - 3. 5 baños, con acabados de alta calidad y moderno diseño. - Una cocina amplia con desayunador, perfecta para preparar comidas y compartir momentos con la familia y amigos. Enorme bodega muy útil para toda la familia. 3 lugares de estacionamientos techados (pero caben 4 autos) Vigilancia 24 horas. Pero lo que realmente hace que este departamento se destaque es su impresionante vista verde desde el piso 9, que ofrece una perspectiva única de la colonia y de las áreas boscosas de Bosques de las Lomas. Imagine disfrutar de un atardecer espectacular desde la comodidad de su propio hogar. Además, con un precio por debajo del promedio en la zona, esta propiedad es una oportunidad única que no querrás dejar pasar. No te pierdas la oportunidad de conocer tu próximo hogar. Contáctame para más detalles y agenda una visita para descubrir por ti mismo por qué este departamento es un verdadero tesoro en Bosques de las Lomas. Características adicionales: - Edificio con seguridad 24/7. - Hermoso Jardín común de 3, 000 metros cuadrados. - Gimnasio. -Ludoteca. -Salón de fiestas. - Estacionamiento para visitas. No esperes más, agenda una visita hoy mismo y descubre por qué este departamento es el hogar de tus sueños. "" eb-ta0129",https://www.inmuebles24.com/propiedades/clasificado/alclapin-departamento-en-renta-en-bosques-de-la-lomas-146329211.html,"MN 72,000","Bosque de Tamarindos
Bosques de las Lomas, Cuajimalpa de Morelos","410 m² lote, 4 rec., 3 baños, 3 estac.",Cuajimalpa de Morelos
"Divino departamento en renta en Prolongación Vista Hermosa &quot;el abedul&quot; con amplios espacios, iluminado, buena orientación. 260 m2 de construcciónBaño de visitas, cocina, área de servicio, lavandería, comedor sala, oficina o estudio. Recámara principal con baño y vestidor, balcón segunda con baño y closet, tercera con vestidor, bodega de 4. 80 mts, tres lugares de estacionamiento. Jardin y balcon. 3 recamaras, 3. 5 baños, oficina o cuarto de tv, cuarto de servicio y lavanderia, bodega. Excelente ubicacion, acceso por santa fe y por carreteria mexico-toluca. Edificio con pocos departamentos, seguridad las 24h. Doce Pisos 24 departamentos en total. Cercano a hospitalaes, edificios de oficinas, colegios y universidades. Mantenimiento $7, 800incluido en la rentaantiguedad 2009amenidadesárea de Juegos, salón de fiestas, Gimnasiopiat convierte a clientes informados y conocedores, en dueños, vendedores e inversionistas exitosos.",https://www.inmuebles24.com/propiedades/clasificado/alclapin-departamento-en-renta-en-lomas-de-vista-hermosa-el-147501320.html,"MN 58,000","Prolongacion Vista Hermosa 32
Lomas de Vista Hermosa, Cuajimalpa de Morelos","260 m² lote, 3 rec., 3 baños, 3 estac.",Cuajimalpa de Morelos
"Excelente Departamento con acabados finos en piso alto Torres del Parque en el exclusivo fraccionamiento Club de Golf Bosques de Santa Fe. Vigilancia extrema 24/7 amenidades campo golf, canchas tenis, padle, fútbol, parque, restaurantes, cafetería, mucho más. Departamento con sala comedor con acceso a terraza con espléndida vista verde y orientación, family, cocina integral equipo Wolf, Subzero, baño visitas, 4 recámaras, lavandería, habitación servicio con baño, patio. 6 cajones estacionamiento. Acabados en pisos madera y mármol, calefacción hidrónica, filtración agua, iluminación, sonido y cortinas domótica. Amenidades del edificio: salón eventos, gym. Parque con juegos infantiles, pista jogging, bancas, jardín mascotas, etc. Rena Amueblado o sin Amueblar 12, 000 us",https://www.inmuebles24.com/propiedades/clasificado/veclapin-departamento-amueblado-venta-y-renta-club-de-golf-147204422.html,"USD 12,000","Club de Golf Bosques de Santa Fe
San Mateo Tlaltenango, Cuajimalpa de Morelos","460 m² lote, 4 rec., 3 baños, 6 estac.",Cuajimalpa de Morelos
"Amplio departamento en Residencial Vidalta, distribuido en dos niveles, con 4 recámaras y 3. 5 baños. En la planta baja ofrece sala de doble altura con vista espectacular, comedor, barra de bar, desayunador o mesa de juegos, estudio tipo oficina (posible quinta recámara sin baño) y baño de visitas. La cocina en piedra está equipada con estufa Wolff, refrigerador, congelador y barra. Además, cuenta con área de lavado y cuarto de servicio de buen tamaño. En la planta alta se encuentra un espacio de trabajo tipo estudio, dos recámaras que comparten baño, cada una con su closet o vestidor, una tercera recámara con baño propio, y walk-in closet, y la recámara principal, muy amplia, con gran vestidor y baño con doble lavabo. El arte social del departamento fue remodelado hace 4 años, las recámaras acaban de ser renovadas. La renta es amueblada e incluye televisores, refrigeradores y piezas de arte a negociar. La renta incluye el mantenimiento y $2500 de crédito. El residencial ofrece excelentes áreas comunes: casa club con albercas techada y al aire libre, gimnasio, salones para clases, spa de alto nivel, salón de belleza, restaurante y bar, parque con kiosco y juegos, ludoteca, canchas de pádel, salón de eventos y mucho más. - El precio de venta publicado no incluye: Gastos Notariales, Impuesto de Traslado de Dominio e Inscripción en el Registro Publico de la Propiedad. Sujeto a cambios de disponibilidad sin previo aviso. El mobiliario, electrodomésticos y arte que se muestran en las fotografías, no están incluidos en el costo de venta. Todas las medidas enunciadas son meramente orientativas, las medidas exactas serán las que se expresen en el respectivo título de propiedad de cada inmueble. La publicación de la presente información no representa una oferta pública por lo que toda transacción debe de hacerse de forma personal de acuerdo con las prácticas comerciales de la inmobiliaria y para poder ser valida requiere de la autorización expresa.",https://www.inmuebles24.com/propiedades/clasificado/veclapin-depto-amueblado-en-venta-o-renta-bosques-de-las-lomas-147640416.html,"MN 200,000","Secretaría de la Marina 571 - 1906
Bosques de las Lomas, Cuajimalpa de Morelos","467 m² lote, 4 rec., 3 baños, 4 estac.",Cuajimalpa de Morelos
"Departamento en renta en proyecto H2o sobre avenida santa fe. Inmejorable ubicacionNivel 21 con inmejorables vistasConstruccion 200m23 recamaras2. 5 bañosSala-ComedorFamilyCocina-Lavanderia y Cuarto de servicio2 EstacionamientosAmenidadesAlberca, Gym, squashSalón fiestasSalón para reuniones con familia o amigosSalón con tv y mesas de jugos para condóminos. Ludotecamantenimiento incluido en costo de renta. piat convierte a clientes informados y conocedores, en dueños, vendedores e inversionistas exitosos.",https://www.inmuebles24.com/propiedades/clasificado/alclapin-departamento-en-renta-en-av-santa-fe-h2o-147780184.html,"MN 45,000","Avenida Santa fe al 400
Santa Fe Cuajimalpa, Cuajimalpa de Morelos","200 m² lote, 3 rec., 2 baños, 2 estac.",Cuajimalpa de Morelos
"¡¡ hermoso departamento en renta! Recien remodelado. ¡ enorme! Con mucha luz, mucha iluminación natural, ventilaciín natural, estilo minimalista, blanco Y negro. Hermoso todo él! * sólo 54, 997 * pide tu cita. 55 Ver datos. mejía bienes raíces. este departamento está entre bosque de las lomas, chamizal, tecamachalco, santa fé, etc. Está A pocos minutos de todo, cerca de paseo de los ahuehuetes. tecamachalco parte alta. 325 mt2. piso alto, con excelente vista. 3 recámaras, cada una con su baño Y walking closet. la recámara principal, es sencillamente. Enorme Y muy bonita. con tina en el baño. family. sala. comedor. una segunda sala- O área de estudio. cocina integral con alacena muy grande. medio baño de visitas. clósets de blancos. bodega. 3 cajones de estacionamiento. área de lavado. cuarto de servicio con baño completo. lo ideal para una vida, muy feliz Y placentera. seguridad 24 *7. caseta de vigilanca. * tiene algunos muebles, se pueden quedar, O sacar, como tu lo prefieras * *amenidades ** alberca. gym. pareas verdes. salón de eventos",https://www.inmuebles24.com/propiedades/clasificado/alclapin-departamento-en-renta-325-m-en-54-997-lomas-del-147253413.html,"MN 54,997","Avenida de los Bosques 1515
Lomas del Chamizal, Cuajimalpa de Morelos","325 m² lote, 3 rec., 3 baños, 3 estac.",Cuajimalpa de Morelos
"Departamento muy bien ubicado, a 10 min. Del Centro Comercial de Santa Fe, Colegios, Bancos, Parques etc. Cuenta con 2 recámaras, 2 baños, sala, comedor, cocina, cuarto de lavado, un pequeño balcón, 1 lugar de estacionamiento. Amenidades: roof garden con azador, salón de fiesta. Mantenimiento incluido",https://www.inmuebles24.com/propiedades/clasificado/alclapin-departamento-en-renta-cercano-a-santa-fe-147541843.html,"MN 16,000","GRANADOS
La Navidad, Cuajimalpa de Morelos","78 m² lote, 2 rec., 2 baños, 1 estac.",Cuajimalpa de Morelos
"Renta Moderno Garden House de 130 m2 más terrazas del Arq. Fernando de Haro. Sala-comedor integrados a la terraza. Cocina integral. Baño de visitas. Área de lavandería con ventilación natural. “Family o sala tv” 2 recamaras, principal con vestidor, baño integrado y salida a la terraza, secundaria con closet, baño exterior y acceso directo a terraza. 2 lugares de estacionamiento techados. Lugares de visitas. Bodega. Seguridad 24 horas. Amenidades: gimnasio, salón de eventos con area de servicio, jardín y área de mascotas. Fácil acceso a la Carretera Mexico-Toluca, a solo 5 minutos de Santa Fe. El precio de renta incluye mantenimiento",https://www.inmuebles24.com/propiedades/clasificado/alclapin-contadero-renta-garden-house-departamento-con-terraza-144304733.html,"MN 34,000","Antonio Nohemi
Contadero, Cuajimalpa de Morelos","130 m² lote, 2 rec., 2 baños, 2 estac.",Cuajimalpa de Morelos
"**Departamento en renta en Enttorno Cuajimalpa – moderno y con excelentes amenidades** Disfruta de un ambiente tranquilo y moderno en este departamento de 98 m², con 2 recámaras, la principal con baño privado y la secundaria que comparte baño con el área social. Cuenta con cocina abierta con cubierta de granito, espacio para lavavajillas y clóset con área para centro de lavado. 2 lugares de estacionamiento en fila al aire libre y opción a bodega por $1, 500 adicionales. Mantenimiento incluido en la renta. **No se aceptan mascotas** **Amenidades del conjunto: ** * Gimnasio. * 2 albercas (una techada y otra al exterior) * Ludoteca. * Salón de adultos y salón de juegos. * Áreas de asador y salón de eventos. * Estacionamiento para visitas. * Seguridad 24/7 con cctv. Un espacio cómodo, funcional y con excelente ubicación en Cuajimalpa. ¡Agenda tu cita y conócelo!",https://www.inmuebles24.com/propiedades/clasificado/alclapin-renta-departamento-moderno-enttorno-cuajimalpa-147825986.html,"MN 19,000","Av. México 359
Manzanastitla, Cuajimalpa de Morelos","98 m² lote, 2 rec., 2 baños, 2 estac.",Cuajimalpa de Morelos
"Ubicado en una de las zonas más exclusivas, este apartamento ofrece un diseño que maximiza la entrada de luz natural y la ventilación. Disfruta de acabados de alta calidad y una distribución pensada para el confort. El interior cuenta con una amplia sala y comedor, ideales para recibir visitas o disfrutar en familia. La cocina integral está equipada con electrodomésticos modernos y cuenta con suficiente espacio de almacenamiento. Tiene 3 recámaras, cada una con clósets y 3 baños completos más un medio baño para visitas. Adicionalmente, cuenta con cuarto de tv y cuarto de servicio. En el exterior, podrás disfrutar de un asador para tus reuniones, área de lavado y 3 lugares de estacionamiento. El edificio ofrece amenidades como alberca, gimnasio, área de eventos, jacuzzi, área de juegos infantiles, salón de usos múltiples, espacio de co-working y estacionamiento de visitas. Cuenta con acceso para personas con discapacidad. Lomas del Chamizal es una zona residencial que ofrece tranquilidad y seguridad, con fácil acceso a importantes vías de comunicación. Encontrarás una gran variedad de servicios, como supermercados, restaurantes, escuelas y hospitales. Además, cuenta con parques y áreas verdes para disfrutar al aire libre.",https://www.inmuebles24.com/propiedades/clasificado/alclapin-departamento-de-260-m-sup2--con-3-recamaras-en-renta-147685234.html,"MN 150,000","Avenida Secretaría de Marina 571
Lomas del Chamizal, Cuajimalpa de Morelos","265 m² lote, 3 rec., 3 baños, 3 estac.",Cuajimalpa de Morelos
"¡Tu nuevo hogar con lujo, confort y ubicación privilegiada en Bosques de las Lomas! Cuajimalpa | 8º piso | Zona exclusiva y conectada, y en calle cerrada, lo que da más tranquilidad y seguridad. Disfruta de un estilo de vida sofisticado en este amplio departamento totalmente remodelado, ubicado en una de las zonas más seguras y codiciadas de la cdmx, cerca de plazas comerciales, supermercados y servicios premium. Renta amueblado: $75, 000. Renta sin amueblar: $65, 000. Mantenimiento: $10, 000 mensuales (no incluido) Distribución interior: 3 espaciosas recámaras con vestidor, baño completo y calefacción individual. Baño de visitas. Sala de tv privada. Elegante y luminosa sala con chimenea de etanol, y comedor con ventanales a lo largo para tener mayor iluminación y amplitud Todo el departamento cuenta con doble vidrio, que garantiza temperatura estable y total silencio. Cocina cerrada con desayunador y amplia alacena. Área de lavado y cuarto de servicio con baño completo. Bodega de 8 m² 3 estacionamientos independientes. Amenidades de lujo: Seguridad 24/7 y acceso controlado. Gimnasio totalmente equipado. Sala de cine para vivir una experiencia vip en casa. Alberca climatizada y jacuzzi. Área de juegos para niños. Salón para eventos con cocina y baños. Terraza común con asadores y vistas panorámicas. Ideal para familias o ejecutivos exigentes que buscan comodidad, elegancia, seguridad, tranquilidad y ubicación estratégica. ¡Agenda tu visita y descubre por qué Bosques es el lugar donde quieres vivir!",https://www.inmuebles24.com/propiedades/clasificado/alclapin-rc-renta-departamento-totalmente-remodelado-bosques-147744079.html,"MN 75,000","Privada de Tamarindos
Bosques de las Lomas, Cuajimalpa de Morelos","305 m² lote, 3 rec., 3 baños, 3 estac.",Cuajimalpa de Morelos
"Vive al máximo en Santa Fe. Estrena moderno departamento en Vitant Santa Fe, piso 18, con vista panorámica espectacular. Disfruta de un espacio de 67 m², con 1 recámara (opción a 2ª), 1 baño completo, sala, comedor con gran iluminación, cocina abierta con barra y área de lavado independiente. Renta: $28, 000 mxn. Amenidades de lujo: Seguridad 24/7 y lobby. Roof Garden con vistas increíbles. Gimnasio equipado. Salón de usos múltiples & lounge social. Estacionamiento de visitas. Asadores, jardín, multicancha, floor valet, lavandería. Amenidades Be Grand: Grand Pool, Sports Bar, Kids Club, Pet Park, Spinning, Grand Gym y más. Ubicación privilegiada: En el corazón de Santa Fe, a minutos de Parque La Mexicana, Centro Comercial Santa Fe, universidades y corporativos. Ideal para ejecutivos o parejas que buscan estilo, comodidad y exclusividad en la cdmx. ¡Agenda tu cita hoy mismo y hazlo tuyo!",https://www.inmuebles24.com/propiedades/clasificado/alclapin-departamento-a-estrenar-en-vitant-en-av-santa-fe-147685809.html,"MN 28,000","Av. Santa Fe 578
Cuajimalpa de Morelos, Ciudad de México","67 m² lote, 2 rec., 1 baño, 1 estac.",Cuajimalpa de Morelos
Departamento totalmente amueblado con chapa electrónica. Inventario. 2 recamaras. 2 baños completos. Sala. Comedor. Cocina integral totalmente equipada. Área de lavado equipada. 2 estacionamientos. 1 bodega. Construcción 160 m2. Mantenimiento 8. 500. Amenidades. cancha de Tenis. cancha de Pádel. alberca. ️ carril de nado. Gym. ring de box. Jardin de perros. asadores. áreas verdes. Sauna. Vapor. Jacuzzi. Ludoteca. Salón de jóvenes. Salón de adultos. ️Cine,https://www.inmuebles24.com/propiedades/clasificado/veclapin-departamento-en-renta-santa-fe-147758357.html,"MN 30,000","Contadero
Cuajimalpa, Cuajimalpa de Morelos","160 m² lote, 2 rec., 2 baños, 2 estac.",Cuajimalpa de Morelos
