Título,Enlace,Precio,Dirección,Características,Municipio de Origen
"Si buscas un experiencia residencial sofisticada, moderna y práctica, este Loft en lomas de Chapultepec es ideal para ti. Ubicado en una de las zonas más seguras de la Ciudad de México, este desarrollo está diseñado para quienes valoran el confort y una vida con servicios integrales al más alto nivel con un precio incomparable. Un espacio premium pensado para jovenes estudiantes, profesionales, ejecutivos internacionales, o nomadas digitales. Olvídate de complicaciones, el desarrollo tiene todo lo que necesitas en un solo lugar. Podrás encontrar espacios desde un Loft, hasta departamentos de 1 y dos recamaras, todos ellos con con control de acceso, centro de lavado, servicio de concierge. Equipados con Refrigerador, estufa con horno, Microondas, Persianas y Wifi. Podrás rentarlo con mobiliario o sin mobiliario. Ofrecemos contratos flexibles desde 6 meses. Tenemos experiencia atendiendo residentes internacionales y embajadas.",https://www.inmuebles24.com/propiedades/clasificado/alclapin-departamento-en-renta-en-bosques-de-las-lomas-146700127.html,"MN 20,779","Carretera México-Toluca 1535
Bosques de las Lomas, Cuajimalpa de Morelos","37 m² lote, 1 rec., 1 baño, 1 estac.",Cuajimalpa de Morelos
"Departamento residencial ubicado a 5 minutos de Santa Fe, en el que encontrarás diversidad de comodidades, amenidades y alta seguridad. Te ofrece una vista inigualable a la Ciudad, áreas verdes y su alrededor están ubicadas universidades, hospitales, centros comerciales, restaurantes y parques. Instalaciones modernas y seguras, cuenta con gran iluminación de luz natural y acabados de lujo, walk-in closets, vidrios insonorizados, interfón con video. El gas, la luz y el internet ya están incluidos. Áreas Pet- Friendly",https://www.inmuebles24.com/propiedades/clasificado/alclapin-departamento-en-renta-en-cuajimalpa-146856427.html,"MN 42,160","Cooperativa Palo Alto
Cuajimalpa, Cuajimalpa de Morelos","93 m² lote, 2 rec., 2 baños, 2 estac.",Cuajimalpa de Morelos
"Este amplio departamento en Lomas de Vista Hermosa cuenta con 2 recamaras, 2 baños completos y una cochera fija con 2 plazas de aparcamiento. Con una superficie total de 140 m2, distribuido en dos plantas. La plata alta es un roof garden de 70m2. El departamento se encuentra en el tercer piso y ofrece comodidades como cuarto de lavado, vestidor y roof garden. La seguridad está garantizada las 24 horas. El estado de la propiedad es bueno y los gastos están incluidos en la renta. Ubicado en una zona tranquila en Secretaría de Marina, este departamento es ideal para quienes buscan un lugar cómodo y seguro para vivir.",https://www.inmuebles24.com/propiedades/clasificado/alclapin-departamento-en-renta-en-lomas-de-vista-hermosa-147841203.html,"MN 21,000","2o Retorno de Secretaria de Marina 0
Lomas de Vista Hermosa, Cuajimalpa de Morelos","140 m² lote, 2 rec., 2 baños, 2 estac.",Cuajimalpa de Morelos
"Iluminoso Y lindo departamento amueblado en cuajimapa, cerca A 5 min. De bosques de ls lomas, 15 min santa fe, Y 10 min, A interlomas, cuenta con una recamara con baño completo, cocineta con microohondas, refrijerador, salita, cerca de colegios, Y paradas para santa fe, entrega inmediata, no tiene estacionamiento, pero el lugar es muy seguro, Y hay un estacionamiento A una cuadra, inf. Claudia cel: Ver datos",https://www.inmuebles24.com/propiedades/clasificado/alclapin-rento-departamento-en-cuajimalpa-145756528.html,"MN 9,300","Cedros
San José de los Cedros, Cuajimalpa de Morelos","75 m² lote, 1 rec., 1 baño",Cuajimalpa de Morelos
"Departamento nuevo para estrenar con acabados de lujo. Consta de 1 recamara, 1baño, 1 cajon. Tiene Refrigerador, microondas, estufa y centro de lavado. Ademas de sensores de humo, gas y dioxido de carbono. . Tambien alarma contra incendios. Incluye servicios. Entre sus amenidades se encuentra alberca, chapoteadero, terrace pool, social bar, game room, barbecue grill, gymcoworking, coffe lounge, sala de yoga y pet zone. Precios sujetos a cambio sin previo aviso. Imagenes referenciales.",https://www.inmuebles24.com/propiedades/clasificado/alclapin-departamento-semi-amueblado-en-renta-en-cuajimalpa-147826909.html,"MN 27,300","Carretera Mexico Toluca
Granjas Palo Alto, Cuajimalpa de Morelos","59 m² lote, 1 rec., 1 baño, 1 estac.",Cuajimalpa de Morelos
"Ver datos, Adolfo López Mateos, Departamento en Renta, en planta baja, con vista al jardín, moderno, dentro de Park D´Luxe, con balcón, cuenta con estancia comedor, cocina integrada, y acceso a patio de servicio, 2 recámaras, 2 baños completos, estacionamiento para 2 autos techados, independientes y bodega, amenidades, jardines y área de mascotas.",https://www.inmuebles24.com/propiedades/clasificado/alclapin-adolfo-lopez-mateos-departamento-en-renta-147072913.html,"MN 17,500","11135 Av. Mexico
Adolfo López Mateos, Cuajimalpa de Morelos","60 m² lote, 2 rec., 2 baños, 2 estac.",Cuajimalpa de Morelos
"Con increíbles vistas. Departamento de 2 recamaras con vestidor espacioso. Mesa elegante de granito con espacio hasta para 8 personas. Estancia amplia, iluminación natural en todas las areas. Amenidades de primer nivel y para todos los intereses",https://www.inmuebles24.com/propiedades/clasificado/alclapin-departamento-en-renta-santa-fe-cuajimalpa-147787187.html,"MN 37,000","Carretera México-Toluca 5804
Contadero, Cuajimalpa de Morelos","122 m² lote, 2 rec., 2 baños, 2 estac.",Cuajimalpa de Morelos
"Departamento en renta amueblado de 2 recamaras, principal con baño, closet, y balcón, otra recamara con closet y dos camas. Sala comedor, cocina equipada, cuarto de servicio. Un estacionamiento, vigilancia las 24 hrs, 2 elevadores, Roof Garden con asador y máquinas de lavado y secado. Ab Inmobiliaria renta, conócelo.",https://www.inmuebles24.com/propiedades/clasificado/alclapin-departamento-en-renta-amueblado-en-cuajimalpa-por-147788215.html,"MN 21,000","Palo Alto 73
Granjas Palo Alto, Cuajimalpa de Morelos","75 m² lote, 2 rec., 2 baños, 1 estac.",Cuajimalpa de Morelos
"¡No dejes pasar esta oportunidad! Características: 2 Recámaras muy amplias e iluminadas, con closet cada una. Recámara Principal con baño incluido. Estancia / comedor, 2 Baños completos, Terraza, Cocina equipada, Cuarto de lavado, Un lugar de estacionamiento compartido, Roof Garden Privado, Se aceptan mascotas. Requisitos: Deposito en garantía. Mes corriente de renta. Fiador con escritura libre de gravamen. Poliza juridica Gastos de investigación $1, 500¡Si cubres con todos los requisitos agenda tu cita y conoce tu nuevo hogar! Mas inmobiliariasomos una inmobiliaria creada en 1998, con experiencia en renta de inmuebles. Especialistas en la administración de inmuebles en renta, ya sean habitacionales o comerciales. Expertos en corretaje de inmuebles en venta y renta. ahora si se renta. Haz un negocio rentable.",https://www.inmuebles24.com/propiedades/clasificado/alclapin-comodos-departamentos-a-5-minutos-de-santa-fe-147771325.html,"MN 12,400","Monte Carmelo 22, Rosa Torres, Cuajimalpa de Morelos, C.p. 05200, Cdmx.
Cuajimalpa de Morelos, Ciudad de México","64 m² lote, 2 rec., 2 baños, 1 estac.",Cuajimalpa de Morelos
"Moderno y amplio departamento ubicado en Reforma Santa Fe departamento de 285 m2 3 recámaras con vestidor y baño cada una, estancia, persianas eléctricas, pisos de madera family room, terraza, medio baño de visitas cocina equipada con madera y granito, área de lavado y cuarto servicio, elevador directo a tu departamento 3 lugares de estacionamiento y bodega. Espectaculares áreas comunes, cancha paddel, alberca techada y descubierta, gym, squash, cine, salón de fiesta, salón de adolescentes, ludoteca, con mas de 13, 000 m2 de áreas verdes y lujosas amenidades. Se renta en $70, 000 pesos incluyendo mantenimiento",https://www.inmuebles24.com/propiedades/clasificado/alclapin-reforma-santa-fe-285-m-sup2--y-terraza-frente-con-59007613.html,"MN 75,000","Vasco de Quiroga 3833
Santa Fe Cuajimalpa, Cuajimalpa de Morelos","285 m² lote, 3 rec., 3 baños, 3 estac.",Cuajimalpa de Morelos
"Excelente Departamento amueblado en Renta en Lantana Santa Fe, cercano al Centro Comercial Santa Fe. Edificio con solo 22 departamentos. Cuenta con 3 habitaciones amplias cada una con baño, estancia amplia, family room, medio baño de visitas, cocina integral con desayunador, cuarto de servicio, área de lavado, terraza, bodega y 5 lugares de estacionamiento. El residencial cuenta con alberca, área para mascotas, lavado de autos, vigilancia, gimnasio, jardín, salón de eventos. Precio 110, 000 más 15, 000 de mantenimiento. no acepta mascotas. ¡Agenda hoy mismo y ven a conocerlo!",https://www.inmuebles24.com/propiedades/clasificado/veclapin-renta-departamento-amueblado-con-terraza-privada-146977020.html,"MN 110,000","Santa Fe
Santa Fe Cuajimalpa, Cuajimalpa de Morelos","365 m² lote, 3 rec., 3 baños, 5 estac.",Cuajimalpa de Morelos
"¡Vive con estilo y comodidad en el corazón de Bosques de las Lomas! Espectacular departamento, que ofrece todo lo que necesitas para disfrutar de una vida de lujo. El departamento cuenta con 3 recamaras cada una con vestidor y baño completo; family room, ideal para convivir en familia; espacio de sala y comedor muy amplio, baño de visitas; cocina integral equipada de buen tamaño, área de lavandería y cuarto de servicio completo. Cuenta con 3 lugares de estacionamiento y bodega. El desarrollo cuenta con amenidades de primer nivel: Alberca, gimnasio, spa, cancha de padel y squash, salón de eventos, business center, sala de cine, ludoteca, jardines y seguridad 24/7. Ubicación privilegiada a tan solo unos metros de Arcos Bosques y a 10 min de Santa Fe, con acceso rápido a las principales vialidades y zonas comerciales. ¡No dejes pasar esta oportunidad! Ideal para quienes buscan confort, seguridad y exclusividad en una de las mejores zonas de la ciudad. Contáctanos y agenda tu visita hoy mismo",https://www.inmuebles24.com/propiedades/clasificado/alclapin-exclusivo-departamento-en-armoni-house-145335313.html,"MN 65,000","Paseo de los Tamarindos
Bosques de las Lomas, Cuajimalpa de Morelos","300 m² lote, 3 rec., 3 baños, 3 estac.",Cuajimalpa de Morelos
"Hermoso departamento en Santa Fe Mediterranea en renta. Caracteristicas: 270 mts2. 2 recamaras. 3 baños completos. 1 medio baño de visitas. Sala y comedor de gran tamaño. Family room. Cocina con amplia estancia. Alacena. cuarto y baño de servicio. cuarto de lavado. terraza (12 mts2) 3 estacionamientos y 1 bodega. Amenidades: Mediterranea Resort Living es un complejo excelente para familias que cuenta con las mejores amenidades de Santa Fe con amplios jardines, un lago artificial, asadores, cancha de futbol, canchas de tennis, paddle, squash, gimnasio, parque para niños, sala de cine, ludoteca, salon de fiestas, salon de adultos, salon de spinning, salon de yoga, cajones de visitantes y seguridad privada. Además cuenta con profesores privados que dan clases de boxeo, yoga, spinning, natación, entre otras.",https://www.inmuebles24.com/propiedades/clasificado/alclapin-amplio-departamento-con-terraza-en-santa-fe-147800627.html,"MN 79,500","Calle Vasco de Quiroga 4800
Santa Fe Cuajimalpa, Cuajimalpa de Morelos","270 m² lote, 2 rec., 3 baños, 3 estac.",Cuajimalpa de Morelos
"Trato sin intermediarios. ¡Tu nuevo hogar en residencial sens te está esperando! Renta exclusivo departamento amueblado en una de las zonas más privilegiadas del poniente de la ciudad, a pocos minutos de Santa Fe, Interlomas y Bosques de las Lomas. Vive con total tranquilidad en un espacio con seguridad 24/7 y rodeado de excelentes amenidades. Este departamento destaca por su gran iluminación natural y espacios funcionales: 2 recámaras con baño y vestidor. 1/2 baño de visitas. Cocina equipada con cubierta de granito. Sala y comedor amplios. Cuarto de servicio con baño completo. 2 cajones de estacionamiento. Bodega. Mantenimiento incluido. Amenidades de primer nivel para un estilo de vida inigualable: - Alberca techada. - Gimnasio completamente equipado. - Cancha de pádel. - Área de asadores. - Salón para adultos. - Salón de eventos. - Área para mascotas. - Estética. - Ludoteca y juegos infantiles. No se aceptan niños ni mascotas. Ideal para ejecutivos o parejas que buscan exclusividad, ubicación y confort. ¡Agenda tu cita y conócelo hoy mismo!",https://www.inmuebles24.com/propiedades/clasificado/alclapin-renta-departamento-amueblado-sens-lomas-de-vista-147640803.html,"MN 45,900","Carlos Echanove 136
Lomas de Vista Hermosa, Cuajimalpa de Morelos","168 m² lote, 2 rec., 2 baños, 2 estac.",Cuajimalpa de Morelos
"Excelente Departamento en Renta en Av. Santa Fe. Cercano al Tec. De Monterrey y al Parque La Mexicana. Consta de una recámara, un baño completo, estancia amplia con cocina integral y un cajón de estacionamiento. El edificio cuenta con valet parking para visitas sin costo, gimnasio, salón de usos múltiples, bussines center, terraza con asadores y bar. Acepta mascota pequeña. fotos ilustrativas. ya incluye mantenimiento. te ayudamos A amueblarlo con costo adicional. ¡Contactanos para agendar hoy mismo!",https://www.inmuebles24.com/propiedades/clasificado/alclapin-departamento-en-renta-en-impulso-santa-fe-144646274.html,"MN 23,000","Avenida Santa Fe
Santa Fe Cuajimalpa, Cuajimalpa de Morelos","71 m² lote, 1 rec., 1 baño, 1 estac.",Cuajimalpa de Morelos
"Ubicado en una zona privilegiada, este apartamento ofrece un diseño que maximiza el confort. Con acabados de alta calidad y una distribución pensada para la convivencia familiar, este inmueble de 6 años de antigüedad es una excelente opción. Cuenta con una amplia sala y comedor, cocina integral equipada, 3 recámaras con 4 baños completos y un medio baño adicional. Disfrute de su terraza privada. Además, cuenta con área de lavado, cuarto de servicio y 4 lugares de estacionamiento. Para el entretenimiento, ofrece cuarto de juegos y cuarto de tv. La seguridad está garantizada con caseta de guardia y seguridad privada. El conjunto residencial ofrece amenidades como alberca, sauna, vapor, asadores, 2 canchas de Pádel, jacuzzi, área de juegos infantiles y salón de usos múltiples. Además, cuenta con servicios básicos como agua y luz, e internet/wifi. Santa Fe Cuajimalpa es una zona residencial y comercial, con acceso a importantes vialidades. Encontrarás escuelas de prestigio, centros comerciales, hospitales y una amplia oferta de restaurantes y entretenimiento. La zona cuenta con transporte público y servicios cercanos.",https://www.inmuebles24.com/propiedades/clasificado/alclapin-precioso-y-moderno-departamento-con-terraza-de-tres-147753043.html,"MN 95,000","Avenida de los Poetas 100
Santa Fe Cuajimalpa, Cuajimalpa de Morelos","304 m² lote, 3 rec., 4 baños, 4 estac.",Cuajimalpa de Morelos
"Siroco forma parte del conjunto Elite Residences Santa Fe. Su diseño único se distingue en el skyline de una de las zonas con diseño arquitectónico de mayor vanguardia en la zona de Santa Fe. Siroco nace proyectando una nueva perspectiva y estilo de vida, para quienes deciden llegar más alto y saben de tendencias innovadoras. Caracteristicas: 160 mts2 en total. 2 habitaciones. 2 baños completos. Sala Comedor (estancia amplia) Terraza. Cuarto de servicio con baño. Cuarto de lavado. Piso de ingenieria. Sistema de aires acondicionados. 2 bodegas conectadas. 2 cajones de estacionamiento. La estructura única y vanguardista de Siroco permite sobresalir y reflejar de manera acertada a quienes eligen la perspectiva de su vida. Cada sección ofrece además de una vista impresionante, un estilo inigualable con 26 diferentes tipos de departamentos que se adaptan a tus necesidades, para que puedas vivir la vida desde una perspectiva única. Ubicación. Ubicado en una de las zonas más vanguardistas y mayor plusvalía de la Ciudad de México, Santa Fe es considerada uno de los centros más importante en términos financieros y corporativos de la capital mexicana. Amenidades. Siroco cuenta con exclusivas amenidades para que puedas relajarte y disfrutar la vida como tú quieres. Lobby con Salas de Visita. Business Center. Owners Lounge. Salón de Cine. Salón de Niños/ Media Room. Ludoteca. Gimnasio. Salón de Yoga. Roof Garden. Siroco cuenta a su vez con Shooping Center, con la comodidas de poner en tu puerta y sin necesidad de trasladarte a otro sitio: Spa. Supermercado. Restaurantes. Banco. Tiendas de Autoservicio. Arquitectos. La firma Gaeta – Springall fue fundada por Julio Gaeta y Luby Springall en 2001. Desde entonces han ganado gran cantidad de concursos y han trabajado en diferentes escalas y programas en arquitectura y proyectos urbanos. • Zona Comercial. • Owners Lounge, Gimnasio, Ludoteca, Sala de Cine, Business Center. • Entrega Inmediata",https://www.inmuebles24.com/propiedades/clasificado/veclapin-departamento-en-siroco-av-santa-fe-143259294.html,"MN 40,000","Av. Santa Fe
Santa Fe Cuajimalpa, Cuajimalpa de Morelos","157 m² lote, 2 rec., 2 estac.",Cuajimalpa de Morelos
"Departamento en Renta que potencializan tu estilo de vida! Ubicado a 5 minutos de Santa Fé y Bosques de las Lomas, cuenta con más de 10 amenidades. Todos nuestros departamentos incluyen, electrodomésticos, chapa digital, y las mejores vistas de la cdmx. ! Recámaras: 1. Baños: 1. Área: 61. 81 m² Altura en Cocinas y Baños: 2. 50 m. Altura en Recámaras y Sala: 2. 70 m. Equipamiento: Refrigerador, Estufa, Microondas y Lavavajilla Smeg, Lavasecadora Mabe. Precio desde $22, 843",https://www.inmuebles24.com/propiedades/clasificado/alclapin-departamento-en-renta-en-granjas-palo-alto-144294299.html,"MN 27,500","Carretera Mexico-Toluca
Granjas Palo Alto, Cuajimalpa de Morelos","61 m² lote, 1 rec., 1 baño, 1 estac.",Cuajimalpa de Morelos
"Mls #25-150. Departamento nuevo para estrenar con acabados de lujo. Consta de 1 recamara, 1baño, 2 cajones. Tiene Refrigerador, microondas, estufa y centro de lavado. Ademas de sensores de humo, gas y dioxido de carbono. . Tambien alarma contra incendios. Incluye servicios. Entre sus amenidades se encuentra alberca, chapoteadero, terrace pool, social bar, game room, barbecue grill, gym. coworking, coffe lounge, sala de yoga y pet zone. Precios sujetos a cambio sin previo aviso. Imagenes referenciales.",https://www.inmuebles24.com/propiedades/clasificado/alclapin-departamento-nuevo-servicios-incluidos-granjas-palo-144689168.html,"MN 27,300","Toluca
Granjas Palo Alto, Cuajimalpa de Morelos","57 m² lote, 1 rec., 1 baño, 2 estac.",Cuajimalpa de Morelos
"Excelente Departamento muy iluminado con luz natural en Av. Santa Fe, piso alto con hermosa vista a la Mexicana y Av Santa Fe, su ubicaciòn permite que puedas caminar al parque La Mexicana, restaurantes, supermercado, etc. El departamento cuenta con las siguientes características: 220 m2 más. 3 recámaras, la principal con walking closet. 2 baños completos. Sala. Comedor. Cocina. 2 estacionamientos. Excelentes Amenidades: Alberca. Jacuzzi. Gym. Vapor. Sauna. Salón de Fiestas. Juegos infantiles. Ludoteca. Asadores. Jardines Naturales. Area de mascotas. La renta incluye mantenimiento. Citas: Blanca Sierra. Ver datos",https://www.inmuebles24.com/propiedades/clasificado/alclapin-renta-depto-amueblado-en-av-santa-fe-145261473.html,"MN 56,000","Av. Santa Fe 482
Cuajimalpa de Morelos, Ciudad de México","220 m² lote, 3 rec., 2 baños, 2 estac.",Cuajimalpa de Morelos
"Km112Vive en la mejor zona de mexico! Over Santa Fe, cuenta con 2 recamaras, 2. 5 baños, 2 estacionamientos y bodega. Vigilancia Privada, Estacionamiento para visitas, excelente iluminacionEn las amenidades podemos encontrar, alberca y área de saunaSe aceptan mascotas, mantenimiento de $5, 000Conócelo!",https://www.inmuebles24.com/propiedades/clasificado/alclapin-departamento-en-rentam-col.-las-tinajas-cuajimalpa-147121030.html,"MN 42,998","Av Carlos Fernandez Graef, Col. Cuajimalpa
Las Tinajas, Cuajimalpa de Morelos","97 m² lote, 2 rec., 2 baños, 2 estac.",Cuajimalpa de Morelos
"Ref: 2 5 4 9 1 7. Magnífico departamento en renta completamente amueblado, ubicado en Bosques de las Loma, una de las zonas más exclusivas de la Ciudad de México. Este amplio y moderno departamento cuenta con 3 recámaras, la principal tiene balcón con una agradable vista, baño propio y vestidor, las otras dos recámaras comparten baño, una de las recámaras secundarias está adecuada como estudio. Tiene una amplia sala integrado al comedor muy iluminados, family room, cocina espaciosa totalmente equipada, cuarto de servicio con baño propio y área de lavado. Le corresponden 3 lugares de estacionamientos totalmente independientes, uno en cada piso de estacionamientos. El desarrollo ofrece agradables amenidades para toda la familia como jardín con área de juegos infantiles, gimnasio, cálida alberca, elevadores, área de eventos y seguridad privada. En cuanto a las zonas de interés cercanas, Bosques de las Lomas cuenta con una amplia oferta de centros comerciales, restaurantes gourmet, parques tranquilos y exclusivos, prestigiosas escuelas y hospitales de alta calidad. A solo unos minutos encontrarás centros comerciales como Paseo Interlomas, Plaza Arcos Bosques y Centro Santa Fe, donde encontrarás tiendas de lujo, cines, restaurantes exclusivos y opciones de entretenimiento para toda la familia. En cuanto a las principales vías de acceso, desde este departamento tendrás fácil acceso a importantes avenidas como Paseo de los Tamarindos, Bosque de las Palmas, carretera México - Toluca y Vialidad de la Barranca, que te conectarán rápidamente a varios puntos de la Ciudad. Requisitos: un depósito, primer mes de renta y pago de póliza jurídica. Mantenimiento incluido en la renta. Agende su cita ahora, no se arrepentirá.",https://www.inmuebles24.com/propiedades/clasificado/alclapin-departamento-amueblado-en-renta-en-miralta-bosques-147143883.html,"MN 44,000","Paseo de los Laureles 398 , Bosques de las Lomas , 05120 Cuajimalpa de Morelos, Ciudad de México, México
Bosques de las Lomas, Cuajimalpa de Morelos","220 m² lote, 3 rec., 2 baños, 3 estac.",Cuajimalpa de Morelos
"Se renta recámara amueblada dentro de una casa, ubicada en una hermosa privada con vigilancia 24 hrs. espacios: La recámara comparte baño, cocina y jardínEn un ambiente tranquilo y seguroMetraje habitable 20m²Excelente ubicación cerca de centros comerciales como Patio Santa Fe, Centro Santa Fe, Samara. Garden Santa Fe, entre otros, tiendas de conveniencia y almacenes como Sams, Costco, etc. Cerca de Universidades Iberoamericana, Tec. De Monterrey, Universidad Panamericana, uam, Colegio como el West Hill, Etón, Monte Verde, etc. Mantenimiento incluido en la rentaEn el costo de la renta incluye, costo de agua, luz, e internet. no mascotasno fumar en el interior de la recámara sólo en el jardín¡¡Conócela te va a gustar!! Requisitos de arrendamiento: - Depósito - 1 mes de renta- Póliza arrendamiento o Aval con bien inmueble y pagaresEstimado Colega, sólo en esta propiedad no es posible compartir comisión. (amg) denh3037Código EasyBroker: eb-tz5311Aviso de Privacidad: Next Home, con domicilio en Av. Noche de Paz No. 49, Local 6 “A”, Colonia Granjas Navidad, Alcaldía Cuajimalpa, Ciudad de México Ver datos, México, es Responsable del tratamiento y uso de sus datos personales. Sus datos personales serán utilizados para las siguientes finalidades: Proveer los servicios solicitados y/o contratados. Responder a sus requerimientos de información, atención y servicio. Evaluar la calidad del servicio que le brindamos. Archivo de registros y expediente de la relación contractual para seguimiento de servicios futuros. Gestión Financiera, facturación y cobro. Dar cumplimiento a las obligaciones y compromisos que hemos contraído con Usted. Usted puede conocer nuestro Aviso de Privacidad integral en nuestra página web",https://www.inmuebles24.com/propiedades/clasificado/alclapin-renta-recamara-amueblada-en-santa-fe-147469157.html,"MN 14,900","Renta Recámara Amueblada EN Santa FE
Santa Fe Cuajimalpa, Cuajimalpa de Morelos","20 m² lote, 1 rec., 1 baño",Cuajimalpa de Morelos
"Expectacular departamento en renta en Lomas de Vista Hermosa, en uno de los condominios más exclusivos de cdmx. Cuenta con 2 recámaras, 2 baños completos y un medio baño para tus visitas, además de contar con 2 lugares de estacionamiento. El condominio cuenta con amenidades de primer nivel como lo son: Alberca · Carril de natación · Jacuzzi · spa · Gimnasio · Canchas de tenis y paddle · Área privada de asador, jardines, pista de correr. Equipamiento del Departamento. Centro de lavado · Amplia lavandería · Lavavajillas · Refrigerador · Cuarto de servicio",https://www.inmuebles24.com/propiedades/clasificado/alclapin-departamento-en-renta-en-lomas-de-vista-hermosa-147826092.html,"MN 40,000","AV. CARLOS ECHANOVE ""SENS"" 136 T.
Bosques de las Lomas, Cuajimalpa de Morelos","200 m² lote, 2 rec., 2 baños, 2 estac.",Cuajimalpa de Morelos
"Acceso a Lobby piso 22 Estancia con doble altura ;recién remodelado, cocina abierta con cubiertas de granito 3 recamaras con vista al parque la mexicana closet de blancos, 2 baños 2 recamara comparten baño, recamara principal con vestidor baño y jacuzzi cuarto de servicio con baño, área de lavado. Cuenta con área de lavandería, servicio de valet parking, cuenta con bodega solo para venta, 2 lugares de estacionamiento, amenidades; cancha de padel gimnasio ludoteca.",https://www.inmuebles24.com/propiedades/clasificado/veclapin-venta-renta-haus-santa-fe-147656880.html,"MN 36,500","Prolongación Paseo de la Reforma 1190 C-2205
Santa Fe Cuajimalpa, Cuajimalpa de Morelos","134 m² lote, 3 rec., 2 baños, 2 estac.",Cuajimalpa de Morelos
