Título,Enlace,Precio,Dirección,Características,Municipio de Origen
"Departamento en Renta Lindavista Norte. Excelente ubicación. 60 m2, Sala, Comedor, Cocina, 2recámaras, 1 baño completo, área, de lavado, 1 lugar de estacionamiento. Piso 3. No cuenta con Elevador. Se aceptan mascotas pequeñas. El costo de la renta incluye mantenimiento y pago de servicio de agua. Cercano a principales avenidas, Bancos, Centros Comerciales, Colegios. Todo lo que necesitas cerca de ti. Citas con 24 horas de anticipación. *es* eb-ub9396",https://www.inmuebles24.com/propiedades/clasificado/alclapin-departamento-en-renta-lindavista-norte-147470796.html,"MN 16,300","Coquimbo
Lindavista Norte, Gustavo A. Madero","60 m² lote, 2 rec., 1 baño, 1 estac.",Gustavo A. Madero
"Departamento como nuevo, exterior, muy iluminado, ubicado en 5to. Piso con elevador. En el edificio se puede disfrutar de un hermoso jardín como área común. Consta de 45m2, sala comedor, cocina integral, 2 recámaras, 1 baño, 1 estacionamiento en línea de 2, área de lavado integrada. Restricciones: Se acepta una mascota pequeña a consideración del propietario. el precio incluye mantenimiento. requisitos: 1 mes de renta + 1 mes de depósito + fiador con propiedad libre de gravamen + póliza jurídica $3, 075",https://www.inmuebles24.com/propiedades/clasificado/alclapin-departamento-en-renta-vallejo-147729178.html,"MN 12,500","Florencio Constantino 243
Vallejo, Gustavo A. Madero","45 m² lote, 2 rec., 1 baño, 1 estac.",Gustavo A. Madero
"Cuarto de estudiante todos los servicios, sala, área de lavado un gimnasio, una alberca, áreas verdes, una mesa de pin pon, cancha. Al lado el paradero de indios verdes, cablebus, Mexibús, metro y Metrobús",https://www.inmuebles24.com/propiedades/clasificado/alclapin-soy-totalmente-fifi-renta-de-cuarto-de-estudiante-8-144383995.html,"MN 8,500","Av. Acueducto 650, Residencial Zacatenco, 01110 Mexico City, Distrito Federa
Residencial Zacatenco, Gustavo A. Madero","73 m² lote, 1 rec., 1 baño, 1 estac.",Gustavo A. Madero
"Bienvenido a tu depto. En la Ciudad de México, por estar a tan solo unos metros del metro bús de la estación politécnico y metro Lindavista de la línea 6, además un lugar ideal para visitar las atracciones como: la villa, Basílica de Guadalupe, Polanco, Palacio Nacional, importantes centros comerciales a 10 minutos caminando (plaza linda vista y fortuna, parque Lindavista) que cuentan con excelentes lugares para comer. Sin dejar de lado qué tan solo caminado estan varios restaurantes entre ellos Lynis y toks, el mejor lugar sin duda para rentar y disfrutar la cdmx. Muy Bien Ubicado!! Cerca de la línea de Metrobús, línea 6, de metro Lindavista. Departamento nuevo a estrenar. Rentalo por $ 18, 000 mantenimiento Incluido ( sin amueblar) opcional amueblado. 57 mts2. 2 recamaras. Muy confortables con closet. 2 baños completos con ventilación. sala amplia. comedor. cocina equipada. 1 cajón de estacionamiento. área de lavado. 1 bodega. Edificio de tan solo 31 departamentos. 5 niveles de construcción. elevadores. escaleras de emergencia. Vigilancia 24 hrs. cerca de plazas comerciales, hospitales, comercios, escuelas y transporte. agenda una cita y apártalo. Rox del Torno. Luxury Homes",https://www.inmuebles24.com/propiedades/clasificado/alclapin-rt-renta-departamento-en-residencial-insurgentes-norte-147494189.html,"MN 18,000","Avenida Insurgentes Norte
Lindavista Norte, Gustavo A. Madero","57 m² lote, 2 rec., 2 baños, 1 estac.",Gustavo A. Madero
"Dpto. nuevo en Colonia Bondojito, de 50m2 aprox. Con 2 recamaras, 1 baño completo, sala-comedor, área de cocina con tarja de lavado, área de lavado en el inmueble, sin estacionamiento. Cercano a vías principales de comunicación y servicios de interes, escuelas, plazas, comercios locales, entre otros.",https://www.inmuebles24.com/propiedades/clasificado/alclapin-departamento-renta-147141922.html,"MN 10,000","AV HENRY FORD
Industrial, Gustavo A. Madero","50 m² lote, 2 rec., 1 baño",Gustavo A. Madero
"Asesor daniel ahumada da421. ""Excelente loft con tapanco para la cama ideal para estudiantes o parejas jovenes. A 5 minutos caminando de la plaza Parque Via Vallejo, Totalmente amueblado, con: sala, Smart tv, Frigobar, cama matrimonial, pequeño desayunador, baño completo. Requisitos. 1 mes de renta. 1 mes de deposito en garantia. identificacion oficial, ultimos 3 comprobantes de ingresos, comprobante de domicilio. Se encuentra en el segundo piso, *se puede rentar amueblado en $16, 000* no incluye cajon de estacionamiento. *pet friendly, el monto de la rente incluye servicios (agua, gas, luz, internet) Y mantenimiento. """,https://www.inmuebles24.com/propiedades/clasificado/alclapin-loft-amueblado-en-renta-en-nueva-vallejo-gustavo-a-147689819.html,"MN 13,500","Poniente no.
Nueva Vallejo, Gustavo A. Madero","40 m² lote, 1 rec., 1 baño",Gustavo A. Madero
"Departamento ecónomico de una recámara, estancia, cocineta, baño, closet, sin estacionamiento, área de lavado en azotea. Cerca de Calz. Guadalupe. Máximo 2 personas, no se aceptan mascotas.",https://www.inmuebles24.com/propiedades/clasificado/alclapin-departamento-en-renta-1-recamara-por-calz.-guadalupe-147302878.html,"MN 6,200","Escuela Industrial No. 209
Industrial, Gustavo A. Madero","40 m² lote, 1 rec., 1 baño",Gustavo A. Madero
"Departamento de 2 recámaras, sala, comedor, cocina con fregadero, un baño completo, Sup. 70 m2. , Interior, 3er. Piso. Sin estacionamiento. Para conocer el departamento el portero se lo muestra de Lunes a Jueves de 10 a 16 hrs. Y los Viernes de 10 a 19 hrs. Sin cita, favor de tocar el timbre marcado con el No. 1 ó 3. O los Sábados con cita de 12 a 12: 45 hrs.",https://www.inmuebles24.com/propiedades/clasificado/alclapin-departamento-70-m-sup2--2-recamaras-en-renta-147832229.html,"MN 8,500","Ingeniero Roberto Gayol 147
Guadalupe Insurgentes, Gustavo A. Madero","70 m² lote, 2 rec., 1 baño",Gustavo A. Madero
"Vive en un increíble departamento con excelente ubicación cercano a la Basílica de Guadalupe que cuenta con: espacio para sala comedor, espacio para cocina con instalación de gas, área de lavado (compartida), 1 habitación, 1 baño, el precio de renta incluye pago de agua. Con excelente ubicación, cercano a principales vialidades como F. C Hidalgo, Av. Insurgentes Norte, Calzada San Juan de Aragón, supermercados, Plaza Tepeyac, Parque Tepeyac, Basílica de Guadalupe, Parque Lindavista, tiendas de conveniencia y vías de transporte público como Metro Indios Verdes, mb Rio de los Remedios. Con Homie renta sin aval. Proceso 100% digital y diferentes formas de pago de tu renta, tú eliges. ¡Conoce ya este depa! Estás a pocos pasos de encontrar el hogar de tus sueños. Departamento de 50. 0 metros cuadrados cuenta con: - 1 habitación. - 1. 0 baño. Características: - Cuarto de lavado. Servicios: - Agua. Antigüedad: Por estrenar. Número de habitantes recomendado: 3. Disponibilidad para mostrar: 28/octubre/2025. Disponibilidad para habitar: 28/octubre/2025. ¡Enamórate de tu vida en este departamento! # Homie Id: 8_4_2_4_5. Estos son los beneficios que tienes como inquilino al rentar tu nuevo hogar con nosotros: * No necesitas aval (sujeto a Términos y Condiciones). * Realiza el pago de tu renta mediante transferencia digital en nuestra plataforma o en efectivo en miles de locales disponibles. * Asistencia y conciliación con tu propietario. * Proceso sin burocracia, renta en cuestión de horas y sin trámites complicados. * Firma tu contrato de forma digital.",https://www.inmuebles24.com/propiedades/clasificado/alclapin-departamento-en-renta-vasco-de-quiroga-gustavo-a.-65777746.html,"MN 7,800","Fray José de La Coruña
Vasco de Quiroga, Gustavo A. Madero","50 m² lote, 1 rec., 1 baño",Gustavo A. Madero
"Dominio inmobiliario. propone en renta. departamento remodelado. ubicado en san juan de aragón I sección. - espacio de cocina. - estancia sala-comedor. - un baño completo. - dos recámaras. - área de tendido. - ideal para una O máximo 2 personas. - sin mascotas. $10, 500. 00 A tratar. agenda tu visita. 55 Ver datos Ver datos",https://www.inmuebles24.com/propiedades/clasificado/alclapin-dominio-inmobiliario-propone-en-renta-departamento-147761916.html,"MN 10,500","Avenida
Gustavo A. Madero, Ciudad de México","50 m² lote, 2 rec., 1 baño",Gustavo A. Madero
"Departamento interior de 71 m², ubicado en el segundo nivel del edificio, en buen estado de conservación. Distribución y características: 3 recámaras con clóset1 baño completoCocina integralSala-comedorÁrea de lavadoEstacionamiento comunitarioJaula de tendido2° nivelExtras: Posibilidad de entrega amueblado con pantalla de 50”, refrigerador y base de cama individual (por $13, 500) Av. Principales Av Montevideo, por ahí seria la entrada Edificio 61 Manzana 2Servicio público cercano Metro Politécnico Metrobús Norte 45",https://www.inmuebles24.com/propiedades/clasificado/alclapin-departamento-en-renta-en-uh-lindavista-vallejo-147849009.html,"MN 12,500","UH Lindavista 61
Lindavista Vallejo, Gustavo A. Madero","71 m² lote, 3 rec., 1 baño",Gustavo A. Madero
"Ref: 2 5 9 7 3 6. Este espectacular departamento en renta se encuentra ubicado en la exclusiva zona de Vasco de Quiroga, en Gustavo A. Madero, Ciudad de México. Con una construcción de 60 m2, este inmueble cuenta con 2 recamaras, 2 baños completos y una cocina equipada que hará las delicias de cualquier aficionado culinario. Además, el departamento cuenta con una sala y comedor amplios y luminosos, con piso de cerámica de alta calidad y armarios empotrados para un mayor aprovechamiento del espacio. En cuanto a las amenidades, este edificio ofrece todo lo que necesitas para disfrutar de un estilo de vida cómodo y seguro. Con áreas comunes como un gimnasio, área de juegos infantiles, asador, salón de fiestas, área de lavandería, elevadores, caseta de vigilancia, internet/wifi, jardín, área de eventos, sala de estar, roof garden, espacio de co-working y seguridad privada, no querrás salir de casa. Además, este departamento se encuentra cerca de importantes zonas de interés como parque Tepeyac, el Parque Lindavista y el Hospital Infantil. Con acceso rápido a importantes vías de la Ciudad de México como la Avenida de los Insurgentes y la estación de Martín Carrera, metro Indios Verdes y a una cuadra del metro bus el Coyol, este departamento es ideal para aquellos que buscan comodidad y seguridad en una de las mejores zonas de la ciudad. ¡No dejes pasar esta oportunidad única!",https://www.inmuebles24.com/propiedades/clasificado/alclapin-renta-de-departamento-en-gustavo-a.-madero-en-147770581.html,"MN 15,000","AV, EDUARDO MOLINA 8132 , Vasco de Quiroga , 07440 Gustavo A. Madero, Ciudad de México, México
Vasco de Quiroga, Gustavo A. Madero","60 m² lote, 2 rec., 2 baños, 1 estac.",Gustavo A. Madero
"*Cuota extra de mantenimiento mensual $1, 500. Características del Departamento: Habitaciones: 3. Baños: 2. Lugares de Estacionamiento: 2. Cocina: Integral. Amenidades: Patio. Juegos. Áreas Verdes. Salón de Fiestas. Asador. Cisterna. Elevador. Seguridad. Balcón. Terraza. Este espacioso departamento en Constitución de la República, Ciudad de México, es perfecto para familias que buscan comodidad y un ambiente agradable. Cuenta con tres amplias habitaciones, dos baños completos y una cocina integral completamente equipada. Además, ofrece la conveniencia de dos lugares de estacionamiento. Ubicación: Situado en Constitución de la República, este departamento ofrece un entorno seguro y accesible, cercano a servicios esenciales, tiendas, y principales vialidades. Vive en una comunidad que te brinda tranquilidad y comodidad con todas las facilidades que necesitas. La ubicación es privilegiada, a solo 5 minutos del metro Martín Carrera y la Basílica, y a 15 minutos de Plaza Tepeyac. Además, encontrarás tiendas, farmacias, cafeterías y mucho más a solo unos pasos de distancia. No pierdas la oportunidad de vivir en este maravilloso departamento. ¡Contáctanos ahora mismo y agenda una visita! Con Homie renta sin aval. Proceso 100% digital y diferentes formas de pago de tu renta, tú eliges. ¡Conoce ya este depa! Estás a pocos pasos de encontrar el hogar de tus sueños. Departamento de 72. 0 metros cuadrados cuenta con: - 3 habitaciones. - 2. 0 baños. - 2 lugares de estacionamiento. Características: - Sala de tv. - Patio. - Balcón. - Jardín. - Terraza. - Cocina integral. Amenidades: - Seguridad. - Elevador. - Juegos. - Salón de fiestas. - Asador. - Áreas verdes. - Cisterna. Antigüedad: 3 años. . Número de habitantes recomendado: 5. Disponibilidad para mostrar: 23/agosto/2025. Disponibilidad para habitar: 23/agosto/2025. ¡Enamórate de tu vida en este departamento! # Homie Id: 1_2_8_4_6. Estos son los beneficios que tienes como inquilino al rentar tu nuevo hogar con nosotros: * No necesitas aval (sujeto a Términos y Condiciones). * Realiza el pago de tu renta mediante transferencia digital en nuestra plataforma o en efectivo en miles de locales disponibles. * Asistencia y conciliación con tu propietario. * Proceso sin burocracia, renta en cuestión de horas y sin trámites complicados. * Firma tu contrato de forma digital.",https://www.inmuebles24.com/propiedades/clasificado/alclapin--departamento-en-renta-en-constitucion-de-la-56314101.html,"MN 15,500","Oriente 153
Constitución de La República, Gustavo A. Madero","72 m² lote, 3 rec., 2 baños, 2 estac.",Gustavo A. Madero
"El departamento cuenta con bonitos acabados, como pisos de cerámica, muebles de cocina y baño de melamina, y ventanas de aluminio. La sala y el comedor son espaciosos y luminosos, y la cocina tiene una barra de trabajo. Las recámaras son amplias y tienen closets empotrados. El baño completo cuenta con regadera, lavabo y wc. El edificio cuenta con un roof garden compartido con asador, área de vigilancia 24/7, tinacos, cisterna de agua pluvial y cisterna de agua potable. Está completamente listo para escriturar. La ubicación es ideal para quienes buscan vivir en una zona céntrica con todos los servicios a su alcance. El departamento está ubicado frente al mercado Gabriel Hernández, muy cerca de bancos, tiendas de autoservicio, escuelas, hospitales y múltiples servicios. ¡Llama ahora y agenda una cita para conocer tu nuevo hogar! * Departamento nuevo a estrenar. * 1 recámaras, 1 baño completo, 1 cajón de estacionamiento y balcón. * Bonitos acabados. * Roof garden compartido con asador. * Área de vigilancia 24/7. * Tinacos, cisterna de agua pluvial y cisterna de agua potable. * Listo para escriturar. * Ubicación céntrica",https://www.inmuebles24.com/propiedades/clasificado/alclapin-renta:-exclusivo-y-tranquilo-depto.-nuevo-de-1-147729771.html,"MN 11,000","Avenida Centenario 2103
Santiago Atzacoalco, Gustavo A. Madero","54 m² lote, 1 rec., 1 baño, 1 estac.",Gustavo A. Madero
"Rar-4945 Departamento en Renta en Ticomán, Gustavo A. Madero, cdmx. Departamento amueblado. Distribución: • Sala. • Comedor. • 3 Recámaras. • 1 Baño completo. • Cocina integral. • Área de lavado. • 1 lugar de estacionamiento. Características: • Construcción: 82 m2. • Forma de Terreno: Regular. • Edad: 30 años aprox. • Piso en el que se encuentra: P. B. • Niveles Totales: 4 niveles. • Uso de suelo: Habitacional. • Mantenimiento: $450 pesos mensuales incluido. Equipamiento del Inmueble: • Gas natural. • Boiler. • Lavadero. • Closet en recamaras. • Estufa. • Contrato cfe. Equipamiento Edificio Conjunto: • Cisterna. • Bomba. • Tinaco. • Portón Automático. • Vigilancia privada. • Escaleras. • Áreas Verdes. Estatus del inmueble: • Inmueble Desocupado. • Inmueble Usado. Documentación con la que se cuenta: • Escritura Pública. • Boleta predial y agua. Servicios de la Zona: • Agua, • cfe, • Drenaje, • Servicios municipales, • Gas, • Transporte Publico. • Vialidades: Guillermo Massieu, Miguel Bernard, Calz. Ticomán. • A 3 km a la redonda: Plazas Comerciales, Bancos, Escuelas, gasolineras, gimnasios, parques. Entorno: • Habitacional.",https://www.inmuebles24.com/propiedades/clasificado/alclapin-departamento-en-renta-en-ticoman-gustavo-a.-madero-147861920.html,"MN 12,000","Arroyo de Guadalupe 177, Edif. 11, Depto. 11
La Purísima TicomAn, Gustavo A. Madero","82 m² lote, 3 rec., 1 baño, 1 estac.",Gustavo A. Madero
"Ag25-866 Departamento con 2 recámaras y 1 baño completo, cocina, sala comedor y área de servicio, distribuídos en 52 m². El departamento está completamente amueblado con mesa comedor, sillón, mueble de tv, refrigerador, microondas, estufa a gas, camas, burós. Entre las amenidades, hay un amplio roof top con asador a la disposición de los residentes. La renta ya incluye mantenimiento y todos los servicios (água, gas, luz e internet). Lavandería de uso común en Planta Baja. No incluye estacionamiento. Se renta con póliza jurídica. ¡Agende una visita para venir a conocer! *Precios sujetos a cambio sin previo aviso. *Fotos referenciales",https://www.inmuebles24.com/propiedades/clasificado/alclapin-departamento-en-renta-vallejo-via-vallejo-144675594.html,"MN 23,000","Poniente 126
Lindavista Vallejo, Gustavo A. Madero","54 m² lote, 2 rec., 1 baño",Gustavo A. Madero
"Departamento. Cuenta con 3 baños, 3 recamaras, incluye mantenimiento, sala, área de lavado un gimnasio, una alberca, áreas verdes, una mesa de pin pon, cancha de futbol. Teniendo al lado el paradero de indios verdes, cablebus, mexibus, metro y metrobus",https://www.inmuebles24.com/propiedades/clasificado/alclapin-renta-departamento-vista-norte-soy-totalmente-fifi-66670323.html,"MN 22,500","Av. Acueducto 650
Residencial Zacatenco, Gustavo A. Madero","79 m² lote, 3 rec., 3 baños, 2 estac.",Gustavo A. Madero
"Estrena moderno y cómodo departamento en cuarto piso con elevador, muy iluminado y totalmente equipado: persianas, clósets, canceles en baños y cocina integral. Ideal para quienes buscan comodidad, seguridad y un estilo de vida práctico al norte de cdmx. El residencial enksa Lindavista se encuentra cercano a vías importantes como Insurgentes Norte, Carretera México–Pachuca, estaciones de Metro, Cablebús y Metrobús Indios Verdes, además de instituciones educativas como el ipn Zacatenco y hospitales de la zona. El departamento tiene un espacio habitable de 90. 5 m2 con la siguiente distribución: - 3 recámaras (la principal con closet y baño completo) - 2 baños completos. - Estancia corrida. - Cocina integral. - Área de lavado. - 2 estacionamientos en línea. - Adicional Bodega de 6. 13 m2. Amenidades del residencial: Alberca techada con agua templada, ludoteca, área de juegos infantiles, parrillas, cancha de futbol, gimnasio interior equipado, salón de jóvenes, roof garden y mesas de ping pong, entre otras. Servicios del residencial: Vigilancia 24/7, elevadores, acceso al área comercial donde se encuentran supermercado, cines, cafeterías, restaurantes y múltiples servicios. Requisitos de arrendamiento: 1 mes de renta adelantada, 1 mes de depósito, Póliza jurídica con obligado solidario, pagar la investigación y salir ok. La renta incluye la cuota de mantenimiento. No se permite subarrendar y No se aceptan mascotas.",https://www.inmuebles24.com/propiedades/clasificado/alclapin-renta-departamento-nuevo-residencial-enksa-lindavista-147753249.html,"MN 22,000","Av. Acueducto 650
Residencial Zacatenco, Gustavo A. Madero","91 m² lote, 3 rec., 2 baños, 2 estac.",Gustavo A. Madero
"Departamento nuevo en planta baja para familia pequeña de 3 personas. . Cuenta con dos amplias recámaras con clóset, sala comedor Y cocina abierta. Piso de porcelanato. Baño Y medio. Un lugar de estacionamiento independiente. Requisitos de arrendamiento: un mes de renta de depósito en garantía, una renta adelantada, fiador con bien raíz sin gravamen en cdmx, ingresos netos comprobables por $63, 000. 00 como mínimo. Pago de servicios jurídico de arrendamiento",https://www.inmuebles24.com/propiedades/clasificado/alclapin-departamento-nuevo-en-renta-en-lindavista-ciudad-de-147792661.html,"MN 20,000","Lima 940
Lindavista Norte, Gustavo A. Madero","120 m² lote, 2 rec., 1 baño, 1 estac.",Gustavo A. Madero
"Departamento Amueblado 1 Recamaras, Estancia, Baño Completo, Cocina, Comedor, Refrigerador. Cada quince días se pagan 3, 500 pesos se le da su recibo y así puede continuar el tiempo que requiera. El precio incluye los servicios de agua, luz, gas. La ocupación incluye hasta 2 personas. Requisitos: Una quincena de depósito y la quincena que corre, Copia del ine o Pasaporte, Un comprobante de Ingresos. A 7 cuadras de Hospital la raza. A 6 cuadras del metro Metro la raza. A 7 Cuadras de Hospital Juarez (Magdalena de las Salinas). No se aceptan mascotas. Informes de Lunes a Viernes de 9 am a 6 pm.",https://www.inmuebles24.com/propiedades/clasificado/alclapin-departamento-amueblado-hospital-la-raza-63434258.html,"MN 7,000","Poniente 106 90
Defensores de La República, Gustavo A. Madero","80 m² lote, 1 rec., 1 baño",Gustavo A. Madero
"Cuarto de aproximadamente 18 m2, ubicado en Privada de Venustiano Carranza, Lomas de Cuautepec, cerca del dif Cuautepec, Deportivo Juventino Rosas, Reclusorio Norte, Escuelas de distintos niveles, facil acceso a transporte hacia Indios Verdes o la Raza. Cuenta con baño completo dentro. La renta incluye el servicio de agua. Max. Para 2 personas. No se aceptan mascotas. Agenda una cita para conocerlo",https://www.inmuebles24.com/propiedades/clasificado/alclapin-cuarto-en-renta-en-cuautepec-142293169.html,"MN 2,500","Priv. Venustiano Carranza 14
Palmatitla, Gustavo A. Madero","18 m² lote, 1 rec., 1 baño",Gustavo A. Madero
"Funcional y amueblado loft en la colonia Estanzuela, gam, es perfecto para quienes buscan practicidad y comodidad en un solo lugar. Ubicado en el primer piso de un edificio con solo dos niveles, este espacio de 20 m² interiores y una terraza privada de 6 m² te permite disfrutar de un ambiente tranquilo y bien aprovechado. Cuenta con cama, escritorio, cocineta con parrilla eléctrica, refrigerador, lavadora, y acceso a áreas compartidas como zotehuela, jardín y patio. Ideal para una persona, este depa incluye servicios de luz y agua caliente en el precio de renta, lo que representa un gran ahorro. Su excelente ubicación te conecta con vías principales y transporte público. Agenda una visita hoy mismo y aprovecha esta gran oportunidad. Con Homie renta sin aval. Proceso 100% digital. Tú eliges cómo pagar la renta a través de diferentes formas de pago. ¡Conoce ya este depa e independízate de las tareas de rentar! Departamento de 36. 0 metros cuadrados cuenta con: - 1 habitación. - 1. 0 baño. Características: - Balcón. - Terraza. - Amueblado. - Cuarto de lavado. - Cocina integral. Servicios: - Luz. - Agua. Antigüedad: 5 años. . Número de habitantes recomendado: 1. Disponibilidad para mostrar: 22/mayo/2025. Disponibilidad para habitar: 25/mayo/2025. ¡Enamórate de tu vida en este departamento! # Homie Id: 9_4_4_5_7. Estos son los beneficios que tienes como inquilino al rentar tu nuevo hogar con nosotros: * No necesitas aval (sujeto a Términos y Condiciones). * Realiza el pago de tu renta mediante transferencia digital en nuestra plataforma o en efectivo en miles de locales disponibles. * Asistencia y conciliación con tu propietario. * Proceso sin burocracia, renta en cuestión de horas y sin trámites complicados. * Firma tu contrato de forma digital.",https://www.inmuebles24.com/propiedades/clasificado/alclapin-acogedor-loft-amueblado-con-terraza-privada-en-gustavo-146513912.html,"MN 4,500","Artes
Estanzuela, Gustavo A. Madero","36 m² lote, 1 rec., 1 baño",Gustavo A. Madero
"Hermoso departamento para estrenar en renta en la col. Industrial, pegado a la col. Guadalupe Insurgentes. Muy bien ubicado, sobre Insurgentes Norte entre el metro metro Potrero y la Raza. Características generales. - 2 recámaras. - 2 baños completos. - cocina. - sala comedor. - Interfón. Áreas comunes. - Lobby-recepción. - Roof Garden. - Vigilancia 24/7. - Elevador. Ecotecnias. - Calentador solar (solo deptos. De los pisos superiores) - Recuperación de agua pluvial. - Botes de basura orgánico e inorgánico. - Iluminación con detectores de presencia. Requisitos. - 1 mes de renta por adelantado. - 1 mes de depósito en garantía. - Aval con bien raíz u obligado solidario. - Póliza de arrendamiento con costo de $3, 250. 00. - Formatos de Arrendamiento llenos y firmados. - Identificación oficial. - Comprobación de ingresos de 3 meses a la fecha. - En caso de aval con bien raíz, la escritura de la propiedad libre de gravamen y su boleta predial. Nota. * El precio de renta ya incluye el mantenimiento. * El cajón de estacionamiento es para Moto incluido en la renta. * También se cuenta con Pensión para automovil el precio es de $1, 500. 00 mensuales No incluido en la renta. Mayor información y citas comunícate con nosotros.",https://www.inmuebles24.com/propiedades/clasificado/alclapin--renta-y-estrena-depto.-cerca-metro-potrero-cdmx-147026720.html,"MN 14,500","Insurgentes Norte 1329
Industrial, Gustavo A. Madero","60 m² lote, 2 rec., 2 baños, 1 estac.",Gustavo A. Madero
