Título,Enlace,Precio,Dirección,Características,Municipio de Origen
"Unidad habitacional zodíaco Colonia Miguel Hidalgo Tláhuac, Departamento de 48 m2, 2 recámaras, 1 baño, Cocina integral, Sala- comedor, Área de lavado, 1 Estacionamiento, Vigilancia las 24 hrs, (se pagan 300 pesos) y se encuentra en planta baja. El departamento se renta amueblado. A unas calles del Metro Nopalera y a 5 minutos del Metro Zapotitlan. Cerca de avenidas principales como Av. Tlahuac, Anillo Peroferic, Av Guillermo Prieto y Cam. Real a Zapotitlan",https://www.inmuebles24.com/propiedades/clasificado/alclapin-departamento-en-renta-cerca-del-metro-nopalera-147847409.html,"MN 7,000","Av Guillermo Prieto 153
Miguel Hidalgo, Tláhuac","48 m² lote, 2 rec., 1 baño, 1 estac.",Tláhuac
"Departamento de 2 recamaras amplias con piso de loseta de ceramica Y puerta. Estacia comedor amplia con piso de loseta de ceramica. cocina con barra Y tarjeta de acero inoxidable, area de lavado con lavadero E instalacion para lavadora. Se ocupa cilindro de gas para el baño Y la estufa. Cuenta con cajon de estacionnamiento, departamento con luz exterior.",https://www.inmuebles24.com/propiedades/clasificado/alclapin-rento-departamento-en-las-arboledas-147722484.html,"MN 7,000","Oyamel mza. 11 lote 26
Las Arboledas, Tláhuac","95 m² lote, 2 rec., 1 baño, 1 estac.",Tláhuac
"Departamento en Renta en Tláhuac consta de 2 recámaras, baño completo, sala, comedor, cocina, área de lavado y tendido, No cuenta con lugar de estacionamiento y se encuentra en un 1er piso No cuenta con elevador.",https://www.inmuebles24.com/propiedades/clasificado/alclapin-departamento-en-renta-en-tlahuac-147798972.html,"MN 5,500","Ana Bolena 270
Miguel Hidalgo, Tláhuac","37 m² lote, 2 rec., 1 baño",Tláhuac
"Departamento en renta ubicado en la Turba, Tláhuac. Se encuentra en el Tercer piso con la siguiente Distribución: -Sala. -Comedor. -Cocina (Solo con mueble de tarja). -2 recamaras. -1 baño. Características: -construcción 66 m2. -Agua. -Drenaje. -Luz. -Gas Estacionario. -3 niveles construidos. -1 cajón de estacionamiento. Alma Angélica Moreno Hernández. Celular: Ver datos",https://www.inmuebles24.com/propiedades/clasificado/alclapin-departamento-en-renta-147819793.html,"MN 8,500","Villa centroamericana 1
Villa Centroamericana y del Caribe, Tláhuac","54 m² lote, 2 rec., 1 baño, 1 estac.",Tláhuac
"Departamento en renta de 51m2 que se distribuyen en 2 habitaciones, 1 baño, estancia sala comedor, cocina integral y área de lavado le corresponde un lugar de estacionamiento. No se aceptan mascotas. La unidad cuenta con seguridad 24 horas.",https://www.inmuebles24.com/propiedades/clasificado/alclapin-departamento-renta-147673928.html,"MN 6,000","SANTA CRUZ
Las Arboledas, Tláhuac","51 m² lote, 2 rec., 1 baño, 1 estac.",Tláhuac
"Se renta amplio y bonito departamento de 2 recámaras con estacionamiento cerca de la estación los olivos de la línea dorada en la Ciudad de México. Ubicado en la segunda planta. Dentro unidad habitacional cuenta con seguridad las 24 horas. 2recámaras. 1 baños. Área de servicio. Sala comedor. un cajón de estacionamiento. Precio: $6, 500 mas mantenimiento. El pago de servicios: luz, agua y gas es independiente. Requisítos: pago de 1 mes de renta como depósito en garantía, pago de póliza jurídica anual. Documentación: Identificación oficial, comprobantes de ingresos (recibos de nómina o estados de cuenta bancarios de los 3 últimos meses), aval u obligado solidario.",https://www.inmuebles24.com/propiedades/clasificado/alclappa-buena-suerte-193-147793817.html,"MN 6,500","Buena suerte 193
Ampliación Los Olivos, Tláhuac","52 m² lote, 2 rec., 1 baño, 1 estac.",Tláhuac
"Departamento en Renta – Colonia San Francisco Tlaltenco, TláhuacPrecio: $12, 600Vive en un espacio cómodo, exclusivo y con ubicación privada al sur de la ciudad. 120 m² de construcción3 recámaras de buen tamaño1 baño completoSala / comedor con gran amplitud e iluminación naturalCocina con desayunadorÁrea de lavado y tendidoServicio de Internet IncluidoDisponibilidad inmediata y recién reacondicionadoUbicado en calle con acceso tranquiloCallejón Francisco Javier Mina, a 5 minutos de Metro TlaltencoA pocos minutos de Las Antenas y Periférico Oriente. Ideal para quienes buscan privacidad, confort y tranquilidad en el sur de cdmx. Agenda tu cita al Ver datos o envíame un mensaje directo para más información.",https://www.inmuebles24.com/propiedades/clasificado/alclapin-departamento-en-renta-en-tlaltenco-147823153.html,"MN 12,600","Callejon Francisco Javier Mina
San Francisco Tlaltenco, Tláhuac","120 m² lote, 3 rec., 1 baño, 1 estac.",Tláhuac
"Departamento de 180 m² con Tres Recamaras, en Segundo Piso. ¡Super Ubicacion! Esquina con Ermita Iztapalapa y Churubusco. Con una cocina muy amplia. Departamento Exterior Segundo piso Solo Cuatro Departamentos Uno por Piso Tiene 180 m2 de Superficie Consta de Sala Comedor Cocina Integral Abierta Balcón Tres Recamaras Dos Baños Completos Recamara Principal con Vestidor Area de Lavado Bodega y Estacionamiento Cubierto Camaras de Vigilancia Calentador Solar Sistema Hidro -Neumatico y Cisterna. Calle Cerrada Esquina Calzada Ermita Iztapalapa A Diez Minutos de Calzada de Tlalpan y Alcaldía Coyoacan. Poliza juridica por cuenta del inquilino. silcar",https://www.inmuebles24.com/propiedades/clasificado/alclapin-precioso-departamento-con-acabados-de-lujo-146418880.html,"MN 30,000","Sinatel
Sinatel, Iztapalapa","180 m² lote, 3 rec., 2 baños, 1 estac.",Tláhuac
"Hermoso departamento en renta o venta, el cual cuenta con dos recamaras, cada una con su closet, sala, comedor, cocina equipada, un baño completo, área de lavado, calefacción solar que ayuda a reducir el consumo de gas, calentador de paso, interpón con pantalla, apertura de las puertas automatizada, el edificio cuenta con cámaras de seguridad, interiores y exteriores, te invito a conocer este hermoso departamento en un lugar único en cd. De México",https://www.inmuebles24.com/propiedades/clasificado/veclapin-en-prados-de-churubusco-en-coyoacan-cd.-de-mexico-se-145894837.html,"MN 15,000","Prados de Churubusco
Prados Iztapalapa, Iztapalapa","60 m² lote, 2 rec., 1 baño",Tláhuac
"Departamento en renta – saliendo del metro culhuacán. 100 m² súper amplios muy bonito. ️ 3 habitaciones. ️ 1 estudio (puede usarse como 4ª habitación) 1 baño completo. 1 lugar de estacionamiento. sin muebles. Precio de renta: $16, 000. Se acepta mascota mediana. Se aceptan niños. Ideal para familia que busca mínimo 3 recámaras. Requisitos: • 1 mes de renta. • 1 mes de depósito. • Póliza jurídica: $4, 500 (se puede pagar con tarjeta de crédito a 3 meses sin intereses) Excelente ubicación, justo saliendo del Metro Culhuacán, con todos los servicios, transporte y comercios a unos pasos. ¡Agenda tu visita y descubre este departamento espacioso, ideal para tu familia!",https://www.inmuebles24.com/propiedades/clasificado/alclapin-departamento-3-recamaras-iztapalapa-147825813.html,"MN 16,000","Av. Tlahuac
Pueblo CulhuacAn, Iztapalapa","100 m² lote, 4 rec., 1 baño, 1 estac.",Tláhuac
¡Sper Ubicacion! Esquina con Ermita Iztapalapa y Churubusco. Con una cocina muy amplia. Departamento Exterior Primer Piso Solo Cuatro Departamentos Uno por Piso Tiene 180 m2 de Superficie Consta de Sala Comedor Cocina Integral Abierta Balcón Tres Recamaras Dos Baños Completos Recamara Principal con Vestidor Area de Lavado Bodega y Estacionamiento Cubierto Camaras de Vigilancia Calentador Solar Sistema Hidro -Neumatico y Cisterna. Calle Cerrada Esquina Calzada Ermita Iztapalapa A Diez Minutos de Calzada de Tlalpan y Alcaldía Coyoacan. Poliza juridica por cuenta del inquilino. silcar,https://www.inmuebles24.com/propiedades/clasificado/alclapin-departamento-de-180-m-sup2--con-tres-recamaras-en-145342337.html,"MN 30,000","Calle Cerrada Esquina Calzada Ermita Iztapalapa
Sinatel, Iztapalapa","180 m² lote, 3 rec., 1 estac.",Tláhuac
"Departamento en muy bien ubicado cuenta con: sala comedor, cocina equipada, 1 baño zotehuela, 1 lugar de estacionamiento, estación del metro calle 11 tlahuac. $400 de Mantenimiento",https://www.inmuebles24.com/propiedades/clasificado/alclapin-departamento-en-renta-en-av-tlahuac-147722608.html,"MN 8,500","Avenida Tlahuac 5724
Cerro de La Estrella, Iztapalapa","60 m² lote, 2 rec., 1 baño, 1 estac.",Tláhuac
"Amplio Y funcional departamento, en tercer piso (sin elevador) ubicado en una zona de excelente conectividad, cerca de vialidades principales, colegio aleman, museo dolores olmedo, en un condominio con seguridad, ambiente tranquilo Y lindas area verdes. El departamento cuenta, con 2 recamaras, con closet, la principal con baño, otro baño completo, un estudio, sala comedor, cocina integral, con area de lavado, 2 estacionamientos, uno atraz de otro, cubiertos Y una bodega. Mantenimiento $1100 incluido en la renta. es para maximo 4 personas. se puede ocupar A partir del 15 de octubre, ya que está en remodelacion. requisitos: comprobantes de ingresos. constancia de buro de credito positiva. indispensable fiador con bien inmueble. el condominio no acepta mascotas",https://www.inmuebles24.com/propiedades/clasificado/alclapin-departamento-en-renta-en-la-noria-xochimilco-147483406.html,"MN 14,500","CAMINO A XOCHIMILCO 35
La Noria, Xochimilco","81 m² lote, 2 rec., 2 baños, 2 estac.",Tláhuac
"¡Descubre la oportunidad de vivir en un acogedor departamento en la colonia justo sierra! Con una superficie de 50 metros cuadrados, esta propiedad cuenta con 1 habitación, 1 alcoba O estudio, 1 baño Y medio y un lugar de estacionamiento, además de una práctica cocineta integral. Ubicado en planta baja para tu comodidad y conveniencia, este departamento se destaca por su cercanía a parques, cafeterías y al metro ermita. Formando parte de un conjunto residencial de solo 5 departamentos, esta es tu oportunidad de disfrutar de un estilo de vida tranquilo y conectado en una ubicación privilegiada. ¡No pierdas la oportunidad de hacerlo tuyo hoy mismo!",https://www.inmuebles24.com/propiedades/clasificado/alclapin-departamento-en-planta-baja-de-una-habitacion-y-alcoba-143132021.html,"MN 14,500","SUR 71 A 314
Justo Sierra, Iztapalapa","50 m² lote, 1 rec., 1 baño, 1 estac.",Tláhuac
"Departamento en primer nivel. Cuenta con dos habitaciones con clóset, un baño completo, cocineta y área de estancia con espacio para sala y comedor. Dispone de un lugar de estacionamiento independiente con acceso directo. El inmueble tiene ventilación en todos sus espacios, lo que permite un ambiente cómodo para habitar. Se encuentra a 100 metros de Prolongación División del Norte y a 160 metros de la estación del Metrobús Preparatoria 1 y con vías de acceso que conectan hacia distintas zonas de la ciudad. En los alrededores hay comercios, escuelas, parques y servicios básicos, lo que facilita las actividades diarias. No se aceptan mascotas. No existe un mantenimiento como tal, por lo que el inquilino deberá hacerse cargo de la limpieza de sus áreas comunes. Además del pago del jardinero cuya cuota actualmente asciende a $250 mensuales",https://www.inmuebles24.com/propiedades/clasificado/alclapin-departamento-en-renta-en-paseo-del-sur-xochimilco-147846028.html,"MN 10,500","Majuelos 173 Depto 2
Paseos del Sur, Xochimilco","86 m² lote, 2 rec., 1 baño, 1 estac.",Tláhuac
"¡Agenda tu cita y estrena tu nuevo hogar hoy mismo! ¿Buscas un departamento cómodo, funcional y bien ubicado en cdmx? Este es el lugar ideal para ti. Ignacio Zaragoza 2980 – Unidad Habitacional La Concordia. Un espacio de 50 m², perfecto para quienes buscan practicidad y tranquilidad, con todo lo que necesitas cerca de ti. 2 recámaras acogedoras. 1 baño completo. Área de cocina. Área de lavado. Mantenimiento incluido. La zona ofrece acceso inmediato a Plaza El Salado, tiendas de conveniencia, farmacias, escuelas y a solo minutos del Metro Santa Marta, con múltiples opciones de transporte público y avenidas principales. Requisitos de renta: 1 mes de renta. 1 mes de depósito. Pago de póliza jurídica. Fiador con inmueble en cdmx o obligado solidario con ingresos comprobables de $18, 000. No se aceptan mascotas. Agenda tu cita hoy mismo y asegura este departamento antes que alguien más lo haga. ¡Llama o mándanos un mensaje ahora! #DepartamentoEnRenta #cdmx #UnidadHabitacionalLaConcordia #RentaSegura #VivirEncdmx #Inmuebles24",https://www.inmuebles24.com/propiedades/clasificado/alclapin-departamento-en-renta-iztapalapa-remodelado-a-lado-del-147431756.html,"MN 4,900","Calzada Ignacio Zaragoza 2980
La Concordia, Iztapalapa","37 m² lote, 2 rec., 1 baño",Tláhuac
"Bonito departamento interior en renta en colonia El Rodeo en Iztapalapa, con 2 amplias recámaras y muebles para guardar ropa, 1 baño completo con cancel, sala comedor, área de cocina equipada, 1 lugar de estacionamiento, cuenta con jaula de tendido en la azotea, área de lavado y planchado que también puede ser utilizado como bodega. El departamento cuenta con cancelaría en aluminio, se encuentra en segundo nivel y únicamente son 4 departamentos. Cerca de avenidas como: Ermita Iztapalapa, también cerca de escuelas, comisión federal, hospitales, universidades, tiendas de autoservicio y diversos comercios. La renta incluye mantenimiento",https://www.inmuebles24.com/propiedades/clasificado/alclapin-departamento-en-renta-en-iztapalapa-64744757.html,"MN 10,000","Calle moyahua 28
El Rodeo, Iztapalapa","80 m² lote, 2 rec., 1 baño, 1 estac.",Tláhuac
"1. Extraordinario departamento. 2. Amplio y Iluminado. 3. Edificio nuevo. 4. Iluminado y Ventilado. 5. Un lugar de estacionamiento. 6. Cisterna de Cinco mil litros. 7. Cuenta con excelentes terminados. 8. Roof Garden. 9. Área de lavado independiente. 10. Cuenta con Roof garden. 11. Cuenta con excelente ubicación dentro de la zona, (a calles caminado de Av. Tláhuac, metro cercano Estación Tezonco, a 10min. De Periférico Oriente). 12. ¡¡Llámanos para agendar una cita!",https://www.inmuebles24.com/propiedades/clasificado/alclapin-renta-de-departamento-san-lorenzo-tezonco-147427912.html,"MN 7,200","Villa del Mar 50
San Lorenzo Tezonco, Iztapalapa","61 m² lote, 2 rec., 1 baño, 1 estac.",Tláhuac
55M2. primer piso. 1 recamara. cocina. 1 baño. estancia. area de lavado en azotea. edificio de solo 3 departamentos. A espaldas del deportivo xochimilco. mascota raza muy pequeña. con 1 estacionamiento,https://www.inmuebles24.com/propiedades/clasificado/alclapin-rento-departamento-xochimilco-144572915.html,"MN 6,000","ACUEDUCTO
La Concha, Xochimilco","54 m² lote, 1 rec., 1 baño",Tláhuac
"Departamento A dos cuadras de el metro Iztapalapa, y a cinco minutos del metro Tlalilco, a dos calles de Eje, ocho Ermita Iztapalapa, todos los servicios. Superficie de 60 m² Sala, comedor, amplios. Una habitación. Cocina. Baño completo. Planta baja. Servicios de agua, gas, luz independiente. Más info y citas al 5523-14-4418",https://www.inmuebles24.com/propiedades/clasificado/alclapin-depa-cerca-metro-iztapalapa-en-planta-baja-147717959.html,"MN 8,000","Capilla del Carmen
El Santuario, Iztapalapa","60 m² lote, 1 rec., 1 baño",Tláhuac
"Se rentan un par de Departamentos en la colonia Constitución de 1917. Cuentan con 3 recámaras, 1 baño, sala comedor, zotehuela, cocina con estufa y área de lavado. Un departamento es interior. La renta ya incluye mantenimiento. ¡Agenda tu visita! ¡Pregunta por los requisitos! Wig: pcvfpwM",https://www.inmuebles24.com/propiedades/clasificado/alclapin-comodo-departamento-en-renta-147514034.html,"MN 11,500","Anillo Periférico 9002
Constitución de 1917, Iztapalapa","60 m² lote, 3 rec., 1 baño",Tláhuac
"Ref: 2 5 7 7 3 5. ¡No busques más! Este encantador departamento en renta con 2 recamaras y 1 baño en Paseos de Churubusco, Iztapalapa, Ciudad de México, es la opción ideal para ti. Con 60 m2 de construcción y uso de suelo Residencial, este hogar ofrece comodidad y modernidad en un solo lugar. La cocina equipada y la alberca dentro de la propiedad son solo algunas de las características que hacen de este departamento una verdadera joya. En cuanto a las zonas de interés cercanas, Paseos de Churubusco se encuentra a pocos minutos de importantes centros comerciales como Plaza Ermita y Parque Tezontle, donde se pueden encontrar una gran variedad de tiendas, restaurantes y servicios. Asimismo, la zona cuenta con varios parques y áreas verdes ideales para realizar actividades al aire libre, como el Parque Cuitláhuac y el Bosque de Tlalpan, perfectos para disfrutar de la naturaleza en la ciudad. Por último, en cuanto a las vías de acceso, el departamento en renta en Paseos de Churubusco se encuentra cerca de importantes avenidas como Ermita Iztapalapa y Calzada Ignacio Zaragoza, así como de la estación del metro Mexicaltzingo, lo que facilita la movilidad en la zona y permite llegar rápidamente a otros puntos de la Ciudad de México. Además, la zona cuenta con ciclovías y transporte público que conectan fácilmente con diferentes partes de la ciudad. ¡No pierdas la oportunidad de vivir en este acogedor departamento en una zona con todo lo que necesitas a tu alcance! Requisitos. Máximo 3 personas. No mascotas. Comprobar ingresos 3 a 1. Pago protección jurídica",https://www.inmuebles24.com/propiedades/clasificado/alclapin-se-renta-departamento-en-paseos-de-churubusco-147511176.html,"MN 13,000","Río Posití 65 , Paseos de Churubusco , 09030 Iztapalapa, Ciudad de México, México
Paseos de Churubusco, Iztapalapa","150 m² lote, 2 rec., 1 baño",Tláhuac
"[arr] id houm: Ver datos. Entérate de todos los beneficios al rentar con Houm: • No te pedimos aval. • Asistencia e intermediación con el propietario. • Firma tu contrato online. • Renta sin burocracia, papeleos y mucho más rápido. • Difiere tu depósito en hasta 6 meses sin interés. Casa en renta, ubicada en la colonia Real del Moral, con una superficie construida de 80. 00 m² y superficie total de 80. 00 m². Sus principales características son: • Sin amueblar. • 3 recámaras. • 1 baño. • No Admite mascotas. • 1 estacionamiento. • Cocina equipada. • Año de construcción: 1995. Si rentas con nosotros, te brindamos asesoría personalizada durante todo el proceso. Importante: • Se deben demostrar ingresos de 3 veces el valor de la renta. • En caso de que tus ingresos no lleguen a 3 veces el valor de la renta, estos pueden ser la suma de las personas que vivirán en la propiedad. • Te invitamos a agendar una visita a esta propiedad: esta puede ser presencial o vía streaming, desde la comodidad de tu hogar. • Y lo mejor. Sin aval. Más que una corredora, somos Houm. *Aplican T&C",https://www.inmuebles24.com/propiedades/clasificado/alclapin-departamento-en-real-del-moral-con-3-recamaras-id:.-147736929.html,"MN 12,000","Río Mixteco
Real del Moral, Iztapalapa","80 m² lote, 3 rec., 1 baño, 1 estac.",Tláhuac
"Departamento en primer nivel, cuenta con salacomedor, cocina, area de lavado, baño completo, dos habitaciones con closet Y una mas sin closet, cuenta estacionamiento Y vigilancia 247, A unos pasos de eje 6 Y calzada de la viga",https://www.inmuebles24.com/propiedades/clasificado/alclapin-departamento-renta-147517797.html,"MN 10,800","GEOLOGOS
El Retoño, Iztapalapa","65 m² lote, 3 rec., 1 baño, 1 estac.",Tláhuac
"¡¡departamento en renta, de 56M2!! Precio: $7, 000. 00 Renta mensual mtto. Incluido. características: - 2 Recámaras. - 1 Baño. - Area para cocina. - Sala/comedor. - Área de lavado. - 1 estacionamiento. requisitos: * 1 depósito en garantía. * Renta del mes en curso. * Póliza Jurídica. * Contrato de Arrendamiento por un año. * No se aceptan mascotas. ref: A 2min. Calz. Ignacio Zaragoza, 4min. Metro Canal de San Juan, 7min. Metro Tepalcates.",https://www.inmuebles24.com/propiedades/clasificado/alclapin-departamento-en-renta-cercano-a-calz.-ignacio-zaragoza-147846352.html,"MN 7,000","Sta. Teresa 103
Tepalcates, Iztapalapa","56 m² lote, 2 rec., 1 baño, 1 estac.",Tláhuac
"Rento bonito departamento en la calle de Cedro en la colonia Hank González, Iztapalapa. Ubicado en tercer piso cuenta con 2 recámaras con closet, sala-comedor, cocina integral, baño completo. Excelente ubicación a 10 minutos de Calzada Ermita Iztapalapa y de la estación del trolebús elevado Deportivo Santa Cruz. 55 metros cuadrados. Costo 7, 500.",https://www.inmuebles24.com/propiedades/clasificado/alclapin-rento-bonito-departamento-en-la-colonia-hank-gonzalez-147194077.html,"MN 7,500","Cedro 100
Carlos Hank Gonzalez, Iztapalapa","55 m² lote, 2 rec., 1 baño",Tláhuac
"Este departamento en renta se encuentra en Huichapan, ofreciendo 50 m² de terreno. Cuenta con una distribución funcional que incluye sala, comedor y cocina. Dispone de 2 recámaras, ideales para una familia pequeña o para compartir. Además, tiene 1 baño completo. El inmueble no cuenta con espacios exteriores como patio o jardín. Tampoco dispone de estacionamiento propio. La ubicación en Huichapan ofrece acceso a servicios básicos y comercios locales. En los alrededores se pueden encontrar tiendas de conveniencia y mercados. La zona es principalmente residencial, con un ambiente tranquilo y familiar. El transporte público está disponible con rutas de autobuses que conectan con otras áreas de la ciudad.",https://www.inmuebles24.com/propiedades/clasificado/alclapin-departamento-50-m-sup2--con-2-recamaras-en-renta-en-147472579.html,"MN 12,500","Av Mexico
Huichapan, Xochimilco","50 m² lote, 2 rec., 1 baño",Tláhuac
"Departamento ideal para 1 o 2 personas. Acogedor espacio que cuenta con: Sala y comedor. Área para tv o estudio. 1 recámara. Área de cocina (no equipada) Ubicado en andador de la colonia Unidad Modelo, justo frente a canchas deportivas, con excelente conectividad hacia Av. Churubusco, Alberca Olímpica y Plaza Mítica. El departamento incluye servicios de agua, luz y gas, lo que lo hace una opción práctica y económica. Requisitos: 1 mes de renta + 1 mes de deposito, poliza juridica ($4200. 00) con obligado solidario ingresos 3a1 de titular y obligado solidario",https://www.inmuebles24.com/propiedades/clasificado/alclapin-acogedor-departamento-1-recamara-147694459.html,"MN 12,500","retorno 104
Unidad Modelo, Iztapalapa","70 m² lote, 1 rec., 1 baño",Tláhuac
"Asesora liz escamilla le613. ""3 recámaras. 2 baños. 1 estacionamientos independiente. 180 m² de construcción. Piso: 2 no mascotas. Características: *2do Piso. *3 recámaras amplias (Principal con vestidor) *2 baños completos. *Cocina integral. *Sala, comedor con excelente iluminación natural y balcón. *Area de Lavado. *Bodega. *cctv. *Lugar de estacionamiento independiente y techado. *180 m2 de construcción. Ubicación privilegiada: Cerca de lugares importantes como centros comerciales, escuelas, parques, vías de acceso importante. le613""",https://www.inmuebles24.com/propiedades/clasificado/alclapin-departamento-en-renta-sinatel-iztapalapa-146644533.html,"MN 30,000","Sur 73a Sinatel
Sinatel, Iztapalapa","180 m² lote, 3 rec., 2 baños, 1 estac.",Tláhuac
"Depto en 3er nivel de 2 recamaras, sala, comedor, cocina integral, un baño completo, un lugar de estacionamiento. Vigilancia A las 24 hrs, salon de usos miltiples Y area de juegos de niños. En av principal, varias vias de acceso Y transporte",https://www.inmuebles24.com/propiedades/clasificado/alclapin-departamento-renta-147785825.html,"MN 10,000","CARRETERA A SAN PABLO
La Noria, Xochimilco","60 m² lote, 2 rec., 1 estac.",Tláhuac
