Título,Enlace,Precio,Dirección,Características,Municipio de Origen
"Renta sin Aval en 24 horas. Proceso ágil y flexible. / Lease without guarantor with agile and flexible processes in 24 hours. Opción de departamentos amueblados por Bo-Concept. / Furnished apartments by Bo-Concept available. Todos los departamentos incluyen electrodomésticos. (microondas, lava-secadora, Refrigerador, estufa con horno, lavavajillas) persianas / canceles. All apartments include appliances. (microwave, washer-dryer, refrigerator, stove with oven, dishwasher) blinds / gates. ! estrena depa en la Torre mas emblemática de la cdmx! Brand new apartments just released to the market in the most iconic tower in cdmx. Departamentos tipo: Loft, 1 y 2 recámaras; a un minuto de Bosques de las Lomas y Arcos Bosques (El Pantalón) en medio de escuelas, universidades, hospitales, centros comerciales y toda la oferta de servicios que ofrecen Santa Fe y Bosques. Potencializa tu vida con nuestras amenidades: Alberca. Co-Working. Bar. Cafetería. Salón de Fiestas. Game Room. Chill Spot. Pet Zone. Área de asadores con fogateros. Gimnasio. Yoga Room. Motor Lobby. Sala de recepción. Concierge Vigilancia 24hrs. cctv. Shuttle que te conecta con los principales puntos de la cdmx y Santa Fe. Renta sin aval; Departamentos nuevos, Totalmente equipados con electrodomesticos nuevos, agenda una cita y prepara todo para estrenar! !",https://www.inmuebles24.com/propiedades/desarrollo/ememvein-ri-a-bosques-renta-y-estrena-nuestros-depas.-loft-1-143241199.html,"MN 19,800","PROLONGACIÓN PASEO DE LA REFORMA
Santa Fe, Alvaro Obregón","454 un., 1 a 2 rec., 61 a 80 m² lote",Álvaro Obregón
"Ubicación: Situado en la Blvd. Adolfo López Mateos 1753, Merced Gómez, Álvaro Obregón, con vialidades de fácil acceso como Anillo Periférico. A su alrededor encontrarás múltiples parques, comercios como cafeterías, tiendas, restaurantes, etc. Con sistema de transporte cercanos. Diseño del espacio: - 2 Recámaras. - 2 Baño. - Sala/Comedor. - Cocina integral. - Área de lavado. - Balcón. - 1 Cajón de estacionamiento. Servicios y Amenidades: - Seguridad 24hrs. - Elevador. - Interfón. -Pet Zone. -Business Center. -Gimnasio. -Carril de Nado. -Spa, Sky Bar con área Lounge. -Kids Club. -Salón de Eventos. -Sky PoolT. -Teppanyaki y Grill. Área: 59 m2. *restricciones* *Las fotografías en esta ficha son de referencia. *No incluye muebles. *Las medidas mencionadas pueden variar ligeramente. Precio sujeto a cambios sin previo aviso. *El precio no incluye gastos de escrituración, ni los gastos iniciales en caso de comprar con crédito hipotecario, como avalúo y comisión por apertura. *Aviso de privacidad enMagnifico departamento en renta para estrenar, con vialidades de fácil acceso, cerca de centros comerciales, parques, hospitales, bancos, supermercados, etc.",https://www.inmuebles24.com/propiedades/clasificado/alclapin-departamento-en-renta-the-park-blvd-adolfo-lopez-147690343.html,"MN 23,000","Blvd. Adolfo López Mateos 1753
Merced Gómez, Alvaro Obregón","59 m² lote, 2 rec., 2 baños, 1 estac.",Álvaro Obregón
"Compartimos comisión con asesores inmobiliarios. Los pinos rentals, primer proyecto residencial con certificación edge en cdmx. departamentos equipados en renta ubicados sobre la vialidad urbana anillo periférico, permitiendo conectar con cualquier parte de la ciudad. Contamos con 3 tipos de departamentos acorde A tus necesidades. Loft - 1 recámara - 2 recámaras. beneficios: sin aval, clientes calificados que cumplan con requisitos. plazos de renta de 6 A 24 meses. mantenimiento en sitio. atención personalizada. 400mts de gimnasio equipado, coworking, sala de juegos, alberca, entre otras amenidades incluidas. Contáctanos Ver datos. Información importante: *Precios en contratos de 12 meses, incluye el costo de mantenimiento. Los cajones de estacionamiento, muebles y bodegas tienen costo adicional. El precio mostrado no incluye servicios públicos.",https://www.inmuebles24.com/propiedades/desarrollo/ememvein-los-pinos-rentals-renta-sin-aval-66376152.html,"MN 14,536","Anillo Periferico 428, San Pedro de los Pinos
San Pedro de los Pinos, Alvaro Obregón","150 un., 1 a 2 rec.",Álvaro Obregón
"Departamento en Tres Cumbres Santa Fe, con 2 recámaras, 2 baños, recámara principal con vestidor, medio baño para visitas, sala, comedor, cocina cerrada, área de lavado, cuarto de servicio con baño, 1 bodega y estacionamiento para 2 autos independientes. Piso 4, 139 metros habitables, mantenimiento incluido. Residencial Tres Cumbres cuenta con vigilancia, cancha de pádel, sendero al aire libre, parque y área de juegos para niños al aire libre, zona de mascotas, casa club con: salones para clases, gimnasio, salón de spinning, alberca, jacuzzi, ludoteca, salón de yoga, salón de jóvenes, vapor.",https://www.inmuebles24.com/propiedades/clasificado/alclapin-departamento-en-tres-cumbres-santa-fe-con-gran-vista-147777932.html,"MN 37,000","Av. de los Poetas 89
Santa Fe, Alvaro Obregón","139 m² lote, 2 rec., 2 baños, 2 estac.",Álvaro Obregón
"""**Descripción para Renta de Casa en Fraccionamiento Privado Estilo Americano** Descubre esta espectacular residencia ubicada en uno de los fraccionamientos más exclusivos, con un diseño de estilo americano que combina privacidad, comodidad y elegancia. **Características de la Propiedad: ** - **Amplia y funcional: ** Una de las casas más grandes del fraccionamiento, diseñada para el máximo confort. - **4 recámaras**: Cada una con baño completo, vestidor y acabados de lujo. - **2 medios baños**: Ideales para visitas. - **Estudio privado con aislamiento acústico: ** Perfecto para home office, clases o actividades que requieran concentración. - **Family Room: ** Espacio acogedor para convivir en familia. - **Cocina semiabierta: ** Conecta armónicamente con un luminoso desayunador y una terraza que ofrece vistas al jardín. - **Comedor amplio: ** Capacidad para 12 personas, ideal para reuniones y celebraciones. - **Sala con bar: ** Acceso a una segunda terraza y un espacioso jardín que complementan este lugar para recibir invitados. - **Jardín impresionante: ** Dividido en varias secciones, con una variada vegetación que invita a disfrutar de la naturaleza desde casa. **Amenidades del Fraccionamiento: ** - Jardín con juegos infantiles. - Salón de fiestas para tus eventos privados. - 2 canchas de pádel. - Cancha de fútbol con pasto artificial. Vive rodeado de tranquilidad, seguridad y entretenimiento en un entorno exclusivo. ¡No pierdas la oportunidad de rentar esta casa que lo tiene todo! **Agenda una visita y enamórate de tu próximo hogar. **"" *El precio es más mantenimiento. Clave interna: erschc1229",https://www.inmuebles24.com/propiedades/clasificado/alclapin-extraordinaria-casa-amueblada-cerca-de-santa-fe.-145434729.html,"USD 9,000","Calzada las Aguilas
Santa Fe, Alvaro Obregón","650 m² lote, 4 rec., 4 baños, 7 estac.",Álvaro Obregón
"Vive con estilo y comodidad en una de las zonas mejor conectadas de la cdmx. Este moderno departamento de 59 m² combina diseño funcional, acabados de calidad y una ubicación privilegiada. Características: + 2 recámaras, cada una con clóset. + 2 baños completos. + Sala–comedor luminosa y acogedora. + Cocina integral con cubierta de granito. + Área de lavado. + 1 lugar de estacionamiento. + Amueblado, listo para habitar. Ubicación estratégica: cerca de vías principales, transporte, comercios y servicios, en un entorno seguro y agradable. Ideal para profesionistas, parejas o familias que buscan confort, practicidad y un hogar listo para disfrutar. ¡Agenda tu visita hoy mismo y enamórate de tu próximo hogar en The Park!",https://www.inmuebles24.com/propiedades/clasificado/alclapin-apartamento-59-m-sup2--con-2-recamaras-en-renta-147665855.html,"MN 28,010","Blvd. Adolfo López Mateos
Merced Gómez, Alvaro Obregón","59 m² lote, 2 rec., 2 baños, 1 estac.",Álvaro Obregón
"Departamento de 2 recámaras en Cosmocrat Santa Fe. - 2 recámaras, recámara principal. - 2 baños completos. - 2 cajones de estacionamiento. - Cocina integral con cubierta de granito. - Área de sala comedor. - Espacio para centro de lavado con centro de lavado. Amenidades. - gym. - Alberca. - Vapor. - Rooftop con asadores. - Salón de estudios. - Salón de eventos. - Cuenta con su propia tienda de conveniencia exclusiva para condóminos",https://www.inmuebles24.com/propiedades/clasificado/alclapin-departamento-de-2-recamaras-en-cosmocrat-santa-fe-145790172.html,"MN 22,500","Prolongacion Paseo de la Reforma 307, Lomas de Santa Fe, Alvaro Obregon
Lomas de Santa Fe, Alvaro Obregón","74 m² lote, 2 rec., 2 baños, 2 estac.",Álvaro Obregón
"Compra o Renta departamento en Eleva2411 con 3 recámaras. Cuenta con acabados de lujo, madera de ingeniería en área social y recámaras, mármol en baños, cocinas, vestidores, puertas y muebles de baños italianos. Contáctanos para recibir información adicional. Características: -115 m². -Recámara principal con baño y walk in clóset. -2 Recámaras con clóset. -Baño completo fuera de las dos recámaras secundarias. -Cocina equipada. -Amplia estancia y comedor. -Desayunador. -Área de servicio. -2 estacionamientos independientes. -Posibilidad de comprar bodega. Excelentes amenidades: • alberca. • chapoteadero para bebés y niños. • asoleadero. • cafetería. • áreas verdes. • gimnasio. • spa y área de masajes. • ludoteca. • salón de adultos. • tiendita. • estética. • business center",https://www.inmuebles24.com/propiedades/clasificado/veclapin-venta-y-renta-departamento-eleva2411-3-recamaras-147525383.html,"MN 38,000","Av. Insurgentes Sur 2411
San Ángel, Alvaro Obregón","115 m² lote, 3 rec., 2 baños, 2 estac.",Álvaro Obregón
"Hola, si vienes A santa fe cdmx Y estas buscando un lugar cerca de tu trabajo O escuela, nosotro te ofrecemos departamento individual O tambien habitaciones individuales con su propio baño. ¡evita perder tiempo en el trafico! Estamos sobre la avenida principal vasco de quiroga (transporte directo A los corporativos santa fe Y universidades) A escasos 5 minutos de televisa sta fe. Y A nuestro alrededor contamos con tiendas de conveniencia Y comida. Las estancias son amuebladas con baño personal Y con servicios incluidos. La mayoria de nuestros inquilinos son personas que laboran en (bancos, televisa santa fe, patio sta fe, novotel, centro comercial sta fe, etc) O estudian en (ibero, cide, tec mty, west hill). Si pretendes ir al area corporativa de santa fe cdmx O estudiar en una de las universidades cercas A santa fe, no dudes en contactarnos O enviarnos un mensaje por whatsapp. A 10 minutos de la ibero, Centro Comercial Santa Fe, cide, Tec de Monterrey, Televisa Santa Fe, Centros Financiero Santa Fe, Zedec, German Centre y mucho más. Te esparamos! ! !",https://www.inmuebles24.com/propiedades/clasificado/alclapin-cerca-de-santa-fe-ibero-tec-mty:-depto.-amueblado-50701658.html,"MN 9,500","Privada de Fresno 2
Santa Fe, Alvaro Obregón","20 m² lote, 1 rec., 1 baño, 1 estac.",Álvaro Obregón
"El depa se encuentra en Residencial El Mirador, el cual destaca por su arquitectura moderna, ubicación privilegiada sobre Av. Bernardo Quintana y diseño sofisticado con vistas panorámicas de la ciudad. Cercanía a corporativos, centros comerciales y vías como Prolongación Paseo de la Reforma y Santa Fe, con cercanía a colegios como Universidad Iberoamericana, Tecnológico de Monterrey (campus Santa Fe) y el Colegio Vista Hermosa. : : superficie: : •? Aprox. ? 390? m²: : detalles de la propiedad: : • 3 recámaras, todas con baño propio y vestidor• 3. 5 baños • Estudio o posible 4ta recámara• 4 Estacionamientos• Sala amplia• Comedor con área para cava• Cocina integral con alacena y desayunador• Cuarto de lavado y de servicio con baño• Amueblado• 2 elevadores directos al departamento: Amenidades: : • Alberca • Gimnasio • Cancha de pádel • Jardínes con juegos infantiles • Ludoteca• Vigilancia 24/7 y recepción**precio: de venta** $Ver datos**precio: de renta** $130, 000. 00Mantenimiento: Incluido¡ Agenda tu cita !. : : Requisitos: : . 1 mes de renta y 1 mes de depósitoComprobantes de ingresos, referencias personales, póliza jurídica y/o fiador.",https://www.inmuebles24.com/propiedades/clasificado/alclapin-departamento-en-renta-en-santa-fe-amueblado-147151046.html,"MN 130,000","Bernardo Quintana 95
Santa Fe La Loma, Alvaro Obregón","390 m² lote, 4 rec., 3 baños, 4 estac.",Álvaro Obregón
"Rento Departamento con Terraza Desierto Leones. Lindo departamento muy amplio a la altura de academia de policía y pasos de colegio Edron. El desarrollo es de solo 35 departamentos en tres torres pequeñas. Ubicado en planta Baja cuenta con gran estancia con salida a terraza de 50 mts2. Tres recámaras la principal muy amplia con vestidor y baño. Dos recámaras secundarias grandes que comparten gran baño y tiene closets. Cuarto de tv o Family. Baño completo que comparte con cto de tv y visitas. Cocina importada con encimeras de granito. Bodega. Solo se acepta una mascota (perro) En áreas comunes tiene 3000 mts2 de áreas verdes. Área de juegos para niños. Carril de nado con vestidores y baños. Gimnasio bien equipado. Salón de eventos con capacidad aprox para 80 personas. Vigilancia 24/7. más cuota de mantenimiento de $8, 000. 00",https://www.inmuebles24.com/propiedades/clasificado/alclapin-hermoso-departamento-cedros-olivar-de-los-padres-147606586.html,"MN 32,000","Desierto de los Leones 5760
Cedros, Alvaro Obregón","240 m² lote, 3 rec., 3 baños, 2 estac.",Álvaro Obregón
"Departamento en renta en San Pedro de los Pinos, año de construcción 2023 y en excelente estado. Con una recamara, un baño y ninguna cochera, este loft en Los Pinos Rentals ofrece 51 m2 de superficie cubierta y total. Cuenta con alberca, gimnasio y salón de eventos/sum, ideal para jóvenes profesionales y nómadas digitales. El precio de renta mensual es de $13, 600 mxn (mantenimiento incluido). Además, disfruta de áreas de coworking, gimnasio equipado, roof garden con vistas increíbles, sala lounge y seguridad 24/7. Ubicado estratégicamente en una zona con alta conectividad y plusvalía en Ciudad de México. ¡Vive en un entorno pensado para tu bienestar y productividad!",https://www.inmuebles24.com/propiedades/clasificado/alclapin-departamento-en-renta-en-san-pedro-de-los-pinos-147780244.html,"MN 18,700","Los Pinos Rentals
San Pedro de los Pinos, Alvaro Obregón","51 m² lote, 1 rec., 1 baño",Álvaro Obregón
"Penthouse de lujo en venta O renta en lomas de santa fe. Hermoso departamento totalmente terminado con acabados de super lujo, diseñado por el arquitecto ""Pancho Guzmán"" *no se comparte comisión* características: • Departamento tipo PentHouse. • 2 niveles (planta alta y planta baja) • Superficie habitable de 371 m2. • Terrazas Techadas de 108 m2. • Terraza abierta de 87 m2. • Jardín de 54 m2. • Superficie total de 621 m2. • 3 recámaras. • Baño principal de ensueño con 2 regaderas de mármol. • 3 baños y medio. • Sala - Comedor con chimenea de gas. • Cocina. • Cuarto de servicio. • Terraza amplia con vista al bosque. • Doble altura en todo el departamento. • Family Room para tus momentos de relax. • Rooftop con Jardín y Jacuzzi. • Área social con barra de mármol. • Acceso por elevador. • Terraza techada con comedor de madera de parota. • Jardín vertical con riego automático. • Totalmente automatizado: cortinas, luz, sonido. amenidades: • Gimnasio. • Salón. • Jardín. *se renta O se vende sin muebles* Renta Mensual de $195, 000. 00 M. N (incluye mantenimiento) Precio de Venta $$2, 980, 000. 00 usd",https://www.inmuebles24.com/propiedades/clasificado/veclapin-penthouse-de-lujo-en-venta-o-renta-en-lomas-de-santa-147708071.html,"MN 195,000","Lomas de Santa Fé
Lomas de Santa Fe, Alvaro Obregón","621 m² lote, 3 rec., 3 baños",Álvaro Obregón
"Precioso departamento en Atlamaya Art Residences 2 rec, 2baños, 2 estacionamientos totalmente nuevo, con mantenimiento incluido. Excelente ubicaciòn, amenities, alberca, jacuzzi, vapor, gimnasio, seguridad y muy bonita vista.",https://www.inmuebles24.com/propiedades/clasificado/alclappa-excelente-departamento-147502649.html,"MN 27,000","Blvd. Adolfo López Mateos 2305
Las Águilas, Alvaro Obregón","73 m² lote, 2 rec., 2 baños, 2 estac.",Álvaro Obregón
"¡Vive en Guadalupe Inn!, una colonia ideal por su seguridad, tranquilidad y alta calidad de vida, que ofrece excelentes servicios, parques, restaurantes, acceso a transporte público y conectividad con principales vías de la ciudad como la avenida Revolución e Insurgentes Sur. ´ Además está a pocos pasos del Poder Judicial de la Federación y también puedes llegar caminando hasta los centros comerciales Portal San Ángel y Plaza Inn, metro (Barranca del Muerto) y metrobús (Olivo). Este moderno departamento a estrenar de espacio abierto con 42. 95 m², y hermosa vista panorámica de la ciudad, es ideal para quienes buscan comodidad y estilo. Se entrega sin muebles pero con persianas y cuenta con: • Cocina integral con estufa eléctrica. • Espacio para frigobar. • Closet amplio. • Baño completo. • Un lugar de estacionamiento. Amenidades de lujo: • Piso 18: Salón de eventos y gimnasio. • Piso 4: Área de coworking, salón con terraza y asador. • Piso 3: Lavandería para uso del edificio. Renta mensual: $19, 000. Incluye mantenimiento, agua y gas. Requisitos: • 1 mes de renta. • 1 mes de depósito en garantía. • Póliza jurídica de $6, 612. ¡Listo para habitar! Ideal para profesionistas, parejas o quienes buscan un estilo de vida urbano y funcional. Contáctame para agendar tu visita. ¡Somos Rent-A-House! #26-847 avc",https://www.inmuebles24.com/propiedades/clasificado/alclapin-rento-loft-a-estrenar-en-guadalupe-inn-av-revolucion-147778940.html,"MN 19,000","Spazio torre inn
Guadalupe Inn, Alvaro Obregón","43 m² lote, 1 rec., 1 baño, 1 estac.",Álvaro Obregón
"Departamento en renta en San Pedro de los Pinos, año de construcción 2023 y en excelente estado. Con una recamara, un baño y ninguna cochera, este loft en Los Pinos Rentals ofrece 51 m2 de superficie cubierta y total. Cuenta con alberca, gimnasio y salón de eventos/sum, ideal para jóvenes profesionales y nómadas digitales. El precio de renta mensual es de $13, 600 mxn (mantenimiento incluido). Además, disfruta de áreas de coworking, gimnasio equipado, roof garden con vistas increíbles, sala lounge y seguridad 24/7. Ubicado estratégicamente en una zona con alta conectividad y plusvalía en Ciudad de México. ¡Vive en un entorno pensado para tu bienestar y productividad!",https://www.inmuebles24.com/propiedades/clasificado/alclapin-departamento-en-renta-en-san-pedro-de-los-pinos-147780243.html,"MN 21,200","Los Pinos Rentals
San Pedro de los Pinos, Alvaro Obregón","63 m² lote, 2 rec., 1 baño",Álvaro Obregón
"Tu nuevo hogar en Parque San Antonio. ¿Buscas un departamento práctico y con excelente ubicación? Este espacio es ideal para quienes valoran la comodidad, la seguridad y la cercanía con todo. Características del departamento. 58 m² perfectamente distribuidos. 2 recámaras con buena iluminación. 1 ½ baños. Sala – comedor con gran ventilación. Family room (ideal para home office o área de tv) Cocina integral equipada. Área de lavado integrada. 1 lugar de estacionamiento. Persianas incluidas. Amenidades y entorno. Áreas verdes y juegos infantiles. Cancha de básquet. Pet friendly. Doble filtro de seguridad 24/7. Excelente conectividad: Periférico, Eje 5, Revolución y Patriotismo. A 20 min de Santa Fe y Polanco. A 4 min caminando de Costco San Antonio, Sport City, Plaza Exhibimex, restaurantes, cines, bancos y farmacias. Metros cercanos: San Pedro de los Pinos y San Antonio. Nota: El mobiliario mostrado en fotografías no está incluido en la renta. Perfecto para parejas, familias pequeñas o profesionales que buscan un espacio acogedor con todo al alcance.",https://www.inmuebles24.com/propiedades/clasificado/alclapin-departamento-en-renta-2-recamaras-142180879.html,"MN 16,000","Parque san Antonio
Carola, Alvaro Obregón","58 m² lote, 2 rec., 1 baño, 1 estac.",Álvaro Obregón
"Renta departamento amueblado en el corazón de San Ángel, propio de conocedores que gusten del placer de la elegancia y el buen gusto diseñado en finas maderas, con acabados de lujo donde se combinan el arte y la comodidad, tiene una amplia estancia con vista al jardín de la Plaza de San Jacinto, la cocina es abierta, techos altos, baño con cancel de cristal templado, subiendo medio nivel encuentra la habitación con una recámara kings size, 2 armarios muy amplios, baño con cancel de cristal templado, cuenta con refrigerador y electrodomésticos. Incluye, luz, agua, gas e internet. Ganelo bajo de precio.",https://www.inmuebles24.com/propiedades/clasificado/alclapin-renta-departamento-amueblado-san-angel-plaza-san-146275267.html,"MN 37,500","DR. GALVEZ 20 B
San Ángel, Alvaro Obregón","80 m² lote, 1 rec., 1 baño",Álvaro Obregón
"Ubicación privilegiada: frente al Centro Comercial Patio Santa Fe y a solo 2 km de la. Universidad ibero. Incluye mantenimiento. Distribución. • 2 recámaras con persianas. • 2 baños completos con canceles de cristal templado. • Sala y comedor con persianas. • Cocina integral con cubiertas de granito. • Flex Room abierto: ideal como sala de tv, estudio amplio u oficina en casa. • Área de lavado. • 2 estacionamientos completamente independientes y muy amplios. Seguridad. • Vigilancia 24/7. • cctv. • Acceso controlado. Amenidades. • Gimnasio equipado. • Ludoteca. • Jardines y áreas verdes. • Salón de usos múltiples. • Salón de asadores con baños y tv. • Jardín para mascotas. • Estacionamiento de visitas. • Elevadores. • Shuttle con chóferes que te conecta con el circuito Santa Fe",https://www.inmuebles24.com/propiedades/clasificado/alclapin-departamento-santa-fe-147791057.html,"MN 27,000","Via Santa Fe Torre 2
Santa Fe, Alvaro Obregón","100 m² lote, 2 rec., 2 baños, 2 estac.",Álvaro Obregón
"Ubicación privilegiada: frente al Centro Comercial Patio Santa Fe y a solo 2 km de la. Universidad ibero. Incluye mantenimiento. Distribución. • 2 recámaras con persianas. • 2 baños completos con canceles de cristal templado. • Sala y comedor con persianas. • Cocina integral con cubiertas de granito. • Flex Room abierto: ideal como sala de tv, estudio amplio u oficina en casa. • Área de lavado. • 2 estacionamientos completamente independientes y muy amplios. Seguridad. • Vigilancia 24/7. • cctv. • Acceso controlado. Amenidades. • Gimnasio equipado. • Ludoteca. • Jardines y áreas verdes. • Salón de usos múltiples. • Salón de asadores con baños y tv. • Jardín para mascotas. • Estacionamiento de visitas. • Elevadores. • Shuttle con chóferes que te conecta con el circuito Santa Fe",https://www.inmuebles24.com/propiedades/clasificado/alclapin-departamento-santa-fe-2-rec.-147656611.html,"MN 27,000","Via SantaFe Torre 1
Santa Fe, Alvaro Obregón","100 m² lote, 2 rec., 2 baños, 2 estac.",Álvaro Obregón
"Mls #26-589Departamento en renta cuenta con iluminación y ventilacion natural, muy cerca de los corporativo y universidades de Santa Fe. Con 63 mts2, distribuidos en 2 recamaras, principal con vestidor y baños, con closet de buen tamaño con bano completo fuera de la habitacion. Amenidades: gym, vapor y carril de nado. Lugares de Visita y Seguridad las 24 horas. Piso bajo vista a la carreterade Santa Fe. Control de acceso a las areas comunes y al edificio. Se acepta mascota pequeña - mediana. Persianas en black out en ventanas de las recamaras y en la sala persiana. Canceles de vidrio en los baños. Mantenimiento incluido. *Precio sujeto a cambio sin previo aviso y de acuerdo a disponibilidad. *Las imágenes publicadas son de carácter ilustrativos, los acabados y dimensiones son referenciales y pueden variar.",https://www.inmuebles24.com/propiedades/clasificado/alclapin-departamento-en-renta-en-alvaro-obregon-santa-fe-am.-147786345.html,"MN 20,000","Alvaro Obregón
Santa Fe, Alvaro Obregón","63 m² lote, 2 rec., 2 baños, 1 estac.",Álvaro Obregón
"Ubicado en Conjunto latelier- Torre Alameda. Departamento amueblado. Con gran ubicación e iluminado departamento de 108 m2. Con 2 Recamaras, 2 Baños Completos, Sala, Comedor, Cocina Abierta. Un lugar de estacionamiento fijo. Excelentes amenidades: Recepción, Alberca Techada con Jacuzzi. Gimnasio, Jardín Cancha tenis. Vigilancia 24 horas. (Mantenimiento Incluido). No mascotas. A unos media cuadra de centro comercial patio santa fe",https://www.inmuebles24.com/propiedades/clasificado/alclapin-renta-departamento-amueblado-conjunto-latelier-147223862.html,"MN 33,500","Fernando Espinosa Gutiérrez No 55
Santa Fe, Alvaro Obregón","108 m² lote, 2 rec., 2 baños, 1 estac.",Álvaro Obregón
