Título,Enlace,Precio,Dirección,Características,Municipio de Origen
"Excelente y funcional departamento en Blum Santa Fe con balcón. 78m2 con excelente distribución. Estancia de Sala y comedor. Cocina integral concepto abierto. *2 Recamaras, la principal con vestidor. *2 baños. * 1 lugar de estacionamiento. Magnifica ubicación cerca de las principales zonas corporativas de Santa Fe y cerca de centros comerciales y universidades. Amenidades. *Business center. *Gym. *Alberca. *Spining. *Golf Range. *Lounge Bar. *Cafeteria. * Salón de Usos múltiples. *Ludoteca. * área de Asadores. *Area de Mascotas",https://www.inmuebles24.com/propiedades/clasificado/alclapin-santa-fe-residencial-blum-renta-excelente-departamento-147789017.html,"MN 26,000","Av. P.º de la Reforma 489
Lomas de Santa Fe, Alvaro Obregón","78 m² lote, 2 rec., 2 baños, 1 estac.",Álvaro Obregón
"Mls #26-811. Con estilo y vanguardia, se ofrece departamento sin mobiliario con la tranquilidad, comodidad, dinamismo y la elegancia que buscas. Son 24 unidades en el residencial. En su interior, cuenta con 85 m2, distribuidos en 81 m2 habitables, 4 m2 de balcon en la recamara principal, mas un cajon de estacionamiento. Además cuenta con Seguridad y vigilancia las 24 horas y un Roof Garden Comun. Las fotos son referenciales. Precios sujetos a cambio sin previo aviso y de acuerdo a disponibilidad. Para rentar se requiere un mes de depósito, primer mes de renta por adelantado. Pago de investigación a cargo del interesado + obligado solidario o propiedad como aval en cdmx (libre de gravamen)",https://www.inmuebles24.com/propiedades/clasificado/alclapin-departamento-en-renta-en-alvaro-obregon-colinas-del-147713663.html,"MN 19,000","Calzada De Los Corceles
Colina del Sur, Alvaro Obregón","85 m² lote, 3 rec., 2 baños, 1 estac.",Álvaro Obregón
"Departamento amueblado O sin amueblado de 2 recamaras Y dos baños. Cerca de la ibero santa fe. 2 recamaras. 2 baños. 1 estacionamiento. Qbico Santa Fe es un desarrollo con un diseño de primera, funcionalidad en. áreas comunes y adicional cuenta con una inteligencia en espacios interiores. Departamento de dos recamaras, este es de los únicos con madera en piso y cancel. en los baños. La ubicación de este desarrollo es inigualable. Cerca de parques, escuelas, centros comerciales y servicios de todo tipo. Amenidades: Recepción, vigilancia 365 x 24, gimnasio, alberca cerrada, salón de eventos, estacionamiento visitas.",https://www.inmuebles24.com/propiedades/clasificado/alclapin-renta-departamento-amueblado-o-sin-amueblar-2-147455604.html,"MN 22,200","PROLONGACION PASEO DE LA REFORMA 319
Santa Fe, Alvaro Obregón","65 m² lote, 2 rec., 2 baños, 1 estac.",Álvaro Obregón
"Departamento con una recamara con closet Y persianas, baño con cancel de vidrio, sala comedor, cocina espacio abierto, area de lavado. Dos estacionamientos. Se acepta mascota. Amenidades: alberca, cancha de padel, gym, salon de usos multiples.",https://www.inmuebles24.com/propiedades/clasificado/alclapin-departamento-con-amenidades-147530798.html,"MN 16,500","ROMULO OFARRIL 520
Olivar de los Padres, Alvaro Obregón","54 m² lote, 1 rec., 1 baño, 2 estac.",Álvaro Obregón
"(Venta o Renta) Departamento Semi Amueblado: Tu Espacio Ideal para Vivir y Trabajar. ¡Descubre el balance perfecto entre vida y trabajo en este moderno departamento semi amueblado! Diseñado para profesionales dinámicos como tú, este espacio te ofrece: - ️ Mobiliario esencial incluido, ¡solo trae tus objetos personales! - Acabados modernos que inspiran productividad y descanso. - Incluye internet de alta velocidad. Amenidades pensadas para tu estilo de vida: - Gimnasio equipado para mantener tu rutina de ejercicio. - Áreas comunes ideales para networking o relajación. - Espacios de coworking para cuando necesites un cambio de ambiente. Ubicación estratégica: - Conexión rápida con las principales vías de la ciudad. - Cerca de zonas corporativas. - ️ Rodeado de servicios, restaurantes y entretenimiento. La independencia y flexibilidad que buscas en un solo lugar. ¡Programa tu visita hoy y descubre tu nuevo espacio de vida!",https://www.inmuebles24.com/propiedades/clasificado/alclapin-departamento-1-habitacion-cerca-de-san-pedro-de-los-145223718.html,"MN 18,500","Av. San Antonio 139
San Pedro de los Pinos, Alvaro Obregón","50 m² lote, 1 rec., 1 baño, 1 estac.",Álvaro Obregón
"Mls #26-811. Con estilo y vanguardia, se ofrece departamento sin mobiliario con la tranquilidad, comodidad, dinamismo y la elegancia que buscas. Son 24 unidades en el residencial. En su interior, cuenta con 85 m2, distribuidos en 81 m2 habitables, 4 m2 de balcon en la recamara principal, mas un cajon de estacionamiento. Además cuenta con Seguridad y vigilancia las 24 horas y un Roof Garden Comun. Las fotos son referenciales. Precios sujetos a cambio sin previo aviso y de acuerdo a disponibilidad. Para rentar se requiere un mes de depósito, primer mes de renta por adelantado. Pago de investigación a cargo del interesado + obligado solidario o propiedad como aval en cdmx (libre de gravamen).",https://www.inmuebles24.com/propiedades/clasificado/alclapin-departamento-en-renta-en-alvaro-obregon-ahb-26-811-147708777.html,"MN 19,000","Calzada De Los Corceles
Colina del Sur, Alvaro Obregón","85 m² lote, 3 rec., 2 baños, 1 estac.",Álvaro Obregón
"Departamento en Renta | 105 m2; | Piso 17 | Amenidades de Lujo. Disponible semiamueblado o sin amueblar. Excelente ubicación con entrada por Insurgentes Sur y Avenida Revolución. Consta de: 2 recámaras, 2 baños completos, Sala-comedor, Cocina integral junto al área de lavado, 2 cajones de estacionamiento. Opcional amueblado: Incluye lavasecadora, refrigerador, una litera, cama queen, mesa de tv y pantalla de 45"". Amenidades de lujo del edificio: Elevador, Vigilancia 24/7 y acceso controlado, Ludoteca, Gimnasio, Spa, Mini súper, Salón de belleza, Área exclusiva para adultos, Alberca, ¡Y mucho más! No se aceptan mascotas. Ya incluye mantenimiento. Requisitos: 1 mes de renta, 1 mes de depósito, Póliza jurídica (30% del valor de la renta) , tramitada con fiador u obligado solidario. Contrato mínimo de 1 año. (4)",https://www.inmuebles24.com/propiedades/clasificado/alclapin-departamento-en-renta-san-angel-alvaro-obregon-4-147528330.html,"MN 36,000","Avenida de los Insurgentes Sur
San Ángel, Alvaro Obregón","105 m² lote, 2 rec., 2 baños, 2 estac.",Álvaro Obregón
"Departamento amueblado y equipado en el Condominio Latelier en Santa Fe, ubicado en 2do. Piso. * 108 m2, * 2 recamaras. * 2 baños. * 1 lugar de estacionamiento. Amenidades. * Gimnasio. * Alberca techada. * Jacuzzi. * Cancha de tenis. * Jardín. Seguridad las 24hrs. Renta Mensual 33, 500. 00 con cuota de mantenimiento incluida. Condominio con excelentes vías de comunicación, cercano a Oficinas, Centros Comerciales, Escuelas. D",https://www.inmuebles24.com/propiedades/clasificado/alclapin-departamento-en-renta-completamente-amueblado-en-santa-147576886.html,"MN 33,500","Fernando Espinoza Gutiérrez
Santa Fe, Alvaro Obregón","108 m² lote, 2 rec., 2 baños, 1 estac.",Álvaro Obregón
"Green house ofrece en renta lindo departamento en la colonia lomas de plateros, unidad torres mixcoac, calle blvd. Adolfo lopez mateos 1661, C. P. Ver datos. Precio de renta mensual $ 17, 500 pesos, + más la cuota de mantenimiento $1, 660. ubicado en quinto nivel, cuenta con estancia, cocina integral con ventilación natural, 3 recámaras con closet, 2 ½ baños, 1 cajón de estacionamiento fijo E independiente. 3 recamaras. 2 ½ baños. 1 estacionamiento fijo E independiente. 95 M2 construcción aproximadamente. 5ª nivel. 40 años de antigÜedad aproximadamente. elevador. seguridad las 24 horas. ubicado junto al walmart de plateros Y el parque octavio paz (deportivo plateros), el cual cuenta con canchas de futbol, tenis, basquetbol, alberca techada, así como otras actividades deportivas. *requisitos para arrendar*: póliza jurídica de arrendamiento, el 50% paga el propietario. fiador con inmueble libre de gravamen en cdmx. depósito en garantía. comprobantes de ingresos O estados de cuenta bancaria. carta membretada laboral. buró de crédito Y buró judicial. 3 referencias. uso habitacional exclusivamente. * no aceptan mascotas* **si cumples con los requisitos** previa cita: mínimo con 24 horas de antelación, proporcionar identificación oficial para ingresar al condominio. tels Ver datos - Ver datos- whatsapp directo Ver datos – Ver datos. visite nuestro anuncio de privacidad. mx/. mx/aviso-de-privacidad. Ver datos. las características son aproximadas. disponibilidad Y precio sujetos A últimos cambios. * exclusiva para clientes directos *",https://www.inmuebles24.com/propiedades/clasificado/alclapin-departamento-en-renta-lomas-de-plateros-unidad-143007714.html,"MN 17,500","BOULEVARD ADOLFO LOPEZ MATEOS 1661
Lomas de Plateros, Alvaro Obregón","95 m² lote, 3 rec., 2 baños, 1 estac.",Álvaro Obregón
"Se renta departamento ubicado en la colonia Ex-Hacienda de Guadalupe Chimalistac, una de las zonas más tranquilas y con mejor ubicación del sur de la Ciudad de México. El departamento cuenta con 76 m⊃2; distribuidos en 3 recámaras, 1 baño completo, cocina integral, sala y comedor amplios. Está ubicado en el tercer piso de un edificio sin elevador, con pocas unidades, lo que garantiza privacidad y tranquilidad. Es un espacio bien iluminado y ventilado, ideal para familias, parejas o profesionistas que buscan comodidad y conexión con zonas céntricas como Coyoacán, Plaza Oasis, unam y las avenidas principales como Universidad y División del Norte. Disponible para entrega inmediata. Se solicita póliza jurídica y un mes de depósito. El mantenimiento está incluido. ¡Contáctanos para agendar una cita y conocer tu próximo hogar! (4)",https://www.inmuebles24.com/propiedades/clasificado/alclapin-departamento-en-renta-av-miguel-angel-de-quevedo-4-146676439.html,"MN 25,000","Av. Miguel Ángel de Quevedo
Ex-Hacienda de Guadalupe Chimalistac, Alvaro Obregón","76 m² lote, 3 rec., 1 baño",Álvaro Obregón
"Renta departamento muy amplio y acogedor en Bosque 6060, en desierto de los Leones. Tiene una extraordinaria ubicación. El departamento cuenta con 3 recámaras cada una con baño completo. La recámara principal tiene vestidor. Tiene sala, comedor, cocina integral, cuanto de servicio, cuarto de lavado, y un balcón. El departamento tiene una gran vista. Encontraras tranquilidad y amenidades como alberca techada con regaderas baños y vestidores, cafetería, coworking, biblioteca, ludoteca, jardines, gimnasio. Es un fraccionamiento muy arbolado donde podrás caminar. Tiene vigilancia 24horas y lugares de visitas. El vivir ahí te hará sentir fuera de la ciudad. No dejes de conocerlo! Tiene escuelas cerca como el Edrón, Oxford y Asunción. También Universidades como el Tec de Monterrey, la Ibero, itam y Anáhuac.",https://www.inmuebles24.com/propiedades/clasificado/alclapin-renta-departamento-en-bosque-6060-147670643.html,"MN 65,000","Desierto de Los Leones 6060
Olivar de los Padres, Alvaro Obregón","205 m² lote, 3 rec., 3 baños, 4 estac.",Álvaro Obregón
"En una de las mejores zonas de Santa Fe está ubicado el conjunto Latelier con salida a 5 minutos de Reforma Constituyentes y casi esquina con Javier Barros Sierra, con escuelas, hospitales, centros comerciales, supermercados y restaurantes de muy alto nivel, con el parque La Mexicana a 10 minutos sobre avenida Santa Fe. Latelier es un conjunto de varias torres con 168 departamentos con vigilancia las 24 horas con cámaras en los lugares comunes. Cada torre tiene lobby de recepción y dos elevadores. El departamento está en la torre Alameda en el piso 2, tiene pisos de madera de ingeniería, la sala comedor tiene ventanas de piso a techo, está amuelado con buen gusto y con muebles de alta calidad. La cocina es abierta con barra desayunador y da acceso al área de lavado, cuenta con dos recámaras, la principal con walking closet y baño con terminados en mármol y cristal templado, tiene cama king size y un escritorio pegado a la ventana, la segunda recámara comparte otro baño completo con el área social. Tiene varias amenidades, entre ellas gym, alberca, jacuzzi, sauna, cancha de padel, jardines con juegos infantiles, asadores y salón de eventos, no se aceptan mascotas. El mantenimiento está incluido en la renta. Anpr",https://www.inmuebles24.com/propiedades/clasificado/alclapin-renta-depto-amueblado-en-latelier-santa-fe-147221752.html,"MN 33,500","Santa Fe, Alameda Poniente, Álvaro Obregón
Santa Fe, Alvaro Obregón","108 m² lote, 2 rec., 2 baños, 1 estac.",Álvaro Obregón
"*trato directo. Colina del Sur se caracteriza por ser tranquila. Edificio ubicado en calle cerrada con Vigilancia. Depto. Ideal para quien guste de la zona o trabaje en San Fe o Barranca del Muerto, cerca de Portal Centenario, Plaza Centenario, Escuelas con vías de acceso a 15 min de Periférico, Santa Lucía, Alta Tension. Perfecto para Ejecutivo o Parejas. *no se aceptan niños ni mascotas. -Sala-Comedor con Área de T. V. -Cocina integral con Área de Lavado. -2 Recámaras con closet más el de Blancos. •Pisos de Loseta. •Persianas. * 1 Estacionamiento (Se comparte fila con 2 autos más) El Edificio tiene salida por la calle de arriba, también tiene vigilancia, ha una cuadra está Av Santa Lucía. no hay elevador ni vigilancia. Al conocerlo querrá que sea su nuevo hogar! Conózcalo sólo llame y solicite cita con Maru Becerril Cel. Ver datos",https://www.inmuebles24.com/propiedades/clasificado/alclapin-depto-en-renta-calle-cerrada-con-vigilancia-en-147080492.html,"MN 13,000","Calz. de la Romería
Alvaro Obregón, Ciudad de México","75 m² lote, 2 rec., 1 baño, 1 estac.",Álvaro Obregón
"Descubre este espectacular Penthouse de dos niveles ubicado Colonia Los Alpes. Te ofrece una combinación perfecta de amplitud, confort y vistas inigualables. Donde podrás disfrutar de una vista panorámica impresionante en sus dos terrazas privadas, sala y comedor con excelente iluminación y doble altura, cocina integral totalmente equipada (incluye refrigerador) y cuenta con un diseño funcional para quienes disfrutan cocinar o compartir momentos en familia, tres recámaras muy amplias, la principal con vestidor y baño, en total dos baños completos y medio baño, cuarto de lavado y cuarto de servicio con baño completo. Tres lugares de estacionamiento, una bodega privada perfecta para almacenaje adicional. Amenidades: Roof garden común con asador y vistas espectaculares. Área de coworking, ideal para trabajar desde casa en un entorno cómodo y profesional. Salón de eventos y Ludoteca para los más pequeños. A unos pasos de vías principales, centros comerciales, escuelas y restaurantes, con la tranquilidad de una zona arbolada y segura. Una propiedad única por su diseño, distribución y ubicación. Ideal para familias o ejecutivos que buscan un hogar moderno, funcional y con carácter. El precio de renta incluye Mantenimiento. Citas con 24 horas de anticipación. *es* eb-uh1364",https://www.inmuebles24.com/propiedades/clasificado/alclapin-departamento-en-renta-col.-los-alpes-residencial-147704157.html,"MN 55,000","Blvd. Adolfo López Mateos
Los Alpes, Alvaro Obregón","190 m² lote, 3 rec., 2 baños, 3 estac.",Álvaro Obregón
"Hermoso departamento junto al bosque en un ambiente muy campirano, 2 recamaras un baño sala comedor Y área de lavado, el residencial es muy acogedor Y con áreas comunes, muchas áreas verdes, salón de eventos, jogging track, areas ideales para tener mascota, gym al aire libre E increibles vistas. Precio incluye mantenimiento.",https://www.inmuebles24.com/propiedades/clasificado/alclapin-renta-a-8-minutos-de-santa-fe-frente-al-bosque-54984124.html,"MN 15,000","REAL DEL BOSQUE, CAMINO SANTA FE 1231
Santa Fe, Alvaro Obregón","84 m² lote, 2 rec., 1 baño, 1 estac.",Álvaro Obregón
"Departamento tipo Master Suite de 1 habitación, ubicada en Col. Guadalupe Inn cdmx. Consta de: 1 habitación con closet completamente amueblada, 1 baño, cocina abierta equipada con: estufa eléctrica, horno de microondas, frigobar y utensilios de cocina, 1 espacio de estacionamiento. La renta incluye, internet, cable de tv, blancos por una vez en recepción del departamento; roof garden equipado con asador y mobiliario. ¡Aceptamos a tu mascota! Con excelente ubicación, cercano a principales vialidades, supermercados, tiendas de conveniencia, vías de transporte público, a una calle de Museo Soumaya. Con Homie renta sin aval. Proceso 100% digital y diferentes formas de pago de tu renta, tú eliges. ¡Conoce ya este depa! Estás a pocos pasos de encontrar el hogar de tus sueños. Departamento de 62. 0 metros cuadrados cuenta con: - 1 habitación. - 1. 0 baño. - Se aceptan mascotas. - 1 lugar de estacionamiento. Características: - Amueblado. - Cocina integral. Servicios: - Cable. - Internet/Teléfono. Amenidades: - Seguridad. - Elevador. - Asador. Antigüedad: 3 años. . Número de habitantes recomendado: 1. Disponibilidad para mostrar: 11/abril/2023. Disponibilidad para habitar: 11/abril/2023. ¡Enamórate de tu vida en este departamento! # Homie Id: 8_6_5_8_6. Estos son los beneficios que tienes como inquilino al rentar tu nuevo hogar con nosotros: * No necesitas aval (sujeto a Términos y Condiciones). * Realiza el pago de tu renta mediante transferencia digital en nuestra plataforma o en efectivo en miles de locales disponibles. * Asistencia y conciliación con tu propietario. * Proceso sin burocracia, renta en cuestión de horas y sin trámites complicados. * Firma tu contrato de forma digital.",https://www.inmuebles24.com/propiedades/clasificado/alclapin-departamento-amueblado-de-1-habitacion-ubicada-en-66654947.html,"MN 49,000","Avenida Insurgentes Sur
Guadalupe Inn, Alvaro Obregón","62 m² lote, 1 rec., 1 baño, 1 estac.",Álvaro Obregón
"Mls #26-12Departamentos en Renta, de 1 recamara y 1 baño. El departamento incluye: cocina integral, estufa por inducción, refrigerador, horno de microondas, closets y persianas. Se cuenta con lavanderia comun en pb. El desarrollo cuenta con diferentes amenidades como son: Alberca, Gimnasio 24 hrs, Work Lounge, Pet Room y Game Room, No tienen muebles y el lugar de estacionamiento es de 1970$. Precio sujeto a cambios de acuerdo a su disponibilidad. Fotos referenciales.",https://www.inmuebles24.com/propiedades/clasificado/alclapin-departamento-en-renta-en-alvaro-obregon-san-pedro-de-147786222.html,"MN 19,363","Alvaro Obregón
San Pedro de los Pinos, Alvaro Obregón","53 m² lote, 1 rec., 1 baño",Álvaro Obregón
"Renta Departamento de Lujo – 220 m² Vive con amplitud, comodidad y exclusividad en este hermoso departamento de 220 m², ubicado en un residencial de primer nivel. Características principales: -3 recámaras con vestidor (la principal con tina de baño) -3. 5 baños. -Sala, comedor y sala de tv. -Cocina integral con acabados de lujo. -Piso de madera y diseño ecofriendly. -Cuarto de servicio con baño completo. -2 terrazas privadas. -3 cajones de estacionamiento. -Bocinas Bluetooth integradas. -Amenidades del residencial: -Gimnasio. -Ludoteca. -Business Center. -Salón de usos múltiples. Requisitos: -1 mes de renta. -1 mes de depósito. -Póliza jurídica $9, 500. -Aval con bien raíz en cdmx o obligado solidario. *Disponible a partir del 15 de noviembre",https://www.inmuebles24.com/propiedades/clasificado/alclapin-renta-de-departamento-en-san-jeronimo-lidice-147778418.html,"MN 36,000","Rio de la Magdalena 124
Loreto y Campamento, Alvaro Obregón","220 m² lote, 3 rec., 3 baños, 3 estac.",Álvaro Obregón
"Vive en un departamento muy iluminado, con vista panorámica y en muy buenas condiciones, cuenta con bodega. El mantenimiento esta incluido en la renta. Ubicado en el pueblo de Santa Fe, cercano a la zonas de corporativos de Santa Fe con fácil acceso a Prolongación Reforma, Sur 122, Constituyentes, calle! 0, Periferico y Av. De las Torres. Doble vigilancia 24/7. El edificio cuenta con jardín para eventos y un área verde exclusiva. Pago de póliza jurídica de $6, 300. 00 con Fiador u obligado solidario. no se admiten mascotas",https://www.inmuebles24.com/propiedades/clasificado/alclapin-departamento-en-renta-147590598.html,"MN 19,500","Residencial Boscoso Torre Granados
Alvaro Obregón, Ciudad de México","100 m² lote, 2 rec., 2 baños, 2 estac.",Álvaro Obregón
"Departamento en 4º piso con roof garden privado de 60 m². El departamento cuenta con área para sala-comedor, cocina integral, área de lavado y dos recámaras, la principal con vestidor. Además, dispone de dos baños completos. El departamento tiene vista arbolada con balcones en el área de sala-comedor y en ambas recámaras. Las puertas tienen sellado acústico. Además, cuenta con dos estacionamientos techados fijos, uno atrás del otro, y una bodega junto a su roof garden privado. Áreas comunes: Salón de usos múltiples con capacidad para 80 personas, con baños, cocina y cuarto para dj. Alberca de 20 metros con dos carriles de nado, baños, regaderas, vapor y lockers. Gimnasio con aparatos de fuerza y máquinas aeróbicas. Área de jóvenes con ping pong y billar, además de una ludoteca para niños pequeños. Área de mascotas y áreas verdes en toda la privada. Seguridad 24 horas, los 7 días de la semana con circuito cerrado de tv. Características adicionales: Varios estacionamientos techados para visitas adentro de la privada. Edificios de cuatro pisos con elevador, con cuatro departamentos por piso. Cisterna en cada edificio y una cisterna general para la privada. El conjunto residencial está ubicado en la parte del camellón de Av. Toluca, cerca del Walmart. Para aviso de privacidad, quejas, sugerencias o aclaraciones visita, o escríbenos a Ver datos. Oficina Pte. Ver datos. Los gastos de investigación y póliza jurídica no están incluidos en el costo de renta, así como el mobiliario, electrodomésticos y arte que se muestran en las fotografías.",https://www.inmuebles24.com/propiedades/clasificado/alclapin-av-toluca:-depto-con-roof-garden-propio-en-privada-147409273.html,"MN 28,500","Avenida Toluca
Olivar de los Padres, Alvaro Obregón","150 m² lote, 2 rec., 2 baños, 2 estac.",Álvaro Obregón
"$30, 000 ( mantenimiento incluido) 100 mts + terraza. 2 recamaras. estancia ( sala /comedor) cocina integral abierta. area de lavado. 2 lugares de estacionamiento. 6to piso. exterior. elevador. vigilancia 24 horas. 2017. pet friendly. amenidades: salon de usos múltiples, roof garden común, gimnasio. Renta departamento amueblado y equipado, iluminado, cerca de cines, restaurantes, supermercados, metro barranca del Muerto, metrobus, Portal San Angel, Pabellón Altavista, Teatro Helénico. Contacto: olivia malvido Ver datos",https://www.inmuebles24.com/propiedades/clasificado/alclapin-renta-departamento-amueblado-en-guadalupe-inn-147587028.html,"MN 30,000","Avenida Revolución 1348
Guadalupe Inn, Alvaro Obregón","130 m² lote, 2 rec., 2 baños, 2 estac.",Álvaro Obregón
"Asesora miriam martinez mm375. Se renta Loft exterior amueblado de 35 m2. cuenta con 1 sanitario amplio. 1 lugar de estacionamiento. 1 recamara con cama queen size. anmbiente para gustos exigentes. Amplios ventanales que permiten una gran iluminacion. equipados con cortinas tipo black out. ubicado en el piso 16, con 2 elevadores, gimnasio, lavanderia -costo extra- y Vigilancia 24/7. Asadores y area de Coworking. vias de comunicacion Av. Revoluicion, Altavista, Barranca del Muerto Periferico e Insurgentes Sur",https://www.inmuebles24.com/propiedades/clasificado/alclapin-loft-amueblado-y-vistas-panoramicas-en-guadalupe-inn-147103055.html,"MN 18,999","Avenida Revolución
Guadalupe Inn, Alvaro Obregón","35 m² lote, 1 rec., 1 baño, 1 estac.",Álvaro Obregón
"Departamento en el piso doce con dos lugares de estacionamientos ubicados en el sótano cinco, tres recamaras con closets, dos baños completos, sala, comedor, cocina abierta. Amenities: Alberca, Jacuzzi, chapoteadero, gimnasio, salón de adultos, vapor.",https://www.inmuebles24.com/propiedades/clasificado/alclapin-departamento-en-renta-en-be-gran-san-angel-146859460.html,"MN 35,000","Calle Iglesia 270, Tizapán San Ángel, Loreto y Campamento, Álvaro Obregón, 01090 Ciudad de México, CDMX
San Ángel, Alvaro Obregón","120 m² lote, 2 rec., 1 baño, 2 estac.",Álvaro Obregón
"Amplio Departamento en venta ubicado en planta baja, con una linda terraza nuevo a estrenar, ubicado en una de las mejores calles de la zona, cuenta con magníficos espacios, buena iluminación, acabados de lujo, cocina abierta de diseño, jardín y patio, dos recamaras la principal con vestidor y baño, ubicado en planta baja, el edificio cuenta con elevador, vigilancia las 24 horas, Roofgarden común y dos lugares de estacionamiento con eleva auto",https://www.inmuebles24.com/propiedades/clasificado/veclapin-departamento-en-venta-las-aguilas-144622844.html,"MN 35,000","las aguilas
Las Águilas, Alvaro Obregón","110 m² lote, 2 rec., 2 estac.",Álvaro Obregón
