Título,Enlace,Precio,Dirección,Características,Colonia de Origen
"Renta. cdmx aviacion civil. venustiano carranza. departamento. Características: 53 m. 2 recamaras. 1 baño completo. Cocina integral. Area de lavado. Estancia. 1 lugar de estacionamiento compartido. Cuarto piso sin elevador. No se aceptan mascotas. El edificio cuenta con salon de usos multiples, Ludoteca, vigilancia 24/7. renta $11, 400 (cuota de mantenimiento incluida) requisitos. Solicitud de arrendamiento. Se llena una solicitud de arrendamiento con toda su información general, deberá venir completa la información. Ine (En caso de Extranjeros, documento de migracion que ampare el tiempo de estadia durante el arrendamiento) Comprobantes de ingresos: Estados de cuenta de los últimos tres meses y/o recibos de nómina. En cualquiera de los casos los ingresos deben ser 3 a 1 con respecto al monto de la Renta. Garantia. Aval con propiedad libre de gravamen en la Ciudad de Mexico (exclusivamente) preferentemente un familiar. En el caso de que existan copropietarios deberán firmar ambos como avales.",https://www.inmuebles24.com/propiedades/clasificado/alclapin-cerca-metro-zaragoza-metro-puebla-10-mins.-aeropuerto-143665990.html,"MN 11,400","ZARAGOZA 838
Ampliación Aviación Civil, Venustiano Carranza","53 m² lote, 2 rec., 1 baño, 1 estac.",Ampliación Aviación Civil
"Ref: 2 5 7 2 4 4. ¡No pierdas la oportunidad de vivir en este acogedor departamento en renta en la Ampliación Aviación Civil, Venustiano Carranza, Ciudad de México! Con 1 recámara y 1 baño, este inmueble de 40 m2 de construcción es ideal para parejas o personas solteras que buscan un espacio cómodo y funcional para habitar. Ubicado en una zona residencial, disfrutarás de tranquilidad y seguridad en tu día a día. ) busco persona sola mujer sin mascotas sin niños =) La propiedad se encuentra cerca de importantes zonas de interés, como el Centro Comercial Parque Delta, donde podrás encontrar una amplia variedad de tiendas, restaurantes y entretenimiento. Además, a pocos minutos se encuentra el Parque de los Venados, ideal para realizar actividades al aire libre y relajarse en medio de la naturaleza. Para los amantes de la cultura, el Teatro Blanquita ofrece diversas obras de teatro y espectáculos a solo unos kilómetros de distancia. En cuanto a las vías de acceso, el departamento en renta cuenta con fácil conectividad a través de avenidas principales como Viaducto Miguel Alemán y Circuito Interior. Además, la estación del Metrobús Balbuena se encuentra a poca distancia, facilitando el transporte público hacia diferentes puntos de la ciudad. ¡No dejes pasar esta oportunidad de vivir en una de las zonas más privilegiadas de la cdmx! ¡Agenda una visita hoy mismo!",https://www.inmuebles24.com/propiedades/clasificado/alclapin-departamento-en-renta-en-calle-rolando-garros-aviacion-147437087.html,"MN 5,500","CALLE ROLANDO GARROS 177
Ampliación Aviación Civil, Venustiano Carranza","40 m² lote, 1 rec., 1 baño",Ampliación Aviación Civil
"Departamento en primer nivel, con 1 recamara con closet, sala, comedor, cocina con pura tarja, baño completo Y area de tendido. No se aceptan mascotas.",https://www.inmuebles24.com/propiedades/clasificado/alclapin-departamento-renta-147393324.html,"MN 7,000","CALZ. I. ZARAGOZA.
Puebla, Venustiano Carranza","42 m² lote, 1 rec., 1 baño",Ampliación Aviación Civil
