Título,Enlace,Precio,Dirección,Características,Colonia de Origen
"Hermoso departamento a estrenar cerca de la Basílica de Guadalupe. Ubicado en tercer nivel. con Roof Garden Privado y 1 estacionamiento independiente (capacidad para 1 coche) 2 recamaras. 2 baños completos. sala-comedor con area de lavado. ubicadisimo a 3 cuadras de la Villa. Se cuenta tambien con 1 roof garden de uso comun. 15, 500 mensuales. requisitos para la contratacion del inmueble. -no negociables- 1. - un deposito en garantía. 2. - un mes de renta adelantado. 3. - fiador: con bien raiz en la ciudad de mexico, libre de gravamen. 4. - gastos de investigación. _1, 500 cdmx 3, 000 edomex. 5. - poliza juridica",https://www.inmuebles24.com/propiedades/clasificado/alclapin-depto-en-renta-cerca-de-la-villa-147290293.html,"MN 15,000","Cuauhtémoc 55
Aragón la Villa, Gustavo A. Madero","67 m² lote, 2 rec., 2 baños, 1 estac.",Aragón la Villa
"Departamento económico con cocineta con tarja, recámara con baño, estancia, interior, gas de cilindro, zotehuela con lavadero, bien ubicado, se aceptan mascotas pequeñas. Cerca del Metro Basílica.",https://www.inmuebles24.com/propiedades/clasificado/alclapin-depto.-en-calz.-guadalupe-627-65054096.html,"MN 6,500","Calz. de Guadalupe 627
Aragón la Villa, Gustavo A. Madero","45 m² lote, 1 rec., 1 baño",Aragón la Villa
"Increíble departamento de 75 m2, dividido en dos niveles, distribuido 2 recámaras, 12 baño, 1 baño completo, cocina eléctrica equipada, sala-comedor luminosa y acceso a área común. Diseño moderno, funcional y acogedor. Perfecto para empezar una nueva etapa de confort y armonía. Te va a encantar",https://www.inmuebles24.com/propiedades/clasificado/alclapin-departamento-renta-147302469.html,"MN 16,000","PROL. OPALO
Estrella, Gustavo A. Madero","75 m² lote, 2 rec., 1 baño",Aragón la Villa
"Precioso departamento con excelente ubicación, a media cuadra de Plaza Tepeyac. Conformado por una recámara con amplio clóset, sala, comedor, baño, cocina integral, área de lavado y zotehuela. El edificio tiene sólo 4 departamentos y está equipado con cisterna y tinacos. Cada departamento está equipado con gas natural, interfón y boiler independientes. Cercano a tiendas comerciales como: Walmart, Chedraui, Sam´s y Suburbia, a 5 minutos de la nueva plaza Parque Tepeyac; bancos, restaurantes, escuelas, hospitales, iglesia y parques. Colonia tranquila, estaciones de metro y metrobús cercanas, a pocos metros de vialidades como Calzada de Guadalupe. Misterios, F. C. Hidalgo y Talismán. Solicitar cita al no. Ver datos",https://www.inmuebles24.com/propiedades/clasificado/alclappa-cerca-plaza-tepeyac-147005661.html,"MN 9,500","Prol. Obsidiana
Estrella, Gustavo A. Madero",60 m² lote,Aragón la Villa
"Amplio con mucha luz, recámara con balcón. Sala, comedor amplio y muy iluminado, baño y cocina. Área de lavado y tendido. Gas de cilindro. Requisitos. Fiador con bienes raíces en la Ciudad de México. ine del fiador y arrendatario. 1 depósito y la renta del mes corriente. Comprobante de ingresos. 2 cartas de recomendación. Constancia laboral que incluya años laborados",https://www.inmuebles24.com/propiedades/clasificado/alclappa-excelente-departamento-en-renta-147059505.html,"MN 7,400","Zafiro 72
Estrella, Gustavo A. Madero","50 m² lote, 1 rec., 1 baño",Aragón la Villa
