Título,Enlace,Precio,Dirección,Características,Colonia de Origen
"Departamento de una habitación. Una recámara con closets de piso a techo, un baño completo con cancel de cristal templado, espaciosa estancia comedor, cocineta, cuarto de lavado con buena ventilación. Bodega en sótano. Roof privado con medio baño, barra, pisos deck, jardinera y conecciones para pantalla o bocinas. Un lugar de estacionamiento. Vigilancia 24 horas. Elevadores, salón de fiestas y un pequeño Gym. Mantenimiento incluido en el precio. Excelente ubicación sobre Avenida Aquiles Sérdan y a unas calles del centro y la alcaldia de Azcapotzalco, y del metro Camarones.",https://www.inmuebles24.com/propiedades/clasificado/alclapin-renta-lindo-departamento-con-roof-privado-146636551.html,"MN 14,000","Aquiles Serdan 671
Centro de Azcapotzalco, Azcapotzalco","75 m² lote, 1 rec., 1 baño, 1 estac.",Centro de Azcapotzalco
"Se renta departamento semi amueblado o sin amueblar, de 90 m2, tiene 3 recámaras con clóset, dos baños completos, sala, comedor, cocina integral, área de lavado integrada al departamento con lavasecadora de 20 kilos, un lugar de estacionamiento. El departamento se encuentra en tercer piso, el edificio cuenta con seguridad las 24 horas, se encuentra a 10 minutos caminando del metro camarones, cerca de plazas, mercado, bancos y avenidas principales como Camarones y Aquiles Serdán, y a 20 minutos en coche de Polanco. Inmobiliarias No se comparte comisión",https://www.inmuebles24.com/propiedades/clasificado/alclapin-departamento-muy-bien-ubicado-en-azcapotzalco-144035668.html,"MN 19,000","Miguel Hidalgo 21
Centro de Azcapotzalco, Azcapotzalco","89 m² lote, 3 rec., 2 baños, 1 estac.",Centro de Azcapotzalco
"Bonito departamento Remodelado en renta en Los Reyes, Azcapotzalco, cdmx, está en 4o piso sin elevador, muy iluminado, estacionamiento para un auto compartido. Vigilancia 24 hrs. Y cámaras de seguridad. Sala comedor corridos, área de cocina con tarja, alacena y estufa, área de lavado integrado, 2 recámaras con closet, un baño completo con cancel de cristal, bodega, pisos cerámicos en todo el departamento. Tiene gas natural, tinaco independiente, áreas verdes comunales. se acepta mascota pequeña. requisitos: Un mes de depósito, un mes por adelantado, Contrato por un año mínimo, inquilino y obligado solidario presentar ine y comprobante de ingresos, pago de protección jurídica anual de 3, 650",https://www.inmuebles24.com/propiedades/clasificado/alclapin-renta-depto-centro-azcapotzalco-cdmx-147381360.html,"MN 13,000","Trebol
Centro de Azcapotzalco, Azcapotzalco","70 m² lote, 2 rec., 1 baño, 1 estac.",Centro de Azcapotzalco
"Departamento en Renta en el centro de Azcapotzalco para 1 o 2 personas sin automovil ya que no hay lugares para auto. Es una calle cerrada de poco tránsito y cale muy estrecha este depto. Consta de una habitación con baño completo y otro espacio para colocar sala o comedor y una pequeña cocina. Ubicado en el 2do. Piso con buena iluminación y ventilación. El gas se maneja por cilindros y la luz el depto. Tiene su medidor propio. En la azotea se asigna lugar de tendido. Los requisitos son un año de contrato, 1 mes de depósito, renta del mes por adelantado, fiador con boleta predial al corriente y comprobantes de ingresos. Si no cuenta con fiador se reciben 2 depósitos en garantía. Para ver físicamente el lugar o mayores informes comunicarse al 55 Ver datos o vía Whatssapp.",https://www.inmuebles24.com/propiedades/clasificado/alclappa-departamento-en-renta-en-centro-de-azcapotzalco-147251635.html,"MN 7,000","2a. Cerrada La Concepción 4
Centro de Azcapotzalco, Azcapotzalco","33 m² lote, 1 rec., 1 baño",Centro de Azcapotzalco
"Características: Renta mn 13, 000. 00. Calle Nte. 87B, Col del Recreo, Azcapotzalco, Ciudad de México, cdmx, Recreo, Azcapotzalco. ""Disfruta de tu nuevo hogar"" Renta de Departamento en ubicación Estratégica. Calle Nte. 87B, Col. Del Recreo, Azcapotzalco, cdmx. (A un costado de la Colonia Clavería). Si estas buscando un lugar en céntrico en la zona de Azcapotzalco, esta es una excelente oportunidad. Disfruta de este departamento con una excelente distribución y ubicación. Cuenta con: Cocina integral equipada con barra y refrigerador. 2 recámaras ideales para tu confort. 1 pasillo que se puede usar como estudio o vestidor. 1 baño completo. Sotehuela (patio de servicio techado). Acabados de de tablaroca en la sala y cocina. Ubicado en un 3er nivel con 55 m² de espacio bien aprovechado, este departamento se encuentra a solo: 7 minutos del metro Camarones y Destino Azcapotzalco. 6 minutos del Parque Bicentenario. 4 minutos del Parque de la China y Plaza Patio Clavería. Requisitos (Mes de renta, deposito, estudio de inquilino). ¡No dejes pasar esta oportunidad! Agenda tu cita para conocer tu próximo hogar.",https://www.inmuebles24.com/propiedades/clasificado/alclapin-renta-de-departamento-en-el-recreo-azcapotzalco-un-146927219.html,"MN 12,500","calle norte 87b
Recreo, Azcapotzalco","56 m² lote, 2 rec., 1 baño",Centro de Azcapotzalco
