Título,Enlace,Precio,Dirección,Características,Colonia de Origen
"Renta de Departamento a estrenar en un Moderno Residencial, un hogar con los mejores acabados y excelente distribución. Ubicado estratégicamente para ofrecer fácil acceso y cercanía a importantes vías como Anillo Periférico. En su interior cuenta con un superficie total de 82. 02, siendo 77. 63 m2 habitables, balcón de 4. 39 m2 y bodega incluida. *Algunas imágenes son referenciales. *Precios sujetos a cambio sin previo aviso y sujetos a disponibilidad.",https://www.inmuebles24.com/propiedades/clasificado/alclapin-25-877-renta-departamento-av-revolucion-i-h-145209410.html,"MN 27,000","Avenida Revolución
San José Insurgentes, Benito Juárez","82 m² lote, 2 rec., 2 baños, 1 estac.",Crédito Constructor
"Vive en una de las colonias más exclusivas y mejor conectadas de la ciudad. A solo pasos de centros comerciales, Manacar, el Teatro Insurgentes y una amplia oferta cultural y gastronómica, este departamento te ofrece lo mejor de la vida urbana con la tranquilidad de una zona residencial. 3 recámaras, la principal con baño y vestidorLas recámaras secundarias comparten un baño completo2 lugares de estacionamiento independientesElevador, lobby y vigilancia 24/7Un espacio diseñado para quienes buscan comodidad, seguridad y, sobre todo, una ubicación inmejorable. Disponible en renta, listo para convertirse en tu próximo hogar.",https://www.inmuebles24.com/propiedades/clasificado/alclapin-departamento-en-san-jose-insurgentes-en-renta-147451009.html,"MN 35,000","San José Insurgentes, Benito Juárez
San José Insurgentes, Benito Juárez","130 m² lote, 3 rec., 2 baños, 2 estac.",Crédito Constructor
"Departamento interior de 82, 02 m2 totales, 2 recamaras con closet, 2 baños completos, la habitación principal tiene baño privado, estancia - comedor, cocina integrada con estufa y campana, closet de lavado, 1 cajón de estacionamiento independiente, 1 bodega de 2, 65 m. Su ubicación te permite estar muy cerca de la Universidad Panamericana (a unos 10 minutos caminando), tiendas de conveniencia, colegios, supermercados, plazas comerciales, vías principales de comunicación, transporte público, estación de metro, trolebús, hospitales y más. El edificio esta a estrenar, tiene 7 niveles de departamentos más el nivel de los roof top privados, son 4 departamentos por piso, 3 tipologías de departamentos exteriores y 1 interior, para un total de 28 departamentos, todos tienen 1 cajón de estacionamiento independiente más 1 bodega. Al estacionamiento se accesa mediante elevador de auto y tiene 3 niveles de sótano. Tiene lobby con recepción, 2 elevadores, gas natural, no tiene amenidades ni roof garden común. Hay posibilidad de rentar con electrodomésticos (refrigerador, microondas y centro de lavado) por costo adicional. Se renta sin muebles. Precios y disponibilidad sujetos a cambio sin previo aviso",https://www.inmuebles24.com/propiedades/clasificado/alclapin-departamento-en-benito-juarez-san-jose-insurgentes-144678983.html,"MN 27,000","Avenida Revolución
San José Insurgentes, Benito Juárez","82 m² lote, 2 rec., 2 baños, 1 estac.",Crédito Constructor
