Título,Enlace,Precio,Dirección,Características,Colonia de Origen
"Departamento en renta en Arquimedes, a unos metros de mazaryk. Excelente ubicación. Entre Horacio y Presidente MasarykA media cuadra del metro PolancoPolanco V secciónEdificio pequeño, en ese piso es el único departamento x lo que el elevador tiene clave para acceder. Construcción 137mSala-ComedorCocinaRecamara principal con baño, vestidor y pequeño balcón Recamara secundaria, con closet Baño Completo que da servicio a la recamara secundaria y al área social. 2 estacionamientosCuarto de lavado con baño de serviciopiat convierte a clientes informados y conocedores, en dueños, vendedores e inversionistas exitosos.",https://www.inmuebles24.com/propiedades/clasificado/alclapin-departamento-en-renta-en-polanco-147384094.html,"MN 48,000","Arquimedes 95
Polanco, Miguel Hidalgo","137 m² lote, 2 rec., 2 baños, 2 estac.",Culhuacán CTM Sección VI
"Ubicada en una de las zonas de mayor plusvalía en Cancún, esta casa de estilo mexicano contemporáneo combina confort, amplitud y diseño funcional en un entorno tranquilo y seguro. Su privilegiada ubicación en una privada cerrada con acceso controlado permite una conexión, segura y rápida con las avenidas principales de la ciudad, la Riviera Maya, el Aeropuerto de Cancún y la Zona Hotelera. Características principales: 3 recámaras. 4 y medio baños. Cocina integral con equipo de cocina. Comedor. Sala. Cuarto de servicio y área de lavado. Terraza techada con pilares de cantera. Alberca climatizada. Balcón. Dos jardines (uno interno y otro externo) con 56 m2. Bodega. Estacionamiento cubierto para 2 autos. Con 315 m² de construcción en dos niveles, esta propiedad ofrece espacios amplios, privacidad y una distribución pensada para el confort. Su alberca climatizada, áreas verdes y acabados de calidad la convierten en una opción ideal para quienes buscan una residencia exclusiva en Cancún.",https://www.inmuebles24.com/propiedades/clasificado/veclapin-departamento-en-venta-cancun-quintana-roo-146092974.html,"MN 37,000","AV ACANCEH
Supermanzana 12, Cancún","300 m² lote, 3 rec., 4 baños, 2 estac.",Culhuacán CTM Sección VI
Departamento en Renta e Arboleda. eexclusivo diseño y ubicacion premium en un solo lugar. 1 recamara. 1 baño completo. Finos acabados de alta calidad. totalmete equipado y amueblado. Amenidades. *Cowork. *Gym. *Areas de asadores. *Salones de eventos. *Ludoteca. *Alberca. *Sport room,https://www.inmuebles24.com/propiedades/clasificado/alclapin-departamento-en-renta-arboleda-en-san-pedro-garza-g.-146819913.html,"MN 48,000","Valle del Campestre
Balcones Del Campestre, San Pedro Garza García","67 m² lote, 1 rec., 1 baño, 1 estac.",Culhuacán CTM Sección VI
"Exclusivo departamento en renta ubicado en el prestigioso desarrollo de Aleden Puerta. Este inmueble ofrece un diseño moderno y elegante, con detalles de alta calidad que lo convierten en la opción ideal para quienes buscan un estilo de vida sofisticado y cómodo. Situado en Aleden Puerta, una zona reconocida por su tranquilidad y accesibilidad, este departamento ofrece fácil acceso a las principales vías de comunicación, así como proximidad a centros comerciales, escuelas, y áreas recreativas. Su ubicación estratégica lo convierte en un hogar perfecto para familias y profesionales. El departamento cuenta con acabados de alta calidad y un diseño contemporáneo que maximiza la luz natural y las vistas panorámicas. Los amplios ventanales en la sala y las habitaciones principales permiten disfrutar de la tranquilidad del paisaje circundante, creando un ambiente sereno y acogedor. Cuenta con 134m2. 3 habitaciones. 2 baños y medio. Área de sala comedor. Amplia terraza con vistas a áreas verdes. 2 cajones de estacionamiento. Bodega. Las áreas comunes del edificio están diseñadas para ofrecer el máximo confort, con amenidades de primer nivel que incluyen: amenidades: -alberca infiniti. -asadores. -salón de eventos. -gym. - área comercial. - oficinas. hace que este departamento sea ideal para quienes buscan una vida moderna y sofisticada.",https://www.inmuebles24.com/propiedades/clasificado/alclapin-exclusivo-departamento-en-renta-en-puerta-de-hierro-147293748.html,"MN 40,000","Av universidad #1011 esq. con Juan Palomar, Vallarta Universidad, Zapopan
Puerta de Hierro, Zapopan","129 m² lote, 2 rec., 2 baños, 2 estac.",Culhuacán CTM Sección VI
"Ubicado en una zona previlegiada, las amenidades que integran a Torre Patria 2644. conviven naturalmente en una atmósfera que inspira tranquilidad, equilibrio y paz, El edificio cuenta con un conjunto de amenidades que lo hacen excelente opción lobby Coworking, Ludoteca, Salón de eventos, Gimnasio, Pet park, asadores, alberca, fire pit, juegos infantiles, vigilancia 24/7 gracias a su ubicación vivirás cerca de centros comerciales, farmacias, bancos, tiendas de conveniencia, a menos de 5 minutos, con sencillas rutas de acceso. El departamento cuenta con 2 recamaras, la principal con baño y closet y aire acondicionado, la segunda con closet y un baño completo a compartir con visitas, cocina integral con barra de granito, estufa con horno y campana extractora, sala, comedor, patio de servicio con lavadero y espacio para un centro de lavado, 2 cajones de estacionamiento. El precio ya incluye mantenimiento.",https://www.inmuebles24.com/propiedades/clasificado/alclapin-departamento-nuevo-en-renta-colomos-providencia-146167309.html,"MN 24,000","AV PATRIA
Colomos Patria, Zapopan","70 m² lote, 2 rec., 2 baños, 2 estac.",Culhuacán CTM Sección VI
Departamentos A estrenar desde 369M2 A 407M2 con acabados de lujo E increible terraza con vista al campo de golf Y A la ciudad. unicamente 24 departamentos. Cuentan con 3 recamaras cada una con vestidor Y baño completo. cocina integral equipada con electrodomesticos. sala comedor con acceso A terraza. medio baño de visitas. sala de tv. 4 cajones de estacionamiento. bodega. areas comunes. sala de choferes. gimnasio. alberca climatizada. bar. business center. asadores. squash. salon de eventos,https://www.inmuebles24.com/propiedades/clasificado/veclapin-estrena-depto-triple-aaa-de-lujo-con-increibles-142669814.html,"MN 106,000","TORRE ROMA BOSQUE REAL
Bosque Real, Huixquilucan","369 m² lote, 3 rec., 3 baños, 4 estac.",Culhuacán CTM Sección VI
"Renta depto en la Col. Doctores, Cuauhtémoc, cdmx. Se renta departamento nuevo, tipo loft en la Colonia Doctores, dentro del Condominio Vía Roma, justo frente a la Colonia Roma Norte, en una ubicación privilegiada rodeada de restaurantes, comercios, gimnasios, bancos y todo lo necesario para disfrutar la vida de barrio. Además, cuenta con excelentes vías de acceso y transporte público muy a la mano. El loft tiene una superficie de 40 m2; y balcón. Es un espacio muy iluminado y con excelente ventilación. Es interior y se encuentra en el 4º piso, lo que lo hace silencioso y tranquilo. Cuenta con techos altos que aportan mayor amplitud al espacio, así como pisos de madera de ingeniería. La cocina es abierta y de buen tamaño, con espacio de almacenamiento, barra de granito para desayunador y área de lavado. El baño completo tiene cancel de vidrio templado, y la zona de recámara dispone de un amplio clóset. Incluye un lugar de estacionamiento en tándem, compartido únicamente con un vecino. El condominio ofrece vigilancia 24/7 todo el año, elevador, terraza interior, zona de coworking y descanso, gimnasio, Roof Garden común con terraza, alberca y área verde con pérgolas. Además, el Roof está equipado con muebles de jardín, sombrillas, camastros, zona de asador y baños. Cuota de mantenimiento 1, 700. 00. ¡No pierdas la oportunidad de conocerlo! Este loft es ideal para quienes buscan comodidad y una ubicación inmejorable cerca de una de las zonas más codiciadas de la Ciudad de México. No se aceptan mascotas. Contáctanos para más información. Previa Cita. Rodrigo vb",https://www.inmuebles24.com/propiedades/clasificado/alclapin-renta-departamento-en-la-col.-doctores-cuauhtemoc-146959098.html,"MN 19,100","Avenida Cuauhtémoc
Doctores, Cuauhtémoc","40 m² lote, 1 rec., 1 baño, 1 estac.",Culhuacán CTM Sección VI
"Lindo departamento de 85 m², súper ubicado en la calle de Adolfo Prieto en la colonia del Valle. distribuido en un solo nivel con dos recámaras Y dos baños completos. cuenta con estancia, sala, comedor, de muy buen tamaño. cocina integral, abierta con mucho espacio de guardado. área de lavado Y un cajon de estacionamiento",https://www.inmuebles24.com/propiedades/clasificado/alclapin-lindo-y-moderno-departamento-en-adolfo-prieto-de-85-147449908.html,"MN 28,000","ADOLFO PRIETO 1442
Del Valle Norte, Benito Juárez","85 m² lote, 2 rec., 2 baños, 1 estac.",Culhuacán CTM Sección VI
"Renta de departamento en punta mayor 2 recamaras. 2 baños completos. sala. comedor. cocina integral. lavadora, refrigerador, utencilios de cocina, casa club con gym salon de usos multiples. elevador. cajon de estacionamiento. vigilancia 24 hrs. manejamos varias opciones. con servicios incluidos",https://www.inmuebles24.com/propiedades/clasificado/alclapin-renta-de-departamento-amueblado-en-punta-mayor-2-146092193.html,"MN 25,000","VALLE DEL CAMPESTRE
Valle del Campestre, León","70 m² lote, 2 rec., 2 baños, 2 estac.",Culhuacán CTM Sección VI
"Tu hogar a primera vista… Con proximidad a plaza Artz, plaza Santa. Teresa, tv Azteca escuelas Liceo Japonés, Aleman, La Salle. Piso alto, con vista a la reserva. Amenidades: -Alberca cubierta, con regaderas y vestidor. -Gimnasio equipado. -Spinning, spa. -Ludoteca. -Salón de eventos. -Salon de adultos. -Cancha de padel. -Sala. -Comedor. -Cocina abierta, con placa de granito. - 2 recamaras, la principal con vestidor. -2 baños completos. -Sala de tv. -Cuarto de lavado con espacio para lavadora y secadora. -Medio baño de servicio. -2 estacionamientos",https://www.inmuebles24.com/propiedades/clasificado/alclapin-departamento-en-renta-jardines-del-pedregal-be-grand-147442171.html,"MN 35,000","Anillo Periferico 3996
Jardines del Pedregal, Alvaro Obregón","136 m² lote, 2 rec., 2 baños, 2 estac.",Culhuacán CTM Sección VI
