Título,Enlace,Precio,Dirección,Características,Colonia de Origen
"Renta sin Aval en 24 horas. Proceso ágil y flexible. / Lease without guarantor with agile and flexible processes in 24 hours. Opción de departamentos amueblados por Bo-Concept. / Furnished apartments by Bo-Concept available. Todos los departamentos incluyen electrodomésticos. (microondas, lava-secadora, Refrigerador, estufa con horno, lavavajillas) persianas / canceles. All apartments include appliances. (microwave, washer-dryer, refrigerator, stove with oven, dishwasher) blinds / gates. ! estrena depa en la Torre mas emblemática de la cdmx! Brand new apartments just released to the market in the most iconic tower in cdmx. Departamentos tipo: Loft, 1 y 2 recámaras; a un minuto de Bosques de las Lomas y Arcos Bosques (El Pantalón) en medio de escuelas, universidades, hospitales, centros comerciales y toda la oferta de servicios que ofrecen Santa Fe y Bosques. Potencializa tu vida con nuestras amenidades: Alberca. Co-Working. Bar. Cafetería. Salón de Fiestas. Game Room. Chill Spot. Pet Zone. Área de asadores con fogateros. Gimnasio. Yoga Room. Motor Lobby. Sala de recepción. Concierge Vigilancia 24hrs. cctv. Shuttle que te conecta con los principales puntos de la cdmx y Santa Fe. Renta sin aval; Departamentos nuevos, Totalmente equipados con electrodomesticos nuevos, agenda una cita y prepara todo para estrenar! !",https://www.inmuebles24.com/propiedades/desarrollo/ememvein-ri-a-bosques-renta-y-estrena-nuestros-depas.-loft-1-141933064.html,"MN 19,800","carretera mex - tol 1535
Santa Fe Cuajimalpa, Cuajimalpa de Morelos","455 un., 1 a 2 rec., 57 m² lote",Culhuacán CTM Sección VI
"Hermoso y moderno departamento amueblado con excelentes acabados de pisos de madera y dos terrazas, Son 250M2, con 2 recamaras y 1. 5 baños completos, amplia sala y comedor que da a una terraza, la cocina tiene mucha luz y esta equipada con refrigerador, lavaplatos, 2 recamaras cada una con closet de pared y baño, la principal con Terraza, El área de servicio esta en una zona separada, cuenta con un dormitorio, 1 baño completo. El edificio cuenta con vigilancia las 24 horas y el departamento cuenta con dos lugares de estacionamiento",https://www.inmuebles24.com/propiedades/clasificado/alclapin-renta-departamento-amueblado-con-terraza-en-polanco-147033810.html,"MN 85,000","Galileo
Polanco, Miguel Hidalgo","250 m² lote, 2 rec., 1 baño, 2 estac.",Culhuacán CTM Sección VI
"Tu nuevo depa en Nápoles, cdmx – Cerca del wtc y listo para ti️ ¿Buscas comodidad, estilo y ubicación en un solo lugar? Este departamento en renta en la colonia Nápoles tiene todo lo que necesitas: a solo unos pasos del World Trade Center, muy cerca de la Del Valle y rodeado de cafés, restaurantes y todo lo que te gusta. Renta sin complicaciones: ️ Sin aval. ️ Sin fianza. ️ Renta en 24 horas. Lo que incluye tu nuevo hogar: Espacios modernos y funcionales. Opción amueblado. Internet de alta velocidad incluido. Cocina equipada. Seguridad 24/7. Estacionamiento (sujeto a disponibilidad) Amenidades que elevan tu día a día: Coworking y salas de juntas. Cine privado y sala de juegos. Terraza con asadores. Gimnasio y área de yoga. Zona pet friendly. Elige entre estudios o departamentos de 1 y 2 recámaras, todos dentro de un edificio moderno, con diseño vanguardista y ambiente profesional.",https://www.inmuebles24.com/propiedades/desarrollo/ememvein-departamento-en-renta-en-la-napoles-del-valle-144568092.html,"MN 20,000","amalia by urbanista
Nápoles, Benito Juárez","199 un., 1 a 2 rec.",Culhuacán CTM Sección VI
"Espectacular Departamento totalmente amueblado y Decorado en Renta ubicado en el piso 30 en Torre Metropolitan Valle Oriente. Totalmente amueblado y decorado, recién remodelado, 167 mts. 3 recamaras con baño y walkin closet. Terraza. Lavanderia. Sala. Comedor. Seguridad 24/7. Accesos controlados. Bell boy. Bodega. Amenidades dentro del edificio. Alberca, salón de eventos, sala de juntas, salones de juegos, área de niños, asadores, jardines. Los mejores restaurantes tiendas, cafés, colegios, comercios, a unos pasos. 85, 000 con mantenimiento incluido",https://www.inmuebles24.com/propiedades/clasificado/alclapin-departamento-amueblado-en-renta-metropolitan-valle-147357926.html,"MN 85,000","Av Lázaro Cárdenas 2400, Valle Oriente, 66260 San Pedro Garza García, N.L.
Valle Oriente, San Pedro Garza García","167 m² lote, 3 rec., 3 baños, 2 estac.",Culhuacán CTM Sección VI
"Sé el primero en experimentar la vida de lujo en Gran Ciudad Nuevo Polanco. Departamentos en renta a estrenar con amenidades inigualables. Reserva tu departamento hoy mismo y disfruta de beneficios especiales. Deja tu información de contacto, ¡nuestro equipo se pondrá en contacto contigo en breve! Elige tu nuevo departamento: Estudios: desde $24, 300 mxn. Departamento de 1 Recámara: desde $27, 500 mxn. Departamento de 2 Recámaras: desde $36, 000 mxn. *Contamos con espacio de estacionamiento y bodega para renta. Contamos con una ubicación privilegiada en Av. Río San Joaquín #498, Col. Ampliación Granada, a tan solo un par de calles del Museo Soumaya, y los centros comerciales Antara Fashion Hall y Miyana. Reserva tu departamento y pregunta por nuestras promociones vigentes.",https://www.inmuebles24.com/propiedades/desarrollo/ememvein-gran-ciudad-nuevo-polanco-144968760.html,"MN 24,300","Río San Joaquín 498, Ampliación Granada, CDMX
Polanco, Miguel Hidalgo","329 un., 1 a 2 rec.",Culhuacán CTM Sección VI
"Exclusivo Departamento Penthouse, venta/renta, frente al mar, 5 Recámaras, 2 Niveles, Piscina, Jacuzzi, Muelle, Isla Mujeres, Quintana Roo. Con muelle exclusivo para barco de 50 pies. el valor está expresado en dolares. Es negociable y damos facilidades de pago acorde a la propuesta que presenten. La Residencia disponible, Penthouse ofrece: • 18 metros de frente de mar. • Acabados de lujo. • Es un Penthouse de 820 m2 en dos niveles: Planta Baja de 517 m2 y Planta Alta de 303m2. • 5 recámaras y 6 ½ baños. • Alberca privada en la terraza de planta baja y espectacular jacuzzi en la segunda planta. • Ventanas panorámicas y anticiclónicas. • Elevador de acceso directo en ambas plantas. • Elevador de servicio• Cuarto de servicio con baño privado. • Cuarto de lavado y planchado. • Alacena. • Estacionamiento techado en planta baja. • Bodega privada. • Estacionamiento para automóvil adicional en el exterior. Residences y Marina representa un estilo de vida que fusiona el lujo, la exclusividad y laseguridad en una inigualable ubicación frente al mar en la bella y pintoresca Isla Mujeres. Siete residencias frente al mar y hermosas vistas lograrán que cada minuto de estancia en este lugarprivilegiado, sea memorable. El desarrollo residencial ofrece su propia marina, espectaculares jardines, alberca frente al mar yplaya privada, Gimnasio, Bar, rodeado por la flora y los manglares típicos de esta zona. Al ubicarse en una pequeña isla y ofrecer únicamente 5 residencias y 2 pent-house, residenses y marina estádestinado a ser el proyecto residencial náutico más exclusivo, pacífico y seguro de todo México. Isla Mujeres se encuentra a sólo 18 minutos en ferry de Cancún, tiene un Aeropuerto Internacionalcon la mejor conectividad nacional e internacional de México. residences y marina te ofrece: • 4, 000 m2 entre el mar turquesa y el verde de la laguna. • 40 metros de frente de playa. • Marina privada con todos los servicios a 100 metros del Condominio en la Laguna Makax. • Sistema de seguridad en toda la propiedad. • Caseta de seguridad 24 horas. • Atracadero de arribo en la playa para embarcaciones menores de 6 metros de eslora. Adicionalmente• Oficina administrativa. • Cuarto de máquinas. • Área de empleados con baños y vestidores. • Cuarto refrigerado para basura. • Bodega de mantenimiento. • Subestación eléctrica. • Cuarto hidráulico. pideme cita con llamada ó mensaje Whatsapp;Celulares: Ver datos y Ver datosAtención Inmediata de alejandro manzanillaasesor inmobiliario certificado",https://www.inmuebles24.com/propiedades/clasificado/alclapin-departamento-penthouse-ocean-front-venta-renat-5-144089433.html,"USD 21,999","Departamento Penthouse en Venta/renta, Frente al Mar, 5 Recamaras, Isla Mujeres, Q. Roo
Lagunamar, Isla Mujeres","870 m² lote, 5 rec., 6 baños, 3 estac.",Culhuacán CTM Sección VI
"¡Descubre el departamento de tus sueños! En Puerta Alameda. Este elegante espacio de 86 m² ofrece un ambiente acogedor y sofisticado. Con 2 recámaras y 2 baños, es perfecto para quienes buscan comodidad y estilo. Los acabados de lujo y el mobiliario cuidadosamente seleccionado crean un ambiente moderno y funcional. Características destacadas: - Espacios amplios y luminosos: La sala y comedor cuentan con un diseño abierto que maximiza la luz natural. - Cocina integral: Perfecta para los amantes de la gastronomía. - Amenidades exclusivas: Disfruta de la alberca, gimnasio, y salón de fiestas. - Seguridad y comodidad: Seguridad 24 horas, circuito cerrado, y estacionamiento techado. - Áreas recreativas: Jardín, área de juegos infantiles, y terraza para relajarte. - Servicios adicionales: Centro de negocios, bodega, y patio de lavado. Frente a la Alameda Central, a 100 metros del Palacio de Bellas Artes, inmediato a la Calle de Madero que es la zona peatonal mas transitada de la cdmx y 5 calles de Av Paseo De La Reforma. Este departamento es más que un lugar para vivir, es un estilo de vida. ¡No dejes pasar esta oportunidad única! wig: pjopwE0",https://www.inmuebles24.com/propiedades/clasificado/alclapin-departamento-colonia-centro-147421254.html,"MN 26,000","Revillagigedo 18
Centro , Cuauhtémoc","89 m² lote, 2 rec., 2 baños, 2 estac.",Culhuacán CTM Sección VI
Rentaplazacarso. com. departamento de 60 M2: completamente amueblado Y equipado. Amplia sala. Linda cocina abierta. Area de lavado. Recamara con vestidor. Espacioso baño. Techos de 3 metros que le dan mucha luz. Vistas al jardin. 1 cajon de estacionamiento. Acceso directo al centro comercial. Completo conjunto de amenidades. Vigilancia 24 horas. Estacionamiento para visitas. Perfecta ubicacion. Servicios incluidos en el precio. Mantenimiento incluido en la renta.,https://www.inmuebles24.com/propiedades/clasificado/alclapin-nuevo-polanco:-amueblado-de-1-recamara-66339900.html,"MN 35,000","LAGO ZURICH 245
Polanco, Miguel Hidalgo","60 m² lote, 1 rec., 1 baño, 1 estac.",Culhuacán CTM Sección VI
"Departamento nuevo equipado en Anida. Zona: Santa María / Valle norte. 150m2. Desarrollo exclusivo ubicado a un lado del puente atirantado y a 5 min. De Calzada San Pedro con seguridad 24 hrs y acceso controlado. Estacionamiento privado 2 autos. Lobby con concierge. Elevadores. solo equipado. El departamento cuenta con: Recibidor. Cocina integral equipada con barra desayunadora. Comedor. Sala amplia con salida a terraza. 2 Recámaras. 2 Baños completos. Terraza exclusiva de 50m2 con barra de asasor, solamente para el departamento. Cuarto de lavado. Bodega. Amenidades: Alberca. Salas sociales. Business center. Asadores. Gimnasio (en proceso) Ludoteca etc.",https://www.inmuebles24.com/propiedades/clasificado/alclapin-departamento-renta-anida-en-santa-maria-en-monterrey-146739659.html,"MN 39,800","Dirección no informada
Santa María, Monterrey","145 m² lote, 2 rec., 2 baños, 2 estac.",Culhuacán CTM Sección VI
"Vía del Bosque: Lujo Vertical en el Corazón de Zapopan. Vive en Vía del Bosque, el desarrollo residencial que redefine la vida urbana en Distrito Andares. Con 166 residencias exclusivas distribuidas en 34 niveles, este proyecto ofrece vistas panorámicas de 180°, acabados premium y amenidades excepcionales: **Amenidades de lujo: 3 pisos de amenidades como alberca, gimnasio, coworking, terraza con asadores, lounge en el nivel 24 y mucho más. **Diseño innovador de la firma gds Global Design Studio, fusionando modernidad y estilo. **Ubicación estratégica: cerca de Andares, universidades, hospitales y las zonas de mayor plusvalía en Zapopan. **Espacios únicos: private dining, guest suite para visitas, y áreas comerciales al pie del edificio.",https://www.inmuebles24.com/propiedades/clasificado/alclapin-departamento-en-renta-en-via-del-bosque-146905025.html,"MN 55,000","Av. Universidad 325
Jardines Universidad, Zapopan","179 m² lote, 3 rec., 3 baños, 3 estac.",Culhuacán CTM Sección VI
"Renta Departamento se encuentra en el Piso 1 donde ya desde ahi tienes vistas espectaculares ya que se encuentra a una altura estrategica para que tengas vistas inigualables de Amirá Residencial, un exclusivo desarrollo de lujo en la Zona Diamante de Querétaro. Con acabados de alta calidad y una distribución moderna, el departamento cuenta con una cocina equipada con cubierta de granito, además de un cuarto de lavado independiente. La sala y el comedor se conectan a un amplio balcón que ofrece una inigualable vista panorámica, a la que acceden a 3 recámaras. La recámara principal incluye un vestidor y su baño con doble lavabo, y las 2 recamaras secundarias cada una con su baño con su closet ambos baños tienen canceles de vidrio templado y los pisos de mármol aportan un toque de sofisticación y lujo a todo el espacio. Cuenta con Aire acondicionado en cada recamara asi como en sala y comedor. Cuenta con 2 cajones de estacionamiento techados. Amirá Residencial es un desarrollo de departamentos de lujo con una ubicación estratégica en el corazón de Querétaro, a solo 3 minutos de Bernardo Quintana y 2 minutos del anillo vial Fray Junípero Serra, cerca de escuelas, hospitales y la exclusiva zona de El Campanario. Características del Desarrollo: Arquitectura de vanguardia y acabados de lujo. 246 viviendas distribuidas en 19 niveles. Iluminación y ventilación natural en todos los departamentos. Amplias terrazas con espectaculares vistas panorámicas de la ciudad de Querétaro. Amenidades Exclusivas: Alberca y jacuzzi. Gimnasio con área de pesas y cardio. Salón de actividades deportivas. Spa con sauna, vapor y baños. Snack-bar lounge y salón de eventos. Ludoteca y cancha de pádel. ¡Las mejores vistas panorámicas de la ciudad! El departamento se entrega con cocina equipada y closets. Torre moderna con seguridad las 24 horas, brindando confort y exclusividad a sus residentes. Requisitos; Deposito, renta y poliza juridica del 35% del valor de la renta. Agenda una cita para conocer este increíble departamento, ¡te encantará!",https://www.inmuebles24.com/propiedades/clasificado/alclapin-renta-departamento-en-amira-residencial-zona-diamante-146365130.html,"MN 25,000","AMIRA RESIDENCIAL
Balcones Coloniales, Querétaro","173 m² lote, 3 rec., 3 baños, 2 estac.",Culhuacán CTM Sección VI
"Hermoso Y moderno departamento en renta sin muebles, ubicado en montebello; consta de 2 habitaciones con baño Y closets vestidos; amplia sala-comedor con ventiladores, terraza con bella panorámica; cocina vestida con estufa electrica; aire acondicionado en recámaras, cortinas black-out. amenidades como: rooftop con piscina. Zona de asadores. Sports bar. Cinema room. Workcenter. Business room. Yoga terrace. Cardio room. Elevadores. Estacionamiento techado Y portón eléctrico para dos autos. La renta incluye cuota de mantenimiento.",https://www.inmuebles24.com/propiedades/clasificado/alclapin-departamento-en-renta-sin-muebles-147419627.html,"MN 16,000","CALLE 16
Fraccionamiento Montebello, Mérida","117 m² lote, 2 rec., 2 baños, 2 estac.",Culhuacán CTM Sección VI
"Espectacular departamento en la mejor zona de Polanco: remodelado, sumamente amplio e iluminado, en el corazón de Polanco, en una calle tranquila y bonita. A 2 cuadras del Palacio de Hierro, ubicado entre las 2 calles principales y más bonitas de la colonia (homero y Horacio), a dos cuadras de Masaryk, la calle más exclusiva de Latinoamérica. 290m2 Remodelado. Se puede Rentar Amueblado o sin Amueblar. 3 recamaras muy amplias: La principal con vestidor de gran tamaño y baño completo, la secundaria con walking closet y baño completo. La tercera con closet y baño completo exterior (se recomienda para bebé o para hacer un estudio) Family room (ideal para sala de tv, juegos, tareas, estudio, etc) 2 salas. Comedor. Desayunador independiente a la cocina. Cocina sumamente amplia con alacena grande. Área de bar. Baño de visitas. Terraza de muy buen espacio para disfrutar un desayuno, un café, una buena plática, etc. Hidroneumático, el agua sale con excelente presión en regaderas y todo el sistema hidráulico. Ventanas grandes, todas con persianas de alta calidad. Muy buena iluminación durante todo el día en todos los cuartos. 1 cajón de estacionamiento. Cuarto de Servicio independiente y amplio en la azotea, no está dentro del departamento, lo que da mayor privacidad. Tendedero y área de lavado. Doble boiler de paso. No tiene elevador, pero son solo 3 pisos. Hay muchos beneficios en la salud cuando se suben escalones diarios ;) Esta zona no tiene parquímetros en fines de semana, es muy cómodo para recibir visitas. La calle es vigilada 24/7 por caseta de policía estatal con radio y arma, se paga cuota y se mantiene muy segura. Solamente 1 departamento por piso, los vecinos de abajo son sumamente amables y tranquilos. Son adultos sin hijos.",https://www.inmuebles24.com/propiedades/clasificado/alclapin-departamento-renta-col.-polanco-146483100.html,"MN 100,000","Edgar Allan Poe
Polanco, Miguel Hidalgo","290 m² lote, 3 rec., 4 baños, 1 estac.",Culhuacán CTM Sección VI
"Departamento amueblado de 1 recámara en Plaza Carso ii: ¡tu nuevo hogar te espera! Descubre la comodidad y el lujo en este departamento amueblado de 1 recámara en el prestigioso Plaza Carso ii. Con 70. 58 m², este espacio está diseñado para ofrecerte el máximo confort y se entrega completamente equipado, listo para que te mudes. Detalles del Departamento. * 1 recámara. * 1 baño completo. * Sala (incluye un práctico sofá-cama matrimonial) * Comedor. * Cocina abierta. * Cuarto de lavado. * 1 cajón de estacionamiento. Amenidades Exclusivas. Vive una experiencia única con las amenidades de primer nivel que ofrece el complejo, ideales para tu bienestar y entretenimiento: * Recepción y business center. * Alberca techada. * Gimnasio (con área de baños, regaderas y vapor) * 2 canchas de pádel. * Jardín con juegos infantiles. * Terrazas y 2 salones de fiestas. * Ludoteca y salón de juegos (con mesa de billar, etc. ) * Motor lobby. * Vigilancia 24 horas. *Ubicación Privilegiada. El departamento se encuentra en Plaza Carso ii, en la dirección (Aquí va la dirección correcta). Disfruta de la conveniencia de vivir cerca de oficinas, centros comerciales, restaurantes y todo lo que la zona tiene para ofrecer. ¡No dejes pasar esta oportunidad! Contáctanos para agendar una visita y conocer tu próximo hogar.",https://www.inmuebles24.com/propiedades/clasificado/alclapin-en-renta-departamento-carso-ampliacion-granada-147342741.html,"MN 39,000","Calle Lago Zurich
Ampliación Granada, Miguel Hidalgo","70 m² lote, 1 rec., 1 baño, 1 estac.",Culhuacán CTM Sección VI
"Departamento en renta o venta de 125 metros: - 3 Habitaciones. - 2 Baños completos. - Sala y Comedor. - Tereza. - Cocina Integral. - Área de lavado. - 2 lugares de estacionamiento. Ludoteca, Salón de Adultos, Asadores, salón de eventos, área de mascotas.",https://www.inmuebles24.com/propiedades/clasificado/veclapin-departamento-en-venta-o-renta-en-bosque-real-con-vista-147142019.html,"MN 28,500","Avenida del Conocimiento 14
Bosque Real, Huixquilucan","125 m² lote, 3 rec., 2 baños, 2 estac.",Culhuacán CTM Sección VI
"Departamento en venta Y renta en excelente estado de conservación, se encuentra en la Colonia Mixcoac en la calle de Giotto. Tiene 80 m2 habitables, cuenta con estancia y comedor, dos recámaras, dos baños completos, es interior, no cuenta con elevador, está en un segundo nivel y cuenta con tres estacionamientos, independientes, en la azotea cuenta con roof garden y asador para tus reuniones familiares, tiene área de lavado y jaula de tendido.",https://www.inmuebles24.com/propiedades/clasificado/alclapin-departamento-venta-renta-giotto-mixcoac-146703909.html,"MN 20,000","GIOTTO 52
Mixcoac, Benito Juárez","80 m² lote, 2 rec., 2 baños, 3 estac.",Culhuacán CTM Sección VI
"Departamento en Renta en Torre Viena, cuenta con 2 habitaciones la principal con baño propio, 2 baños completos y 2 estacionamientos, el edificio ofrece seguridad 24 hrs, estacionamiento de visitas, alberca, gimnasio, salon de eventos, canchas de paddel, area de mascotas, salas de juntas, a unos pasos de plaza Carso, Antara y Miyana, supermercados, bancos, museos",https://www.inmuebles24.com/propiedades/clasificado/alclapin-renta-de-departamento-torre-viena-147171764.html,"MN 30,000","Lago Zurich 243
Ampliación Granada, Miguel Hidalgo","80 m² lote, 2 rec., 2 baños, 2 estac.",Culhuacán CTM Sección VI
"Departamento de lujo amueblado en esquina en Riva Residencial, Puerto Cancún. Vive el equilibrio perfecto entre exclusividad, diseño y ubicación en este espectacular departamento en Riva Residencial, dentro de Puerto Cancún, uno de los desarrollos más prestigiosos del Caribe Mexicano. Rodeado de marinas, campos de golf y justo al lado de la plaza comercial más exclusiva de la ciudad, Riva ofrece una experiencia de vida única en un entorno privilegiado. Características principales: 151 m² de superficie. Departamento en esquina. Totalmente amueblado y listo para habitar. 2 recámaras. 2 baños completos. Cuarto de servicio con baño (opción a tercera recámara) Cocina integral moderna. Sala y comedor con diseño de concepto abierto. Amplias terrazas. Cuarto de lavado. Riva destaca por su arquitectura contemporánea, seguridad y su ubicación inmejorable dentro de Puerto Cancún. Aquí encontrarás tranquilidad, privacidad y acceso inmediato a las mejores experiencias de la ciudad: marina, centro comercial, restaurantes y espacios naturales. Una excelente opción para vivir o invertir en una propiedad de alta plusvalía.",https://www.inmuebles24.com/propiedades/clasificado/veclapin-departamento-en-venta-y-renta-riva-puerto-cancun-147274404.html,"MN 65,000","riva
Zona Hotelera, Cancún","151 m² lote, 2 rec., 2 baños, 1 estac.",Culhuacán CTM Sección VI
"Hermoso en Polanco con 3 Recamaras Terraza Privada. Ubicado en Polanco, Departamento de Lujo, Alquiler, inmediato Periférico, Ejercito Nacional, Circuito Interior, Lomas de Chapultepec, Polanco, Plaza Carso los mejores Centros Comerciales y Corporativos, Estilo Contemporáneo y Minimalista, precioso, finos acabados en madera italiana, mármol, granito y cerámica, cocina integral abierta con barra desayunadora con linea blanca, muy iluminado, hermosa vista arbolada con Terraza de 54 metros, amplia sala comedor, 03 recamaras, principal con vestidor, todas las recamaras tienen baño propio, aparte 1/2 baño de visitas, Sala de tv y estudio, Terraza Privada, 02 estacionamientos, Cuarto de Lavado. Excelente zona, céntrica y con acceso a múltiples servicios, comercios, entretenimiento y vías rápidas, acceso controlado, Excelente ubicación inmediato al restaurantes con acceso a múltiples servicios, comercios y lugares públicos, así como a una gran oferta cultural, caminando o en auto. Todos los servicios a la mano. A menos de 10 minutos (caminando): City Market, Palacio de Hierro, Plaza Carso, cafés, teatros, cines, club deportivo, farmacias, restaurantes, bancos, gasolinera, spa, salones y peluquerías, regalos, agencias automotrices, etc. Cerca de Corporativos, las mejores escuelas y Universidades. Una de las zonas con mayor plusvalía de la Ciudad de México, segura, y con excelentes opciones para pasear y disfrutar con la familia o amigos.",https://www.inmuebles24.com/propiedades/clasificado/alclapin-rento-departamento-en-polanco-con-terraza-privada-146723309.html,"MN 120,000","Horacio
Polanco, Miguel Hidalgo","254 m² lote, 3 rec., 3 baños, 2 estac.",Culhuacán CTM Sección VI
"Departamento en venta en landmark reserve. 241 departamentos. 36 pisos. Piso 09 torre B. 127 mts2. Cocina. Comedor. Balcón. Ventaneria con doble cristal. Cuarto de lavado con medio baño. Aire central. Closet de blancos. Medio baño visitas. Cuarto secundario con baño completo. Cuarto principal con baño completo. 2 cajones de estacionamiento. 24 cajones de visita. Vista sur. Amenidades. Biblioteca. Residence kitchen. Terraza fumadores. Adults lounge. Gym. Yoga. Spa damas y spa caballeros cada uno con barber shop, nails bar, cabinas de masaje, lockers, vestidores, sauna, vapor regaderas y jacuzzi. Sports bar. Alberca y terraza. Teens room. Pet park. Kids room. Cinema. Sky garden con juegos infantiles. Juice bar. Salon de eventos con cocina industrial para 120 personas. mantenimiento incluído",https://www.inmuebles24.com/propiedades/clasificado/alclapin-departamento-en-venta-y-renta-en-landmark-reserve-146388296.html,"MN 55,000","Av Patria 1937
Puerta de Hierro, Zapopan","127 m² lote, 2 rec., 2 baños, 2 estac.",Culhuacán CTM Sección VI
