Título,Enlace,Precio,Dirección,Características,Colonia de Origen
"Bonito departamento interior, cuenta con buena iluminación Y pisos de cerámica. estancia. cocina con parrilla de cuatro quemadores, barra desayunadora Y un refrigerador. dos recamaras con closet abiertos. un baño. area de lavado integrada. Vigilancia. en caso de requerir estacionamiento tiene costo adicional. ubicación: escuelas cercanas, iglesias, hospitales, metro (estacion misterios), metrobus, parques. Bancos, plazas Y tiendas comerciales, etc. . Máximo 4 personas. no se aceptan mascotas",https://www.inmuebles24.com/propiedades/clasificado/alclapin-juventino-rosas-23-col.-peralvillo-alcaldia-cuauhtemoc-59113173.html,"MN 9,000","JUVENTINO ROSAS
Peralvillo, Cuauhtémoc","50 m² lote, 2 rec., 1 baño",Ex-Hipódromo de Peralvillo
"Departamento pequeño ideal para familia chica. Se admiten mascotas. Sala Comedor, 2 Recamaras pequeñas, Baño, Cocina y Area de Lavado y tendido. No tiene estacionamiento. En Planta Baja, Edificio antiguo de 3 niveles. Muy bien ubicado sobre eje central entre juventino rosas y chopin en peralvillo, Cuauhtemoc. Contrato anual. No se requiere aval. Se pide fianza costo aprox $4, 500. 00",https://www.inmuebles24.com/propiedades/clasificado/alclappa-renta-departamento-muy-bien-ubicado-147443023.html,"MN 5,000","Eje Central 63
Peralvillo, Cuauhtémoc","51 m² lote, 2 rec., 1 baño",Ex-Hipódromo de Peralvillo
"Este departamento de 45 m2 es completamente nuevo y tiene una magnífica ubicación ya que se encuentra justo frente a la Unidad Tlatelolco, posicionando estratégicamente entre Insurgentes Norte y Eje Central, muy cerca a Paseo de la Reforma. Al lado se encuentra la Plaza Comercial Puerta Tlatelolco y un sin fin de restaurantes, escuelas y comercios de todo tipo. Este conjunta habitacional también ofrece excelentes vías de comunicación de fácil acceso y transporte urbano a la mano, incluyendo el metro Tlatelolco a solo unos pasos. Todo el departamento tiene piso de loseta, acabados de alta calidad y amplios ventanales. El interior ofrece: -2 recámaras con clóset cada una, -sala-comedor. -cocina integral. -1 baño completo. -área de lavandería. -1 bodega. -un lugar de estacionamiento. -elevador. El edificio cuenta con caseta de guardia y muy pronto estarán listas muchas amenidades, como un gimnasio totalmente equipado, espacios para clases de spinning, un acogedor salón lounge, una sala de estar diseñada para tu comodidad, un versátil salón de eventos, zona de mascotas, asadores, cine, boliche, sala de videojuegos y un divertido kids club para los más pequeños de la casa. La renta 15, 000 ya incluye mantenimiento.",https://www.inmuebles24.com/propiedades/clasificado/alclapin-renta-departamento-nuevecito-en-grand-central-147380724.html,"MN 16,000","Manuel Gonzalez 165
San Simón Tolnahuac, Cuauhtémoc","45 m² lote, 2 rec., 1 baño, 1 estac.",Ex-Hipódromo de Peralvillo
"Departamento en Renta. Departamento a estrenar en tercer piso. Cuenta con. 2 recamaras. 1 baño completo. cocina integral con estufay campana, area de sala - comedor. 1 Estacionamiento. Cisterna. Área de tendio con lavadero y Jaula individual. Zona bien comunicada, a tres calles del metro y metrobus. Se aceptan mascotas. Mantenimiento $800 no incluido en el valor de la renta. Requisitos: * Mes de renta. *Deposito en garantía. *Poliza juridica con valor de el 30% de una renta, se tramita con fiador con bien raiz en cdmx u obligado solidario. Agenda tu cita hoy mismo y conocelo! (4)",https://www.inmuebles24.com/propiedades/clasificado/alclapin-departamento-en-renta-san-simon-tolnahuac-cuauhtemoc-147363728.html,"MN 13,000","Urano
San Simón Tolnahuac, Cuauhtémoc","50 m² lote, 2 rec., 1 baño, 1 estac.",Ex-Hipódromo de Peralvillo
Asesora alis ortiz ao221. 50 m² tot. 2 rec. 1 baño. 1 estac. A estrenar. Se Aceptan Mascotas. -Depósito. -Renta. -Póliza jurídica. -Fiador con bien inmueble u obligado solidarios,https://www.inmuebles24.com/propiedades/clasificado/alclapin-departamento-en-renta-san-simon-tolnahuac-146720258.html,"MN 14,000","San Simón Tolnahuac
San Simón Tolnahuac, Cuauhtémoc","50 m² lote, 2 rec., 1 baño, 1 estac.",Ex-Hipódromo de Peralvillo
"Estrena loft moderno en zona céntrica y tranquila! Disfruta de un espacio recién remodelado, ideal para una persona que valore la comodidad, funcionalidad y excelente conectividad. Características: Espacio abierto tipo loft. Cocina abierta. Baño completo amplio. Planta baja. Excelente ubicación con acceso a vías principales y transporte público. No cuenta con estacionamiento. No se aceptan mascotas. requisitos: -Un depósito en garantía. -Una renta por adelantado a la firma del contrato. -Pago de póliza jurídica $4, 150. 00. -Obligado Solidario. (4)",https://www.inmuebles24.com/propiedades/clasificado/alclapin-en-renta-departamento-tipo-loft-col.-santa-maria-146751686.html,"MN 8,000","Sandalo
Santa Maria Insurgentes, Cuauhtémoc","24 m² lote, 1 rec., 1 baño",Ex-Hipódromo de Peralvillo
"Departamento semiamueblado con litera con cama superior Y escritorio, recamaras con closet, comedor para 8 personas, cocina integral, refrigerador, lavadora, televisor de 80 pulgadas, librero, calentador electrico, eliptica, (banco para hacer ejercicio Y pesa opcional) escritorio con silla. Se ubica en segundo piso sin ascensor. Vista al exterior. Idea para complementar con una sala Y juego de recamara. No necesitas más ya que cuenta practicamente con todo amueblado. Reqs. Contrato 1 año con firma de aval. -Deposito y renta. -Fianza Jurídica o deposito adicional. -Firma de 12 pagares correspondiente a cada mes de renta. -Los servicios deben de ser pagados por el inquilino, agua, luz, gas y luz de áreas comunes.",https://www.inmuebles24.com/propiedades/clasificado/alclappa-departamento-ubicado-a-una-cuadra-de-insurgentes-142768373.html,"MN 8,800","PRIMERA PRIVADA DE GUERRERO
San Simón Tolnahuac, Cuauhtémoc","75 m² lote, 2 rec., 1 baño",Ex-Hipódromo de Peralvillo
"Departamento en Renta. Departamento a estrenar en tercer piso. Cuenta con. 2 recamaras. 1 baño completo. cocina integral con estufay campana, area de sala - comedor. 1 Estacionamiento. Cisterna. Área de tendido con lavadero y Jaula individual. Zona bien comunicada, a tres calles del metro y Metrobús. Se aceptan mascotas. Mantenimiento $800 no incluido en el valor de la renta. Requisitos: * Mes de renta. *Deposito en garantía. *Póliza jurídica con valor de el 30% de una renta, se tramita con fiador con bien raíz en cdmx u obligado solidario. Remax pro. Agenda tu cita hoy mismo y conócelo!",https://www.inmuebles24.com/propiedades/clasificado/alclappa-departamento-a-estrenar-san-simon-tolnahuac-147397197.html,"MN 13,000","Urano 14
San Simón Tolnahuac, Cuauhtémoc","50 m² lote, 2 rec., 1 baño",Ex-Hipódromo de Peralvillo
