Título,Enlace,Precio,Dirección,Características,Colonia de Origen
"Renta de departamento ubicado en la Colonia Acacias del Valle, zona segura, tranquíla y bien ubicada. Este departamento cuenta con amplia y luminosa estancia con acceso a terraza amplia. Dos cómodas recámaras, con closet en la recamara secundaria y walking closet, en la principal. Dos baños completos uno de ellos se encuentra ubicado en la recamara principal. La cocina es funcional y cuenta con espacio para alacena y refrigerador además de excelente ventilación e iluminación natural. Cuenta con patio de servicio, área de lavado, anexa al área de cocina y bien ventilada. El departamento cuenta con dos lugares de estacionamiento son amplios y solo se estorban entre sí. La ubicación es idónea para accesar a vías rápidas, metro, zonas peatonales, calle muy tranquila y en cerrada, a media cuadra del parque Acacias del Valle, muy cerca plazas comerciales, hospitales y tiendas de autoservicio.",https://www.inmuebles24.com/propiedades/clasificado/alclapin-renta-de-departamento-en-col-acacias-del-valle-benito-147143936.html,"MN 27,500","Calle 3
Acacias, Benito Juárez","95 m² lote, 2 rec., 2 baños, 2 estac.",Florida
"Este encantador departamento interior ubicado en la Avenida Revolución. Con 90 metros cuadrados de espacio contemporáneo este hogar ofrece el equilibrio perfecto entre comodidad y estilo. Descubre la amplitud y luminosidad de este espacio, que cuenta con dos acogedoras recamaras y dos baños modernos que te brindarán la privacidad que mereces. La cocina, diseñada con un gusto exquisito, se integra perfectamente con la sala de estar, creando un ambiente perfecto para la convivencia. Este departamento incluye dos lugares de estacionamiento, proporcionándote la comodidad que necesitas. Además, el edificio ofrece un toque adicional de exclusividad con su roof garden, donde podrás disfrutar de vistas panorámicas que quitan el aliento. Mantente en forma en el gimnasio completamente equipado, relájate mientras tus pequeños exploran la ludoteca y vive con total tranquilidad gracias al servicio de vigilancia las 24 horas. Tu seguridad y bienestar son nuestra prioridad.",https://www.inmuebles24.com/propiedades/clasificado/alclapin-departamento-en-renta-2-recamaras-revolucion-1062-141913999.html,"MN 25,100","revolucion 1062
San José Insurgentes, Benito Juárez","90 m² lote, 2 rec., 2 baños, 2 estac.",Florida
"Departamento ubicado en piso medio-alto en venta, acabados de lujo, 95 m2 habitables, piso de madera de ingeniería, estancia abierta, 2 recámaras, la principal con baño, 2 baños completos, cocina integral con barra de granito, área de lavado, 2 estacionamientos, área de lavado. Circuito cerrado, lobby, seguridad, 3 elevadores por torre. Mantenimiento incluido. Amenidades: Alberca techada, jacuzzi, spa, sauna, gimnasio, ludoteca, salón para eventos grandes, salón para eventos pequeños, asadores con parrilla, área de juegos infantiles, terraza para tomar sol, áreas para eventos en diferentes puntos, áreas abiertas con jardín. Nuevo proyecto icónico al sur de la Ciudad, inspirado en el arte y la creatividad para lograr un ambiente único. En el tradicional barrio de San Ángel, a unos pasos de Altavista, un nuevo concepto residencial inspirado en el arte y la creatividad, tiene su origen y punto de inspiración en la casa estudio de Feliciano Béjar, un destacado artista plástico mexicano. La mezcla de belleza con áreas verdes, convierten los más de 2, 300 m2 en un lugar ideal para vivir. Incorporando el arte como parte de sus más de 1, 200 m2 de espacios abiertos, para lograr un ambiente que te llevarán a un estado de lujo, confort e inspiración. Proyecto diseñado para disfrutar las vistas del sur de la ciudad desde sus Amenidades en el nivel 26.",https://www.inmuebles24.com/propiedades/clasificado/alclapin-renta-art-atlamaya-residences-san-angel-zona-sur-147324832.html,"MN 28,500","Blvd. Adolfo López Mateos 2370
San Ángel, Alvaro Obregón","95 m² lote, 2 rec., 2 baños, 2 estac.",Florida
"Excelente departamento bien ubicado, ideal persona sola, estudiante O empleado, muy bien ubicado, cerca portal san angel, amueblado, una recamara, baño, para verlo es previa cita",https://www.inmuebles24.com/propiedades/clasificado/alclapin-excelente-departamento-147424735.html,"MN 8,500","Ricardo Palmerín
Guadalupe Inn, Alvaro Obregón","30 m² lote, 1 rec., 1 baño",Florida
"Mls #25-1403. Moderno residencial a estrenar, con acabados de calidad y excelente distribución. Ubicado estrategicamente para ofrecer facil acceso y cercania a importantes vias como anillo periferico. En su interior cuenta con un superficie total de 155. 91 m2, siendo 79. 27 m2 habitables, Roof garden de 71. 82 m2, balcon de 4. 82 m2 y bodega incluida. Cambio de precio sin previo aviso y sujeto a disponibilidad. Ubicacion",https://www.inmuebles24.com/propiedades/clasificado/alclapin-departamento-en-renta-en-benito-juarez-san-jose-145161420.html,"MN 43,000","San Jose Insurgentes
San José Insurgentes, Benito Juárez","155 m² lote, 2 rec., 2 baños, 1 estac.",Florida
"Si estás buscando vivir en una de las Colonias al Sur de la Ciudad con una ubicación magnífica y estratégica con plusvalía garantizada. Este es el proyecto para ti. La Colonia San José Insurgentes es símbolo de dinamismo conservando ese toque residencial en medio de la cdmx. Encontrarás a unos min. Entre Av. Revolución y Av. Insurgentes siendo sede del Teatro de los Insurgentes, con un enorme y colorido mural del famoso pintor Diego Rivera. En las cercanías, el elevado centro comercial Torre Mural tiene boutiques modernas y elegantes, cafeterías para almorzar y bistrós. Este desarrollo cuenta con 4 diferentes diseños de departamentos con características como: Desde 85 m2 hasta 170m2. Exteriores con balcón y vistas panorámicas. 2 Habitaciones. 2 Baños completos. 1 lugar de estacionamiento. Seguridad. Conserje. Elevadores. Piso de ingeniería italiana. Ventanales anti-ruido. Renta Desde $27, 000 mantenimiento incluido. Venta Desde $5. 8 M. Con gusto te puedo ayudar en tramitar tu crédito hipotecario. Contáctame. Ver datos. Compañeros asesores en esta propiedad no se comparte comisión. Gracias por su comprensión.",https://www.inmuebles24.com/propiedades/clasificado/veclapin-estrena-departamento-en-la-col.-san-jose-insurgentes-145731722.html,"MN 30,000","Av Revolución
San José Insurgentes, Benito Juárez","90 m² lote, 2 rec., 2 baños, 1 estac.",Florida
"Departamento en renta con 50M2, cuenta con 1 recamara, sala, comedor, cocina integral, gas natural, 1 baño completo, area de lavado con jaula, cuenta con chimenea, muy cerca de av universidad Y A 10 minutos de metro viveros Y derechos humanos, A 15 minutos caminando de centro comercial mitikah.",https://www.inmuebles24.com/propiedades/clasificado/alclapin-departamento-renta-146805383.html,"MN 15,000","BENITO JUAREZ
Axotla, Alvaro Obregón","50 m² lote, 1 rec., 1 baño",Florida
