Título,Enlace,Precio,Dirección,Características,Colonia de Origen
"Se renta departamento nuevo amueblado en la pastora, A 10 minutos de estadio de rayados. Cuenta con sala, comedor, cocina integral con refrigerador, 2 recamaras con camas queen, centro de lavado, climas. Mayores informes sra. Rosy villarreal tel. - Ver datos",https://www.inmuebles24.com/propiedades/clasificado/alclapin-se-renta-departamento-nuevo-amueblado-en-la-pastora-147373732.html,"MN 20,000","La Pastora
La Pastora, Guadalupe","70 m² lote, 2 rec., 2 baños, 1 estac.",Guadalupe
"Rento excelente departamento amueblado para una persona en bosques del contry guadalupe N. L. , es muy amplio con sala, comedor, area de barra con bancos cocina, refrigerador, estufa electrica, recamara con baño completo vestidor, television, terraza con mecedora Y una vista espectacular con vista al cerro de la silla incluye agua, gas, E internet la luz va aparte tiene minisplit no mascotas",https://www.inmuebles24.com/propiedades/clasificado/alclapin-rento-depa-amueblado-para-una-persona-en-bosques-del-146322888.html,"MN 13,000","BOSQUES DE LA PASTORA 2242
Bosques de la Pastora, Guadalupe","118 m² lote, 1 rec., 1 baño, 1 estac.",Guadalupe
"Departamento en renta amueblado en torre santa fe living, guadalupe N. L. Excelente ubicación, cerca de centros comerciales como Citadel, Soriana la Fe, Paseo La fe, H. E. B. , Mueblería lm, Salud Digna, Avenidas principales como Miguel Alemán, Av. Acapulco, a 5 minutos del Centro de Apodaca, cerca de parques industriales. El Departamento cuenta con las siguientes amenidades, alberca, co-work, asadores, sport bar, vigilancia las 24 hrs. Se incluye Internet, mantenimiento del fraccionamiento, el agua y un estacionamiento exclusivo. Los minisplit son inverter frío- caliente. Distribución: -Cocina Integral con Estufa, Refrigerador, microondas y cafetera. -Área de Lavandería Techada con Lavadora y secadora. -Comedor. -Sala. -Baño completo. -Recámara principal amueblada, minisplit, closet y baño completo con jacuzzi. -Balcón. -Recámara Secundaria amueblada con minisplit.",https://www.inmuebles24.com/propiedades/clasificado/alclapin-departamento-en-renta-amueblado-en-torre-santa-fe-146158386.html,"MN 17,500","Melchor Ocampo, Guadalupe Nuevo León
Melchor Ocampo, Guadalupe","84 m² lote, 2 rec., 2 baños, 1 estac.",Guadalupe
"Departamento amueblado de 3 recamaras en col santa maria guadalupe nlcasa/departamento Segunda planta descripción* 3 recamaras* 2 baños completos* 3 recamaras - Recamara principal amplia con cama matrimonial y buro, clima, pantalla abanico, closet de madera, persianas, espejo. Con mini Split - 2 Recamaras con camas individuales, clima, pantalla, abanicos cada una. Ambas con mini Split* Sala con clima y sillón* Cocina - Tarja - Parrilla con 4 quemadores y campana - Micro hondas - licuadora y otros utensilios - Refrigerador* Comedor - Juego de mesa con 4 sillas - Pantalla - abanico* Lavandería - Lavadora y secadora* Terraza * Cochera para 1 autorequisitos: * ine* Comprobante de domicilio* Comprobante de ingresos * Póliza jurídica* Contrato 1 año accesos inmediatos A* Av. Benito Juárez* Cerca de Soriana Híper Santa CruzInformes al Ver datos y Ver datosTramitamos tu crédito hipotecario/bancario o cofinavitmejoramos tu hipoteca actual. ig904",https://www.inmuebles24.com/propiedades/clasificado/alclapin-departamento-en-renta-amueblado-de-3-recamaras-en-col-147325828.html,"MN 12,500","Departamento EN Renta Amueblado DE 3 Recamaras EN COL Santa Maria GPE NL
Santa María, Guadalupe","3 rec., 2 baños, 1 estac.",Guadalupe
Dos departamentos disponibles. A solo 3 minutos del Estadio bbva. Sala-Comedor con Minisplit. Cocina nueva. 2 Recámaras con clósets y Minisplit. 2 Baños completos. 2 Estacionamientos techados,https://www.inmuebles24.com/propiedades/clasificado/alclapin-departamento-en-renta-en-guadalupe-olivas-147361352.html,"MN 19,500","O LIVAS
15 de Mayo, Guadalupe","70 m² lote, 2 rec., 2 baños, 2 estac.",Guadalupe
"Departamento disponible en renta en Guadalupe. Ideal para quienes buscan comodidad y funcionalidad. Este departamento ofrece sala, comedor, cocina funcional, 2 recámaras y 1 baño. Además, cuenta con área de patio para disfrutar del aire libre. Disfruta de la comodidad de tener 1 lugar de estacionamiento. El edificio ofrece servicios básicos como agua y luz, e internet/wifi. Se admiten mascotas. La zona de Guadalupe es predominantemente residencial, con un ambiente familiar y tranquilo. Cuenta con excelentes opciones de transporte público, incluyendo fácil acceso a avenidas principales. Encontrarás escuelas cercanas, así como supermercados, tiendas de conveniencia y farmacias. Para el tiempo libre, hay parques y áreas verdes en los alrededores. La zona también cuenta con hospitales y clínicas cercanos. Es una zona segura y con un ambiente agradable para vivir.",https://www.inmuebles24.com/propiedades/clasificado/alclapin-renta-de-departamento-en-linda-vista-147266165.html,"MN 14,000","Vista Sol
Guadalupe, Nuevo León","75 m² lote, 2 rec., 1 baño, 1 estac.",Guadalupe
"Renta de departamento amueblado equipado y climatizado Guadalupe Nuevo León. - Cocina equipada con estufa electrica. - Sala y comedor - Una Tv en el area de la sala. - 2 recamaras equipadas con closets. -1 baño completo en recamara principal-Área de lavado, con una lavadora y secadora. - 1 baño completo en área social con asador. - Terraza con vistas panoramicas a la ciudad -2 cajones de estacionamiento -Alberca en común para los inquilinos de la torre. -Cuenta con todos los servicios. -Vigilancia con circuito cerrado 24/7-Acceso de vía rapida por av constitucion hacia el centro de Mty y acceso rapida hacia la av Miguel Aleman. -Muy cerca de centros comerciales, restaurantes, super, cine, escuelas, farmacias, hospitales etc. precio: $ 25, 000 pesos al mes + iva MisiónNuestra misión es ofrecer servicios inmobiliarios de calidad en Monterrey y el área Metropolitana. Atendiendo las necesidades y requerimientos de nuestros clientes, buscando superar sus expectativas y contribuir al desarrollo económico y social; capacitando a nuestros colaboradores para que brinden un servicio en excelencia.",https://www.inmuebles24.com/propiedades/clasificado/alclapin-departamento-en-renta-amueblado-guadalupe-nuevo-leon.-146024238.html,"MN 25,000","Departamento en Renta Amueblado Guadalupe Nuevo León.
Lindavista, Guadalupe",100 m² lote,Guadalupe
"Una excelente ubicación en la av. Melchor Ocampo con acceso rápido en vialidades como, Miguel Alemán, av. Los Ángeles o Acapulco, a una cuadra Soriana y a 3 minutos de Citadel y Paseo la fe, fraccionamiento cerrado con vigilancia de 24 horas. Un lugar muy tranquilo con amenidades que te sirven para relajarte después de un largo día de trabajo, alberca tipo olímpica, cowor, salón de eventos, área de asadores, agenda tu cita!",https://www.inmuebles24.com/propiedades/clasificado/alclapin-departamento-en-renta-amueblado-en-coloniasanta-fe-147302778.html,"MN 15,500","Departamento en Renta Amueblado en Santa Fe Living Apodaca - Guadalupe NL
Guadalupe, Nuevo León","70 m² lote, 2 rec., 2 baños, 1 estac.",Guadalupe
"Departamento Amueblado en renta en Riveras de Linda Vista, Guadalupe N. L. Muy fácil acceso, listo para habitar. Sala, antecomedor, cocina con Refrigerador, estufa, campana, lavanderia con lavadora, 2 recamaras, con closet, minisplit, y 2 baños completos",https://www.inmuebles24.com/propiedades/clasificado/alclapin-departamento-amueblado-en-renta-en-riveras-de-linda-147074178.html,"MN 17,000","Santa Rosa 5720
Rivera de Linda Vista, Guadalupe","102 m² lote, 2 rec., 2 baños, 1 estac.",Guadalupe
"Una excelente ubicación en la av. Melchor Ocampo con acceso rápido en vialidades como, Miguel Alemán, av. Los Ángeles o Acapulco, a una cuadra Soriana y a 3 minutos de Citadel y Paseo la fe, fraccionamiento cerrado con vigilancia de 24 horas. Un lugar muy tranquilo con amenidades que te sirven para relajarte después de un largo día de trabajo, alberca tipo olímpica, cowor, salón de eventos, área de asadores, agenda tu cita!",https://www.inmuebles24.com/propiedades/clasificado/alclapin-departamento-en-renta-amueblado-en-coloniasanta-fe-147302779.html,"MN 15,500","Departamento en Renta Amueblado en Santa Fe Living Apodaca - Guadalupe NL
Guadalupe, Nuevo León","70 m² lote, 2 rec., 2 baños, 1 estac.",Guadalupe
"Departamento Tipo Loft amueblado para ejecutivo, con 1 cajón de estacionamiento, con excelente ubicación en Guadalupe, cerca del Parque La Pastora, Centros comerciales, Soriana, heb, Tiendas Oxxo y Seven, a 20 min del aeropuerto,. Caseta con control de acceso y vigilancia incluye servicio de agua, internet y Tv por cableNo Mascotasid-1863",https://www.inmuebles24.com/propiedades/clasificado/alclapin-loft-en-renta-en-bosques-del-contry-guadalupe-146951671.html,"MN 11,000","Departamento Amueblado EN Renta
Guadalupe, Nuevo León","42 m² lote, 1 rec., 1 baño, 1 estac.",Guadalupe
"* favor de leer el anuncio completo antes de comunicarse * departamento amueblado con cochera techada, de una recamara Y un baño. Para una sola persona. Ubicado por ave. Eloy cavazos frente A bosque magico. A 7 min. Del tec Y fundidora. Características. - - una recamara. - un baño. - sala. - cocina integral completa. - estufa. - refrigerador. - minisplit frio/calor. - boiler. - lavadora. - cama matrimonial. - abanicos de techo. * requisitos * - mes de renta. - mes de depósito. - comprobante de ingresos. - contrato minimo un año. * los servicios se pagan por aparte * * edificio libre de humo * ** no mascotas ** ** no fiestas ni reuniones ** * informes solo por telefono *",https://www.inmuebles24.com/propiedades/clasificado/alclappa-departamento-amueblado-por-av-eloy-cavazos-y-av-las-146019085.html,"MN 8,900","Calle Bosques de la Sierra 2505
Rincón de la Primavera, Guadalupe","60 m² lote, 1 rec., 1 baño",Guadalupe
"Departamento Amueblado en renta en Riveras de Linda Vista, Guadalupe N. L. Muy fácil acceso, listo para habitar. Sala, antecomedor, cocina con Refrigerador, estufa, campana, lavanderia con lavadora, 2 recamaras, con closet, minisplit, y 2 baños completos",https://www.inmuebles24.com/propiedades/clasificado/alclapin-departamento-en-renta-en-guadalupe-nuevo-leon-a-unas-147056408.html,"MN 17,000","Santa Rosa
Rivera de Linda Vista, Guadalupe","102 m² lote, 2 rec., 2 baños, 2 estac.",Guadalupe
"Departamento listo para habitar. De una planta. Cuenta con recibidor, sala, comedor, cocina totalmente equipada. 3 recámaras, 3 baños, 2 terrazas internas, una terraza patio exterior muy amplia y área de bar. La altura libre es de 2. 60m. , la cocina conevta con el espacio flex, lavandería y a su vez con el cuarto de servicio y/o bodega, con baño completo con entrada independiente. Recámara principal con closet y baño completo, 2 recámaras secundarias y una de ellas tiene terraza interna y espacio de blancos. Cuenta con 2 cajones de estacionamiento, boiler y se encuentra semi amueblada, con opción a amueblarse completamente a gusto del cliente, la colonia cuenta con caseta de vigilancia. A 1 minuto de la entrada del emblemático cerro de la silla y a 3 minutos del estadio de futbol bbva. Se aceptan mascotas. Fácil acceso a avenidas principales como lo son Av. Eloy Cavazos, Av. Pablo Livas, Av. Las Américas, Av. Chapultepec. Super cerca de Av. Revolución, Av. Eugenio Garza Sada, Av. Benito Juárez, entre otras.",https://www.inmuebles24.com/propiedades/clasificado/alclapin-departamento-en-renta-en-bosques-de-la-pastora-147117521.html,"MN 25,000","Bosques del Mirador
Bosques de la Pastora, Guadalupe","250 m² lote, 3 rec., 3 baños, 2 estac.",Guadalupe
"Departamento en Renta O Livas, Guadalupe, N. L. Mensualidad de 19, 000 Pesos. Un depa que te permite estar conectado a todo, y al mismo tiempo disfrutar de tu propio espacio con tranquilidad. Este departamento en O Livas tiene lo que buscas si quieres comodidad y estilo de vida: 2 recámaras climatizadas con clósets nuevos. 2 Baños completos. Cocina equipada con campana, estufa, refrigerador y horno de microondas. Centro de lavado con lavadora y secadora nuevas. Balcón privado. Boiler. 2 cajones de estacionamiento. Cuenta con increíbles amenidades como alberca, vitapista, área social y seguridad y acceso controlado 24/7. Ubicación estratégica: a 2 km del Estadio de Rayados, con conexión rápida a avenidas principales, universidades y comercios. Este depa no es solo un lugar donde vivir, es un espacio que te permite crecer, trabajar, disfrutar y estar conectado con todo lo que importa. Importante: No se aceptan mascotas. Agenda tu visita y ven a conocerlo.",https://www.inmuebles24.com/propiedades/clasificado/alclapin-departamento-en-renta-o-livas-guadalupe-n.-l.-147387016.html,"MN 19,000","O LIVAS
Guadalupe, Nuevo León","1 m² lote, 2 rec., 2 baños, 2 estac.",Guadalupe
"Departamento en Renta – Riberas del? Río, Guadalupe, N. L. Excelente opción habitacional ubicada sobre la avenida Plutarco Elias Calles, en el tercer piso de un edificio de fácil acceso. El inmueble se entrega equipado y listo para habitar. Distribución y equipamiento2 recámaras: Principal amueblada con cama matrimonialSecundaria adaptable como cuarto de estudioÁrea de sala y comedor integradosCocina con refrigerador y estufaBoiler y tanque de gas instaladoPatio de servicio independienteRequisitos de arrendamientoUn mes de depósitoUn mes de renta por adelantadoPóliza jurídica obligatoria (costo adicional) Para más información o para agendar visita, favor de contactar vía mensaje o llamada.",https://www.inmuebles24.com/propiedades/clasificado/alclapin-departamento-en-riberas-del-rio-146371977.html,"MN 12,500","Riberas del Rio
Riberas del Río, Guadalupe","60 m² lote, 2 rec., 1 baño",Guadalupe
"Amenidades. Alberca con asadores. Áreas verdes. Área de eventos. Co- work. Sport bar. Vita pista. Canchas para ejercitarse. Gym. Requisitos: 1 mes de renta. 1. 5 mes de deposito. Poliza de garantía jurídica. Buen historial crediticio. Excelente Ubicación al estar muy cerca de. Empresas y zona Industrial, Av Ruiz Cortines. Av Miguel Alemán. Av Acapulco. A 2 km de Paseo la fe, 14 km del Aeropuerto. 800 metros de del heb Acapulco. Torre con Amenidades como: Vitapista, Gimnasio, Club Social, Grill, Terraza techada, Cancha, Salón de juegos, Pet park, Cowork, area de visitas etc. - teléfono: Ver datos",https://www.inmuebles24.com/propiedades/clasificado/alclapin-departamento-en-renta-santa-fe-living-144833700.html,"MN 21,000","Santa FE Living
Melchor Ocampo, Guadalupe","71 m² lote, 2 rec., 2 baños, 1 estac.",Guadalupe
"Rednorte ofrece: clave interna: yc0170. Departamento en Renta en Torres de Linda Vista, Guadalupe. Departamento amueblado en excelente ubicación, ideal para quienes buscan comodidad y funcionalidad en una zona conectada y segura. Características: • Construcción: 95 m² • 2 recámaras. • 2 baños completos. • 2 espacios de estacionamiento. • Amueblado. • Cocina equipada. • Centro de lavado. • Clósets y mobiliario en excelente estado. • Seguridad 24/7. Precio de renta: $23, 900. Incluye mantenimiento. Ubicado en Torres de Linda Vista, en Guadalupe, con rápido acceso a principales avenidas, comercios, supermercados y servicios. Ideal para profesionistas, parejas o pequeñas familias. Agenda tu cita para conocerlo. Referencia: yc0170",https://www.inmuebles24.com/propiedades/clasificado/alclapin-departamento-en-renta-torres-de-linda-vista-147134831.html,"MN 23,900","TORRES DE LINDAVISTA
Torres Lindavista, Guadalupe","95 m² lote, 2 rec., 2 baños, 2 estac.",Guadalupe
"Rednorte ofrece: Departamento en Renta en Torres de Linda Vista – Guadalupe. Descubre este espacioso y elegante departamento en renta, ubicado en la exclusiva comunidad de Torres de Linda Vista en Guadalupe. Con un diseño moderno y funcional, este inmueble es ideal para quienes buscan confort y estilo en una de las zonas más cotizadas de la ciudad. Características del Departamento: • Construcción: 95 m² de excelente distribución. • Recámaras: 2 confortables habitaciones. • Baños: 2 baños completos. • Estacionamiento: 2 espacios incluidos. • Amueblado: Listo para entrar a vivir. • Centro de lavado: Equipado para tu conveniencia. • Mantenimiento: Incluido en el precio. Precio de Renta: $25, 000. 00 mxn mensuales. No pierdas la oportunidad de vivir en un entorno de alta calidad y disfrutar de todas las comodidades que este departamento ofrece. Contáctanos para obtener más información o para agendar una visita. Clave interna: yc0136. whatsapp: Ver datos",https://www.inmuebles24.com/propiedades/clasificado/alclapin-departamento-en-renta-torres-de-linda-vista-146067538.html,"MN 25,000","Torres de Linda Vista Guadalupe
Lindavista, Guadalupe","95 m² lote, 2 rec., 2 baños, 2 estac.",Guadalupe
"Rednorte ofrece: clave interna: yc0165. whatsapp: 81 Ver datos. Departamento en Renta en Torres de Linda Vista – Guadalupe. *$24, 000. 00 mxn mensuales* Descubre este espacioso y elegante departamento en renta, ubicado en la exclusiva comunidad de Torres de Linda Vista en Guadalupe. Con un diseño moderno y funcional, este inmueble es ideal para quienes buscan confort y estilo en una de las zonas más cotizadas de la ciudad. Características del Departamento: • Construcción: 95 m² de excelente distribución. • Recámaras: 2 confortables habitaciones. • Baños: 2 baños completos. • Estacionamiento: 2 espacios incluidos. • Amueblado: Listo para entrar a vivir. • Centro de lavado: Equipado para tu conveniencia. • Mantenimiento: Incluido en el precio. Amenidades Exclusivas: • Gimnasio. • Alberca. • Asadores. • Terraza. Precio de Renta: *$23, 000. 00 mxn mensuales* No pierdas la oportunidad de vivir en un entorno de alta calidad y disfrutar de todas las comodidades que este departamento ofrece. Contáctanos para obtener más información o agendar una visita.",https://www.inmuebles24.com/propiedades/clasificado/alclapin-departamento-en-renta-torres-de-linda-vista-147086119.html,"MN 24,000","TORRE DE LINDA VISTA
Lindavista, Guadalupe","95 m² lote, 2 rec., 2 baños, 2 estac.",Guadalupe
Departamento Equipado y Amueblado en Renta en Santa Fe Living. Pet Friendly. Renta incluye el mantenimiento del complejo. A 5 minutos de paseo la fe. A 5 minutos de miguel aleman. Supermercados a 2 minutos. 2 recámaras. 2 baños completos. 1 estacionamiento techado. Lavandería. totalmente equipado y amueblado. Departamento en planta baja. Con terraza. **Amenidades** Acceso controlado. Pasillo Central. Co-work. Sports Bar. Alberca semi olímpica. Asadores vip. Asadores. Ejercitadores. Alberca con Terraza. Pet-Park. Cine al aire libre. requisitos: 1 mes de deposito. 1 mes de renta. investigacion Pagada por Arrendatario. poliza juridica Pagada por arrendatario Pagarés. asesor: hector ivan cuevas. cel Ver datos. Ver datos,https://www.inmuebles24.com/propiedades/clasificado/alclapin-departamento-equipado-y-amueblado-en-renta-en-santa-fe-147119040.html,"MN 21,000","Melchor Ocampo 39
Guadalupe, Nuevo León","83 m² lote, 2 rec., 2 baños, 1 estac.",Guadalupe
"Rednorte ofrece: Cuenta con 2 recámaras, 2 baños completos. 65m2 de construcción. Equipado con minisplits en sala, comedor y recámaras. Cocina integral, con estufa, refrigerador, microondas, centro de lavado y boiler. Cuenta con amenidades como dos albercas, asadores, áreas de cowork, sports bar y seguridad 24/7. renta 16, 000 mensuales e incluye: Cuota de mantenimiento, servicio de agua, internet y un cajón de estacionamiento (negociable un segundo cajón). Clave interna: eg050. whatsapp: Ver datos",https://www.inmuebles24.com/propiedades/clasificado/alclapin-departamento-en-renta-en-santa-fe-living-144898071.html,"MN 18,000","Santa FE
Santa María, Guadalupe","65 m² lote, 2 rec., 2 baños, 1 estac.",Guadalupe
"Renta de departamento amueblado equipado y climatizado Guadalupe Nuevo León. - Cocina equipada con estufa electrica. - Sala y comedor. - Una Tv en el area de la sala. - 2 recamaras equipadas con closets. - 1 baño completo en recamara principal-Área de lavado, con una lavadora y secadora. - 1 baño completo - Terraza con asador y vistas panoramicas a la ciudad. -2 cajones de estacionamiento. -Alberca en común para los inquilinos de la torre. -Cuenta con todos los servicios. -Vigilancia con circuito cerrado 24/7-Acceso de vía rapida por av constitucion hacia el centro de Mty y acceso rapida hacia la av Miguel Aleman. -Muy cerca de centros comerciales, restaurantes, super, cine, escuelas, farmacias, hospitales etc. precio: $ 25, 000 pesos al mes + iva MisiónNuestra misión es ofrecer servicios inmobiliarios de calidad en Monterrey y el área Metropolitana. Atendiendo las necesidades y requerimientos de nuestros clientes, buscando superar sus expectativas y contribuir al desarrollo económico y social; capacitando a nuestros colaboradores para que brinden un servicio en excelencia.",https://www.inmuebles24.com/propiedades/clasificado/alclapin-departamento-en-renta-equipado-y-amueblado-guadalupe-91187787.html,"MN 25,000","Departamento en Renta Equipado y Amueblado Guadalupe Nuevo León.
Riveras de la Purísima, Guadalupe","100 m² lote, 2 rec., 2 baños, 2 estac.",Guadalupe
"Depa en renta amueblado. 2 recamaras incluyen tv Y closet. estudio independiente, lavanderia equipada, sala, comedor, cocina. 1 1/2 baños. Son dos pisos. minisplit inverter E. iluminacion led en todas las areas. se ubica en el 1er piso. 12, 000 incluye internet. * indispensable: contar con buro de credito al corriente Y aval. No se aceptan mascotas",https://www.inmuebles24.com/propiedades/clasificado/alclapin-departamento-en-renta-camino-real-zona-guadalupe-79579310.html,"MN 12,000","Av. Camino Real
Camino Real FOVISSSTE, Guadalupe","50 m² lote, 2 rec., 1 baño, 1 estac.",Guadalupe
Hermoso departamento en rentacaseta de seguridad con acceso controlado vigilancia las 24 hrs ubicado en 2do piso con 2 habitacionesrecamara principal con baño completo Y espacio para walk in closetcocina totalmente equipada 2 baños completoscuenta con hermosas amenidades como: jardinalbercagymasadoresexcelente ubicacion A solo 20 minutos del aeropuerto de monterreya 15 minutos de fundidora A 2 km de av constitucion con centros comerciales Y tiendas de conveniencia A su alrededor.,https://www.inmuebles24.com/propiedades/clasificado/alclapin-departamento-en-venta-linda-vista-monterrey-145115260.html,"MN 18,000","AV Ruiz Cortines 1
Cerradas de Lindavista, Guadalupe","81 m² lote, 2 rec., 2 baños, 2 estac.",Guadalupe
"Penthouse en renta de 3 Recamaras de 2 pisos // Zona Linda Vista Precio: $29, 500Mtto: IncluidoServicios: Apartecaracterísticas de la propiedad-Torres Linda Vista -2 Pisos ( Arriba una Recámara y Roof Garden) -3 Recámaras-3 Baños-Completamente Amueblado-Roof Garden-Minisplits Frio/Calor-Dos Smart Tv´s con wifi de Alta Velocidad-2 Lugares de estacionamientoamenidades- Gimnasio- Asadores- Alberca- Seguridad Las 24 horas",https://www.inmuebles24.com/propiedades/clasificado/alclapin-penthouse-en-renta-de-3-recamaras-de-2-pisos-zona-147422456.html,"MN 29,500","La Barranca al 5400
Torres Lindavista, Guadalupe","3 rec., 3 baños, 2 estac.",Guadalupe
"Excelente departamento en renta de dos recamaras con 1 baño completo. Totalmente remodelado, cocina integral equipada con estufa Y campana, lavanderia con centro de lavado Y boiler Y minisplit de dos toneladas en sala comedor cochera para un auto. las recámaras equipadas con ventilador de techo Y roperiasde facil acceso por av chapultepec, av las americas Y por la calle arteaga en guadalupe. muy cerca del heb Y de la presidencia municipal de guadalupe. A minutos de la central de abastos guadalupe, del colegio juan pablo. no se aceptan mascotasdisponible de inmediato",https://www.inmuebles24.com/propiedades/clasificado/alclapin-departamento-en-renta-residencial-cerro-de-la-silla-147329451.html,"MN 10,000","Departamento EN Renta Residencial Cerro DE LA Silla Guadalupe
Residencial Cerro de la Silla, Guadalupe","70 m² lote, 2 rec., 1 baño, 1 estac.",Guadalupe
"Col: Linda Vista. amplio departamento amueblado de 94. 6 m2, mini splits en todas las areas, 2 recamaras, dos baños completos, hermosa vista, cuenta con cocina equipada, refrigerador y centro de lavado, alberca, gimnasio, area de asadores, 2 cajones de estacionamiento, vigilancia 24/7 la renta incluye mantenimiento. Cerca de Hospitales, Centros Comerciales, Colegios, Bancos. La disponibilidad, precios, promociones y condiciones de la propiedad están sujetos a cambio sin previo aviso. Las imágenes y descripciones son de carácter ilustrativo y pueden variar respecto al producto final. El precio publicado no incluye gastos notariales, impuestos, derechos de registro, costos de financiamiento, avalúos, honorarios legales, cuotas de mantenimiento, gastos de administración ni cualquier otro gasto adicional que pudiera generarse en la operación de compraventa o arrendamiento. Para conocer la disponibilidad actualizada, precio vigente y condiciones específicas de la propiedad, por favor consulte directamente con su asesor inmobiliario.",https://www.inmuebles24.com/propiedades/clasificado/alclapin-departamento-en-renta-en-guadalupe-146838963.html,"MN 25,000","Linda Vista
Lindavista, Guadalupe","94 m² lote, 2 rec., 2 baños, 2 estac.",Guadalupe
