Título,Enlace,Precio,Dirección,Características,Colonia de Origen
"Plaza Carso 3 Recamaras y Cuarto de Servicio Torre Botticelli Amueblado y Equipado de Super Lujo. Muy exclusivo ubicado en Residencial Plaza Carso, Hermoso Departamento con una superficie de 170 metros, de Super Lujo, inmediato a Polanco, Antara, Periférico, Ejercito Nacional, Río San Joaquin, Reforma, Circuito Interior, Lomas de Chapultepec, los mejores Centros Comerciales y Corporativos, Estilo Contemporáneo, precioso departamento, excelente orientación, vista panoramica al Museo Soumaya, muy iluminado, lleno de luz, acabados de super lujo, mármol, granito y cerámica, fina carpinteria italiana, cuenta con amplia estancia, cocina integral con barra de granito abierta, muy iluminado, hermosa vista panoramica, 03 recamaras, 03 1/2 baños, Sala de television o estudio, 03 estacionamientos, closets empotrados, Cuarto de Servicio con baño integrado, Cuarto de Lavado. Amenidades: Alberca, Gimnasio, salón de fiestas, ludoteca. Estricta Vigilancia 24 horas. Cerca de supermercados, cines, las mejores tiendas y restaurantes. Excelente zona, céntrica y con acceso a múltiples servicios, comercios, entretenimiento y vías rápidas, acceso controlado. Excelente ubicación inmediato al restaurantes con acceso a múltiples servicios, comercios y lugares públicos, asi como a una gran oferta cultural, caminando o en auto. Todos los servicios a la mano. A menos de 10 minutos (caminando): cafés, teatros, cines, club deportivo, farmacias, restaurante/bar, bancos, gasolinera, vigilancia, spa, salones y peluquerías, regalos, agencias automotrices, etc. Cerca de Corporativos, las mejores escuelas y Universidades. Una de las zonas con mayor tradición, historia y plusvalía de la Ciudad de México, segura, y con excelentes opciones para pasear y disfrutar con la familia o amigos.",https://www.inmuebles24.com/propiedades/clasificado/alclapin-renta-departamento-en-plaza-carso-3-recamaras-143732835.html,"MN 92,000","Lago Zurich 272
Polanco, Miguel Hidalgo","170 m² lote, 3 rec., 3 baños, 2 estac.",Las Águilas 1a Sección
"Departamento de 175m2 + 60 m de terrazaprecio de renta sin muebles Renta $125, 000, ambueblado $135, 000el departamento cuenta con mucha luz y el edificio es nuevo tiene 2 cuartos con baño completo, 1 baño de visitas, Cocina abierta, Cuarto de servicio con baño, sala y comedor con un mueble empotrado como bar, el departamento tiene terraza y en la parte de arriba cuenta con terraza privada (con baño y bodega) . 1 bodega en el estacionamiento y 2 lugares de estacionamientos (1 detras del otro sin bloqueos) Pago de mantenimiento: 6, 800 (incluido en caso de renta) Edificio nuevo - 9 pisos - 2 deptos por pisoel edificio cuenta con un área social como terraza para eventos",https://www.inmuebles24.com/propiedades/clasificado/alclapin-departamento-polanco-147230129.html,"MN 125,000","Venta o Renta Departamento en Polanco
Polanco, Miguel Hidalgo","235 m² lote, 2 rec., 2 baños, 2 estac.",Las Águilas 1a Sección
"Estrena departamento en Renta en carretera México-Toluca, Bosques de Santa Fé, Cuajimalpa, En Residencial Agwa Bosques del Parque, de 128 m2 se encuentra en el piso 11. Con una vista espectacular hacia el centro de la Ciudad de Mexico este departamento cuenta con una cocina abierta integral con barra de granito, una estancia muy amplia y muy iluminada, dos amplias recámaras, la secundaria con baño y closet y la principal con baño y un espectacular vestidor con doble lavabo, baño de visitas, área de lavado y dos lugares de estacionamiento. Se encuentra muy cerca a la Plaza lilias, plaza Arcos Bosques, edificio del Pantalón, a solo 5 minutos de Santa Fe. Las amenidades que incluye son espectaculares, restaurante, alberca con vista espectacular, jardines para mascotas, parrillas para barbicue, vestidores, carril de nado contracorriente, gimnasio, spa, cuartos de masaje, salón de belleza, vapor, sauna, salón de entretenimiento para adolescentes, ludoteca, salas de juntas y salón de fiestas. Todo esto incluido en la renta. Que esperas, ven y conócelo, saca tu cita Ahora!!. Los datos proporcionados por clientes o terceros serán tratados conforme a la Ley federal de protección de datos personales, si desea consultar nuestro aviso de privacidad, deberá solicitarlo vía correo al correo de contacto.",https://www.inmuebles24.com/propiedades/clasificado/alclapin-departamento-en-renta-en-santa-fe-bosques-agwa-bosques-147176743.html,"MN 44,000","Carretera Mexico - Toluca 1535
Granjas Palo Alto, Cuajimalpa de Morelos","128 m² lote, 2 rec., 2 baños, 2 estac.",Las Águilas 1a Sección
"Renta de departamento en Cuadrante Neuchatel de 2 habitaciones la principal con baño y vestidor, 2 baños completos y 2 estacionamientos, el edificio cuenta con seguridad 24 hrs, estacionamiento de visitas, gimnasio, alberca con jacuzzi, ludoteca, salon para jovenes, lounge bar, a unos pasos de plaza Carso, Antara y Miyana, supermercados, bancos, museos, cines",https://www.inmuebles24.com/propiedades/clasificado/alclapin-renta-de-departamento-en-cuadrante-neuchatel-147062197.html,"MN 36,000","Lago Andromaco 55
Ampliación Granada, Miguel Hidalgo","88 m² lote, 2 rec., 2 baños, 2 estac.",Las Águilas 1a Sección
"Departamento en Renta ubicado en Cosmocrat Puerta de Hierro, cerca de Plaza Comercial Andares, Plaza Acueducto, Unicenter, Parque Colomos. Características: Piso 13 - #501B. Mantenimiento Incluido. Construcción: 97 M2. - 2 Recámaras. - 2 Baños completos. - Sala. - Comedor. - Cocina. - Área de lavado. - 2 Cajones de estacionamiento. Extras: Cuenta con aire acondicionado y persianas. Amenidades: - Cine. - Gimnasio. - Lobby. - Salón de Juegos. - Terrazas con asadores. - Kids Club. - Merlot Room. - Roof Garden. - Alberca - Spa. - Áreas Verdes. *Cambios de informacion o precios sin previo aviso. Eb-mo7348. wig: pchh3Up",https://www.inmuebles24.com/propiedades/clasificado/alclapin-departamento-en-renta-cosmocrat-puerta-de-hierro-146068077.html,"MN 30,000","Avenida Acueducto 6075
Puerta de Hierro, Zapopan","97 m² lote, 2 rec., 2 baños, 2 estac.",Las Águilas 1a Sección
