Título,Enlace,Precio,Dirección,Características,Colonia de Origen
"Renta sin Aval en 24 horas. Proceso ágil y flexible. / Lease without guarantor with agile and flexible processes in 24 hours. Opción de departamentos amueblados por Bo-Concept. / Furnished apartments by Bo-Concept available. Todos los departamentos incluyen electrodomésticos. (microondas, lava-secadora, Refrigerador, estufa con horno, lavavajillas) persianas / canceles. All apartments include appliances. (microwave, washer-dryer, refrigerator, stove with oven, dishwasher) blinds / gates. ! estrena depa en la Torre mas emblemática de la cdmx! Brand new apartments just released to the market in the most iconic tower in cdmx. Departamentos tipo: Loft, 1 y 2 recámaras; a un minuto de Bosques de las Lomas y Arcos Bosques (El Pantalón) en medio de escuelas, universidades, hospitales, centros comerciales y toda la oferta de servicios que ofrecen Santa Fe y Bosques. Potencializa tu vida con nuestras amenidades: Alberca. Co-Working. Bar. Cafetería. Salón de Fiestas. Game Room. Chill Spot. Pet Zone. Área de asadores con fogateros. Gimnasio. Yoga Room. Motor Lobby. Sala de recepción. Concierge Vigilancia 24hrs. cctv. Shuttle que te conecta con los principales puntos de la cdmx y Santa Fe. Renta sin aval; Departamentos nuevos, Totalmente equipados con electrodomesticos nuevos, agenda una cita y prepara todo para estrenar! !",https://www.inmuebles24.com/propiedades/desarrollo/ememvein-ri-a-bosques-renta-y-estrena-nuestros-depas.-loft-1-141933064.html,"MN 19,800","carretera mex - tol 1535
Santa Fe Cuajimalpa, Cuajimalpa de Morelos","455 un., 1 a 2 rec., 57 m² lote",Las Águilas 1a Sección
"¡Vive en el corazón de Monterrey! Este moderno departamento en renta está ubicado en el centro de la ciudad, ofreciendo comodidad, seguridad y cercanía a todo lo que necesitas. Ideal para quienes buscan estar cerca de las principales zonas comerciales, culturales y de transporte. Características: Recámaras: 2 habitaciones amplias y bien iluminadas, las 2 cuantan con minisplit y closets. La recamara principal tiene baño completo y un colchon matrimonial nuevo. 1 Baño completo para visitas y habitacion secundaria. Centro de lavado, lavadora y secadora. Cocina integral con refrigerador nuevo. Sala y comedor con minisplit. Balcon con vistas espectaculares a la ciudad. Pequeño espacio para oficina o estudio. Ubicado en el 9o piso y cuenta con 1 cajon para estacionamiento. Amenidades como Gimnacio, oficinas cowork, ludoteca, asadores, salas de uso multiple. Precio de la renta incluye mantenimiento. Los recibos de los servicios se pagan aparte. Ventajas: Excelente ubicación, a pocos minutos de avenidas principales, restaurantes, tiendas y centros de entretenimiento. Perfecto para profesionales, parejas o pequeñas familias que buscan comodidad en el centro de la ciudad. Espacios bien distribuidos y funcionales. ¡No pierdas la oportunidad de vivir en una de las mejores zonas de Monterrey! Contáctanos para más información o para agendar una visita!",https://www.inmuebles24.com/propiedades/clasificado/alclapin-departamento-equipado-en-renta-en-monterrey-centro-145278233.html,"MN 22,000","Centro
Monterrey Centro, Monterrey","73 m² lote, 2 rec., 2 baños, 1 estac.",Las Águilas 1a Sección
"Tu nuevo depa en Nápoles, cdmx – Cerca del wtc y listo para ti️ ¿Buscas comodidad, estilo y ubicación en un solo lugar? Este departamento en renta en la colonia Nápoles tiene todo lo que necesitas: a solo unos pasos del World Trade Center, muy cerca de la Del Valle y rodeado de cafés, restaurantes y todo lo que te gusta. Renta sin complicaciones: ️ Sin aval. ️ Sin fianza. ️ Renta en 24 horas. Lo que incluye tu nuevo hogar: Espacios modernos y funcionales. Opción amueblado. Internet de alta velocidad incluido. Cocina equipada. Seguridad 24/7. Estacionamiento (sujeto a disponibilidad) Amenidades que elevan tu día a día: Coworking y salas de juntas. Cine privado y sala de juegos. Terraza con asadores. Gimnasio y área de yoga. Zona pet friendly. Elige entre estudios o departamentos de 1 y 2 recámaras, todos dentro de un edificio moderno, con diseño vanguardista y ambiente profesional.",https://www.inmuebles24.com/propiedades/desarrollo/ememvein-departamento-en-renta-en-la-napoles-del-valle-144568092.html,"MN 20,000","amalia by urbanista
Nápoles, Benito Juárez","199 un., 1 a 2 rec.",Las Águilas 1a Sección
"Departamento en Renta – Torre Amatis. Superficie: 105 m² Ubicación: Piso 8. Precio: 42, 000. Distribución y espacios: • 2 cómodas recámaras. • 2 baños completos. • 1 medio baño para visitas. • Estudio o área flex ideal para home office. • Balcón con vista. • Cocina y área social de excelente tamaño. • Centro de lavado. • Cuarto de máquinas. Amenidades de la torre: • Alberca al aire libre. • Área social con asadores. • Extensas y hermosas áreas verdes. • Cancha de basquetbol. • Lobby con vigilancia 24/7 y control de acceso",https://www.inmuebles24.com/propiedades/clasificado/alclapin-departamento-en-renta-105-m-sup2--torre-amatis-147220782.html,"MN 42,000","Amatis
Vía Cordillera, Santa Catarina","105 m² lote, 2 rec., 2 baños, 2 estac.",Las Águilas 1a Sección
"Sé el primero en experimentar la vida de lujo en Gran Ciudad Nuevo Polanco. Departamentos en renta a estrenar con amenidades inigualables. Reserva tu departamento hoy mismo y disfruta de beneficios especiales. Deja tu información de contacto, ¡nuestro equipo se pondrá en contacto contigo en breve! Elige tu nuevo departamento: Estudios: desde $24, 300 mxn. Departamento de 1 Recámara: desde $27, 500 mxn. Departamento de 2 Recámaras: desde $36, 000 mxn. *Contamos con espacio de estacionamiento y bodega para renta. Contamos con una ubicación privilegiada en Av. Río San Joaquín #498, Col. Ampliación Granada, a tan solo un par de calles del Museo Soumaya, y los centros comerciales Antara Fashion Hall y Miyana. Reserva tu departamento y pregunta por nuestras promociones vigentes.",https://www.inmuebles24.com/propiedades/desarrollo/ememvein-gran-ciudad-nuevo-polanco-144968760.html,"MN 24,300","Río San Joaquín 498, Ampliación Granada, CDMX
Polanco, Miguel Hidalgo","329 un., 1 a 2 rec.",Las Águilas 1a Sección
"Departamento en venta en landmark reserve. 241 departamentos. 36 pisos. Piso 09 torre B. 127 mts2. Cocina. Comedor. Balcón. Ventaneria con doble cristal. Cuarto de lavado con medio baño. Aire central. Closet de blancos. Medio baño visitas. Cuarto secundario con baño completo. Cuarto principal con baño completo. 2 cajones de estacionamiento. 24 cajones de visita. Vista sur. Amenidades. Biblioteca. Residence kitchen. Terraza fumadores. Adults lounge. Gym. Yoga. Spa damas y spa caballeros cada uno con barber shop, nails bar, cabinas de masaje, lockers, vestidores, sauna, vapor regaderas y jacuzzi. Sports bar. Alberca y terraza. Teens room. Pet park. Kids room. Cinema. Sky garden con juegos infantiles. Juice bar. Salon de eventos con cocina industrial para 120 personas. mantenimiento incluído",https://www.inmuebles24.com/propiedades/clasificado/alclapin-departamento-en-venta-y-renta-en-landmark-reserve-146388296.html,"MN 55,000","Av Patria 1937
Puerta de Hierro, Zapopan","127 m² lote, 2 rec., 2 baños, 2 estac.",Las Águilas 1a Sección
"Departamento en Renta Jardines de Allende Planta baja 9, 500 mxn (incluye mantenimiento 2 recámaras con clóset 1 baño completo Sala comedor, Cocina con alacena y parrilla de gas, Patio de servicio, Calentador solar sin tanque de gas Canchas Seguridad 24/7 Acceso controlado A 5 min de Liverpool ¿Quieres agendar visita?",https://www.inmuebles24.com/propiedades/clasificado/alclapin-departamento-allende-147397074.html,"MN 8,500","Departamento en Renta en Jardines de Allende San Miguel de Allende 1
Allende, San Miguel de Allende","60 m² lote, 2 rec., 1 baño, 1 estac.",Las Águilas 1a Sección
"Departamento en renta cerca de Colosio sin muebles. Como nuevo con closets, canceles, cocina equipada. Sala comedor. Cocina equipada. Cocina equipada. Dos recámaras con closet. Dos baños completos. Área de lavado. Un cajón de estacionamiento",https://www.inmuebles24.com/propiedades/clasificado/alclapin-departamento-en-renta-a-una-cuadra-de-colosio-en-147321456.html,"MN 15,000","San Juan de Los Lagos 1001
Condominio Puerto las Hadas, Aguascalientes","98 m² lote, 2 rec., 2 baños, 1 estac.",Las Águilas 1a Sección
"Renta de Departamento Amueblado con balcón, en piso bajo de Be Grand Polanco, de 75 M2, 1 recámara, 1 baño completo, sala y comedor, cocina abierta, área de lavado, 1 lugar de estacionamiento, el edificio cuenta con Amenidades: Alberca, Gym, jardines con juegos infantiles, ludoteca, vigilancia 24 horas. Agenda tu cita cuanto antes!",https://www.inmuebles24.com/propiedades/clasificado/alclapin-renta-departamento-amueblado-en-be-grand-polanco-con-65875062.html,"MN 33,500","Lago Iseo 305
Ampliación Granada, Miguel Hidalgo","75 m² lote, 1 rec., 1 baño, 1 estac.",Las Águilas 1a Sección
"Departamento amueblado en renta, sls Marina Beach, Cancún. Descubre la elegancia y el lujo en sls Marina Beach Cancún con este impresionante departamento en renta de 3 recámaras, completamente amueblado y equipado. Disfruta de vistas panorámicas al canal, campo de golf y mar caribe desde su terraza privada. Además, cuenta con un cuarto de servicio, área de lavado y baño de visitas. Las amenidades exclusivas incluyen piscina infinity, gimnasio de clase mundial, restaurantes y acceso a la playa. Este es su oasis de lujo en el paraíso de Cancún. ¡Contáctenos para más información y programar una visita!",https://www.inmuebles24.com/propiedades/clasificado/veclapin-departamento-amueblado-en-venta-y-renta-sls-marina-91311752.html,"MN 120,000","Sls Marina Beach
Zona Hotelera, Cancún","185 m² lote, 3 rec., 4 baños, 2 estac.",Las Águilas 1a Sección
Rentaplazacarso. com. departamento amueblado Y equipado. Bien decorado. 70 M2. 1 recamara con baño completo Y vestidor. Area de lavado. Acabados de alta calidad. Amplias cristaleras. Muy luminoso. 1 cajon de estacionamiento. Vigilancia 24 horas. Estacionamiento para visitas. Amplio conjunto de amenidades. Torre muy tranquila Y segura. Conexion directa A la plaza. Todos los servicios alrededor. Ubicacion inmejorable. Mantenimiento incluido en el precio. Solo se renta por periodos de larga estancia.,https://www.inmuebles24.com/propiedades/clasificado/alclapin-plaza-carso:-amueblado-de-1-recamara-147186324.html,"MN 37,500","Calle Lago Zurich 219
Ampliación Granada, Miguel Hidalgo","70 m² lote, 1 rec., 1 baño, 1 estac.",Las Águilas 1a Sección
"¡Vive en Col Narvarte! Planta Baja Exterior con Terraza Privada, Nuevo. ¡Estrena departamento en 2do piso con balcón en Narvarte! Vive en el corazón de la ciudad, sobre Av. Cuauhtémoc, en un desarrollo exclusivo, seguro y pensado para la vida familiar. Este departamento exterior combina amplitud, practicidad y confort, con una terraza privada que se convierte en el lugar perfecto para que los niños jueguen con seguridad, organizar comidas al aire libre o disfrutar momentos de tranquilidad. Beneficios y características del departamento: -exterior: fácil acces ideal para familias con niños pequeños o recién casados. -2 recámaras amplias con espacio para closets grandes, perfectas para el descanso y la privacidad de cada integrante. -2 baños completos, que evitan esperas en la rutina diaria. -Cocina equipada con barra desayunadora, pensada para reuniones familiares o comidas rápidas. -Balcón privado, un espacio para plantas o convivencias. -Grandes ventanales que inundan cada espacio de luz natural y permiten ventilación cruzada, manteniendo el ambiente fresco. -Área de lavado independiente para mayor comodidad. -1 cajón de estacionamiento de uso exclusivo. El desarrollo ofrece: *Elevador con acceso directo a los demás niveles. *Vigilancia 24/7 para la seguridad de tu familia. *Ubicación inmejorable: *Sobre Av. Cuauhtémoc, con Metro y Metrobús a pocos pasos. *Conexión inmediata a Xola, Eje Central, Viaducto y Eje 5. *A minutos de parques, escuelas, supermercados, cafeterías y todo lo que tu familia necesita. Vivir en Narvarte es disfrutar de una colonia segura, bien comunicada y con un ambiente tranquilo, perfecta para crecer y convivir. ¡Agenda tu visita hoy y conoce el que podría ser el nuevo hogar de tu familia!",https://www.inmuebles24.com/propiedades/clasificado/alclapin-departamento-en-renta-narvarte-poniente-beyond-147415830.html,"MN 25,000","Av. Cuauhtémoc 718
Narvarte Poniente, Benito Juárez","80 m² lote, 2 rec., 2 baños, 1 estac.",Las Águilas 1a Sección
"Detalles del departamento: Renta: $34, 000 mxn. Precio: $7, 500, 000 mxn. Área: 120 m² Piso: 3, Torre A, Vista Huasteca. Distribución: Cocina. Área social. Balcón con vista al norte. Recámara principal con walk-in closet. Recámara secundaria. 3 baños completos. Centro de lavado. 2 lugares de estacionamiento. Bodega. Equipamiento: Cocina (no incluye electrodomesticos) Boiler. Clósets en recámaras. Canceles en baños. Persianas en sala y habitaciones. 3 equipos de aire acondicionado. Amenidades del conjunto: Más de 4, 000 m² con áreas recreativas: juegos infantiles, alberca, canchas, asadores, zona zen, áreas de mascotas, campamento, casa en el árbol y más. Seguridad 24/7 con circuito cerrado, control de acceso con tarjetas. Áreas exteriores: alberca, fogata, cancha polivalente, áreas para mascotas, entre otros.",https://www.inmuebles24.com/propiedades/clasificado/veclapin-departamento-venta-en-torre-lanka-santa-catarina.-147053484.html,"MN 34,000","Lanka
Bosques de La Huasteca, Santa Catarina","120 m² lote, 2 rec., 3 baños, 2 estac.",Las Águilas 1a Sección
"Lujoso departamento totalmente amueblado Y equipado de estilo Contemporaneo con privilegiada ubicación en la colonia Polanco, entre Campos Eliseos y Ruben Dario, Inmediato a Paseo de la Reforma, Presidente Mazarik y Periferico bonita calle tranquila y arbolada, a una cuadra del Hotel Camino Real y Bosque de Chapultepec, fácil y rápido acceso, de estilo contemporáneo, amplios y cómodos espacios, exterior, iluminado, finos acabados, con vista panorámica, ideal para extranjeros o ejecutivos, cuenta con: Amplia estancia, 02 recámaras, 01 1/2 baños, 01 estacionamiento, preciosa cocina integral equipada con electrodomesticos y menaje de casa, area de lavado con lavasecadora premium, Persianas, linea telefónica, cable e internet. No se aceptan Mascotas",https://www.inmuebles24.com/propiedades/clasificado/alclapin-campos-eliseos-departamento-amueblado-2-recamaras-con-53090918.html,"MN 30,000","Campos Eliseos
Polanco, Miguel Hidalgo","105 m² lote, 2 rec., 1 baño, 1 estac.",Las Águilas 1a Sección
"Exclusivo Departamento en Landmark Reserve – Piso 13 con Vistas Espectaculares. Descubre la sofisticación en este departamento nuevo de 127 m², ubicado en el icónico Landmark Reserve, en el corazón de la ciudad. Con un diseño moderno y acabados de lujo, este espacio redefine el concepto de vida urbana premium. Distribución: 2 recámaras amplias, cada una con su propio baño completo para mayor privacidad y confort. Baño de visitas ideal para recibir invitados. Baño de servicio para mayor funcionalidad. Amenidades de primer nivel: Vive una experiencia única con acceso a todas las amenidades que Landmark Reserve ofrece: ""mantenimiento incluido"" incluye bodega. ¡Agenda tu visita y vive la experiencia Landmark!",https://www.inmuebles24.com/propiedades/clasificado/alclapin-departamento-en-renta-en-landmark-reserve-puerta-de-147103441.html,"MN 56,000","AV PATRIA #1937 - 1103-A, Puerta de Hierro, Zapopan
Puerta de Hierro, Zapopan","127 m² lote, 2 rec., 2 baños, 2 estac.",Las Águilas 1a Sección
"Vive en un desarrollo con diversas amenidades, gran ubicación y espectaculares áreas verdes en Lomas de Chapultepec. El departamento cuenta con gran iluminación, es silencioso y cálido, perfecto para hacerlo tu hogar. Ideal para familias. 223. 53 m2 totales. 3 recamaras con baño y vestidor. 2 estacionamientos. Bodega. Amplia estancia. Estudio tv. Cocina integral. Cuarto de servicio completo y lavandería. Todos los servicios. El edificio cuenta con: Alberca. Spa. Gimnasio. Ludoteca con personal de planta. Salón de fiestas. Valet parking y estacionamiento para visitas",https://www.inmuebles24.com/propiedades/clasificado/alclapin-departamento-en-renta-en-lomas-de-chapultepec-146803690.html,"MN 80,000","Cofre de Perote 245
Lomas de Chapultepec, Miguel Hidalgo","223 m² lote, 3 rec., 3 baños, 2 estac.",Las Águilas 1a Sección
"Departamento disponible, Isla Dorada, Cancún Quintana Roo. Este exclusivo Penthouse en Venta o Renta de 420 m², único en su piso, ofrece total privacidad y espectaculares vistas a las albercas y al canal. Cuenta con 4 amplias recámaras, cada una con baño completo y walk-in closet, así como elegantes espacios como sala, comedor, family room y un estudio independiente. Dispone de dos grandes terrazas con vista al canal de amarres y acceso directo a la laguna, además de una cocina independiente totalmente equipada. El Penthouse incluye un medio baño de visitas, área de servicio con lavandería y un cuarto de servicio con baño completo. Todas las estancias están equipadas con aire acondicionado de control independiente y ventiladores de techo con luminaria. Para mayor seguridad, cuenta con cortinas anticiclónicas en todo el departamento. También dispone de dos cajones de estacionamiento techados, y acceso a excelentes amenidades como alberca, muelle privado y casa club con spa, gimnasio, alberca y canchas deportivas. Todo ello con un sistema de doble filtro de seguridad las 24 horas.",https://www.inmuebles24.com/propiedades/clasificado/veclapin-departamento-disponible-isla-dorada-cancun-quintana-145758547.html,"MN 85,000","Isla Dorada
Zona Hotelera, Cancún","420 m² lote, 4 rec., 5 baños, 2 estac.",Las Águilas 1a Sección
"Espectacular departamento en renta en Eugenio Sue, con acabados de lujo cuenta con 3 habitaciones, la principal con vestidor y baño con tina, la 2a con baño y vestidor,, la 3a con amplio closet, 3 baños completos, cuarto de servicio con baño propio, terraza, bodega y 2 estacionamientos, en una calle tranquila, a unos pasos de Masaryk y el Parque Lincoln",https://www.inmuebles24.com/propiedades/clasificado/alclapin-espectacular-departamento-en-renta-en-eugenio-sue-146983381.html,"MN 90,000","Eugenio Sue 236
Polanco, Miguel Hidalgo","250 m² lote, 3 rec., 4 baños, 2 estac.",Las Águilas 1a Sección
"¡Listo para ocuparlo! Características: -Planta Baja. -105 m2. -2 recámaras. -2 baños completos. -Centro de Lavado. -Amueblado y totalmente equipado. -Se aceptan mascotas pequeñas (se pide medio deposito) -Estacionamiento en la parte de afuera. Amenidades: -Restaurante Bar. - Área de Yoga. -Gimnasio. -Alberca tipo isla. -Hamaka Deck. -Coworking. -Alberca con Chapoteadero. -2 cenotes, solo acceso para nadar en uno de ellos. -Mirador. -Play Ground. -Minimarket. -Petpark",https://www.inmuebles24.com/propiedades/clasificado/alclapin-selva-norte-amueblado-y-equipado!-departamento-2-147210545.html,"MN 15,000","Selva Norte
Tulum, Tulum","105 m² lote, 2 rec., 2 baños, 1 estac.",Las Águilas 1a Sección
"Ph en Renta – Roma-Condesa. 35, 000 mxn (incluye mantenimiento, gas e internet) Ubicado en el corazón del corredor Roma-Condesa, este ph totalmente amueblado y equipado combina estilo, comodidad y una ubicación inmejorable. Características: *2 recámaras con clóset. *2. 5 baños. *Cocina integral equipada. *Área de lavado (incluye lavadora y secadora) *tv y WiFi. Ubicación: *3er piso (sin elevador) *Exterior. Adicionales: *No cuenta con estacionamiento, pero hay pensión para autos a 2 cuadras (Calle Durango) *Excelente conectividad y rodeado de restaurantes, cafés, parques y opciones culturales. Vive en una de las zonas más vibrantes y solicitadas de la cdmx.",https://www.inmuebles24.com/propiedades/clasificado/alclapin-departamento-ph-en-renta-en-la-roma-66498162.html,"MN 35,000","Salamanca 69 Condesa, Benito Juárez
Condesa, Cuauhtémoc","100 m² lote, 2 rec., 2 baños",Las Águilas 1a Sección
"Departamento en renta en el exclusivo residencial agwa bosques con espectacular vista hacia bosques de las lomas. Consta de 142 M2 habitales, estancia sala comedor, cocina integral abierta Y equipada, cuarto de television, medio de baño de visitas, recamara principal con vestidor Y baño completo, 2 recamaras secundarias con baño completo Y closet, area de lavado. 3 cajones de estacionamiento Y bodega. cuenta con un club privado de primer nivel que brinda servicio A los residentes donde tendran acceso A amenidades exclusivas tales como: -alberca con carril de nado, area de asadores. -cafeteria, zona pet friendly. -gimnasio & cardio room, ludoteca. -busines & social room, spa. -teen lounge, vapor. -estudios privados. EasyBroker id: eb-mx1329",https://www.inmuebles24.com/propiedades/clasificado/alclapin-depto-en-renta-en-el-exclusivo-residencial-agwa-81286327.html,"MN 43,000","CARRETERA MEXICO TOLUCA 1535
Bosques de las Lomas, Cuajimalpa de Morelos","145 m² lote, 3 rec., 3 baños, 3 estac.",Las Águilas 1a Sección
Renta de loft en torre west. nuevo. 1 recamara. 1. 5 baños. sala. comedor. hermosa cocina integral. tv super amplia. zona panorama. servicios independientes. area de recepcion. 1 cajon de estacionamiento. elevador,https://www.inmuebles24.com/propiedades/clasificado/alclapin-renta-de-loft-en-torre-west-zona-panorama-145655486.html,"MN 17,500","PANORAMA
Fraccionamiento Panorama, León","63 m² lote, 1 rec., 1 baño, 1 estac.",Las Águilas 1a Sección
"¡Vive en una de las zonas más exclusivas de la Ciudad de México con una vista inigualable! Este espectacular departamento amueblado y decorado de 171 m² se encuentra en el 6to piso del Conjunto Condominal Lago Zúrich 272, en la vibrante colonia Ampliación Granada. Características del departamento: * Vista espectacular al Museo Soumaya. * Sala y comedor amplios. * Sala de tv para tus momentos de entretenimiento. * Cocina equipada con barra y línea blanca. * 3 recámaras y 3 baños completos. * Cuarto de servicio con baño. * Cuarto de lavado. * 2 cajones de estacionamiento. El condominio ofrece amenidades de primer nivel que te harán sentir como si estuvieras de vacaciones permanentes: gimnasio, alberca, ludoteca, salón de eventos, cancha de pádel, sala de reuniones y seguridad las 24 horas. Precio de renta: 92, 000 mxn. ¡No pierdas la oportunidad de vivir en el corazón de la modernidad y el arte de la cdmx! Para más información o agendar una visita, contáctanos.",https://www.inmuebles24.com/propiedades/clasificado/alclapin-en-renta-departamento-carso-botticelli-lago-zurich-147266318.html,"MN 92,000","Calle Lago Zurich 272
Ampliación Granada, Miguel Hidalgo","171 m² lote, 3 rec., 3 baños, 2 estac.",Las Águilas 1a Sección
"Renta Departamento de 3 recamaras cada una con su baño y vestidor, con cocina de alta gama, sala comedor y con amplia sala de tv tambien cuenta con cuarto de servicio esta ubicado en una de las zonas de mas alta plusvalía de todo Querétaro- Zona Campanario- Acabados de lujo, amenidades con certificación aaa, y dentro de un desarrollo premiado como el mejor de Latinoamérica. Cine, Spa, Alberca, zona de asadores, Ludoteca, Área con CandyBar, mesa de billar, futbolito, vista a los arcos de Querétaro entre mas amenidades para todos los integrantes de tu familia y amistades para pasar momentos inolvidables. En tu departamento encontraras el estilo de vida que te mereces, con acabados de lujo y una vista panorámica hacia el Campanario, Departamento controlable por Alexa, cuarto deservicio con baño completo propio, en el piso 4 y con excelente ubicación y vistas. Tu propiedad cuenta con 3 recamaras con baño completo, 2 de ellas cuentan con vestidor y la principal tiene una hermosa vista al Campanario. *Precio y disponibilidad sujeto a cambio sin previo aviso* Requisitos para renta. Deposito. Renta y Poliza Juridica del 35% del valor de la renta",https://www.inmuebles24.com/propiedades/clasificado/alclapin-renta-departamento-de-lujo-a-estrenar-en-the-view-zona-144426169.html,"MN 50,000","EL CAMPANARIO
El Campanario, Querétaro","230 m² lote, 3 rec., 3 baños, 3 estac.",Las Águilas 1a Sección
"Departamento en pb de 213 metros habitables más terraza. 3 recamaras con baño cada una, cocina abierta, medio baño de visitas, cuarto de lavado y cuarto de servicio, balcón en estancia y recamara principal. El desarrollo cuenta con amenities (carril de nado, jacuzzi, salas de masaje, juegos infantiles, asadores, pista de jogging, jardines) disponible finales de mayo 2025",https://www.inmuebles24.com/propiedades/clasificado/alclapin-departamento-renta-col.-polanco-146302329.html,"MN 130,000","Av. Presidente Masaryk
Polanco, Miguel Hidalgo","213 m² lote, 3 rec., 3 baños, 2 estac.",Las Águilas 1a Sección
