Título,Enlace,Precio,Dirección,Características,Colonia de Origen
"Bonito y amplio departamento en Condominio Horizonte a solo 5 min de Galerías Atizapán y la autopista Chamapa la Venta, de 148 m2, amplia estancia con terraza, cocina integral totalmente equipada, 3 recámaras, 2 baños y la principal con baño propio y vestidor, 3 lugares de estacionamiento, un área para juegos infantiles y un salón para eventos, opcional la compra de bodega de 6 m2, vigilancia las 24 hrs.",https://www.inmuebles24.com/propiedades/clasificado/alclapin-departamento-en-renta-mexico-nuevo-atizapan-de-143370620.html,"MN 20,000","Ahooro Popular 1
México Nuevo, Atizapán de Zaragoza","148 m² lote, 3 rec., 2 baños, 3 estac.",México Nuevo
"Departamento en mexico nuevo A estrenar, depto de 96 mts cuenta con 3 recamaras la principal con baño Y closet amplio, 2 recamaras secundarias con closet Y baño compartido, cocina abierta con barra de granito, area de lavado, sala-comedor con terraza, depto con persianas, 2 lugares de estacionamiento techados, elevador, vigilancia 24 hrs, cuenta el desarrollo con salon de eventos Y roof garden comunal, tienen una bodega de 2 X 1 mt. Edificio de 6 pisos con elevador con 23 deptos por torre. Si deseas concertar una cita favor comunicate al Ver datos con erika morales sera un gusto atenderte",https://www.inmuebles24.com/propiedades/clasificado/alclapin-renta-de-departamento-en-mexico-nuevo-146524103.html,"MN 18,500","DR. GUSTAVO BAZ PRADA NO. 26 A-1
México Nuevo, Atizapán de Zaragoza","96 m² lote, 3 rec., 2 baños, 2 estac.",México Nuevo
"Hermoso departamento en renta en México Nuevo, Atizapán de Zaragoza! ¡Amplios espacios, roof garden privado y excelente ubicación! Renta mensual: $19, 000 (incluye Mtto) Características: • Departamento de 87. 92 m² • Roof garden semicubierto de 45. 85 m² dando un total de 135 M2 • Bodega privada de 9. 36 m² • 2 estacionamientos independientes? Distribución interior: • 2 recámaras con excelente iluminación • 2 baños completos • Cocina equipada • Cuarto de lavandería • Roof garden privado con área techada, ideal para convivencias? Servicios y almacenamiento de agua: • 2 cisternas de 18, 000 litros cada una • 2 tinacos de 5, 000 litrosUbicado en una zona tranquila, segura y con excelente conectividad en México Nuevo, Atizapán de Zaragoza en la calle de Juan Ángulo, a escasos de Plaza Crystal Atizapan, donde se encuentra el Chedraui",https://www.inmuebles24.com/propiedades/clasificado/alclapin-departamento-mexico-nuevo-147174141.html,"MN 19,000","Atizapan, Estado de Mexico
México Nuevo, Atizapán de Zaragoza","135 m² lote, 2 rec., 2 estac.",México Nuevo
"¡Hermoso departamento en renta en México Nuevo, Atizapán de Zaragoza! ¡Amplios espacios, roof garden privado y excelente ubicación! Renta mensual: 19, 000 (incluye mantenimiento) Mantenimiento: 1, 600 incluido en el precio. Características: • Departamento de 87. 92 m² • Roof garden semicubierto de 45. 85 m² • Bodega privada de 9. 36 m² • 2 estacionamientos independientes. Distribución interior: • 2 recámaras con excelente iluminación. • 2 baños completos. • Cocina equipada. • Cuarto de lavandería. • Roof garden privado con área techada, ideal para convivencias. Servicios y almacenamiento de agua: • 2 cisternas de 18, 000 litros cada una. • 2 tinacos de 5, 000 litros. Ubicado en una zona tranquila, segura y con excelente conectividad en México Nuevo, Atizapán de Zaragoza. Agenda tu cita y conócelo! ¡Una excelente opción para vivir con estilo y comodidad!",https://www.inmuebles24.com/propiedades/clasificado/alclapin-departamento-en-renta-con-roof-top-hermoso-147151443.html,"MN 18,000","Calle Tabasco
México Nuevo, Atizapán de Zaragoza","88 m² lote, 2 rec., 2 baños, 2 estac.",México Nuevo
"Departamento en Renta ph con Roof Garden de uso exclusivo, muy bien ubicado en México Nuevo. -distribución-3 Recámaras2 BañosMedio BañoCocina IntegralBarra - DesayunadorEstanciaAlacenaÁrea de Lavado2 Estacionamientos CubiertosBalconesRoof GardenBodega-equipamiento-ElevadorPortón eléctricoCámaras de seguridadCisterna en el Edificio-amenidades-Terraza Comunal con tarjaDos medios baños dan servicio a la terraza-alrededores-A 3 calles de Av. Pdte. Adolfo López MateosA 7 min de Plaza Galerías AtizapánA 8 minutos de la Autopista México - ChamapaA 8 minutos de Zona Esmeralda-Requisitos-1 Mes de Renta1 Mes de Deposito1 Póliza Jurídica MediaFiador con bien inmueble",https://www.inmuebles24.com/propiedades/clasificado/alclapin-departamento-en-renta-mexico-nuevo-3-recamaras-147284724.html,"MN 18,000","México Nuevo, Atizapán de Zaragoza
México Nuevo, Atizapán de Zaragoza","122 m² lote, 32 rec., 2 estac.",México Nuevo
