Título,Enlace,Precio,Dirección,Características,Colonia de Origen
"Este apartamento totalmente amueblado y listo para entrar a vivir está disponible desde el 13-06-2025. Asesores inmobiliarios, compartimos comisión. Se puede emitir factura. Para ser atendido en inglés, marca el número de nuestra oficina. Ofrecemos precios personalizados para cualquier duración. Las tarifas pueden variar en función de las fechas exactas de entrada y salida. La tarifa para esta vivienda comienza en mxn 66, 600* / mes. Visita nuestro sitio web e introduce las fechas de tu estancia para ver los precios actualizados para tu reserva específica. *Los precios estas basados en (1) disponibilidad desde la fecha de entrada (2) rentas a un año pagadas de contado (3) incluyendo servicios de agua, luz, wifi y gas. Siéntete como en casa dondequiera que elijas vivir con Blueground. Te encantará este acogedor Polanco amueblado apartamento de dos dormitorios con su moderna decoración, cocina totalmente equipada, y alegre salón. Con magníficas vistas. Idealmente situado, estarás cerca de todo lo mejor que Mexico City puede ofrecer. (id #mex117) Diseñado pensando en ti. Precioso mobiliario, cocina totalmente equipada, smart tv y un altavoz inalámbrico premium son sólo algunas de las comodidades que encontrarás en el interior de este apartamento de dos dormitorios. Idealmente situado en Mexico City, encontrarás mucho para disfrutar. Cuando estés listo para relajarte, te alegrará descubrir que cada habitación Blueground viene con colchones de calidad superior, ropa de cama de lujo y toallas acogedoras. Nosotros nos encargamos de todo para que sólo tengas que llegar y empezar a disfrutar. Este apartamento también ofrece Lavadora en el apartamento. Camas disponibles. Cama Queen, 160cm. Cama Queen, 160cm. Servicios. Entre los servicios exclusivos de este edificio apartamento de dos dormitorios se incluyen: Portero. Secadora. Ascensor. Lavadora. Aparcamiento. Se admiten mascotas. Llegada y ayuda continua. Todo apartamento es tuyo para que lo disfrutes. Un miembro del equipo de Blueground te recibirá personalmente o te dará instrucciones para que te hagas el check-in por ti mismo. Durante su estancia, tendrá acceso a nuestro equipo de Atención al Cliente a través de la aplicación Blueground. Puedes programar limpiezas adicionales, enviar solicitudes de mantenimiento, y ver nuestras recomendaciones de tu barrio con sólo unos toques. Te informaremos de todos los detalles una vez confirmada su estancia. Idealmente situado. Polanco es uno de los barrios más elegantes y urbanos de Ciudad de México. A lo largo de la Avenida Presidente Masaryk encontrarás algunas de las tiendas y restaurantes más exclusivos de la ciudad. Otros aspectos a tener en cuenta. Los servicios del edificio pueden tener un coste adicional. Este apartamento Blueground tiene opciones flexibles de alquiler, lo que te permite reservarlo por un mes, un año o más. Este apartamento se puede reservar para estancias cortas, con la opción de ampliarlo a un mes o más. Se admiten mascotas, aunque se aplican restricciones de peso y raza y pueden estar sujetas a tarifas adicionales. El aparcamiento se ofrece en función de la disponibilidad y es de pago. Nos enorgullece garantizar que todas las fotos que se muestran están tomadas en nuestros apartamentos con nuestro mobiliario real. Dicho esto, renovamos regularmente nuestra decoración y disposición de los muebles, que puede diferir de lo que aparece en la foto.",https://www.inmuebles24.com/propiedades/clasificado/alclapin-polanco-depa-amueblado-2-recamaras-2-banos-security-144932614.html,"MN 66,600","Juan Vazquez de Mella 421, Polanco, Polanco I Secc, Miguel Hidalgo
Polanco I Sección, Polanco","99 m² lote, 2 rec., 2 baños, 1 estac.",Pradera II Sección
"Departamento en Torre Iris, Vía Cordillera, ubicado en Santa Catarina, Nuevo León, Cercanía a San Pedro Garza García. Ideal para quienes buscan comodidad, seguridad y un estilo de vida moderno en una de las zonas más exclusivas de Valle Poniente. **se renta sin amueblar** Precio de renta: $40, 000 mxn con mantenimiento incluido. Superficie: 126 m² Cocina equipada. 2 recámaras con baño completo y vestidor. Terraza con vista panorámica. Baño de visitas. Área de lavandería. 2 cajones de estacionamiento. Equipamiento: persianas, blackouts y minisplits en recámaras. El mantenimiento ya está incluido en la renta. Amenidades: área de asadores, salón de eventos y espacios comunes de primer nivel que complementan una experiencia de vida exclusiva y segura. Departamento en renta Torre Iris, renta Vía Cordillera, departamento en Valle Poniente, renta San Pedro Garza García, departamentos modernos en renta Monterrey, renta departamento con terraza, departamento con 2 recámaras y vestidor, renta con amenidades y seguridad 24/7.",https://www.inmuebles24.com/propiedades/clasificado/alclapin-departamento-en-renta-torre-iris-via-cordillera-147408368.html,"MN 40,000","EJE INTERIOR
Vía Cordillera, Santa Catarina","126 m² lote, 2 rec., 2 baños, 2 estac.",Pradera II Sección
"Espectacular departamento en venta o renta en bosque real. En venta se pueden entregar en obra para que lo termines a tu gusto o terminados con acabados de súper lujo que podrás elegir. Cuenta con 3 recámaras cada una con su baño y vestidor, sala, comedor, family, estudio, cocina y áreas de servicio. Tiene amplias terrazas y todo el departamento tiene vistas 360 grados al campo de golf y las montañas. Increíbles amenidades, alberca cubierta, gym, spa, ludoteca, salón lounge, business center, salón de fiestas, asadores, jardines con juegos para niños y muchas cosas más.",https://www.inmuebles24.com/propiedades/clasificado/veclapin-vendo-o-rento-departamento-a-estrenar-en-bosque-real-144678422.html,"MN 130,000","Core 31
Bosque Real, Huixquilucan","457 m² lote, 3 rec., 3 baños, 4 estac.",Pradera II Sección
"Vive frente a la marina en Puerto Cancún. Departamento de lujo con 4 recámaras y amplia terraza con vista espectacular, en el residencial más exclusivo de la ciudad. Distribución: &#x2714;4 recámaras con baño completo. &#x2714;5 baños completos + 1 medio baño. &#x2714;Cuarto de servicio y área de lavado. &#x2714;Cocina integral con plancha de granito gris. &#x2714;Sala-comedor concepto abierto. &#x2714;Terraza con vista panorámica. Amenidades: &#x2714;Lobby con seguridad 24/7. &#x2714;Alberca y jacuzzi. &#x2714;Gimnasio. &#x2714;Sala de juntas. &#x2714;Terraza para eventos. &#x2714;Acceso peatonal a Plaza Puerto Cancún. Renta: $100, 000 mxn mensuales. Ubicación privilegiada: rodeado de restaurantes, tiendas y entretenimiento, con seguridad y acceso directo a la marina.",https://www.inmuebles24.com/propiedades/clasificado/alclapin-renta-de-departamento-alba-puerto-cancun-147276390.html,"MN 100,000","Dirección no informada
Cancún Centro, Cancún","258 m² lote, 4 rec., 4 baños, 2 estac.",Pradera II Sección
Rednorte ofrece: clave interna: mf030. Estrena Departamento en Torre Anida (equipado/con opción a amoblar) Departamento de 110m2. En zona Santa María. Torre residencial nueva. El departamento consta de: 2 recámaras. 2 baños completos. 2 cajones de estacionamiento. Con balcón. Cocina integral con desayunadora. Área de lavado. Bodega. amenidades: Alberca. Gym. Ludoteca. Area de asadores. Area de Co-work. Salas de visita. Family dining. Juegos infantiles,https://www.inmuebles24.com/propiedades/clasificado/alclapin-departamento-en-renta-santa-maria-147448091.html,"MN 39,000","SANTA MARIA
Santa María, Monterrey","110 m² lote, 2 rec., 2 baños, 2 estac.",Pradera II Sección
"¡Ven a vivir en este espectacular departamento ph panorámico! Con amplios espacios y excelente iluminación, es un espacio perfecto para aquellos que buscan comodidad y estilo en su hogar. El departamento cuenta con dos opciones: amueblado por $85, 000 pesos al mes. En el primer nivel, encontrarás una espaciosa área social, perfecta para recibir invitados y pasar tiempo en familia. Cuenta con una cómoda sala, comedor, baño de visitas, cocina equipada y un balcón con vistas impresionantes. También encontrarás áreas de servicio y un cuarto de servicio completo. En el segundo nivel, encontrarás las tres habitaciones. Dos baño completos. La tercera habitación, tiene una pequeña terraza que ofrece una vista espectacular. Con una superficie total de 220 m2 habitables, este departamento ofrece un ambiente de confort. Además, cuenta con un estacionamiento para tu comodidad. Ven a vivir la experiencia de habitar este lugar especial. ¡Agenda tu visita hoy mismo y descubre todo lo que este departamento panorámico tiene para ofrecer! El mantenimiento ya esta incluido en la renta. Clave interna: ersaag2923",https://www.inmuebles24.com/propiedades/clasificado/alclapin-renta-ph-con-terraza-panoramica-145511942.html,"MN 70,000","Lamartine
Polanco V Sección, Polanco","220 m² lote, 3 rec., 3 baños, 1 estac.",Pradera II Sección
"¡Departamento de lujo en renta en Ndúcha, listo para habitar! * Disfruta de amplitud, comodidad y exclusividad en una de las zonas más privilegiadas de la ciudad. Depa 1062 – Piso 6 230 m² habitables. Renta mensual: 35, 000 amueblada. Renta mensual: 27, 000 sin muebles. *Distribución funcional y equipada: * - Sala-comedor con aire acondicionado. - Bar y ½ baño de visitas. - Cocina integral totalmente equipada: refrigerador, horno, microondas, lavavajillas. - Recámara principal con vestidor y baño completo. - Recámara secundaria con baño. - Cuarto de servicio con baño completo, lavadora y secadora. - Elevador con acceso directo. - 2 cajones de estacionamiento. - Televisión, internet y línea telefónica incluidos. Amenidades exclusivas del desarrollo: Gimnasio. Salón de juegos. Spa y jacuzzi. Ludoteca. Carril de nado. Cancha de pádel. Sala de juntas. Seguridad 24/7 Acabados premium Espacios amplios y funcionales. ¡Contáctanos para agendar tu visita y conoce tu próximo hogar en Ndúcha!",https://www.inmuebles24.com/propiedades/clasificado/alclapin-renta-de-departamento-en-torre-nducha-san-bernardino-147398269.html,"MN 35,000","Avenida Casiopea 4002
San Bernardino Tlaxcalancingo, San Andrés Cholula","230 m² lote, 2 rec., 2 baños, 2 estac.",Pradera II Sección
"Disfruta de la exclusividad y el lujo en Residencial Isla Dorada, ubicado en la prestigiosa Zona Hotelera de Cancún. Este departamento amueblado de 175 m² ofrece un estilo de vida único, con espacios diseñados para la comodidad y el disfrute. -La propiedad cuenta con sala, comedor, cocina ( Refrigerador, estufa a estrenar) dos recámaras, tres baños completos, cuarto de lavado ( centro de lavado a estrenar) cuarto de servicio, dos cajones de estacionamiento y una amplia terraza con vista a la laguna nichupte, ideal para quienes buscan vivir cerca del mar con todas las facilidades para la navegación. -Isla Dorada ofrece una amplia gama de amenidades que complementan un estilo de vida exclusivo, como un muelle privado, alberca, espacios para eventos, jardines, casa club, spa, gimnasio, canchas de tenis y un restaurante de primera clase. --Contamos con las 101 propiedades más exclusivas de Quintana Roo.",https://www.inmuebles24.com/propiedades/clasificado/alclapin-isla-dorada-departamento-en-renta-147160484.html,"MN 45,000","Isla Dorada Departamento En Renta Sin Muebles
Zona Hotelera, Cancún","174 m² lote, 2 rec., 2 baños, 2 estac.",Pradera II Sección
