Título,Enlace,Precio,Dirección,Características,Colonia de Origen
"Sé el primero en experimentar la vida de lujo en Gran Ciudad Nuevo Polanco. Departamentos en renta a estrenar con amenidades inigualables. Reserva tu departamento hoy mismo y disfruta de beneficios especiales. Deja tu información de contacto, ¡nuestro equipo se pondrá en contacto contigo en breve! Elige tu nuevo departamento: Estudios: desde $24, 300 mxn. Departamento de 1 Recámara: desde $27, 500 mxn. Departamento de 2 Recámaras: desde $36, 000 mxn. *Contamos con espacio de estacionamiento y bodega para renta. Contamos con una ubicación privilegiada en Av. Río San Joaquín #498, Col. Ampliación Granada, a tan solo un par de calles del Museo Soumaya, y los centros comerciales Antara Fashion Hall y Miyana. Reserva tu departamento y pregunta por nuestras promociones vigentes.",https://www.inmuebles24.com/propiedades/desarrollo/ememvein-gran-ciudad-nuevo-polanco-144968760.html,"MN 24,300","Río San Joaquín 498, Ampliación Granada, CDMX
Polanco, Miguel Hidalgo","329 un., 1 a 2 rec.",Pradera II Sección
"Este apartamento totalmente amueblado y listo para entrar a vivir está disponible desde el 04-05-2025. Asesores inmobiliarios, compartimos comisión. Se puede emitir factura. Para ser atendido en inglés, marca el número de nuestra oficina. Ofrecemos precios personalizados para cualquier duración. Las tarifas pueden variar en función de las fechas exactas de entrada y salida. La tarifa para esta vivienda comienza en $66, 600* / mes. Visita nuestro sitio web e introduce las fechas de tu estancia para ver los precios actualizados para tu reserva específica. *Los precios estas basados en (1) disponibilidad desde la fecha de entrada (2) rentas a un año pagadas de contado (3) incluyendo servicios de agua, luz, wifi y gas. Llega y empieza a vivir desde el primer día en Mexico City con este encantador Apartamento Blueground de dos dormitorios. Te encantará volver a casa a este apartamento cuidadosamente amueblado, bellamente diseñado y totalmente equipado en Polanco. Con impresionantes vistas de la ciudad. (id #mex99) Diseñado pensando en ti. Precioso mobiliario, cocina totalmente equipada, smart tv y un altavoz inalámbrico premium son sólo algunas de las comodidades que encontrarás en el interior de este apartamento de dos dormitorios. Idealmente situado en Mexico City, encontrarás mucho para disfrutar. Cuando estés listo para relajarte, te alegrará descubrir que cada habitación Blueground viene con colchones de calidad superior, ropa de cama de lujo y toallas acogedoras. Nosotros nos encargamos de todo para que sólo tengas que llegar y empezar a disfrutar. Este apartamento también ofrece Lavadora en el apartamento. Camas disponibles. Cama Queen, 160cm. Cama Queen, 160cm. Servicios. Entre los servicios exclusivos de este edificio apartamento de dos dormitorios se incluyen: Portero. Secadora. Ascensor. Lavadora. Aparcamiento. Se admiten mascotas. Llegada y ayuda continua. Todo apartamento es tuyo para que lo disfrutes. Un miembro del equipo de Blueground te recibirá personalmente o te dará instrucciones para que te hagas el check-in por ti mismo. Durante su estancia, tendrá acceso a nuestro equipo de Atención al Cliente a través de la aplicación Blueground. Puedes programar limpiezas adicionales, enviar solicitudes de mantenimiento, y ver nuestras recomendaciones de tu barrio con sólo unos toques. Te informaremos de todos los detalles una vez confirmada su estancia. Idealmente situado. Polanco es uno de los barrios más elegantes y urbanos de Ciudad de México. A lo largo de la Avenida Presidente Masaryk encontrarás algunas de las tiendas y restaurantes más exclusivos de la ciudad. Otros aspectos a tener en cuenta. Los servicios del edificio pueden tener un coste adicional. Este apartamento Blueground tiene opciones flexibles de alquiler, lo que te permite reservarlo por un mes, un año o más. Se admiten mascotas, aunque se aplican restricciones de peso y raza y pueden estar sujetas a tarifas adicionales. El aparcamiento se ofrece en función de la disponibilidad y es de pago. Nos enorgullece garantizar que todas las fotos que se muestran están tomadas en nuestros apartamentos con nuestro mobiliario real. Dicho esto, renovamos regularmente nuestra decoración y disposición de los muebles, que puede diferir de lo que aparece en la foto.",https://www.inmuebles24.com/propiedades/clasificado/alclapin-polanco-depa-amueblado-2-recamaras-2-banos-security-143737653.html,"MN 66,600","Juan Vazquez de Mella 421, Polanco, Polanco I Secc, Miguel Hidalgo
Polanco I Sección, Polanco","114 m² lote, 2 rec., 2 baños, 1 estac.",Pradera II Sección
"Renta sin Aval en 24 horas. Proceso ágil y flexible. / Lease without guarantor with agile and flexible processes in 24 hours. Opción de departamentos amueblados por Bo-Concept. / Furnished apartments by Bo-Concept available. Todos los departamentos incluyen electrodomésticos. (microondas, lava-secadora, Refrigerador, estufa con horno, lavavajillas) persianas / canceles. All apartments include appliances. (microwave, washer-dryer, refrigerator, stove with oven, dishwasher) blinds / gates. ! estrena depa en la Torre mas emblemática de la cdmx! Brand new apartments just released to the market in the most iconic tower in cdmx. Departamentos tipo: Loft, 1 y 2 recámaras; a un minuto de Bosques de las Lomas y Arcos Bosques (El Pantalón) en medio de escuelas, universidades, hospitales, centros comerciales y toda la oferta de servicios que ofrecen Santa Fe y Bosques. Potencializa tu vida con nuestras amenidades: Alberca. Co-Working. Bar. Cafetería. Salón de Fiestas. Game Room. Chill Spot. Pet Zone. Área de asadores con fogateros. Gimnasio. Yoga Room. Motor Lobby. Sala de recepción. Concierge Vigilancia 24hrs. cctv. Shuttle que te conecta con los principales puntos de la cdmx y Santa Fe. Renta sin aval; Departamentos nuevos, Totalmente equipados con electrodomesticos nuevos, agenda una cita y prepara todo para estrenar! !",https://www.inmuebles24.com/propiedades/desarrollo/ememvein-ri-a-bosques-renta-y-estrena-nuestros-depas.-loft-1-141933064.html,"MN 19,800","carretera mex - tol 1535
Santa Fe Cuajimalpa, Cuajimalpa de Morelos","455 un., 1 a 2 rec., 57 m² lote",Pradera II Sección
Rentaplazacarso. com. departamento amueblado Y equipado. Bien decorado. 70 M2. 1 recamara con baño completo Y vestidor. Area de lavado. Acabados de alta calidad. Amplias cristaleras. Muy luminoso. 1 cajon de estacionamiento. Vigilancia 24 horas. Estacionamiento para visitas. Amplio conjunto de amenidades. Torre muy tranquila Y segura. Conexion directa A la plaza. Todos los servicios alrededor. Ubicacion inmejorable. Mantenimiento incluido en el precio. Solo se renta por periodos de larga estancia.,https://www.inmuebles24.com/propiedades/clasificado/alclapin-nuevo-polanco:-amueblado-de-1-recamara-147186405.html,"MN 37,500","Calle Lago Zurich 219
Polanco, Miguel Hidalgo","70 m² lote, 1 rec., 1 baño, 1 estac.",Pradera II Sección
"Tu nuevo depa en Nápoles, cdmx – Cerca del wtc y listo para ti️ ¿Buscas comodidad, estilo y ubicación en un solo lugar? Este departamento en renta en la colonia Nápoles tiene todo lo que necesitas: a solo unos pasos del World Trade Center, muy cerca de la Del Valle y rodeado de cafés, restaurantes y todo lo que te gusta. Renta sin complicaciones: ️ Sin aval. ️ Sin fianza. ️ Renta en 24 horas. Lo que incluye tu nuevo hogar: Espacios modernos y funcionales. Opción amueblado. Internet de alta velocidad incluido. Cocina equipada. Seguridad 24/7. Estacionamiento (sujeto a disponibilidad) Amenidades que elevan tu día a día: Coworking y salas de juntas. Cine privado y sala de juegos. Terraza con asadores. Gimnasio y área de yoga. Zona pet friendly. Elige entre estudios o departamentos de 1 y 2 recámaras, todos dentro de un edificio moderno, con diseño vanguardista y ambiente profesional.",https://www.inmuebles24.com/propiedades/desarrollo/ememvein-departamento-en-renta-en-la-napoles-del-valle-144568092.html,"MN 20,000","amalia by urbanista
Nápoles, Benito Juárez","199 un., 1 a 2 rec.",Pradera II Sección
"Departamento en privada con vigilancia, tipo duplex en planta alta, en dos niveles con 2 habitaciones, la principal con vestidor y baño, las recámaras secundarias comparten baño completo. Agradables espacios con gran iluminación, terraza con vista al área común. La privada cuenta con alberca Gym y salón de eventos. Para opción a renta: Mantenimiento incluido. Descripción: Cocina, comedor y sala con salida a la terraza. Baño de visitas y estacionamiento para 2 autos. 3 recámaras. La recámara principal tiene vestidor. Amenidades: Salón de eventos, sala social, alberca, y áreas verdes.",https://www.inmuebles24.com/propiedades/clasificado/alclapin-departamento-amueblado-de-3-hab.-en-juriquilla-santa-52153574.html,"MN 23,500","El Respiro
Santa Fe, Juriquilla","157 m² lote, 3 rec., 2 baños, 2 estac.",Pradera II Sección
"Vive en un desarrollo con diversas amenidades, gran ubicación y espectaculares áreas verdes en Lomas de Chapultepec. El departamento cuenta con gran iluminación, es silencioso y cálido, perfecto para hacerlo tu hogar. Ideal para familias. 223. 53 m2 totales. 3 recamaras con baño y vestidor. 2 estacionamientos. Bodega. Amplia estancia. Estudio tv. Cocina integral. Cuarto de servicio completo y lavandería. Todos los servicios. El edificio cuenta con: Alberca. Spa. Gimnasio. Ludoteca con personal de planta. Salón de fiestas. Valet parking y estacionamiento para visitas",https://www.inmuebles24.com/propiedades/clasificado/alclapin-departamento-en-renta-en-lomas-de-chapultepec-146803690.html,"MN 80,000","Cofre de Perote 245
Lomas de Chapultepec, Miguel Hidalgo","223 m² lote, 3 rec., 3 baños, 2 estac.",Pradera II Sección
"En ubicación privilegiada disfruta de un departamento completamente amueblado y equipado. Su diseño abierto permite un ambiente de gran comodidad. Precio de renta $23, 000 mensuales. • Incluye mantenimiento, internet y agua. Al entrar, cocina integral equipada con estufa y campana, tarja doble, microondas y refrigerador. En espacio abierto y confortable, isla para cuatro personas. Para disfrutar tus tardes una cómoda sala decorada con mesita al centro e iluminación. Para descansar cuenta con dos recámaras, la principal con baño completo, walk-in closet, cama matrimonial y balcón y una segunda recámara con ropería y cama matrimonial. Un baño completo para la segunda recámara y el área de sala comedor. Equipado con centro de lavado. Se permite mascota pequeña. Disponible para ocupación inmediata. Departamento completamente amueblado: • 92 m2. • 2 habitaciones. • 2 baños completos, • 1 balcón. • Cocina integral equipada. • 2 cajón de estacionamiento. • Seguridad 24/7. Amueblado y equipamiento: • 3 minisplit inverter. • Persianas. • Centro de lavado. • Refrigerador de 2 puertas. • Horno de microondas. • Estufa y campana. • Boiler. • 2 camas matrimoniales. Amenidades: • Seguridad 24/7 caseta. • Elevadores. • Área juegos infantiles. • Área social con asadores. • Alberca. • oxxo dentro del complejo.",https://www.inmuebles24.com/propiedades/clasificado/alclapin-departamento-amueblado-y-equipado-living-san-nicolas-147085864.html,"MN 23,000","Av. Lic. Adolfo López Mateos
Living San Nicolás, San Nicolás de los Garza","92 m² lote, 2 rec., 2 baños, 2 estac.",Pradera II Sección
"Departamento en Renta ubicado en Cosmocrat Puerta de Hierro, cerca de Plaza Comercial Andares, Plaza Acueducto, Unicenter, Parque Colomos. Características: Piso 13 - #501B. Mantenimiento Incluido. Construcción: 97 M2. - 2 Recámaras. - 2 Baños completos. - Sala. - Comedor. - Cocina. - Área de lavado. - 2 Cajones de estacionamiento. Extras: Cuenta con aire acondicionado y persianas. Amenidades: - Cine. - Gimnasio. - Lobby. - Salón de Juegos. - Terrazas con asadores. - Kids Club. - Merlot Room. - Roof Garden. - Alberca - Spa. - Áreas Verdes. *Cambios de informacion o precios sin previo aviso. Eb-mo7348. wig: pchh3Up",https://www.inmuebles24.com/propiedades/clasificado/alclapin-departamento-en-renta-cosmocrat-puerta-de-hierro-146068077.html,"MN 30,000","Avenida Acueducto 6075
Puerta de Hierro, Zapopan","97 m² lote, 2 rec., 2 baños, 2 estac.",Pradera II Sección
"Departamento recién remodelado en zona privilegiada! Disfruta de vivir en uno de los mejores puntos de la ciudad, donde todo lo tienes a unos pasos: restaurantes, tiendas, parques, cafés y más. Este hermoso departamento cuenta con: 2 recámaras amplias 2 baños completos 1 lugar de estacionamiento Espacios renovados con acabados modernos Excelente iluminación y distribuciónIdeal para quienes buscan comodidad, estilo y una ubicación 100% caminable. ¡Agenda tu cita y ven a conocer el que podría ser tu nuevo hogar! Mantenimiento incluido",https://www.inmuebles24.com/propiedades/clasificado/alclapin-departamento-en-virreyes-recien-remodelado-147225714.html,"MN 40,000","Alencastre al 200
Lomas de Chapultepec, Miguel Hidalgo","115 m² lote, 2 rec., 2 baños, 1 estac.",Pradera II Sección
"Detalles del departamento: Renta: $34, 000 mxn. Precio: $7, 500, 000 mxn. Área: 120 m² Piso: 3, Torre A, Vista Huasteca. Distribución: Cocina. Área social. Balcón con vista al norte. Recámara principal con walk-in closet. Recámara secundaria. 3 baños completos. Centro de lavado. 2 lugares de estacionamiento. Bodega. Equipamiento: Cocina (no incluye electrodomesticos) Boiler. Clósets en recámaras. Canceles en baños. Persianas en sala y habitaciones. 3 equipos de aire acondicionado. Amenidades del conjunto: Más de 4, 000 m² con áreas recreativas: juegos infantiles, alberca, canchas, asadores, zona zen, áreas de mascotas, campamento, casa en el árbol y más. Seguridad 24/7 con circuito cerrado, control de acceso con tarjetas. Áreas exteriores: alberca, fogata, cancha polivalente, áreas para mascotas, entre otros.",https://www.inmuebles24.com/propiedades/clasificado/veclapin-departamento-venta-en-torre-lanka-santa-catarina.-147053484.html,"MN 34,000","Lanka
Bosques de La Huasteca, Santa Catarina","120 m² lote, 2 rec., 3 baños, 2 estac.",Pradera II Sección
"Lujoso departamento totalmente amueblado Y equipado de estilo Contemporaneo con privilegiada ubicación en la colonia Polanco, entre Campos Eliseos y Ruben Dario, Inmediato a Paseo de la Reforma, Presidente Mazarik y Periferico bonita calle tranquila y arbolada, a una cuadra del Hotel Camino Real y Bosque de Chapultepec, fácil y rápido acceso, de estilo contemporáneo, amplios y cómodos espacios, exterior, iluminado, finos acabados, con vista panorámica, ideal para extranjeros o ejecutivos, cuenta con: Amplia estancia, 02 recámaras, 01 1/2 baños, 01 estacionamiento, preciosa cocina integral equipada con electrodomesticos y menaje de casa, area de lavado con lavasecadora premium, Persianas, linea telefónica, cable e internet. No se aceptan Mascotas",https://www.inmuebles24.com/propiedades/clasificado/alclapin-campos-eliseos-departamento-amueblado-2-recamaras-con-53090918.html,"MN 30,000","Campos Eliseos
Polanco, Miguel Hidalgo","105 m² lote, 2 rec., 1 baño, 1 estac.",Pradera II Sección
"Disfruta un departamento con alto diseño ubicado en la colonia Roma, te presentamos este concepto exclusivo en un desarrollo de 7 niveles con comercio en planta baja y 12 departamentos con terrazas. El departamento cuenta con: 60m2. 6m2 de balcón. 1 Recámara con vestidor. 1 Baño completo. Sala comedor. Cocina Integral. Iluminación inteligente. El edificio cuenta con: Jacuzzi con vista a la ciudad. Champagne Library. Roof Garden común. Elevado. Seguridad 24 hrs. Puntos de interés cercanos: Restaurantes. Jardín Pushkin. Librería. Hospital ángeles Roma",https://www.inmuebles24.com/propiedades/clasificado/alclapin-departamento-en-renta-amueblado-en-colonia-roma-147397807.html,"MN 39,000","Zacatecas 4
Roma Sur, Cuauhtémoc","66 m² lote, 1 rec., 1 baño",Pradera II Sección
"Se ofrece en renta departamento amueblado ubicado en el exclusivo edificio L'Atelier en Santa Fe. Características del inmueble: * 2 recámaras. * 2 baños completos. * 108 m² de superficie, con acabados de alta calidad y una decoración elegante. * 1 cajón de estacionamiento. El condominio cuenta con amenidades de lujo que incluyen: * Gimnasio completamente equipado. * Alberca techada con jacuzzi y vistas panorámicas. * Extenso jardín. * Cancha de tenis. * Seguridad las 24 horas del día. La ubicación es estratégica, a solo media cuadra de Patio Santa Fe. Condiciones y detalles: * Renta mensual de 33, 500. 00 mxn, que incluye la cuota de mantenimiento de 4, 581. 00 mxn. * No se aceptan mascotas. * El edificio, con 23 años de antigüedad, dispone de 4 elevadores, 10 pisos y 2 torres Torre Alameda, en el Condominio latelier Santa Fe.",https://www.inmuebles24.com/propiedades/clasificado/alclapin-en-renta-departamento-santa-fe-latelier-alvaro-147225413.html,"MN 33,500","Santa Fe
Santa Fe, Alvaro Obregón","108 m² lote, 2 rec., 2 baños, 1 estac.",Pradera II Sección
"Departamento en renta en Fraccionamiento Residencial El Refugio, Condominio Alterra Towers edificio con seguridad, amenidades como, alberca, salón de usos múltiples, cancha de padel, gimnasio y área de juegos infantiles. El inmueble cuenta con: 2 recámaras. 2 baños completos. Sala. Comedor. Cocina Integral. Cuarto de lavado. 2 lugares de estacionamiento. *se aceptan mascotas pequeñas. **sujeto A cambios sin previo aviso",https://www.inmuebles24.com/propiedades/clasificado/alclapin-departamento-en-renta-en-alterra-towers-55554656.html,"MN 13,500","La Venta del Refugio #315, Alterra Towers
Residencial El Refugio, Querétaro","92 m² lote, 2 rec., 2 baños, 2 estac.",Pradera II Sección
"Departamento en Renta en Long Island – Midtown Condos, Av. Huayacán. Ubicado en Av. Huayacán km 4, en la nueva zona residencial de Cancún, este departamento te ofrece exclusividad, confort y cercanía a todo lo que necesitas. A solo minutos de centros comerciales, supermercados, aeropuerto, escuelas, vialidades principales y hospitales. Características. • Superficie: 110 m² • 3 recámaras (principal con vestidor y baño completo) • 2 baños completos. • Sala – comedor – cocina con barra. • Área de lavado. • 2 lugares de estacionamiento. Amenidades. • Alberca con chapoteadero. • Extensos jardines. • Baños en áreas comunes. • Vigilancia 24/7. • Terraza bar. • Área de juegos infantiles. • Asoleaderos. Vive con estilo en un entorno seguro y moderno, ideal para familias o profesionistas que buscan comodidad y ubicación privilegiada.",https://www.inmuebles24.com/propiedades/clasificado/alclapin-departamento-en-renta-en-long-island-midtown-condos-147403484.html,"MN 24,000","Midtown A Condos
Long Island, Cancún","110 m² lote, 3 rec., 2 baños, 2 estac.",Pradera II Sección
"Moderno y funcional departamento ideal para quienes buscan comodidad y estilo. Cuenta con cochera para un auto, amplia sala, comedor bien iluminado, cocina equipada, y un encantador balcón para disfrutar del aire libre. Dispone de 2 recámaras, la principal con vestidor, y 2 baños completos que brindan privacidad y confort. Además, incluye un práctico cuarto de lavado. ¡Perfecto para vivir con todo lo que necesitas!",https://www.inmuebles24.com/propiedades/clasificado/veclapin-departamento-en-venta-y-renta-lusanta-modelo-armonia-146280671.html,"MN 16,156","Av las amazonas
San Nicolás del Palote, León","102 m² lote, 2 rec., 2 baños, 1 estac.",Pradera II Sección
"Departamento amueblado disponible, Marina Condos, Cancún Quintana Roo. ¡Increíble oportunidad en Marina Condos, Puerto Cancún! Hermoso departamento en renta/venta con una ubicación privilegiada en el piso 9, ofrece 2 recámaras, la principal con walk-in closet y la segunda con closet, 2 baños completos, una barra desayunadora en la cocina integral equipada y una amplia terraza con vista espectacular a la marina. Ideal para Airbnb. Disfruta de las amenidades como alberca, juegos para niños, gimnasio, cancha de pádel y acceso directo a la plaza comercial La Marina. ¡No pierdas esta oportunidad única!",https://www.inmuebles24.com/propiedades/clasificado/veclapin-departamento-amueblado-disponible-marina-condos-144896837.html,"MN 67,000","Marina Condos
Zona Hotelera, Cancún","125 m² lote, 2 rec., 2 baños, 2 estac.",Pradera II Sección
Rentaplazacarso. com. departamento de 115 M2. Totalmente amueblado Y equipado. Muy bonita decoracion. 2 recamaras con 2 baños completos. Baño de visitas. Linda cocina abierta. Area de lavado. Techos de 3 metros que le dan mucha amplitud Y luminosidad. 2 cajones de estacionamiento. Completo conjunto de amenidades. Acceso directo al centro comercial. Vigilancia 24 horas. Estacionamiento para visitas. Perfecta ubicacion con todos los servicios alrededor. Mantenimiento incluido en la renta. Solo se renta para periodos de larga estancia.,https://www.inmuebles24.com/propiedades/clasificado/alclapin-precioso-amueblado-de-2-recamaras-147247809.html,"MN 60,000","Calle Lago Zurich 245
Polanco, Miguel Hidalgo","115 m² lote, 2 rec., 2 baños, 1 estac.",Pradera II Sección
"Torre de Departamentos muy bien ubicada en La Colonia La Paz. El ph es amplio 150 m2 habitable. 2 cajones de estacionamiento. 2 recámaras secundarias cada una con closet y baño completo. Medio baño para visitas. Un pequeño bar. Recámara principal con vestidor, baño completo y balcón. La torre cuenta con vigilancia. Roof Garden con una vista preciosa de la ciudad. Los acabados del departamento son de alta calidad. Mantenimiento incluido",https://www.inmuebles24.com/propiedades/clasificado/alclapin-departamento-en-renta-en-la-colonia-la-paz-puebla-144289016.html,"MN 22,000","Chalchicomula 29
La Paz, Puebla","215 m² lote, 3 rec., 3 baños, 2 estac.",Pradera II Sección
"Disponible A partir del 1 de agosto 2025. video agregado puede ver amenidades Y departamento. Campos Elíseos. Departamento 260 m2. 3 habitaciones con baño completo y vestidor. 1/2 Baño de visitas. Sala, Comedor, Cocina Completa (refri, lava vajilla, triturador de basura, estufa y horno de inducción (eléctrico) y campana. Family room. Balcón. Cuarto de servicio con Baño, cuarto de lavado (con lavadora y secadora) bodega. Vigilancia 24/7. Circuito cerrado. Concierge. Chapa digital. Cortinas (persianas) Aire Acondicionado y Calefacción. baño para choferes y escoltas. Acabados de lujo. 2 lugares de estacionamiento no se estorban con nadie se estorban solo entre ellos son en hilera. Alberca. Jacuzzi. Gym. area de niños. Asadores. Vestidores. Vapor. Sauna. spa. juice Bar. Roof Garden. Lugar para fiestas y eventos hasta 200 personas",https://www.inmuebles24.com/propiedades/clasificado/alclapin-departamento-renta-col.-polanco-146626221.html,"MN 130,000","Campos Elíseos
Polanco, Miguel Hidalgo","260 m² lote, 3 rec., 3 baños, 2 estac.",Pradera II Sección
"30 departamentos de 215 metros con terraza con vista A campo de golf. - 3 habitaciones: cada una con vestidor Y baño completos con acabados de lujo. - familyroom. - elevador directo A piso. - 1/2 baño de visitas. - sala Y comedor con acceso A terraza. - cocina integral con acabados de lujo. - cuarto de servicio con baño completo. - área de lavado. - bodega dentro del departamento. - 2 lugares de estacionamiento. Opción A diferentes alturas, prestaciones Y precios. Business center, ludoteca, salón de eventos, salón de adultos, alberca climatizada, área de mascotas, área de asadores, roofgarden. Seguridad 24/7. Disponible A partir de 15 de abril. (consulte lista de precios actual) desde $38, 700",https://www.inmuebles24.com/propiedades/clasificado/alclapin-departamento-de-215-m-a-estrenar-con-vista-al-campo-de-66400457.html,"MN 45,050","THE OAKS
Bosque Real, Huixquilucan","215 m² lote, 3 rec., 3 baños, 2 estac.",Pradera II Sección
