Título,Enlace,Precio,Dirección,Características,Colonia de Origen
Bonito departamento en renta a 2 minutos de Polanco y las lomas de Chapultepec. 1 habitación con opción a 2 o family. Cocina integral. Sala y comedor con linda vista de la ciudad. 2 baños. 2 estacionamientos. Amenidades. Seguridad 24/7,https://www.inmuebles24.com/propiedades/clasificado/alclapin-departamento-en-reforma-social-sin-amueblar-146968355.html,"MN 27,000","Avenida Tecamachalco 20
Reforma Pensil, Miguel Hidalgo","110 m² lote, 1 rec., 2 baños, 2 estac.",Reforma Pensil
"Horario de atención telefónica de 9: 30 A 18 horas de lunes A viernes. La renta es solamente por la habitación y se comparten áreas comunes. Si trabajas en Polanco, Miyana, Plaza Carso, Antara, Toreo, Torre de Pemex, Reforma o cualquiera de estos rumbos aledaños, podemos ofrecerte una habitación a 10 minutos de distancia y con servicios incluidos. La habitación cuenta con: - Entrada independiente. - Agua caliente disponible las 24 horas. - Cama individual. - Armario. - Buró. - Se entrega sin decorar. Áreas comunes: cocina con refrigerador, comedor y área de lavado. Incluidos los servicios de luz, agua Y gas. Algunas normas generales de la casa: - Habitación para una persona. - La hora de llegada es flexible. - Visitas. - No se admiten mascotas. - 1 renta de depósito en garantía. Buscamos una comunidad de huéspedes que quieran vivir con tranquilidad, respeto y armonía. *Lugar de estacionamiento no disponible.",https://www.inmuebles24.com/propiedades/clasificado/alclapin-cuarto-habitacion-en-renta-polanco-miyana-carso-142682320.html,"MN 4,650","Calzada General Mariano Escobedo
Ahuehuetes Anahuac, Miguel Hidalgo","14 m² lote, 1 rec., 1 baño",Reforma Pensil
"Departamento en renta amueblado, Condominio frontera polanco, con excelente ubicación, a unos pasos del metro Rio San Joaquín, Piso 7, con elevador, con 100m2, Roof Garden privado de 100m2, cocina integral con área de lavado, 2 recámaras con closets y 2 baños completos, con 2 lugares de estacionamiento independientes, con bodega. Amenidades: Ludoteca, Gimnasio, Sala de juntas y Salón de eventos. Seguridad privada 24 x7. El precio de renta incluye el costo de mantenimiento. Se aceptan mascotas. Toda la información y medidas son aproximadas y deberán ratificarse con la documentación correspondiente y no compromete a Grupo 1nmobiliario bap. Fotografías no vinculantes ni contractuales.",https://www.inmuebles24.com/propiedades/clasificado/alclapin-renta-departamento-amueblado-con-roof-garden-privado-147275696.html,"MN 30,000","Lago Hielmar 44
Modelo Pensil, Miguel Hidalgo","100 m² lote, 2 rec., 2 baños, 2 estac.",Reforma Pensil
"Departamento de 55 m² en 3ª Cerrada de Lago Kolind No. 39, complejo de sólo 5 unidades. Cuenta con cocina equipada (parrilla, barra desayunador y alacenas), una recámara con clóset y baño completo. Disponible en primer nivel o segundo nivel. Amenidades y servicios: Roof garden común. 1 lugar de estacionamiento. Mantenimiento incluido. Internet 200 / mes; agua y luz con costos muy bajos. Gas (tanque de 30 L) a cargo del inquilino. Complejo en Pensil Norte, con incorporación vial a Río San Joaquín, Calzada Legaria y Av. Marina Nacional; a sólo 10 min en auto de Polanco y a 15 min caminando al metro San Joaquín. Disponible el 15 de Julio de 2025. Requisitos: 1 mes de depósito, 1 mes de renta, Comprobación de ingresos mensuales 3 veces el valor de la renta, Póliza Jurídica con valor del 35% sobre el valor de la renta, Fiador con bien inmueble libre de gravamen en la cdmx o Estado de México u Obligado Solidario que compruebe ingresos de tres veces el valor de la renta. Por favor verifica que la ubicación, el precio y las características del inmueble se adecuan a tus preferencias y presupuesto antes de solicitar una cita.",https://www.inmuebles24.com/propiedades/clasificado/alclapin-departamento-en-renta-lago-kolind-cdmx-roof-garden-y-146730255.html,"MN 12,500","Tercera Cda. Lago Kolind 39, Pensil Nte., Miguel Hidalgo, 11430 Ciudad de México, CDMX
Pensil Norte, Miguel Hidalgo","51 m² lote, 1 rec., 1 baño, 1 estac.",Reforma Pensil
"En el nuevo y exclusivo condominio Frontera Polanco es el momento de re-estrenar un extraordinario departamento ubicadisimo saliendo del etro Río San Joaquín, Nuevo Polanco, Cortinas claro oscuro Gabin Eclisse tela española valentin color grey se acepta mascota pequeña con foto previa. (4)",https://www.inmuebles24.com/propiedades/clasificado/alclapin-renta-de-departamento-en-la-colonia-anahuac-pensil-147175589.html,"MN 20,500","LAGO HIELMAR
Modelo Pensil, Miguel Hidalgo","65 m² lote, 2 rec., 2 baños, 1 estac.",Reforma Pensil
"Ofrezco Renta departamento frontarapolanco. cuenta con: - 100 M2 habitalidad. - 100 M2 Roof garden con baño. - 2 recámaras 2 baños. - 2 lugares de estacionamiento independientes. - 1 bodega. - Tiene elevador. - Renta 30, 000 Incluido mantenimiento. amenidades. -gym, - Ludoteca, - Sallón de eventos. - Sala de juntas. - Vigilancia las 24/7. Junto del metro Río San Joaquín y 1 cuadra de Av Río San Joaquín a 2 calles de Miguek de Cervantes Saavedra y Polanco. interesados 55 Ver datos",https://www.inmuebles24.com/propiedades/clasificado/alclapin-dpto-amueblado-frontera-polanco-147383426.html,"MN 30,000","Lago Hielmar 26
Pensil Norte, Miguel Hidalgo","110 m² lote, 2 rec., 2 baños, 2 estac.",Reforma Pensil
"Departamento en renta en pensil alcaldía Miguel Hidalgo cdmx a 7 cuadra de metro san joaquin está en 3 piso en excelente ubicación y buenas vías de comunicación a 5 min del plaza carso. Mide 47 metros. 2 recamaras con espacio para closet. Sala-comedor. Cocina con estufa. Área de lavado. Sin estacionamiento. Cuenta con gas estacionario. Precio $ 9, 500 incluye mantenimiento. Requisitos. Deposito. Renta. Poliza de arrendamiento",https://www.inmuebles24.com/propiedades/clasificado/alclappa-departamento-en-renta-cerca-de-plaza-carso-y-metro-san-147396825.html,"MN 9,500","Lago Naur 153
Pensil Norte, Miguel Hidalgo","47 m² lote, 2 rec., 1 baño",Reforma Pensil
"Departamento en renta A 10 minutos de antara polanco, dos recamaras, estancia, baño Y zotehuela, sin cajón de estacionamiento, cuota por servicios generales incluida, cuarto piso, con camara de vigilancia Y portero 24 horas, servicio de basura 24 horas",https://www.inmuebles24.com/propiedades/clasificado/alclappa-depatamento-a-cuatro-cuadras-del-metro-san-joaquin-146896387.html,"MN 9,500","Lago Naur 153
Pensil Norte, Miguel Hidalgo","50 m² lote, 2 rec., 1 baño",Reforma Pensil
