Título,Enlace,Precio,Dirección,Características,Colonia de Origen
"Moderno Departamento en Renta en excelente estado de 60 metros cuadrados, se encuentra en el Desarrollo Residencial Amado Nervo 32, San Francisco Tetecala, Azcapotzalco, Ver datos Ciudad de México, cdmx Num. Ext. 32, Colonia San Francisco Tetecala C. P. Ver datos, cdmx. Consta de Sala-Comedor, 2 recamaras, 1 baño con cancel, balcón y 1 lugar de estacionamiento. Adicionalmente el condominio tiene recepción, caseta de seguridad 24/7, interfón, elevador, jardín, área para aparcar bicicletas y cisterna. Se ubica a solo 1/2 cuadra del Metro Camarones, muy cerca de plazas comerciales (Destino Azcapotzalco, Pabellón Azcapotzalco, Walmart, etc. ) bancos, escuelas, cmf imss, Parque Bicentanario y vías importantes de comunicación como Aquiles Serdán, Calz. San Isidro, Tezozómoc, etc. La renta es de $11, 500, 00 e incluye la cuota de mantenimiento. Los requisitos son: Comprobante de ingresos de los últimos 3 meses, ine y buró de crédito de la persona que arrendará el inmueble, un fiador o póliza de arrendamiento y un mes de depósito.",https://www.inmuebles24.com/propiedades/clasificado/alclappa-moderno-departamento-a-media-cuadra-del-metro-147462086.html,"MN 11,500","Amado Nervo 32
San Francisco Tetecala, Azcapotzalco","60 m² lote, 2 rec., 1 baño, 1 estac.",San Francisco Tetecala
"Se renta cómodo y bien ubicado departamento en Azcapotzalco, a solo 5 minutos caminando del Metro Camarones. Características: 2 recámaras. 1 baño completo. Sala – comedor. Cocina. 1 cajón de estacionamiento. Ubicado en 2º piso. Vigilancia 24/7. Cámaras de vigilancia. Excelente opción para quienes buscan seguridad, accesibilidad y una zona con gran conectividad.",https://www.inmuebles24.com/propiedades/clasificado/alclappa-departamento-en-renta-en-azcapotzalco-a-5-min-de-147410160.html,"MN 11,000","Miguel Lerdo de Tejada 100
San Francisco Tetecala, Azcapotzalco","68 m² lote, 2 rec., 1 baño, 1 estac.",San Francisco Tetecala
"Tengo en renta hermoso departamento de 3 recamaras y 2 baños, 78m+4m de balcon, con estacionamiento y bodega en segundo piso, edificio cuenta con elevador y vigilancia las 24 horas, cuenta con cocina integral, área de lavado, comedor, sala, mantenimiento de 2000 pesos, reta Ver datos y mantenimiento 2000 para un total de 19000.",https://www.inmuebles24.com/propiedades/clasificado/alclappa-departamento-3-recamaras-en-renta-metro-camarones-146723805.html,"MN 17,000","Amado Nervo 32
San Francisco Tetecala, Azcapotzalco","82 m² lote, 3 rec., 2 baños, 1 estac.",San Francisco Tetecala
