Título,Enlace,Precio,Dirección,Características,Colonia de Origen
"Plaza Carso Torre Pissarro Departamento de Super Lujo. Muy exclusivo ubicado en Residencial Plaza Carso Torre Pissarro, la mejor ubicacion, vista panoramica, nuevo Polanco, de Super Lujo, con acceso directo a el centro comercial Plaza Carso, inmediato a Polanco, Periférico, Ejercito Nacional, Circuito Interior, Lomas de Chapultepec, los mejores Centros Comerciales y Corporativos, Estilo Contemporáneo, precioso departamento, finos acabados en madera, mármol, granito y cerámico, cocina integral abierta con barra de granito, muy iluminado, hermosa vista panorámica, amplia área social, 02 recamaras con walking closet, 03 baños, Sala de tv o estudio, 02 estacionamientos, Cuarto de Lavado. Amenidades: Alberca, gimnasio, salón de eventos, ludoteca, canchas de tenis, jardines con juegos infantiles y acceso al centro comercial Plaza Carso. Vigilancia estricta las 24 horas. Cerca de Antara, Palacio de Hierro, supermercados, cines, las mejores tiendas y restaurantes. Excelente zona, céntrica y con acceso a múltiples servicios, comercios, entretenimiento y vías rápidas, acceso controlado, Excelente ubicación inmediato al restaurantes con acceso a múltiples servicios, comercios y lugares públicos, así como a una gran oferta cultural, caminando o en auto. Todos los servicios a la mano. A menos de 10 minutos (caminando): City Market, cafés, teatros, cines, club deportivo, farmacias, restaurantes, bancos, gasolinera, spa, salones y peluquerías, regalos, agencias automotrices, etc. Cerca de Corporativos, las mejores escuelas y Universidades. Una de las zonas con mayor plusvalía de la Ciudad de México, segura, y con excelentes opciones para pasear y disfrutar con la familia o amigos.",https://www.inmuebles24.com/propiedades/clasificado/alclapin-plaza-carso-2-recamaras-muy-bonito-acceso-directo-58316423.html,"MN 39,000","Lago Zurich 219
Ampliación Granada, Miguel Hidalgo","118 m² lote, 2 rec., 3 baños, 2 estac.",San Miguel Teotongo Sección Puente
"Loft de 43 m² en desarrollo nuevo, ubicado en la calle de Monterrey, Colonia Roma. Cuenta con terraza privada, excelente iluminación natural y vista exterior. Ideal para una o dos personas. Seguridad 24/7, elevador y acceso controlado. Cercano a restaurantes, supermercados y transporte público.",https://www.inmuebles24.com/propiedades/clasificado/alclapin-loft-a-estrenar-con-terraza-en-renta-147130225.html,"MN 25,000","Monterrey 147
Roma, Cuauhtémoc","46 m² lote, 1 rec., 1 baño",San Miguel Teotongo Sección Puente
"Lindo departamento de 85 m², súper ubicado en la calle de Adolfo Prieto en la colonia del Valle. distribuido en un solo nivel con dos recámaras Y dos baños completos. cuenta con estancia, sala, comedor, de muy buen tamaño. cocina integral, abierta con mucho espacio de guardado. área de lavado Y un cajon de estacionamiento",https://www.inmuebles24.com/propiedades/clasificado/alclapin-lindo-y-moderno-departamento-en-adolfo-prieto-de-85-147449908.html,"MN 28,000","ADOLFO PRIETO 1442
Del Valle Norte, Benito Juárez","85 m² lote, 2 rec., 2 baños, 1 estac.",San Miguel Teotongo Sección Puente
"Renta de departamento en cancun towers, puerto cancúnubicación: El departamento está ubicado en Cancun Towers, dentro de Puerto Cancún, una de las zonas más exclusivas de Cancún, con fácil acceso a centros comerciales, restaurantes, y a pocos minutos de la playa. características: • 2 Recámaras con cama king size cada una• 2. 5 Baños• 1 Estacionamiento subterráneo• 153 m² de espacio interior• Área de lavandería con lavadora y secadora• Terraza con jacuzzi y comedor• Vista al manglar y Puerto Cancún• Elevador en el edificiocaracterísticas del condominio/edificio: • Seguridad 24 horas• Piscina• Gimnasio• Salón de usos múltiples• Palapas y áreas recreativas• Hermosos jardines• Salón de eventosrequisitos para renta: • Firma de contrato de 1 año• Estudio socioeconómico• Depósito de garantía y primer mes de rentacontáctanos!! Natiiv Nah Boutique InmobiliariaTeléfono/Whatsapp: +52 1 Ver datosLlamanos para brindarte servicio personalizado con uno de nuestros asesores. +Ver datos+ Ver datos",https://www.inmuebles24.com/propiedades/clasificado/alclapin-departamento-amueblado-en-cancun-towers-puerto-cancun-147217204.html,"MN 48,000","Departamento Amueblado en Cancún Towers, Puerto Cancún
Ciudad de Cancún, Cancún","153 m² lote, 2 rec., 2 baños",San Miguel Teotongo Sección Puente
"Departamento en dos niveles con terraza de 100 m² y vista al Bosque de Chapultepec en Polanco. Ubicado en una de las zonas más privilegiadas de la ciudad, este espectacular departamento ofrece una distribución ideal para familias, con amplios espacios, privacidad y vistas inigualables al bosque. Una verdadera joya en el corazón de Polanco. Superficie: 400m² Recámaras: 3, cada una con baño completo y vestidor. Baños: 3 completos + baño de servicio + medio baño de visitas. Distribución: * **Planta baja: ** Cocina cerrada con ventilación natural, antecomedor, gran alacena, área de lavado, cuarto de servicio, sala y comedor con salida a terraza de 110 m² con vista al Bosque de Chapultepec. * **Nivel inferior: ** Family room central, rodeado por las tres recámaras. Amenidades destacadas: Terraza privada de 100 m², family room, excelente iluminación. Extras: 4 lugares de estacionamiento, bodega. Áreas comunes: Alberca techada con agua climatizada, gimnasio totalmente equipado, área de juegos infantiles. Disponibilidad: Libre a partir del 1 de junio, visitas disponibles desde ahora. Seguridad: Vigilancia 24/7. Agenda tu visita y no dejes pasar esta oportunidad única de vivir frente al Bosque de Chapultepec. Clave interna: erschc0108. Notas importantes: El precio reflejado en la publicidad no considera gastos de escrituración ni impuestos o cualquier otro gasto que genere la compra del Inmueble. Las Imágenes, acabados vistas y detalles estéticos son ilustrativos. Consulte con nuestros asesores para detalles sobre planos, distribuciones y lista de acabados. Precio y disponibilidad sujetos a cambio sin previo aviso. Verifique con nuestros asesores la información actualizada. Las medidas son aproximadas, deben corroborarse con títulos de propiedad y/o boletas prediales. El proceso de compraventa se realiza ante notario público. Esta publicación no es una oferta pública. Toda transacción requiere autorización expresa de los propietarios y debe realizarse de acuerdo con nuestras prácticas comerciales. Operaciones de crédito: El precio total varía según montos de crédito y gastos notariales. Consulte para más detalles. Métodos de pago: El pago podrá realizarse con recursos propios o con crédito hipotecario de cualquier institución, pública o privada, sujeto a la negociación que lleguen las partes de la compraventa y a las políticas de la institución correspondiente. Consulta nuestro aviso de privacidad en nuestra página web.",https://www.inmuebles24.com/propiedades/clasificado/alclapin-extraordinario-ph-en-polanco-146378986.html,"MN 160,000","Arquímedes
Polanco V Sección, Polanco","400 m² lote, 3 rec., 3 baños, 4 estac.",San Miguel Teotongo Sección Puente
"Departamento en renta en Av Juarez Carso La Nacional en el Centro HistóricoLoft en Renta en Av Juarez Centro Histórico – semi-amueblado. Ubicado en una de las zonas más icónicas y culturales de la Ciudad de México, enfrente de Bellas Artes. Construido por Grupo Carso, reconocido por su calidad constructiva y acabados, esta propiedad combina funcionalidad y una ubicación inmejorable. Tipo de operación: Departamento tipo loft en renta semi-amueblado. Ubicación: Carso La Nacional, Av Juarez, Centro Histórico, Ciudad de México (frente a Bellas Artes) Características del Departamento: • Superficie total: 44. 43m² • Distribución tipo estudio, ideal para una persona o pareja. • 1 baño completo y clóset. • Cocineta equipada con estufa eléctrica, refrigerador y microondas. • El cajón de estacionamiento es con costo adicional e independiente a la renta del departamento. Condiciones: 1. Precio incluye: mantenimiento y consumo de agua, agua caliente y luz. No hay gas. 2. Amueblado incluye: Cocineta eléctrica, refri, microondas, box y burós de cama tamaño queen, soporte para t. v. Y persianas. 3. Mascotas: Permitidas. 4. Se solicita póliza jurídica, la cual deberá ser cubierta en su totalidad por el arrendatario. 5. Se solicitan 2 meses de depósito de garantía. El departamento estará listo un mes después de entregar el depósito. 6. El contrato directamente con el Residencial Carso. 7. El departamento se entrega con servicios de luz, agua y agua caliente funcionando. 8. El depósito no es reembolsable en caso de desistir del arrendamiento. 9. Se pueden adquirir cajones de estacionamiento en la pensión de Sears (mismo edificio): 1, 200 más iva cajón pequeño y 1, 595 más iva. El precio es adicional y es un contrato independiente a la renta. Nota importante: El contrato es anual y forzoso. Amenidades del Conjunto: • Lobby de acceso. • Seguridad 24/7. • Control de acceso. • Elevadores. • Gimnasio. • Co-Working. • Área de lavandería común. Contáctanos para más información o para agendar una visita privada. Este estudio representa una excelente oportunidad para vivir en el corazón cultural de la ciudad, con todo lo que necesitas a unos pasos, en un desarrollo moderno y seguro.",https://www.inmuebles24.com/propiedades/clasificado/alclapin-departamento-en-renta-en-av-juarez-carso-la-nacional-147150909.html,"MN 19,993","Av. Juarez 4371
Centro Histórico de la Cdad. de México, Cuauhtémoc","44 m² lote, 1 rec., 1 baño, 1 estac.",San Miguel Teotongo Sección Puente
"Extraordinario Departamento de 3 Recamaras Equipado en Torre Arbol, Arboleda. Este increible Depto se ubica en el piso 17 en una de las Torres mas nuevas de Arboleda spgg. Ademas de contar con una de las mejores vistas del cerro de la silla y el club campestre Mty, este depto totalmente equipado incluye 3 cajones de estacionamiento y 1 una bodega. La torre cuenta con amenidades de primer mundo como: Alberca. Karaoke Bar. Salon de eventos. Ludoteca. Salon de Yoga. Business Center. Bbq area. Por si fuera poco la renta incluye acceso a la prestigiosa casa club del residencial de Arboleda, que cuenta con sus propias amenidades. Que esperas para vivir en la zona mas codiciada de spgg! Book your appointment Today! Ism",https://www.inmuebles24.com/propiedades/clasificado/alclapin-departamento-en-renta-torre-arbol-arboleda-valle-del-147066852.html,"MN 120,000","Blvd. Botánica 7102
Valle del Campestre, San Pedro Garza García","220 m² lote, 3 rec., 3 baños, 3 estac.",San Miguel Teotongo Sección Puente
"¡Espectacular departamento en renta en el Condominio Alba en Residencial Puerto Cancún! Un exclusivo desarrollo residencial ubicado en la zona más privilegiada de Puerto Cancún. Este departamento combina lujo, diseño contemporáneo y acabados de primera en un entorno natural inigualable. Diseñado por la firma italiana Archea Associati, el proyecto ofrece un estilo de vida sofisticado con impresionantes vistas al mar caribe, canal y campo de golf. El edificio cuenta con 30 unidades que garantizan privacidad y tranquilidad. Alba ofrece un entorno seguro, cuenta con tres filtros de acceso, seguridad 24/7 y servicio premium. Con una excelente ubicación cerca de centro comercial, restaurantes de lujo y accesos a la playa. Este departamento se distribuye de la siguiente manera: distribución: - Cocina integral. - Amplia sala y comedor con espectacular vista. - Ventanales de piso a techo. - Terraza de 90o. - Medio baño de visitas. - Lavandería. - Recámara #1 / Principal - Con walk-in closet y baño completo. - Recámara #2 - Con walk in-closet y baño completo. - Recámara #3 - Con walk in-closet y baño completo. - Recámara #4 - Con walk in-closet y baño completo. - Estacionamiento techado para 2 coches. - Bodega. amenidades: - Seguridad 24/7. - Gimnasio total mente equipado. - Alberca con carril de nado, hidromasaje y chapoteadero. - Business center. - Roof grill. - Sky terrace. - Sky jacuzzi. - Sala de usos múltiples. Año de construcción: 2025",https://www.inmuebles24.com/propiedades/clasificado/alclapin-departamento-en-renta-en-cancun-en-alba-puerto-cancun-146526558.html,"MN 115,000","Alba Puerto Cancun
Puerto Juárez, Cancún","258 m² lote, 4 rec., 4 baños, 3 estac.",San Miguel Teotongo Sección Puente
