Título,Enlace,Precio,Dirección,Características,Colonia de Origen
"Este departamento de 141 m², en la colonia Insurgentes Mixcoac. Cuenta con 2 recámaras y 2 lugares de estacionamiento, cocina integral, área de lavado y 2 baños completos. Además, cuenta con clósets en las recámaras para mayor comodidad. El departamento ofrece amenidades como gimnasio, alberca, jacuzzi y salón de usos múltiples, ideal para disfrutar sin salir de casa. También cuenta con caseta de guardia y seguridad privada para tu tranquilidad. La ubicación es excelente, con fácil acceso a servicios básicos como agua y luz, así como internet/wifi. Disfruta de la terraza y el área de juegos infantiles. Además, cuenta con acceso para personas con discapacidad. La zona ofrece cercanía a comercios, servicios y vialidades importantes, facilitando tu día a día. También dispone de estacionamiento de visitas. Renta incluye mantenimiento",https://www.inmuebles24.com/propiedades/clasificado/alclapin-departamento-renta-insurgentes-benito-juarez-147455997.html,"MN 29,500","Avenida Patriotismo 883
Insurgentes Mixcoac, Benito Juárez","141 m² lote, 2 rec., 2 baños, 2 estac.",San Juan
"Hermoso departamento totalmente remodelado en la colonia Extremadura Insurgentes, a dos cuadras del metro Mixcoac y a dos cuadras del Parque Hundido. Tiene 3 recámaras, la principal con baño privado y otras dos recámaras que comparten baño. Sala, comedor, cocina, 1 estacionamiento compartido con otros 2 autos, vigilancia portero. El departamento está totalmente remodelado: cocina nueva (tarja, estufa, placa granito, boiler nuevo). Los baños nuevos (wc urrea, cristal templado en regaderas, azulejos interceramic). La carpintería nueva (puertas, chapas), todo el sistema eléctrico nuevo (cableado, apagadores, contactos, luminarias). Todo el departamento tiene pisos de parquet impecable. Persianas en todas las ventanas. Preciosa vista. Muy calientito. La cuota de mantenimiento está incluida en la renta. Requisitos: póliza jurídica en renta.",https://www.inmuebles24.com/propiedades/clasificado/veclapin-departamento-en-renta-o-venta-extremadura-insurgentes-147357979.html,"MN 28,000","Calle de Empresa 144
Extremadura Insurgentes, Benito Juárez","115 m² lote, 3 rec., 2 baños, 1 estac.",San Juan
"Departamento en renta ubicado en Ciudad de los Deportes. Cuenta con 2 recámaras y 2 baños. El interior ofrece sala, comedor y cocina integral. Disfruta de línea blanca y 70 m2 de superficie construida. Cuenta con 1 lugar de estacionamiento. El edificio ofrece guardianía y seguridad privada. La Ciudad de los Deportes es una zona predominantemente residencial y comercial, con un ambiente familiar y dinámico. Tiene excelente conectividad gracias a sus vialidades principales y opciones de transporte público como estaciones de metro y metrobús. Encontrarás escuelas cercanas, supermercados, tiendas de conveniencia, farmacias y bancos. Para el ocio, hay parques, centros deportivos, cines, restaurantes y bares. La zona cuenta con hospitales y clínicas en la cercanía. Se percibe como una zona segura y con un ambiente cotidiano vibrante, ideal para familias jóvenes y profesionales.",https://www.inmuebles24.com/propiedades/clasificado/alclapin-departamento-2-recamaras-en-renta-ciudad-de-los-143944616.html,"MN 23,000","TINTORETTO 108 EJE 6 SUR
Ciudad de los Deportes, Benito Juárez","70 m² lote, 2 rec., 2 baños, 1 estac.",San Juan
