Título,Enlace,Precio,Dirección,Características,Colonia de Origen
"Exclusivos desarrollo ubicado en el corazón de las principales colonias residenciales del Sur de la ciudad. (Pedregal y San Ángel). Pedre cuenta con 110 departamentos desde 1 hasta 3 recámaras, todos con terraza y vistas espectaculares. 1 Torre de 14 niveles con 6 elevadores, 4 sótanos de estacionamiento, Gimnasio, Carril de Nado, Restaurante, Área de asadores y terraza común con vista de 360 a la ciudad. Además contamos con servicio exclusivo de Concierge. Este departamento de 2 niveles cuenta con un jardin de 144. 72m2",https://www.inmuebles24.com/propiedades/clasificado/alclapin-departamento-a-estrenar-en-el-pedregal-1001-66501818.html,"MN 54,000","Avenida San Jerónimo, 111
Loreto y Campamento, Alvaro Obregón","148 m² lote, 2 rec., 2 baños, 2 estac.",San Ángel
"Disfruta de un departamento en una de las avenidas mas importantes de la Ciudad de México, 2 recamáras, 2 baños, balcón a lo largo del departemento, 1 estacionamiento. Amenidades, salón de fiestas, alberca, gimnasio. Cerca de parada de metrobus.",https://www.inmuebles24.com/propiedades/clasificado/alclapin-renta-de-departamento-amueblado-en-agatha-san-angel-147422495.html,"MN 23,500","Avenida Insurgentes Sur 2239
San Angel Inn, Alvaro Obregón","70 m² lote, 2 rec., 2 baños, 1 estac.",San Ángel
"Loft en Renta en Av. Revolución con una superficie de 35m2 mas balcón amplio de 8 m2 ubicado en 9no. Piso exterior. habitación con closet, un baño completo, cocina integral, 1 estacionamiento techado, se entrega con persianas dobles, dos elevadores, cctv, vigilancia 24 horas, lobby con vigilancia, amenities, coworking, business center, gym en roof top y Sky Lounge, en sotano área de lavanderia estacionamiento para bicicletas, planta de luz. -Precio de Renta $18, 500. -Mantenimiento incluido. -Cel: 55 Ver datosWhatsApp oficina Ver datos. Loft for Rent on Av. Revolución with an area of 35m2 plus a large 8 m2 balcony located on 9th. Exterior floor. room with closet, a full bathroom, kitchen, 1 covered parking, comes with double blinds, two elevators, cctv, 24-hour surveillance, lobby with surveillance, amenities, coworking, business center, rooftop gym and Sky Lounge, basement laundry area, bicycle parking, power plant. -Rental Price $18, 500. -Maintenance included. -Cel: 55 Ver datos WhatsApp office Ver datos",https://www.inmuebles24.com/propiedades/clasificado/alclapin-loft-con-amenities-y-balcon-vistas-panoramicas-y-145868752.html,"MN 18,500","avenida revolucion
Guadalupe Inn, Alvaro Obregón","45 m² lote, 1 rec., 1 baño, 1 estac.",San Ángel
"Se renta departamento amueblado, luminoso y completamente renovado en San Ángel. Ubicación: - Zona residencial exclusiva. - Calle con seguridad 24 horas. - Cercano a principales vialidades: Periférico, Av. Revolución y Altavista. Amenidades cercanas: supermercados, tiendas, cafeterías y restaurantes. Fácil acceso a transporte público. Características del departamento: - Luminoso y con excelente distribución. - 1 recámara con clóset empotrado y escritorio. - Sala con televisión nueva empotrada. - Comedor moderno y funcional. - Cocina equipada con lavavajillas, triturador de comida y electrodomésticos nuevos. - 1 baño completo. - Terraza, ideal para disfrutar al aire libre. Condiciones de renta: Precio: $20, 000 mxn mensuales. Exclusivamente para una persona sola. No se aceptan mascotas. Para más información o agendar una cita, escríbenos por WhatsApp o llámanos al 56 Ver datos.",https://www.inmuebles24.com/propiedades/clasificado/alclappa-departamento-amueblado-en-san-angel-a-estrenar-145710366.html,"MN 20,000","Hermenegildo Galeana
San Angel Inn, Alvaro Obregón","50 m² lote, 1 rec., 1 baño",San Ángel
"Se renta departamento en la colonia Florida, tiene una excelente ubicación, a unas calles de Insurgentes y muy cerca del Club France. El edificio tiene vigilancia 24/7, cuenta con un elevador nuevo y el departamento se encuentra en el tercer nivel. Entrando al departamento se encuentra el área de sala-comedor que es muy iluminada y tiene espacio para poder hacer una tercera recámara. Cuenta con dos recámaras, un baño completo y medio baño para visitas. La cocina es amplia y tiene además un área de servicio y cuarto de servicio con baño completo que tiene acceso independiente. El departamento tiene asignado un cajón de estacionamiento de uso exclusivo y que es independiente y además el edificio cuenta con 4 lugares de estacionamiento para visitas. Fue remodelado recientemente y todo el departamento cuenta con luz indirecta",https://www.inmuebles24.com/propiedades/clasificado/alclapin-departamento-en-renta-en-la-colonia-florida-147109135.html,"MN 39,000","Camelia 163
Florida, Alvaro Obregón","136 m² lote, 2 rec., 2 baños, 1 estac.",San Ángel
Departamento en planta baja con terraza y jardín. Tres recámaras con dos baños completos. Sala y comedor con vista y salida a la terraza y jardín. Baño de visitas. Cuarto de servicio y área de lavado. Seguridad 24 hrs. 2 lugares de estacionamiento. Lugares de visita. Disponible hasta el 15 de septiembre,https://www.inmuebles24.com/propiedades/clasificado/alclapin-departamento-en-tizapan-san-angel-con-terraza-y-147181206.html,"MN 56,000","Tizapan
Tizapan, Alvaro Obregón","160 m² lote, 3 rec., 2 baños, 2 estac.",San Ángel
