Título,Enlace,Precio,Dirección,Características,Colonia de Origen
"Renta departamento en Eleva2411 con 3 recámaras. Cuenta con acabados de lujo, madera de ingeniería en área social y recámaras, mármol en baños, cocinas, vestidores, puertas y muebles de baños italianos. Contáctanos para recibir información adicional. Características: -115 m². -Recámara principal con baño y walk in clóset. -2 Recámaras con clóset. -Baño completo fuera de las dos recámaras secundarias. -Cocina equipada. -Amplia estancia y comedor. -Desayunador. -Área de servicio. -2 estacionamientos. Excelentes amenidades: • alberca. • chapoteadero para bebés y niños. • asoleadero. • cafetería. • áreas verdes. • gimnasio. • spa y área de masajes. • ludoteca. • salón de adultos. • tiendita. • estética. • business center",https://www.inmuebles24.com/propiedades/clasificado/alclapin-renta-departamento-eleva2411-3-recamaras-90599447.html,"MN 38,000","Av. Insurgentrs Sur 2411
San Ángel, Alvaro Obregón","115 m² lote, 3 rec., 2 baños, 2 estac.",San Ángel
"Renta departamento amueblado en el corazón de San Ángel, propio de conocedores que gusten del placer de la elegancia y el buen gusto diseñado en finas maderas, con acabados de lujo donde se combinan el arte y la comodidad, tiene una amplia estancia con vista al jardín de la Plaza de San Jacinto, la cocina es abierta, techos altos, baño con cancel de cristal templado, subiendo medio nivel encuentra la habitación con una recámara kings size, 2 armarios muy amplios, baño con cancel de cristal templado, cuenta con refrigerador y electrodomésticos. Incluye, luz, agua, gas e internet. Ganelo bajo de precio.",https://www.inmuebles24.com/propiedades/clasificado/alclapin-renta-departamento-amueblado-san-angel-plaza-san-146275267.html,"MN 37,500","DR. GALVEZ 20 B
San Ángel, Alvaro Obregón","80 m² lote, 1 rec., 1 baño",San Ángel
"Espectacular departamento de 235m2 en piso 15 con vista 180grados a San Angel) El departamento que se caracteriza por estar lleno de luz con amplísimos espacios y magnifica distribución consta de: •⁠ ⁠Estancia (sala-comedor) •⁠ ⁠Cocina Integral Abierta con barra desayunador. •⁠ ⁠Recámara principal con baño completo a doble tarja, closet y vestidor. •⁠ ⁠2 recámaras secundarias cada una con baño completo y closet. •⁠ ⁠½ Baño de visitas. •⁠ área para family room. •⁠ ⁠Area de lavado. •⁠ ⁠Cuarto de servicio con baño completo. •⁠ 3 Cajones de estacionamiento. El desarrollo que consta de dos torres de 17 pisos cada una con aprox. 72 depas por torre. En cuanto a amenidades contamos con: •⁠ Alberca techada con jacuzzi y área de vapor, sauna, regaderas y vestidores. •⁠ Gimnasio equipado con salón de spinning. •⁠ Salón de usos múltiples amueblado con bar. •⁠ Business center amuelado con internet. •⁠ ludoteca (adorable) •⁠ Area de juegos infantiles. •⁠ Jardín. •⁠ Area de asadores amueblada. •⁠ Area para mascotas",https://www.inmuebles24.com/propiedades/clasificado/alclapin-renta-departamento-de-lujo-las-flores-2020-con-147252866.html,"MN 70,000","Blvd adolfo lopez mateos 2020
San Ángel, Alvaro Obregón","235 m² lote, 3 rec., 3 baños, 3 estac.",San Ángel
"Departamento ubicado en piso medio-alto en venta, acabados de lujo, 95 m2 habitables, piso de madera de ingeniería, estancia abierta, 2 recámaras, la principal con baño, 2 baños completos, cocina integral con barra de granito, área de lavado, 2 estacionamientos, área de lavado. Circuito cerrado, lobby, seguridad, 3 elevadores por torre. Mantenimiento incluido. Amenidades: Alberca techada, jacuzzi, spa, sauna, gimnasio, ludoteca, salón para eventos grandes, salón para eventos pequeños, asadores con parrilla, área de juegos infantiles, terraza para tomar sol, áreas para eventos en diferentes puntos, áreas abiertas con jardín. Nuevo proyecto icónico al sur de la Ciudad, inspirado en el arte y la creatividad para lograr un ambiente único. En el tradicional barrio de San Ángel, a unos pasos de Altavista, un nuevo concepto residencial inspirado en el arte y la creatividad, tiene su origen y punto de inspiración en la casa estudio de Feliciano Béjar, un destacado artista plástico mexicano. La mezcla de belleza con áreas verdes, convierten los más de 2, 300 m2 en un lugar ideal para vivir. Incorporando el arte como parte de sus más de 1, 200 m2 de espacios abiertos, para lograr un ambiente que te llevarán a un estado de lujo, confort e inspiración. Proyecto diseñado para disfrutar las vistas del sur de la ciudad desde sus Amenidades en el nivel 26.",https://www.inmuebles24.com/propiedades/clasificado/alclapin-renta-art-atlamaya-residences-san-angel-zona-sur-147324832.html,"MN 28,500","Blvd. Adolfo López Mateos 2370
San Ángel, Alvaro Obregón","95 m² lote, 2 rec., 2 baños, 2 estac.",San Ángel
"Departamento en renta a estrenar en piso alto, muy iluminado y ventilado, espectacular vista de la Ciudad, con acabados de lujo, en hermoso y exclusivo desarrollo, encuentra el departamento de tus sueños aquí, con una arquitectura única, y espacios pensados en tu comodidad. Ubicado en una de las mejores zonas de la Ciudad de México, a solo unos minutos de Portal San Ángel. Cuenta con 117 m2, de los cuales 40 son de terraza con verja de seguridad de vidrio templado alrededor del departamento, dos recámaras, 2 baños con acabados de mármol, cancel de vidrio templado, 2 estacionamientos, 4 bodegas, piso de madera de ingeniería, cocina integral abierta con plancha de granito, área de lavado, amplios ventanales. Mantenimiento incluido. Amenidades: Gym. Spa. Lounge Garden. Salón de eventos. Business center. Cine. Ludoteca. Carril de nado. Alberca. Motor Lobby. Estacionamiento para visitas. Circuito Cerrado. Seguridad. Concierge. Room Service. Biblioteca. Cafetería. Tienda de conveniencia. Tintorería. Sky Lounge. Sky Bar. Sky Pool. Barber shop & beauty salon",https://www.inmuebles24.com/propiedades/clasificado/alclapin-renta-departamento-en-icon-san-angel-sur-cdmx-147400475.html,"MN 35,000","Blvd. Adolfo López Mateos 2008
San Ángel, Alvaro Obregón","117 m² lote, 2 rec., 2 baños, 2 estac.",San Ángel
"Departamento de 164 m2 con muy bonitas vistas desde todo el departamento. Consta de 3 recámaras, 3 baños completos; cocina abierta, cuarto de servicio. Amenidades: 2 Albercas -Terraza con asadores - Ludoteca - Salón de eventos - Business center - sala de juntas - Gym - Tiendita - Salón de belleza - Cine - Biblioteca.",https://www.inmuebles24.com/propiedades/clasificado/veclapin-departamento-en-venta-y-renta-icon-san-angel-143252650.html,"MN 55,000","LOS ALPES
San Ángel, Alvaro Obregón","162 m² lote, 3 rec., 3 baños, 4 estac.",San Ángel
"Departamento enrenta |128 m2 | Planta baja con acceso directo a las amenidades| se renta sin muebles. Se renta cómodo y amplio departamento en planta baja, justo al nivel de las principales amenidades del edificio. Consta de: 2 Recámaras (recámara principal con walk-in closet) , 2 Baños completos, Sala - Comedor, Cocina integral, Cuarto de servicio/lavado, 2 Terrazas medianas, 2 cajones de estacionamiento. Amenidades de lujo: Elevador, Vigilancia 24/7 y acceso controlado, Ludoteca, Gimnasio, Spa, Mini súper, Salón de belleza, Área exclusiva para adultos, Alberca y mucho más. De preferencia sin mascotas. Precio: $35, 000 mensual + mantenimiento de$5, 700. Requisitos: Mes de renta, Mes de depósito, Póliza jurídica (30% del valor de la renta) que se tramita con con fiador u obligado solidario. Contrato mínimo por 1 año. (4)",https://www.inmuebles24.com/propiedades/clasificado/alclapin-departamento-en-renta-san-angel-alvaro-obregon-4-147090804.html,"MN 35,000","Avenida de los Insurgentes Sur
San Ángel, Alvaro Obregón","128 m² lote, 2 rec., 2 baños, 2 estac.",San Ángel
"Vive en uno de los desarrollos más modernos y cómodos de la Ciudad de México, con excelente distribución y una terraza espectacular que te enamorará desde el primer momento. *3 recámaras. * La recámara principal cuenta con walking clóset y baño propio. * Las otras dos recámaras comparten un baño completo. * Todas las recámaras con persianas dobles y blackout. *2. 5 baños. Cocina muy amplia con gran capacidad de guardado. Piso laminado en todo el departamento. *Cuarto de lavado. *Clóset de blancos. Gran terraza con excelentes vistas. El departamento se encuentra en excelente estado, listo para habitarse. Perfecto para familias o parejas que buscan comodidad, amplitud y buena ubicación. Mantenimiento incluido. se acepta 1 mascota pagando depósito extra de $60, 000. - ¡Agenda tu cita hoy y ven a conocer tu próximo hogar!",https://www.inmuebles24.com/propiedades/clasificado/alclapin-renta-departamento-solare-san-angel-alvaro-obregon-146607816.html,"MN 28,000","Blvd. Adolfo López Mateos 125
San Ángel, Alvaro Obregón","117 m² lote, 3 rec., 2 baños, 1 estac.",San Ángel
"Exelente dapartamento amueblado en el corazones de san ángel ideal para conocedores que gusten de la elegancia y el buen gusto con acabados de primera tanto en plafones, muros y pisos cuenta con una gran estancia, vista a la plaza, jardín de san jacinto un entorno de ambiente colonial la cocina equipada un baño con cristales templados en los canceles, cuenta con medio nivel que da acceso ala recamara Kings size cuenta con dos armarios muy amplios, electro domésticos refrigerador ideal para altos ejecutivos incluye luz, agua, gas internet visítelo citas al Ver datosVer datos28",https://www.inmuebles24.com/propiedades/clasificado/alclapin-renta-de-departamento-amueblado-en-el-corazon-de-146442826.html,"MN 40,000","Arteaga
San Ángel, Alvaro Obregón","80 m² lote, 1 rec., 1 baño, 1 estac.",San Ángel
"Nota: disponible A partir de julio de 2025. Si estás buscando un lugar que combine espacios amplios, mucha luz natural, acabados de lujo y una ubicación estratégica cerca de Periférico Sur, este departamento es para ti. Disfruta de un hogar elegante y funcional. ¡Listo para entrar a vivir! Terrazas privadas y áreas verdes. Cuenta con sala, cocina integral, comedor, Family Room, ½ medio baño de visitas, 3 recámaras con vestidor y baño cada una; 3. 5 baños, terraza cubierta, cuarto de lavado y cuarto de servicio con baño. Estacionamiento para 4 autos y de visitas. Áreas comunes: Alberca, Gimnasio, Cancha de pádel, Jardines y terrazas, Salón de fiestas, Salón de juegos, Elevador, Seguridad 24/7. Cuota de mantenimiento $23, 000. 00 incluida en la renta.",https://www.inmuebles24.com/propiedades/clasificado/alclapin-departamento-renta-en-bosque-san-angel-146465557.html,"MN 125,000","Alfonso Caso
San Ángel, Alvaro Obregón","435 m² lote, 3 rec., 3 baños, 4 estac.",San Ángel
"¡Con balcon y en el piso 13 con vistas a la ciudad! Consta de 2 recamaras (principal con baño y vestidor) , 2 baños completos, sala-comedor, cocina intergal con lavavajillas, area de lavado, balcon, 2 lugares de estacionamiento independientes y seguridad 24 horas con acceso controlado. Acceso a el complejo por Av. Revolucion y Av. Insurgentes. Amenidades: Alberca, spa, sauna, vapor, gimnasio, ludoteca, salon de juegos, estetica y tienda dentro del conjunto. ¡se renta amueblado! Requisitos: mes de renta, mes de deposito, fiador libre de gravamen en cdmx u obligado solidario con poliza juridica (30% del total de la renta) Mantenimiento incluido en la renta. Acepta mascotas. (4)",https://www.inmuebles24.com/propiedades/clasificado/alclapin-renta-departamento-amueblado-en-san-angel-alvaro-147175696.html,"MN 38,000","Insurgentes Sur
San Ángel, Alvaro Obregón","106 m² lote, 2 rec., 2 baños, 2 estac.",San Ángel
"Departamento en el piso doce con dos lugares de estacionamientos ubicados en el sótano cinco, tres recamaras con closets, dos baños completos, sala, comedor, cocina abierta. Amenities: Alberca, Jacuzzi, chapoteadero, gimnasio, salón de adultos, vapor.",https://www.inmuebles24.com/propiedades/clasificado/alclapin-departamento-en-renta-en-be-gran-san-angel-146859460.html,"MN 35,000","Calle Iglesia 270, Tizapán San Ángel, Loreto y Campamento, Álvaro Obregón, 01090 Ciudad de México, CDMX
San Ángel, Alvaro Obregón","120 m² lote, 2 rec., 1 baño, 2 estac.",San Ángel
"Primer nivel: Vestíbulo, sala comedor con balcón, cocina cerrada con antecomedor y alacena, medio baño de visitas, sala de tv, 3 recamaras, la principal con vestidor y baño y las otras 2 comparten baño. Lavandería y cuarto de servicio con baño. Segundo nivel family room con salida al roof garden. 3 Estacionamientos techados, en línea. El departamento tiene una vista muy abierta, es silencioso e iluminado. Jardín común. Mantenimiento incluído. Para aviso de privacidad, quejas, sugerencias o aclaraciones visita, o escríbenos a Ver datos. Oficina Sur Ver datos y 6292. Los gastos de investigación y póliza jurídica no están incluidos en el costo de renta, así como el mobiliario, electrodomésticos y arte que se muestran en las fotografías",https://www.inmuebles24.com/propiedades/clasificado/alclapin-renta-ph-en-tizapan-roof-privado-146579445.html,"MN 39,500","General Aureliano Rivera
San Ángel, Alvaro Obregón","242 m² lote, 3 rec., 2 baños, 3 estac.",San Ángel
"Descubre este Departamento dúplex en renta sin amueblar en Tizapan San Ángel, ofrece 114 m² de terreno y 138 m² de construcción. Cuenta con 2 recámaras y 2 1/2 baños, ideal para familias o profesionales. La propiedad incluye un estacionamiento con opción a 2 y permite mascotas. En su interior, encontrarás una cocina integral, un cuarto de tv y un estudio perfecto para trabajar desde casa. Además, cuenta con área de lavado y cuarto de servicio o usos multiples. El dúplex ofrece una terraza para disfrutar del aire libre. El conjunto residencial cuenta con caseta de guardia, brindando seguridad 24/7. El precio no incluye el mantenimiento de 4, 000 pesos. La ubicación en Tizapan es estratégica, ubicada a 1 sola cuadra del itam y unas cuadras de San Ángel, con escuelas cercanas y fácil acceso a servicios y comercios. Disfruta de la comodidad y seguridad que este dúplex ofrece en una de las zonas más tranquilas de la ciudad.",https://www.inmuebles24.com/propiedades/clasificado/alclapin-departamento-duplex-de-138-m-sup2--con-2-recamaras-y-3-147419535.html,"MN 28,000","YUCATAN 103
Tizapan, Alvaro Obregón","114 m² lote, 2 rec., 2 baños, 2 estac.",San Ángel
"Renta en eleva 2411 insurgentes sur. •97mts. •piso 11. •sala. •comedor. •cocina integral. •área de lavado. •baño de vistas completo. •segunda recámara con clóset. •recámara principal con baño completo Y vestidor. • dos estacionamientos que no se estorban con vecinos. •bodega. desarrollo eleva 2411. spa. gimnasio. salón de eventos. ludoteca. súper. areas verdes. salón de juegos. vigilancia las 24hrs. acceso controlado. cámaras de seguridad. Entrada sobre Insurgentes y avenida Revolución, entre Loreto y Rey Cuahutemoc. Renta 34, 000. citas Ver datos",https://www.inmuebles24.com/propiedades/clasificado/alclapin-renta-depto-en-eleva-insurgentes-sur-tizapan-alvaro-147386050.html,"MN 34,000","Avenida Insurgentes Sur 2411
Tizapan, Alvaro Obregón","97 m² lote, 2 rec., 2 baños, 2 estac.",San Ángel
"Hermoso y moderno departamento interior en renta en piso 22 con elegantes acabados. Parallelo es un edificio sustentable, con captación de aguas pluviales, equipos ahorradores y de bajo consumo. Iluminación led. Ductos de basura para reciclaje, etc. Con la mejor ubicación de la Ciudad, en la Col. Guadalupe Inn. Cerca tendrás transporte público, centros comerciales, escuelas, hospitales, restaurantes y clubs deportivos, vigilancia 24/7 y recepción. Consta de: Sala-comedor con amplio balcón de 7 m2 hasta la recámara. Cocina integral abierta con granito, horno de microondas incluido. Espacio de refrigerador bastante grande. Persianas de día y de noche. Iluminación con leds en todo el departamento. 1 Recámara bastante amplia con un closet enorme y persianas black out. Baño bastante amplio con canceles de vidrio. Área de lavado con conexiones listas. 1 cajón de estacionamiento que no estorba con nadie más. Ductos para la basura. Recepción y vigilancia 24/7. Sensores y aspersores de fuego. Con piso de amenidades: -Salón de adultos con barra y muy bien ambientado. -Área infantil con juegos. -Ludoteca. -Área de asadores. -Terraza. -Salón de usos múltiples. (Eventos 2, 200) -Fogatas. -Spa. -Jacuzzi. -Vapor. -Vestidores. y Gym. Todo de la mejor calidad! Pide al broker que te atienda que te envíe el video del departamento amueblado!! No se aceptan mascotas. mantenimiento incluido. - no asesores - * - requisitos: 1 Mes de Renta. 1 Mes de Depósito. -Póliza Jurídica 50-50 (aprox 4, 000 c/u) incluida investigación. (Con Aval u Obligado Solidario) (#est104-piso 5)",https://www.inmuebles24.com/propiedades/clasificado/alclapin-departamento-de-1-recamara-en-guadalupe-inn-en-90148972.html,"MN 21,000","Insurgentes Sur 1831
Guadalupe Inn, Alvaro Obregón","51 m² lote, 1 rec., 1 baño, 1 estac.",San Ángel
"Rento departamento de lujo en Be Grand Iglesias amueblado y con finos acabados, en Piso 21 ideal para ejecutivos o repatriados, con las mejores amenidades ubicado al sur de la ciudad, a 5 minutos de Periférico Sur (Glorieta de San Jerónimo), Av. Revolución e Insurgentes, cercano a centros comerciales, cerca de clínicas del imss, restaurantes, escuelas, tiendas de autoservicio, bancos, Parque Batán y mucho más. Con seguridad las 24 hrs. Es un desarrollo ecológicamente sustentable, para esto, cuenta con una planta de tratamiento de agua y un sistema de captación pluvial. Esto te permitirá ahorrar un 65% en tu consumo y gracias al sistema centralizado de agua caliente, ahorrarás hasta un 50% en gas natural. Disponible A partir de agosto. No se aceptan Mascotas. Renta: $ 49, 500 (la renta incluye cuota de mantenimiento) Construcción 146 m2. Sala. Comedor. Cocina integral. Recámara principal con vestidor y baño. 2da. Recámara con baño y closet. Baño de visitas completo. Clóset de blancos. Área de lavado con baño. Bodega en el sótano 4. cochera para 2 autos en el sótano 2. Increíbles amenities que dan servicio a todo el desarrollo como son: Alberca semiolímpica de 3 carriles. Jacuzzi. Salones Privados. Gimnasio. Vestidores con Spa. Kid’s Club. Jardines especialmente diseñados. Espejo de agua, cascada, andador y áreas recreativas. Previa cita: Ángeles Aguirre cel. Ver datos",https://www.inmuebles24.com/propiedades/clasificado/alclapin-rento-departamento-amueblado-de-lujo-en-be-grand-57776788.html,"MN 49,500","Iglesias
Tizapan, Alvaro Obregón","146 m² lote, 2 rec., 3 baños, 2 estac.",San Ángel
"Departamento en renta excelente ubicación Acceso a Insurgentes, Av. Revolucion a 5 minutos de unam, Estadio Universitario. Rectoría. Características: -97 m². -Recámara principal con baño completo y vestidor clóset. -Segunda Recamara comparte baño completo con visitas. -Cocina integral equipada. - Sala comedor muy amplia. -Área de despensa. -Area de Lavado. -2 Estacionamientos independientes. -Bodega. -Vigilancia las 24 Horas. -Cámaras de circuito cerrado de televisión. Excelentes amenidades: * Alberca. * Ahapoteadero para bebés y niños. * Asoleadero. * Cafetería. * Areas verdes. * Gimnasio. * Spa y área de masajes. * Ludoteca. * Salón de adultos. * Tienda. * Estética. * Business center",https://www.inmuebles24.com/propiedades/clasificado/alclapin-departamento-en-renta-san-angel-eleva-residencial-147387976.html,"MN 34,000","AVENIDA DE LOS INSURGENTES 2411
Tizapan, Alvaro Obregón","96 m² lote, 2 rec., 2 baños, 2 estac.",San Ángel
"Departamento en renta en moderno y exclusivo desarrollo residencial ubicado en Guadalupe Inn. Es un espacio abierto, muy adecuado para jóvenes ejecutivos, personas solteras o parejas jóvenes sin hijos o adultos mayores que ya viven solos. Consta de: Una habitación con espacio para cama King size y closet. Un baño completo. Cocineta equipada con tarja fregadero, espacio para frigo bar, parrilla eléctrica y gabinetes. Área abierta Flex para una estancia-comedor o espacio abierto. Superficie 38 m² aprox. Amueblado. amenidades. Business Center. Cafetería. Librería. Terraza Grill. Gimnasio. Salón lounge. otras instalaciones. 4 niveles de estacionamientos con Valet Parking. Lavandería. Elegante lobby de acceso principal con seguridad 24 horas. Local comercial en planta baja. puntos de referencia. Centros culturales, comerciales y corporativos cercanos a Spazio Torre Inn: Centro Cultural y Teatro Helénico, Cafetería El Péndulo. San Ángel (Parque, Museos, Mercado, Restaurantes, etc) Plaza Inn (Nafinsa, cnsf, shcp, Bancos, Restaurantes, Tiendas, etc. ) Pabellón AltaVista (Cinemex, Restaurantes, Boutiques) Portal San Ángel (Sams, Walmart, Sears, Cinépolis, Bancos, Restaurantes, Boutiques, etc)",https://www.inmuebles24.com/propiedades/clasificado/alclapin-departamento-amueblado-en-renta-en-guadalupe-inn-65908315.html,"MN 25,000","Av. Revolución 1470
Guadalupe Inn, Alvaro Obregón","38 m² lote, 1 rec., 1 baño",San Ángel
"Hermoso departamento de lujo ubicado en el piso 28 con excelentes acabados, extraordinaria vista y excelente ubicación. Con todos los servicios y comercios cercanos como Plaza Loreto y Plaza San Jerónimo. Cuenta con área de sala y comedor muy amplia, tiene un lindo techo con acabado Paladium en lo que divide la cocina y área social, balcón a todo lo largo del área social, tiene una cocina integral abierta de gran tamaño con barra de mármol negro, triturador de desperdicios orgánicos y filtro purificador, medio baño de visitas, family room. 3 Recámaras, la principal con vestidor, baño y una vista espectacular hacia la ciudad, la cual cuenta con aires acondicionados y persianas motorizadas, la 2a y 3er recámara con closet y baño cada una, área de lavado, alacena y 3 lugares de estacionamiento. El desarrollo cuenta con magníficas amenidades como: salón de adultos, ludoteca, juegos infantiles al aire libre, gym, área para mascotas, alberca techada, salón de eventos y mucho más!! Estricta vigilancia 24/7. Es el departamento de tus sueños!! Que no te lo ganen!! Agenda tu cita!!",https://www.inmuebles24.com/propiedades/clasificado/alclapin-departamento-en-renta-en-be-grand-san-angel-147291729.html,"MN 77,000","Iglesia
Tizapan, Alvaro Obregón","267 m² lote, 3 rec., 3 baños, 3 estac.",San Ángel
"Espacios inmobiliarios renta excelente departamento en la calle de Barranca del Muerto en la colonia Florida, a pasos de Insurgentes, muy iluminado, magnífica ubicación, 2do piso, 3 recámaras, 2 baños, cocina, sala, comedor, balcón, área de lavado, 2 estacionamientos, vigilancia 24 horas. Mantenimiento incluido en el precio de renta.",https://www.inmuebles24.com/propiedades/clasificado/alclapin-renta-departamento-calle-barranca-del-muerto-florida-61788622.html,"MN 26,500","Barranca del Muerto 140
Florida, Alvaro Obregón","130 m² lote, 3 rec., 2 baños, 2 estac.",San Ángel
"Disponible A partir del 1ro de Septiembre. Amplio y luminoso departamento en el excelente desarrollo Be Grand, San Angel. Son 143m2 distribuídos en 3 recámaras, 3. 5 baños (incluído el servicio), sala-comedor, tiene un espacio que puede ser utilizado como sala de tv, cocina, lavandería y área de servicio con baño, 2 estacionamientos. El desarrollo ofrece excelentes áreas comunes, alberca, gym, área para perros, área para niños, seguridad 24/7. Se encuentra en el piso 10, está lleno de luz, de ventilación. El precio incluye mantenimiento Informes y citas: Sissi Fialdini Ver datos",https://www.inmuebles24.com/propiedades/clasificado/alclapin-se-renta-depto-en-be-grand-iglesia-270-tizapan.-64432966.html,"MN 42,000","Iglesia 270
Tizapan, Alvaro Obregón","143 m² lote, 3 rec., 2 baños, 2 estac.",San Ángel
"Departamento en renta ubicado en Guadalupe Inn. Cuenta con 2 recámaras y 2 baños. El interior ofrece sala, comedor y cocina integral. Disfruta de 85 m2 de superficie construida. En el exterior, cuenta con 1 lugar de estacionamiento y terraza, ideal para disfrutar al aire libre. El edificio ofrece amenidades como gimnasio y área de bbq. Además, cuenta con conserje y seguridad privada, así como acceso para personas con discapacidad y se aceptan mascotas. Disfruta de los servicios básicos de agua y luz. Guadalupe Inn es una colonia predominantemente residencial, con un ambiente tranquilo y familiar. Encontrarás escuelas cercanas, así como diversos comercios y servicios esenciales. La zona cuenta con buenas opciones de transporte público y vialidades importantes, facilitando el acceso a diferentes puntos de la ciudad.",https://www.inmuebles24.com/propiedades/clasificado/alclapin-departamento-2-recamaras-en-venta-o-renta-85-m-sup2--147390501.html,"MN 28,000","Avenida Revolución 1386
Guadalupe Inn, Alvaro Obregón","85 m² lote, 2 rec., 2 baños, 1 estac.",San Ángel
"Excelente departamento bien ubicado, ideal persona sola, estudiante O empleado, muy bien ubicado, cerca portal san angel, amueblado, una recamara, baño, para verlo es previa cita",https://www.inmuebles24.com/propiedades/clasificado/alclapin-excelente-departamento-147424735.html,"MN 8,500","Ricardo Palmerín
Guadalupe Inn, Alvaro Obregón","30 m² lote, 1 rec., 1 baño",San Ángel
