Título,Enlace,Precio,Dirección,Características,Colonia de Origen
"Departamento en renta en planta baja. Ideal para solo llegar con maletas ya que está amueblado y equipado. 2 recámaras cada una con closet, la principal con 2 camas individuales que pueden ser king zise y la secundaria con cama individual. 1 Baño completo. Sala-comedor. Cocina integral equipada. Área de lavado con lavadero y clóset. Clóset de blancos. Terraza. 1 lugar de estacionamiento con costo de $1, 500. rodeado de comercios Y bancos. metro mixcoac A pasos. No se aceptan mascotas. Renta $16, 900. Mantenimiento $400. Requisitos: Un mes de renta. Un mes de deposito. Póliza jurídica. Propiedad en garantía sino cuentas con ello márcanos y te damos opciones de garantías",https://www.inmuebles24.com/propiedades/clasificado/alclapin-departamento-en-renta-amueblado-y-equipado-metro-147243553.html,"MN 16,900","Revolución, San Juan, Benito Juárez
San Juan, Benito Juárez","87 m² lote, 2 rec., 1 baño, 1 estac.",San Juan
"Si buscas vivir en una zona céntrica, tranquila y con excelente conectividad, este departamento es para ti. Ubicado en el tercer nivel (sin elevador), esta propiedad de 77 m² ha sido remodelada recientemente, por lo que se encuentra en perfecto estado y lista para habitar. Características: • 2 recámaras con excelente iluminación. • 1 baño completo con acabados modernos. • Área de lavado independiente. • 1 cajón de estacionamiento. • Distribución funcional y espacios bien aprovechados. Su cercanía a Av. Patriotismo, viaducto, escuelas, supermercados, parques y transporte público, lo hace una opción ideal para quienes valoran la comodidad de moverse fácilmente por la ciudad. Ideal para parejas, profesionistas o pequeñas familias que buscan un hogar moderno, cómodo y bien ubicado. ¡Agenda una visita y conócelo! El mantenimiento ya está incluido en el precio. Informes por WhatsApp Ver datos",https://www.inmuebles24.com/propiedades/clasificado/alclapin--departamento-en-renta-en-holbein!-147031165.html,"MN 20,000","Holbein
San Juan, Benito Juárez","77 m² lote, 2 rec., 1 baño, 1 estac.",San Juan
"¡Vive en una de las zonas más conectadas y tranquilas de la Ciudad de México! Este acogedor departamento interior en planta baja (28m cuadrados) se encuentra a solo unos pasos del Parque Hundido, perfecto para quienes buscan comodidad, privacidad y excelente ubicación. No mascotas, sin estacionamiento.",https://www.inmuebles24.com/propiedades/clasificado/alclapin-departamento-en-planta-baja-a-pasos-del-parque-hundido-146221517.html,"MN 9,500","Agusto Rodin 347
San Juan, Benito Juárez","28 m² lote, 1 rec., 1 baño",San Juan
"Departamento en renta – mixcoac. Privilegiada ubicación dentro de una pequeña privada discreta, donde encontrarás esta joya: Características: • 66 m² • 1er piso. • 2 habitaciones con clóset. • 1 baño completo. • Área social amplia y luminosa. • Área de lavado y tendido. • No se aceptan mascotas. Renta mensual: 14, 000 mxn. (Incluye mantenimiento) Requisitos de arrendamiento: Pago de investigación. Fiador u obligado solidario. Ingresos comprobados 3 a 1. Identificación oficial (ine o Pasaporte) Colonia Mixcoac, cdmx. ocho inmobiliaria. Ver datos",https://www.inmuebles24.com/propiedades/clasificado/alclapin-renta-departamento-duplex-colonia-mixcoac-147401481.html,"MN 14,000","Rubens 17
San Juan, Benito Juárez","69 m² lote, 2 rec., 1 baño, 1 estac.",San Juan
"Departamento en venta Y renta en excelente estado de conservación, se encuentra en la Colonia Mixcoac en la calle de Giotto. Tiene 80 m2 habitables, cuenta con estancia y comedor, dos recámaras, dos baños completos, es interior, no cuenta con elevador, está en un segundo nivel y cuenta con tres estacionamientos, independientes, en la azotea cuenta con roof garden y asador para tus reuniones familiares, tiene área de lavado y jaula de tendido.",https://www.inmuebles24.com/propiedades/clasificado/alclapin-departamento-venta-renta-giotto-mixcoac-146703909.html,"MN 20,000","GIOTTO 52
Mixcoac, Benito Juárez","80 m² lote, 2 rec., 2 baños, 3 estac.",San Juan
"Excelente departamento encortinado con vista al parque plaza jose clemente orozco, recien remodelado, 3 recamaras, closets, 2 baños completos, amplia sala comedor, cocina intergral, area de lavado, gas natural, sin estacionamiento, se acepta mascota pequeña con deposito adicional.",https://www.inmuebles24.com/propiedades/clasificado/alclapin-excelente-departamento-junto-a-la-plaza-mexico.-144843607.html,"MN 21,900","José Clemente Orozco # 10
Ciudad de los Deportes, Benito Juárez","115 m² lote, 3 rec., 2 baños",San Juan
"Espectacular departamento en renta en una excelente ubicación. disponible hasta el 15 de septiembre, agenda cita para esas fechas. caracteristicas: $36, 000 renta ya con mantenimiento. 120m2. 3 recamaras (recamara principal con vestidor Y ambas recamaras con closet) 2 baños completos (uno en recamara principal Y uno en recamara principal) sala-comedor bastante amplio con vista al jardin interior. cocina equipada. área de lavdo. 2 lugares de estacionamiento. Amenidades: Gimnasio, alberca, chapoteadero, jacuzzi, asadores, cuenta con una casa club divina de muy buen gusto con cafetería, ludoteca, spa, business center, área de estar, salón de jóvenes y adultos con barra, terraza de fiestas con entrada independiente a los edificios. Recepción cálida, jardines lindos, salitas de estar y mesas.",https://www.inmuebles24.com/propiedades/clasificado/alclapin-espectacular-departamento-en-renta-en-el-desarrollo-144360710.html,"MN 36,000","AV. PATRIOTISMO 883
Insurgentes Mixcoac, Benito Juárez","154 m² lote, 3 rec., 2 baños, 2 estac.",San Juan
"Departamento tipo loft en calle valencia no. 9 esquina con av. Insurgentes sur cuenta con cama queen, mesa con 4 sillas, sofa, cocina integral totalmente equipada, television, baño, el edificio cuenta con un area con lavadora Y secadora, vigilancia 24/7 elevador, la renta incluye luz, agua, gas, internet, mantenimiento, el cambio de sabanas Y toallas una vez por semana, no aceptamos mascotas, no pedimos aval,",https://www.inmuebles24.com/propiedades/clasificado/alclapin-departamento-amueblado-y-equipado-enfrenta-de-147111585.html,"MN 18,500","Valencia NO 9 Esquina AV. Insurgentes
Insurgentes Mixcoac, Benito Juárez","28 m² lote, 1 rec., 1 baño",San Juan
"Departamento seminuevo, solo 5 años de uso en excelentes condiciones, interior 2o piso en un condominio de solo 12 departamentos, en una calle muy arbolada, tranquila y segura, a solo 50 metros del Parque Hundido, los mejores servicios y vías de comunicación. El departamento es muy cuadrado con excelente distribución y consta de sala/comedor, cocina equipada con muy buenos espacios, amplia area de lavado y bien ventilada, 2 recamaras, 2 baños y 2 estacionamientos grandes. Vigilancia 24/7 y elevador. requisitos indispensables: aval con bien inmueble libre de gravamen en cdmx U obligado solidario, comprobantes de ingresos fiscales de sus ultimos 3 meses Y pago poliza juridica 50/50.",https://www.inmuebles24.com/propiedades/clasificado/alclapin-departamento-en-renta-colonia-noche-buena.-143980885.html,"MN 24,000","Cleveland 60
Nochebuena, Benito Juárez","94 m² lote, 2 rec., 2 baños, 2 estac.",San Juan
"Excelente departamento con vigilancia, en primer piso con balcón, exterior. Cuenta con 2 recámaras, principal con baño completo y salida a balcón, segunda recámara comparte baño con estancia. Estancia con salida al balcón, cocina integral, cuenta con área de lavado. El edificio cuenta con elevadorA pasos de Galerías Insurgentes, Avenida Insurgentes, Plaza Manacar, Metrobús y MetroLa renta incluye mantenimientono se aceptan mascotasno se aceptan niños se renta sin muebles",https://www.inmuebles24.com/propiedades/clasificado/alclapin-departamento-insurgentes-mixcoac-147305830.html,"MN 25,000","Algeciras
Insurgentes Mixcoac, Benito Juárez","85 m² lote, 2 rec., 2 baños, 1 estac.",San Juan
"Departamento en renta sin comisión compartida. Excelente ubicación a 2 cuadras del Periférico y a 2 cuadras del metro mixcoac. En cuanto a tema de mascota se deberá comprobar qué mascota es y se podrá a consideración del propietario. Edificio con Elevadory seguridad 24 hrs. . 1 cajón de estacionamiento independiente no se estorba con nadie. . 2 recámaras (cada una con su baño completo dentro de la recámara) . Cocina abierta con barra. . Cuarto de lavado. . Estancia con balcón. Se entrega con persianas, lámparas (tal cual aparece en las fotografías). Mantenimiento incluído en. Requisitos: 2 personas que firman el contrato (inquilino Y un obligado solidario) ambos deben de comprobar ingresos (últimos 6 meses), identificación oficial vigente. buró de crédito y un comprobante de domicilio. Llenar cuestionario con referencias personales y laborales, acreditar lugar de trabajo con recibos de nómina o carta laboral. Mes de Renta. Mes de depósito. Pago de póliza jurídica 6, 700",https://www.inmuebles24.com/propiedades/clasificado/alclapin-renta-departamento-santa-maria-nonoalco-benito-juarez-66902537.html,"MN 22,500","Miguel Ángel
Santa María Nonoalco, Benito Juárez","70 m² lote, 2 rec., 2 baños, 1 estac.",San Juan
Excelente depa totalmente amueblado. Excelente ubicación a una cuadra de insurgentes. 3 recámaras. 3 baños completos. Sala y comedor. Cocina muy amplia con área de lavado integrada. 1 estacionamiento. Elevador,https://www.inmuebles24.com/propiedades/clasificado/alclapin-excelente-departamento-amueblado-super-ubicado-147386222.html,"MN 25,000","Avenida Extremadura 46
Insurgentes Mixcoac, Benito Juárez","120 m² lote, 3 rec., 3 baños, 1 estac.",San Juan
"Penthouse en renta en una zona agradable a unos pasos de la agradable Plaza Agustín Jáuregui y la universidad Panamericana. Se encuentra construido en de dos niveles, con terraza, family room y 2 recámaras en excelente ubicación. Este amplio y luminoso departamento tipo penthouse cuenta con sala, comedor, cocina integral, baño de visitas, cuarto de lavado, family room y una espectacular terraza descubierta de 35. 8 m² ideal para disfrutar al aire libre. Tiene 2 recámaras, cada una con baño completo; la principal con vestidor y la secundaria con clóset y balcón privado. Además, ofrece 2 lugares de estacionamiento. Perfecto para quienes buscan un departamento en renta con terraza, espacios amplios y distribución funcional.",https://www.inmuebles24.com/propiedades/clasificado/alclapin-departamento-en-renta-insurgentes-mixcoac-campana-147185943.html,"MN 39,000","Campana
Insurgentes Mixcoac, Benito Juárez","135 m² lote, 2 rec., 2 baños, 2 estac.",San Juan
"Departamento muy iluminado con preciosa vista. frente al liverpool de insurgentes 4o piso exterior. amplia sala, comedor con balcón. cocina integral nueva. 2 recámaras amplias con balcón. 1 baño. no tiene estacionamiento. servicios incluidos: luz, agua, gas, internet",https://www.inmuebles24.com/propiedades/clasificado/alclapin-excelente-departamento-amueblado-61480545.html,"MN 30,000","Valencia 9
Insurgentes Mixcoac, Benito Juárez","94 m² lote, 2 rec., 1 baño",San Juan
"Departamento exterior ubicado en un segundo piso de un edificio de sólo 3 niveles. Muy cerca de la Universidad Panamericana. Consta de dos recámaras, área de tv o home office, dos baños completos, amplia estancia, cocina abierta con barra, área de lavado, dos cajones de estacionamiento techados que no se estorban con ningún vecino y dos balcones, uno en la estancia y otro en la recámara principal. A pesar de ser un edificio bajo, cuenta con elevador. Las cortinas que se ven en las fotos fueron cambiadas por persianas. Vigilancia durante el día y cámaras de videovigilancia cctv. Mantenimiento incluido en el precio de renta.",https://www.inmuebles24.com/propiedades/clasificado/alclapin-departamento-con-dos-balcones-muy-iluminado-143574228.html,"MN 25,800","Poussin 40
Mixcoac, Benito Juárez","120 m² lote, 2 rec., 2 baños, 2 estac.",San Juan
"Excelente departamento en holbein completamente renovado con acabados de lujo, impecable, con mucha iluminación, cuenta con gran estancia-comedor, bellisima cocina integral con cubierta de tipo corian, recámara principal con closet, baño completo con regadera de cascada Y cancel de vidrio templado, recámara secundaria con closet, segundo baño completo con lavabos dobles con cubierta tipo corian, regadera de cascada Y cancel de vidrio templado, cuenta con 1 espacio que puede ser 3er recámara, oficina, estudio O family room con baño completo Y mueble empotrable, el departamento tiene hermosa terraza privada Y balcon en recámara principal Y estancia, persianas enrollables con sus galerías, pisos de loseta, con 3 puertas: una de herrería, la principal de madera Y una de servicio. Se ubica en 1er piso, acceso en forma peatonal por holbein, con 2 estacionamientos con acceso por detroit con portero eléctrico, gas lp, todo en perfecto estado de conservación Y de funcionalidad. Magnifica ubicación sobre holbein A un paso de insurgentes, muy cerca de parque hundido, A 2 cuadras de la plaza de toros Y vialidades que conectan con eje 5 Y eje 6 cerca de patriotismo, muy cerca de colonias del valle, nochebuena, nápoles, en la zona con todos los servicios escuelas, universidades, hospitales, gasolineria, bancos, iglesia, supermercados, farmacias. Se requiere el pago de 1 mes de renta de depósito Y 1 mes de ocupación, contrato anual, aval, pago de $5, 300. 00 para la investigación Y póliza jurídica, $27, 250. 00 de renta + $750. 00 de mantenimiento, toda la documentacion al corriente Y en orden, interesados comunicarse para concertar cita.",https://www.inmuebles24.com/propiedades/clasificado/alclapin-departamento-en-renta-con-terraza-en-nochebuena-ciudad-146032288.html,"MN 27,250","HOLBEIN 215, COLONIA NOCHEBUENA
Nochebuena, Benito Juárez","150 m² lote, 2 rec., 3 baños, 2 estac.",San Juan
"Excelente departamento boutique con las comodidades de un departamento moderno privado. Ideal para extranjeros! Excelente departamento amueblado en renta dentro de condominio de sólo 8 departamentos. Prácticamente Nuevo. Impecable, Segundo Nivel. Muy tranquilo, Excelente orientación sur. Interior. Vista al Atrio de la Iglesia. Excelente orientación. Muy buenos acabados. Confortable. Acogedor. Iluminado. No mascotas. Amueblado y equipado con electrodomésticos. área privativa 85. 00 M2. Colindante con atrio de Iglesia colonial. Se compone de: área formal: Amplia estancia - comedor con salida a balcón y vista al atrio de la Iglesia. Cocina integral equipada en concepto abierto con barra. Junto a la cocina se encuentra el área de lavado con iluminación y ventilación natural. área íntima: Recámara principal con ventana de piso a techo y salida a pequeño balcón, cuenta con baño - vestidor integrado. Segunda recámara, también con ventana de piso a techo y salida a pequeño balcón, comparte el uso de un baño completo con visitas. Los baños cuenta con iluminación y ventilación natural. Además cuenta con 2 lugares de estacionamiento fijos e independientes. área común: Cuenta con un Salón de Usos Múltiples con Terraza en la planta alta del edificio. El edificio cuenta con conserjería en el día y velador por las noches, también tiene cctv. Ubicado atrás del Parque Hundido, y colindante con la Parroquia de San Juan Evangelista y Nuestra Señora de Guadalupe, frente a la Plaza Gómez Farías. Bien comunicado a través de avenidas principales como Insurgentes Sur, Patriotismo y Revolución. Precio de renta con mantenimiento incluido. Edificio muy tranquilo, muy poco ruido. Ideal para extranjeros! Visítelo!",https://www.inmuebles24.com/propiedades/clasificado/alclapin-excelente-departamento-amueblado-y-equipado-en-renta-142830768.html,"MN 33,000","Augusto Rodín No. 316
Nochebuena, Benito Juárez","85 m² lote, 2 rec., 2 baños, 2 estac.",San Juan
"Este encantador departamento en Pablo Ucello 30, ubicado en la Colonia Ciudad de los Deportes, te ofrece todo lo que necesitas para vivir cómodamente en una de las zonas más conectadas de la Ciudad de México. Con un costo mensual de $11, 100, es ideal para una pareja o una persona sola. Se solicita un mes de renta, un mes de deposito una póliza jurídica y comprobación de ingresos de $33, 000 mensuales. 1 amplia recámara y área de servicio. Estancia comedor con refrigerador y parrilla incluidos. Ubicado en planta baja, ideal para quienes buscan fácil acceso. No cuenta con estacionamiento, pero su ubicación te permite disfrutar de todo a pie o en transporte público. Ubicación Privilegiada: Ciudad de los Deportes es conocida por su conectividad y oferta cultural. Este departamento está cerca de: Plazas comerciales: Como Plaza Metrópoli Patriotismo, donde encontrarás tiendas, cines y restaurantes. Restaurantes: A solo minutos de lugares como El Califa, ideal para disfrutar de tacos, o Chazz Pizza para una experiencia más casual. Parque Hundido: Un oasis natural en medio de la ciudad, perfecto para pasear o ejercitarse. Instituto Mora: Ideal para académicos e investigadores que buscan vivir cerca de su lugar de trabajo. Acceso a avenidas principales como Insurgentes, Viaducto y Patriotismo, facilitando la movilidad en toda la ciudad. Metro cercano: La estación más cercana es San Antonio (Línea 7), a solo unos minutos a pie. Cercanía a Escuelas y Dependencias: Universidad Panamericana: A pocos minutos, ideal para estudiantes o académicos. Colegio Madrid y Escuela Moderna Americana, si buscas opciones para la educación de los más pequeños. ¡Este departamento te ofrece todo lo que necesitas para disfrutar de un estilo de vida cómodo y dinámico! Agenda tu cita hoy mismo y no pierdas la oportunidad de conocerlo.",https://www.inmuebles24.com/propiedades/clasificado/alclapin-departamento-en-renta-tipo-loft-a-10-minutos-de-parque-144677415.html,"MN 11,100","Paulo ucello 30
Ciudad de los Deportes, Benito Juárez","45 m² lote, 1 rec., 1 baño",San Juan
"Es un departamento exterior con 95m2 muy iluminado en cuarto piso con elevador cuenta con dos recamaras la principal con su baño dos baños cocina equipada área de lavado junto a la cocina sala comedor con una excelente distribución cuenta con dos lugares de estacionamiento fijos no estorba a nadie área de contenedor para la basura vigilancia las 24 horas el edificio cuenta con roft Garden y gym, el mantenimiento esta incluido en la renta. Requisitos un deposito una renta adelanta un fiador el pago de una póliza legal no mascotas. Informes únicamente Whatsapp",https://www.inmuebles24.com/propiedades/clasificado/alclapin-mixcoac-dos-recamaras-147142744.html,"MN 22,000","Leonardo Da Vinci 129
Mixcoac, Benito Juárez","84 m² lote, 2 rec., 2 baños, 2 estac.",San Juan
"Rento precioso departamento, con preciosa vista al jardín, sin vecinos de un lado, la distribucion del departamento es excelente y cuenta con mucha luz, se entrega con persianas. Cuenta con asador, jardín, ludoeca, business center, area social, gimnasio, jaccuzi. Excelente ubicación y vias de acceso.",https://www.inmuebles24.com/propiedades/clasificado/alclapin-rento-precioso-departamento-enquentro-mixcoac-147009494.html,"MN 30,000","Av. Patriotismo 883
Mixcoac, Benito Juárez","88 m² lote, 2 rec., 2 baños, 2 estac.",San Juan
"Se rentan dos ofinas en Insurgentes. * Departamento 10 Área total: 77 m2 $20, 000. * Departamento 7 Área total: 83 m2 $27, 000. Este encantador departamento en renta ofrece una combinación perfecta de comodidad, estilo y conveniencia. Situado en el corazón de la ciudad, este espacio es ideal para aquellos que buscan un estilo de vida urbano sin comprometer la tranquilidad.",https://www.inmuebles24.com/propiedades/clasificado/alclapin-oficinas-en-insurgentes-en-renta-143385660.html,"MN 20,000","Av. Insurgentes
Insurgentes Mixcoac, Benito Juárez","77 m² lote, 2 rec., 1 baño",San Juan
"Amplio e iluminado departamento en venta ubicado en una zona privilegiada y con todo lo que necesitas a tu alcance. A dos cuadras de Avenida Insurgentes y del Metrobús Parque Hundido, rodeado de comercios, tiendas de conveniencia, centros comerciales, áreas verdes y a unos pasos del icónico Parque Hundido donde podrás ejercitarte diariamente, pasear a tu mascota y disfrutar de todas las actividades que se realizan en éste. Cuenta con dos amplias recámaras una de ellas con balcón, la principal con baño completo y clóset, la secundaria cuenta con clóset, otro baño completo en pasillo, sala, comedor con balcón para que instales tu asador y disfrutes preparar tu carne asada en la comodidad de tu hogar, cuenta también con amplia cocina integral con barra desayunadora, area de lavado integrada y con ventilacion natural, dos estacionamientos trchados. El edificio cuenta con elevador, bussiness center, circuito cerrado y seguridad 24 horas.",https://www.inmuebles24.com/propiedades/clasificado/alclapin-magnifico-e-iluminado-departamento-144421296.html,"MN 25,000","Carolina
Nochebuena, Benito Juárez","100 m² lote, 2 rec., 2 baños, 2 estac.",San Juan
"Lindo departamento iluminado exterior con balcón. Cuenta con amplia estancia y 2 recamaras con amplios closets. Cocineta. 1 baño. Silenciosos espacios e inmejorable ubicación. Pisos de duela original. Sobre Insurgentes sur. Frente a Liverpool. Bancos, comercios, tiendas, escuelas, transportes. No cuenta con elevador. Se encuentra en 2º piso. Cuenta con 1 cajón de estacionamiento. Precio de renta ya incluye mantenimiento. Requisitos1 depósito la renta del primer mes. Fiador con propiedad en garantía. Comprobar ingresos por 3 veces el monto de la renta. Póliza jurídica por cuenta del inquilino.",https://www.inmuebles24.com/propiedades/clasificado/alclapin-departamento-en-renta-insurgentes-mixcoac-147369620.html,"MN 30,000","Insurgentes Sur 1409
Insurgentes Mixcoac, Benito Juárez","85 m² lote, 2 rec., 1 baño, 1 estac.",San Juan
"Departamento de lujo, con gran terraza de vistas preciosas, edificio único en Insurgentes Mixcoac, 134m2, de 3 recamaras, 2 baños, 2 estacionamientos. Amenidades como alberca, gimnasio, jardines comunes, área de usos múltiples, lobby, parques y zonas arboladas cercanas, a unos pasos de la Universidad Panamericana, zona colonial. Renta más mantenimiento de 5, 500 pesos. Ver Video integrado en la publicidad.",https://www.inmuebles24.com/propiedades/clasificado/alclapin-departamento-en-renta-en-insurgentes-mixcoac-58456633.html,"MN 39,500","Goya 29
Insurgentes Mixcoac, Benito Juárez","134 m² lote, 3 rec., 2 baños, 2 estac.",San Juan
"*mantenimiento incluido* -115m2 habitables. -Cocina integral abierta c/cubiertas de granito. -3 recamaras (princ. C/baño completo y walking closet) -2 baños completos c/ventilacion natural, canceles de cristal templado. -Cuarto de lavado c/ventilacion natural. -Balcon a lo largo de todo el frente (15 mts. De largo) -Elevador al piso. -Roof garden en area comun c/baño, mobiliario y asador. -2 cajones de estacionamiento, techados e independientes. -Servicio de conserjeria y limpieza (recibe paqueteria) -Condominio de solo 5 departamentos (1 por piso) *Excelente iluminacion natural, canceles de cristal de piso a techo a lo largo de todo el frente del departamento, con orientacion oriente/poniente, incluye persianas y black out, parque a media cuadra, excelente ubicacion, varios servicios cercanos y vialidades principales para un facil acceso. *",https://www.inmuebles24.com/propiedades/clasificado/alclapin-departamento-en-renta-ciudad-de-los-deportes-147356213.html,"MN 35,000","Correggio 65
Ciudad de los Deportes, Benito Juárez","125 m² lote, 3 rec., 2 baños, 2 estac.",San Juan
"Este departamento cuenta con inmejorable ubicación, ya que está cerca de parques, escuelas, oficinas, restaurantes, gimnasios, ciclovías y excelente transporte público. La colonia Nápoles es una de las colonias mas seguras y tranquilas de la cdmx. Este acogedor departamento está en planta baja interior, tiene 2 recámaras con clóset; la principal es muy amplia y ambas comparten un baño completo. Tiene una gran área de sala comedor con acceso a patio privado con asador (es el único departamento que lo tiene). Cuenta con cocina integral y muebles de almacenamiento, así como despensa. Clóset con instalación para lavadora o ideal para centro de lavado eléctrico. En la azotea, se encuentra el cuarto de servicio que se puede usar como bodega y también tiene una jaula de tendido techada. El edificio cuenta con un roof top de uso común con asador. No se admiten mascotas. No cuenta con estacionamiento pero hay pensiones disponibles a una cuadra. No dejes de pedir tu cita, te encantará!!",https://www.inmuebles24.com/propiedades/clasificado/alclapin-departamento-en-renta-en-la-napoles-147402279.html,"MN 19,000","Indiana
Ampliación Nápoles, Benito Juárez","100 m² lote, 2 rec., 1 baño",San Juan
"Departamento amueblado Y equipado en calle valencia esquina con av. Insurgentes sur con 83 mt2 de superficien cuenta con 2 recamaras, un baño, sala, comedor, cocina integral totalmente equipada, lavadora/secadora, televisores, seguridad 24/7 recepcion, la renta incluye, mantenimienro, luz, agus, gas, internet asi como el cambio de sabanas Y toallas una vez por semana, no aceptamos mascotas, no pedimos aval",https://www.inmuebles24.com/propiedades/clasificado/alclapin-departamento-amueblado-y-equipado-esquina-con-av-146995099.html,"MN 30,000","Valencia 9 Amueblado Y Equipado
Insurgentes Mixcoac, Benito Juárez","83 m² lote, 2 rec., 1 baño",San Juan
