Título,Enlace,Precio,Dirección,Características,Colonia de Origen
"Bonito departamento recién remodelado en un condominio horizontal. Consta de estancia, cocina con desayunador, área de lavado incluye lavadora y secadora. Amplio estudio, una recámara grande con closet de muy buen tamaño con vista al jardín. Comparte jardín y terraza con otro departamento. La renta incluye los servicios de agua, luz y gas. Se requiere póliza jurídica con aval. Un lugar de estacionamiento. No se permiten mascotas. Conócelo!! Malena Romo Ver datos. Maru de Miguel Ver datos",https://www.inmuebles24.com/propiedades/clasificado/alclapin-rento-departamento-en-san-nicolas-totolapan-dentro-de-146371355.html,"MN 13,500","SOLEDAD
San Nicolás Totolapan, La Magdalena Contreras","80 m² lote, 1 rec., 1 baño, 1 estac.",San Nicolás Totolapan
"Id: dd108 Departamento de dos pisos en pb, dentro de fraccionamiento de casas y departamentos. En la parte alta de San Nicolas Totolapan cerca de los Dinamos El departamento esta distribuido en dos plantas, en la primera planta esta el área social, comedor y sala, cocina y un baño de visitas, al subir las escaleras, se encuentran dos recamaras con vestidor y closet y comparten baño El complejo cuenta con áreas comunes, una terraza, un jardín y una pequeña área de descanso. Se aceptan mascotas y la renta incluye el mantenimiento",https://www.inmuebles24.com/propiedades/clasificado/alclapin-departamento-en-renta-col.-san-nicolas-totolapan-146117255.html,"MN 13,900","San Nicolas Totolapan
San Nicolás Totolapan, La Magdalena Contreras","120 m² lote, 2 rec., 2 baños, 1 estac.",San Nicolás Totolapan
"Rento dos bonitos departamentos con buenos espacios de 2 recámaras con vista arbolada, sala-comedor, cocina integral con barra, balcón, 1 baño grande completo, área de lavado y 1 estacionamiento. Vista arbolada y panorámica. En segundo y tercer piso sin elevador. No se admiten mascotas.",https://www.inmuebles24.com/propiedades/clasificado/alclapin-departamento-en-san-nicolas-totolapan-vista-arbolada-147374560.html,"MN 8,700","Cerrada Alamos 72
San Nicolás Totolapan, La Magdalena Contreras","70 m² lote, 2 rec., 1 baño, 1 estac.",San Nicolás Totolapan
