Título,Enlace,Precio,Dirección,Características,Colonia de Origen
"Hermoso departamento 2o nivel muy bien ubicado cerca avenida rio churubusco, Y municipio libre, excelente condominio con seguridad privada, cuenta con 2 recamaras, 2 bañoscompletos, cocina equipada un estacionamiento, elevador, area de negocios. Incluye mantenimiento",https://www.inmuebles24.com/propiedades/clasificado/alclapin-en-renta-andres-molina-enriquez-av-de-las-torres-59239792.html,"MN 16,500","ANDRES MOLINA ENRIQUEZ AV DE LAS TORRES
San Andrés Tetepilco, Iztapalapa","70 m² lote, 2 rec., 2 baños, 1 estac.",San Andrés Tetepilco
"Departamento en planta baja de 1 recámara amplia, cocina amplia, sala-comedor, baño y área de lavado. No acepta mascotas. Cerca de vialidades importantes como Eje 6 Sur Pie de la Cuesta, Av. Andrés Molina E, Av. Emilio Carranza y Plutarco E. Calles. Cercano a metros Nativitas y Portales (Línea 2)",https://www.inmuebles24.com/propiedades/clasificado/alclapin-departamento-renta-147310676.html,"MN 7,200","ALFAJAYUCAN
San Andrés Tetepilco, Iztapalapa","30 m² lote, 1 rec., 1 baño",San Andrés Tetepilco
"Departamento de 2 habitaciones, 1 baño, sala comedor, cocina, area de lavado integrada al departamento, se encuentra en primer nivel, 1 lugar de estacionamiento. El condominio cuenta con vigilancia las 24 hrs, acceso controlado, áreas comunes con juegos al aire libre, cerca de vialidades importantes",https://www.inmuebles24.com/propiedades/clasificado/alclapin-departamento-renta-147454835.html,"MN 10,200","PORTO ALEGRE
San Andrés Tetepilco, Iztapalapa","68 m² lote, 2 rec., 1 baño, 1 estac.",San Andrés Tetepilco
"Moderno Y comodo departamento remodelado totalmente ubicado en planta baja, en edificio de solo dos departamentos. Muy iluminado ideal para home office. - amplia estancia con vista A terraza O patio. - cocina integral abierta con barra. - agradable patio O terraza con area para lavanderia. - pasillo distribuidor. - recamara con closet. - estudio O segunda recamara con closet. . Baño con regadera con cancel cristal templado. - un estacionamiento. excelente comunicacion, todos los medios de transporte Y servicio, rapidas vias de acceso, eje 6 angel urraza, tlalpan, plutarco elias calles. todos los medios de transporte Y servicios. informes Y citas: leticia esparza. celular Ver datos. oficina Ver datos",https://www.inmuebles24.com/propiedades/clasificado/alclapin-reforma-iztaccihuatl-renta-departamento-80-m.-con-90797755.html,"MN 15,000","CALZ. DE LA VIGA
Reforma Iztaccihuatl Sur, Iztacalco","77 m² lote, 2 rec., 1 baño, 1 estac.",San Andrés Tetepilco
"¡Descubre tu nuevo hogar! Este departamento en renta es la opción perfecta para quienes buscan comodidad y estilo en un solo lugar. Con 70 m² de construcción, ofrece un espacio bien distribuido con 3 recámaras y 1 baño, ideal para tu familia o compartir con roomies. Características destacadas: - Cocina integral: Equipada y moderna, lista para que prepares tus platillos favoritos. - Espacios amplios y luminosos: Las habitaciones cuentan con ventanas que permiten la entrada de luz natural. - Acabados elegantes: Pisos de cerámica que aportan un toque sofisticado. - Amenidades prácticas: Patio de lavado, calentador de agua, tinaco y tanque de gas estacionario, todo pensado para tu comodidad. - Estacionamiento: Un lugar seguro para tu auto. Este departamento es más que un lugar para vivir, es un espacio donde crearás momentos inolvidables. ¡No dejes pasar esta oportunidad y hazlo tuyo! Wig: ppjoW6W",https://www.inmuebles24.com/propiedades/clasificado/alclapin-departamento-reforma-iztaccihuatl-147421364.html,"MN 16,000","Playa Pie de la Cuesta
Reforma Iztaccihuatl Sur, Iztacalco","70 m² lote, 3 rec., 1 baño, 1 estac.",San Andrés Tetepilco
"Lindo departamento en renta 80 metros distribuidos en dos piso en la planta baja se encuentra estancia, medio baño, cocina integral, área de lavado, terreza, en primer piso dos recámaras con closet, dos baños completos, balcón en ambas recámaras, un lugar de estacionamiento compartido, el departamento se encuentra en primer piso exterior, costo de renta 20, 000 mas 1, 500 de mantenimiento. El departamento se encuentra en perfectas condiciones A estrenar, la ubicación es inigualable A dos calles del metro portales Y A tres calles del metro ermita, zona segura Y comercial. Informes Y citas al Ver datos con ivonne farfan",https://www.inmuebles24.com/propiedades/clasificado/alclapin-lindo-departamento-en-portales-nuevo-147413015.html,"MN 20,000","Miravalle
Portales Oriente, Benito Juárez","80 m² lote, 2 rec., 2 baños, 1 estac.",San Andrés Tetepilco
"Departamento muy iluminado con una excelente ubicación. Consta de 64 m2 habitables más 62 m2 de rg privado, 2 recámaras, 2 baños y 1 lugar de estacionamiento en línea de 2. Área de lavado integrada. En el edificio se cuenta con vigilancia 24 horas, está ubicado en 5to. Piso con elevador. Muy cerca de todos los medios de transporte: a 2 cuadras del metro Portales, muy cerca de Plutarco E. Calles. Restricciones: no mascotas. Requisitos: 1 mes de renta + 1 mes de depósito + Fiador con propiedad libre de gravamen + Póliza jurídica $4, 505",https://www.inmuebles24.com/propiedades/clasificado/alclapin-departamento-en-renta-portales-oriente-147200452.html,"MN 17,500","Miraflores 415
Portales Oriente, Benito Juárez","64 m² lote, 2 rec., 2 baños, 1 estac.",San Andrés Tetepilco
"¡Comodidad, ubicación y practicidad en un solo lugar! Este acogedor departamento de aproximadamente 70 m², ubicado en el piso 2 de un edificio con elevador, en la tranquila y céntrica Colonia Albert, es ideal para quienes buscan vivir con estilo y funcionalidad. 2 recámaras con excelente iluminación 2 baños completos Cuarto de servicio (ideal como bodega o área de lavado) 1 cajón de estacionamiento Elevador en el edificio Mantenimiento mensual: $1, 500 Disponible para habitar a partir del 15 de agosto Ubicado en una zona estratégica con acceso a avenidas principales, transporte público, parques y todos los servicios. ¡Agenda tu cita y conoce tu próximo hogar!",https://www.inmuebles24.com/propiedades/clasificado/alclapin-departamento-en-renta-colonia-albert-benito-juarez-146960019.html,"MN 17,500","Benito Juárez
Albert, Benito Juárez","70 m² lote, 2 rec., 2 baños, 1 estac.",San Andrés Tetepilco
"Excelente departamento interior muy iluminado, en el primer piso, con elevador, seminuevo, con canceles de cristal templado en los. baños, cubiertas de granito en la cocina y en los dos baños. Un cajón de estacionamiento solo para auto chico. Muy céntrico a una cuadra del viaducto Tlalpan, excelentes vías de comunicación. Requisitos: Una renta de deposito. La renta del mes que vaya corriendo. Fiador con bien inmueble en Ciudad de México ó en Naucalpan, Huixquilucan, Tlalnepantla, Atizapán y Querétaro. Ingresos que demuestren el 3 a 1 del valor de la renta con recibos de nomina o estados de cuenta bancarios.",https://www.inmuebles24.com/propiedades/clasificado/alclapin-elisa-departamento-en-renta-146760983.html,"MN 15,300","Elisa 241
Del Carmen, Benito Juárez","70 m² lote, 2 rec., 2 baños, 1 estac.",San Andrés Tetepilco
"Estrena departamento ubicado en Col. Portales Oriente, consta de estancia, cocina equipada abierta, área de lavado, 2 recámaras con clóset, clóset de blancos, dos baños completos (uno en la recámara principal), excelentes acabados, con roof garden privado, interfón, seguridad privada, elevador, un lugar de estacionamiento. Cerca de centros comerciales, restaurantes y parques, en una zona con diferentes vías de comunicación, a dos calles de Calz. Tlalpan (metro Portales), muy cerca Av. Plutarco Elías Calles, División del Norte, Eje Central, Eje 7 Sur Municipio Libre. Ven a conocerlo, apártalo y estrénalo! - El precio de renta incluye mantenimiento de $1, 200. - Acepta mascota pequeña. - Requisitos de Arrendamiento: Una renta adelantada, un depósito, fiador con bien raíz libre de gravamen, pago de póliza jurídica por $6, 650.",https://www.inmuebles24.com/propiedades/clasificado/alclapin-departamento-en-renta-en-portales-oriente-146485978.html,"MN 24,000","Suiza 32
Portales Oriente, Benito Juárez","111 m² lote, 2 rec., 2 baños, 1 estac.",San Andrés Tetepilco
"Departamento sobre Calz. De Tlalpan, de 79 m2, con 2 recámaras con closet (principal con baño), 2 baños, área de lavado integrada 2 balcones, 1 lugar de estacionamiento en eleva-autos, ubicación interior en piso 7 con elevador. El edificio tiene 8 años, vigilancia 24hrs, mantenimiento incluido. Servicios cercanos: Walmart Tlalpan, Mercado de Portales, Parque San Simón, metro Portales. Vías de comunicación: Plutarco Elías Calles, Cumbres de Maltrata. Requisitos: 1 mes de renta, 1 mes de depósito, fiador con propiedad libre de gravamen y una póliza jurídica de 2, 150. Restricciones: Mascotas 2 depositos. Fiador obligatorio: No.",https://www.inmuebles24.com/propiedades/clasificado/alclapin-departamento-en-tlalpan-147369635.html,"MN 17,500","Calz. de Tlalpan 1234
Zacahuitzco, Benito Juárez","79 m² lote, 2 rec., 2 baños, 1 estac.",San Andrés Tetepilco
Departamento en renta remodelado. cuenta con: * 1 habitacion. *1 baño completo. * sala - comedor. *cocina con tarja. *no acepta mascotas. *no cuenta con estacionamiento. ¡¡para mas informacion contactanos!!,https://www.inmuebles24.com/propiedades/clasificado/alclapin-bonito-departamento-en-renta-en-la-colonia-portales-146866373.html,"MN 8,200","AV. EMPERADORES 40B
Portales Oriente, Benito Juárez","45 m² lote, 1 rec., 1 baño",San Andrés Tetepilco
"Ref: 2 5 7 0 3 6. ¡No dejes pasar la oportunidad de rentar este hermoso departamento en la exclusiva zona de Albert, Benito Juárez, Ciudad de México! Con una superficie de 55 m2, esta propiedad cuenta con 2 recámaras, 1 baño, balcón y cocina equipada, perfecta para aquellos que buscan un espacio acogedor y funcional. Además, el departamento se encuentra semiamueblado y tiene piso de cerámica, lo que le brinda un toque moderno y elegante. Ubicado en una zona residencial, este departamento cuenta con elevadores, lo que facilita el acceso a las diferentes áreas del edificio. Su uso de suelo residencial garantiza un ambiente tranquilo y seguro para ti y tu familia. Además, la cercanía a puntos de interés como centros comerciales, parques y restaurantes hacen de esta propiedad una excelente opción para aquellos que buscan comodidad y calidad de vida. Entre las zonas de interés cercanas a este departamento se encuentran el centro comercial Parque Delta, ideal para realizar compras y disfrutar de una tarde de cine o comida en sus variados restaurantes. Asimismo, el Parque de los Venados y el Auditorio Nacional son lugares ideales para disfrutar de actividades al aire libre y eventos culturales. Por otro lado, la zona cuenta con una amplia oferta educativa, con escuelas de prestigio a pocos minutos de distancia. Con excelentes vías de acceso como las avenidas Insurgentes y Universidad, así como la cercanía a estaciones del metro y metrobús, moverse por la ciudad nunca ha sido tan sencillo. ¡No dejes pasar esta oportunidad y agenda una cita para conocer este encantador departamento en renta en Albert, Benito Juárez!",https://www.inmuebles24.com/propiedades/clasificado/alclapin-renta-de-departamento-en-albert-portales-147423117.html,"MN 13,000","Albert 10 , Albert , 03560 Benito Juárez, Ciudad de México, México
Albert, Benito Juárez","55 m² lote, 2 rec., 1 baño, 1 estac.",San Andrés Tetepilco
"Bonito Departamento en la calle de Benito Juárez, a unos metros de Tlalpan, cerca de metro Portales dirección Centro. Ubicado en primer piso con elevador, departamento interior, Estancia Comedor, cocina integral con área de lavado ventilado, dos recámaras (ideal para camas Queen no King) closets, un baño completo en pasillo y recámara principal con baño completo, un lugar de estacionamiento en fila de 3, Vigilancia 24/7. No cuenta con areas comunes. Se acepta mascota de raza pequeña. Contrato Anual. Requisitos: *Pago de póliza completa de $5800. *comprobar ingresos tres veces el valor de la renta. *Aval u Obligado solidario. *Un mes de renta de deposito. *Un mes de renta anticipada del primer mes del contrato",https://www.inmuebles24.com/propiedades/clasificado/alclapin-departamento-en-benito-juarez-metro-portales-albert-144117519.html,"MN 16,500","Benito Juárez
Albert, Benito Juárez","65 m² lote, 2 rec., 2 baños, 1 estac.",San Andrés Tetepilco
6500 (incluye servicios y Wifi) Ideal para estudiantes o ejecutivos. Se encuentra en un conjunto de 10 estudios con áreas comunes muy agradables. Entrada independiente y baño propio. Lugar tranquilo y muy bien mantenido. 18 m2. Mono ambiente. Planta baja. Cocineta. Baño completo. Se renta habitación completamente independiente. Entrada y baño Propio. Incluye internet y todos los servicios. No se aceptan mascotas. No cuenta con estacionamiento. A unas cuadras del metro nativitas.,https://www.inmuebles24.com/propiedades/clasificado/alclapin-renta-habitacion-con-entrada-independiente-en-reforma-147415369.html,"MN 6,500","Avenida Presidente Plutarco Elías Calles 1334
Reforma Iztaccihuatl Sur, Iztacalco","20 m² lote, 1 rec., 1 baño",San Andrés Tetepilco
"Bienvenido al mejor desarrollo en la zona: lujo - seguridad - garantías - acabados - ubicación - exclusividad. Con su distintivo estilo de ciudad y su cómoda localización; tu nuevo departamento! ! Es donde realmente puedes tenerlo todo. Lugares que marcan tendencia, restaurantes galardonados y de clase mundial, eventos deportivos de élite y una escena social que siempre es vibrante y excitante. &quot;Es lo que mereces para tu estilo de vida. &quot;Características: Departamento con acabados de lujo! ! 2 Recamaras. 2 Baños Completos. 1 Estacionamiento. Iluminación y ubicación inigualable. Contáctanos para conocer tu nuevo hogar. Será un placer atenderte! ! z o n a h o g a r e s. C o mte ayudamos A tramitar cualquier crédito hipotecario. bancario, infonavit, cofinavit, fovissste, alia2, etc. Llama Ahora! Tel: Ver datos. Whatsapp: Ver datos. z o n a h o g a r e s. C o mImágenes y textos son únicamente referencia. No deben interpretarse con fiel base de detalles finales en las residencias y desarrollo. El desarrollo se reserva el derecho de modificar y realizar cambios como juzgue correcto a su única y absoluta discreción. Representaciones verbales no contarán como modelo representante del desarrollador. *ajuste de precios sin previo aviso*z o n a h o g a r e s. C o m",https://www.inmuebles24.com/propiedades/clasificado/alclapin-departamento-en-venta-2-recamaras-2-banos-1-147401460.html,"MN 22,000","Cercano Alberca Olimpica
Albert, Benito Juárez","65 m² lote, 2 rec., 2 baños, 1 estac.",San Andrés Tetepilco
"Bienvenido al mejor desarrollo en la zona: lujo - seguridad - garantías - acabados - ubicación - exclusividad. Con su distintivo estilo de ciudad y su cómoda localización; tu nuevo departamento! ! Es donde realmente puedes tenerlo todo. Lugares que marcan tendencia, restaurantes galardonados y de clase mundial, eventos deportivos de élite y una escena social que siempre es vibrante y excitante. &quot;Es lo que mereces para tu estilo de vida. &quot;Características: Departamento con acabados de lujo! ! 2 Recamaras. 2 Baños Completos. 1 Estacionamiento. Iluminación y ubicación inigualable. Contáctanos para conocer tu nuevo hogar. Será un placer atenderte! ! z o n a h o g a r e s. C o mte ayudamos A tramitar cualquier crédito hipotecario. bancario, infonavit, cofinavit, fovissste, alia2, etc. Llama Ahora! Tel: Ver datos. Whatsapp: Ver datos. z o n a h o g a r e s. C o mImágenes y textos son únicamente referencia. No deben interpretarse con fiel base de detalles finales en las residencias y desarrollo. El desarrollo se reserva el derecho de modificar y realizar cambios como juzgue correcto a su única y absoluta discreción. Representaciones verbales no contarán como modelo representante del desarrollador. *ajuste de precios sin previo aviso*z o n a h o g a r e s. C o m",https://www.inmuebles24.com/propiedades/clasificado/alclapin-departamento-en-venta-2-recamaras-2-banos-1-147401477.html,"MN 22,000","Cercano Alberca Olimpica
Portales Oriente, Benito Juárez","65 m² lote, 2 rec., 2 baños, 1 estac.",San Andrés Tetepilco
"Bienvenido al mejor desarrollo en la zona: lujo - seguridad - garantías - acabados - ubicación - exclusividad. Con su distintivo estilo de ciudad y su cómoda localización; tu nuevo departamento! ! Es donde realmente puedes tenerlo todo. Lugares que marcan tendencia, restaurantes galardonados y de clase mundial, eventos deportivos de élite y una escena social que siempre es vibrante y excitante. &quot;Es lo que mereces para tu estilo de vida. &quot;Características: Departamento con acabados de lujo! ! 2 Recamaras. 2 Baños Completos. 1 Estacionamiento. Iluminación y ubicación inigualable. Contáctanos para conocer tu nuevo hogar. Será un placer atenderte! ! z o n a h o g a r e s. C o mte ayudamos A tramitar cualquier crédito hipotecario. bancario, infonavit, cofinavit, fovissste, alia2, etc. Llama Ahora! Tel: Ver datos. Whatsapp: Ver datos. z o n a h o g a r e s. C o mImágenes y textos son únicamente referencia. No deben interpretarse con fiel base de detalles finales en las residencias y desarrollo. El desarrollo se reserva el derecho de modificar y realizar cambios como juzgue correcto a su única y absoluta discreción. Representaciones verbales no contarán como modelo representante del desarrollador. *ajuste de precios sin previo aviso*z o n a h o g a r e s. C o m",https://www.inmuebles24.com/propiedades/clasificado/alclapin-departamento-en-venta-2-recamaras-2-banos-1-147401499.html,"MN 22,000","Cercano Alberca Olimpica
Zacahuitzco, Benito Juárez","65 m² lote, 2 rec., 2 baños, 1 estac.",San Andrés Tetepilco
¡Departamento listo para habitar! Ofrece: 1 habitación c/closet. 1 baño completo. Pequeño espacio para Estancia-comedor. Pequeña cocina para parrilla eléctrica. 1 lugar de estacionamiento compartido. Costo de mantenimiento $600 mensual. Requisitos: Pago de Póliza$ Mes de renta al corriente. 1 mes de depósito. Comprobante de ingresos vía nómina o estados de cuenta bancarios. Documentos: *ine. *Comprobante de ingresos (nómina o estados de cuenta bancarios) *Cédula fiscal del mes actual y año en curso,https://www.inmuebles24.com/propiedades/clasificado/alclappa-renta-departamento-en-planta-baja-147073392.html,"MN 10,000","Playa Langosta 292
Reforma Iztaccihuatl Sur, Iztacalco","55 m² lote, 1 rec., 1 baño, 1 estac.",San Andrés Tetepilco
"En una muy bonita colonia, muy bien ubicada con todos los servicios, baño agua caliente, cocina, te rento una recamara grande totalmente independiente.",https://www.inmuebles24.com/propiedades/clasificado/alclappa-te-rento-bonita-recamara-independiente-147443960.html,"MN 5,500","Playa Revolcadero 638 Reforma Iztaccihuatl Sur
Reforma Iztaccihuatl Sur, Iztacalco","27 m² lote, 1 rec., 1 baño",San Andrés Tetepilco
"Departamento interior de 2 recamaras con closet, sala comedor, cocina integral, área de lavado, 1 baño completo, 12 baño de visita, área de lavado y estacionamiento compartido. Vigilancia las 24, horas, elevador y extracción de basura",https://www.inmuebles24.com/propiedades/clasificado/alclapin-departamento-renta-147429546.html,"MN 14,000","BENITO JUAREZ
Albert, Benito Juárez","65 m² lote, 2 rec., 1 baño, 1 estac.",San Andrés Tetepilco
