Título,Enlace,Precio,Dirección,Características,Colonia de Origen
"Rento departamento en Soleil Santa Fe con preciosa vista a la Ciudad. 74m2. Una recámara. Un baño completo. Amueblado y cocina completa. Un estacionamiento con opción a dos. Excelentes áreas comunes: gimnasio, alberca, jacuzzi, salón de fiestas para 300 personas, salón de juegos para adultos, ludoteca, área de mascotas, jardín, asadores, cancha de padel. El precio incluye mantenimiento.",https://www.inmuebles24.com/propiedades/clasificado/alclappa-rento-departamento-en-soleil-santa-fe-con-preciosa-147265081.html,"MN 25,000","Avenida Javier Barros Sierra 225
Santa Fe Peña Blanca, Alvaro Obregón","74 m² lote, 1 rec., 1 baño, 1 estac.",Santa Fe Peña Blanca
"Excelente departamento en renta amueblado Y equipado, excelentes acabados, pisos de madera, Dos recámaras dos baños completos, , Sala comedor, cocina Equipada, techos doble altura, iluminación, Cocina, Área de lavado, Cuarto de Servicio con baño, dos estacionamientos, Áreas comunes Alberca, Cancha de tenis, asador, Jardín, juegos infantiles, vigilancia, Gimnasio, Ludoteca, Salón de Fiestas, Salón de Juegos para adultos, Solon de usos múltiples, Vigilancia, Estacionamiento para visitas.,",https://www.inmuebles24.com/propiedades/clasificado/alclapin-departamento-en-renta-147023992.html,"MN 39,500","Avenida Javier Barros Sierra
Santa Fe Peña Blanca, Alvaro Obregón","155 m² lote, 2 rec., 2 baños, 2 estac.",Santa Fe Peña Blanca
"Lindisimo y acogedor depto amueblado con mucha luz, techos altos y distribución excelente. 106 m con 2 recámaras, 2 baños, amplia sala comedor, cocina abierta, área de lavado y un garage. Alberca techada con jacuzzi, gym bien equipado, cancha de paddle tennis, jardín con asador y juegos infantiles, jardín de mascotas, salón de eventos. Frente a Televisa Santa fe y a dos calles del centro comercial Patio Santa fe, de la Universidad Iberoamericana y de corporativo Santander. Muy bien ubicado. Precio de oportunidad. Véalo! Previa cita",https://www.inmuebles24.com/propiedades/clasificado/alclapin-acogedor-depto-amueblado-se-renta-en-latelier-santa-147418621.html,"MN 32,000","Fernando espinosa Gutiérrez 55
Santa Fe Peña Blanca, Alvaro Obregón","106 m² lote, 2 rec., 2 baños, 1 estac.",Santa Fe Peña Blanca
