Título,Enlace,Precio,Dirección,Características,Colonia de Origen
"Estrena loft moderno en zona céntrica y tranquila! Disfruta de un espacio recién remodelado, ideal para una persona que valore la comodidad, funcionalidad y excelente conectividad. Características: Espacio abierto tipo loft. Cocina abierta. Baño completo amplio. Planta baja. Excelente ubicación con acceso a vías principales y transporte público. No cuenta con estacionamiento. No se aceptan mascotas. requisitos: -Un depósito en garantía. -Una renta por adelantado a la firma del contrato. -Pago de póliza jurídica $4, 150. 00. -Obligado Solidario. (4)",https://www.inmuebles24.com/propiedades/clasificado/alclapin-en-renta-departamento-tipo-loft-col.-santa-maria-146751686.html,"MN 8,000","Sandalo
Santa Maria Insurgentes, Cuauhtémoc","24 m² lote, 1 rec., 1 baño",Santa María Insurgentes
"Bonito departamento interior, cuenta con buena iluminación Y pisos de cerámica. estancia. cocina con parrilla de cuatro quemadores, barra desayunadora Y un refrigerador. dos recamaras con closet abiertos. un baño. area de lavado integrada. Vigilancia. en caso de requerir estacionamiento tiene costo adicional. ubicación: escuelas cercanas, iglesias, hospitales, metro (estacion misterios), metrobus, parques. Bancos, plazas Y tiendas comerciales, etc. . Máximo 4 personas. no se aceptan mascotas",https://www.inmuebles24.com/propiedades/clasificado/alclapin-juventino-rosas-23-col.-peralvillo-alcaldia-cuauhtemoc-59113173.html,"MN 9,000","JUVENTINO ROSAS
Peralvillo, Cuauhtémoc","50 m² lote, 2 rec., 1 baño",Santa María Insurgentes
"Departamento pequeño ideal para familia chica. Se admiten mascotas. Sala Comedor, 2 Recamaras pequeñas, Baño, Cocina y Area de Lavado y tendido. No tiene estacionamiento. En Planta Baja, Edificio antiguo de 3 niveles. Muy bien ubicado sobre eje central entre juventino rosas y chopin en peralvillo, Cuauhtemoc. Contrato anual. No se requiere aval. Se pide fianza costo aprox $4, 500. 00",https://www.inmuebles24.com/propiedades/clasificado/alclappa-renta-departamento-muy-bien-ubicado-147443023.html,"MN 5,000","Eje Central 63
Peralvillo, Cuauhtémoc","51 m² lote, 2 rec., 1 baño",Santa María Insurgentes
