Título,Enlace,Precio,Dirección,Características,Colonia de Origen
"Hermoso departamento en venta con excelente ubicacion E iluminacion. A unos minutos de fes iztacala Y centros comerciales como encuentro tlanepantla, centro comercial centura. Este departamento cuenta con sala/comedor, una cocina integral, dos recamaras con closet, un baño completo, zotehuela, un cajon de estacionamiento, ubicado en un tercer piso, excelente para adecuar tu espacio de descanso A tu gusto, además de contar con seguridad. Para conocerlo Y tener una atención rápida Y directa envía whatsapp:: 55:: 12:: 95:: 34:: 12. Favor de no llamar, toda la atencion sera via whatsapp",https://www.inmuebles24.com/propiedades/clasificado/alclapin-departamento-en-venta-calzada-vallejo-147423910.html,"MN 1,670,000","Calzada Vallejo 1268
Santa Rosa, Gustavo A. Madero","47 m² lote, 2 rec., 1 baño, 1 estac.",Santa Rosa
"Renta Departamento en Joyas Vallejo, Col. Santa Rosa, cdmx 9, 000 c/mtto incluido, no mascotas. 2 recámaras. Sala comedor corrido. Cocina integral. Área de lavado. 1 baño completo. 2do nivel. Caseta de vigilancia. Vigilancia las 24hrs. Cerca del metrobus Tenayuca, Supermercado, Bancos y Vialidades Mario Colin, Calz. Vallejo 100 metros. *Requisitos: * 1 mes de depósito. 1 mes de renta. •apartado de 3, 650 (nota: que se reembolsa al firmar el contrato) •Llenar formato de arrendamiento. •Pago anual 3. , 150 de *protección jurídica* (incluye evaluación de riesgo, contrato, y pagarés) más 500 de gastos de contración. •Comprobante de ingresos (3 meses) •Identificación. •Y una garantía: - obligado solidario que compruebe ingresos, identificación y comprobante de domicilio. Se firma contrato y pagares x 1 año",https://www.inmuebles24.com/propiedades/clasificado/alclapin-renta-depto-en-joyas-vallejo-col.-santa-rosa-gam-145332159.html,"MN 9,000","Calz Vallejo 1268, Col. Santa Rosa, Alcaldía Gustavo A. madero
Santa Rosa, Gustavo A. Madero","60 m² lote, 2 rec., 1 baño",Santa Rosa
Se renta bonito departamento ubicado cerca de la estacion tenayuca del metrobus (linea 3) el departamento consta de: dos recamaras. espacio para sala Y comedor. cocina sin estufa. zotehuela. boiler. gas estacionario. vigilancia,https://www.inmuebles24.com/propiedades/clasificado/alclappa-se-renta-bonito-departamento-147145395.html,"MN 7,500","Calzada Vallejo 1268 Edificio ""D 1"" departamento 101
Santa Rosa, Gustavo A. Madero","60 m² lote, 2 rec., 1 baño",Santa Rosa
