Título,Enlace,Precio,Dirección,Características,Colonia de Origen
"Descubre este elegante y moderno departamento de 245 m² ubicado en el quinto piso de un edificio reciente Ver datos en la colonia Parque del Pedregal, a tan solo unos minutos de Perisur. Con una distribución ideal para quienes valoran el espacio y la luz, la propiedad cuenta con ventanales amplios que enmarcan una vista arbolada hacia el parque, lo que brinda una sensación de calma y conexión con la naturaleza. Tiene 3 recámaras, todas con vestidor y baño propio, family room, sala y comedor con acceso a dos balcones privados, una cocina integral equipada con servicios integrados, medio baño de visitas, cuarto de servicio, y 4 lugares de estacionamiento techado. El edificio ofrece elevador, vigilancia 24 horas, y un salón de usos múltiples con baños para tus reuniones o eventos.",https://www.inmuebles24.com/propiedades/clasificado/alclapin-exclusivo-departamento-con-vista-al-parque-en-parque-147230598.html,"MN 55,000","Alborada
Parque del Pedregal, Tlalpan","245 m² lote, 3 rec., 3 baños, 4 estac.",Tlalpan
"Excelente departamento en 1er. Piso, sin elevador, con buena iluminación cuenta con cocina integral con área de lavado anexa, dos recámaras la principal con baño completo y área de clóset abierta, la segunda recámara con área de clóset abierta. Aparte otro baño completo en área social. 1 estacionamiento en batería (hay que ponerse de acuerdo con otro vecino) Cuota de mantenimiento de 1, 200 (incluida en la renta) Se entrega sin persianas. No se aceptan mascotas. Características generales. Pisos de loseta cerámica, ventanas con marco de aluminio, muros y techos terminados en aplanado. Cisterna. Gas Natural. Cuenta con vigilancia y cctv. Estacionamiento para visitas. Amenidades. Salón de usos múltiples. Entorno urbano. Escuelas cercanas, Tec de Monterrey y plazas comerciales. Transporte público accesible",https://www.inmuebles24.com/propiedades/clasificado/alclapin-departamento-en-renta-en-primer-piso-col.-valle-147206912.html,"MN 16,000","Arenal 581
Valle Escondido, Tlalpan","70 m² lote, 2 rec., 2 baños, 1 estac.",Tlalpan
"Vive en un penthouse que combina amplitud, lujo clásico y panorámicas espectaculares. Este ph de 500 m² ofrece sala y comedor, bar con medio baño, terraza con vistas hacia Reforma y volcanes, cocina con antecomedor y múltiples espacios para convivir. En el nivel inferior, cuatro recámaras exquisitamente diseñadas: dos comparten baño, una con baño propio y la principal con sala privada, walk-in clóset y baño completo. Con acabados de madera y cristal finos, pisos de parquet y baños elegantes, cada rincón refleja calidad y sofisticación. Disfruta de cuatro estacionamientos y amenidades exclusivas: alberca, gimnasio, salón de usos múltiples, asador y jardín.",https://www.inmuebles24.com/propiedades/clasificado/alclapin-elegancia-y-vistas-de-ensueno-en-jardines-en-la-147282001.html,"MN 130,000","Pico de Peñalara
Jardines en la Montaña, Tlalpan","500 m² lote, 4 rec., 3 baños, 4 estac.",Tlalpan
"Bonito departamento en renta sin amueblar en residencial insurgentes sur (ris1), remodelado hace 3 años, con muy buena iluminación natural, con vista A las áreas verdes Y una excelente ubicación junto A la uic (universidad intercontinental) Y A 100 mts. Del metrobus ""la joya"" sobre insurgentes sur, centros comerciales Y más. La distribución se compone de 2 recamaras con opción A una tercer recamara. Ambas cuentan con closet. Sala. comedor. cocina integral. un baño. un estacionamiento libre asignado. cuarto de servicio. jaula de tendido. vigilancia 24/7. se ubica en el 4o. Piso, no hay elevador. en el exterior se cuenta con jardines Y área de juegos infantiles. Se aceptan mascotas, roomies Y familia. Precio de renta: 12, 800 pesos mexicanos. incluye el pago de mantenimiento. requisitos: 1 mes de renta corriente. 1 mes de depósito en garantía. fiador con bienes raíces dentro de la ciudad de méxico O un obligado solidario. póliza jurídica. citas: viernes Y sabado con previa cita de 24 hrs.",https://www.inmuebles24.com/propiedades/clasificado/alclapin-departamento-en-renta-75-m-sup2--2-recamaras-1-147416783.html,"MN 12,800","Avenida Insurgentes Sur 4411
Tlalpan, Ciudad de México","75 m² lote, 2 rec., 1 baño, 1 estac.",Tlalpan
Elevador portón eléctrico a control remoto 2 recamaras la principal de buen tamaño con su vestidor y baño completo integrados y la segunda con su amplio clóset el segundo baño completo también con su amplia estancia sala comedor con cocina integral totalmente equipada muy tranquilo y mucha luz natural con jaula de tendido en la zona zotea con arena cuenta con cuarto de servicio exclusivo muy amplio con instalación para su lavadora cuanta con elevador y con portón eléctrico a control remoto con cctv y con roof garden para eventos o reuniones excelente zona del sur,https://www.inmuebles24.com/propiedades/clasificado/alclapin-rento-departamento-amplio-con-excelente-ubicacion-147402523.html,"MN 15,000","Avenida Cafetales
Granjas Coapa, Tlalpan","98 m² lote, 2 rec., 2 baños, 1 estac.",Tlalpan
