Título,Enlace,Precio,Dirección,Características,Colonia de Origen
"Departamento de 3 recamaras en be grand coapa, 116M2, con bodega de 5M2, 2 baños completos, balcon, 2 lugares de estacionamiento, amenidades de primer nivel (alberca, chapoteadero, jacuzzi, regaderas, gimnasio, cafeteria, ludoteca, 4 salones de usos multiples, 3 salas de negocio, paqueteria, estacionamiento para visitas, juegos infantiles al aire libre) la renta incluye mantenimiento. se aceptan mascotas. celular Ver datos. precio venta: $5, 800, 000",https://www.inmuebles24.com/propiedades/clasificado/alclapin-venta-de-departamento-3-recamaras-be-grand-coapa-116-59517639.html,"MN 27,000","CALZADA DEL HUESO 859
Granjas Coapa, Tlalpan","116 m² lote, 3 rec., 2 baños, 2 estac.",Tlalpan
"Increíble departamento completamente nuevo en renta al sur de la ciudad, cerca de six flags. -2 recamaras con closets de piso A techo. -2 baños completos. -sala comedor. -cocina integral con barra de granito. - área de lavado. - balcón. - 1 lugar para un auto. - calentador de paso. - vigilancia. mantenimiento incluido.",https://www.inmuebles24.com/propiedades/clasificado/alclapin-increible-depto-completamente-nuevo-en-renta.-146085608.html,"MN 17,500","SINANCHE
Héroes de Padierna, Tlalpan","80 m² lote, 2 rec., 2 baños, 1 estac.",Tlalpan
"Mirador 46, Fuentes de Tepepan. Tlalpan. Amplio e iluminado departamento de 110m2. Ubicado a 15 min del Tec de Monterrey y a 15 min de zona de hospitales. Cuenta con 2 recamaras, (opción a tercer recamara) la principal con vestidor y baño completo con cancel de cristal templado, segunda recámara muy amplia con clóset y excelente iluminación. Balcón de 6 m2. Espacio de cuarto de tv, estudio u opción a tercer recámara. Dos baños completos. Sala comedor. Cocina integral de concepto cerrado con barra desayunador. Cuarto de lavando independiente con ventilación natural. 2 lugares de estacionamiento fijos e independientes de muy buen tamaño. Bodega. Gas estacionario. Cisterna. 9 años de antigüedad. Piso 1 sin elevador. $17, 000. 00 mantenimiento incluido. Requisitos: -Mes de renta. -Mes de depósito. -Póliza juridica. ¡Aprovecha el excelente precio y disfrútalo! ¡Contáctanos! Ofi. (55) Ver datos. Cel. (55) Ver datos. Correo. Ver datos. Facebook e Instagram @vbienesraices. Al ""Contactar"" para consultar esta propiedad, estás aceptando los ""Términos y Condiciones"" y ""Aviso de privacidad"". Los precios publicados y la disponibilidad pueden cambiar sin previo aviso por lo que se debe de verificar con la inmobiliaria y los propietarios de los inmuebles. Todas las medidas enunciadas son meramente orientativas, las medidas exactas serán las que se expresen en el respectivo título de propiedad de cada inmueble.",https://www.inmuebles24.com/propiedades/clasificado/alclapin-departamento-en-renta-fuentes-de-tepepan-tlalpan.-147284367.html,"MN 17,000","Mirador 46
Fuentes de Tepepan, Tlalpan","110 m² lote, 2 rec., 2 baños, 2 estac.",Tlalpan
"Departamento en renta con amplio espacios, y lo mejor de todo el sinfín de amenidades y recursos dentro de un desarrollo de lujo. Gana esta oportunidad de vivir al sur de la Ciudad en este inmueble con seguridad 24 hrs y las mejores amenidades como canchas de fútbol, albercas, gimnasio entre otras.",https://www.inmuebles24.com/propiedades/clasificado/alclapin-departamento-en-renta-fuentes-de-tepepan-90599291.html,"MN 21,000","Bosques de tepepan
Fuentes de Tepepan, Tlalpan","112 m² lote, 3 rec., 2 baños, 2 estac.",Tlalpan
"Si lo que buscas en vivir en un lugar privilegiado dentro de la ciudad, rodeado de árboles con seguridad y un ambiente de tranquilidad como si estuvieras en un lugar de descanso, este departamento es tu opción. El departamento cuenta con 170 mt de superficie, consta de 2 amplias recámaras, ambas con closet y baño integrado, sala comedor, cocina integral, desayunador, baño de visitas, espacio para poder realizar home office o lo que tú decidas, área de lavado, 2 lugares de estacionamiento, uno de ellos techado, cuarto de servicio con baño, zotehuela en donde se encuentran los lavaderos y boilers y una preciosa terraza a todo lo largo del departamento con vista al campo de Golf. Tanto la sala comedor como las recámaras tienen salida a la terraza. Dentro de las amenidades cuenta con precioso jardín con asador, amplia terraza común y un salón para reuniones familiares o con los amigos con barra de bar, tarja, una parrilla y baño completo. Sólo 3 departamentos en el inmueble. Este departamento tiene salida directa al jardín. Vigilancia 24/7. Cuota de mantenimiento: $3, 300 (no inlcuída en la renta)",https://www.inmuebles24.com/propiedades/clasificado/alclapin-renta-departamento-club-de-golf-mexico-tlalpan-146384197.html,"MN 27,000","Av. San Buenaventura 616
Club de Golf México, Tlalpan","179 m² lote, 2 rec., 2 baños, 2 estac.",Tlalpan
"Dos extraordinario departamentos llenos de luz, vista exterior uno con balcón el otro con terraza para disfrutar! contactar por wattsappdepatamento No. 1cobalto No, Ver datosmts2 habitables, 20mts2 de terraza balcón, recámara principal con vestidor Y baño, recamaras secundaria con baño integrado Y vestidor, sala comedor, diseño de bar, cocina abierta con excelente capacidad de almacenaje, medio baño de visitas, área de lavado y cuarto de servicio con baño integrados al departamento, 3 cajones de estacionamiento, bodega, 2 elevadores. renta: $52, 000. 00 mantenimiento incluidobalcón terrazadepatamento No. 2cobalto No. 70190mts2 habitables, 5mts2 de terraza, recámara principal con vestidor Y baño, 2 recamaras secundarias con con closet, baño completo que compaten recámaras secundarias, sala comedor, cocina abierta con excelente capacidad de almacenaje, medio baño de visitas, área de lavado y cuarto de servicio con baño integrados al departamento, 2 cajones de estacionamiento, 2 elevadores. renta: $54, 000. 00 mas mantenimientoterrazaacabados de lujo, pisos madera ingeniería en Tzalam, mármol, techos con 2. 70 de altura, grandes ventanales. El edificio cuenta: Lobby, control de acceso, salón de fiestas, gym, área de asador. Fraccionamiento con extrema vigilancia, calles de concreto, gas natural, cables ocultos, magnífico parque de 6000mts2 aproximados divididos en 3 terrazas, juegos infantiles, espejo de agua con lirios y peces. El departamento se encuentra dentro del mejor fraccionamiento al sur de la ciudad &quot;único en su tipo&quot; A 5 Minutos del hospital Ángeles del Pedregal, 6 minutos del Plaza artz. Rodeado de todos los servicios y los mejores colegios de la zona. &quot;estilo de vida, seguridad, tranquilidad, ubicación&quot;____________________________________________________________________________________________________________________Todas las imágenes mostradas en este anuncio son para fines ilustrativos, el departamento no se renta amueblado. Es importante hacer una visita al inmueble para conocer características y/o acabados. requisitos* 1 Mes de depósito* 1 Mes de renta* Fiador con bien raíz libre de gravamen en cdmx* Firma de Póliza Jurídica de Arrendamiento e Investigación* (Probables requisitos extras) dependiendo del perfil del cliente, condiciones del propietario, propuesta de renta, tiempo y tipo de arrendamiento con o sin muebles*Rentas inmuebles comerciales precio de renta mas iva* Contrato mínimo por 1 año.",https://www.inmuebles24.com/propiedades/clasificado/alclapin-juntate-con-los-expertos-renta-departamento-lomas-del-147155958.html,"MN 52,000","Lomas del Pedregal, Tlalpan, Ciudad de México
Lomas del Pedregal, Tlalpan","175 m² lote, 2 rec., 3 baños, 3 estac.",Tlalpan
"Ubicado en el Tercer Piso, lo cual da total privacidad y cero ruido de vecinos superiores. Cuenta con 2 Recamaras, 2 Baños Completos, 2 Estacionamientos, Amenidades Amplias, parcialmente amueblada y mantenimiento incluido. 2 recámaras. 2 baños completos. 2 estacionamientos. Terraza privada. Último piso. Mantenimiento incluido. No se aceptan mascotas o se acepta con poliza ampliada. Amenidades del conjunto: Alberca (Pueden tomar clases los niños) Gimnasio (Amplio y bien distribuido con equipos Life Fitness) Juegos infantiles (Uno cerrado y 2 Abiertos) Salones de fiestas (3 uno Grande para arriba de 100 personas) Cafetería (1 Llevan la comida al departamento) Paqueteria y Tintorería. Excelente ubicación en zona tranquila y con fácil acceso.",https://www.inmuebles24.com/propiedades/clasificado/alclapin-renta-departamento-bg-coapa-con-bodega-y-amueblado-147440485.html,"MN 27,000","Calzada del Hueso , granjas Coapa, be grand
Granjas Coapa, Tlalpan","92 m² lote, 2 rec., 2 baños, 2 estac.",Tlalpan
"Solo 2 deptos, cerca de picacho ajusco. Amplia estancia comedor, cocina integral equipada, 2 recamaras, la rec. Principal con baño Y closet, segunda recámara con closet, primer piso, pequeña área de lavado, gas independiente. Acabados nuevos. Sin estacionamiento. Gánelo! Citas whats Ver datos",https://www.inmuebles24.com/propiedades/clasificado/alclapin-estrene-depto!-147397523.html,"MN 10,600","Temascalillo
Cruz del Farol, Tlalpan","60 m² lote, 2 rec., 2 baños",Tlalpan
"Se rentan lindas y funcionales oficinas dentro de Plaza Imágen, en Jardines en la Montaña. Son 150mt2 y cuenta con 7 privados, sala de juntas, cocineta, 2 baños, 3 lugares de estacionamiento. Por encontrarse dentro de la plaza comercial, tienes lugares de estacionamiento para visitas, cafeterías y diversos comercios. Vigilancia y cctv. Cerca de bancos, Hotel Royal del Pedregal, vías de acceso como Periférico Sur, Insurgentes Sur. Renta: 41, 500 m. n. Mas iva (factura) mantenimiento: 4, 000 m. n. Mas iva. Gracias a nuestra experiencia y nuestro servicio personalizado te garantizamos: - Nos ocupamos de todo el proceso de principio a fin, desde la negociación hasta la entrega de la propiedad. Al ""Contactar"" para consultar esta propiedad, estás aceptando los ""Términos y Condiciones"" y ""Aviso de privacidad"". Los precios publicados y la disponibilidad pueden cambiar sin previo aviso por lo que se debe de verificar con la inmobiliaria y los propietarios de los inmuebles. Todas las medidas enunciadas son meramente orientativas, las medidas exactas serán las que se expresen en el respectivo título de propiedad de cada inmueble. La publicación de la presente información no representa una oferta pública por lo que toda transacción debe hacerse de forma personal de acuerdo con las prácticas comerciales de la inmobiliaria y para poder ser valida requiere de la autorización expresa de los propietarios de los inmuebles. No esperes más y déjanos ayudarte. ¡contáctanos!",https://www.inmuebles24.com/propiedades/clasificado/alclapin-renta-oficina-en-jardines-en-la-montana-tlalpan-147205833.html,"MN 41,500","Jardines en la Montaña
Tlalpan, Ciudad de México","150 m² lote, 1 rec., 2 baños, 3 estac.",Tlalpan
"Si disfrutas de vivir de forma tranquila y rodeado de naturaleza, esta propiedad es para ti. Se encuentra en planta baja en un conjunto de solo 2 departamentos y 2 casas, dentro de una calle cerrada con vigilancia, lo que te proporcionara tranquilidad y seguridad. La zona es boscosa por lo que te sentiras en tu propia cabaña en el bosque. El departamento cuenta con 2 recamaras, un baño completo, estancia sala comedor y pequeña cocineta con barra de trabajo, asi como espacio para un lugar de estacionamiento. No esperes mas para visitarlo, llama ahora para agendar tu cita: 55 Ver datos. requisitos: Un mes de renta, un mes de deposito, fiador con bien inmueble libre de gravamen y poliza juridica compartiendo costo con propietario. Mantenimiento incluido. En cumplimiento a la nom247, se informa a nuestros clientes que las medidas son enunciativas y deben de corroborarse con los documentos de propiedad respectivos. Asimismo, los precios publicados y su disponibilidad pueden variar sin previo aviso por lo que se deben verificar con la inmobiliaria. De igual forma, la póliza jurídica, gastos de investigación, así como el mobiliario y demás enseres que se muestran en las fotografías no está incluido en el precio de renta.",https://www.inmuebles24.com/propiedades/clasificado/alclapin-lindo-departamento-en-pb-en-renta-en-san-andres-147297349.html,"MN 10,500","1a. Cerrada del Cedral 4
San Andrés Totoltepec, Tlalpan","80 m² lote, 2 rec., 1 baño, 1 estac.",Tlalpan
"Vivienda en Col. Popular Santa Teresa. Ideal para 1-2 personas. 2 cuartos con buena iluminación, zotehuela y baño independientes. Zona tranquila y segura ubicada a 10 minutos del Periférico Sur. Cercano: transporte público, mercado, escuelas y Walmart. Restricciones: no niños, no mascotas. Renta de 4, 500. 00 mensuales mas 400 de agua y luz. Agenda tu cita para visita por WhatsApp al 55 Ver datos con Mayra.",https://www.inmuebles24.com/propiedades/clasificado/alclapin-solo-mujeres-vivienda-en-renta-de-2-cuartos-en-col.-144843340.html,"MN 4,500","Becal, Col. Popular Santa Teresa, C.P. 14160, cdmx
Popular Santa Teresa, Tlalpan","30 m² lote, 2 rec., 1 baño",Tlalpan
"286 m2 en 2 niveles, 3 recámaras cada una con baño, vestidor en la principal, 2 terrazas, sala y comedor, sala de tv, desayunador con espacio para family room, cocina, cuarto de servicio y cuarto de lavandería, 4 autos, closets de guardado en garage, Edificio de 5 niveles, 20 departamentos, doble seguridad, fraccionamiento con parques privados, renta más mantenimiento Gentry Real Estate es una Agencia Inmobiliaria conformada por Personal altamente profesional; quienes se capacitan constantemente con el objetivo de estar dispuestos a enfrentar los cambios que el sector inmobiliario lanza día con día, con ello, procuran y salvaguardan que los clientes tomen la mejor decisión en todas sus operaciones.",https://www.inmuebles24.com/propiedades/clasificado/alclapin-departamento-en-renta-jardines-en-la-montana-ph-143822739.html,"MN 75,000","Jardines en la Montaña, PH en Renta o Venta
Jardines en la Montaña, Tlalpan","286 m² lote, 3 rec., 3 baños, 4 estac.",Tlalpan
"Este departamento en renta se ubica en la tranquila zona de Arenal Tepepan. El interior cuenta con sala, comedor, balcon, cocina integral area de servicio para conexion de lavadora, 3 recámaras con clósets y 2 baños completos. Además, dispone de cuarto de servicio. En el exterior, 2 lugares de estacionamiento asi como de visitas. El edificio ofrece caseta de guardia y seguridad privada. Arenal Tepepan es una zona residencial tranquila, ideal para familias. Cuenta con escuelas cercanas y fácil acceso a servicios básicos como agua y luz. El área ofrece una mezcla de tranquilidad y conveniencia, con acceso a transporte público y vialidades importantes. Encontrarás supermercados, tiendas de conveniencia y farmacias a poca distancia. La zona se percibe como segura, con servicios de vigilancia que contribuyen a un ambiente familiar y apacible.",https://www.inmuebles24.com/propiedades/clasificado/alclapin-departamento-de-3-recamaras-en-renta-arenal-tepepan-147293689.html,"MN 18,000","Arenal 694
Arenal Tepepan, Tlalpan","110 m² lote, 3 rec., 2 baños, 2 estac.",Tlalpan
"Amplio departamento recién remodelado, mto incluido con acabados de lujo y 3 estacionamientos, alberca techada, salón de eventos y seguridad 24/7 horas.",https://www.inmuebles24.com/propiedades/clasificado/alclappa-amplio-deprtamento-en-fuentes-del-pedregal.-147415086.html,"MN 43,000","Circuito Fuentes del Pedregal 478
Fuentes del Pedregal, Tlalpan","222 m² lote, 3 rec., 3 baños, 3 estac.",Tlalpan
"¡Estrena tu nueva suite en Tlalpan! Descubre la comodidad y funcionalidad de nuestras suites en renta, diseñadas para brindarte un espacio acogedor y funcional. Contamos con 5 tipos de suites, con superficies de 25 a 34 m², cada una equipada con: Amplia recámara con baño privado. Cocineta equipada con refrigerador y microondas. Área para estar con iluminación natural. Clóset y espacios de almacenamiento. Completamente amueblada. Ubicadas en Tlalpan, cerca del área de hospitales, son la opción ideal para profesionales, estudiantes o quienes buscan un lugar cómodo, práctico y bien ubicado. ¡Agenda tu cita y conócelas hoy mismo!",https://www.inmuebles24.com/propiedades/clasificado/alclapin-amplias-suites-amuebladas-y-equipadas-145807397.html,"MN 14,000","CALZADA DE TLALPAN
La Joya, Tlalpan","32 m² lote, 1 rec., 1 baño",Tlalpan
"Departamento en Renta – ¡Último Piso con Terraza y Vista! Vive con comodidad y estilo en este hermoso departamento en excelente estado de conservación, ubicado en el último piso, con bonita vista, gran iluminación natural y ventilación cruzada. 2 recámaras. 2 baños completos. 2 estacionamientos. Terraza privada. Último piso. Mantenimiento incluido. No se aceptan mascotas. Amenidades del conjunto: Alberca. Gimnasio. Juegos infantiles. Salones de fiestas. Cafetería. Excelente ubicación en zona tranquila y con fácil acceso. Requisitos: • 1 mes de renta. • 1 mes de depósito. • Aval con propiedad en cdmx u obligado solidario. • Pago total de póliza jurídica",https://www.inmuebles24.com/propiedades/clasificado/alclapin-renta-departamento-be-grand-coapa-147068545.html,"MN 26,500","Calzada del Hueso 921
Granjas Coapa, Tlalpan","92 m² lote, 2 rec., 2 baños, 2 estac.",Tlalpan
"- Departamento en venta o renta en Bosques de Tepepan, Tlalpan. - 195 m2. - 3 habitaciones. - 2. 5 baños. - 2 estacionamientos. - Roof Garden privado. - Piso 7. - Elevador. - Mantenimiento incluido. - Se aceptan mascotas. amenidades: - 2 hectáreas de áreas verdes y deportivas. - Pista de tartán. - Canchas de fút y de front tennis. - Alberca techada y climatizada de dos carriles. - Alberca exterior con terraza común. - Gimnasio súper equipado. - Seguridad 24/7. - Juegos infantiles. - Área para perritos. - Ludoteca. - Salón de eventos con terraza para 250 personas. requisitos para renta: - Póliza de arrendamiento a cargo del inquilino. - Investigación de solvencia económica del inquilino y el obligado solidario con costo de 1, 199 ya incluido en el costo de la póliza. - Un mes de depósito en garantía a la firma del contrato. - Un mes de renta a la firma del contrato",https://www.inmuebles24.com/propiedades/clasificado/veclapin-departamento-en-venta-o-renta-195-m-sup2--3-147351833.html,"MN 32,000","Mirador 18
Fuentes de Tepepan, Tlalpan","195 m² lote, 3 rec., 2 baños, 2 estac.",Tlalpan
"Buscas una ubicación privilegiada en colonia tranquila?. Cerca de zona de Hospitales a unos minutos de perisur, vive la experiencia de vivir en casa sola con dos departamentos. El departamento recién remodelado con pisos de cerámica en colores neutros que hacen un acogedor hogar, techos altos, excelente iluminación y ventilación! Con 81 metros dividido en dos plantas, en planta baja encontrarás cocina integral con barra de preparación de alimentos y amplia alacena en madera, medio baño para visitas y área de sala comedor, en segunda planta goza de grandes espacios. Recámara con clóset en madera y baño completo, salón de tv que bien puede ser tu estudio o porque no?. Una segunda recámara. La casa cuenta con 1 lugar de estacionamiento independiente para cada departamento y cisterna. Ideal para solteros que trabajen home office, pareja o familia pequeña que busquen espacios amplios y tranquilidad. Que esperas para conocerlo?. Visítanos! Requisitos. Depósito de renta. Renta corriente. Póliza jurídica. Info Wats app",https://www.inmuebles24.com/propiedades/clasificado/alclapin-departamento-remodelado-a-5-minutos-de-perisur!-146764060.html,"MN 14,400","saturno esq neptuno
Comuneros de Santa Úrsula, Tlalpan","80 m² lote, 1 rec., 1 baño, 1 estac.",Tlalpan
"Lindo departamento en renta en primer piso, exterior, portón eléctrico, Roof garden en azotea con asador. El departamento cuenta con 2 habitaciones con clósets, la principal con baño integrado, cocina integral concepto abierto, área de lavado con instalaciones para centro de lavado, un lugar de estacionamiento fijo. Nota: No se aceptan mascotas",https://www.inmuebles24.com/propiedades/clasificado/alclapin-departamento-en-renta-en-primer-piso-147368390.html,"MN 11,000","Chapab 49
Cuchilla de Padierna, Tlalpan","85 m² lote, 2 rec., 2 baños, 1 estac.",Tlalpan
"Amplio departamento bien iluminado de 85 m2, cuenta con acceso automatizado en privada, cuenta con dos recámaras, 2 closets amplios, dos baños completos, sala comedor, cocina con cubierta de granito, cuarto de servicio, circuito cerrado y un lugar de estacionamiento techado. Incluye cuota de mantenimiento. Hermosa vista de la ciudad con Roof garden!! A diez minutos de periférico!! Cerca de zona de Hospitales. no se aceptan mascotas",https://www.inmuebles24.com/propiedades/clasificado/alclapin-renta-de-departamento-en-san-pedro-martir-tlalpan-61829422.html,"MN 12,000","San Pedro Mártir
San Pedro Mártir, Tlalpan","85 m² lote, 2 rec., 2 baños, 1 estac.",Tlalpan
"Departamento en renta en Tlalpan, con balcones y vista a la ciudad. Amplio y muy iluminado departamento exterior de 120 m², ubicado en calle Chabacanos #4, Colonia Paraje 38, Alcaldía Tlalpan, en segundo piso. Características principales: 3 recámaras, la principal con baño completo; 2 de ellas con balcón y vista a la ciudad. Estancia amplia y luminosa con balcón exterior. 2 baños completos en total. Cocina integral muy amplia. Cuarto de lavado grande dentro del departamento. Estacionamiento independiente con portón eléctrico. Su ubicación ofrece excelente conectividad con vías principales como Periférico Sur, Viaducto Tlalpan y Carretera Federal a Cuernavaca. Muy cerca de Six Flags México, la zona de hospitales y centros comerciales. Ideal para quienes buscan amplitud, comodidad, luz natural y una ubicación estratégica en el sur de la cdmx.",https://www.inmuebles24.com/propiedades/clasificado/alclapin-renta-de-amplio-depa-iluminado-en-tlalpan-con-balcon-y-147427923.html,"MN 11,550","Chabacanos 4
Paraje 38, Tlalpan","120 m² lote, 3 rec., 2 baños, 1 estac.",Tlalpan
"Bonito departamento en renta, a 5 minutos de Paseo Acoxpa, todos los servicios, acceso con tarjeton, vigilancia las 24 horas. Acceso a vias principales: Division del Norte, Acoxpa, Viaducto Tlalpan. * Una renta como anticipo. * Renta a correr. * Aval con bien inmueble en garantia",https://www.inmuebles24.com/propiedades/clasificado/alclapin-departamento-en-renta-147447072.html,"MN 15,000","Hacienda de Santa Ana Y Lobos 60
Prado Coapa, Tlalpan","60 m² lote, 2 rec., 1 baño, 1 estac.",Tlalpan
Iluminado Y amplio departamento en renta. cuenta con: 100 M2. 2 recamaras. 2 baños completos. sala. comedor. cocina integral. area de lavado. amplios closets. 1 cajon de estacionamiento (no es fijo) elevador. vigilancia 24/7. salon de usos multiples. mantenimiento incluido. *requisitos* renta. deposito. pago de una poliza juridica,https://www.inmuebles24.com/propiedades/clasificado/alclapin-departamento-en-renta-en-viaducto-tlalpan-144869877.html,"MN 16,500","VIADUCTO TLALPAN
La Joya, Tlalpan","100 m² lote, 2 rec., 2 baños, 1 estac.",Tlalpan
"Excelente departamento en condominio amplio Y con mucha iluminación, cuenta con estancia-comedor con pisos de porcelanato, espacio para estudio O area de tv con balcón, moderna cocina integral con barra Y cubierta de granito, 2 recámaras con closets la principal con baño completo Y cancel, otro baño completo con cancel en pasillo, area de lavado integrado al departamento, con bodega, se entrega con persianas, 2 estacionamientos con autoelevador, portero eléctrico para acceso al estacionamiento, salón de usos multiples con cocineta Y baños, estricta vigilancia en caseta de ingreso. Magnifica ubicación principales vialidades A 2 minutos de carretera picacho-ajusco, periferico sur, boulevard de la luz, muy cerca de san jerónimo, luis cabrera, six flags, hospital angeles del pedregal, centros comerciales artz, perisur Y plaza san jerónimo, gasolineria, bancos, iglesia, supermercados, perfecto estado de conservación Y de funcionalidad. Se requiere el pago de 1 mes de renta de depósito, 1 mes de ocupación Y mantenimiento, contrato anual, aval, pago de 4, 400 póliza jurídica E investigación, renta $17, 200. 00 mas $1, 300. 00 de mantenimiento, interesados concertar citas",https://www.inmuebles24.com/propiedades/clasificado/alclapin-excelente-departamento-en-lomas-de-padierna-62195977.html,"MN 17,200","Akil 218
Lomas de Padierna, Tlalpan","2000 m² lote, 2 rec., 2 baños, 2 estac.",Tlalpan
"Fraccionamiento cerrado Jardines en la Montaña – Estricta Seguridad 24 hrs. – Impecable - Acabados de Lujo - Renta $50, 000. Más $6, 500. De Cuota de Mantenimiento - Departamento Moderno Semi-amueblado de 300 m² - no mascotas - Hermosa vista al Bosque de Tlalpan – 2 niveles - doble altura - 3 recámaras cada una con baño-vestidor (la principal con enorme vestidor y jacuzzi), sala comedor, cocina integral equipada con espacio para antecomedor, alacena, sala de T. V. , área de lavado, cuarto de servicio, estacionamiento para 3 automóviles fijos, bodega, Jardín de área común. Amplios espacios, iluminación natural, grandes ventanales, Interfón. Extraordinaria ubicación, cerca de Centros Comerciales, Servicios (tiendas Departamentales, Farmacias, Bancos, Restaurantes, etc. ), fácil acceso a principales vías de comunicación. Citas Ver datos",https://www.inmuebles24.com/propiedades/clasificado/alclapin-jardines-montana-moderno-300-m-sup2--$50-000.-mas-147200854.html,"MN 50,000","CAMINO SANTA TERESA
Jardines en la Montaña, Tlalpan","300 m² lote, 3 rec., 4 baños, 3 estac.",Tlalpan
